id,type,attributes.date_created,attributes.date_modified,attributes.date_published,attributes.original_publication_date,attributes.doi,attributes.title,attributes.description,attributes.is_published,attributes.is_preprint_orphan,attributes.tags,attributes.preprint_doi_created,attributes.date_withdrawn,attributes.current_user_permissions,attributes.public,attributes.reviews_state,attributes.date_last_transitioned,attributes.has_coi,attributes.conflict_of_interest_statement,attributes.has_data_links,attributes.why_no_data,attributes.data_links,attributes.has_prereg_links,attributes.why_no_prereg,attributes.prereg_links,attributes.prereg_link_info,attributes.subjects,attributes.license_record.copyright_holders,attributes.license_record.year,relationships.contributors.links.related.href,relationships.bibliographic_contributors.links.related.href,relationships.citation.links.related.href,relationships.citation.data.id,relationships.citation.data.type,relationships.identifiers.links.related.href,relationships.node.links.self.href,relationships.node.links.related.href,relationships.node.data.id,relationships.node.data.type,relationships.license.links.related.href,relationships.license.data.id,relationships.license.data.type,relationships.provider.links.related.href,relationships.provider.data.id,relationships.provider.data.type,relationships.files.links.related.href,relationships.primary_file.links.related.href,relationships.primary_file.data.id,relationships.primary_file.data.type,relationships.review_actions.links.related.href,relationships.requests.links.related.href,links.self,links.html,links.preprint_doi,links.doi
pj63e,preprints,2020-12-28T08:56:07.732738,2020-12-30T22:08:41.908990,2020-12-30T22:06:38.571337,2019-11-30T22:00:00,NA,Implications of CJEU Jurisprudence on the Delimitation of Working Time by Rest Time in the Collaborative Economy,"The specificity of the collaborative economy has raised a number of issues with regard to the qualification of legal relationships between workers, final beneficiaries and the online platform that mediates the provision of work, respectively whether between the platform and the worker there is an employment relationship or there is a commercial relationship between the platform, self-employees and consumers. In particular, the question arises whether, in the case of these workers, the working time regulations apply and, if so, how they can be applied in concrete manner. The article contains an analysis on how some principles derived from the CJEU case law can be used to determine whether and under what conditions workers in the collaborative economy can benefit from protection by limiting working time and how can work time be delimited by rest time in their case, given the specificity of their work condition, in order to ensure an effective protection.",TRUE,FALSE,collaborative economy|employees|rest time|self-employees|workers|working time,2020-12-30T22:08:41.890677,NA,,TRUE,accepted,2020-12-30T22:06:38.571337,FALSE,NA,not_applicable,NA,,not_applicable,NA,,,5a8c80f0c698300375c76c07|5a8c80f1c698300375c76c33|Law|Labor and Employment Law|5a8c80f0c698300375c76c07|5a8c80f2c698300375c76c62|Law|Jurisprudence,,2020,https://api.osf.io/v2/preprints/pj63e/contributors/,https://api.osf.io/v2/preprints/pj63e/bibliographic_contributors/,https://api.osf.io/v2/preprints/pj63e/citation/,pj63e,preprints,https://api.osf.io/v2/preprints/pj63e/identifiers/,https://api.osf.io/v2/preprints/pj63e/relationships/node/,NA,NA,NA,https://api.osf.io/v2/licenses/563c1cf88c5e4a3877f9e96c/,563c1cf88c5e4a3877f9e96c,licenses,https://api.osf.io/v2/providers/preprints/socarxiv/,socarxiv,preprint-providers,https://api.osf.io/v2/preprints/pj63e/files/,https://api.osf.io/v2/files/5fe99db0e9ccb9021caee5d9/,5fe99db0e9ccb9021caee5d9,files,https://api.osf.io/v2/preprints/pj63e/review_actions/,https://api.osf.io/v2/preprints/pj63e/requests/,https://api.osf.io/v2/preprints/pj63e/,https://osf.io/preprints/socarxiv/pj63e/,https://doi.org/10.31235/osf.io/pj63e,NA
x78ys,preprints,2020-12-28T07:26:56.708451,2020-12-30T22:11:02.069687,2020-12-30T22:09:06.916803,2020-12-23T15:00:00,NA,The Missing 15 Percent of Patent Citations,"Patent citations are one of the most commonly-used metrics in the innovation literature. Leading uses of patent-to-patent citations are associated with the quantification of inventions' quality and the measurement of knowledge
flows. Due to their widespread availability, scholars have exploited citations listed on the front-page of patent documents. Citations appearing in the full-text of patent documents have been neglected. We apply modern machine learning methods to extract these citations from the text of USPTO patent documents. Overall, we are able to recover an additional 15 percent of patent citations that could not be found using only front-page data. We show that ""in-text"" citations bring a different type of information compared to front-page citations. They exhibit higher text-similarity to the citing patents and alter the ranking of patent importance. The dataset is available at patcit.io (CC-BY-4).",TRUE,FALSE,Citation|Open data|Patent,2020-12-30T22:11:02.048635,NA,,TRUE,accepted,2020-12-30T22:09:06.916803,FALSE,NA,available,NA,https://cverluise.github.io/PatCit/,no,NA,,,5a8c80f7c698300375c76d84|5a8c80f8c698300375c76dbe|Social and Behavioral Sciences|Economics|5a8c80f7c698300375c76d84|5a8c80f9c698300375c76df4|Social and Behavioral Sciences|Science and Technology Studies,,2020,https://api.osf.io/v2/preprints/x78ys/contributors/,https://api.osf.io/v2/preprints/x78ys/bibliographic_contributors/,https://api.osf.io/v2/preprints/x78ys/citation/,x78ys,preprints,https://api.osf.io/v2/preprints/x78ys/identifiers/,https://api.osf.io/v2/preprints/x78ys/relationships/node/,NA,NA,NA,https://api.osf.io/v2/licenses/563c1cf88c5e4a3877f9e96a/,563c1cf88c5e4a3877f9e96a,licenses,https://api.osf.io/v2/providers/preprints/socarxiv/,socarxiv,preprint-providers,https://api.osf.io/v2/preprints/x78ys/files/,https://api.osf.io/v2/files/5fe988c51e6d9702072faba1/,5fe988c51e6d9702072faba1,files,https://api.osf.io/v2/preprints/x78ys/review_actions/,https://api.osf.io/v2/preprints/x78ys/requests/,https://api.osf.io/v2/preprints/x78ys/,https://osf.io/preprints/socarxiv/x78ys/,https://doi.org/10.31235/osf.io/x78ys,NA
hqvnz,preprints,2020-12-27T22:11:16.896634,2020-12-28T00:46:00.830857,2020-12-28T00:45:36.632330,2020-06-30T21:00:00,NA,THE NATIONAL COURT FOLLOW-UP IN THE CJ EU CASE “SINDICATUL FAMILIA E.A.” REGARDING THE WORKING TIME OF FOSTER PARENTS IN ROMANIA,"The CJEU judgement in Sindicatul Familia case (C‑147/17) is a steppingstone for the working time Directive 2003/88 interpretation and application and for the European debate regarding the foster carer for children statute, the remuneration and working time. The article presents the national court decision following the CJEU judgement accompanied by the author´s commentaries. The purpose of the article is to provide legal professionals with the information on the practical results of the dialog between CJEU and national courts and the way national courts use European legislation interpretations given in the preliminary ruling procedure aiming at its uniform application in the EU member states.",TRUE,FALSE,EU law|foster carer|labour law|Romanian law|workers|working time,2020-12-28T00:46:00.804731,NA,,TRUE,accepted,2020-12-28T00:45:36.632330,FALSE,NA,not_applicable,NA,,not_applicable,NA,,,5a8c80f0c698300375c76c07|5a8c80f1c698300375c76c33|Law|Labor and Employment Law|5a8c80f0c698300375c76c07|5a8c80f2c698300375c76c62|Law|Jurisprudence,,2020,https://api.osf.io/v2/preprints/hqvnz/contributors/,https://api.osf.io/v2/preprints/hqvnz/bibliographic_contributors/,https://api.osf.io/v2/preprints/hqvnz/citation/,hqvnz,preprints,https://api.osf.io/v2/preprints/hqvnz/identifiers/,https://api.osf.io/v2/preprints/hqvnz/relationships/node/,NA,NA,NA,https://api.osf.io/v2/licenses/563c1cf88c5e4a3877f9e96c/,563c1cf88c5e4a3877f9e96c,licenses,https://api.osf.io/v2/providers/preprints/socarxiv/,socarxiv,preprint-providers,https://api.osf.io/v2/preprints/hqvnz/files/,https://api.osf.io/v2/files/5fe90688e9ccb901e9af14c8/,5fe90688e9ccb901e9af14c8,files,https://api.osf.io/v2/preprints/hqvnz/review_actions/,https://api.osf.io/v2/preprints/hqvnz/requests/,https://api.osf.io/v2/preprints/hqvnz/,https://osf.io/preprints/socarxiv/hqvnz/,https://doi.org/10.31235/osf.io/hqvnz,NA
9fkjb,preprints,2020-12-27T14:44:47.136168,2020-12-28T00:43:22.323228,2020-12-28T00:43:06.781624,2020-12-26T16:00:00,10.31014/aior.1991.03.04.243,Implementation of the Philippines-Indonesia Coordinated Patrol in the Sea Border Area of Indonesia and the Philippines from the Sea Power Perspective,"The Philippines-Indonesia coordinated patrol (Corpat Philindo) is an implementation of the 1975 Border Patrol Agreement (BPA) which was carried out on a scheduled basis by the two countries in the context of securing the Indonesia-Philippines maritime border. Corpat philindo is the response of the two countries to the existence of traditional border crossers of border communities as well as to guarantee the country's sovereignty from criminal acts and law violations in the border sea between Indonesia and the Philippines. The purpose of this study is to determine the advantages and disadvantages of implementing the Corpat Philindo which have been implemented from the perspective of marine power. The theories used in the analysis are international cooperation security theory and sea power theory. This study uses qualitative data analysis techniques using secondary data and then uses theory to identify a process of events that the author studied. The results of this study conclude that the use of defense equipment, operational areas and support bases in the Corpat Philindo have not yet fulfilled the embodiment of sea power in the Philippines-Indonesia border sea.",TRUE,FALSE,Border|Patrol|Sea Power,2020-12-28T00:43:22.302264,NA,,TRUE,accepted,2020-12-28T00:43:06.781624,FALSE,NA,not_applicable,NA,,not_applicable,NA,,,5a8c80f7c698300375c76d84|Social and Behavioral Sciences,,2020,https://api.osf.io/v2/preprints/9fkjb/contributors/,https://api.osf.io/v2/preprints/9fkjb/bibliographic_contributors/,https://api.osf.io/v2/preprints/9fkjb/citation/,9fkjb,preprints,https://api.osf.io/v2/preprints/9fkjb/identifiers/,https://api.osf.io/v2/preprints/9fkjb/relationships/node/,https://api.osf.io/v2/nodes/c7vbg/,c7vbg,nodes,https://api.osf.io/v2/licenses/563c1cf88c5e4a3877f9e96a/,563c1cf88c5e4a3877f9e96a,licenses,https://api.osf.io/v2/providers/preprints/socarxiv/,socarxiv,preprint-providers,https://api.osf.io/v2/preprints/9fkjb/files/,https://api.osf.io/v2/files/5fe89de6e9ccb901cdaf07b5/,5fe89de6e9ccb901cdaf07b5,files,https://api.osf.io/v2/preprints/9fkjb/review_actions/,https://api.osf.io/v2/preprints/9fkjb/requests/,https://api.osf.io/v2/preprints/9fkjb/,https://osf.io/preprints/socarxiv/9fkjb/,https://doi.org/10.31235/osf.io/9fkjb,https://doi.org/10.31014/aior.1991.03.04.243
8p2x9,preprints,2020-12-27T14:39:57.472021,2020-12-28T00:43:00.875947,2020-12-28T00:42:48.570584,2020-12-26T16:00:00,10.31014/aior.1991.03.04.242,The Universal War Strategy in the 5th Generation War in the 4.0 Industry Era (Cyber Threat Case Study),"Currently, the world has entered into the 5th generation war, and this war in the 5th generation can be said to be an invisible war. This war can be interpreted as an information war, an economic war, including cyber warfare. The rapid progress of the development of science and technology today has a very broad impact on various aspects of human life. The threat of cyber attacks that can cripple the stability of national security needs to be watched out for. For this reason, the Indonesian nation must have strategic steps to anticipate all possibilities from the threat of cyber attacks. The research objective in this paper is to identify the potential threat of 5th generation war, analyze cyber threats and cyber attacks in Indonesia and how the Universal War Strategy in dealing with the threat of cyber attacks. This research method uses a qualitative descriptive phenomenology research method, using data sources from some literature and mass media. The research results from the researcher's analysis provide significant results with the conclusion that Indonesia is vulnerable to cyber threats so that it is necessary to equalize perceptions in drafting the concept of defense and security from the threat of cyber attacks.",TRUE,FALSE,5th Generation War|Siber Threats|Universal War Strategy,2020-12-28T00:43:00.852139,NA,,TRUE,accepted,2020-12-28T00:42:48.570584,FALSE,NA,not_applicable,NA,,not_applicable,NA,,,5a8c80f7c698300375c76d84|Social and Behavioral Sciences,,2020,https://api.osf.io/v2/preprints/8p2x9/contributors/,https://api.osf.io/v2/preprints/8p2x9/bibliographic_contributors/,https://api.osf.io/v2/preprints/8p2x9/citation/,8p2x9,preprints,https://api.osf.io/v2/preprints/8p2x9/identifiers/,https://api.osf.io/v2/preprints/8p2x9/relationships/node/,https://api.osf.io/v2/nodes/c7vbg/,c7vbg,nodes,https://api.osf.io/v2/licenses/563c1cf88c5e4a3877f9e96a/,563c1cf88c5e4a3877f9e96a,licenses,https://api.osf.io/v2/providers/preprints/socarxiv/,socarxiv,preprint-providers,https://api.osf.io/v2/preprints/8p2x9/files/,https://api.osf.io/v2/files/5fe89cc51e6d9701d22fd340/,5fe89cc51e6d9701d22fd340,files,https://api.osf.io/v2/preprints/8p2x9/review_actions/,https://api.osf.io/v2/preprints/8p2x9/requests/,https://api.osf.io/v2/preprints/8p2x9/,https://osf.io/preprints/socarxiv/8p2x9/,https://doi.org/10.31235/osf.io/8p2x9,https://doi.org/10.31014/aior.1991.03.04.242
wsh64,preprints,2020-12-27T14:28:22.645228,2020-12-28T00:42:41.139550,2020-12-28T00:42:31.775088,2020-12-26T16:00:00,10.31014/aior.1991.03.04.241,Benford’s Law Application: Case of Elections in Sri Lanka,"Sri Lanka, like many developing countries has been involved in a circle of allegations of election fraud. Usually these claims are pronounced more by losing parties. This study uses Benford’s law, a law of probability distribution of digits, to investigate whether the election fraud claims might have merit. A sample in this study is made of 808 election data. This data comes from the 2010 Presidential election for representatives from three major political parties and from 2010 General Election data. All of the data points were obtained through reliable government sources, two of which are, the Department of Elections website of Sri Lanka, and the National News Paper statistics (2010). The study contrasts the distribution of the first digit of election results against the Benford’s Law benchmark. After obtaining the results, we organize the data and find median, mean, mode and standard deviation. The preliminary results showe that the data does not align with Benford’s law predictions. In other words, it shows that the data does not follow the law where the mean is larger than the median and there is a positive skewness then it likely follows a Benford’s distribution. The distribution of the first digit of actual data for three parties disagrees with Benford's law. This misalignment is more pronounced for the winning party than for the second and third place parties, respectively. We, therefore, look forward to run the data through several critical analyses and observing if there shall be any fraud or manipulation in numbers.",TRUE,FALSE,Benford’s Law|Elections Fraud|Probability Distribution|Sri Lanka,2020-12-28T00:42:41.118214,NA,,TRUE,accepted,2020-12-28T00:42:31.775088,FALSE,NA,not_applicable,NA,,not_applicable,NA,,,5a8c80f7c698300375c76d84|Social and Behavioral Sciences,,2020,https://api.osf.io/v2/preprints/wsh64/contributors/,https://api.osf.io/v2/preprints/wsh64/bibliographic_contributors/,https://api.osf.io/v2/preprints/wsh64/citation/,wsh64,preprints,https://api.osf.io/v2/preprints/wsh64/identifiers/,https://api.osf.io/v2/preprints/wsh64/relationships/node/,https://api.osf.io/v2/nodes/c7vbg/,c7vbg,nodes,https://api.osf.io/v2/licenses/563c1cf88c5e4a3877f9e96a/,563c1cf88c5e4a3877f9e96a,licenses,https://api.osf.io/v2/providers/preprints/socarxiv/,socarxiv,preprint-providers,https://api.osf.io/v2/preprints/wsh64/files/,https://api.osf.io/v2/files/5fe89a0de9ccb901ccaee7fa/,5fe89a0de9ccb901ccaee7fa,files,https://api.osf.io/v2/preprints/wsh64/review_actions/,https://api.osf.io/v2/preprints/wsh64/requests/,https://api.osf.io/v2/preprints/wsh64/,https://osf.io/preprints/socarxiv/wsh64/,https://doi.org/10.31235/osf.io/wsh64,https://doi.org/10.31014/aior.1991.03.04.241
un6h8,preprints,2020-12-27T14:19:35.323838,2020-12-28T00:42:40.822795,2020-12-28T00:42:16.726984,2020-12-26T16:00:00,10.31014/aior.1991.03.04.240,The 1962 Military Confrontation on Salvaging West Papua: An Analysis on War Theory,"Based on the Round Table Conference between Indonesia and the Netherlands' representatives in 1949, West Papua will be delivered to Indonesia a year later. Nevertheless, the Dutch broke their promise to return West Papua to Indonesian sovereignty. The Dutch continued to insist on West Papua as their land and then increased their military presence in West Papua to prepare for defending the territory. Responding to this, initially, Indonesia made peaceful efforts, namely bilateral diplomacy within the Indonesian-Dutch Union ties, continued with trilateral diplomacy and diplomacy efforts using the Asian African Conference and United Nations organizations. However, Indonesian diplomatic efforts met with deadlock. Hence, another form of diplomacy, the military effort, has been displayed. This study's main aim is to review the 1962 military confrontation on salvaging West Papua in the analysis on war theory. Also, to prove that with sufficient military strength, the country will confidently step up to be the negotiating table winner. The Indonesian military strength at that time was playing a significant role as a deterrent effect. The research uses a qualitative descriptive phenomenology method, using data sources from several books and journals available. The result of the research shows that Indonesia absolutely needs a modern and more rigid military force to maintain its sovereignty, protect our Island and its natural resources. Without the deterrent effect of military power, Indonesia will be underestimated in international politics.",TRUE,FALSE,Deterrent Effect|Political Diplomacy|War Theory,2020-12-28T00:42:40.802616,NA,,TRUE,accepted,2020-12-28T00:42:16.726984,FALSE,NA,not_applicable,NA,,not_applicable,NA,,,5a8c80f7c698300375c76d84|5a8c80f7c698300375c76d8e|Social and Behavioral Sciences|International and Area Studies,,2020,https://api.osf.io/v2/preprints/un6h8/contributors/,https://api.osf.io/v2/preprints/un6h8/bibliographic_contributors/,https://api.osf.io/v2/preprints/un6h8/citation/,un6h8,preprints,https://api.osf.io/v2/preprints/un6h8/identifiers/,https://api.osf.io/v2/preprints/un6h8/relationships/node/,https://api.osf.io/v2/nodes/c7vbg/,c7vbg,nodes,https://api.osf.io/v2/licenses/563c1cf88c5e4a3877f9e96a/,563c1cf88c5e4a3877f9e96a,licenses,https://api.osf.io/v2/providers/preprints/socarxiv/,socarxiv,preprint-providers,https://api.osf.io/v2/preprints/un6h8/files/,https://api.osf.io/v2/files/5fe897fce3acd101e04a69df/,5fe897fce3acd101e04a69df,files,https://api.osf.io/v2/preprints/un6h8/review_actions/,https://api.osf.io/v2/preprints/un6h8/requests/,https://api.osf.io/v2/preprints/un6h8/,https://osf.io/preprints/socarxiv/un6h8/,https://doi.org/10.31235/osf.io/un6h8,https://doi.org/10.31014/aior.1991.03.04.240
7gr3d,preprints,2020-12-27T14:11:02.334483,2020-12-28T00:42:00.718835,2020-12-28T00:41:47.825016,2020-12-26T16:00:00,10.31014/aior.1991.03.04.239,"The Comparison of Guerilla Warfare Framework of Mao Tse-Tung, Vo Nguyen Giap, and Che Guevara","Small war became popularly used in irregular warfare when a more considerable force dominated the opponent. Small wars but troublesome opposing forces are known as guerrillas. Since war architects popularized the guerrilla theory, it has also been frequently used in wars between forces. The psychological impact of most of the war's success can influence both state and group leaders to apply this model. It has been practiced and applied for a long time in various parts of the world until today. The very popularity of this model of warfare has prompted the author to produce an article that aims to compare the three guerrilla architects' frameworks from the point of view of a comprehensive strategy, tactics, and social aspects using the method of collecting data through document study. The results show that the framework of Mao Tse Tung, Vo Nguyen Giap, and Che Guevara about guerrilla warfare has its characteristics and perspectives.",TRUE,FALSE,Che Guevara|Framework|Guerilla|Mao Tse-Tung|Vo Nguyen Giap,2020-12-28T00:42:00.696088,NA,,TRUE,accepted,2020-12-28T00:41:47.825016,FALSE,NA,not_applicable,NA,,not_applicable,NA,,,5a8c80f7c698300375c76d84|Social and Behavioral Sciences,,2020,https://api.osf.io/v2/preprints/7gr3d/contributors/,https://api.osf.io/v2/preprints/7gr3d/bibliographic_contributors/,https://api.osf.io/v2/preprints/7gr3d/citation/,7gr3d,preprints,https://api.osf.io/v2/preprints/7gr3d/identifiers/,https://api.osf.io/v2/preprints/7gr3d/relationships/node/,https://api.osf.io/v2/nodes/c7vbg/,c7vbg,nodes,https://api.osf.io/v2/licenses/563c1cf88c5e4a3877f9e96a/,563c1cf88c5e4a3877f9e96a,licenses,https://api.osf.io/v2/providers/preprints/socarxiv/,socarxiv,preprint-providers,https://api.osf.io/v2/preprints/7gr3d/files/,https://api.osf.io/v2/files/5fe895fb1e6d9701d22fb638/,5fe895fb1e6d9701d22fb638,files,https://api.osf.io/v2/preprints/7gr3d/review_actions/,https://api.osf.io/v2/preprints/7gr3d/requests/,https://api.osf.io/v2/preprints/7gr3d/,https://osf.io/preprints/socarxiv/7gr3d/,https://doi.org/10.31235/osf.io/7gr3d,https://doi.org/10.31014/aior.1991.03.04.239
e7d4g,preprints,2020-12-27T13:23:15.980106,2020-12-28T00:41:20.704408,2020-12-28T00:41:12.873609,2020-12-26T16:00:00,10.31014/aior.1993.03.04.166,Analysis and Improvement Strategies of the Phenomenon that What Biology Teachers Teach is not What They Learned in Rural Middle Schools,"Rural education is a short board of China’s education. It is of great significance to strengthen the construction of the teacher team in rural middle schools for Rural Revitalization in the new era. The problem of structural shortage of teachers, reflected by the phenomenon of “what biology teachers teach is not what they learned” in rural middle schools, is a key issue that has been existing for a long time in the development of rural middle school education in our country. It is also a key problem that must be paid attention to and urgently solved in the face of the new situation, new tasks and new requirements. In response to this phenomenon that caused by the decline of students and the loss of biological teachers in rural middle schools, the government needs to play a supporting role and the school leaders of rural middle schools should innovate their systems and concepts. What’s more, biological teachers should reflect on their hearts and have the educational feelings of being willing to develop the countryside. Only when the government, middle school leaders and biology teachers have formed an educational synergy, can we better solve that harmful phenomenon and promote the healthy and rapid development of rural middle school education.",TRUE,FALSE,Biology Teacher|Improvement Strategy|Rural Middle School|Structural Shortage|Teach not What They Learned,2020-12-28T00:41:20.675484,NA,,TRUE,accepted,2020-12-28T00:41:12.873609,FALSE,NA,not_applicable,NA,,not_applicable,NA,,,5a8c80f6c698300375c76d4e|Education,,2020,https://api.osf.io/v2/preprints/e7d4g/contributors/,https://api.osf.io/v2/preprints/e7d4g/bibliographic_contributors/,https://api.osf.io/v2/preprints/e7d4g/citation/,e7d4g,preprints,https://api.osf.io/v2/preprints/e7d4g/identifiers/,https://api.osf.io/v2/preprints/e7d4g/relationships/node/,https://api.osf.io/v2/nodes/zuksr/,zuksr,nodes,https://api.osf.io/v2/licenses/563c1cf88c5e4a3877f9e96a/,563c1cf88c5e4a3877f9e96a,licenses,https://api.osf.io/v2/providers/preprints/socarxiv/,socarxiv,preprint-providers,https://api.osf.io/v2/preprints/e7d4g/files/,https://api.osf.io/v2/files/5fe88ac81e6d9701c82fde7f/,5fe88ac81e6d9701c82fde7f,files,https://api.osf.io/v2/preprints/e7d4g/review_actions/,https://api.osf.io/v2/preprints/e7d4g/requests/,https://api.osf.io/v2/preprints/e7d4g/,https://osf.io/preprints/socarxiv/e7d4g/,https://doi.org/10.31235/osf.io/e7d4g,https://doi.org/10.31014/aior.1993.03.04.166
