w2cxp,preprints,2021-02-09T16:10:23.932354,2021-02-10T18:33:21.999757,2021-02-10T18:32:20.413354,2021-01-12T16:00:00,10.1038/s41598-020-79514-5,Myopic reallocation of extraction improves collective outcomes in networked common-pool resource games,"When individuals extract benefits from multiple resources, the decision they face is twofold: besides choosing how much total effort to exert for extraction, they must also decide how to allocate this effort. We focus on the allocation aspect of this choice in an iterated game played on bipartite networks of agents and common-pool resources (CPRs) that degrade linearly in quality as extraction increases. When CPR users attempt to reallocate their extraction efforts among resources to maximize
their own payoffs in the very next round (that is, myopically), collective wealth is increased. Using a heterogeneous mean-field approach, we estimate how these reallocations affect the payoffs of CPR users of different degrees within networks having different levels of degree heterogeneity. Focusing specifically on Nash equilibrium initial conditions, which represent the patterns of over-exploitation that result from rational extraction, we find that networks with greater heterogeneity among CPR
degrees show greater improvements over equilibrium due to reallocation. When the marginal utility of extraction diminishes, these reallocations also reduce wealth inequality. These findings emphasize that CPR users’ adaptive reallocations of effort—a behavior that previously-studied network evolutionary game models typically disallow by construction—can serve to direct individuals’ self interest toward the collective good.",TRUE,FALSE,common-pool resources|evolutionary games|networks|resource allocation,2021-02-10T18:33:21.975008,NA,,TRUE,accepted,2021-02-10T18:32:20.413354,FALSE,NA,not_applicable,NA,,not_applicable,NA,,,5a8c80f7c698300375c76d84|5a8c80f7c698300375c76d96|Social and Behavioral Sciences|Other Social and Behavioral Sciences|5a8c80f7c698300375c76d84|5a8c80f8c698300375c76db6|Social and Behavioral Sciences|Agricultural and Resource Economics,Andrew Schauf and Poong Oh,2021,https://api.osf.io/v2/preprints/w2cxp/contributors/,https://api.osf.io/v2/preprints/w2cxp/bibliographic_contributors/,https://api.osf.io/v2/preprints/w2cxp/citation/,w2cxp,preprints,https://api.osf.io/v2/preprints/w2cxp/identifiers/,https://api.osf.io/v2/nodes/2sbz8/,https://api.osf.io/v2/preprints/w2cxp/relationships/node/,2sbz8,nodes,https://api.osf.io/v2/licenses/563c1cf88c5e4a3877f9e96a/,563c1cf88c5e4a3877f9e96a,licenses,https://api.osf.io/v2/providers/preprints/socarxiv/,socarxiv,preprint-providers,https://api.osf.io/v2/preprints/w2cxp/files/,https://api.osf.io/v2/files/6022b3f4232383007b9d7503/,6022b3f4232383007b9d7503,files,https://api.osf.io/v2/preprints/w2cxp/review_actions/,https://api.osf.io/v2/preprints/w2cxp/requests/,https://api.osf.io/v2/preprints/w2cxp/,https://osf.io/preprints/socarxiv/w2cxp/,https://doi.org/10.1038/s41598-020-79514-5,https://doi.org/10.31235/osf.io/w2cxp
7v6mt,preprints,2021-02-09T13:55:57.147099,2021-02-10T18:19:03.788623,2021-02-10T18:18:39.080201,NA,NA,Avoiding Material Hardship: The Buffer Function of Wealth,"We assess how a variety of disruptive life-course events impact the well-being of
U.S. households and trace the importance of household wealth in helping families experiencing these events avoid entering a spell of material hardship. Using longitudinal data from two panels of the Survey of Income and Program Participation (SIPP), we draw on direct measures of material hardship, disruptive events, and household assets. Regression and decomposition analyses reveal that the relationship between disruptive events and the likelihood of experiencing a new spell of material hardship strongly varies across the wealth distribution, suggesting that high household wealth provides an effective private safety net. By distinguishing different types of disruptive events, we also demonstrate that divorce, disability, and income instability entail the risk of falling into material hardship but also that this risk is effectively buffered by substantial wealth. Different types of hardship – namely, financial, food, and medical hardship – respond in similar ways.
Like public insurance schemes, wealth insurance helps buffer the effects of disruptive events on material hardship, but unlike public insurance schemes, reliance on private wealth further stratifies the economic well-being of households. Policy options for addressing this highly stratified private insurance scheme includes disposing of the need for it by funding a more robust public insurance, for instance through wealth taxation.",TRUE,FALSE,hardship|inequality|wealth,2021-02-10T18:19:03.765871,NA,,TRUE,accepted,2021-02-10T18:18:39.080201,FALSE,NA,available,NA,https://www.census.gov/programs-surveys/sipp.html,no,"Please direct correspondence to Richard Rodems, University of Michigan, 426 Thompson Street, Institute for Social Research, Ann Arbor, Michigan 48104, rodems@umich.edu. A replication file for the reported analyses will be made available upon publication.",,NA,"5a8c80f7c698300375c76d84|5a8c80fac698300375c76e20|5a8c80fac698300375c76e35|Social and Behavioral Sciences|Sociology|Inequality, Poverty, and Mobility",Fabian T. Pfeffer|Richard Rodems,2020,https://api.osf.io/v2/preprints/7v6mt/contributors/,https://api.osf.io/v2/preprints/7v6mt/bibliographic_contributors/,https://api.osf.io/v2/preprints/7v6mt/citation/,7v6mt,preprints,https://api.osf.io/v2/preprints/7v6mt/identifiers/,NA,https://api.osf.io/v2/preprints/7v6mt/relationships/node/,NA,NA,https://api.osf.io/v2/licenses/563c1cf88c5e4a3877f9e96a/,563c1cf88c5e4a3877f9e96a,licenses,https://api.osf.io/v2/providers/preprints/socarxiv/,socarxiv,preprint-providers,https://api.osf.io/v2/preprints/7v6mt/files/,https://api.osf.io/v2/files/6022947273c9fe0067077128/,6022947273c9fe0067077128,files,https://api.osf.io/v2/preprints/7v6mt/review_actions/,https://api.osf.io/v2/preprints/7v6mt/requests/,https://api.osf.io/v2/preprints/7v6mt/,https://osf.io/preprints/socarxiv/7v6mt/,NA,https://doi.org/10.31235/osf.io/7v6mt
