id,type,attributes.date_created,attributes.date_modified,attributes.date_published,attributes.original_publication_date,attributes.doi,attributes.title,attributes.description,attributes.is_published,attributes.is_preprint_orphan,attributes.tags,attributes.preprint_doi_created,attributes.date_withdrawn,attributes.current_user_permissions,attributes.public,attributes.reviews_state,attributes.date_last_transitioned,attributes.has_coi,attributes.conflict_of_interest_statement,attributes.has_data_links,attributes.why_no_data,attributes.data_links,attributes.has_prereg_links,attributes.why_no_prereg,attributes.prereg_links,attributes.prereg_link_info,attributes.subjects,attributes.license_record.copyright_holders,attributes.license_record.year,relationships.contributors.links.related.href,relationships.bibliographic_contributors.links.related.href,relationships.citation.links.related.href,relationships.citation.data.id,relationships.citation.data.type,relationships.identifiers.links.related.href,relationships.node.links.related.href,relationships.node.links.self.href,relationships.node.data.id,relationships.node.data.type,relationships.license.links.related.href,relationships.license.data.id,relationships.license.data.type,relationships.provider.links.related.href,relationships.provider.data.id,relationships.provider.data.type,relationships.files.links.related.href,relationships.primary_file.links.related.href,relationships.primary_file.data.id,relationships.primary_file.data.type,relationships.review_actions.links.related.href,relationships.requests.links.related.href,links.self,links.html,links.doi,links.preprint_doi
ez3ws,preprints,2021-02-10T15:34:14.223506,2021-02-10T18:23:21.412992,2021-02-10T18:22:54.266175,2021-02-09T16:00:00,10.31014/aior.1991.04.01.255,The CCP’s Development of Artificial Intelligence: Impact on Future Operations,"The development of artificial intelligence and related technologies has a potential serious impact on the industrial development and the military operations. The Chinese Communist Party has also classified this area as a key direction of the future development, hoping that in this new wave of military affairs innovation, under the absolute superiority of economic and military affairs, China could surpass the United States in one fell swoop, changing the world situation in which the United States is the only military superpower since the end of the Cold War. In the report of the 19th National Congress of the Communist Party of China, President Xi Jinping clearly stated that it should accelerate the development of military intelligence and strengthen the joint combat capability of the network information system, including the R&amp;D of the innovative weapons and equipment. As Xi Jinping took over the presidency of China in 2013, he initiated the ""dream of strong army"". In the future, artificial intelligence is bound to be an important part of the CCP's military modernization, and it is also a foresighted preparation for winning the next war. At present, most of the CCP’s research on military development in terms of artificial intelligence tends to be on hardware devices, such as automated combat vehicles, autonomous drones and remote-controlled submarines. These related technologies rely heavily on the mechanical engineering and traditional R&amp;D. The CCP intends to combine the development of military science and technology with the advanced weapons as a means of ""killer"" conception for future regional wars against the United States and other major powers. In this concept, the Communist Army will carry out paralytic asymmetrical attacks to its potential enemies. In the past, the ""killer"" weapons may be the attack missiles that attack large ships, but now they may include a new generation of artificial intelligence weapons that use the big data, the Internet of Things, or the cloud computing. In the face of the development of the CCP’s artificial intelligence militarization, not only we must concern about its current major developments, but also have to analyze the motives behind it, so that we can make correct judgments in the future operations to block the CCP’s media campaign and arms deterrent. This is the focus worthy of our urgent attention.",TRUE,FALSE,Artificial Intelligence|Asymmetric Combat|Dream of Strong Army,2021-02-10T18:23:21.390301,NA,,TRUE,accepted,2021-02-10T18:22:54.266175,FALSE,NA,not_applicable,NA,,not_applicable,NA,,,5a8c80f7c698300375c76d84|Social and Behavioral Sciences,,2021,https://api.osf.io/v2/preprints/ez3ws/contributors/,https://api.osf.io/v2/preprints/ez3ws/bibliographic_contributors/,https://api.osf.io/v2/preprints/ez3ws/citation/,ez3ws,preprints,https://api.osf.io/v2/preprints/ez3ws/identifiers/,https://api.osf.io/v2/nodes/c7vbg/,https://api.osf.io/v2/preprints/ez3ws/relationships/node/,c7vbg,nodes,https://api.osf.io/v2/licenses/563c1cf88c5e4a3877f9e96a/,563c1cf88c5e4a3877f9e96a,licenses,https://api.osf.io/v2/providers/preprints/socarxiv/,socarxiv,preprint-providers,https://api.osf.io/v2/preprints/ez3ws/files/,https://api.osf.io/v2/files/6023fcfb23238300ee9e0916/,6023fcfb23238300ee9e0916,files,https://api.osf.io/v2/preprints/ez3ws/review_actions/,https://api.osf.io/v2/preprints/ez3ws/requests/,https://api.osf.io/v2/preprints/ez3ws/,https://osf.io/preprints/socarxiv/ez3ws/,https://doi.org/10.31014/aior.1991.04.01.255,https://doi.org/10.31235/osf.io/ez3ws
9zu8g,preprints,2021-02-10T15:23:04.872836,2021-02-10T18:23:41.067216,2021-02-10T18:23:24.762869,NA,NA,Recruiting a Probability-Based Online Panel via Postal Mail:  Experimental Evidence,"Once recruited, probability-based online panels have proven to enable high-quality and high-frequency data collection. In ever faster-paced societies and, recently, in times of pandemic lockdowns, such online survey infrastructures are invaluable to social research. In absence of email sampling frames, one way of recruiting such a panel is via postal mail. However, few studies have examined how to best approach and then transition sample members from the initial postal mail contact to the online panel registration. To fill this gap, we implemented a large-scale experiment in the recruitment of the 2018 sample of the German Internet Panel (GIP) varying panel recruitment designs in four experimental conditions: online-only, concurrent mode, push-to-web, and paper-first. Our results show that the online-only design delivers higher online panel registration rates than the other recruitment designs. In addition, all experimental conditions led to similarly representative samples on key socio-demographic characteristics.",TRUE,FALSE,concurrent mode|mail surveys|mixed-mode|offline recruitment|online panels|probability sampling|push-to-web|representativeness,2021-02-10T18:23:41.020540,NA,,TRUE,accepted,2021-02-10T18:23:24.762869,FALSE,NA,no,NA,,no,NA,,,5a8c80f7c698300375c76d84|Social and Behavioral Sciences,,2021,https://api.osf.io/v2/preprints/9zu8g/contributors/,https://api.osf.io/v2/preprints/9zu8g/bibliographic_contributors/,https://api.osf.io/v2/preprints/9zu8g/citation/,9zu8g,preprints,https://api.osf.io/v2/preprints/9zu8g/identifiers/,NA,https://api.osf.io/v2/preprints/9zu8g/relationships/node/,NA,NA,https://api.osf.io/v2/licenses/563c1cf88c5e4a3877f9e96a/,563c1cf88c5e4a3877f9e96a,licenses,https://api.osf.io/v2/providers/preprints/socarxiv/,socarxiv,preprint-providers,https://api.osf.io/v2/preprints/9zu8g/files/,https://api.osf.io/v2/files/6023fa5c23238300ed9dc81e/,6023fa5c23238300ed9dc81e,files,https://api.osf.io/v2/preprints/9zu8g/review_actions/,https://api.osf.io/v2/preprints/9zu8g/requests/,https://api.osf.io/v2/preprints/9zu8g/,https://osf.io/preprints/socarxiv/9zu8g/,NA,https://doi.org/10.31235/osf.io/9zu8g
sbvpd,preprints,2021-02-10T14:06:50.672760,2021-02-10T18:24:23.319924,2021-02-10T18:23:45.658510,2021-02-02T00:00:00,10.1016/j.copsyc.2021.01.007,Critical psychologies and climate change,"This article is a review of recent contributions in critical psychology, and its close cousins, critical social psychology, critical community psychology and liberation psychology, to understandings of the human response to climate change. It contrasts critical psychology with mainstream psychology in general terms, before introducing a critical psychological perspective on climate change. Central to this perspective is a critique of the framing of individual behaviour change as the problem and solution to climate change in mainstream psychology, and a related emphasis on identifying ‘barriers’ to pro-environmental behaviour. This framework is argued to be reductive, obscuring or downplaying the influence of a range of factors in shaping predominant responses to climate change to date, including social context, discourse, power and affect. Currently, critical psychologies set out to study the relative contribution of these factors to (in)action on climate change. A related concern is how the psychological and emotional impacts of climate change impact unevenly on communities and individuals, depending on place-based, economic, geographic and cultural differences, and giving rises to experiences of injustice, inequality and disempowerment. Critical psychology does not assume these to be overriding or inevitable psychological and social responses, however. Critical psychologies also undertake research and inform interventions that highlight the role of collective understanding, activism, empowerment and resistance as the necessary foundations of a genuine shift towards sustainable societies.",TRUE,FALSE,climate change|climate crisis|community psychology|critical psychology|eco-anxiety|emotion|environmental justice|liberation psychology|psychology|resistance,2021-02-10T18:24:23.298069,NA,,TRUE,accepted,2021-02-10T18:23:45.658510,FALSE,NA,not_applicable,NA,,not_applicable,NA,,,5a8c80f7c698300375c76d84|5a8c80f7c698300375c76d98|5a8c80f7c698300375c76d9c|Social and Behavioral Sciences|Psychology|Community Psychology|5a8c80f7c698300375c76d84|5a8c80f7c698300375c76d98|5a8c80f7c698300375c76da2|Social and Behavioral Sciences|Psychology|Social Psychology|5a8c80f7c698300375c76d84|5a8c80f7c698300375c76d98|5a8c80f8c698300375c76dab|Social and Behavioral Sciences|Psychology|Clinical Psychology|5a8c80f7c698300375c76d84|5a8c80f8c698300375c76dbd|Social and Behavioral Sciences|Environmental Studies|5a8c80f7c698300375c76d84|5a8c80fac698300375c76e20|5a8c80fac698300375c76e2f|Social and Behavioral Sciences|Sociology|Environmental Sociology,Elsevier,2021,https://api.osf.io/v2/preprints/sbvpd/contributors/,https://api.osf.io/v2/preprints/sbvpd/bibliographic_contributors/,https://api.osf.io/v2/preprints/sbvpd/citation/,sbvpd,preprints,https://api.osf.io/v2/preprints/sbvpd/identifiers/,NA,https://api.osf.io/v2/preprints/sbvpd/relationships/node/,NA,NA,https://api.osf.io/v2/licenses/563c1cf88c5e4a3877f9e965/,563c1cf88c5e4a3877f9e965,licenses,https://api.osf.io/v2/providers/preprints/socarxiv/,socarxiv,preprint-providers,https://api.osf.io/v2/preprints/sbvpd/files/,https://api.osf.io/v2/files/6023e87f73c9fe00f9076a36/,6023e87f73c9fe00f9076a36,files,https://api.osf.io/v2/preprints/sbvpd/review_actions/,https://api.osf.io/v2/preprints/sbvpd/requests/,https://api.osf.io/v2/preprints/sbvpd/,https://osf.io/preprints/socarxiv/sbvpd/,https://doi.org/10.1016/j.copsyc.2021.01.007,https://doi.org/10.31235/osf.io/sbvpd
qwjcx,preprints,2021-02-10T09:04:41.616412,2021-02-10T18:25:42.495092,2021-02-10T18:25:19.517640,2020-12-31T23:00:00,NA,Untangling Agile Government: On the Dual Necessities of Structure and Agility,"Agility has become a common term when it comes to today's discourse on digitalization and government transformation. There is a widely held view that governmental bureaucracy with its laws, regulations, institutions, and `red tape' is unable to keep up with a rapidly changing and digitizing society. It is now often claimed that the solution is for governments to become agile. Along these lines, the resulting discourse on `agile government' posits that government is not agile now, but it could be, and if it were agile then government would be more e?ective, adaptive, and, thus, normatively better. We argue that while agility can represent a useful paradigm in some contexts, it is often applied inappropriately in the governmental context due to a lack of understanding about what `agile' is, and what it is not.",TRUE,FALSE,,2021-02-10T18:25:42.465124,NA,,TRUE,accepted,2021-02-10T18:25:19.517640,FALSE,NA,not_applicable,NA,,not_applicable,NA,,,"5a8c80f7c698300375c76d84|5a8c80f8c698300375c76ddb|5a8c80f9c698300375c76df1|Social and Behavioral Sciences|Public Affairs, Public Policy and Public Administration|Public Administration",,2021,https://api.osf.io/v2/preprints/qwjcx/contributors/,https://api.osf.io/v2/preprints/qwjcx/bibliographic_contributors/,https://api.osf.io/v2/preprints/qwjcx/citation/,qwjcx,preprints,https://api.osf.io/v2/preprints/qwjcx/identifiers/,NA,https://api.osf.io/v2/preprints/qwjcx/relationships/node/,NA,NA,https://api.osf.io/v2/licenses/563c1cf88c5e4a3877f9e96a/,563c1cf88c5e4a3877f9e96a,licenses,https://api.osf.io/v2/providers/preprints/socarxiv/,socarxiv,preprint-providers,https://api.osf.io/v2/preprints/qwjcx/files/,https://api.osf.io/v2/files/6023a1ad73c9fe00dc079e40/,6023a1ad73c9fe00dc079e40,files,https://api.osf.io/v2/preprints/qwjcx/review_actions/,https://api.osf.io/v2/preprints/qwjcx/requests/,https://api.osf.io/v2/preprints/qwjcx/,https://osf.io/preprints/socarxiv/qwjcx/,NA,https://doi.org/10.31235/osf.io/qwjcx
bd2hy,preprints,2021-02-09T23:37:17.986422,2021-02-10T18:30:02.391510,2021-02-10T18:29:39.950151,NA,NA,The Changing Landscape of Affordable Housing in the Rural and Urban United States; 1990-2016,"Affordable housing has declined in recent decades, yet limited research has examined the demographic and economic changes influencing place-level affordability—especially outside of large metros. In this study I examine the effects of county-level population growth and decline, population aging, and natural amenity development on rates of affordable housing, income, and housing costs across four types of counties. While declines in affordability from 1990-2016 were universal between rural and urban counties, population growth is associated with decreases in affordability in rural counties but increased affordability in large metros counties due to estimated decreases in housing costs. Population aging is estimated to improve affordability in large and small metro counties, despite the associated decrease in income and housing costs across all county types. The effects of aging vary greatly between owners and renters. Natural amenity development, despite its theoretical importance, is not associated with changes in affordability for rural counties.",TRUE,FALSE,Affordable Housing|Demographic Change|Rural|Urban,2021-02-10T18:30:02.360999,NA,,TRUE,accepted,2021-02-10T18:29:39.950151,FALSE,NA,available,NA,https://www.nhgis.org/,no,NA,,,5a8c80f7c698300375c76d84|5a8c80fac698300375c76e20|5a8c80fac698300375c76e25|Social and Behavioral Sciences|Sociology|Community and Urban Sociology|5a8c80f7c698300375c76d84|5a8c80fac698300375c76e20|5a8c80fac698300375c76e3e|Social and Behavioral Sciences|Sociology|Population,,2021,https://api.osf.io/v2/preprints/bd2hy/contributors/,https://api.osf.io/v2/preprints/bd2hy/bibliographic_contributors/,https://api.osf.io/v2/preprints/bd2hy/citation/,bd2hy,preprints,https://api.osf.io/v2/preprints/bd2hy/identifiers/,NA,https://api.osf.io/v2/preprints/bd2hy/relationships/node/,NA,NA,https://api.osf.io/v2/licenses/563c1cf88c5e4a3877f9e96a/,563c1cf88c5e4a3877f9e96a,licenses,https://api.osf.io/v2/providers/preprints/socarxiv/,socarxiv,preprint-providers,https://api.osf.io/v2/preprints/bd2hy/files/,https://api.osf.io/v2/files/60231cbd73c9fe00bc077aaf/,60231cbd73c9fe00bc077aaf,files,https://api.osf.io/v2/preprints/bd2hy/review_actions/,https://api.osf.io/v2/preprints/bd2hy/requests/,https://api.osf.io/v2/preprints/bd2hy/,https://osf.io/preprints/socarxiv/bd2hy/,NA,https://doi.org/10.31235/osf.io/bd2hy
cvb7e,preprints,2021-02-09T21:31:50.488679,2021-02-10T18:30:25.933751,2021-02-10T18:30:07.462446,2020-02-08T23:00:00,10.1016/j.jenvman.2020.110526,The impact of a gain-sharing cost-reflective tariff on waste management cost under incentive regulation: The Italian case,"In many European countries, waste tariff systems are being updated to take account of the consolidation of circular economy objectives. We forecast the impact of a gain-sharing cost-reflective tariff on waste management sustainability. The cost-reflective tariff generates an economic surplus for society, while meeting environmental goals. Based on empirical data we developed two scenarios. The baseline scenario formalizes the current Italian tariff scheme, while the intervention scenario includes users' response to a gainsharing policy. By optimizing the tariff structure, society would benefit from a surplus that could be reached setting an asymmetric regulation based on current waste management efficiency level. Our results will potentially be a basis for directing waste management policy as per tariff design",TRUE,FALSE,economic regulation|regulation|tariff|waste fee|waste management|waste tax,2021-02-10T18:30:25.903122,NA,,TRUE,accepted,2021-02-10T18:30:07.462446,FALSE,NA,no,NA,,no,NA,,,5a8c80f7c698300375c76d84|5a8c80f8c698300375c76dbd|Social and Behavioral Sciences|Environmental Studies|5a8c80f7c698300375c76d84|5a8c80f8c698300375c76dbe|5a8c80f8c698300375c76dce|Social and Behavioral Sciences|Economics|Public Economics,,2020,https://api.osf.io/v2/preprints/cvb7e/contributors/,https://api.osf.io/v2/preprints/cvb7e/bibliographic_contributors/,https://api.osf.io/v2/preprints/cvb7e/citation/,cvb7e,preprints,https://api.osf.io/v2/preprints/cvb7e/identifiers/,NA,https://api.osf.io/v2/preprints/cvb7e/relationships/node/,NA,NA,https://api.osf.io/v2/licenses/563c1cf88c5e4a3877f9e96a/,563c1cf88c5e4a3877f9e96a,licenses,https://api.osf.io/v2/providers/preprints/socarxiv/,socarxiv,preprint-providers,https://api.osf.io/v2/preprints/cvb7e/files/,https://api.osf.io/v2/files/6022ff4973c9fe00ab077c46/,6022ff4973c9fe00ab077c46,files,https://api.osf.io/v2/preprints/cvb7e/review_actions/,https://api.osf.io/v2/preprints/cvb7e/requests/,https://api.osf.io/v2/preprints/cvb7e/,https://osf.io/preprints/socarxiv/cvb7e/,https://doi.org/10.1016/j.jenvman.2020.110526,https://doi.org/10.31235/osf.io/cvb7e
tca34,preprints,2021-02-09T20:22:14.984415,2021-02-10T18:31:02.406664,2021-02-10T18:30:36.007645,NA,NA,Socio-economic indicators correlate with daily mobility during the second-wave of the Covid-19 pandemic,"Non-pharmaceutical interventions are being used globally to limit the spread of Covid-19, which are in turn affecting individual mobility patterns. Mobility measures were found to be strongly associated with regional socio-economic indicators during the first wave of the pandemic. Here, we use network mobility data from an ~3.5 million person sample of individuals in Ontario, Canada to study the association between three different individual-mobility measures and four socio-economic indicators throughout the first and second wave of Covid-19 (January to December 2020). We demonstrate that understanding how mobility behaviours have changed in response to Covid-19 varies considerably depending on how mobility is measured. We find a strong positive association between different mobility levels and the economic deprivation index, which demonstrates that inequities in the changes to mobility across economic gradients observed during the initial lockdown have persisted into the later stages of the pandemic. However, the associations between mobility and other socio-economic indicators vary over time. We capture a strong day-of-week pattern of association between socio-economic indicators and mobility levels. Our findings have important implications for understanding if and how mobility data should be used to study the impact of non-pharmaceutical interventions on the socio-economic conditions across geographical space, and over time. Our results support that Covid-19 non-pharmaceutical interventions have resulted in geographically disparate responses to mobility behaviour, and quantifying mobility changes at fine geographical scales is crucial to understanding the impacts of Covid-19 on local populations.",TRUE,FALSE,Covid-19|Mobility,2021-02-10T18:31:02.387981,NA,,TRUE,accepted,2021-02-10T18:30:36.007645,FALSE,NA,no,NA,,no,NA,,,5a8c80f7c698300375c76d84|5a8c80f7c698300375c76d86|5a8c80f7c698300375c76d88|Social and Behavioral Sciences|Geography|Geographic Information Sciences|5a8c80f7c698300375c76d84|5a8c80f7c698300375c76d86|5a8c80f7c698300375c76d8d|Social and Behavioral Sciences|Geography|Spatial Science|5a8c80f7c698300375c76d84|5a8c80f7c698300375c76d8e|Social and Behavioral Sciences|International and Area Studies|5a8c80f7c698300375c76d84|5a8c80f9c698300375c76e0c|Social and Behavioral Sciences|Social Statistics,,2021,https://api.osf.io/v2/preprints/tca34/contributors/,https://api.osf.io/v2/preprints/tca34/bibliographic_contributors/,https://api.osf.io/v2/preprints/tca34/citation/,tca34,preprints,https://api.osf.io/v2/preprints/tca34/identifiers/,NA,https://api.osf.io/v2/preprints/tca34/relationships/node/,NA,NA,https://api.osf.io/v2/licenses/563c1cf88c5e4a3877f9e96a/,563c1cf88c5e4a3877f9e96a,licenses,https://api.osf.io/v2/providers/preprints/socarxiv/,socarxiv,preprint-providers,https://api.osf.io/v2/preprints/tca34/files/,https://api.osf.io/v2/files/6022eefa23238300949dac19/,6022eefa23238300949dac19,files,https://api.osf.io/v2/preprints/tca34/review_actions/,https://api.osf.io/v2/preprints/tca34/requests/,https://api.osf.io/v2/preprints/tca34/,https://osf.io/preprints/socarxiv/tca34/,NA,https://doi.org/10.31235/osf.io/tca34
thx4j,preprints,2021-02-09T16:32:07.177116,2021-02-12T06:36:32.518177,2021-02-12T06:35:40.609257,NA,NA,A method for evaluating global university rankings,"Describes a method to provide an independent, community-sourced set of best practice criteria with which to assess global university rankings and to identify the extent to which a sample of six rankings, Academic Ranking of World Universities (ARWU), CWTS Leiden, QS World University Rankings (QS WUR), Times Higher Education World University Rankings (THE WUR), U-Multirank, and US News &amp; World Report Best Global Universities, met those criteria. The criteria fell into four categories: good governance, transparency, measure what matters, and rigour. The relative strengths and weaknesses of each ranking were compared. Overall, the rankings assessed fell short of all criteria, with greatest strengths in the area of transparency and greatest weaknesses in the area of measuring what matters to the communities they were ranking. The ranking that most closely met the criteria was CWTS Leiden. Scoring poorly across all the criteria were the THE WUR and US News rankings. Suggestions for developing the ranker rating method are described.",TRUE,FALSE,Research evaluation|Responsible metrics|University Rankings,2021-02-12T06:36:32.488364,NA,,TRUE,accepted,2021-02-12T06:35:40.609257,FALSE,NA,available,NA,https://osf.io/mykud/,no,NA,,,5a8c80f7c698300375c76d84|5a8c80f9c698300375c76df4|Social and Behavioral Sciences|Science and Technology Studies,,2021,https://api.osf.io/v2/preprints/thx4j/contributors/,https://api.osf.io/v2/preprints/thx4j/bibliographic_contributors/,https://api.osf.io/v2/preprints/thx4j/citation/,thx4j,preprints,https://api.osf.io/v2/preprints/thx4j/identifiers/,https://api.osf.io/v2/nodes/mykud/,https://api.osf.io/v2/preprints/thx4j/relationships/node/,mykud,nodes,https://api.osf.io/v2/licenses/5ad7979bc69830002d8190e3/,5ad7979bc69830002d8190e3,licenses,https://api.osf.io/v2/providers/preprints/socarxiv/,socarxiv,preprint-providers,https://api.osf.io/v2/preprints/thx4j/files/,https://api.osf.io/v2/files/6022b90bd6a432007df0eadf/,6022b90bd6a432007df0eadf,files,https://api.osf.io/v2/preprints/thx4j/review_actions/,https://api.osf.io/v2/preprints/thx4j/requests/,https://api.osf.io/v2/preprints/thx4j/,https://osf.io/preprints/socarxiv/thx4j/,NA,https://doi.org/10.31235/osf.io/thx4j
