id,type,attributes.date_created,attributes.date_modified,attributes.date_published,attributes.original_publication_date,attributes.doi,attributes.title,attributes.description,attributes.is_published,attributes.is_preprint_orphan,attributes.tags,attributes.preprint_doi_created,attributes.date_withdrawn,attributes.current_user_permissions,attributes.public,attributes.reviews_state,attributes.date_last_transitioned,attributes.has_coi,attributes.conflict_of_interest_statement,attributes.has_data_links,attributes.why_no_data,attributes.data_links,attributes.has_prereg_links,attributes.why_no_prereg,attributes.prereg_links,attributes.prereg_link_info,attributes.subjects,attributes.license_record.copyright_holders,attributes.license_record.year,relationships.contributors.links.related.href,relationships.bibliographic_contributors.links.related.href,relationships.citation.links.related.href,relationships.citation.data.id,relationships.citation.data.type,relationships.identifiers.links.related.href,relationships.node.links.self.href,relationships.license.links.related.href,relationships.license.data.id,relationships.license.data.type,relationships.provider.links.related.href,relationships.provider.data.id,relationships.provider.data.type,relationships.files.links.related.href,relationships.primary_file.links.related.href,relationships.primary_file.data.id,relationships.primary_file.data.type,relationships.review_actions.links.related.href,relationships.requests.links.related.href,links.self,links.html,links.doi,links.preprint_doi
p8qzc,preprints,2020-06-14T05:07:17.576429,2020-06-14T11:09:00.637240,2020-06-14T11:08:45.162943,NA,10.24093/awej/vol11no1.17,"Difficulties Encountering Multileveled Classes Teachers' in Teaching Reading Comprehension (A case study of Cambridge Training Centers and British Educational Institutes in Khartoum State, Sudan)","The study aims at investigating the difficulties encountered by English centers teachers of multileveled classes in teaching reading comprehension, and suggests some suitable strategies that can alleviate the problems. To run the study, thirty-four language center teachers' from Khartoum State are the sample of the study. A questionnaire, supported by classroom observation, was the collecting data tool. The quantitative method matches this type of research. The findings of the study reveal that the difficulties encountered by multileveled classes teachers' attributed to the students' limited vocabulary, poor background knowledge, annoying reading materials, lack of teachers' training, and adverse selection of suitable strategies. The findings of this study are of high value for syllables designers as well as multileveled classes’teachers. Teachers have to adopt adequate strategies, choosing attractive reading materials, and they should be equipped with the required training.",TRUE,FALSE,Center teachers|EFL students|multileveled classes|reading comprehension|reading difficulties,2020-06-14T11:09:00.622968,NA,,TRUE,accepted,2020-06-14T11:08:45.162943,FALSE,NA,not_applicable,NA,,NA,NA,NA,NA,5a8c80f2c698300375c76c7d|5a8c80f5c698300375c76d10|Arts and Humanities|English Language and Literature,,2020,https://api.osf.io/v2/preprints/p8qzc/contributors/,https://api.osf.io/v2/preprints/p8qzc/bibliographic_contributors/,https://api.osf.io/v2/preprints/p8qzc/citation/,p8qzc,preprints,https://api.osf.io/v2/preprints/p8qzc/identifiers/,https://api.osf.io/v2/preprints/p8qzc/relationships/node/,https://api.osf.io/v2/licenses/563c1cf88c5e4a3877f9e96a/,563c1cf88c5e4a3877f9e96a,licenses,https://api.osf.io/v2/providers/preprints/socarxiv/,socarxiv,preprint-providers,https://api.osf.io/v2/preprints/p8qzc/files/,https://api.osf.io/v2/files/5ee5b08a44eab500a35250e3/,5ee5b08a44eab500a35250e3,files,https://api.osf.io/v2/preprints/p8qzc/review_actions/,https://api.osf.io/v2/preprints/p8qzc/requests/,https://api.osf.io/v2/preprints/p8qzc/,https://osf.io/preprints/socarxiv/p8qzc/,https://doi.org/10.24093/awej/vol11no1.17,https://doi.org/10.31235/osf.io/p8qzc
xd7te,preprints,2020-06-14T05:03:59.507810,2020-06-14T11:09:20.654401,2020-06-14T11:08:57.877084,NA,10.24093/awej/vol11no1.16,The Detective and Sensation Fiction of Wilkie Collins: A Computational Lexical-Semantic Analysis,"Theme and genre classifications in the works of Wilkie Collins (1824-89) have been extensively investigated using different literary approaches; these are usually based on textual content and biographical considerations. Different critics place Collins’ works under the two main headings of detective fiction and sensation fiction. Such analyses have been generated by what is referred to as the ‘philological method’; that is, by an individual critic’s reading of the relevant material and their intuitive abstraction of generalizations from that reading. A problem with such an approach is that it is not objective, and it is therefore unreliable. The research question is thus asked in response to the subjectivity of previous genre classifications of the novels of Wilkie Collins and the lack of agreement among literary critics and researchers about such classifications. As such, I ask whether an objective and conceptually useful reading of the themes and subjects of Wilkie Collins’ prose fiction texts can be developed. As thus, computational lexical-semantics is suggested to understand the issues of thematic classification. For this purpose, vector space clustering (VSC) was used for capturing the lexical-semantic features of his novels and linking them explicitly to the relevant themes and genres. It is suggested that through this method, an objective, replicable, and reliable genre classification of Collins’ novels is possible. The results of this study can serve as a basis for future studies and criticisms of Wilkie Collins’ fiction.",TRUE,FALSE,,2020-06-14T11:09:20.635959,NA,,TRUE,accepted,2020-06-14T11:08:57.877084,FALSE,NA,not_applicable,NA,,NA,NA,NA,NA,5a8c80f2c698300375c76c7d|5a8c80f5c698300375c76d10|Arts and Humanities|English Language and Literature,,2020,https://api.osf.io/v2/preprints/xd7te/contributors/,https://api.osf.io/v2/preprints/xd7te/bibliographic_contributors/,https://api.osf.io/v2/preprints/xd7te/citation/,xd7te,preprints,https://api.osf.io/v2/preprints/xd7te/identifiers/,https://api.osf.io/v2/preprints/xd7te/relationships/node/,https://api.osf.io/v2/licenses/563c1cf88c5e4a3877f9e96a/,563c1cf88c5e4a3877f9e96a,licenses,https://api.osf.io/v2/providers/preprints/socarxiv/,socarxiv,preprint-providers,https://api.osf.io/v2/preprints/xd7te/files/,https://api.osf.io/v2/files/5ee5afc4a777b700b4ab2df8/,5ee5afc4a777b700b4ab2df8,files,https://api.osf.io/v2/preprints/xd7te/review_actions/,https://api.osf.io/v2/preprints/xd7te/requests/,https://api.osf.io/v2/preprints/xd7te/,https://osf.io/preprints/socarxiv/xd7te/,https://doi.org/10.24093/awej/vol11no1.16,https://doi.org/10.31235/osf.io/xd7te
aw48q,preprints,2020-06-14T05:00:42.083048,2020-06-14T11:09:20.697577,2020-06-14T11:09:13.691469,NA,10.24093/awej/vol11no1.15,Investigating Teachers’ Perceptions of the Influence of Professional Development on Teachers’ Performance and Career Progression,"Understanding a process is the key to maximizing the outcomes of such a process; teachers’ professional development (PD) can be further facilitated through fully apprehending the process by which they grow professionally and the factors that contribute to such growth.  In this study, the author intends to explore the relationship between a school environment and teachers’ readiness for PD as well as how they perceive of the impact of PD on their professional and personal qualities, students’ performance, teachers’ career progression, and commitment to the job and workplace. The author administered semi-structured interviews with three English as a Second Language (ESL) teachers who are in their mid-career stage and work for private, American curriculum-based schools in Dubai. The results show that all three interviewees admit the positive influence of PD on their professional performance, personal qualities, students’ outcomes, career progression and commitment to the profession. How a progressive school culture would impact teachers’ inclination towards PD has also been brought to attention by the interviewees as a critical aspect. As potential areas of research on PD, it is recommended that students’ academic performance is to be looked into closely through examining their assessment results in order to muster tangible evidence on the significance of teachers’ PD. Also, a conversation analysis of classroom discourse following a number of classroom observations of teachers in different career stages would be another informative research method to investigate the impact of PD on teachers’ performance and on classroom dynamics.",TRUE,FALSE,career progression|differentiated professional development|professional development|school culture|teacher’s commitment,2020-06-14T11:09:20.684241,NA,,TRUE,accepted,2020-06-14T11:09:13.691469,FALSE,NA,not_applicable,NA,,NA,NA,NA,NA,5a8c80f2c698300375c76c7d|5a8c80f5c698300375c76d10|Arts and Humanities|English Language and Literature,,2020,https://api.osf.io/v2/preprints/aw48q/contributors/,https://api.osf.io/v2/preprints/aw48q/bibliographic_contributors/,https://api.osf.io/v2/preprints/aw48q/citation/,aw48q,preprints,https://api.osf.io/v2/preprints/aw48q/identifiers/,https://api.osf.io/v2/preprints/aw48q/relationships/node/,https://api.osf.io/v2/licenses/563c1cf88c5e4a3877f9e96a/,563c1cf88c5e4a3877f9e96a,licenses,https://api.osf.io/v2/providers/preprints/socarxiv/,socarxiv,preprint-providers,https://api.osf.io/v2/preprints/aw48q/files/,https://api.osf.io/v2/files/5ee5aeffa777b700b4ab2d26/,5ee5aeffa777b700b4ab2d26,files,https://api.osf.io/v2/preprints/aw48q/review_actions/,https://api.osf.io/v2/preprints/aw48q/requests/,https://api.osf.io/v2/preprints/aw48q/,https://osf.io/preprints/socarxiv/aw48q/,https://doi.org/10.24093/awej/vol11no1.15,https://doi.org/10.31235/osf.io/aw48q
kjdzf,preprints,2020-06-14T04:55:52.241744,2020-06-14T11:10:16.483025,2020-06-14T11:09:39.956435,NA,10.24093/awej/vol11no1.14,Investigating the Use of Language in Islam-related News: Evidence  from Selected Non-Western Online Newspapers,"The manner in which language is utilized in reporting Islam is disheartening. This is because sensationalized language, especially in the news media, could reinforce negative stereotypes. As such, those who rely on the media to understand Islam are likely to develop negative preconceptions about the religion. This study aims to investigate how the non-western online newspapers use language in news coverage of Islam. Content analysis was used to collect and analyze the data. Using purposive sampling, Punch and Vanguard were selected from Nigeria while The Star and New Straits Times were selected from Malaysia. A total of 599 Islam-related news articles were collected from the selected newspapers using internet-based search from November 2015 until September 2016. The findings showed that almost half of the overall Islam-related articles conveyed negative tone toward Islam while very few conveyed positive tone. This shows that the language used in news coverage of Islam is inappropriate and sensational. Hence, there is a need to enhance the reporters’ knowledge and writing skills through inter-media exchange program, exposure to different religious, social and cultural lives, workshops, seminars, conferences, as well as sensitivity training and retraining on reporting religions.",TRUE,FALSE,media language|news articles|newspapers|non-western media|sensationalism,2020-06-14T11:10:16.469542,NA,,TRUE,accepted,2020-06-14T11:09:39.956435,FALSE,NA,not_applicable,NA,,NA,NA,NA,NA,5a8c80f2c698300375c76c7d|5a8c80f5c698300375c76d10|Arts and Humanities|English Language and Literature,,2020,https://api.osf.io/v2/preprints/kjdzf/contributors/,https://api.osf.io/v2/preprints/kjdzf/bibliographic_contributors/,https://api.osf.io/v2/preprints/kjdzf/citation/,kjdzf,preprints,https://api.osf.io/v2/preprints/kjdzf/identifiers/,https://api.osf.io/v2/preprints/kjdzf/relationships/node/,https://api.osf.io/v2/licenses/563c1cf88c5e4a3877f9e96a/,563c1cf88c5e4a3877f9e96a,licenses,https://api.osf.io/v2/providers/preprints/socarxiv/,socarxiv,preprint-providers,https://api.osf.io/v2/preprints/kjdzf/files/,https://api.osf.io/v2/files/5ee5addd44eab500a65256ea/,5ee5addd44eab500a65256ea,files,https://api.osf.io/v2/preprints/kjdzf/review_actions/,https://api.osf.io/v2/preprints/kjdzf/requests/,https://api.osf.io/v2/preprints/kjdzf/,https://osf.io/preprints/socarxiv/kjdzf/,https://doi.org/10.24093/awej/vol11no1.14,https://doi.org/10.31235/osf.io/kjdzf
evm38,preprints,2020-06-14T04:51:28.649658,2020-06-14T11:11:22.181589,2020-06-14T11:10:19.905327,NA,10.24093/awej/vol11no1.13,Discourse Markers in Arabic and English Newspaper Articles: The Case of the Arabic Lakin and its English equivalent But,"Discourse markers, as words or phrases, play a significant role in promoting coherent segments of discourse. This paper investigates the use of discourse markers (DMs) in newspaper articles. By applying Fraser’s framework, this study aims at investigating the functions and positions of DM but (English) and its equivalent lakin (Arabic) in newspaper articles written by native and non-native speakers of English and Saudi and Egyptian speakers of Arabic. It also highlights the similarities and differences in the functions and positions of DMs but and lakin. This quantitative study adopts a corpus-based approach. The data consist of articles collected from 12 newspapers categorized as: Arabic language newspapers published in Saudi Arabia (Alriyadh, Al Jazirah, Al-Hayat) and Egypt (Al-Ahram, Al-Gomhuria, Eltahrir) and English language newspapers published in Saudi Arabia (Arab News, Saudi Gazette, Asharq Al-Awsat) and the USA (Washington Post, The New York Times, USA TODAY).  Findings demonstrate, first, that DM but is used frequently as a confirmation or addition marker by both native and non-native speakers. However, second, lakin, functions as the primary correction DM in standard Arabic. Moreover, third, the native Arabic speakers mostly share the same functions of using lakin despite different dialects they have. This study also reveals that lakin can be found only in the medial position, whereas, but is found in the initial and medial position. It concludes that DMs but and lakin evidence that functions of DMs proposed by Fraser are universal and they could be generalized.",TRUE,FALSE,Arabic and English newspaper articles|but|discourse markers|functions and positions|lakin,2020-06-14T11:11:22.164733,NA,,TRUE,accepted,2020-06-14T11:10:19.905327,FALSE,NA,not_applicable,NA,,NA,NA,NA,NA,5a8c80f2c698300375c76c7d|5a8c80f5c698300375c76d10|Arts and Humanities|English Language and Literature,,2020,https://api.osf.io/v2/preprints/evm38/contributors/,https://api.osf.io/v2/preprints/evm38/bibliographic_contributors/,https://api.osf.io/v2/preprints/evm38/citation/,evm38,preprints,https://api.osf.io/v2/preprints/evm38/identifiers/,https://api.osf.io/v2/preprints/evm38/relationships/node/,https://api.osf.io/v2/licenses/563c1cf88c5e4a3877f9e96a/,563c1cf88c5e4a3877f9e96a,licenses,https://api.osf.io/v2/providers/preprints/socarxiv/,socarxiv,preprint-providers,https://api.osf.io/v2/preprints/evm38/files/,https://api.osf.io/v2/files/5ee5acd6a777b700b1ab3da7/,5ee5acd6a777b700b1ab3da7,files,https://api.osf.io/v2/preprints/evm38/review_actions/,https://api.osf.io/v2/preprints/evm38/requests/,https://api.osf.io/v2/preprints/evm38/,https://osf.io/preprints/socarxiv/evm38/,https://doi.org/10.24093/awej/vol11no1.13,https://doi.org/10.31235/osf.io/evm38
g5kst,preprints,2020-06-14T04:48:06.361787,2020-06-14T11:11:34.834935,2020-06-14T11:10:35.761991,NA,10.24093/awej/vol11no1.12,The Effect of Semantic Mapping and Question Generation Teaching Strategies on English as a Second Language Tertiary Students’ Reading achievement,"This study aimed at investigating the effect of two strategies of teaching reading: ‘semantic mapping’ and  ‘question generation’ on the reading achievement of a sample of 40 female students enrolling in two classes in Level 2 English as a Second Language Foundation Program at the Community College of Qatar. The researcher of the current study tried to find ways to help solve the problems of students’ low achievement in reading comprehension tests.   Convenient sampling was used to select the two classes as the researcher herself was teaching them. The two classes of 20 students each constituted two experimental groups. One class was taught by the semantic mapping strategy, and the other was taught by students’ question-generation strategy.  A pre-posttests design was used in both experimental groups.  T-test computed on the pretests in both classes revealed that the groups were equivalent. The researcher established the validity and reliability of all the components of the study: the pre-posttest and the instructional material.  The instructional material selected for the intervention consisted of four extra expository texts, which are not written in students’ textbooks. After analyzing students’ results on the pre-post tests using two T-Test statistical analyses, it was found out that there were significant differences in the mean scores of each group on the pre-post tests, which reveals that each individual strategy has significantly influenced the group achievement.  In order to investigate which teaching strategy was significantly better than the other was a third T-test on the post-tests, mean scores in both groups were computed. The results were in favor of the experimental group, which was taught by the Semantic Mapping Strategy. In light of these findings, the researcher suggested several recommendations directed to ESL instructors, curricula designers, and researchers",TRUE,FALSE,Community College of Qatar|EFL students|Foundation Level|Question Generation|Semantic Maps,2020-06-14T11:11:34.800565,NA,,TRUE,accepted,2020-06-14T11:10:35.761991,FALSE,NA,not_applicable,NA,,NA,NA,NA,NA,5a8c80f2c698300375c76c7d|5a8c80f5c698300375c76d10|Arts and Humanities|English Language and Literature,,2020,https://api.osf.io/v2/preprints/g5kst/contributors/,https://api.osf.io/v2/preprints/g5kst/bibliographic_contributors/,https://api.osf.io/v2/preprints/g5kst/citation/,g5kst,preprints,https://api.osf.io/v2/preprints/g5kst/identifiers/,https://api.osf.io/v2/preprints/g5kst/relationships/node/,https://api.osf.io/v2/licenses/563c1cf88c5e4a3877f9e96a/,563c1cf88c5e4a3877f9e96a,licenses,https://api.osf.io/v2/providers/preprints/socarxiv/,socarxiv,preprint-providers,https://api.osf.io/v2/preprints/g5kst/files/,https://api.osf.io/v2/files/5ee5ac0ca777b700b5ab2a80/,5ee5ac0ca777b700b5ab2a80,files,https://api.osf.io/v2/preprints/g5kst/review_actions/,https://api.osf.io/v2/preprints/g5kst/requests/,https://api.osf.io/v2/preprints/g5kst/,https://osf.io/preprints/socarxiv/g5kst/,https://doi.org/10.24093/awej/vol11no1.12,https://doi.org/10.31235/osf.io/g5kst
7uvkr,preprints,2020-06-14T04:44:47.089926,2020-06-14T11:11:39.767578,2020-06-14T11:10:54.221979,NA,10.24093/awej/vol11no1.11,The Challenges and Prospects of Using E-learning among EFL Students in Bisha University,"This study attempts to find out the challenges students' face in learning English as a foreign language when using E-learning system at University of Bisha. It also investigates whether using E-learning is beneficial to EFL students in their learning English to the degree anticipated. There are many challenges face both teachers and students during use E-learning. These challenges include academic, technological; and administrative challenges. The study sample included 36 teaching staff and 261 EFL students at University of Bisha - English department. To collect data required, the researcher developed questionnaires that consist of three domains for both teaching staff and students separately. The study results show that there are no significant differences between EFL students (males and females) of E-learning activities. Therefore, it argued that all domains of teaching staff and students' challenges could not predict academic achievement. The findings reveal that some factors such as academic, administrative, and technical challenges regarding E-learning were the main challenges of E-learning at University of Bisha. The results also show that students aware of the benefits of using E-learning. They perceive themselves as having a highly positive attitude towards E-learning in English. However, the main advantage can be used anywhere, anytime, and the E-learning system can adapt to the aims of improving communication and enriching students' learning experiences",TRUE,FALSE,and Prospects|Challenges|E-learning|English as Foreign Language|Information &amp; Communication Technology,2020-06-14T11:11:39.740291,NA,,TRUE,accepted,2020-06-14T11:10:54.221979,FALSE,NA,not_applicable,NA,,NA,NA,NA,NA,5a8c80f2c698300375c76c7d|5a8c80f5c698300375c76d10|Arts and Humanities|English Language and Literature,,2020,https://api.osf.io/v2/preprints/7uvkr/contributors/,https://api.osf.io/v2/preprints/7uvkr/bibliographic_contributors/,https://api.osf.io/v2/preprints/7uvkr/citation/,7uvkr,preprints,https://api.osf.io/v2/preprints/7uvkr/identifiers/,https://api.osf.io/v2/preprints/7uvkr/relationships/node/,https://api.osf.io/v2/licenses/563c1cf88c5e4a3877f9e96a/,563c1cf88c5e4a3877f9e96a,licenses,https://api.osf.io/v2/providers/preprints/socarxiv/,socarxiv,preprint-providers,https://api.osf.io/v2/preprints/7uvkr/files/,https://api.osf.io/v2/files/5ee5ab45a777b700abab71d0/,5ee5ab45a777b700abab71d0,files,https://api.osf.io/v2/preprints/7uvkr/review_actions/,https://api.osf.io/v2/preprints/7uvkr/requests/,https://api.osf.io/v2/preprints/7uvkr/,https://osf.io/preprints/socarxiv/7uvkr/,https://doi.org/10.24093/awej/vol11no1.11,https://doi.org/10.31235/osf.io/7uvkr
yk8ca,preprints,2020-06-14T04:40:59.892333,2020-06-14T11:11:41.165245,2020-06-14T11:11:11.951197,NA,10.24093/awej/vol11no1.10,EFL Teachers’ Attitudes towards the Use of Mobile Devices in Learning English at A University in Vietnam,"Among the sharp development of modern technology, mobile learning (M-learning) appears as the significantmark of technological revolution 4.0. It has seen that the exponential expansionof mobile devices accompanied their smart functions to support learners’ learning everywhere and every time. Thus, mobile-assisted language learning (MALL) is believed to serve learners' English knowledge. Although learning through mobile devices is expected to apply appropriately toteaching and learning, teachers’attitudestowardsmobile learning needto be assessedseriously. This writing is to present EFL learners’ psychological preparation to perceive English mobile learning application at University X through a survey on 69 EFL teachers byquestionnaire,including tenstatements within 10 minutes. The investigationis carried out in the second semester of the school year 2018-2019. The qualitative approach was used to collect and analyze data, and findings showed that teachers have positive attitudes towards M-learning and its application at University X can be accepted firmly.",TRUE,FALSE,attitude|mobile learning|Vietnam EFL students,2020-06-14T11:11:41.151427,NA,,TRUE,accepted,2020-06-14T11:11:11.951197,FALSE,NA,not_applicable,NA,,NA,NA,NA,NA,5a8c80f2c698300375c76c7d|5a8c80f5c698300375c76d10|Arts and Humanities|English Language and Literature,,2020,https://api.osf.io/v2/preprints/yk8ca/contributors/,https://api.osf.io/v2/preprints/yk8ca/bibliographic_contributors/,https://api.osf.io/v2/preprints/yk8ca/citation/,yk8ca,preprints,https://api.osf.io/v2/preprints/yk8ca/identifiers/,https://api.osf.io/v2/preprints/yk8ca/relationships/node/,https://api.osf.io/v2/licenses/563c1cf88c5e4a3877f9e96a/,563c1cf88c5e4a3877f9e96a,licenses,https://api.osf.io/v2/providers/preprints/socarxiv/,socarxiv,preprint-providers,https://api.osf.io/v2/preprints/yk8ca/files/,https://api.osf.io/v2/files/5ee5aa6236a16d0096e9bbf6/,5ee5aa6236a16d0096e9bbf6,files,https://api.osf.io/v2/preprints/yk8ca/review_actions/,https://api.osf.io/v2/preprints/yk8ca/requests/,https://api.osf.io/v2/preprints/yk8ca/,https://osf.io/preprints/socarxiv/yk8ca/,https://doi.org/10.24093/awej/vol11no1.10,https://doi.org/10.31235/osf.io/yk8ca
