id,type,attributes.date_created,attributes.date_modified,attributes.date_published,attributes.original_publication_date,attributes.doi,attributes.title,attributes.description,attributes.is_published,attributes.is_preprint_orphan,attributes.tags,attributes.preprint_doi_created,attributes.date_withdrawn,attributes.current_user_permissions,attributes.public,attributes.reviews_state,attributes.date_last_transitioned,attributes.has_coi,attributes.conflict_of_interest_statement,attributes.has_data_links,attributes.why_no_data,attributes.data_links,attributes.has_prereg_links,attributes.why_no_prereg,attributes.prereg_links,attributes.prereg_link_info,attributes.subjects,attributes.license_record.copyright_holders,attributes.license_record.year,relationships.contributors.links.related.href,relationships.bibliographic_contributors.links.related.href,relationships.citation.links.related.href,relationships.citation.data.id,relationships.citation.data.type,relationships.identifiers.links.related.href,relationships.node.links.self.href,relationships.node.links.related.href,relationships.node.data.id,relationships.node.data.type,relationships.license.links.related.href,relationships.license.data.id,relationships.license.data.type,relationships.provider.links.related.href,relationships.provider.data.id,relationships.provider.data.type,relationships.files.links.related.href,relationships.primary_file.links.related.href,relationships.primary_file.data.id,relationships.primary_file.data.type,relationships.review_actions.links.related.href,relationships.requests.links.related.href,links.self,links.html,links.preprint_doi,links.doi
fs9jy,preprints,2020-10-01T08:31:21.872941,2020-10-02T07:25:46.841459,2020-10-02T07:25:24.035747,NA,NA,Professional networking by gender: A case study on LinkedIn contacts for a professor in science,"In this study, we used data from LinkedIn networks to gain insight in how different groups network in terms of network size and gender composition among men and women. We have gathered categorical data from 751 LinkedIn networks to quantitatively analyze networking tendencies and network gender compositions in the categories gender, age, sector of work, fi?eld of work, level of education and area of residence. We have also determined networking ""savviness"" as a quantitative measure of social networking for comparing groups in the categories. The observations made regarding networking behavior among female and male LinkedIn users include that women on average had more female contacts than men in all categories. Female networks working in a non-technical fi?eld were found to have the most gender equal networks of all groups with an average of 42.5% female contacts. The data show further, that men and women in STEM and the private sector were savvier networkers and that users with a PhD had fewer female contacts on average than those without a PhD. Further, Scandinavian networks had signi?cantly more female contacts in their networks than networks from other European countries and North America had.",TRUE,FALSE,gender equality|professional networking|social communication|social media|social networks,2020-10-02T07:25:46.821615,NA,,TRUE,accepted,2020-10-02T07:25:24.035747,FALSE,NA,no,Contact the authors at markus.snellman@gmail.com to request the data.,,no,NA,,,"5a8c80f7c698300375c76d84|5a8c80f9c698300375c76e0c|Social and Behavioral Sciences|Social Statistics|5a8c80f7c698300375c76d84|5a8c80f9c698300375c76e0d|5a8c80f9c698300375c76e0f|Social and Behavioral Sciences|Communication|Communication Technology and New Media|5a8c80f7c698300375c76d84|5a8c80f9c698300375c76e0d|5a8c80f9c698300375c76e18|Social and Behavioral Sciences|Communication|Social Media|5a8c80f7c698300375c76d84|5a8c80f9c698300375c76e0d|5a8c80f9c698300375c76e19|Social and Behavioral Sciences|Communication|Gender, Race, Sexuality, and Ethnicity in Communication",Anders Lindh Olsson|Markus Snellman|Knut Deppert|Inger Lövkrona,2020,https://api.osf.io/v2/preprints/fs9jy/contributors/,https://api.osf.io/v2/preprints/fs9jy/bibliographic_contributors/,https://api.osf.io/v2/preprints/fs9jy/citation/,fs9jy,preprints,https://api.osf.io/v2/preprints/fs9jy/identifiers/,https://api.osf.io/v2/preprints/fs9jy/relationships/node/,NA,NA,NA,https://api.osf.io/v2/licenses/5ad7979bc69830002d8190e3/,5ad7979bc69830002d8190e3,licenses,https://api.osf.io/v2/providers/preprints/socarxiv/,socarxiv,preprint-providers,https://api.osf.io/v2/preprints/fs9jy/files/,https://api.osf.io/v2/files/5f7593e11cfe6900c2cf4f04/,5f7593e11cfe6900c2cf4f04,files,https://api.osf.io/v2/preprints/fs9jy/review_actions/,https://api.osf.io/v2/preprints/fs9jy/requests/,https://api.osf.io/v2/preprints/fs9jy/,https://osf.io/preprints/socarxiv/fs9jy/,https://doi.org/10.31235/osf.io/fs9jy,NA
xrf3t,preprints,2020-10-01T07:13:57.112832,2020-11-17T05:37:44.801308,2020-10-02T07:24:17.334573,NA,NA,Bread-in-pandemic voting: forecasting the 2020 United States presidential election with the Bread and Peace model,"The Bread and Peace model of US presidential elections estimates `VOTE`, the incumbent’s party’s share of the major-party vote, as a function of rates of personal-income growth and military fatalities during the incumbent president’s term. I replicate past work fitting the model to elections since 1952, confirming that income growth and war deaths account for most variation in VOTE. Using data available as of the end of October, I then develop 5 income-growth forecasts for Donald Trump’s presidential term and use them to forecast Trump’s share of the two-party vote in the 2020 election. My 5 forecasts range from 49.3% to 56.1% with a mean of 53.0%, notably higher than final polling averages of 45.6%–46.2% and a preliminary election result of 48%. An idiosyncratic factor such as the sitting president’s impeachment might account for the model overrating Donald Trump’s popular-vote performance.",TRUE,FALSE,2020 election|Bread and Peace|Democratic Party|electoral politics|presidency|presidential vote|Republican Party|voting behaviour,2020-10-02T07:25:01.707391,NA,,TRUE,accepted,2020-10-02T07:24:17.334573,FALSE,NA,available,NA,https://catalog.archives.gov/id/4734832|https://catalog.archives.gov/id/4734834|http://icasualties.org/|https://fred.stlouisfed.org/series/B230RC0Q173SBEA|https://fred.stlouisfed.org/series/A229RX0|https://fred.stlouisfed.org/series/A229RX0Q048SBEA|https://fred.stlouisfed.org/series/W875RX1|https://uselectionatlas.org/RESULTS/,no,,,,5a8c80f7c698300375c76d84|5a8c80f8c698300375c76daf|5a8c80f8c698300375c76db1|Social and Behavioral Sciences|Political Science|Models and Methods|5a8c80f7c698300375c76d84|5a8c80f8c698300375c76daf|5a8c80f8c698300375c76db5|Social and Behavioral Sciences|Political Science|American Politics,,2020,https://api.osf.io/v2/preprints/xrf3t/contributors/,https://api.osf.io/v2/preprints/xrf3t/bibliographic_contributors/,https://api.osf.io/v2/preprints/xrf3t/citation/,xrf3t,preprints,https://api.osf.io/v2/preprints/xrf3t/identifiers/,https://api.osf.io/v2/preprints/xrf3t/relationships/node/,https://api.osf.io/v2/nodes/p6734/,p6734,nodes,https://api.osf.io/v2/licenses/563c1cf88c5e4a3877f9e96c/,563c1cf88c5e4a3877f9e96c,licenses,https://api.osf.io/v2/providers/preprints/socarxiv/,socarxiv,preprint-providers,https://api.osf.io/v2/preprints/xrf3t/files/,https://api.osf.io/v2/files/5f7581b81cfe6900b0cefd24/,5f7581b81cfe6900b0cefd24,files,https://api.osf.io/v2/preprints/xrf3t/review_actions/,https://api.osf.io/v2/preprints/xrf3t/requests/,https://api.osf.io/v2/preprints/xrf3t/,https://osf.io/preprints/socarxiv/xrf3t/,https://doi.org/10.31235/osf.io/xrf3t,NA
wd23b,preprints,2020-09-30T17:46:25.333840,2020-10-01T00:40:00.751364,2020-10-01T00:39:52.241544,2014-04-01T07:00:00,10.1177/0891243213508308,“They Always Call Me an Investment”: Gendered Familism and Latino/a College Pathways,"In the past 20 years, Latinas have begun to outperform Latinos in high school completion
and college enrollment, tracking the overall “gender reversal” in college attainment that
favors women. Few studies have examined what factors contribute to Latinas’ increasing
educational success. This article focuses on gender differences in college-going behavior
among a cohort of 50 Latino/a college aspirants in the San Francisco East Bay Area.
Through 136 longitudinal interviews, I examine trends in Latinos/as’ postsecondary pathways
and life course decisions over a two-year period. Findings suggest evidence for
gendered familism, in which gender and racial/ethnic beliefs intersect to differentially
shape Latinos/as’ attitudes, behaviors, and college choices. Gendered familism encouraged
Latinas to seek a four-year degree as a means of earning independence, while
Latinos expressed a sense of automatic autonomy that was not as strongly tied to educational
outcomes.",TRUE,FALSE,gender|higher education|Latino/a studies|Latinx Studies|qualitative|race/ethnicity,2020-10-01T00:40:00.733199,NA,,TRUE,accepted,2020-10-01T00:39:52.241544,FALSE,NA,no,NA,,no,NA,,,"5a8c80f7c698300375c76d84|5a8c80fac698300375c76e20|5a8c80fac698300375c76e26|Social and Behavioral Sciences|Sociology|Sociology of Education|5a8c80f7c698300375c76d84|5a8c80fac698300375c76e20|5a8c80fac698300375c76e2a|Social and Behavioral Sciences|Sociology|Racial and Ethnic Minorities|5a8c80f7c698300375c76d84|5a8c80fac698300375c76e20|5a8c80fac698300375c76e3d|Social and Behavioral Sciences|Sociology|Latina/o Sociology|5a8c80f7c698300375c76d84|5a8c80fac698300375c76e20|5a8c80fac698300375c76e44|Social and Behavioral Sciences|Sociology|Race, Gender, and Class|5a8c80f7c698300375c76d84|5a8c80fac698300375c76e20|5a8c80fac698300375c76e49|Social and Behavioral Sciences|Sociology|Sex and Gender",,2020,https://api.osf.io/v2/preprints/wd23b/contributors/,https://api.osf.io/v2/preprints/wd23b/bibliographic_contributors/,https://api.osf.io/v2/preprints/wd23b/citation/,wd23b,preprints,https://api.osf.io/v2/preprints/wd23b/identifiers/,https://api.osf.io/v2/preprints/wd23b/relationships/node/,NA,NA,NA,https://api.osf.io/v2/licenses/5ad7979bc69830002d8190e3/,5ad7979bc69830002d8190e3,licenses,https://api.osf.io/v2/providers/preprints/socarxiv/,socarxiv,preprint-providers,https://api.osf.io/v2/preprints/wd23b/files/,https://api.osf.io/v2/files/5f74c4751cfe690079cf111f/,5f74c4751cfe690079cf111f,files,https://api.osf.io/v2/preprints/wd23b/review_actions/,https://api.osf.io/v2/preprints/wd23b/requests/,https://api.osf.io/v2/preprints/wd23b/,https://osf.io/preprints/socarxiv/wd23b/,https://doi.org/10.31235/osf.io/wd23b,https://doi.org/10.1177/0891243213508308
6fwm8,preprints,2020-09-30T11:38:56.919107,2020-10-01T00:38:01.708083,2020-10-01T00:37:44.618769,NA,NA,Exploring Household Food Security and Malnutrition Risk with Psychosocial Indicators of Healthy Ageing in Place: The Food Train - Eat Well Age Well Partnership Project,"In Scotland, and United Kingdom, there are stark inequalities in the experience of older age, particularly for those with limited social contact, poorer health, located in deprived neighbourhoods (Centre for Ageing Better 2015). This mixed-methodology research, reports survey findings with n=169 community dwelling older adults in Scotland (average age 79.5), supported with qualitative interviews to evidence the underexplored connection between food insecurity and physiological risk indicators of undernutrition (malnutrition), with psychosocial indicators of healthy ageing.  Findings are grounded in collaboration with a third sector social enterprise – Food Train, who provide food shopping and volunteer meal making for those aged 65+.  Findings revealed correlations between food insecurity and early indicators of malnutrition risk with poorer wellbeing, and social connectedness. Supported food access mitigates the negative cycle of food insecurity on mental health, via empowerment (locus of control) over one’s life. Qualitative findings suggest that risks of food insecurity may not be financial (food poverty), or attributable to health realities associated with ageing. Rather, psychosocial health and wellbeing diverge as older adults attempt to draw upon available resources, reflective of their own social capital.  Mitigators of malnutrition risk includes empowerment through social care located in the third sector, as well as social aspects of food access e.g. social eating, warranting future investigation. These findings are considered post Covid-19, with key policy implications.",TRUE,FALSE,Active Ageing|Ageing in Place|Food Insecurity|Healthy Ageing|Malnutrition|Older Adult|Social Connections|Third Sector|Undernutrition|Wellbeing,2020-10-01T00:38:01.480403,NA,,TRUE,accepted,2020-10-01T00:37:44.618769,FALSE,NA,no,Please contact lead author for data access,,available,NA,https://osf.io/gvhwz/,prereg_designs,"5a8c80f0c698300375c76c07|5a8c80f1c698300375c76c34|Law|Human Rights Law|5a8c80f7c698300375c76d84|5a8c80f7c698300375c76d85|Social and Behavioral Sciences|Food Studies|5a8c80f7c698300375c76d84|5a8c80f7c698300375c76d98|5a8c80f7c698300375c76d9c|Social and Behavioral Sciences|Psychology|Community Psychology|5a8c80f7c698300375c76d84|5a8c80f7c698300375c76d98|5a8c80f8c698300375c76da4|Social and Behavioral Sciences|Psychology|Health Psychology|5a8c80f7c698300375c76d84|5a8c80f8c698300375c76ddb|5a8c80f9c698300375c76de0|Social and Behavioral Sciences|Public Affairs, Public Policy and Public Administration|Social Policy|5a8c80f7c698300375c76d84|5a8c80f8c698300375c76ddb|5a8c80f9c698300375c76de2|Social and Behavioral Sciences|Public Affairs, Public Policy and Public Administration|Health Policy",Kate Reid,2020,https://api.osf.io/v2/preprints/6fwm8/contributors/,https://api.osf.io/v2/preprints/6fwm8/bibliographic_contributors/,https://api.osf.io/v2/preprints/6fwm8/citation/,6fwm8,preprints,https://api.osf.io/v2/preprints/6fwm8/identifiers/,https://api.osf.io/v2/preprints/6fwm8/relationships/node/,https://api.osf.io/v2/nodes/d8eau/,d8eau,nodes,https://api.osf.io/v2/licenses/563c1cf88c5e4a3877f9e96a/,563c1cf88c5e4a3877f9e96a,licenses,https://api.osf.io/v2/providers/preprints/socarxiv/,socarxiv,preprint-providers,https://api.osf.io/v2/preprints/6fwm8/files/,https://api.osf.io/v2/files/5f746e76e64e7e005faaaffb/,5f746e76e64e7e005faaaffb,files,https://api.osf.io/v2/preprints/6fwm8/review_actions/,https://api.osf.io/v2/preprints/6fwm8/requests/,https://api.osf.io/v2/preprints/6fwm8/,https://osf.io/preprints/socarxiv/6fwm8/,https://doi.org/10.31235/osf.io/6fwm8,NA
cgevu,preprints,2020-09-30T09:03:59.236013,2021-03-26T13:24:12.579162,2020-10-01T00:38:57.823383,NA,NA,MEASURING SEXUAL VICTIMIZATION AND PERPETRATION IN TODAY’S SOCIETY: MODIFICATIONS TO THE SEXUAL EXPERIENCES SURVEY,"Sexual violence is a major public health problem that has received increasing scientific attention over the years. Prevalence rates, however, remain inconclusive due to inconsistencies in the applied definition of sexual violence. While the development of the Sexual Experiences Survey (SES) and its popular use among scholars already allowed for greater comparisons between studies, the latest revision dates back from 2006. In the meantime legal definitions have changed and other forms of sexual violence have become more prominent. This paper discusses changes made to the SES in the context of a large-scale national representative study regarding sexual violence among the Belgian population. The rationale indicated that changes to the SES may be necessary to increase its applicability in today’s society. The aim of this paper is to inform future scholars who wish to examine sexual violence and make similar changes, therefore allowing for greater comparability between studies. In addition, we aim to create a platform for future discussions and documentations of changes made to the SES that may eventually be used as a basis for future revisions of the SES tool.",TRUE,FALSE,comparability|measurement design|scale construction|SES-R|sexual assault|survey design,2020-10-01T00:39:20.818753,NA,,TRUE,accepted,2020-10-01T00:38:57.823383,FALSE,NA,no,Contact authors.,,not_applicable,NA,,,5a8c80f7c698300375c76d84|5a8c80f8c698300375c76db8|5a8c80f8c698300375c76dbb|Social and Behavioral Sciences|Legal Studies|Criminology and Criminal Justice,,2020,https://api.osf.io/v2/preprints/cgevu/contributors/,https://api.osf.io/v2/preprints/cgevu/bibliographic_contributors/,https://api.osf.io/v2/preprints/cgevu/citation/,cgevu,preprints,https://api.osf.io/v2/preprints/cgevu/identifiers/,https://api.osf.io/v2/preprints/cgevu/relationships/node/,NA,NA,NA,https://api.osf.io/v2/licenses/563c1cf88c5e4a3877f9e96a/,563c1cf88c5e4a3877f9e96a,licenses,https://api.osf.io/v2/providers/preprints/socarxiv/,socarxiv,preprint-providers,https://api.osf.io/v2/preprints/cgevu/files/,https://api.osf.io/v2/files/5f744a02e64e7e004daa916a/,5f744a02e64e7e004daa916a,files,https://api.osf.io/v2/preprints/cgevu/review_actions/,https://api.osf.io/v2/preprints/cgevu/requests/,https://api.osf.io/v2/preprints/cgevu/,https://osf.io/preprints/socarxiv/cgevu/,https://doi.org/10.31235/osf.io/cgevu,NA
7dmsr,preprints,2020-09-30T08:58:25.443795,2020-10-01T00:37:26.269501,2020-10-01T00:36:56.554946,NA,NA,Humanitarian Securitisation,"A humanitarian crisis occurs within an arena of political crisis and humanitarian organisations are in existence to attend to the consequent needs of populations created by these crises. The political ramifications of the humanitarian act must be considered from the standpoints of both INGOs and states and a way found to theorise the relationship between these political actors. The relationship can be framed in various ways, but most often as a dichotomy between principles and politics mediated through discussions about identity. This paper uses the ‘friends and enemies’ distinction and the securitisation perspective to better understand this relationship. The case study of the MSF-Holland and the Government of Sri Lanka 2006-2009 is explored. Focus is placed on process, audience, and discourse—how the relationship is actually constructed in practice. The perspectives of pragmatism—action versus discourse; temporality—routine versus state of exception securitisation; and agency—who securitises, are employed.",TRUE,FALSE,Humanitarian crisis|INGOs|MSF|securitisation|sovereignty|state of exception,2020-10-01T00:37:26.213265,NA,,TRUE,accepted,2020-10-01T00:36:56.554946,FALSE,NA,no,"The paper is based on thesis research and research conducted for the book Cunningham, AJ (2018). International Humanitarian NGOs and State Relations: 
Politics, Principles and Identity. London: Routledge https://goo.gl/HA8KKL",,not_applicable,,,,5a8c80f7c698300375c76d84|5a8c80f7c698300375c76d8e|Social and Behavioral Sciences|International and Area Studies|5a8c80f7c698300375c76d84|5a8c80f8c698300375c76daf|5a8c80f8c698300375c76db0|Social and Behavioral Sciences|Political Science|International Relations,Andrew Cunningham,2020,https://api.osf.io/v2/preprints/7dmsr/contributors/,https://api.osf.io/v2/preprints/7dmsr/bibliographic_contributors/,https://api.osf.io/v2/preprints/7dmsr/citation/,7dmsr,preprints,https://api.osf.io/v2/preprints/7dmsr/identifiers/,https://api.osf.io/v2/preprints/7dmsr/relationships/node/,NA,NA,NA,https://api.osf.io/v2/licenses/563c1cf88c5e4a3877f9e965/,563c1cf88c5e4a3877f9e965,licenses,https://api.osf.io/v2/providers/preprints/socarxiv/,socarxiv,preprint-providers,https://api.osf.io/v2/preprints/7dmsr/files/,https://api.osf.io/v2/files/5f7448b539d7e30049eb5ab1/,5f7448b539d7e30049eb5ab1,files,https://api.osf.io/v2/preprints/7dmsr/review_actions/,https://api.osf.io/v2/preprints/7dmsr/requests/,https://api.osf.io/v2/preprints/7dmsr/,https://osf.io/preprints/socarxiv/7dmsr/,https://doi.org/10.31235/osf.io/7dmsr,NA
8hkas,preprints,2020-09-30T08:12:55.320178,2020-10-12T09:17:12.939315,2020-10-01T00:35:25.139294,2020-10-11T22:00:00,10.1002/ajhb.23516,"""All the problems in the community are multi-faceted and related to each other"": Inuit concerns in an era of climate change","Human dimensions of climate change research in the Arctic often proposes ways for local communities to adapt to changes to their environment, foregrounding problems posed by climate change while treating social, political and economic factors as background conditions. We explore the relevance of this research paradigm for Inuit by examining how Inuit from Kangiqsujuaq present and discuss the major issues facing their community. We thematically code and analyze the responses of 107 Inuit to three free-response questions about the problems facing their community and the best things about their community. The data were collected as part of a questionnaire for a project focused on food security and food sharing conducted in Kangiqsujuaq, Nunavik, in 2013–2014. Few respondents mentioned issues relating to climate change among the most pressing problems facing their community. Rather, a suite of interconnected social and economic issues, particularly substance abuse and the cost of living, emerged as the main concerns of Kangiqsujuarmiut. However, the environment was a central theme in respondents’ favourite thing about their community. In light of the concerns identified by Inuit, we argue that much research on climate change makes incorrect a priori assumptions and consequently fails to capture aspects of Arctic socioecological systems that are essential for how Inuit are responding to climate change. An inductive, open-ended approach can help produce research more relevant to communities.",TRUE,FALSE,adaptation and vulnerability|Arctic|climate change|community-based research|Inuit,2020-10-01T00:36:00.516947,NA,,TRUE,accepted,2020-10-01T00:35:25.139294,FALSE,NA,no,Data are available after signing a data sharing agreement.,,no,This paper involves an exploratory analysis.,,,5a8c80f7c698300375c76d84|5a8c80f7c698300375c76d86|5a8c80f7c698300375c76d89|Social and Behavioral Sciences|Geography|Human Geography|5a8c80f7c698300375c76d84|5a8c80f8c698300375c76dbd|Social and Behavioral Sciences|Environmental Studies|5a8c80f7c698300375c76d84|5a8c80f9c698300375c76df6|5a8c80f9c698300375c76dfa|Social and Behavioral Sciences|Anthropology|Social and Cultural Anthropology|5a8c80f7c698300375c76d84|5a8c80f9c698300375c76df6|5a8c80f9c698300375c76dfc|Social and Behavioral Sciences|Anthropology|Biological and Physical Anthropology,Elspeth Ready and Peter Collings,2020,https://api.osf.io/v2/preprints/8hkas/contributors/,https://api.osf.io/v2/preprints/8hkas/bibliographic_contributors/,https://api.osf.io/v2/preprints/8hkas/citation/,8hkas,preprints,https://api.osf.io/v2/preprints/8hkas/identifiers/,https://api.osf.io/v2/preprints/8hkas/relationships/node/,NA,NA,NA,https://api.osf.io/v2/licenses/563c1cf88c5e4a3877f9e965/,563c1cf88c5e4a3877f9e965,licenses,https://api.osf.io/v2/providers/preprints/socarxiv/,socarxiv,preprint-providers,https://api.osf.io/v2/preprints/8hkas/files/,https://api.osf.io/v2/files/5f743e0b39d7e30046eb5ff3/,5f743e0b39d7e30046eb5ff3,files,https://api.osf.io/v2/preprints/8hkas/review_actions/,https://api.osf.io/v2/preprints/8hkas/requests/,https://api.osf.io/v2/preprints/8hkas/,https://osf.io/preprints/socarxiv/8hkas/,https://doi.org/10.31235/osf.io/8hkas,https://doi.org/10.1002/ajhb.23516
