id,type,attributes.date_created,attributes.date_modified,attributes.date_published,attributes.original_publication_date,attributes.doi,attributes.title,attributes.description,attributes.is_published,attributes.is_preprint_orphan,attributes.tags,attributes.preprint_doi_created,attributes.date_withdrawn,attributes.current_user_permissions,attributes.public,attributes.reviews_state,attributes.date_last_transitioned,attributes.has_coi,attributes.conflict_of_interest_statement,attributes.has_data_links,attributes.why_no_data,attributes.data_links,attributes.has_prereg_links,attributes.why_no_prereg,attributes.prereg_links,attributes.prereg_link_info,attributes.subjects,attributes.license_record.copyright_holders,attributes.license_record.year,relationships.contributors.links.related.href,relationships.bibliographic_contributors.links.related.href,relationships.citation.links.related.href,relationships.citation.data.id,relationships.citation.data.type,relationships.identifiers.links.related.href,relationships.node.links.related.href,relationships.node.links.self.href,relationships.node.data.id,relationships.node.data.type,relationships.license.links.related.href,relationships.license.data.id,relationships.license.data.type,relationships.provider.links.related.href,relationships.provider.data.id,relationships.provider.data.type,relationships.files.links.related.href,relationships.primary_file.links.related.href,relationships.primary_file.data.id,relationships.primary_file.data.type,relationships.review_actions.links.related.href,relationships.requests.links.related.href,links.self,links.html,links.preprint_doi,links.doi
79dth,preprints,2021-02-09T12:53:22.980938,2021-02-09T15:51:04.791674,2021-02-09T15:45:09.583458,NA,NA,Political trust as a cause and consequence of democracy: Longitudinal analysis of European data,"The causal link between political trust and democratic performance has been assumed rather than established. Building on research on political trust as related to regime legitimacy and on the evaluative nature of political trust, we formulate hypotheses about the effect of political trust on democracy and of democracy on political trust, both with regard to overall levels of trust in societies, as well as trust by education and age groups. We test these hypotheses with cross-lagged models applied to country time series of political trust from 26 European countries between 1991 and 2019, and with two democracy indicators, from the Varieties of Democracy and the Democracy Barometer projects. We find evidence of effects of democracy on trust and vice versa, as well as of differences in the effects of democracy on political trust among different education and age groups. The results are sensitive to the choice of the democracy indicator as well as the lag length, which points to the need of examining different reasonable combinations of indicators and nags in this kind of analysis.",TRUE,FALSE,brms|democracy|Democracy Barometer|political trust|Varieties of Democracy,2021-02-09T15:51:04.769690,NA,,TRUE,accepted,2021-02-09T15:45:09.583458,FALSE,NA,available,NA,https://osf.io/chx6a/,no,NA,,,5a8c80f7c698300375c76d84|5a8c80f8c698300375c76daf|5a8c80f8c698300375c76db2|Social and Behavioral Sciences|Political Science|Comparative Politics|5a8c80f7c698300375c76d84|5a8c80fac698300375c76e20|5a8c80fac698300375c76e43|Social and Behavioral Sciences|Sociology|Comparative and Historical Sociology,,2021,https://api.osf.io/v2/preprints/79dth/contributors/,https://api.osf.io/v2/preprints/79dth/bibliographic_contributors/,https://api.osf.io/v2/preprints/79dth/citation/,79dth,preprints,https://api.osf.io/v2/preprints/79dth/identifiers/,https://api.osf.io/v2/nodes/chx6a/,https://api.osf.io/v2/preprints/79dth/relationships/node/,chx6a,nodes,https://api.osf.io/v2/licenses/563c1cf88c5e4a3877f9e96a/,563c1cf88c5e4a3877f9e96a,licenses,https://api.osf.io/v2/providers/preprints/socarxiv/,socarxiv,preprint-providers,https://api.osf.io/v2/preprints/79dth/files/,https://api.osf.io/v2/files/602285c6d6a4320054f1516a/,602285c6d6a4320054f1516a,files,https://api.osf.io/v2/preprints/79dth/review_actions/,https://api.osf.io/v2/preprints/79dth/requests/,https://api.osf.io/v2/preprints/79dth/,https://osf.io/preprints/socarxiv/79dth/,https://doi.org/10.31235/osf.io/79dth,NA
m7uhw,preprints,2021-02-09T12:30:02.682693,2021-02-10T13:55:37.294632,2021-02-09T15:44:41.285826,NA,NA,Bringing Occupations Back In: Maternal Occupation-Specific Skills and Children’s Language and Cognitive Development,"This study investigated the impact of maternal occupation-specific skills on 5-year old children’s verbal and cognitive abilities. Representative data from the Millennium Cohort Study on 13,543 children were complemented with data from the British Skills Surveys to analyze how the relative importance of multiple job tasks across maternal occupations (79 groups) influences children’s inductive reasoning, spatial awareness and verbal ability. We found that mothers’ problem-solving and professional skills (e.g., presentation and teaching skills) are positively associated with children’s verbal abilities over and above human, social and economic capital. Mothers’ manual and numerical skills were negatively associated with children’s verbal abilities. Albeit effect sizes are small, this study shows that maternal occupation-specific resources contribute to social stratification in child development.",TRUE,FALSE,,2021-02-09T15:50:21.531257,NA,,TRUE,accepted,2021-02-09T15:44:41.285826,FALSE,NA,available,NA,https://ukdataservice.ac.uk/,no,NA,,,5a8c80f7c698300375c76d84|5a8c80f7c698300375c76d98|5a8c80f8c698300375c76da3|Social and Behavioral Sciences|Psychology|Developmental Psychology,,2021,https://api.osf.io/v2/preprints/m7uhw/contributors/,https://api.osf.io/v2/preprints/m7uhw/bibliographic_contributors/,https://api.osf.io/v2/preprints/m7uhw/citation/,m7uhw,preprints,https://api.osf.io/v2/preprints/m7uhw/identifiers/,https://api.osf.io/v2/nodes/98vye/,https://api.osf.io/v2/preprints/m7uhw/relationships/node/,98vye,nodes,https://api.osf.io/v2/licenses/563c1cf88c5e4a3877f9e96c/,563c1cf88c5e4a3877f9e96c,licenses,https://api.osf.io/v2/providers/preprints/socarxiv/,socarxiv,preprint-providers,https://api.osf.io/v2/preprints/m7uhw/files/,https://api.osf.io/v2/files/6022804f23238300579d6d26/,6022804f23238300579d6d26,files,https://api.osf.io/v2/preprints/m7uhw/review_actions/,https://api.osf.io/v2/preprints/m7uhw/requests/,https://api.osf.io/v2/preprints/m7uhw/,https://osf.io/preprints/socarxiv/m7uhw/,https://doi.org/10.31235/osf.io/m7uhw,NA
s6q3m,preprints,2021-02-09T09:47:49.637314,2021-02-09T15:49:24.607284,2021-02-09T15:42:51.299391,NA,10.1016/j.wasman.2020.07.012,Drivers of municipal solid waste management cost based on cost models inherent to sorted and unsorted waste,"After having divided waste management cost in its cost items, we focus on how well-known exogenous and endogenous drivers impact on such cost items. To this end, we collected empirical data of 6,616 Italian municipalities for a two-year period. We develop four regression-based models to analyze the data according to cost items. Models are also reiterated using different data normalization: cost per ton of waste or waste per capita. Besides exogenous determiners of cost, such as altitude, population density, and coastal zone, results refer to both unsorted and sorted waste management cost items. In this respect economies of scale are confirmed along with the critical role of adequate waste facilities that play a remarkable role in cost minimization. Policymakers and regulators may benefit from such results when it comes to define allowed revenues and design the scope of municipal solid waste regulation.",TRUE,FALSE,circular economy|local economy|MSW|municipal waste|public services|waste|waste cost|waste management|waste tax,2021-02-09T15:49:24.589885,NA,,TRUE,accepted,2021-02-09T15:42:51.299391,FALSE,NA,no,NA,,no,NA,,,5a8c80f7c698300375c76d84|5a8c80f8c698300375c76dbd|Social and Behavioral Sciences|Environmental Studies|5a8c80f7c698300375c76d84|5a8c80f8c698300375c76dbe|Social and Behavioral Sciences|Economics,,2021,https://api.osf.io/v2/preprints/s6q3m/contributors/,https://api.osf.io/v2/preprints/s6q3m/bibliographic_contributors/,https://api.osf.io/v2/preprints/s6q3m/citation/,s6q3m,preprints,https://api.osf.io/v2/preprints/s6q3m/identifiers/,NA,https://api.osf.io/v2/preprints/s6q3m/relationships/node/,NA,NA,https://api.osf.io/v2/licenses/563c1cf88c5e4a3877f9e96a/,563c1cf88c5e4a3877f9e96a,licenses,https://api.osf.io/v2/providers/preprints/socarxiv/,socarxiv,preprint-providers,https://api.osf.io/v2/preprints/s6q3m/files/,https://api.osf.io/v2/files/60225a4973c9fe004e077c19/,60225a4973c9fe004e077c19,files,https://api.osf.io/v2/preprints/s6q3m/review_actions/,https://api.osf.io/v2/preprints/s6q3m/requests/,https://api.osf.io/v2/preprints/s6q3m/,https://osf.io/preprints/socarxiv/s6q3m/,https://doi.org/10.31235/osf.io/s6q3m,https://doi.org/10.1016/j.wasman.2020.07.012
qjcuv,preprints,2021-02-09T09:24:09.901279,2021-02-09T15:48:46.627692,2021-02-09T15:42:12.244844,NA,10.1016/j.spc.2021.01.002,Designing waste management systems to meet circular economy goals: The Italian case,"Waste management capacity plays a prominent role in complying with circular economy goals, such as reducing municipal waste disposal by landfilling to 10%. We first analyze the imbalance in municipal solid waste management across Italy by estimating the quantities of waste to be treated using technologies different from those currently in use. Subsequently, we estimate the impact that a system compliant with circular economy goals would have on the cost of waste management. Our empirical analyses are based on an econometric method. The results suggest that Italy could reduce the use of landfill by 11.5%, resulting in a 13% reduction in mechanical-biological treatment. The waste-to-energy capacity would rise by 4.6% compared to the current situation, while the organic fraction treatment capacity would increase by 8.3%. Besides the positive impact on the environment, the potential annual savings on the cost of waste management could reach 0.07%, or 0.27% when the phase corresponding to treatment and disposal is considered. We provide insights into the design of more efficient national waste management plans using a novel approach based on best performers.",TRUE,FALSE,circular economy|landfill|waste|waste management|waste treatment|wte,2021-02-09T15:48:46.596626,NA,,TRUE,accepted,2021-02-09T15:42:12.244844,FALSE,NA,no,NA,,no,NA,,,5a8c80f7c698300375c76d84|5a8c80f8c698300375c76dbd|Social and Behavioral Sciences|Environmental Studies|5a8c80f7c698300375c76d84|5a8c80f8c698300375c76dbe|5a8c80f8c698300375c76dc9|Social and Behavioral Sciences|Economics|Industrial Organization,,2021,https://api.osf.io/v2/preprints/qjcuv/contributors/,https://api.osf.io/v2/preprints/qjcuv/bibliographic_contributors/,https://api.osf.io/v2/preprints/qjcuv/citation/,qjcuv,preprints,https://api.osf.io/v2/preprints/qjcuv/identifiers/,NA,https://api.osf.io/v2/preprints/qjcuv/relationships/node/,NA,NA,https://api.osf.io/v2/licenses/563c1cf88c5e4a3877f9e96a/,563c1cf88c5e4a3877f9e96a,licenses,https://api.osf.io/v2/providers/preprints/socarxiv/,socarxiv,preprint-providers,https://api.osf.io/v2/preprints/qjcuv/files/,https://api.osf.io/v2/files/602254be23238300439db18a/,602254be23238300439db18a,files,https://api.osf.io/v2/preprints/qjcuv/review_actions/,https://api.osf.io/v2/preprints/qjcuv/requests/,https://api.osf.io/v2/preprints/qjcuv/,https://osf.io/preprints/socarxiv/qjcuv/,https://doi.org/10.31235/osf.io/qjcuv,https://doi.org/10.1016/j.spc.2021.01.002
be82v,preprints,2021-02-09T01:26:32.181428,2021-02-09T15:47:43.684185,2021-02-09T15:41:48.492404,NA,NA,Support in Response to a Spouse's Distress: Comparing Women and Men in Same-Sex and Different-Sex Marriages,"Accepted at the Journal of Social and Personal Relationships         Abstract: Support for a spouse with psychological distress can be expressed in many different ways. Previous research indicates that support expression is shaped by gender, but we do not know much about how support within marriage is provided in response to a spouse’s distress outside of a different-sex couple context. In this study, we analyze dyadic data from 378 midlife married couples (35-65 years; N = 756 individuals) within the U.S. to examine how men and women in same- and different-sex relationships provide support when they perceive that their spouse is experiencing distress. We find women in different-sex couples are less likely to report taking care of their distressed spouse’s tasks or giving their distressed spouse more personal time and space compared to women in same-sex couples and men. We also find that men in different-sex couples are less likely to report encouraging their spouse to talk compared to men in same-sex couples and women. Being personally stressed by a spouse’s distress is positively associated with providing support to that spouse, whereas feeling that a spouse’s distress is stressful for the marriage is negatively associated with providing support. This study advances understanding of gendered provisions of support in response to psychological distress in marriage, moving beyond a framing of women as fundamentally more supportive than men to a consideration of how these dynamics may be different or similar in same- and different-sex marital contexts.",TRUE,FALSE,distress|dyadic data|gender|gender differences|marriage|same-sex relationships|stress|support,2021-02-09T15:47:43.654645,NA,,TRUE,accepted,2021-02-09T15:41:48.492404,FALSE,NA,available,NA,https://doi.org/10.3886/ICPSR37404.v1,no,NA,,,5a8c80f7c698300375c76d84|5a8c80f7c698300375c76d98|Social and Behavioral Sciences|Psychology|5a8c80f7c698300375c76d84|5a8c80fac698300375c76e20|5a8c80fac698300375c76e2e|Social and Behavioral Sciences|Sociology|Mental Health|5a8c80f7c698300375c76d84|5a8c80fac698300375c76e20|5a8c80fac698300375c76e49|Social and Behavioral Sciences|Sociology|Sex and Gender|5a8c80f7c698300375c76d84|5a8c80fac698300375c76e20|5a8c80fac698300375c76e4c|Social and Behavioral Sciences|Sociology|Family|5a8c80f7c698300375c76d84|5a8c80fac698300375c76e20|5a8c80fac698300375c76e4e|Social and Behavioral Sciences|Sociology|Medical Sociology,,2021,https://api.osf.io/v2/preprints/be82v/contributors/,https://api.osf.io/v2/preprints/be82v/bibliographic_contributors/,https://api.osf.io/v2/preprints/be82v/citation/,be82v,preprints,https://api.osf.io/v2/preprints/be82v/identifiers/,NA,https://api.osf.io/v2/preprints/be82v/relationships/node/,NA,NA,https://api.osf.io/v2/licenses/563c1cf88c5e4a3877f9e96a/,563c1cf88c5e4a3877f9e96a,licenses,https://api.osf.io/v2/providers/preprints/socarxiv/,socarxiv,preprint-providers,https://api.osf.io/v2/preprints/be82v/files/,https://api.osf.io/v2/files/6021e4ccd6a4320020f12ffc/,6021e4ccd6a4320020f12ffc,files,https://api.osf.io/v2/preprints/be82v/review_actions/,https://api.osf.io/v2/preprints/be82v/requests/,https://api.osf.io/v2/preprints/be82v/,https://osf.io/preprints/socarxiv/be82v/,https://doi.org/10.31235/osf.io/be82v,NA
f9tsw,preprints,2021-02-08T20:48:06.216874,2021-02-10T19:52:02.276324,2021-02-10T18:31:17.881970,NA,NA,Mitigating losses: How science diplomacy can address the impact of COVID-19 on early career researchers,"Despite the failures to tackle early coordinated responses at national and multinational levels, the global emergence of Coronavirus Disease 2019 (COVID-19) pandemic promoted unprecedented actions on the science-policy, science-communication, and science-diplomacy interfaces worldwide. With varying degrees of success, various actions within the realm of science diplomacy have accompanied the creation of knowledge related to COVID-19 through international collaboration. The COVID-19 pandemic brought the world to a standstill and also drew attention to the genuine need for science diplomacy. This pandemic highlighted the need of training opportunities in the interface of policy and diplomacy for researchers to be able to get grips on emerging health issues. Moreover, it is necessary to create specific platforms for experts to interact with decision-makers at the national and international levels, especially in the Global South. This crisis inevitably shifted the focus on scientific areas that directly address the pandemic response (epidemiology, public health, virology, immunology, pharmacology, human behavioral research, economics, among others). At the same time, some areas not related to the pandemic response have been slowed down due to inevitable physical and social restrictions that impacted certain aspects of the academic life. This does not only relate to daily access to the lab, scientific collections, or field sites, but also associates with furloughed employees and reduced funding to non-COVID-19-related research. Moreover, during the pandemic, women and (usually young) scientists with children have reduced their research efforts substantially, with future implications still difficult to quantify. While some researchers might have harnessed telecommuting and lockdown periods to focus on data analysis and publication writing, gender bias still exists. The slight increase in publications with pre-acquired data may still be followed by an immediate future impacted by the lack of data acquisition during the pandemic. These issues may create long-term effects due to reduced capacity for generating pre-requisite data for securing new funding, termination of research, reduced networking opportunities, restrictions to international collaborations, collectively having a negative impact on other disciplines. While most established researchers may not be affected hardly by the above-mentioned effects, early career researchers (ECRs), represent a more vulnerable population. ECRs usually refer to PhD students, postdoctoral fellows and scientists who have 10 years or less of experience after the doctoral degree, although there is some flexibility in this definition. Due to their career stage, ECRs often face job precarity, lack of available opportunities, low funding, and job insecurity (e.g., untenured positions and temporary contract employees). These problems are augmented by the COVID-19 pandemic and may be experienced more in countries with a developing scientific system. The impact could be higher for countries that are developing their research environment, are dependent on training their ECRs and conducting experiments abroad through international exchanges programs, which have been stopped due to the pandemic. 
Given these unprecedented times, it has been observed that international scientific organizations, policy-makers, scientific communities, and private stakeholders have strengthened their collaborations in response to the pandemic. We, as ECRs, strongly believe that science diplomacy can make a difference in addressing the challenges (emanated or amplified by the current pandemic) that ECRs would face inside and outside academia. Here we present such challenges, and discuss how the Global Young Academy (GYA), an independent organization of early to mid-career researchers across all disciplines and countries, has provided a platform for ECRs to practice science diplomacy, science advice, and science communication. The former by serving as a bridge between ECRs and governments, the second by hearing the voices of young researchers when enacting policies, and the latter by informing societies about the benefits of scientific research. Motivated by the described examples, we recommend measures for scientists, funding agencies, and international organizations to foster international collaboration in these unparallel times.",TRUE,FALSE,COVID-19|Early career researchers|Science Diplomacy|Science Policy,2021-02-10T19:52:02.242180,NA,,TRUE,accepted,2021-02-10T18:31:17.881970,FALSE,NA,not_applicable,NA,,not_applicable,NA,,,5a8c80f6c698300375c76d4e|5a8c80f6c698300375c76d5c|Education|Higher Education|5a8c80f7c698300375c76d84|5a8c80f7c698300375c76d96|Social and Behavioral Sciences|Other Social and Behavioral Sciences,,2021,https://api.osf.io/v2/preprints/f9tsw/contributors/,https://api.osf.io/v2/preprints/f9tsw/bibliographic_contributors/,https://api.osf.io/v2/preprints/f9tsw/citation/,f9tsw,preprints,https://api.osf.io/v2/preprints/f9tsw/identifiers/,https://api.osf.io/v2/nodes/hfmwr/,https://api.osf.io/v2/preprints/f9tsw/relationships/node/,hfmwr,nodes,https://api.osf.io/v2/licenses/5ad7979bc69830002d8190e3/,5ad7979bc69830002d8190e3,licenses,https://api.osf.io/v2/providers/preprints/socarxiv/,socarxiv,preprint-providers,https://api.osf.io/v2/preprints/f9tsw/files/,https://api.osf.io/v2/files/6021a38923238300189d68c6/,6021a38923238300189d68c6,files,https://api.osf.io/v2/preprints/f9tsw/review_actions/,https://api.osf.io/v2/preprints/f9tsw/requests/,https://api.osf.io/v2/preprints/f9tsw/,https://osf.io/preprints/socarxiv/f9tsw/,https://doi.org/10.31235/osf.io/f9tsw,NA
yjpek,preprints,2021-02-08T18:04:59.045828,2021-02-09T15:40:41.428590,2021-02-09T15:36:39.387824,NA,NA,Selective perimeter lockdowns in Madrid: a way to bend the COVID-19 curve?,"Lockdowns have been widespread used to limit social interaction and bend the epidemic curve. However, their intensity and geographical delimitation have been variable across different countries. Madrid (Spain) implemented perimeter lockdowns in September with the purpose of bending the COVID-19 curve. In this paper we compared, using join point regressions, the evolution of COVID-19 cases in those areas where this intervention was implemented and those where it was not. According to our analysis, the decrease in the epidemic curve started before the impact of the perimeter lockdown could be reflected.",TRUE,FALSE,,2021-02-09T15:40:41.406788,NA,,TRUE,accepted,2021-02-09T15:36:39.387824,FALSE,NA,available,NA,https://datos.comunidad.madrid/catalogo/dataset/covid19_tia_zonas_basicas_salud,not_applicable,NA,,,"5a8c80f7c698300375c76d84|5a8c80f8c698300375c76ddb|5a8c80f9c698300375c76de2|Social and Behavioral Sciences|Public Affairs, Public Policy and Public Administration|Health Policy",Mario Fontán|Pedro Gullón|Javier Padilla,2021,https://api.osf.io/v2/preprints/yjpek/contributors/,https://api.osf.io/v2/preprints/yjpek/bibliographic_contributors/,https://api.osf.io/v2/preprints/yjpek/citation/,yjpek,preprints,https://api.osf.io/v2/preprints/yjpek/identifiers/,NA,https://api.osf.io/v2/preprints/yjpek/relationships/node/,NA,NA,https://api.osf.io/v2/licenses/563c1cf88c5e4a3877f9e965/,563c1cf88c5e4a3877f9e965,licenses,https://api.osf.io/v2/providers/preprints/socarxiv/,socarxiv,preprint-providers,https://api.osf.io/v2/preprints/yjpek/files/,https://api.osf.io/v2/files/60217d4e4497cf013f9c07c1/,60217d4e4497cf013f9c07c1,files,https://api.osf.io/v2/preprints/yjpek/review_actions/,https://api.osf.io/v2/preprints/yjpek/requests/,https://api.osf.io/v2/preprints/yjpek/,https://osf.io/preprints/socarxiv/yjpek/,https://doi.org/10.31235/osf.io/yjpek,NA
62bd7,preprints,2021-02-08T16:21:14.630912,2021-02-09T15:39:24.587086,2021-02-09T15:36:07.299376,2021-01-21T00:00:00,NA,Notes on the Basic Economic Forces Affecting Interpreting,This note discusses the general economic forces affecting the provision and availability of interpreting. it is an updated and tidied version of a blog post previously appearing on the Still Thinking blog and contains additional sources not available at the time that post was created.,TRUE,FALSE,,2021-02-09T15:39:24.566231,NA,,TRUE,accepted,2021-02-09T15:36:07.299376,FALSE,NA,not_applicable,NA,,not_applicable,NA,,,5a8c80f2c698300375c76c7d|5a8c80f6c698300375c76d27|Arts and Humanities|Modern Languages|5a8c80f7c698300375c76d84|5a8c80f8c698300375c76dbe|5a8c80f8c698300375c76dc1|Social and Behavioral Sciences|Economics|Other Economics,,2021,https://api.osf.io/v2/preprints/62bd7/contributors/,https://api.osf.io/v2/preprints/62bd7/bibliographic_contributors/,https://api.osf.io/v2/preprints/62bd7/citation/,62bd7,preprints,https://api.osf.io/v2/preprints/62bd7/identifiers/,NA,https://api.osf.io/v2/preprints/62bd7/relationships/node/,NA,NA,https://api.osf.io/v2/licenses/563c1cf88c5e4a3877f9e96a/,563c1cf88c5e4a3877f9e96a,licenses,https://api.osf.io/v2/providers/preprints/socarxiv/,socarxiv,preprint-providers,https://api.osf.io/v2/preprints/62bd7/files/,https://api.osf.io/v2/files/602164fe4497cf01339c0eaa/,602164fe4497cf01339c0eaa,files,https://api.osf.io/v2/preprints/62bd7/review_actions/,https://api.osf.io/v2/preprints/62bd7/requests/,https://api.osf.io/v2/preprints/62bd7/,https://osf.io/preprints/socarxiv/62bd7/,https://doi.org/10.31235/osf.io/62bd7,NA
