mxkgq,preprints,2021-02-08T09:19:17.594023,2021-02-09T15:41:42.799742,2021-02-09T15:37:13.542372,NA,NA,Mapping the online songbird trade in Indonesia,"Wildlife trade, when unsustainable, can be an important threat to biodiversity conservation. In this contribution, we explored the use of digital data to investigate the online market for songbirds in Indonesia, where keeping pet songbirds is a deeply rooted cultural practice. We examined the spatial characteristics of three dimensions of the songbird trade using data from online sources: birdwatchers’ sightings as a proxy for the supply of the songbird market, small ads from an online marketplace platform, representing the trade itself and its transactions, and videos by pet songbird owners to represent the demand side of the songbird market. We found that, geographically, these three stages of the songbird supply chain did not overlap, which potentially hints at the roles extended transport networks and commercial captive breeding play for the songbird trade. The trade was not confined to major cities but spread out through the country, indicating both a possible democratisation of the trade (i.e. a larger group of sellers, and consumers selling to consumers) and an opportunity to observe previously covert parts of the trade. We further found that the asking prices on online marketplaces were significantly higher than the prices stated in an independently carried out consumer survey, and discuss possible reasons. Data from digital sources can give rich insights into the spatial, temporal and taxonomic structure of wildlife trade, can help understand the motivations of buyers and sellers, and can help direct wildlife trade towards a more sustainable fashion. Our methodology toolbox that allows automatic and continuous monitoring of online marketplaces and includes data preparation and cleaning, and follows the highest standards of data privacy principles, is openly available.",TRUE,FALSE,conservation culturomics|conservation geography|data science|digital conservation|GIS|online data|online marketplaces|pet trade|social media|spatial science|wildlife trade,2021-02-09T15:41:42.778896,NA,,TRUE,accepted,2021-02-09T15:37:13.542372,FALSE,NA,available,NA,http://urn.fi/urn:nbn:fi:att:3e4b2f79-e073-4e64-8f0d-0a173ad4ee9b,not_applicable,NA,,,5a8c80f7c698300375c76d84|5a8c80f7c698300375c76d86|5a8c80f7c698300375c76d88|Social and Behavioral Sciences|Geography|Geographic Information Sciences|5a8c80f7c698300375c76d84|5a8c80f7c698300375c76d86|5a8c80f7c698300375c76d89|Social and Behavioral Sciences|Geography|Human Geography|5a8c80f7c698300375c76d84|5a8c80f7c698300375c76d86|5a8c80f7c698300375c76d8a|Social and Behavioral Sciences|Geography|Physical and Environmental Geography|5a8c80f7c698300375c76d84|5a8c80f7c698300375c76d86|5a8c80f7c698300375c76d8c|Social and Behavioral Sciences|Geography|Nature and Society Relations|5a8c80f7c698300375c76d84|5a8c80f7c698300375c76d86|5a8c80f7c698300375c76d8d|Social and Behavioral Sciences|Geography|Spatial Science|5a8c80f7c698300375c76d84|5a8c80f8c698300375c76dbd|Social and Behavioral Sciences|Environmental Studies,,2021,https://api.osf.io/v2/preprints/mxkgq/contributors/,https://api.osf.io/v2/preprints/mxkgq/bibliographic_contributors/,https://api.osf.io/v2/preprints/mxkgq/citation/,mxkgq,preprints,https://api.osf.io/v2/preprints/mxkgq/identifiers/,https://api.osf.io/v2/nodes/mkdc7/,https://api.osf.io/v2/preprints/mxkgq/relationships/node/,mkdc7,nodes,https://api.osf.io/v2/licenses/563c1cf88c5e4a3877f9e96a/,563c1cf88c5e4a3877f9e96a,licenses,https://api.osf.io/v2/providers/preprints/socarxiv/,socarxiv,preprint-providers,https://api.osf.io/v2/preprints/mxkgq/files/,https://api.osf.io/v2/files/602102181d985e0102747e5c/,602102181d985e0102747e5c,files,https://api.osf.io/v2/preprints/mxkgq/review_actions/,https://api.osf.io/v2/preprints/mxkgq/requests/,https://api.osf.io/v2/preprints/mxkgq/,https://osf.io/preprints/socarxiv/mxkgq/,https://doi.org/10.31235/osf.io/mxkgq,NA
n8yp6,preprints,2021-02-08T08:54:05.363373,2021-02-09T17:42:10.890314,2021-02-09T15:37:49.377260,NA,NA,"Patient-made Long Covid changed COVID-19 (and the production of science, too)","Background: Significant knowledge about long-term symptoms following SARS-CoV-2 infection has been produced by patients, which made Long Covid.   
Objective: To document and analyse such knowledge, outline how it changed understanding of COVID-19, and specify ethical and socio-political challenges associated with its development.
Methods: Analysis of publicly available materials on Long Covid by people with Long Covid, largely in English and Italian, and across media and genre.  
Results: Those with Long Covid have made epistemic contributions across multiple media, including: oral, written and visual narratives, testimonies and arguments; quantitative and qualitative research; grey literature, essays, opinion pieces and commentaries; and advocacy and policy interventions. 
Discussion: Patient knowledge contributed to shifting assumptions concerning COVID-19 symptoms and disease pathways; phasing and duration; classification and naming of illness; disease morbidity; and who is affected. Patients’ use of a wide range of media challenged the conventional scientific production of epistemic claims. Many ethical and political challenges lie ahead, including exploitation of patients, their knowledge, and their data.
Conclusions: Long Covid patient activism and research have been instrumental to key epistemic shifts that have changed understandings of COVID-19. They have also changed – possibly permanently – how science and medical knowledge are produced. Patient expertise must be routinely integrated into medicine beyond the current pandemic. We also need to ensure the ethical use of patient-led expertise and patient-produced data in Long Covid. 
Patient contribution: Both authors are patients and researchers with Long Covid, who have contributed to making ‘Long Covid', and to advocacy around its definition and recognition.",TRUE,FALSE,citizen science|COVID-19|epistemology|experiential knowledge|Long Covid|long-haulers|patient expertise|patient knowledge|patient-led research|SARS-CoV-2|symptoms,2021-02-09T15:45:01.401371,NA,,TRUE,accepted,2021-02-09T15:37:49.377260,TRUE,"Relationships and activities that could appear to influence the submitted research, but no other competing interest: Both authors have completed the ICMJE uniform disclosure form at www.icmje.org/coi_disclosure.pdf and declare that they have participated in Long Covid advocacy and have Long Covid themselves. They report no financial support, no financial interests, and no other relationships or activities that could appear to have influenced the submitted work.",not_applicable,NA,,not_applicable,NA,,,5a8c80f7c698300375c76d84|5a8c80fac698300375c76e20|5a8c80fac698300375c76e4e|Social and Behavioral Sciences|Sociology|Medical Sociology,,2021,https://api.osf.io/v2/preprints/n8yp6/contributors/,https://api.osf.io/v2/preprints/n8yp6/bibliographic_contributors/,https://api.osf.io/v2/preprints/n8yp6/citation/,n8yp6,preprints,https://api.osf.io/v2/preprints/n8yp6/identifiers/,NA,https://api.osf.io/v2/preprints/n8yp6/relationships/node/,NA,NA,https://api.osf.io/v2/licenses/5ad7979bc69830002d8190e3/,5ad7979bc69830002d8190e3,licenses,https://api.osf.io/v2/providers/preprints/socarxiv/,socarxiv,preprint-providers,https://api.osf.io/v2/preprints/n8yp6/files/,https://api.osf.io/v2/files/6020fc311d985e00fd74af56/,6020fc311d985e00fd74af56,files,https://api.osf.io/v2/preprints/n8yp6/review_actions/,https://api.osf.io/v2/preprints/n8yp6/requests/,https://api.osf.io/v2/preprints/n8yp6/,https://osf.io/preprints/socarxiv/n8yp6/,https://doi.org/10.31235/osf.io/n8yp6,NA
