id,type,attributes.date_created,attributes.date_modified,attributes.date_published,attributes.original_publication_date,attributes.doi,attributes.title,attributes.description,attributes.is_published,attributes.is_preprint_orphan,attributes.tags,attributes.preprint_doi_created,attributes.date_withdrawn,attributes.current_user_permissions,attributes.public,attributes.reviews_state,attributes.date_last_transitioned,attributes.has_coi,attributes.conflict_of_interest_statement,attributes.has_data_links,attributes.why_no_data,attributes.data_links,attributes.has_prereg_links,attributes.why_no_prereg,attributes.prereg_links,attributes.prereg_link_info,attributes.subjects,attributes.license_record.copyright_holders,attributes.license_record.year,relationships.contributors.links.related.href,relationships.bibliographic_contributors.links.related.href,relationships.citation.links.related.href,relationships.citation.data.id,relationships.citation.data.type,relationships.identifiers.links.related.href,relationships.node.links.self.href,relationships.node.links.related.href,relationships.node.data.id,relationships.node.data.type,relationships.license.links.related.href,relationships.license.data.id,relationships.license.data.type,relationships.provider.links.related.href,relationships.provider.data.id,relationships.provider.data.type,relationships.files.links.related.href,relationships.primary_file.links.related.href,relationships.primary_file.data.id,relationships.primary_file.data.type,relationships.review_actions.links.related.href,relationships.requests.links.related.href,links.self,links.html,links.preprint_doi,links.doi
arw7c,preprints,2020-04-20T07:35:00.467881,2020-04-21T05:03:24.290564,2020-04-20T16:01:14.820651,NA,NA,Transforming Economies and Generating Sustainable “Green” Economic Growth After the COVID-19 Pandemic through General Collective Intelligence,"The lockdown of economic activity in many countries as a measure to stop the spread of the COVID-19 pandemic has led to high levels of unemployment and other indicators of a potentially upcoming economic crisis. As a gauge of the seriousness of these concerns some have suggested that current levels of some of these indicators have not been seen in the US since the time of the great depression. This paper explores how General Collective Intelligence, a recent innovation in group decision-making systems, might reliably generate the economic growth needed to avert such a crisis where not reliably achievable otherwise. Current group decision-making systems, whether choosing a human decision-maker, consensus voting on decisions, or automated decision-systems such as conventional collective intelligence, have been suggested to lack the capacity to maximize more than a very few group outcomes simultaneously due to specific limitations. Since impact on collective well-being is determined by impact on an open (unbounded) set of outcomes, this implies lack of the capacity to maximize the necessary range of impacts on well-being for groups if that range is too broad. If so, the breadth of impact required to achieve sustainable “green” economic development while simultaneously solving hunger, solving the environmental degradation that consensus has linked to climate change, as well as providing maximal access to healthcare, education, and other resources, may not be reliably possible with current decision systems. General Collective Intelligence or GCI replicates the adaptive problem solving mechanisms by which nature has demonstrated the ability to optimally respond to an unlimited set of problems, and by which nature has demonstrated the ability to potentially increase sustainability per unit of resources by orders of magnitude so that life is reliably self-sustaining. This paper explores why GCI can potentially be used to reliably drive self-sustaining economic growth to revive economies in the aftermath of the COVID-19 pandemic, and why GCI has the potential to reliably drive a transformation to sustainable green economies while doing so.",TRUE,FALSE,economic development|GCI|General Collective Intelligence|green growth|sustainable development,2020-04-21T05:03:24.280023,NA,,TRUE,accepted,2020-04-20T16:01:14.820651,NA,NA,NA,NA,NA,NA,NA,NA,NA,5a8c80f7c698300375c76d84|5a8c80f8c698300375c76dbe|5a8c80f8c698300375c76dc8|Social and Behavioral Sciences|Economics|Growth and Development,,2020,https://api.osf.io/v2/preprints/arw7c/contributors/,https://api.osf.io/v2/preprints/arw7c/bibliographic_contributors/,https://api.osf.io/v2/preprints/arw7c/citation/,arw7c,preprints,https://api.osf.io/v2/preprints/arw7c/identifiers/,https://api.osf.io/v2/preprints/arw7c/relationships/node/,NA,NA,NA,https://api.osf.io/v2/licenses/563c1cf88c5e4a3877f9e96a/,563c1cf88c5e4a3877f9e96a,licenses,https://api.osf.io/v2/providers/preprints/socarxiv/,socarxiv,preprint-providers,https://api.osf.io/v2/preprints/arw7c/files/,https://api.osf.io/v2/files/5e9d50a8f1353506b3d599c3/,5e9d50a8f1353506b3d599c3,files,https://api.osf.io/v2/preprints/arw7c/review_actions/,https://api.osf.io/v2/preprints/arw7c/requests/,https://api.osf.io/v2/preprints/arw7c/,https://osf.io/preprints/socarxiv/arw7c/,https://doi.org/10.31235/osf.io/arw7c,NA
scnza,preprints,2020-04-20T07:28:46.434917,2020-04-21T05:03:22.537305,2020-04-20T16:01:39.105079,NA,NA,COVID-19 and The Hidden Cost of Reduced Civil Liberties,"The ongoing COVID-19 outbreak that emerged from Wuhan, China in 2020 has seen unprecedented restrictions on civilian populations in many countries in the attempt to curtail the spread of the pandemic. A recently developed model of general collective intelligence predicts the properties of group decision-making systems that are required to optimize collective outcomes, along with predicting that authoritarian systems of decision-making might tend to be restricted to non-optimal group outcomes in ways that are somewhat hidden in that they require an understanding of this new and relatively unknown model of general collective intelligence. In light of this model of general collective intelligence, the economic restrictions imposed to combat the pandemic take on a new light, since these restrictions have not only resulted in economic lockdowns for some countries, but in some cases have also effectively imposed martial law. The hidden cost of this reduction in civil liberties is explored from the perspective of the cost of an authoritarian decision-making system resulting in non-optimal group outcomes as theorized by this model of general collective intelligence, using models of government inefficiency to assess the cost of those non-optimal group outcomes, and therefore the hidden cost of reduced civil liberties.",TRUE,FALSE,Civil Liberties|coronavirus|COVID-19|GCI|General Collective Intelligence,2020-04-21T05:03:22.518737,NA,,TRUE,accepted,2020-04-20T16:01:39.105079,NA,NA,NA,NA,NA,NA,NA,NA,NA,"5a8c80f7c698300375c76d84|5a8c80f8c698300375c76ddb|5a8c80f9c698300375c76dee|Social and Behavioral Sciences|Public Affairs, Public Policy and Public Administration|Emergency and Disaster Management",Andy E. Williams,2020,https://api.osf.io/v2/preprints/scnza/contributors/,https://api.osf.io/v2/preprints/scnza/bibliographic_contributors/,https://api.osf.io/v2/preprints/scnza/citation/,scnza,preprints,https://api.osf.io/v2/preprints/scnza/identifiers/,https://api.osf.io/v2/preprints/scnza/relationships/node/,NA,NA,NA,https://api.osf.io/v2/licenses/563c1cf88c5e4a3877f9e965/,563c1cf88c5e4a3877f9e965,licenses,https://api.osf.io/v2/providers/preprints/socarxiv/,socarxiv,preprint-providers,https://api.osf.io/v2/preprints/scnza/files/,https://api.osf.io/v2/files/5e9d4f31f1353506b0d58148/,5e9d4f31f1353506b0d58148,files,https://api.osf.io/v2/preprints/scnza/review_actions/,https://api.osf.io/v2/preprints/scnza/requests/,https://api.osf.io/v2/preprints/scnza/,https://osf.io/preprints/socarxiv/scnza/,https://doi.org/10.31235/osf.io/scnza,NA
8m46u,preprints,2020-04-20T06:32:57.445305,2020-04-21T05:03:21.660618,2020-04-20T16:03:24.654263,NA,NA,"Individual, Structural and Exchange Mobility: Decomposition and Axiom based measures","We present a novel and common framework for analysing transition matrices representing social, occupational or economic mobility. It is based on an unambiguous decomposition of structural and exchange components of mobility and applicable to nominal, ordinal and continuous data with grouping. Partial orders of transition matrices and scaled axiomatic  measures of directional and other mobility follow from these easily interpretable representations.",TRUE,FALSE,,2020-04-21T05:03:21.645450,NA,,TRUE,accepted,2020-04-20T16:03:24.654263,NA,NA,NA,NA,NA,NA,NA,NA,NA,5a8c80f7c698300375c76d84|5a8c80f8c698300375c76dbe|Social and Behavioral Sciences|Economics|5a8c80f7c698300375c76d84|5a8c80f9c698300375c76e0c|Social and Behavioral Sciences|Social Statistics,Debasis Sengupta and Nachiketa Chattopadhyay,2020,https://api.osf.io/v2/preprints/8m46u/contributors/,https://api.osf.io/v2/preprints/8m46u/bibliographic_contributors/,https://api.osf.io/v2/preprints/8m46u/citation/,8m46u,preprints,https://api.osf.io/v2/preprints/8m46u/identifiers/,https://api.osf.io/v2/preprints/8m46u/relationships/node/,NA,NA,NA,https://api.osf.io/v2/licenses/563c1cf88c5e4a3877f9e965/,563c1cf88c5e4a3877f9e965,licenses,https://api.osf.io/v2/providers/preprints/socarxiv/,socarxiv,preprint-providers,https://api.osf.io/v2/preprints/8m46u/files/,https://api.osf.io/v2/files/5e9d4225d69735068abde9a8/,5e9d4225d69735068abde9a8,files,https://api.osf.io/v2/preprints/8m46u/review_actions/,https://api.osf.io/v2/preprints/8m46u/requests/,https://api.osf.io/v2/preprints/8m46u/,https://osf.io/preprints/socarxiv/8m46u/,https://doi.org/10.31235/osf.io/8m46u,NA
vzkad,preprints,2020-04-20T02:44:24.165805,2020-04-20T05:04:42.508025,2020-04-20T04:49:28.708688,2020-04-15T14:00:00,10.18408/ahuri-5119101,Redesign of a homelessness service system for young people,"This research identifies measures that could reduce youth homelessness and lead to improved outcomes for young people who experience homelessness. The findings are based on a community-level analysis of special homelessness services (SHS) data and sites of innovation in three states: South Australia, NSW and Victoria.",TRUE,FALSE,Australia|early intervention|leaving care|service system|system reform|Youth homelessness,2020-04-20T05:04:42.493968,NA,,TRUE,accepted,2020-04-20T04:49:28.708688,NA,NA,NA,NA,NA,NA,NA,NA,NA,5a8c80f6c698300375c76d4e|Education,,2020,https://api.osf.io/v2/preprints/vzkad/contributors/,https://api.osf.io/v2/preprints/vzkad/bibliographic_contributors/,https://api.osf.io/v2/preprints/vzkad/citation/,vzkad,preprints,https://api.osf.io/v2/preprints/vzkad/identifiers/,https://api.osf.io/v2/preprints/vzkad/relationships/node/,NA,NA,NA,https://api.osf.io/v2/licenses/563c1cf88c5e4a3877f9e96a/,563c1cf88c5e4a3877f9e96a,licenses,https://api.osf.io/v2/providers/preprints/socarxiv/,socarxiv,preprint-providers,https://api.osf.io/v2/preprints/vzkad/files/,https://api.osf.io/v2/files/5e9d0c8dd69735068bbdc33a/,5e9d0c8dd69735068bbdc33a,files,https://api.osf.io/v2/preprints/vzkad/review_actions/,https://api.osf.io/v2/preprints/vzkad/requests/,https://api.osf.io/v2/preprints/vzkad/,https://osf.io/preprints/socarxiv/vzkad/,https://doi.org/10.31235/osf.io/vzkad,https://doi.org/10.18408/ahuri-5119101
ztgpm,preprints,2020-04-19T22:30:04.664228,2020-06-22T17:26:34.267158,2020-04-20T04:47:45.446685,NA,NA,A Text-As-Data Approach for Using Open-Ended Responses as Manipulation Checks,"Participants that complete online surveys and experiments may be inattentive, which can hinder researchers’ ability to draw substantive or causal inferences. As such, many practitioners include multiple factual or informational closed-ended manipulation checks to identify low-attention respondents. However, closed-ended manipulation checks are either correct or incorrect, which allows participants to more easily guess and it reduces the potential variation in attention between respondents. In response to these shortcomings, I develop an automatic and standardized methodology to measure attention that relies on the text that respondents provide in an open-ended manipulation check. There are multiple benefits to this approach. First, it provides a continuous measure of attention, which allows for greater variation between respondents. Second, it reduces the reliance on subjective, paid humans to analyze open-ended responses. Last, I outline how to diagnose the impact of inattentive workers on the overall results, including how to assess the average treatment effect of those respondents that likely received the treatment. I provide easy-to-use software in R to implement these suggestions for open-ended manipulation checks.",TRUE,FALSE,manipulation checks|online respondent attention|open-ended responses|survey experiments|text-as-data,2020-04-20T05:04:41.915488,NA,,TRUE,accepted,2020-04-20T04:47:45.446685,NA,NA,NA,NA,NA,NA,NA,NA,NA,5a8c80f7c698300375c76d84|5a8c80f8c698300375c76daf|5a8c80f8c698300375c76db1|Social and Behavioral Sciences|Political Science|Models and Methods,,2020,https://api.osf.io/v2/preprints/ztgpm/contributors/,https://api.osf.io/v2/preprints/ztgpm/bibliographic_contributors/,https://api.osf.io/v2/preprints/ztgpm/citation/,ztgpm,preprints,https://api.osf.io/v2/preprints/ztgpm/identifiers/,https://api.osf.io/v2/preprints/ztgpm/relationships/node/,NA,NA,NA,https://api.osf.io/v2/licenses/563c1cf88c5e4a3877f9e96a/,563c1cf88c5e4a3877f9e96a,licenses,https://api.osf.io/v2/providers/preprints/socarxiv/,socarxiv,preprint-providers,https://api.osf.io/v2/preprints/ztgpm/files/,https://api.osf.io/v2/files/5e9cd0f0f1353506a0d5a0f9/,5e9cd0f0f1353506a0d5a0f9,files,https://api.osf.io/v2/preprints/ztgpm/review_actions/,https://api.osf.io/v2/preprints/ztgpm/requests/,https://api.osf.io/v2/preprints/ztgpm/,https://osf.io/preprints/socarxiv/ztgpm/,https://doi.org/10.31235/osf.io/ztgpm,NA
mq9au,preprints,2020-04-18T23:18:34.914060,2020-04-20T05:04:42.007544,2020-04-20T04:43:58.972308,NA,NA,Economic Burden of Mental Disorders in Bangladesh: A Systematic Review and Recommendations for Future Research,"Mental disorders are highly prevalent in different population groups in Bangladesh. Effective policymaking and evaluation may need economic evidence on complex mental health problems. In this systematic review, we aimed to evaluate the current evidence on the economic burden of mental disorders in Bangladesh. We searched six major databases and additional sources using the Preferred Reporting Items for Systematic Reviews and Meta-Analyses (PRISMA) guidelines. We included studies that were published in English, as peer-reviewed articles, reported any economic burden of any mental disorders, and focused on the Bangladeshi population. Among a total of 1241 citations, no study met our criteria. This scarcity of evidence on the economic burden of mental disorders can be attributable to many factors, including a suboptimal state of research in mental health, lack of institutional and national priorities on mental health economic research, and lack of capacities or resources to improve knowledge. Future efforts should aim at strengthening research capacities, providing resources, prioritizing mental health research, improving collaboration, and effective policymaking and strategic planning to promote mental health economic research in the context of Bangladesh.",TRUE,FALSE,Economic Burden|Health Economics|Health Policy|Mental Disorders|Mental Health|Mental Illness,2020-04-20T05:04:41.981992,NA,,TRUE,accepted,2020-04-20T04:43:58.972308,NA,NA,NA,NA,NA,NA,NA,NA,NA,"5a8c80f7c698300375c76d84|5a8c80f7c698300375c76d98|5a8c80f8c698300375c76da4|Social and Behavioral Sciences|Psychology|Health Psychology|5a8c80f7c698300375c76d84|5a8c80f7c698300375c76d98|5a8c80f8c698300375c76dab|Social and Behavioral Sciences|Psychology|Clinical Psychology|5a8c80f7c698300375c76d84|5a8c80f8c698300375c76dbe|5a8c80f8c698300375c76dc5|Social and Behavioral Sciences|Economics|Behavioral Economics|5a8c80f7c698300375c76d84|5a8c80f8c698300375c76dbe|5a8c80f8c698300375c76dcd|Social and Behavioral Sciences|Economics|Health Economics|5a8c80f7c698300375c76d84|5a8c80f8c698300375c76ddb|5a8c80f9c698300375c76de2|Social and Behavioral Sciences|Public Affairs, Public Policy and Public Administration|Health Policy",,2020,https://api.osf.io/v2/preprints/mq9au/contributors/,https://api.osf.io/v2/preprints/mq9au/bibliographic_contributors/,https://api.osf.io/v2/preprints/mq9au/citation/,mq9au,preprints,https://api.osf.io/v2/preprints/mq9au/identifiers/,https://api.osf.io/v2/preprints/mq9au/relationships/node/,NA,NA,NA,https://api.osf.io/v2/licenses/563c1cf88c5e4a3877f9e96a/,563c1cf88c5e4a3877f9e96a,licenses,https://api.osf.io/v2/providers/preprints/socarxiv/,socarxiv,preprint-providers,https://api.osf.io/v2/preprints/mq9au/files/,https://api.osf.io/v2/files/5e9b8acff135350672d5313b/,5e9b8acff135350672d5313b,files,https://api.osf.io/v2/preprints/mq9au/review_actions/,https://api.osf.io/v2/preprints/mq9au/requests/,https://api.osf.io/v2/preprints/mq9au/,https://osf.io/preprints/socarxiv/mq9au/,https://doi.org/10.31235/osf.io/mq9au,NA
3xqgm,preprints,2020-04-18T19:58:59.988867,2020-06-18T03:27:20.232042,2020-04-20T04:42:31.949297,NA,10.1086/709105,Able but Unwilling to Enforce: Cooperative Dilemmas in Group Lending,"It is known that greater social cohesion increases a group’s ability to enforce cooperation. Despite this, defectors often go unpunished and groups with social structures that are a priori favorable often fail. A critical distinction is required between the structural effect on ability versus willingness to punish. We develop a theoretical framework in which variation in a group’s social structure generates a tension between ability and willingness to enforce cooperation. Structures that promote ability to punish also often reduce interest in carrying out sanctions, thus changing collective outcomes. Our empirical analysis involves a well-defined cooperative dilemma: group lending in Sierra Leone. We complement statistical modelling, based on a dataset containing 5,487 group repayments, with ethnographic analysis. We find: (1) Structural cohesion only increases economic cooperation between borrowers to a point, beyond which unwillingness outweighs increased ability to punish, reducing group repayments. (2) Groups with disconnected subgroups perform worse on average. Although borrowers are more willing to punish defectors in the out-subgroup, they are unable to do so effectively.",TRUE,FALSE,cooperation|enforcement|punishment|social embeddedness|social networks|social sanctions,2020-04-20T05:04:41.883300,NA,,TRUE,accepted,2020-04-20T04:42:31.949297,NA,NA,NA,NA,NA,NA,NA,NA,NA,"5a8c80f7c698300375c76d84|5a8c80fac698300375c76e20|5a8c80fac698300375c76e2c|Social and Behavioral Sciences|Sociology|Methodology|5a8c80f7c698300375c76d84|5a8c80fac698300375c76e20|5a8c80fac698300375c76e2d|Social and Behavioral Sciences|Sociology|Economic Sociology|5a8c80f7c698300375c76d84|5a8c80fac698300375c76e20|5a8c80fac698300375c76e39|Social and Behavioral Sciences|Sociology|Collective Behavior and Social Movements|5a8c80f7c698300375c76d84|5a8c80fac698300375c76e20|5a8c80fac698300375c76e53|Social and Behavioral Sciences|Sociology|Altruism, Morality, and Social Solidarity",,2020,https://api.osf.io/v2/preprints/3xqgm/contributors/,https://api.osf.io/v2/preprints/3xqgm/bibliographic_contributors/,https://api.osf.io/v2/preprints/3xqgm/citation/,3xqgm,preprints,https://api.osf.io/v2/preprints/3xqgm/identifiers/,https://api.osf.io/v2/preprints/3xqgm/relationships/node/,NA,NA,NA,https://api.osf.io/v2/licenses/563c1cf88c5e4a3877f9e96a/,563c1cf88c5e4a3877f9e96a,licenses,https://api.osf.io/v2/providers/preprints/socarxiv/,socarxiv,preprint-providers,https://api.osf.io/v2/preprints/3xqgm/files/,https://api.osf.io/v2/files/5e9b5c09d697350652bdfa76/,5e9b5c09d697350652bdfa76,files,https://api.osf.io/v2/preprints/3xqgm/review_actions/,https://api.osf.io/v2/preprints/3xqgm/requests/,https://api.osf.io/v2/preprints/3xqgm/,https://osf.io/preprints/socarxiv/3xqgm/,https://doi.org/10.31235/osf.io/3xqgm,https://doi.org/10.1086/709105
sdr79,preprints,2020-04-18T07:01:08.379153,2020-05-28T14:46:34.430200,2020-04-18T08:12:04.797590,NA,NA,Data (il)literacy education as a hidden curriculum of the datafication of education,"This position paper uses the concept of “hidden curriculum” as a heuristic device to analyze everyday data-related practices in formal education. Grounded in a careful reading of the theoretical literature, this paper argues that the everyday data-related practices of contemporary education can be approached as functional forms of data literacy education: deeds with unintentional educational consequences for students’ relationships with data and datafication. More precisely, this paper suggests that everyday data-related practices represent data as cognitive authority and naturalize the routines of all-pervading data collection. These routines lead to what is here referred to as “data (il)literacy”—an uncritical, one-dimensional understanding of data and datafication. Since functional data (il)literacy education takes place subconsciously, it can be conceptualized as a form of hidden curriculum, an idea that refers to lessons taught and learned but not consciously intended to be so.",TRUE,FALSE,Critical literacy|Datafication|Data literacy|Hidden curriculum,2020-04-19T05:04:47.001994,NA,,TRUE,accepted,2020-04-18T08:12:04.797590,NA,NA,NA,NA,NA,NA,NA,NA,NA,5a8c80f6c698300375c76d4e|5a8c80f6c698300375c76d52|Education|Language and Literacy Education|5a8c80f6c698300375c76d4e|5a8c80f7c698300375c76d63|Education|Curriculum and Instruction|5a8c80f6c698300375c76d4e|5a8c80f7c698300375c76d64|Education|Social and Philosophical Foundations of Education|5a8c80f6c698300375c76d4e|5a8c80f7c698300375c76d65|Education|Other Education|5a8c80f6c698300375c76d4e|5a8c80f7c698300375c76d6d|Education|Curriculum and Social Inquiry,,2020,https://api.osf.io/v2/preprints/sdr79/contributors/,https://api.osf.io/v2/preprints/sdr79/bibliographic_contributors/,https://api.osf.io/v2/preprints/sdr79/citation/,sdr79,preprints,https://api.osf.io/v2/preprints/sdr79/identifiers/,https://api.osf.io/v2/preprints/sdr79/relationships/node/,NA,NA,NA,https://api.osf.io/v2/licenses/563c1cf88c5e4a3877f9e96a/,563c1cf88c5e4a3877f9e96a,licenses,https://api.osf.io/v2/providers/preprints/socarxiv/,socarxiv,preprint-providers,https://api.osf.io/v2/preprints/sdr79/files/,https://api.osf.io/v2/files/5e9aa5b8f1353505f2d599e6/,5e9aa5b8f1353505f2d599e6,files,https://api.osf.io/v2/preprints/sdr79/review_actions/,https://api.osf.io/v2/preprints/sdr79/requests/,https://api.osf.io/v2/preprints/sdr79/,https://osf.io/preprints/socarxiv/sdr79/,https://doi.org/10.31235/osf.io/sdr79,NA
a8r3p,preprints,2020-04-17T20:28:48.654389,2020-04-19T05:03:21.525319,2020-04-18T08:18:30.625215,NA,NA,How Right-Leaning Media Coverage of COVID-19 Facilitated the Spread of Misinformation in the Early Stages of the Pandemic,"In recent weeks, several academic and journalistic outlets have documented widespread misinformation about the origins and potential treatment for COVID-19. This misinformation could have important public health consequences if misinformed people are less likely to heed the advice of public health experts. While some have anecdotally tied the prevalence of misinformation to misleading or inaccurate media coverage of the pandemic in its early stages, few have rigorously tested this claim empirically. In this paper, we report the results of an automated content analysis showing that right-leaning news outlets (e.g., Fox News, Breitbart) were more than 2.5 times more likely than mainstream outlets to discuss COVID-19 misinformation during the early stages of the U.S. pandemic response. In a nationally representative survey (N = 8,914) conducted from 3/10-3/16, we then show that people who consumed more right-leaning news during this timeframe were more than twice as likely to endorse COVID-related misinformation. Alarmingly, survey data further suggest that misinformation endorsement has negative public health consequences, as misinformed people are more likely to believe that the CDC is exaggerating COVID-related health risks.",TRUE,FALSE,conspiracy theories|content analysis|coronavirus|COVID|COVID-19|media effects|misinformation|partisan media|political communication|political science|science communication|survey research,2020-04-19T05:03:21.485641,NA,,TRUE,accepted,2020-04-18T08:18:30.625215,NA,NA,NA,NA,NA,NA,NA,NA,NA,5a8c80f7c698300375c76d84|5a8c80f8c698300375c76daf|5a8c80f8c698300375c76db5|Social and Behavioral Sciences|Political Science|American Politics,,2020,https://api.osf.io/v2/preprints/a8r3p/contributors/,https://api.osf.io/v2/preprints/a8r3p/bibliographic_contributors/,https://api.osf.io/v2/preprints/a8r3p/citation/,a8r3p,preprints,https://api.osf.io/v2/preprints/a8r3p/identifiers/,https://api.osf.io/v2/preprints/a8r3p/relationships/node/,https://api.osf.io/v2/nodes/4hdgw/,4hdgw,nodes,https://api.osf.io/v2/licenses/563c1cf88c5e4a3877f9e96a/,563c1cf88c5e4a3877f9e96a,licenses,https://api.osf.io/v2/providers/preprints/socarxiv/,socarxiv,preprint-providers,https://api.osf.io/v2/preprints/a8r3p/files/,https://api.osf.io/v2/files/5e9a1183f1353505c2d54f85/,5e9a1183f1353505c2d54f85,files,https://api.osf.io/v2/preprints/a8r3p/review_actions/,https://api.osf.io/v2/preprints/a8r3p/requests/,https://api.osf.io/v2/preprints/a8r3p/,https://osf.io/preprints/socarxiv/a8r3p/,https://doi.org/10.31235/osf.io/a8r3p,NA
