id,type,attributes.date_created,attributes.date_modified,attributes.date_published,attributes.original_publication_date,attributes.doi,attributes.title,attributes.description,attributes.is_published,attributes.is_preprint_orphan,attributes.tags,attributes.preprint_doi_created,attributes.date_withdrawn,attributes.current_user_permissions,attributes.public,attributes.reviews_state,attributes.date_last_transitioned,attributes.has_coi,attributes.conflict_of_interest_statement,attributes.has_data_links,attributes.why_no_data,attributes.data_links,attributes.has_prereg_links,attributes.why_no_prereg,attributes.prereg_links,attributes.prereg_link_info,attributes.subjects,attributes.license_record.copyright_holders,attributes.license_record.year,relationships.contributors.links.related.href,relationships.bibliographic_contributors.links.related.href,relationships.citation.links.related.href,relationships.citation.data.id,relationships.citation.data.type,relationships.identifiers.links.related.href,relationships.node.links.related.href,relationships.node.links.self.href,relationships.node.data.id,relationships.node.data.type,relationships.license.links.related.href,relationships.license.data.id,relationships.license.data.type,relationships.provider.links.related.href,relationships.provider.data.id,relationships.provider.data.type,relationships.files.links.related.href,relationships.primary_file.links.related.href,relationships.primary_file.data.id,relationships.primary_file.data.type,relationships.review_actions.links.related.href,relationships.requests.links.related.href,links.self,links.html,links.preprint_doi
8wcgz,preprints,2020-07-03T10:23:41.483289,2020-12-17T00:28:05.284993,2020-07-06T16:04:11.443952,NA,NA,Explaining Support for COVID-19 Cell Phone Contact Tracing,"COVID-19 contact tracing applications have been deployed at a fast pace around the world and may be a key policy instrument to contain future waves in Canada. This study aims to explain public opinion toward cell phone contact tracing using a survey experiment conducted with a representative sample of Canadian respondents. We build upon an established theory in evolutionary psychology—disease avoidance—to predict how media coverage of the pandemic affects public support for containment measures. We report three key findings. First, exposure to a news item that shows people ignoring social distancing rules causes an increase in support for cell phone contact tracing. Second, pre-treatment covariates such as anxiety and a belief that other people are not following the rules rank among the strongest predictors of support for COVID-19 apps. And third, while a majority of respondents approve the reliance on cell phone contact tracing, many of them hold ambivalent thoughts about the technology. Our analysis of answers to an open-ended question on the topic suggests that concerns for rights and freedoms remain a salient preoccupation.",TRUE,FALSE,Canada|Cell Phone Contact Tracing|COVID-19|Disease Avoidance Hypothesis|Experiment|Framing|Privacy|Public Opinion,2020-07-06T16:04:42.465356,NA,,TRUE,accepted,2020-07-06T16:04:11.443952,FALSE,NA,no,Replication data and scripts will be made available publicly upon completion of the peer-review process.,,NA,NA,,NA,"5a8c80f7c698300375c76d84|5a8c80f7c698300375c76d98|5a8c80f7c698300375c76da1|Social and Behavioral Sciences|Psychology|Experimental Analysis of Behavior|5a8c80f7c698300375c76d84|5a8c80f8c698300375c76daf|5a8c80f8c698300375c76db2|Social and Behavioral Sciences|Political Science|Comparative Politics|5a8c80f7c698300375c76d84|5a8c80f8c698300375c76ddb|5a8c80f9c698300375c76de2|Social and Behavioral Sciences|Public Affairs, Public Policy and Public Administration|Health Policy|5a8c80f7c698300375c76d84|5a8c80f8c698300375c76ddb|5a8c80f9c698300375c76ded|Social and Behavioral Sciences|Public Affairs, Public Policy and Public Administration|Science and Technology Policy|5a8c80f7c698300375c76d84|5a8c80f8c698300375c76ddb|5a8c80f9c698300375c76dee|Social and Behavioral Sciences|Public Affairs, Public Policy and Public Administration|Emergency and Disaster Management|5a8c80f7c698300375c76d84|5a8c80f9c698300375c76e0d|5a8c80f9c698300375c76e1e|Social and Behavioral Sciences|Communication|Mass Communication",Ludovic Rheault and Andreea Musulan,2020,https://api.osf.io/v2/preprints/8wcgz/contributors/,https://api.osf.io/v2/preprints/8wcgz/bibliographic_contributors/,https://api.osf.io/v2/preprints/8wcgz/citation/,8wcgz,preprints,https://api.osf.io/v2/preprints/8wcgz/identifiers/,https://api.osf.io/v2/nodes/mz6eq/,https://api.osf.io/v2/preprints/8wcgz/relationships/node/,mz6eq,nodes,https://api.osf.io/v2/licenses/563c1cf88c5e4a3877f9e965/,563c1cf88c5e4a3877f9e965,licenses,https://api.osf.io/v2/providers/preprints/socarxiv/,socarxiv,preprint-providers,https://api.osf.io/v2/preprints/8wcgz/files/,https://api.osf.io/v2/files/5eff0730bee665013ff98c76/,5eff0730bee665013ff98c76,files,https://api.osf.io/v2/preprints/8wcgz/review_actions/,https://api.osf.io/v2/preprints/8wcgz/requests/,https://api.osf.io/v2/preprints/8wcgz/,https://osf.io/preprints/socarxiv/8wcgz/,https://doi.org/10.31235/osf.io/8wcgz
5wtyv,preprints,2020-07-03T06:46:02.485194,2020-07-04T02:25:10.161034,2020-07-04T02:24:39.297755,2020-07-02T21:00:00,NA,A reductionist reading of Husserl’s phenomenology by Mach’s descriptivism and phenomenalism,"Husserl’s phenomenology is what is used, and then the conception of “bracketing reality” is modelled to generalize Peano arithmetic in its relation to set theory in the foundation of mathematics. The obtained model is equivalent to the generalization of Peano arithmetic by means of replacing the axiom of induction with that of transfinite induction.
A comparison to Mach’s doctrine is used to be revealed the fundamental and philosophical reductionism of Husserl’s phenomenology leading to a kind of Pythagoreanism in the final analysis.",TRUE,FALSE,eidetic reduction|epoché|Husserl’s|Mach’s “economy of thought”|phenomenological reduction|phenomenology|transcendental reduction,2020-07-04T02:25:10.141937,NA,,TRUE,accepted,2020-07-04T02:24:39.297755,FALSE,NA,not_applicable,NA,,NA,NA,,NA,5a8c80f2c698300375c76c7d|5a8c80f5c698300375c76cf4|5a8c80f5c698300375c76cf6|Arts and Humanities|Philosophy|Metaphysics|5a8c80f2c698300375c76c7d|5a8c80f5c698300375c76cf4|5a8c80f5c698300375c76cfa|Arts and Humanities|Philosophy|Logic and Foundations of Mathematics|5a8c80f2c698300375c76c7d|5a8c80f5c698300375c76cf4|5a8c80f5c698300375c76cfc|Arts and Humanities|Philosophy|Philosophy of Science|5a8c80f2c698300375c76c7d|5a8c80f5c698300375c76cf4|5a8c80f5c698300375c76cff|Arts and Humanities|Philosophy|Continental Philosophy|5a8c80f2c698300375c76c7d|5a8c80f5c698300375c76cf4|5a8c80f5c698300375c76d01|Arts and Humanities|Philosophy|History of Philosophy,,2020,https://api.osf.io/v2/preprints/5wtyv/contributors/,https://api.osf.io/v2/preprints/5wtyv/bibliographic_contributors/,https://api.osf.io/v2/preprints/5wtyv/citation/,5wtyv,preprints,https://api.osf.io/v2/preprints/5wtyv/identifiers/,NA,https://api.osf.io/v2/preprints/5wtyv/relationships/node/,NA,NA,https://api.osf.io/v2/licenses/5ad7979bc69830002d8190e3/,5ad7979bc69830002d8190e3,licenses,https://api.osf.io/v2/providers/preprints/socarxiv/,socarxiv,preprint-providers,https://api.osf.io/v2/preprints/5wtyv/files/,https://api.osf.io/v2/files/5efed437ea59af0122d37fc4/,5efed437ea59af0122d37fc4,files,https://api.osf.io/v2/preprints/5wtyv/review_actions/,https://api.osf.io/v2/preprints/5wtyv/requests/,https://api.osf.io/v2/preprints/5wtyv/,https://osf.io/preprints/socarxiv/5wtyv/,https://doi.org/10.31235/osf.io/5wtyv
9xzgf,preprints,2020-07-02T19:04:37.519040,2020-11-15T05:31:33.403192,2020-07-06T16:04:46.435927,NA,NA,Getting out while staying in: Policy and environmental predictors of park visits during the first months of the COVID-19 pandemic,"The spread of COVID-19 altered use of public spaces, such as parks, with potential effects on human health and well-being. Little is known about park use during the pandemic, how local features (e.g, park availability) influence use, and whether park visits accelerate COVID-19 spread. Using weekly panel data for 620 U.S. counties, we show park visits decreased by 10% beginning March 15, and by 17-35% through May 9, 2020. Net of weekly sample trends, park visits decreased by 2.3% when stay-at-home orders were in effect, yet increased by 8.3% after school closures and 4.1% after business closures. Park visits decreased less during the pandemic in metropolitan counties or where park availability was high. Higher park visits were weakly associated with COVID-19 case growth rate but not incidence. Thus, parks may serve as alternatives for recreation when schools and businesses close, especially where parks are available, with no-to-little influence on COVID-19 spread.",TRUE,FALSE,cell phone data|COVID-19|Google Mobility Reports|green space|outdoor recreation|park access|parks|SafeGraph|social distancing measures,2020-07-06T16:05:30.590138,NA,,TRUE,accepted,2020-07-06T16:04:46.435927,FALSE,NA,available,NA,https://www.google.com/covid19/mobility/|https://github.com/JieYingWu/COVID-19_US_County-level_Summaries/tree/master/data|https://github.com/nytimes/covid-19-data|https://www.arcgis.com/home/item.html?id=578968f975774d3fab79fe56c8c90941|https://drive.google.com/drive/folders/1wZXBrqw9uE2JorzQThKpktO_l1XGlzLT|https://dataverse.harvard.edu/dataset.xhtml?persistentId=doi:10.7910/DVN/VOQCHQ|https://www.census.gov/geographies/reference-files/time-series/demo/metro-micro/delineation-files.html|https://data.census.gov/|https://catalog.data.gov/dataset/coastal-counties|https://www.ers.usda.gov/data-products/county-typology-codes/,no,NA,,,5a8c80f7c698300375c76d84|5a8c80f7c698300375c76d97|Social and Behavioral Sciences|Urban Studies and Planning|5a8c80f7c698300375c76d84|5a8c80fac698300375c76e20|5a8c80fac698300375c76e2f|Social and Behavioral Sciences|Sociology|Environmental Sociology,,2020,https://api.osf.io/v2/preprints/9xzgf/contributors/,https://api.osf.io/v2/preprints/9xzgf/bibliographic_contributors/,https://api.osf.io/v2/preprints/9xzgf/citation/,9xzgf,preprints,https://api.osf.io/v2/preprints/9xzgf/identifiers/,https://api.osf.io/v2/nodes/bq8xm/,https://api.osf.io/v2/preprints/9xzgf/relationships/node/,bq8xm,nodes,https://api.osf.io/v2/licenses/563c1cf88c5e4a3877f9e96a/,563c1cf88c5e4a3877f9e96a,licenses,https://api.osf.io/v2/providers/preprints/socarxiv/,socarxiv,preprint-providers,https://api.osf.io/v2/preprints/9xzgf/files/,https://api.osf.io/v2/files/5efe2fcabee66500fbf9a16d/,5efe2fcabee66500fbf9a16d,files,https://api.osf.io/v2/preprints/9xzgf/review_actions/,https://api.osf.io/v2/preprints/9xzgf/requests/,https://api.osf.io/v2/preprints/9xzgf/,https://osf.io/preprints/socarxiv/9xzgf/,https://doi.org/10.31235/osf.io/9xzgf
dhfj3,preprints,2020-07-02T13:55:04.996295,2020-12-09T10:39:09.742538,2020-07-02T16:12:55.865869,NA,NA,Speaking-out on the migration crisis or remaining silent? The importance of the interplay between personal attitudes and perceived group norms,"Europeans’ attitudes and perceived group norms on immigration were examined from social psychological and semantic approaches. While overall personal attitudes are neutral and significantly different from perceived norms (mismatch), a small minority with extremely negative attitudes was observed. As predicted, the mismatch shaped outspokenness and identification with Europe moderated it. A conformity orientation among low identifiers and a resistance among high identifiers were revealed. Such resistance might is partly due to robust and vocal minority of opponents to the immigration. The need of distinguishing between attitudes and norms is discussed in regards to explanation of rising intolerance to migration.",TRUE,FALSE,group identification|migration|perceived group norms|personal attitudes|speaking-out|word association,2020-07-02T16:13:29.352778,NA,,TRUE,accepted,2020-07-02T16:12:55.865869,FALSE,NA,no,"Only accessible to the research community, on demand.",,NA,NA,,NA,5a8c80f7c698300375c76d84|5a8c80f7c698300375c76d98|5a8c80f7c698300375c76da2|Social and Behavioral Sciences|Psychology|Social Psychology|5a8c80f7c698300375c76d84|5a8c80f9c698300375c76dfd|5a8c80f9c698300375c76e0a|Social and Behavioral Sciences|Linguistics|Discourse and Text Linguistics,,2020,https://api.osf.io/v2/preprints/dhfj3/contributors/,https://api.osf.io/v2/preprints/dhfj3/bibliographic_contributors/,https://api.osf.io/v2/preprints/dhfj3/citation/,dhfj3,preprints,https://api.osf.io/v2/preprints/dhfj3/identifiers/,https://api.osf.io/v2/nodes/wydk2/,https://api.osf.io/v2/preprints/dhfj3/relationships/node/,wydk2,nodes,https://api.osf.io/v2/licenses/563c1cf88c5e4a3877f9e96a/,563c1cf88c5e4a3877f9e96a,licenses,https://api.osf.io/v2/providers/preprints/socarxiv/,socarxiv,preprint-providers,https://api.osf.io/v2/preprints/dhfj3/files/,https://api.osf.io/v2/files/5efde740af115600bf3b3783/,5efde740af115600bf3b3783,files,https://api.osf.io/v2/preprints/dhfj3/review_actions/,https://api.osf.io/v2/preprints/dhfj3/requests/,https://api.osf.io/v2/preprints/dhfj3/,https://osf.io/preprints/socarxiv/dhfj3/,https://doi.org/10.31235/osf.io/dhfj3
74ujt,preprints,2020-07-02T13:36:22.378968,2020-09-23T19:03:40.139227,2020-07-04T02:24:04.860732,NA,NA,Conservation co-benefits from air pollution regulation: Evidence from birds,"Massive wildlife losses over the past 50 years have brought new urgency to identifying both the drivers of population decline and potential solutions. We provide the first large-scale evidence that air pollution, specifically ozone, is associated with declines in bird abundance in the United States. We show that an air pollution regulation limiting ozone precursors emissions has delivered substantial benefits to bird conservation. Our results imply that air quality improvements over the past four decades have stemmed the decline in bird populations, averting the loss of 1.5 billion birds, approximately 20 percent of current totals. Our results highlight that in addition to protecting human health, air pollution regulations have previously unrecognized and unquantified conservation co-benefits.",TRUE,FALSE,air pollution|birds|conservation,2020-07-04T02:24:31.415820,NA,,TRUE,accepted,2020-07-04T02:24:04.860732,FALSE,NA,available,NA,https://ebird.org,NA,NA,,NA,5a8c80f7c698300375c76d84|5a8c80f8c698300375c76dbd|Social and Behavioral Sciences|Environmental Studies|5a8c80f7c698300375c76d84|5a8c80f8c698300375c76dbe|Social and Behavioral Sciences|Economics,,2020,https://api.osf.io/v2/preprints/74ujt/contributors/,https://api.osf.io/v2/preprints/74ujt/bibliographic_contributors/,https://api.osf.io/v2/preprints/74ujt/citation/,74ujt,preprints,https://api.osf.io/v2/preprints/74ujt/identifiers/,NA,https://api.osf.io/v2/preprints/74ujt/relationships/node/,NA,NA,https://api.osf.io/v2/licenses/5ad7979bc69830002d8190e3/,5ad7979bc69830002d8190e3,licenses,https://api.osf.io/v2/providers/preprints/socarxiv/,socarxiv,preprint-providers,https://api.osf.io/v2/preprints/74ujt/files/,https://api.osf.io/v2/files/5efde2dbbee66500bbf99681/,5efde2dbbee66500bbf99681,files,https://api.osf.io/v2/preprints/74ujt/review_actions/,https://api.osf.io/v2/preprints/74ujt/requests/,https://api.osf.io/v2/preprints/74ujt/,https://osf.io/preprints/socarxiv/74ujt/,https://doi.org/10.31235/osf.io/74ujt
67zkf,preprints,2020-07-02T13:09:51.937324,2020-12-03T23:10:52.718279,2020-07-02T16:09:35.515813,NA,NA,The Long-Term Effects of the Vietnam War on Civic Engagement,"What are the legacies of war exposure on civic engagement? Recent evidence suggests that domestic war may have short-term effects on participation in social organizations. Yet, it is unclear whether these effects will be present in internationalized conflicts and persist over long periods of time. Further, the pathways of persistence by which war exposure leads to greater civic engagement in the long-term are even less understood. In this paper, I contribute to both questions using unique evidence from the Vietnam War. Empirically, I combine a unique U.S. military dataset containing bombing intensity with respondents' wartime place of residence to generate an objective indicator of conflict intensity. Then, I exploit the distance to the arbitrarily drawn border at the seventeenth parallel as an instrument for conflict intensity. The results show that individuals who lived in a province heavily affected by the conflict during the war tend to be more engaged in social organizations and hold greater expressive values, at least, 26 years later. Further, I empirically explore the mechanisms of persistence. The empirical evidence suggests that both persistence within individuals and community-wide transmission jointly account for the long-term increase of civic engagement after conflict.",TRUE,FALSE,,2020-07-02T16:10:10.168216,NA,,TRUE,accepted,2020-07-02T16:09:35.515813,FALSE,NA,no,The data will be made available upon publication.,,no,NA,,,5a8c80f7c698300375c76d84|5a8c80f8c698300375c76daf|5a8c80f8c698300375c76db2|Social and Behavioral Sciences|Political Science|Comparative Politics,,2020,https://api.osf.io/v2/preprints/67zkf/contributors/,https://api.osf.io/v2/preprints/67zkf/bibliographic_contributors/,https://api.osf.io/v2/preprints/67zkf/citation/,67zkf,preprints,https://api.osf.io/v2/preprints/67zkf/identifiers/,NA,https://api.osf.io/v2/preprints/67zkf/relationships/node/,NA,NA,https://api.osf.io/v2/licenses/5ad7979bc69830002d8190e3/,5ad7979bc69830002d8190e3,licenses,https://api.osf.io/v2/providers/preprints/socarxiv/,socarxiv,preprint-providers,https://api.osf.io/v2/preprints/67zkf/files/,https://api.osf.io/v2/files/5efddca7ea59af00b9d327b0/,5efddca7ea59af00b9d327b0,files,https://api.osf.io/v2/preprints/67zkf/review_actions/,https://api.osf.io/v2/preprints/67zkf/requests/,https://api.osf.io/v2/preprints/67zkf/,https://osf.io/preprints/socarxiv/67zkf/,https://doi.org/10.31235/osf.io/67zkf
wab8m,preprints,2020-07-02T10:30:36.538653,2020-12-22T19:04:50.802569,2020-07-02T11:05:21.689540,NA,NA,The Wall Street Consensus,"Abstract: The Wall Street Consensus is an elaborate effort to reorganize development interventions around partnerships with global finance. The Billions to Trillions agenda, the World Bank’s Maximising Finance for Development or the G20’s Infrastructure as an Asset Class all call on international development institutions and governments of poor countries to ‘escort capital’ – institutional investors and the managers of their trillions in assets – into investable development assets. For this, ten policy commandments aim to forge the de-risking state and accelerate the structural transformation of local financial systems towards market-based finance. The state risk-proofs development assets for institutional investors by taking on its balance sheet: (i) demand risks attached to commodified (social) infrastructure assets, (ii) political risk attached to policies that would threaten profits such as nationalization, higher minimum wages and climate regulation, (iii) climate risks that may become part of regulatory frameworks; (iv) bond and currency markets risks that complicate investors’ exit. The new ‘development as derisking’ paradigm narrows the scope for a green developmental state that could design a just transition to low-carbon economies.",TRUE,FALSE,blended finance|critical macrofinance|derisking|financial globalisation|green finance|international development|PPP|SDG|shadow banking|World Bank,2020-07-02T11:05:42.914451,NA,,TRUE,accepted,2020-07-02T11:05:21.689540,FALSE,NA,not_applicable,NA,,NA,NA,,NA,5a8c80f7c698300375c76d84|5a8c80f8c698300375c76dbe|5a8c80f8c698300375c76dc0|Social and Behavioral Sciences|Economics|Political Economy|5a8c80f7c698300375c76d84|5a8c80f8c698300375c76dbe|5a8c80f8c698300375c76dc8|Social and Behavioral Sciences|Economics|Growth and Development|5a8c80f7c698300375c76d84|5a8c80f8c698300375c76dbe|5a8c80f8c698300375c76dc9|Social and Behavioral Sciences|Economics|Industrial Organization,Daniela Gabor,2020,https://api.osf.io/v2/preprints/wab8m/contributors/,https://api.osf.io/v2/preprints/wab8m/bibliographic_contributors/,https://api.osf.io/v2/preprints/wab8m/citation/,wab8m,preprints,https://api.osf.io/v2/preprints/wab8m/identifiers/,NA,https://api.osf.io/v2/preprints/wab8m/relationships/node/,NA,NA,https://api.osf.io/v2/licenses/563c1cf88c5e4a3877f9e965/,563c1cf88c5e4a3877f9e965,licenses,https://api.osf.io/v2/providers/preprints/socarxiv/,socarxiv,preprint-providers,https://api.osf.io/v2/preprints/wab8m/files/,https://api.osf.io/v2/files/5efdb750af1156009f3b9128/,5efdb750af1156009f3b9128,files,https://api.osf.io/v2/preprints/wab8m/review_actions/,https://api.osf.io/v2/preprints/wab8m/requests/,https://api.osf.io/v2/preprints/wab8m/,https://osf.io/preprints/socarxiv/wab8m/,https://doi.org/10.31235/osf.io/wab8m
tg6vn,preprints,2020-07-02T08:38:16.287116,2020-07-21T08:10:07.515461,2020-07-02T08:50:28.189501,NA,NA,Getting to the bottom of research funding: Acknowledging the complexity of funding dynamics,"Research funding is an important factor for public science. Funding can affect which research topics get addressed, and what research outputs are produced. However, funding has often been studied simplistically, using top-down or system-led perspectives. These can restrict analysis to national funding landscapes or single funding organisations and instruments in isolation. This overlooks interlinkages and potentially broader funding that researchers might access. We instead frame an alternative ‘bottom-up’ approach, using individual researchers as the entry point. For two test research fields (food science, renewable energy research) we analyse articles published 2009–18 as an example funded research activity. Here we trace researcher funding via article funding acknowledgements (FAs) of researchers affiliated to Denmark, the Netherlands or Norway. We then map field-level ‘co-funding networks’. These turn out to include heterogeneous funding from inside, outside and across these test countries. We further study article-level ‘funding amalgamations’ – the sum of all authors’ reported funding per article. These similarly show highly varied (co-)funding by funder ‘type’ (public, private, university or non-profit) and ‘origin’ (domestic, foreign or supranational). We note this approach has certain limitations but suggest it does advance our understanding of research funding dynamics. It provides an additional perspective, and appears adaptable to further analyses (e.g. of potential influences of co-funding). We lastly suggest several implications for science policy stemming from this bottom-up approach.",TRUE,FALSE,,2020-07-02T08:50:44.111829,NA,,TRUE,accepted,2020-07-02T08:50:28.189501,FALSE,NA,no,NA,,NA,NA,,NA,"5a8c80f7c698300375c76d84|5a8c80fac698300375c76e20|5a8c80fac698300375c76e40|Social and Behavioral Sciences|Sociology|Science, Knowledge, and Technology",,2020,https://api.osf.io/v2/preprints/tg6vn/contributors/,https://api.osf.io/v2/preprints/tg6vn/bibliographic_contributors/,https://api.osf.io/v2/preprints/tg6vn/citation/,tg6vn,preprints,https://api.osf.io/v2/preprints/tg6vn/identifiers/,NA,https://api.osf.io/v2/preprints/tg6vn/relationships/node/,NA,NA,https://api.osf.io/v2/licenses/563c1cf88c5e4a3877f9e96a/,563c1cf88c5e4a3877f9e96a,licenses,https://api.osf.io/v2/providers/preprints/socarxiv/,socarxiv,preprint-providers,https://api.osf.io/v2/preprints/tg6vn/files/,https://api.osf.io/v2/files/5efd9cfbaf115600a43b4805/,5efd9cfbaf115600a43b4805,files,https://api.osf.io/v2/preprints/tg6vn/review_actions/,https://api.osf.io/v2/preprints/tg6vn/requests/,https://api.osf.io/v2/preprints/tg6vn/,https://osf.io/preprints/socarxiv/tg6vn/,https://doi.org/10.31235/osf.io/tg6vn
