id,type,attributes.date_created,attributes.date_modified,attributes.date_published,attributes.original_publication_date,attributes.doi,attributes.title,attributes.description,attributes.is_published,attributes.is_preprint_orphan,attributes.tags,attributes.preprint_doi_created,attributes.date_withdrawn,attributes.current_user_permissions,attributes.public,attributes.reviews_state,attributes.date_last_transitioned,attributes.has_coi,attributes.conflict_of_interest_statement,attributes.has_data_links,attributes.why_no_data,attributes.data_links,attributes.has_prereg_links,attributes.why_no_prereg,attributes.prereg_links,attributes.prereg_link_info,attributes.subjects,attributes.license_record.copyright_holders,attributes.license_record.year,relationships.contributors.links.related.href,relationships.bibliographic_contributors.links.related.href,relationships.citation.links.related.href,relationships.citation.data.id,relationships.citation.data.type,relationships.identifiers.links.related.href,relationships.node.links.self.href,relationships.node.links.related.href,relationships.node.data.id,relationships.node.data.type,relationships.license.links.related.href,relationships.license.data.id,relationships.license.data.type,relationships.provider.links.related.href,relationships.provider.data.id,relationships.provider.data.type,relationships.files.links.related.href,relationships.primary_file.links.related.href,relationships.primary_file.data.id,relationships.primary_file.data.type,relationships.review_actions.links.related.href,relationships.requests.links.related.href,links.self,links.html,links.preprint_doi,links.doi
v4wc8,preprints,2020-06-24T16:27:03.417325,2020-06-25T07:26:55.206300,2020-06-25T07:26:15.949150,NA,NA,Symbol Systems and Social Structures,"Symbol systems and social structures are prominent concepts with long historical legacies in the social sciences. This chapter traces how symbol systems and social structures have been theorized independently of each other in the social sciences during the 20th century, before elaborating the ways in which sociologists have theorized the relationship between the two. Marx, Weber, and Simmel offered important ideas about this relationship, but Durkheim’s account of the social origins of mental structures provides the most direct and elaborated theory about the relationship between mental and social structures within the classical sociological period. Subsequently, we trace Durkheim’s legacy through three contemporary perspectives: field theory, neo-institutionalism, and culture and cognition. While maintaining analytical continuity with the Durkheimian tradition, these perspectives also represent new theoretical, analytical, and methodological advances in locating and specifying correspondences between symbol systems and social structures. Nevertheless, we find that pressing questions remain pertaining to how symbol systems and social structures interrelate, and how exactly this relationship shapes both cognition and action.",TRUE,FALSE,cognition|culture|fields|organizations|social structures|symbol systems,2020-06-25T07:26:55.191916,NA,,TRUE,accepted,2020-06-25T07:26:15.949150,FALSE,NA,not_applicable,NA,,NA,NA,,NA,5a8c80f7c698300375c76d84|5a8c80fac698300375c76e20|Social and Behavioral Sciences|Sociology,None,2020,https://api.osf.io/v2/preprints/v4wc8/contributors/,https://api.osf.io/v2/preprints/v4wc8/bibliographic_contributors/,https://api.osf.io/v2/preprints/v4wc8/citation/,v4wc8,preprints,https://api.osf.io/v2/preprints/v4wc8/identifiers/,https://api.osf.io/v2/preprints/v4wc8/relationships/node/,NA,NA,NA,https://api.osf.io/v2/licenses/563c1cf88c5e4a3877f9e965/,563c1cf88c5e4a3877f9e965,licenses,https://api.osf.io/v2/providers/preprints/socarxiv/,socarxiv,preprint-providers,https://api.osf.io/v2/preprints/v4wc8/files/,https://api.osf.io/v2/files/5ef37eda145b1a02d952e6ac/,5ef37eda145b1a02d952e6ac,files,https://api.osf.io/v2/preprints/v4wc8/review_actions/,https://api.osf.io/v2/preprints/v4wc8/requests/,https://api.osf.io/v2/preprints/v4wc8/,https://osf.io/preprints/socarxiv/v4wc8/,https://doi.org/10.31235/osf.io/v4wc8,NA
4whvs,preprints,2020-06-24T15:21:19.469075,2020-07-06T18:01:42.851376,2020-06-24T15:29:05.096554,NA,NA,Assortative Mating and Labor Income Inequality: Evidence from Fifty Years of Coupling in the U.S.,"Labor income inequality among couples has increased by 33 percent in the U.S. over the past half-century. Over the same period, the correlation of labor income within couples has also increased sharply. Is this increase in sorting over labor income a cause for the rise of labor income inequality among couples? Using the March supplement of the CPS, first, I find that there has been a sharp increase in positive sorting over labor income in the U.S. in the 1970-2018 period. The top decile of men’s earners married to the top decile of women’s earners has doubled from 10.6 percent in 1970 to 23.3 percent in 2018. Second, I use a bounded copula framework as a reference distribution to track the relative changes in labor income inequality among couples. Using this framework, I find that positive sorting over labor income did play a role in increasing labor income inequality among couples in the 1970-1990 period; however, I find little evidence to suggest that this relationship existed in the 1990-2018 period. (Stone Center on Socio-Economic Inequality Working Paper)",TRUE,FALSE,Assortative Mating|Bounded Copula|Employment|Family Structure|Income Inequality|Labor|Stone Center Working Paper Series,2020-06-24T16:45:00.932214,NA,,TRUE,accepted,2020-06-24T15:29:05.096554,FALSE,NA,not_applicable,NA,,NA,NA,,NA,5a8c80f7c698300375c76d84|5a8c80f8c698300375c76dbe|5a8c80f8c698300375c76dc2|Social and Behavioral Sciences|Economics|Income Distribution|5a8c80f7c698300375c76d84|5a8c80f8c698300375c76dbe|5a8c80f8c698300375c76dc3|Social and Behavioral Sciences|Economics|Labor Economics,,2020,https://api.osf.io/v2/preprints/4whvs/contributors/,https://api.osf.io/v2/preprints/4whvs/bibliographic_contributors/,https://api.osf.io/v2/preprints/4whvs/citation/,4whvs,preprints,https://api.osf.io/v2/preprints/4whvs/identifiers/,https://api.osf.io/v2/preprints/4whvs/relationships/node/,NA,NA,NA,https://api.osf.io/v2/licenses/563c1cf88c5e4a3877f9e96a/,563c1cf88c5e4a3877f9e96a,licenses,https://api.osf.io/v2/providers/preprints/socarxiv/,socarxiv,preprint-providers,https://api.osf.io/v2/preprints/4whvs/files/,https://api.osf.io/v2/files/5ef36f7676ebd802b4cd70c0/,5ef36f7676ebd802b4cd70c0,files,https://api.osf.io/v2/preprints/4whvs/review_actions/,https://api.osf.io/v2/preprints/4whvs/requests/,https://api.osf.io/v2/preprints/4whvs/,https://osf.io/preprints/socarxiv/4whvs/,https://doi.org/10.31235/osf.io/4whvs,NA
pa3bc,preprints,2020-06-24T08:27:11.523898,2020-11-16T15:59:57.465186,2020-06-24T18:42:08.921681,NA,10.1016/j.gloenvcha.2020.102198,Co-designing global target-seeking scenarios: a cross-scale participatory process for capturing multiple perspectives on pathways to sustainability,"The United Nations 2030 Agenda catalysed the development of global target-seeking sustainability-oriented scenarios representing alternative pathways to reach the Sustainable Development Goals (SDGs). Implementing the SDGs requires connected actions across local, national, regional, and global levels; thus, target-seeking scenarios need to reflect alternative options and tensions across those scales. We argue that the design of global sustainability-oriented target-seeking scenarios requires a consistent process for capturing multiple and contrasting perspectives on how to reach the goals, including the perspectives from multiple scales (e.g. local, national, regional) and geographic regions (e.g. the Global South). Here we propose a novel approach to co-design global target-seeking scenarios, consisting of (a) capturing global perspectives on pathways to the SDGs through a review of existing global scenarios; (b) a multi-stakeholder process to obtain multiple sub-global perspectives on pathways to sustainability; (c) an analysis of convergences, and crucially, divergences between global and regional perspectives on pathways to reach the SDGs, feeding into the design of new target-seeking scenario narratives. As a case study, we use the results of the 2018 African Dialogue on The World in 2050, discussing the future of agriculture and food systems. The identified divergent themes emerging from our analysis included urbanization, population growth, agricultural practices, and the roles of different actors in the future of agriculture. The results challenge some of the existing underlying assumptions of the current sustainability-oriented global scenarios (e.g. population growth, urbanisation, agricultural practices), indicating the relevance and timeliness of the proposed approach. We suggest that similar approaches can be replicated in other contexts to better inform the process of sustainability-oriented scenario co-design across scales, regions and cultures.",TRUE,FALSE,cross-scale analysis|food system transformation|pathways|Sustainable Development Goals|target-seeking scenarios|Three Horizons,2020-06-24T18:42:21.779660,NA,,TRUE,accepted,2020-06-24T18:42:08.921681,FALSE,NA,no,Please get in touch with authors to get access.,,NA,NA,,NA,5a8c80f7c698300375c76d84|5a8c80f8c698300375c76dbd|Social and Behavioral Sciences|Environmental Studies,,2020,https://api.osf.io/v2/preprints/pa3bc/contributors/,https://api.osf.io/v2/preprints/pa3bc/bibliographic_contributors/,https://api.osf.io/v2/preprints/pa3bc/citation/,pa3bc,preprints,https://api.osf.io/v2/preprints/pa3bc/identifiers/,https://api.osf.io/v2/preprints/pa3bc/relationships/node/,NA,NA,NA,https://api.osf.io/v2/licenses/563c1cf88c5e4a3877f9e96a/,563c1cf88c5e4a3877f9e96a,licenses,https://api.osf.io/v2/providers/preprints/socarxiv/,socarxiv,preprint-providers,https://api.osf.io/v2/preprints/pa3bc/files/,https://api.osf.io/v2/files/5ef30e6676ebd80293cdf977/,5ef30e6676ebd80293cdf977,files,https://api.osf.io/v2/preprints/pa3bc/review_actions/,https://api.osf.io/v2/preprints/pa3bc/requests/,https://api.osf.io/v2/preprints/pa3bc/,https://osf.io/preprints/socarxiv/pa3bc/,https://doi.org/10.31235/osf.io/pa3bc,https://doi.org/10.1016/j.gloenvcha.2020.102198
sjdt6,preprints,2020-06-24T07:19:33.532053,2020-06-24T18:40:45.469765,2020-06-24T18:40:26.653861,NA,NA,Parity disparity: Educational differences in Nordic fertility across parities and number of reproductive partners,"Most research on trends in socioeconomic fertility differences focus on cohort total fertility.
This study asks how cohort trends in parity-specific fertility differ across educational
segments for men and women, and what role multi-partner fertility plays in these trends. The
study used Finnish and Swedish register data on cohorts born in 1940–1973/1978. The main
analyses use parity progression ratios. Ordinary ratios were contrasted with ratios on births to
first reproductive partner. Among low- and medium-educated persons we observe parity
polarization, where both childlessness and higher parity (3+) births increase, largely
reflecting increases in multi-partner fertility. Highly educated men and women more often
have exactly two children. We demonstrate that cohort total fertility can mask significant
parity-specific trends across educational groups, and that changes in multi-partner fertility
can be a part and parcel of cohort trends in socioeconomic fertility differentials.",TRUE,FALSE,childlessness|cohort|education|Fertility|gender|multi-partner fertility|Nordic countries|parity|parity progression ratios|socioeconomic,2020-06-24T18:40:45.445932,NA,,TRUE,accepted,2020-06-24T18:40:26.653861,FALSE,NA,no,Licenses to use data are granted by Stastistics Finland (www.stat.fi/index_en) and Statistics Sweden (www.scb.se/en/).,,NA,NA,,NA,"5a8c80f7c698300375c76d84|5a8c80fac698300375c76e20|5a8c80fac698300375c76e26|Social and Behavioral Sciences|Sociology|Sociology of Education|5a8c80f7c698300375c76d84|5a8c80fac698300375c76e20|5a8c80fac698300375c76e3e|Social and Behavioral Sciences|Sociology|Population|5a8c80f7c698300375c76d84|5a8c80fac698300375c76e20|5a8c80fac698300375c76e44|Social and Behavioral Sciences|Sociology|Race, Gender, and Class|5a8c80f7c698300375c76d84|5a8c80fac698300375c76e20|5a8c80fac698300375c76e4c|Social and Behavioral Sciences|Sociology|Family",Marika Jalovaara; Linus Andersson; Anneli Miettinen,2020,https://api.osf.io/v2/preprints/sjdt6/contributors/,https://api.osf.io/v2/preprints/sjdt6/bibliographic_contributors/,https://api.osf.io/v2/preprints/sjdt6/citation/,sjdt6,preprints,https://api.osf.io/v2/preprints/sjdt6/identifiers/,https://api.osf.io/v2/preprints/sjdt6/relationships/node/,https://api.osf.io/v2/nodes/m6r8t/,m6r8t,nodes,https://api.osf.io/v2/licenses/563c1cf88c5e4a3877f9e965/,563c1cf88c5e4a3877f9e965,licenses,https://api.osf.io/v2/providers/preprints/socarxiv/,socarxiv,preprint-providers,https://api.osf.io/v2/preprints/sjdt6/files/,https://api.osf.io/v2/files/5ef2fe8a145b1a02b052e44c/,5ef2fe8a145b1a02b052e44c,files,https://api.osf.io/v2/preprints/sjdt6/review_actions/,https://api.osf.io/v2/preprints/sjdt6/requests/,https://api.osf.io/v2/preprints/sjdt6/,https://osf.io/preprints/socarxiv/sjdt6/,https://doi.org/10.31235/osf.io/sjdt6,NA
938ve,preprints,2020-06-24T04:56:36.493815,2021-01-28T08:11:29.627363,2020-06-24T18:39:28.729560,NA,10.1080/13229400.2020.1835694,Online partnering and family related outcomes in Germany,"In recent years, the Internet has become an increasingly important venue for meeting partners. While meeting online may have a range of effects on family-related outcomes, studies on the link between meeting online and family-related outcomes are scarce. Using eight follow-up waves of the German Family Panel (Pairfam), with observations from 8,177 persons from three birth cohorts between 2009 and 2016, this study investigates whether meeting online is associated with relationship satisfaction, intention to separate, separation, moving in together, intentions to have a child, and entry into parenthood. More specifically, a series of between-person regressions are used to compare those who met their partners offline and those who met their partners online. Results show that meeting online is associated with likelihood to separate and intentions to have a child in the youngest birth cohort, and transition to parenthood in the oldest birth cohort. These findings are discussed with the concepts of selectivity and intentionality in searching for and meeting partners online.",TRUE,FALSE,digitalization|family-related outcomes|Germany|Internet|meeting online,2020-06-24T18:39:57.534918,NA,,TRUE,accepted,2020-06-24T18:39:28.729560,FALSE,NA,available,NA,https://www.pairfam.de/en/data/data-access/,NA,NA,,NA,"5a8c80f7c698300375c76d84|5a8c80fac698300375c76e20|5a8c80fac698300375c76e34|Social and Behavioral Sciences|Sociology|Communication, Information Technologies, and Media Sociology|5a8c80f7c698300375c76d84|5a8c80fac698300375c76e20|5a8c80fac698300375c76e4c|Social and Behavioral Sciences|Sociology|Family",Mirkka Danielsbacka; Antti O. Tanskanen; Francesco Billari,2020,https://api.osf.io/v2/preprints/938ve/contributors/,https://api.osf.io/v2/preprints/938ve/bibliographic_contributors/,https://api.osf.io/v2/preprints/938ve/citation/,938ve,preprints,https://api.osf.io/v2/preprints/938ve/identifiers/,https://api.osf.io/v2/preprints/938ve/relationships/node/,NA,NA,NA,https://api.osf.io/v2/licenses/563c1cf88c5e4a3877f9e965/,563c1cf88c5e4a3877f9e965,licenses,https://api.osf.io/v2/providers/preprints/socarxiv/,socarxiv,preprint-providers,https://api.osf.io/v2/preprints/938ve/files/,https://api.osf.io/v2/files/5ef2dd0a6598280280cf274d/,5ef2dd0a6598280280cf274d,files,https://api.osf.io/v2/preprints/938ve/review_actions/,https://api.osf.io/v2/preprints/938ve/requests/,https://api.osf.io/v2/preprints/938ve/,https://osf.io/preprints/socarxiv/938ve/,https://doi.org/10.31235/osf.io/938ve,https://doi.org/10.1080/13229400.2020.1835694
2bdzr,preprints,2020-06-24T04:55:11.677927,2020-06-24T18:49:25.677199,2020-06-24T18:49:12.762195,2019-05-04T14:00:00,10.1016/j.annals.2019.04.008,BRILLIANCE IS SUCCINCT - Embrace and respect the short communication,"This viewpoint  puts forward an argument in support of short communication formats. Such formats are still frowned upon my many universities. Wrongly so. Some of the most brilliant ideas of our time were communicated in short 
notes.",TRUE,FALSE,research note|short communication,2020-06-24T18:49:25.652278,NA,,TRUE,accepted,2020-06-24T18:49:12.762195,FALSE,NA,not_applicable,NA,,NA,NA,,NA,5a8c80f7c698300375c76d84|5a8c80f7c698300375c76d96|Social and Behavioral Sciences|Other Social and Behavioral Sciences|5a8c80f7c698300375c76d84|5a8c80f7c698300375c76d98|Social and Behavioral Sciences|Psychology|5a8c80f7c698300375c76d84|5a8c80f8c698300375c76dbd|Social and Behavioral Sciences|Environmental Studies|5a8c80f7c698300375c76d84|5a8c80f8c698300375c76dd0|Social and Behavioral Sciences|Leisure Studies|5a8c80f7c698300375c76d84|5a8c80fac698300375c76e20|Social and Behavioral Sciences|Sociology,,2020,https://api.osf.io/v2/preprints/2bdzr/contributors/,https://api.osf.io/v2/preprints/2bdzr/bibliographic_contributors/,https://api.osf.io/v2/preprints/2bdzr/citation/,2bdzr,preprints,https://api.osf.io/v2/preprints/2bdzr/identifiers/,https://api.osf.io/v2/preprints/2bdzr/relationships/node/,https://api.osf.io/v2/nodes/8fg7u/,8fg7u,nodes,https://api.osf.io/v2/licenses/563c1cf88c5e4a3877f9e96c/,563c1cf88c5e4a3877f9e96c,licenses,https://api.osf.io/v2/providers/preprints/socarxiv/,socarxiv,preprint-providers,https://api.osf.io/v2/preprints/2bdzr/files/,https://api.osf.io/v2/files/5ef2dcb576ebd80293cd9b26/,5ef2dcb576ebd80293cd9b26,files,https://api.osf.io/v2/preprints/2bdzr/review_actions/,https://api.osf.io/v2/preprints/2bdzr/requests/,https://api.osf.io/v2/preprints/2bdzr/,https://osf.io/preprints/socarxiv/2bdzr/,https://doi.org/10.31235/osf.io/2bdzr,https://doi.org/10.1016/j.annals.2019.04.008
yu26b,preprints,2020-06-24T04:44:37.183015,2020-06-27T13:49:56.380843,2020-06-27T13:49:12.937621,2019-07-06T14:00:00,10.1016/j.annals.2019.05.003,Reduce reuse … and don’t recycle! On text reuse in academic articles,This viewpoint discusses how text duplication is determined by publishers and provides practical recommendations for authors on how they can avoid text duplication in their manuscripts.,TRUE,FALSE,integrity|plagiarism|selfplagiarism|text reuse,2020-06-27T13:49:56.363331,NA,,TRUE,accepted,2020-06-27T13:49:12.937621,FALSE,NA,not_applicable,NA,,NA,NA,,NA,5a8c80f7c698300375c76d84|5a8c80f7c698300375c76d96|Social and Behavioral Sciences|Other Social and Behavioral Sciences|5a8c80f7c698300375c76d84|5a8c80f8c698300375c76dd0|Social and Behavioral Sciences|Leisure Studies|5a8c80f7c698300375c76d84|5a8c80fac698300375c76e20|Social and Behavioral Sciences|Sociology,,2020,https://api.osf.io/v2/preprints/yu26b/contributors/,https://api.osf.io/v2/preprints/yu26b/bibliographic_contributors/,https://api.osf.io/v2/preprints/yu26b/citation/,yu26b,preprints,https://api.osf.io/v2/preprints/yu26b/identifiers/,https://api.osf.io/v2/preprints/yu26b/relationships/node/,https://api.osf.io/v2/nodes/8fg7u/,8fg7u,nodes,https://api.osf.io/v2/licenses/563c1cf88c5e4a3877f9e96c/,563c1cf88c5e4a3877f9e96c,licenses,https://api.osf.io/v2/providers/preprints/socarxiv/,socarxiv,preprint-providers,https://api.osf.io/v2/preprints/yu26b/files/,https://api.osf.io/v2/files/5ef2da3b76ebd80292cd86bd/,5ef2da3b76ebd80292cd86bd,files,https://api.osf.io/v2/preprints/yu26b/review_actions/,https://api.osf.io/v2/preprints/yu26b/requests/,https://api.osf.io/v2/preprints/yu26b/,https://osf.io/preprints/socarxiv/yu26b/,https://doi.org/10.31235/osf.io/yu26b,https://doi.org/10.1016/j.annals.2019.05.003
xgscj,preprints,2020-06-23T22:51:06.711085,2020-06-24T09:29:00.993417,2020-06-24T09:28:48.352362,NA,NA,America’s Most Divided Sport: Polarization and Inequality in Attitudes about Youth Football,"Football may be America’s most popular sport, but, with growing evidence of the risk of sport-associated concussions, some adults are reconsidering which sports they would encourage children to play. Using data from a nationally representative sample of 958 respondents, we examine how political party, belief in patriotic displays in sport, attention to concussion news, social class, and race are associated with encouragement of children playing each of the five major U.S. sports: baseball, basketball, hockey, soccer, and football. Our findings suggest that unlike other sports, attitudes about youth participation in football are divided by views on patriotism in sport, age, race, education, and attention to concussion news. For many Americans, football is connected to participation in a civil religion, which celebrates national pride and respect for the military. We argue that child safety advocates who aim to steer children away from football must grapple with the deeper cultural and identity-based framework associated with the sport.",TRUE,FALSE,attitudinal research|children|inequality|patriotism|political sociology|sport,2020-06-24T09:29:00.976362,NA,,TRUE,accepted,2020-06-24T09:28:48.352362,FALSE,NA,no,Data will be posted immediately after publication.,,NA,NA,,NA,5a8c80f7c698300375c76d84|5a8c80fac698300375c76e20|5a8c80fac698300375c76e50|Social and Behavioral Sciences|Sociology|Other Sociology,,2020,https://api.osf.io/v2/preprints/xgscj/contributors/,https://api.osf.io/v2/preprints/xgscj/bibliographic_contributors/,https://api.osf.io/v2/preprints/xgscj/citation/,xgscj,preprints,https://api.osf.io/v2/preprints/xgscj/identifiers/,https://api.osf.io/v2/preprints/xgscj/relationships/node/,https://api.osf.io/v2/nodes/ncjfq/,ncjfq,nodes,https://api.osf.io/v2/licenses/563c1cf88c5e4a3877f9e96a/,563c1cf88c5e4a3877f9e96a,licenses,https://api.osf.io/v2/providers/preprints/socarxiv/,socarxiv,preprint-providers,https://api.osf.io/v2/preprints/xgscj/files/,https://api.osf.io/v2/files/5ef2875e145b1a028752f04f/,5ef2875e145b1a028752f04f,files,https://api.osf.io/v2/preprints/xgscj/review_actions/,https://api.osf.io/v2/preprints/xgscj/requests/,https://api.osf.io/v2/preprints/xgscj/,https://osf.io/preprints/socarxiv/xgscj/,https://doi.org/10.31235/osf.io/xgscj,NA
