id,type,attributes.date_created,attributes.date_modified,attributes.date_published,attributes.original_publication_date,attributes.doi,attributes.title,attributes.description,attributes.is_published,attributes.is_preprint_orphan,attributes.tags,attributes.preprint_doi_created,attributes.date_withdrawn,attributes.current_user_permissions,attributes.public,attributes.reviews_state,attributes.date_last_transitioned,attributes.has_coi,attributes.conflict_of_interest_statement,attributes.has_data_links,attributes.why_no_data,attributes.data_links,attributes.has_prereg_links,attributes.why_no_prereg,attributes.prereg_links,attributes.prereg_link_info,attributes.subjects,attributes.license_record.copyright_holders,attributes.license_record.year,relationships.contributors.links.related.href,relationships.bibliographic_contributors.links.related.href,relationships.citation.links.related.href,relationships.citation.data.id,relationships.citation.data.type,relationships.identifiers.links.related.href,relationships.node.links.related.href,relationships.node.links.self.href,relationships.node.data.id,relationships.node.data.type,relationships.license.links.related.href,relationships.license.data.id,relationships.license.data.type,relationships.provider.links.related.href,relationships.provider.data.id,relationships.provider.data.type,relationships.files.links.related.href,relationships.primary_file.links.related.href,relationships.primary_file.data.id,relationships.primary_file.data.type,relationships.review_actions.links.related.href,relationships.requests.links.related.href,links.self,links.html,links.preprint_doi
un7t3,preprints,2020-01-28T17:34:01.802426,2020-01-28T21:33:45.551078,2020-01-28T17:40:46.836181,2017-05-02T18:30:00,NA,Institutional and Policy aspects of Promoting Entrepreneurship as a Career Goal among Youth,"Many countries around the world both developed and developing are trying to promote entrepreneurship in order to boost rural economy. However, there has been no systematic attempt to look at it from a youth angle as their career goal. The main objective of this study was to examine the entrepreneurship development policy and institutional support dimensions towards the entrepreneurial expectations for choose entrepreneurship as their career goal referring to youth segment. For this study, 70 registered youth entrepreneurs from 10 different sectors of the VIDATHA program of Ministry of Technology and Research (MTR) during the year 2012 were identified. The primary data was collected directly from a youth through questionnaire.  Regression model was utilized for predicting the level of youth entrepreneurs’ expectation as a dependent Variable and the independent variables categorized using entrepreneurship policy criteria (policy relevance, efficiency, effectiveness, sustainability) and Institutional support criteria (entrepreneurial culture, education, business development support and access to finance). The results of the study advocated that promotion of entrepreneurial culture and business development support services were the significant contributors for the youth entrepreneurs’ expectations towards Institutional Support and the efficiency of the policy is the significant unique contributor to the prediction of youth entrepreneurs’ expectation towards entrepreneurship policy. The major challenge faced by youth entrepreneurs is to transform their enterprises into commercially viable, competitive business. Also entrepreneurship development projects have different goals and objectives, in terms of target group, political agenda and types of interventions. Further, there is no single policy model for encouragement and promotion of entrepreneurial activity among youth. Therefore, it is recommend establishing single institutional framework for promotion of entrepreneurial activity among youth and suggesting for formulating single policy model for encouragement and promotion of entrepreneurial activity among youth and key promoting agency with the combination of all sectors.",TRUE,FALSE,Career Option|Entrepreneurship Development|Entrepreneurship Policy|Institutional Support|Youth Entrepreneurship,2020-01-28T21:33:45.530231,NA,,TRUE,accepted,2020-01-28T17:40:46.836181,NA,NA,NA,NA,,NA,NA,,NA,5a8c80f7c698300375c76d84|5a8c80f7c698300375c76d96|Social and Behavioral Sciences|Other Social and Behavioral Sciences,D. W. C. Padmini Dambugolla,2017,https://api.osf.io/v2/preprints/un7t3/contributors/,https://api.osf.io/v2/preprints/un7t3/bibliographic_contributors/,https://api.osf.io/v2/preprints/un7t3/citation/,un7t3,preprints,https://api.osf.io/v2/preprints/un7t3/identifiers/,https://api.osf.io/v2/nodes/e3wvz/,https://api.osf.io/v2/preprints/un7t3/relationships/node/,e3wvz,nodes,https://api.osf.io/v2/licenses/563c1cf88c5e4a3877f9e965/,563c1cf88c5e4a3877f9e965,licenses,https://api.osf.io/v2/providers/preprints/socarxiv/,socarxiv,preprint-providers,https://api.osf.io/v2/preprints/un7t3/files/,https://api.osf.io/v2/files/5e307098af7593007ebe14c1/,5e307098af7593007ebe14c1,files,https://api.osf.io/v2/preprints/un7t3/review_actions/,https://api.osf.io/v2/preprints/un7t3/requests/,https://api.osf.io/v2/preprints/un7t3/,https://osf.io/preprints/socarxiv/un7t3/,https://doi.org/10.31235/osf.io/un7t3
tue6x,preprints,2020-01-28T12:25:37.012039,2020-06-06T13:10:23.774999,2020-01-28T17:37:23.347530,NA,NA,"Elegant Security: Concept, Evidence and Implications","Some security devices can be ugly, inconvenient or an infringement on civil liberties. This means that security is a quality of life issue as well as one of crime prevention. Here we propose that, in addition to preventing crime and being cost effective, security should preferably be ethical and unobtrusive, aesthetically neutral or pleasing, and the easy-to-use or default option. We describe security with such characteristics as ‘elegant’. We use two case studies to explore how, as many types of crime have declined in recent decades, there was an increase in elegant and a decrease in inelegant security. We suggest that the lifecycle of some security technologies sees them evolve from inelegant to elegant, that continual improvement is required to keep ahead of offender adaptations, and that inelegant security can fall into disuse even if it prevents crime. It is hoped that this conceptual contribution might inform discussions about the appropriate form and role of security.",TRUE,FALSE,civil liberties|crime decline|crime drop|dapper|elegant security|security|situartional crime prevention|surveillance society,2020-01-28T21:32:24.241076,NA,,TRUE,accepted,2020-01-28T17:37:23.347530,FALSE,NA,NA,NA,,NA,NA,,NA,"5a8c80f0c698300375c76c07|Law|5a8c80f7c698300375c76d84|5a8c80fac698300375c76e20|5a8c80fac698300375c76e2b|Social and Behavioral Sciences|Sociology|Crime, Law, and Deviance",,2020,https://api.osf.io/v2/preprints/tue6x/contributors/,https://api.osf.io/v2/preprints/tue6x/bibliographic_contributors/,https://api.osf.io/v2/preprints/tue6x/citation/,tue6x,preprints,https://api.osf.io/v2/preprints/tue6x/identifiers/,NA,https://api.osf.io/v2/preprints/tue6x/relationships/node/,NA,NA,https://api.osf.io/v2/licenses/563c1cf88c5e4a3877f9e96a/,563c1cf88c5e4a3877f9e96a,licenses,https://api.osf.io/v2/providers/preprints/socarxiv/,socarxiv,preprint-providers,https://api.osf.io/v2/preprints/tue6x/files/,https://api.osf.io/v2/files/5e302843e71ef8005b18c24b/,5e302843e71ef8005b18c24b,files,https://api.osf.io/v2/preprints/tue6x/review_actions/,https://api.osf.io/v2/preprints/tue6x/requests/,https://api.osf.io/v2/preprints/tue6x/,https://osf.io/preprints/socarxiv/tue6x/,https://doi.org/10.31235/osf.io/tue6x
vysgr,preprints,2020-01-28T11:06:21.764376,2020-01-30T14:37:06.287481,2020-01-28T17:39:27.848659,NA,NA,"Maximizing the Impact of Community Information Centres on Education, Health and Development in the Age of Computers and Mobile Technologies","Community information service (CIS)-related publications agree that people in communities, especially rural, need information and should be helped to have it for solving daily life’s problems and developing themselves and community. From the publications, it is evident that advent of computers and mobile technologies or information and communication technologies (ICTs) had caused an uncleared confusion in naming and operating a CIS. Aimed at highlighting this problem and giving a recipe for a CIS to impact maximally on education, health and overall development, this work is a critical analysis of the literature. It found most CISs reported on inadequate and ineffective. While a majority of sponsors believe that CIS is solely about ICTs, a few think it is about either a library or a combination of a library and ICTs. Ten names were found for a CIS, including community information centre (CIC), telecentre, community information and communication technology centre, community library, community multimedia centre, cybercafé and information kiosk. Stock and services provided depended on the name. One thing common is the expectation that people should go for information when they need it. There is little thought about the reality that many people may not know they need information and about how to serve people who are incapacitated in other ways to go or ask for information. Thinking critically about all these alongside the goal of CIS achievable only with ICT and non-ICT resources and strategies that match every community member’s differences, preferences, deficiencies and constraints, the researcher concludes that any other name than CIC is needless. This understanding brings about maximum impact, which can be supported with data from further researches.",TRUE,FALSE,community|computer|development|ICT|information centre|information service|mobile technologies,2020-01-28T21:33:03.747502,NA,,TRUE,accepted,2020-01-28T17:39:27.848659,NA,NA,NA,NA,,NA,NA,,NA,5a8c80f7c698300375c76d84|5a8c80f8c698300375c76dd4|Social and Behavioral Sciences|Library and Information Science,,2020,https://api.osf.io/v2/preprints/vysgr/contributors/,https://api.osf.io/v2/preprints/vysgr/bibliographic_contributors/,https://api.osf.io/v2/preprints/vysgr/citation/,vysgr,preprints,https://api.osf.io/v2/preprints/vysgr/identifiers/,NA,https://api.osf.io/v2/preprints/vysgr/relationships/node/,NA,NA,https://api.osf.io/v2/licenses/563c1cf88c5e4a3877f9e96a/,563c1cf88c5e4a3877f9e96a,licenses,https://api.osf.io/v2/providers/preprints/socarxiv/,socarxiv,preprint-providers,https://api.osf.io/v2/preprints/vysgr/files/,https://api.osf.io/v2/files/5e3015b8e71ef8005f1889c2/,5e3015b8e71ef8005f1889c2,files,https://api.osf.io/v2/preprints/vysgr/review_actions/,https://api.osf.io/v2/preprints/vysgr/requests/,https://api.osf.io/v2/preprints/vysgr/,https://osf.io/preprints/socarxiv/vysgr/,https://doi.org/10.31235/osf.io/vysgr
gj2kf,preprints,2020-01-28T07:25:26.071427,2020-01-28T21:35:45.201934,2020-01-28T17:55:24.849949,NA,NA,Ethical by Design: Measuring and Managing Digital Ethics in the Enterprise,"Since the Cambridge Analytica/ Facebook scandal the question of how to manage Ethics in the context of Digital technologies has risen in prominence from afterthought, to keynote agenda item. The problem is not simply that Ethics as a domain of governance is not well understood by the technology industry, but that it is either restricted in mainstream dialogue to a discussion of risk and safety issues, or it is conflated with regulatory compliance. The terms used to for structures to manage ethics, such as ‘Ethics Boards’ and ‘Ethics Councils’ are also used interchangeably. What this paper proposes is to define Digital Ethics in terms where it becomes clear that it is necessarily a separate topic of governance to regulatory compliance and technical risk/ safety management. This paper also suggests some defining characteristics of Ethics Boards and Councils and proposes alternative models. Finally, a case is made for how the quality of ethics governance can be measured and therefore managed, in order to build comparisons between organisations in language that will be familiar to investors and consumers. It is believed that in doing so, the difficulty of talking of this subject in purely subjective terms can be avoided.",TRUE,FALSE,artificial intelligence|digital ethics|ESG|intersubjectivity|philosophy|regulation|risk management,2020-01-28T21:35:45.185076,NA,,TRUE,accepted,2020-01-28T17:55:24.849949,NA,NA,NA,NA,,NA,NA,,NA,5a8c80f2c698300375c76c7d|5a8c80f5c698300375c76cf4|5a8c80f5c698300375c76cfe|Arts and Humanities|Philosophy|Ethics and Political Philosophy,,2020,https://api.osf.io/v2/preprints/gj2kf/contributors/,https://api.osf.io/v2/preprints/gj2kf/bibliographic_contributors/,https://api.osf.io/v2/preprints/gj2kf/citation/,gj2kf,preprints,https://api.osf.io/v2/preprints/gj2kf/identifiers/,NA,https://api.osf.io/v2/preprints/gj2kf/relationships/node/,NA,NA,https://api.osf.io/v2/licenses/563c1cf88c5e4a3877f9e96a/,563c1cf88c5e4a3877f9e96a,licenses,https://api.osf.io/v2/providers/preprints/socarxiv/,socarxiv,preprint-providers,https://api.osf.io/v2/preprints/gj2kf/files/,https://api.osf.io/v2/files/5e2fe1eae71ef80047190167/,5e2fe1eae71ef80047190167,files,https://api.osf.io/v2/preprints/gj2kf/review_actions/,https://api.osf.io/v2/preprints/gj2kf/requests/,https://api.osf.io/v2/preprints/gj2kf/,https://osf.io/preprints/socarxiv/gj2kf/,https://doi.org/10.31235/osf.io/gj2kf
c3xg5,preprints,2020-01-27T22:18:12.228444,2020-01-28T21:35:04.571171,2020-01-28T17:42:43.494902,NA,NA,Is science a pyramid scheme? The correlation between an author's position in the academic hierarchy and her scientific output per year,"A grievance expressed by some PhD students and Postdocs is that science works like a pyramid scheme: Young scientists are encouraged to invest into building scientific careers although the chances at remaining in science are extremely slim. This issue is investigated quantitatively by connecting it with the way authorship on papers is distributed. I analyzed a large bibliographic dataset made available by Microsoft under the name Academic Graph  to create a histogram with the number of articles an author produces per year. The histogram has the shape of a pyramid, and different layers in it correlate with positions in the academic hierarchy. The super-prolific authors at the top of the pyramid with more than 40 publications per year are usually heads of large institutes with many subgroups and large numbers of PhD students, while the bottom of the pyramid is populated by PhD students and Postdocs with less than 5 publications per year. The mechanism that allows 'manager scientists' to appropriate publications generated in their sphere of influence is related to other issues, such as the evaluation of scientific performance based on scientometric indicators and the lenient enforcement of authorship rules. A new index, the Ponzi factor, is proposed to quantify this phenomenon.",TRUE,FALSE,authorship rules|Microsoft academic graph|pyramid scheme|scientific misconduct|scientific productivity|scientometrics|social stratification of academia,2020-01-28T21:35:04.551798,NA,,TRUE,accepted,2020-01-28T17:42:43.494902,NA,NA,NA,NA,,NA,NA,,NA,5a8c80f7c698300375c76d84|5a8c80f8c698300375c76dd4|5a8c80f8c698300375c76dd5|Social and Behavioral Sciences|Library and Information Science|Scholarly Publishing|5a8c80f7c698300375c76d84|5a8c80f9c698300375c76df4|Social and Behavioral Sciences|Science and Technology Studies,,2020,https://api.osf.io/v2/preprints/c3xg5/contributors/,https://api.osf.io/v2/preprints/c3xg5/bibliographic_contributors/,https://api.osf.io/v2/preprints/c3xg5/citation/,c3xg5,preprints,https://api.osf.io/v2/preprints/c3xg5/identifiers/,https://api.osf.io/v2/nodes/59zux/,https://api.osf.io/v2/preprints/c3xg5/relationships/node/,59zux,nodes,https://api.osf.io/v2/licenses/563c1cf88c5e4a3877f9e96a/,563c1cf88c5e4a3877f9e96a,licenses,https://api.osf.io/v2/providers/preprints/socarxiv/,socarxiv,preprint-providers,https://api.osf.io/v2/preprints/c3xg5/files/,https://api.osf.io/v2/files/5e2f61adaf75930035bdca96/,5e2f61adaf75930035bdca96,files,https://api.osf.io/v2/preprints/c3xg5/review_actions/,https://api.osf.io/v2/preprints/c3xg5/requests/,https://api.osf.io/v2/preprints/c3xg5/,https://osf.io/preprints/socarxiv/c3xg5/,https://doi.org/10.31235/osf.io/c3xg5
yzkfu,preprints,2020-01-27T21:50:32.152863,2020-01-28T21:35:45.337422,2020-01-28T17:56:16.777031,NA,NA,"Research metrics, labor markets, and epistemic change: evidence from Britain 1970-2018","In this paper, I study the effects of quantifying knowledge on the organization of disciplinary fields. Using an original dataset of about 44,000 British social scientists and bibliographic information about their published, peer-reviewed articles, I show that the introduction of standardized research evaluations disrupted local academic labor markets in British higher education, leading to patterns of interinstitutional mobility that altered the epistemic diversity of social science disciplines and the organization of their academic fields. Much like market-based interventions, research evaluations lead to a form of epistemic matching that has distinct consequences on how knowledge is generated. In particular, when evaluations affect organizational units (such as academic departments) and stress disciplinary norms, they foster forms of isomorphism that lead to reductions in a discipline’s thematic diversity and a more homogeneous structure for the field. This paper thus advances the sociology of knowledge by showing how epistemic change occurs not only through the individual realignments of quantified scholars but, as importantly, through the mediation of interinstitutional mobility.",TRUE,FALSE,computational social science|knowledge|quantification|research evaluation|science of science,2020-01-28T21:35:45.322606,NA,,TRUE,accepted,2020-01-28T17:56:16.777031,NA,NA,NA,NA,,NA,NA,,NA,"5a8c80f7c698300375c76d84|5a8c80fac698300375c76e20|5a8c80fac698300375c76e2d|Social and Behavioral Sciences|Sociology|Economic Sociology|5a8c80f7c698300375c76d84|5a8c80fac698300375c76e20|5a8c80fac698300375c76e40|Social and Behavioral Sciences|Sociology|Science, Knowledge, and Technology",,2020,https://api.osf.io/v2/preprints/yzkfu/contributors/,https://api.osf.io/v2/preprints/yzkfu/bibliographic_contributors/,https://api.osf.io/v2/preprints/yzkfu/citation/,yzkfu,preprints,https://api.osf.io/v2/preprints/yzkfu/identifiers/,NA,https://api.osf.io/v2/preprints/yzkfu/relationships/node/,NA,NA,https://api.osf.io/v2/licenses/563c1cf88c5e4a3877f9e96a/,563c1cf88c5e4a3877f9e96a,licenses,https://api.osf.io/v2/providers/preprints/socarxiv/,socarxiv,preprint-providers,https://api.osf.io/v2/preprints/yzkfu/files/,https://api.osf.io/v2/files/5e2f5b29af7593003dbdc108/,5e2f5b29af7593003dbdc108,files,https://api.osf.io/v2/preprints/yzkfu/review_actions/,https://api.osf.io/v2/preprints/yzkfu/requests/,https://api.osf.io/v2/preprints/yzkfu/,https://osf.io/preprints/socarxiv/yzkfu/,https://doi.org/10.31235/osf.io/yzkfu
2qfkt,preprints,2020-01-27T19:46:40.453107,2021-02-02T22:03:29.636609,2020-01-27T23:08:59.805186,NA,NA,No support for the genetic hypothesis of the Black-white achievement gap using polygenic scores and tests for divergent selection,"Objectives: Debate about the cause of IQ score gaps between Black and white populations has persisted within genetics, anthropology, and psychology. Recently, authors claimed polygenic scores provide evidence that a significant portion of differences in cognitive performance between Black and white populations are caused by genetic differences due to natural selection, the “hereditarian hypothesis”. This study aims to show conceptual and methodological flaws of past studies supporting the hereditarian hypothesis.
Materials and Methods: Polygenic scores for educational attainment were constructed for African and European samples of the 1000 Genomes Project. Evidence for selection was evaluated using an excess variance test. Education associated variants were further evaluated for signals of selection by testing for excess genetic differentiation (Fst). Expected mean difference in IQ for populations was calculated under a neutral evolutionary scenario and contrasted to hereditarian claims.
Results: Tests for selection using polygenic scores failed to find evidence of natural selection when the less biased within-family GWAS effect sizes were used. Tests for selection using Fst values did not find evidence of natural selection. Expected mean difference in IQ was substantially smaller than postulated by hereditarians, even under unrealistic assumptions that overestimate genetic contribution.
Conclusion: Given these results, hereditarian claims are not supported in the least. Cognitive performance does not appear to have been under diversifying selection in Europeans and Africans. In the absense of diversifying selection, the best case estimate for genetic contributions to group differences in cognitive performance is substantially smaller than hereditarians claim and is consistent with genetic differences contributing little to the Black-white gap.",TRUE,FALSE,Evolutionary Biology|Genetics|Genomics|Hereditarianism|Natural Selection|Race,2020-01-27T23:10:41.382453,NA,,TRUE,accepted,2020-01-27T23:08:59.805186,FALSE,NA,available,NA,https://zenodo.org/record/4284020#.YBnL__tKhuV,no,NA,,,5a8c80f7c698300375c76d84|5a8c80f9c698300375c76df6|5a8c80f9c698300375c76dfc|Social and Behavioral Sciences|Anthropology|Biological and Physical Anthropology,,2020,https://api.osf.io/v2/preprints/2qfkt/contributors/,https://api.osf.io/v2/preprints/2qfkt/bibliographic_contributors/,https://api.osf.io/v2/preprints/2qfkt/citation/,2qfkt,preprints,https://api.osf.io/v2/preprints/2qfkt/identifiers/,NA,https://api.osf.io/v2/preprints/2qfkt/relationships/node/,NA,NA,https://api.osf.io/v2/licenses/563c1cf88c5e4a3877f9e96a/,563c1cf88c5e4a3877f9e96a,licenses,https://api.osf.io/v2/providers/preprints/socarxiv/,socarxiv,preprint-providers,https://api.osf.io/v2/preprints/2qfkt/files/,https://api.osf.io/v2/files/5e2f3e23e71ef8001f1896d6/,5e2f3e23e71ef8001f1896d6,files,https://api.osf.io/v2/preprints/2qfkt/review_actions/,https://api.osf.io/v2/preprints/2qfkt/requests/,https://api.osf.io/v2/preprints/2qfkt/,https://osf.io/preprints/socarxiv/2qfkt/,https://doi.org/10.31235/osf.io/2qfkt
wugxs,preprints,2020-01-27T16:42:40.181925,2020-01-27T17:41:42.098187,2020-01-27T17:41:27.931116,NA,NA,Exploring public engagement with missing person appeals on Twitter,"Police agencies globally are seeing an increase in reports of people going missing. These people are often vulnerable, and their safe and early return is a key factor in preventing them from coming to serious harm. One approach to quickly find missing people is to disseminate appeals for information using social media. Yet despite the popularity of twitter-based missing person appeals, presently little is known about how to best construct these messages to ensure they are shared far and wide. This paper aims to build an evidence-base for understanding how police accounts tweet appeals for information about missing persons, and how the public engage with these tweets by sharing them. We analyse 1,008 Tweets made by Greater Manchester Police between the period of 2011 and 2018 in order to investigate what features of the tweet, the twitter account, and the missing person are associated with levels of retweeting. We find that tweets with different choice of image, wording, sentiment, and hashtags vary in how much they are retweeted. Tweets that use custody images have lower retweets than Tweets with regular photos, while tweets asking the question “have you seen...?” and asking explicitly to be retweeted have more engagement in the form of retweets. These results highlight the need for conscientious, evidence-based crafting of missing appeals, and pave the way for further research into the causal mechanisms behind what affects engagement, to develop guidance for police forces worldwide.",TRUE,FALSE,investigation|missing persons|police|public engagement|social media|twitter,2020-01-27T17:41:42.073860,NA,,TRUE,accepted,2020-01-27T17:41:27.931116,NA,NA,NA,NA,,NA,NA,,NA,5a8c80f7c698300375c76d84|5a8c80f9c698300375c76e0c|Social and Behavioral Sciences|Social Statistics,,2020,https://api.osf.io/v2/preprints/wugxs/contributors/,https://api.osf.io/v2/preprints/wugxs/bibliographic_contributors/,https://api.osf.io/v2/preprints/wugxs/citation/,wugxs,preprints,https://api.osf.io/v2/preprints/wugxs/identifiers/,https://api.osf.io/v2/nodes/4w5eg/,https://api.osf.io/v2/preprints/wugxs/relationships/node/,4w5eg,nodes,https://api.osf.io/v2/licenses/563c1cf88c5e4a3877f9e96a/,563c1cf88c5e4a3877f9e96a,licenses,https://api.osf.io/v2/providers/preprints/socarxiv/,socarxiv,preprint-providers,https://api.osf.io/v2/preprints/wugxs/files/,https://api.osf.io/v2/files/5e2f130787a1d9024e1cf640/,5e2f130787a1d9024e1cf640,files,https://api.osf.io/v2/preprints/wugxs/review_actions/,https://api.osf.io/v2/preprints/wugxs/requests/,https://api.osf.io/v2/preprints/wugxs/,https://osf.io/preprints/socarxiv/wugxs/,https://doi.org/10.31235/osf.io/wugxs
