id,type,attributes.date_created,attributes.date_modified,attributes.date_published,attributes.original_publication_date,attributes.doi,attributes.title,attributes.description,attributes.is_published,attributes.is_preprint_orphan,attributes.tags,attributes.preprint_doi_created,attributes.date_withdrawn,attributes.current_user_permissions,attributes.public,attributes.reviews_state,attributes.date_last_transitioned,attributes.has_coi,attributes.conflict_of_interest_statement,attributes.has_data_links,attributes.why_no_data,attributes.data_links,attributes.has_prereg_links,attributes.why_no_prereg,attributes.prereg_links,attributes.prereg_link_info,attributes.subjects,attributes.license_record.copyright_holders,attributes.license_record.year,relationships.contributors.links.related.href,relationships.bibliographic_contributors.links.related.href,relationships.citation.links.related.href,relationships.citation.data.id,relationships.citation.data.type,relationships.identifiers.links.related.href,relationships.node.links.self.href,relationships.license.links.related.href,relationships.license.data.id,relationships.license.data.type,relationships.provider.links.related.href,relationships.provider.data.id,relationships.provider.data.type,relationships.files.links.related.href,relationships.primary_file.links.related.href,relationships.primary_file.data.id,relationships.primary_file.data.type,relationships.review_actions.links.related.href,relationships.requests.links.related.href,links.self,links.html,links.preprint_doi,links.doi
syr84,preprints,2020-04-23T19:55:03.959780,2021-03-10T13:11:12.456478,2020-04-25T00:42:27.512874,NA,NA,Wealth of Tongues: Why Peripheral Regions Vote for the Radical Right in Germany,"Why do voters for the radical right tend to cluster in specific geographic locations? Many scholars have emphasized the economic roots of radical right support. Other scholarship highlights the role of the urban-rural divide, contending that the radical right finds support in low population density locations due to distinctive social values and strong place-based social identities found in rural areas. To date, however, we do not have a full grasp of the sources of these latter factors nor an understanding of the historical roots that explain their emergence. We argue that what is frequently classified as the ``rural'' bases of radical right support in previous research is in part a proxy for something entirely different: communities that were in the historical ""periphery"" in the center-periphery conflicts that shaped modern nation-state formation. Inspired by a classic state-building literature that emphasizes the prevalence of a ``wealth of tongues'' (Weber 1976)---or nonstandard linguistic dialects in a region---as a definition of the periphery, we use data from more than 725,000 geo-coded responses in a linguistic survey in Germany to show that voters from historically peripheral geographic communities are more likely to vote for the radical right today.",TRUE,FALSE,AfD|dialect|locality|nationalism|parochialism|place-based identity|radical right|voting,2020-04-25T00:42:41.964388,NA,,TRUE,accepted,2020-04-25T00:42:27.512874,FALSE,NA,no,NA,,not_applicable,NA,,,5a8c80f7c698300375c76d84|5a8c80f8c698300375c76daf|5a8c80f8c698300375c76db2|Social and Behavioral Sciences|Political Science|Comparative Politics,,2020,https://api.osf.io/v2/preprints/syr84/contributors/,https://api.osf.io/v2/preprints/syr84/bibliographic_contributors/,https://api.osf.io/v2/preprints/syr84/citation/,syr84,preprints,https://api.osf.io/v2/preprints/syr84/identifiers/,https://api.osf.io/v2/preprints/syr84/relationships/node/,https://api.osf.io/v2/licenses/563c1cf88c5e4a3877f9e96a/,563c1cf88c5e4a3877f9e96a,licenses,https://api.osf.io/v2/providers/preprints/socarxiv/,socarxiv,preprint-providers,https://api.osf.io/v2/preprints/syr84/files/,https://api.osf.io/v2/files/5ea1f29cc74184001df3e545/,5ea1f29cc74184001df3e545,files,https://api.osf.io/v2/preprints/syr84/review_actions/,https://api.osf.io/v2/preprints/syr84/requests/,https://api.osf.io/v2/preprints/syr84/,https://osf.io/preprints/socarxiv/syr84/,https://doi.org/10.31235/osf.io/syr84,NA
5md7u,preprints,2020-04-23T09:34:44.108441,2020-04-25T00:44:17.673874,2020-04-25T00:43:36.128603,2016-12-19T23:00:00,10.1163/15718182-02404007,Social Welfare or Moral Warfare? Popular Resistance against Children’s Rights and Juvenile Justice in Contemporary Russia,"Since the mid-2000s, Russia has increased its efforts to strengthen the legal rights of children and to improve the systems of social assistance to vulnerable families in in line with the UN Convention of the Rights of the Child. The reform drive has met fierce resistance by a grassroots mobilization in defence of ‘traditional Russian family values’. Child rights are conceived of as weapons in a Western moral war against Russia, but simultaneously, the popular appeal of the campaign stems from a profound distrust in Russian state administrators, who purportedly use the CRC for personal gain. This paper suggests that this disbelief makes the protesters locate notions of citizenship primarily to the intimate social sphere, prioritizing ‘parental rights’ rather than ‘civil rights’ defined by the state-citizen relationship. It is also suggested that the confidence of citizens in their own state administration must be considered if the Convention is to be successfully implemented.",TRUE,FALSE,Child rights|corporal punishment|family values|juvenile justice|nationalism|Russia|social policy|UNCRC,2020-04-25T00:44:17.654041,NA,,TRUE,accepted,2020-04-25T00:43:36.128603,FALSE,NA,NA,NA,,NA,NA,,NA,5a8c80f7c698300375c76d84|5a8c80f7c698300375c76d96|Social and Behavioral Sciences|Other Social and Behavioral Sciences,,2020,https://api.osf.io/v2/preprints/5md7u/contributors/,https://api.osf.io/v2/preprints/5md7u/bibliographic_contributors/,https://api.osf.io/v2/preprints/5md7u/citation/,5md7u,preprints,https://api.osf.io/v2/preprints/5md7u/identifiers/,https://api.osf.io/v2/preprints/5md7u/relationships/node/,https://api.osf.io/v2/licenses/563c1cf88c5e4a3877f9e96a/,563c1cf88c5e4a3877f9e96a,licenses,https://api.osf.io/v2/providers/preprints/socarxiv/,socarxiv,preprint-providers,https://api.osf.io/v2/preprints/5md7u/files/,https://api.osf.io/v2/files/5ea16137fe323800d8c3853e/,5ea16137fe323800d8c3853e,files,https://api.osf.io/v2/preprints/5md7u/review_actions/,https://api.osf.io/v2/preprints/5md7u/requests/,https://api.osf.io/v2/preprints/5md7u/,https://osf.io/preprints/socarxiv/5md7u/,https://doi.org/10.31235/osf.io/5md7u,https://doi.org/10.1163/15718182-02404007
uyzxe,preprints,2020-04-23T07:28:29.866340,2020-04-25T00:45:05.778973,2020-04-25T00:44:33.214158,NA,NA,Face masks for the public during Covid-19: an appeal for caution in policy,"As the Covid-19 crisis deepens, some researchers have argued for the widespread routine use of face masks in community settings, despite acknowledged gaps in the evidence base for the effectiveness of such a measure. We argue that such calls are premature, and risk neglecting important potential harms and negative consequences, known and unknown. We identify potential unintended consequences at multiple levels, from individual-behavioural to macrosocial, and suggest that it is far from clear that the benefits of widespread uptake of face masks, whether encouraged or enforced by public authorities, outweigh the downsides. Finally, we make the case for caution in communicating unequivocal messages about the scientific evidence for face mask use to policy, practitioner and public audiences, given continued scientific disagreement on the question.",TRUE,FALSE,Coronavirus|Covid-19|facemasks|face masks|health policy|precautionary principle|SARS-Cov-2|science communication|United Kingdom,2020-04-25T00:45:05.766192,NA,,TRUE,accepted,2020-04-25T00:44:33.214158,TRUE,"Robert Dingwall is a member of the New and Emerging Respiratory Virus Threats Advisory Group (NERVTAG), which advises the UK government on the threat posed by new and emerging respiratory viruses. The other authors declare no conflicts of interest.",NA,NA,,NA,NA,,NA,"5a8c80f7c698300375c76d84|5a8c80f8c698300375c76ddb|5a8c80f9c698300375c76de2|Social and Behavioral Sciences|Public Affairs, Public Policy and Public Administration|Health Policy",Graham Martin|Esmée Hanna|Robert Dingwall,2020,https://api.osf.io/v2/preprints/uyzxe/contributors/,https://api.osf.io/v2/preprints/uyzxe/bibliographic_contributors/,https://api.osf.io/v2/preprints/uyzxe/citation/,uyzxe,preprints,https://api.osf.io/v2/preprints/uyzxe/identifiers/,https://api.osf.io/v2/preprints/uyzxe/relationships/node/,https://api.osf.io/v2/licenses/563c1cf88c5e4a3877f9e965/,563c1cf88c5e4a3877f9e965,licenses,https://api.osf.io/v2/providers/preprints/socarxiv/,socarxiv,preprint-providers,https://api.osf.io/v2/preprints/uyzxe/files/,https://api.osf.io/v2/files/5ea143a4fe323800c1c3c751/,5ea143a4fe323800c1c3c751,files,https://api.osf.io/v2/preprints/uyzxe/review_actions/,https://api.osf.io/v2/preprints/uyzxe/requests/,https://api.osf.io/v2/preprints/uyzxe/,https://osf.io/preprints/socarxiv/uyzxe/,https://doi.org/10.31235/osf.io/uyzxe,NA
tvneu,preprints,2020-04-22T21:12:45.740639,2020-04-25T00:41:41.486545,2020-04-25T00:41:21.620888,NA,10.1080/09692290.2020.1752769,Is Neoliberalism Still Spreading? The Impact of International Cooperation on Capital Taxation,"The downward trend in capital taxes since the 1980s has recently reversed for personal capital income. At the same time, it continued for corporate profits. Why have these tax rates di-verged after a long period of parallel decline? We argue that the answer lies in different levels of change in the fights against tax evasion and tax avoidance. The fight against evasion by households progressed significantly since 2009, culminating in the multilateral adoption of automatic exchange of information (AEI). In contrast, international efforts against base ero-sion and profit shifting (BEPS) failed to curb tax avoidance by corporations. We theorize that international cooperation is an intervening variable, countering the negative impact of tax competition on capital taxation by reducing the risk of capital flight. Under such conditions, domestic political pressures in favor of higher capital taxes can unfold. We confirm our argu-ment in a difference-in-difference analysis and through additional tests with data for up to 35 OECD countries from 2000-2017. Our central estimate suggests that the average tax rate on dividends in 2017 is 4.5 percentage points higher than it would have been absent international tax cooperation.",TRUE,FALSE,,2020-04-25T00:41:41.455605,NA,,TRUE,accepted,2020-04-25T00:41:21.620888,FALSE,NA,NA,NA,,NA,NA,,NA,5a8c80f7c698300375c76d84|5a8c80f8c698300375c76daf|5a8c80f8c698300375c76db3|Social and Behavioral Sciences|Political Science|Other Political Science|5a8c80f7c698300375c76d84|5a8c80f8c698300375c76dbe|5a8c80f8c698300375c76dc0|Social and Behavioral Sciences|Economics|Political Economy,,2020,https://api.osf.io/v2/preprints/tvneu/contributors/,https://api.osf.io/v2/preprints/tvneu/bibliographic_contributors/,https://api.osf.io/v2/preprints/tvneu/citation/,tvneu,preprints,https://api.osf.io/v2/preprints/tvneu/identifiers/,https://api.osf.io/v2/preprints/tvneu/relationships/node/,https://api.osf.io/v2/licenses/563c1cf88c5e4a3877f9e96a/,563c1cf88c5e4a3877f9e96a,licenses,https://api.osf.io/v2/providers/preprints/socarxiv/,socarxiv,preprint-providers,https://api.osf.io/v2/preprints/tvneu/files/,https://api.osf.io/v2/files/5ea0b35635f4bf00a91f8f51/,5ea0b35635f4bf00a91f8f51,files,https://api.osf.io/v2/preprints/tvneu/review_actions/,https://api.osf.io/v2/preprints/tvneu/requests/,https://api.osf.io/v2/preprints/tvneu/,https://osf.io/preprints/socarxiv/tvneu/,https://doi.org/10.31235/osf.io/tvneu,https://doi.org/10.1080/09692290.2020.1752769
rs5ab,preprints,2020-04-22T18:15:56.738954,2020-04-25T00:40:48.792874,2020-04-25T00:40:26.691771,2020-04-22T04:00:00,NA,"Race, Gender, and Parental College Savings: Assessing Economic and Academic Factors","This article assesses the relationships between race, gender, and parental college savings. Although some prior studies have investigated race differences in parental college savings, none have taken an intersectional approach, and most of these studies were conducted with cohorts of students who pre-date key demographic changes among U.S. college-goers (such as the reversal of the gender gap in college completion). Drawing on theories of parental investment and data from the High School Longitudinal Study of 2009 (HSLS:09), we show that both race and gender are associated with whether parents save for college, as well as how much they save. Both Black boys and Black girls experience savings disadvantages relative to their White peers. However, particularly striking disparities face Black girls: Black girls with the strongest academic credentials receive savings equivalent to those with the weakest academic credentials. Results suggest that this in due, at least in part, to the fact that high-achieving Black girls tend to come from families that are much less well-off than high achievers in other race-gender groups. As a result, parents of Black girls frequently rely on funding sources other than their own earnings or savings to pay for their children’s college. These include private loans that may pose financial challenges for Black girls and their families across generations, thus deepening inequalities along the lines of gender, race, and class. These findings demonstrate the power of taking an intersectional approach to the study of higher education in general and college funding in particular.",TRUE,FALSE,gender|higher education|race|savings for college/education,2020-04-25T00:40:48.772933,NA,,TRUE,accepted,2020-04-25T00:40:26.691771,FALSE,NA,NA,NA,,NA,NA,,NA,"5a8c80f7c698300375c76d84|5a8c80fac698300375c76e20|5a8c80fac698300375c76e26|Social and Behavioral Sciences|Sociology|Sociology of Education|5a8c80f7c698300375c76d84|5a8c80fac698300375c76e20|5a8c80fac698300375c76e35|Social and Behavioral Sciences|Sociology|Inequality, Poverty, and Mobility|5a8c80f7c698300375c76d84|5a8c80fac698300375c76e20|5a8c80fac698300375c76e44|Social and Behavioral Sciences|Sociology|Race, Gender, and Class|5a8c80f7c698300375c76d84|5a8c80fac698300375c76e20|5a8c80fac698300375c76e47|Social and Behavioral Sciences|Sociology|Children and Youth|5a8c80f7c698300375c76d84|5a8c80fac698300375c76e20|5a8c80fac698300375c76e4c|Social and Behavioral Sciences|Sociology|Family",,2020,https://api.osf.io/v2/preprints/rs5ab/contributors/,https://api.osf.io/v2/preprints/rs5ab/bibliographic_contributors/,https://api.osf.io/v2/preprints/rs5ab/citation/,rs5ab,preprints,https://api.osf.io/v2/preprints/rs5ab/identifiers/,https://api.osf.io/v2/preprints/rs5ab/relationships/node/,https://api.osf.io/v2/licenses/563c1cf88c5e4a3877f9e96a/,563c1cf88c5e4a3877f9e96a,licenses,https://api.osf.io/v2/providers/preprints/socarxiv/,socarxiv,preprint-providers,https://api.osf.io/v2/preprints/rs5ab/files/,https://api.osf.io/v2/files/5ea089e3fe3238009ac3af15/,5ea089e3fe3238009ac3af15,files,https://api.osf.io/v2/preprints/rs5ab/review_actions/,https://api.osf.io/v2/preprints/rs5ab/requests/,https://api.osf.io/v2/preprints/rs5ab/,https://osf.io/preprints/socarxiv/rs5ab/,https://doi.org/10.31235/osf.io/rs5ab,NA
fudzq,preprints,2020-04-22T14:48:51.907828,2020-06-06T13:50:47.069948,2020-04-25T00:39:19.325460,NA,NA,"Faith in Trump, Moral Foundations, and Social Distancing  Defiance During the Coronavirus Pandemic","Purpose: Over the past several months, the coronavirus has infected nearly 2 million Americans and killed more than 100,000. Governors have issued stay-at-home orders, and prosecutors have filed criminal charges against individuals for defying those orders. And yet, many Americans have still refused to keep their distance from their fellow citizens, even if they had symptoms of infection. This study explores the underlying causes for those who intend to defy these norms.
Methods: Using national-level data from a March 2020 survey of 989 Americans, we explore intentions to defy social distancing norms by testing an interactionist theory of foundation-based moral behavior in combination with faith in President Trump.  The analysis controls for a range of variables, including measures of low self-control and deterrence. 
Results: Low self-control is the strongest predictor of defiance intentions. Consistent with interactionist theory, defiance intentions are significantly higher for those holding a specific faith in Trump and those endorsing binding foundation.  Furthermore, the interaction of these two variables is significant and in the predicted direction. The results hold for two different measures of faith in Trump. 
Conclusions: Even with a strong effect for low self-control, faith in President Trump is a strong predictor of refusal to social distance, and its effect is largest among individuals high in binding foundations.",TRUE,FALSE,COVID-19|moral foundations|pandemic|President Trump|social distancing,2020-04-25T00:39:43.730539,NA,,TRUE,accepted,2020-04-25T00:39:19.325460,FALSE,NA,no,NA,,NA,NA,,NA,"5a8c80f7c698300375c76d84|5a8c80fac698300375c76e20|5a8c80fac698300375c76e2b|Social and Behavioral Sciences|Sociology|Crime, Law, and Deviance",,2020,https://api.osf.io/v2/preprints/fudzq/contributors/,https://api.osf.io/v2/preprints/fudzq/bibliographic_contributors/,https://api.osf.io/v2/preprints/fudzq/citation/,fudzq,preprints,https://api.osf.io/v2/preprints/fudzq/identifiers/,https://api.osf.io/v2/preprints/fudzq/relationships/node/,https://api.osf.io/v2/licenses/5ad7979bc69830002d8190e3/,5ad7979bc69830002d8190e3,licenses,https://api.osf.io/v2/providers/preprints/socarxiv/,socarxiv,preprint-providers,https://api.osf.io/v2/preprints/fudzq/files/,https://api.osf.io/v2/files/5ea059579fd598007956f12e/,5ea059579fd598007956f12e,files,https://api.osf.io/v2/preprints/fudzq/review_actions/,https://api.osf.io/v2/preprints/fudzq/requests/,https://api.osf.io/v2/preprints/fudzq/,https://osf.io/preprints/socarxiv/fudzq/,https://doi.org/10.31235/osf.io/fudzq,NA
4w9bx,preprints,2020-04-22T09:18:55.022892,2020-04-23T05:03:01.563024,2020-04-22T12:16:25.255568,NA,NA,Impact of the COVID-19 pandemic on life expectancy in Madrid (Spain),"The COVID-19 pandemic is causing substantial increases in mortality across populations, potentially causing stagnation or decline in life expectancy. We explored this idea by examining the impact of excess mortality linked to the COVID-19 crisis on life expectancy in the region of Madrid (Spain). Using data from the Daily Mortality Surveillance System (MoMo), we calculated excess mortality (death counts) for the weeks 10th to 14th in 2020 using data on expected and observed mortality, assuming no further excess mortality during the rest of the year. The expected annual mortality variation was +6%, +21% and +25% among men aged under 65, between 65 and 74 and over 75, respectively, and +5%, +13%, and 18% for women, respectively. This excess mortality during weeks 10th to 14th resulted in a life expectancy at birth decline of 1.6 years among men and 1.1 years among women. These estimates confirm that Madrid and other severely hit regions in the world may face substantial life expectancy declines.",TRUE,FALSE,health crisis|life expectancy|Madrid|Mortality|SARS-CoV2,2020-04-23T05:03:01.551099,NA,,TRUE,accepted,2020-04-22T12:16:25.255568,FALSE,NA,NA,NA,,NA,NA,,NA,5a8c80f7c698300375c76d84|5a8c80f7c698300375c76d86|Social and Behavioral Sciences|Geography|5a8c80f7c698300375c76d84|5a8c80f7c698300375c76d96|Social and Behavioral Sciences|Other Social and Behavioral Sciences,,2020,https://api.osf.io/v2/preprints/4w9bx/contributors/,https://api.osf.io/v2/preprints/4w9bx/bibliographic_contributors/,https://api.osf.io/v2/preprints/4w9bx/citation/,4w9bx,preprints,https://api.osf.io/v2/preprints/4w9bx/identifiers/,https://api.osf.io/v2/preprints/4w9bx/relationships/node/,https://api.osf.io/v2/licenses/563c1cf88c5e4a3877f9e96a/,563c1cf88c5e4a3877f9e96a,licenses,https://api.osf.io/v2/providers/preprints/socarxiv/,socarxiv,preprint-providers,https://api.osf.io/v2/preprints/4w9bx/files/,https://api.osf.io/v2/files/5ea00c029fd598006a567a5c/,5ea00c029fd598006a567a5c,files,https://api.osf.io/v2/preprints/4w9bx/review_actions/,https://api.osf.io/v2/preprints/4w9bx/requests/,https://api.osf.io/v2/preprints/4w9bx/,https://osf.io/preprints/socarxiv/4w9bx/,https://doi.org/10.31235/osf.io/4w9bx,NA
up9qz,preprints,2020-04-21T21:18:35.018595,2020-05-15T19:44:12.010957,2020-04-22T12:14:41.842149,NA,NA,The Politics of Platform Capitalism. A Case Study on the Regulation of Uber in New York,"Platform companies like Uber not only disrupt existing markets but also contest existing regulatory regimes. This raises the question of how, when, and why such companies are regulated. This paper develops, tests and defends a theoretical framework that explains the politics of regulatory response to the rise of platform capitalism. Using discourse network analysis and a case study on the regulation of Uber in New York, it shows that the success or failure of regulations depends on the ability of actors to mobilize broad coalition; that narratives affect the composition of these coalitions; and that platform companies have both unique political strengths and vulnerabilities. The paper makes substantive contributions to our understanding of the politics of platform capitalism, and it makes theoretical contributions to the literatures on coalitional politics, ideational institutionalism, and business power.",TRUE,FALSE,Business Power|Coalitional Politics|Discourse Network Analysis|Framing|Narratives|Platform Capitalism|Sentiment Analysis,2020-04-23T05:03:00.809908,NA,,TRUE,accepted,2020-04-22T12:14:41.842149,FALSE,NA,NA,NA,,NA,NA,,NA,"5a8c80f7c698300375c76d84|5a8c80f8c698300375c76daf|5a8c80f8c698300375c76db5|Social and Behavioral Sciences|Political Science|American Politics|5a8c80f7c698300375c76d84|5a8c80f8c698300375c76ddb|5a8c80f9c698300375c76deb|Social and Behavioral Sciences|Public Affairs, Public Policy and Public Administration|Public Policy|5a8c80f7c698300375c76d84|5a8c80f8c698300375c76ddb|5a8c80f9c698300375c76dec|Social and Behavioral Sciences|Public Affairs, Public Policy and Public Administration|Transportation",,2020,https://api.osf.io/v2/preprints/up9qz/contributors/,https://api.osf.io/v2/preprints/up9qz/bibliographic_contributors/,https://api.osf.io/v2/preprints/up9qz/citation/,up9qz,preprints,https://api.osf.io/v2/preprints/up9qz/identifiers/,https://api.osf.io/v2/preprints/up9qz/relationships/node/,https://api.osf.io/v2/licenses/563c1cf88c5e4a3877f9e96a/,563c1cf88c5e4a3877f9e96a,licenses,https://api.osf.io/v2/providers/preprints/socarxiv/,socarxiv,preprint-providers,https://api.osf.io/v2/preprints/up9qz/files/,https://api.osf.io/v2/files/5e9f63359fd598004f568973/,5e9f63359fd598004f568973,files,https://api.osf.io/v2/preprints/up9qz/review_actions/,https://api.osf.io/v2/preprints/up9qz/requests/,https://api.osf.io/v2/preprints/up9qz/,https://osf.io/preprints/socarxiv/up9qz/,https://doi.org/10.31235/osf.io/up9qz,NA
uzqdj,preprints,2020-04-21T20:29:22.399132,2020-04-23T05:03:01.934278,2020-04-22T12:14:09.040719,2016-04-15T04:00:00,NA,A ‘Not Particularly Felicitous’ Phrase: A History of the ‘Behavioral Sciences’ Label,"The article reconstructs the history of the ""behavioral sciences"" label, from scattered interwar use through to the decisive embrace of the newly prominent Ford Foundation in the early Cold War. The rapid uptake of the label, the article concludes, was the result of the Ford Foundation’s 1951 decision to name its social science unit the “Behavioral Sciences Program” (BSP). With Ford’s en- couragement, the term was widely adopted by quantitative social scientists eager to tap the founda- tion’s social science funds. The label’s newness and its link to the gigantic foundation’s initiative generated much suspicion and resistance as well.",TRUE,FALSE,behavioral sciences|Cold War|Ford Foundation|history of political science|history of psychology|history of social science|history of sociology|sociology of academic life|sociology of knowledge,2020-04-23T05:03:01.922121,NA,,TRUE,accepted,2020-04-22T12:14:09.040719,NA,NA,NA,NA,,NA,NA,,NA,5a8c80f2c698300375c76c7d|5a8c80f4c698300375c76ccc|5a8c80f4c698300375c76cd1|Arts and Humanities|History|Intellectual History|5a8c80f7c698300375c76d84|5a8c80f7c698300375c76d98|Social and Behavioral Sciences|Psychology|5a8c80f7c698300375c76d84|5a8c80f8c698300375c76daf|Social and Behavioral Sciences|Political Science|5a8c80f7c698300375c76d84|5a8c80fac698300375c76e20|5a8c80fac698300375c76e4f|Social and Behavioral Sciences|Sociology|History of Sociology,,2020,https://api.osf.io/v2/preprints/uzqdj/contributors/,https://api.osf.io/v2/preprints/uzqdj/bibliographic_contributors/,https://api.osf.io/v2/preprints/uzqdj/citation/,uzqdj,preprints,https://api.osf.io/v2/preprints/uzqdj/identifiers/,https://api.osf.io/v2/preprints/uzqdj/relationships/node/,https://api.osf.io/v2/licenses/5ad7979bc69830002d8190e3/,5ad7979bc69830002d8190e3,licenses,https://api.osf.io/v2/providers/preprints/socarxiv/,socarxiv,preprint-providers,https://api.osf.io/v2/preprints/uzqdj/files/,https://api.osf.io/v2/files/5e9f57a735f4bf00461f768a/,5e9f57a735f4bf00461f768a,files,https://api.osf.io/v2/preprints/uzqdj/review_actions/,https://api.osf.io/v2/preprints/uzqdj/requests/,https://api.osf.io/v2/preprints/uzqdj/,https://osf.io/preprints/socarxiv/uzqdj/,https://doi.org/10.31235/osf.io/uzqdj,NA
