id,type,attributes.date_created,attributes.date_modified,attributes.date_published,attributes.original_publication_date,attributes.doi,attributes.title,attributes.description,attributes.is_published,attributes.is_preprint_orphan,attributes.tags,attributes.preprint_doi_created,attributes.date_withdrawn,attributes.current_user_permissions,attributes.public,attributes.reviews_state,attributes.date_last_transitioned,attributes.has_coi,attributes.conflict_of_interest_statement,attributes.has_data_links,attributes.why_no_data,attributes.data_links,attributes.has_prereg_links,attributes.why_no_prereg,attributes.prereg_links,attributes.prereg_link_info,attributes.subjects,attributes.license_record.copyright_holders,attributes.license_record.year,relationships.contributors.links.related.href,relationships.bibliographic_contributors.links.related.href,relationships.citation.links.related.href,relationships.citation.data.id,relationships.citation.data.type,relationships.identifiers.links.related.href,relationships.node.links.self.href,relationships.node.links.related.href,relationships.node.data.id,relationships.node.data.type,relationships.license.links.related.href,relationships.license.data.id,relationships.license.data.type,relationships.provider.links.related.href,relationships.provider.data.id,relationships.provider.data.type,relationships.files.links.related.href,relationships.primary_file.links.related.href,relationships.primary_file.data.id,relationships.primary_file.data.type,relationships.review_actions.links.related.href,relationships.requests.links.related.href,links.self,links.html,links.preprint_doi,links.doi
dpz9q,preprints,2021-05-24T13:52:19.771917,2021-05-25T10:26:23.785681,2021-05-25T10:25:59.354837,2021-05-23T22:00:00,NA,How to Increase Survey Response and Manage the Postal and Face-to-Face Field Work of Participant Recruitment during the Covid-19 Pandemic:  A Note with Preliminary Evidence from Immigrant-Origin and Native Voters in a German Metropolis in Spring 2021,"This note presents preliminary evidence from a postal and face-to-face recruitment field for a telephone survey during the Covid-19 pandemic.  Drawn from the city register of Duisburg, a metropolis of 500,000 inhabitants, voters eligible for the September 2021 Bundestag elections are the target population. They are stratified into four groups by onomastic classification: native Germans, Germans of Turkish Descent, Germans with a (Post-) Soviet background and Germans of any other immigrant origin. This note presents ten measures of optimising the recruitment of individuals from these four groups under the constraints of an all-encompassing high-incidence pandemic with distance measures and curfews in place, with closed shops and schools and reduced other care facilities. In addition, the report puts forward statistical analyses of some measures applied in an experimental design and estimates the overall and per-person-recruited costs. 
Overall, the pandemic forced us to make drastic changes to research design and field organisation and to invest much more time and money than planned. Especially overburdened postal deliveries and restrictive policies for public places made the endeavour most difficult. So far, the ongoing fieldwork has produced a response rate of 8.2 % (only individuals willing to participate in telephone interview) with 11.0 % as a likely expected outcome. One individual recruited to take part in the telephone panel survey costs an estimated 53-71 €.
Early-bird incentives produced a positive response (meaning the willingness to partake in the survey) of 5.5 % compared to 4.0 % among those without early-bird incentives. The most effective measure to boost overall positive response among initial non-responders was in-person canvassing with unconditional incentive (21.3 %) instead of postal reminders (9.9 %). Canvassing a smaller group of people in person proved to be as costly as reminding a larger group of people in writing: we estimated costs of 60-61 € per additionally recruited survey participants through either channel.",TRUE,FALSE,canvassing|corona|covid-19|election|immigration|incentive|reminder|response|response rate|survey|voting,2021-05-25T10:26:23.765912,NA,,TRUE,accepted,2021-05-25T10:25:59.354837,FALSE,NA,no,NA,,no,NA,,,5a8c80f7c698300375c76d84|5a8c80f8c698300375c76daf|Social and Behavioral Sciences|Political Science|5a8c80f7c698300375c76d84|5a8c80fac698300375c76e20|Social and Behavioral Sciences|Sociology,,2021,https://api.osf.io/v2/preprints/dpz9q/contributors/,https://api.osf.io/v2/preprints/dpz9q/bibliographic_contributors/,https://api.osf.io/v2/preprints/dpz9q/citation/,dpz9q,preprints,https://api.osf.io/v2/preprints/dpz9q/identifiers/,https://api.osf.io/v2/preprints/dpz9q/relationships/node/,NA,NA,NA,https://api.osf.io/v2/licenses/563c1cf88c5e4a3877f9e96a/,563c1cf88c5e4a3877f9e96a,licenses,https://api.osf.io/v2/providers/preprints/socarxiv/,socarxiv,preprint-providers,https://api.osf.io/v2/preprints/dpz9q/files/,https://api.osf.io/v2/files/60abaf998a5d3d020f0cc717/,60abaf998a5d3d020f0cc717,files,https://api.osf.io/v2/preprints/dpz9q/review_actions/,https://api.osf.io/v2/preprints/dpz9q/requests/,https://api.osf.io/v2/preprints/dpz9q/,https://osf.io/preprints/socarxiv/dpz9q/,https://doi.org/10.31235/osf.io/dpz9q,NA
2bxyw,preprints,2021-05-24T06:23:23.323403,2021-05-25T10:23:25.427460,2021-05-25T10:23:11.098491,2021-05-23T14:00:00,NA,"Drug markets and COVID-19: A spatiotemporal study of drug offence detection rates in Brisbane, Australia","In many parts of the world, the social mobility restrictions and stay-at-home orders introduced during the early months of the COVID-19 pandemic have been associated with significant reductions in crime. However, contrary to this general finding, illicit drug offence detections increased significantly. In this study, we explore the geographical distribution of the increase in Queensland, Australia, using spatiotemporal generalised additive model (GAM) to identify locations in the Local Government Area (LGA) of Brisbane where drug offence detection rates were unusually high during the three months of the COVID-19 lockdown (April-June 2020). Contrary to expectation, we find that the increase in drug offence detection rates appears to have been modest in most places, but widespread and diffuse throughout the city. We conclude that drug offence detections are most likely to have increased incidentally, probably as a consequence of general street policing initiatives which saw an increase in the visibility and vulnerability of drug user communities. We do, however, identify five locations in Brisbane where the drug offence detection rate exceeded the prediction by a considerable margin (in one case, more than double the worst case prediction). We argue that in these locations the increase was likely the result of some spatial displacement of inner-city drug markets coupled with a series of targeted policing activities. Further research is needed to clarify the true mechanism of change in these locations.",TRUE,FALSE,Australia|Brisbane|COVID-19|Crime|Drug Markets|Drug Offences|Queensland,2021-05-25T10:23:25.403978,NA,,TRUE,accepted,2021-05-25T10:23:11.098491,FALSE,NA,not_applicable,NA,,no,Not required for this study,,,5a8c80f7c698300375c76d84|5a8c80f7c698300375c76d86|5a8c80f7c698300375c76d8d|Social and Behavioral Sciences|Geography|Spatial Science|5a8c80f7c698300375c76d84|5a8c80f7c698300375c76d96|Social and Behavioral Sciences|Other Social and Behavioral Sciences|5a8c80f7c698300375c76d84|5a8c80f9c698300375c76e0c|Social and Behavioral Sciences|Social Statistics,,2021,https://api.osf.io/v2/preprints/2bxyw/contributors/,https://api.osf.io/v2/preprints/2bxyw/bibliographic_contributors/,https://api.osf.io/v2/preprints/2bxyw/citation/,2bxyw,preprints,https://api.osf.io/v2/preprints/2bxyw/identifiers/,https://api.osf.io/v2/preprints/2bxyw/relationships/node/,NA,NA,NA,https://api.osf.io/v2/licenses/563c1cf88c5e4a3877f9e96a/,563c1cf88c5e4a3877f9e96a,licenses,https://api.osf.io/v2/providers/preprints/socarxiv/,socarxiv,preprint-providers,https://api.osf.io/v2/preprints/2bxyw/files/,https://api.osf.io/v2/files/60ab465e0b6c6901f09c2146/,60ab465e0b6c6901f09c2146,files,https://api.osf.io/v2/preprints/2bxyw/review_actions/,https://api.osf.io/v2/preprints/2bxyw/requests/,https://api.osf.io/v2/preprints/2bxyw/,https://osf.io/preprints/socarxiv/2bxyw/,https://doi.org/10.31235/osf.io/2bxyw,NA
q9y7b,preprints,2021-05-24T04:55:39.880064,2021-05-24T11:46:06.204327,2021-05-24T11:45:49.843751,NA,NA,"Calamities, Common Interests, Shared Identity: What Shapes Altruism and Reciprocity?","We conduct a large-scale survey experiment in nine European countries to study how priming a major crisis (COVID-19), common economic interests, and a shared identity influences altruism, reciprocity and trust of EU citizens. We find that priming the COVID-19 pandemic increases altruism and reciprocity towards compatriots, citizens of other EU countries, and non-EU citizens. Priming common European values also boosts altruism and reciprocity but only towards compatriots and fellow Europeans. Priming common economic interests has no tangible impact on behaviour. Trust in others is not affected by any treatment. Our results are consistent with the parochial altruism hypothesis, which asserts that because altruism arises out of inter-group conflict, humans show a tendency to favor members of their own groups.",TRUE,FALSE,altruism|COVID-19|Europe|reciprocity|survey experiment,2021-05-24T11:46:06.036203,NA,,TRUE,accepted,2021-05-24T11:45:49.843751,FALSE,NA,no,NA,,available,NA,https://www.socialscienceregistry.org/trials/6164,prereg_analysis,5a8c80f7c698300375c76d84|5a8c80f8c698300375c76dbe|5a8c80f8c698300375c76dc0|Social and Behavioral Sciences|Economics|Political Economy,,2021,https://api.osf.io/v2/preprints/q9y7b/contributors/,https://api.osf.io/v2/preprints/q9y7b/bibliographic_contributors/,https://api.osf.io/v2/preprints/q9y7b/citation/,q9y7b,preprints,https://api.osf.io/v2/preprints/q9y7b/identifiers/,https://api.osf.io/v2/preprints/q9y7b/relationships/node/,NA,NA,NA,https://api.osf.io/v2/licenses/563c1cf88c5e4a3877f9e96a/,563c1cf88c5e4a3877f9e96a,licenses,https://api.osf.io/v2/providers/preprints/socarxiv/,socarxiv,preprint-providers,https://api.osf.io/v2/preprints/q9y7b/files/,https://api.osf.io/v2/files/60ab31d48a5d3d01e60cecaf/,60ab31d48a5d3d01e60cecaf,files,https://api.osf.io/v2/preprints/q9y7b/review_actions/,https://api.osf.io/v2/preprints/q9y7b/requests/,https://api.osf.io/v2/preprints/q9y7b/,https://osf.io/preprints/socarxiv/q9y7b/,https://doi.org/10.31235/osf.io/q9y7b,NA
69n4m,preprints,2021-05-24T03:17:45.047876,2021-05-25T10:22:42.096254,2021-05-25T10:22:27.245296,NA,NA,Changing context of walking behaviour: Impacts of movement restrictions in the urban neighbourhoods coping with the COVID-19 Pandemic,"Recent theoretical and empirical urban planning studies suggest that the availability of daily amenities, such as shopping stores, health care units, education services, pharmacies, within a 15-20-minute walking distance can keep daily life flux and also bring physical activities to individuals coping with the movement limitations of lockdowns during the COVID-19 Pandemic. This paper focuses on the relationship between neighborhood walkability and the changing walking behavior of 514 individuals during these lockdowns. The spatial context of this relationship highlights three main urban design aspects of the novel and innovative urban neighborhood planning: walkable access, spatial proximity, and social cohesion. This study demonstrates how restrictions imposed by the COVID-19 Pandemic affect the walking behaviors of the individuals, within 15-20 minute walkable and non-walkable neighborhoods located in different socio-economic geographies from American, European, Asian, Western Pacific, African, and Eastern Mediterranean cities. The discussion section of the methodology is supported by a survey questionnaire conducted in 24 disparate neighborhoods. Our data obtained from survey questionnaires is indicating that lockdown restrictions during the Pandemic influenced the walking purpose. Research findings also reflect limitations during the Pandemic complicate individuals’ requiring access to amenities in urban neighborhoods. With a nod to future studies on this topic, this paper proposes a basic framework as well as a thematic analysis with superimposed polar matrix charts.",TRUE,FALSE,15 minutes neighborhood|COVID-19 pandemic|Health|Urban Planning|Walkability,2021-05-25T10:22:42.080573,NA,,TRUE,accepted,2021-05-25T10:22:27.245296,FALSE,NA,no,NA,,no,NA,,,5a8c80f2c698300375c76c7d|Arts and Humanities|5a8c80f7c698300375c76d84|5a8c80f7c698300375c76d97|Social and Behavioral Sciences|Urban Studies and Planning,,2021,https://api.osf.io/v2/preprints/69n4m/contributors/,https://api.osf.io/v2/preprints/69n4m/bibliographic_contributors/,https://api.osf.io/v2/preprints/69n4m/citation/,69n4m,preprints,https://api.osf.io/v2/preprints/69n4m/identifiers/,https://api.osf.io/v2/preprints/69n4m/relationships/node/,NA,NA,NA,https://api.osf.io/v2/licenses/5ad7979bc69830002d8190e3/,5ad7979bc69830002d8190e3,licenses,https://api.osf.io/v2/providers/preprints/socarxiv/,socarxiv,preprint-providers,https://api.osf.io/v2/preprints/69n4m/files/,https://api.osf.io/v2/files/60ab1adba480c601bf0d1a54/,60ab1adba480c601bf0d1a54,files,https://api.osf.io/v2/preprints/69n4m/review_actions/,https://api.osf.io/v2/preprints/69n4m/requests/,https://api.osf.io/v2/preprints/69n4m/,https://osf.io/preprints/socarxiv/69n4m/,https://doi.org/10.31235/osf.io/69n4m,NA
4jtvm,preprints,2021-05-22T00:29:11.881444,2021-05-24T16:32:04.683003,2021-05-23T18:36:13.722904,NA,NA,Combining interventions to reduce the spread of viral misinformation,"Misinformation online poses a range of threats, from subverting democratic processes to undermining public health measures. Proposed solutions range from encouraging more selective sharing by individuals, to platform removal of false content and accounts that create or promote it. How, whether, and which strategies to implement depends on their relative and combined ability to reduce viral misinformation spread at practical levels of enforcement. Here we provide a framework to evaluate interventions aimed at reducing viral misinformation online both in isolation and when used in combination. We begin by deriving a generative model of viral misinformation spread, inspired by research on infectious disease. Applying this model to a large corpus of misinformation events that occurred during the 2020 US election, we reveal that commonly proposed interventions--including removal of content, virality circuit breakers, nudges, and account banning---are unlikely to be effective in isolation without extreme censorship. However, our framework demonstrates that a combined approach can achieve a substantial, ~50%, reduction in the prevalence of misinformation. Our results challenge claims that combating misinformation will require new ideas or high costs to user expression. Instead, we highlight a practical path forward as misinformation online continues to threaten vaccination efforts, equity, and democratic processes around the globe.",TRUE,FALSE,Election|Misinformation|Platform Policies|Social Media|Twitter,2021-05-23T18:36:42.147100,NA,,TRUE,accepted,2021-05-23T18:36:13.722904,FALSE,NA,no,Data will be made available upon publication.,,no,NA,,,5a8c80f7c698300375c76d84|5a8c80f9c698300375c76df4|Social and Behavioral Sciences|Science and Technology Studies|5a8c80f7c698300375c76d84|5a8c80f9c698300375c76e0d|Social and Behavioral Sciences|Communication|5a8c80f7c698300375c76d84|5a8c80fac698300375c76e20|Social and Behavioral Sciences|Sociology,,2021,https://api.osf.io/v2/preprints/4jtvm/contributors/,https://api.osf.io/v2/preprints/4jtvm/bibliographic_contributors/,https://api.osf.io/v2/preprints/4jtvm/citation/,4jtvm,preprints,https://api.osf.io/v2/preprints/4jtvm/identifiers/,https://api.osf.io/v2/preprints/4jtvm/relationships/node/,https://api.osf.io/v2/nodes/2dcer/,2dcer,nodes,https://api.osf.io/v2/licenses/563c1cf88c5e4a3877f9e96a/,563c1cf88c5e4a3877f9e96a,licenses,https://api.osf.io/v2/providers/preprints/socarxiv/,socarxiv,preprint-providers,https://api.osf.io/v2/preprints/4jtvm/files/,https://api.osf.io/v2/files/60a8505a8a5d3d01040cbd0e/,60a8505a8a5d3d01040cbd0e,files,https://api.osf.io/v2/preprints/4jtvm/review_actions/,https://api.osf.io/v2/preprints/4jtvm/requests/,https://api.osf.io/v2/preprints/4jtvm/,https://osf.io/preprints/socarxiv/4jtvm/,https://doi.org/10.31235/osf.io/4jtvm,NA
a8eux,preprints,2021-05-21T23:30:06.813045,2021-05-23T18:35:49.554523,2021-05-23T18:35:30.075346,2015-05-14T07:00:00,10.1177/0731121415586479,"Social Bonding to School and Educational Inequality: Race/Ethnicity, Dropping Out, and the Significance of Place","Social bond theory suggests that strong bonds to school influence better outcomes on measures of educational progress and success. However, we know little about the relationship between social bonding to school and dropout for racial/ethnic minorities, or how this relationship varies across school settings. We examine how five types of social bonding (attachment, academic and sports involvement, commitment, and belief) influence the likelihood of dropout for racial/ethnic minorities in urban, suburban, and rural schools using national survey data. Results suggest that strong social bonds to school have the potential to mitigate some of the observed racial/ethnic gaps in dropout risk; however, the opportunity to form such bonds, as well as the strength of their protective effects, vary by student race/ethnicity, type of social bond, and school location.",TRUE,FALSE,dropout|education|race/ethnicity|social bonds,2021-05-23T18:35:49.536903,NA,,TRUE,accepted,2021-05-23T18:35:30.075346,FALSE,NA,no,NA,,no,NA,,,5a8c80f7c698300375c76d84|5a8c80fac698300375c76e20|5a8c80fac698300375c76e26|Social and Behavioral Sciences|Sociology|Sociology of Education|5a8c80f7c698300375c76d84|5a8c80fac698300375c76e20|5a8c80fac698300375c76e2a|Social and Behavioral Sciences|Sociology|Racial and Ethnic Minorities|5a8c80f7c698300375c76d84|5a8c80fac698300375c76e20|5a8c80fac698300375c76e47|Social and Behavioral Sciences|Sociology|Children and Youth,,2021,https://api.osf.io/v2/preprints/a8eux/contributors/,https://api.osf.io/v2/preprints/a8eux/bibliographic_contributors/,https://api.osf.io/v2/preprints/a8eux/citation/,a8eux,preprints,https://api.osf.io/v2/preprints/a8eux/identifiers/,https://api.osf.io/v2/preprints/a8eux/relationships/node/,NA,NA,NA,https://api.osf.io/v2/licenses/5ad7979bc69830002d8190e3/,5ad7979bc69830002d8190e3,licenses,https://api.osf.io/v2/providers/preprints/socarxiv/,socarxiv,preprint-providers,https://api.osf.io/v2/preprints/a8eux/files/,https://api.osf.io/v2/files/60a842830b6c69010f9ba94d/,60a842830b6c69010f9ba94d,files,https://api.osf.io/v2/preprints/a8eux/review_actions/,https://api.osf.io/v2/preprints/a8eux/requests/,https://api.osf.io/v2/preprints/a8eux/,https://osf.io/preprints/socarxiv/a8eux/,https://doi.org/10.31235/osf.io/a8eux,https://doi.org/10.1177/0731121415586479
ghptz,preprints,2021-05-21T20:05:06.490622,2021-05-23T18:34:41.943788,2021-05-23T18:34:17.813028,NA,NA,Health Care Visits During the COVID-19 Pandemic: A Spatial and Temporal Analysis of Mobile Device Data,"Transportation disruptions caused by COVID-19 have exacerbated difficulties in health care delivery and access, which may lead to changes in health care use. This study uses mobile device data from SafeGraph to explore the temporal patterns of visits to health care points of interest (POIs) during 2020 and examines how these patterns are associated with socio-demographic and spatial characteristics at the block group level in North Carolina. Specifically, using the k-medoid time-series clustering method, we identify three distinct types of temporal patterns of visits to health care POI. Furthermore, by estimating the multinomial logit models, we find that socio-demographic and spatial characteristics are strongly correlated with both the intensity and trend of medical visits during the pandemic. The results suggest that the ability to conduct in-person medical visits during the pandemic has been unequally distributed, which highlights the importance of tailoring policy strategies for specific socio-demographic groups to ensure health care delivery and access in a timely, equitable, and safe manner.",TRUE,FALSE,healthcare access; equity; COVID-19; mobile device data; time-series clustering,2021-05-23T18:34:41.922849,NA,,TRUE,accepted,2021-05-23T18:34:17.813028,FALSE,NA,no,SafeGraph data is available after signing a data use agreement with SafeGraph. Other data used in this paper is publicly available.,,no,NA,,NA,"5a8c80f7c698300375c76d84|5a8c80f7c698300375c76d86|5a8c80f7c698300375c76d89|Social and Behavioral Sciences|Geography|Human Geography|5a8c80f7c698300375c76d84|5a8c80f7c698300375c76d97|Social and Behavioral Sciences|Urban Studies and Planning|5a8c80f7c698300375c76d84|5a8c80f8c698300375c76ddb|5a8c80f9c698300375c76de2|Social and Behavioral Sciences|Public Affairs, Public Policy and Public Administration|Health Policy",,2021,https://api.osf.io/v2/preprints/ghptz/contributors/,https://api.osf.io/v2/preprints/ghptz/bibliographic_contributors/,https://api.osf.io/v2/preprints/ghptz/citation/,ghptz,preprints,https://api.osf.io/v2/preprints/ghptz/identifiers/,https://api.osf.io/v2/preprints/ghptz/relationships/node/,NA,NA,NA,https://api.osf.io/v2/licenses/5ad7979bc69830002d8190e3/,5ad7979bc69830002d8190e3,licenses,https://api.osf.io/v2/providers/preprints/socarxiv/,socarxiv,preprint-providers,https://api.osf.io/v2/preprints/ghptz/files/,https://api.osf.io/v2/files/60a81276a480c601020d0eab/,60a81276a480c601020d0eab,files,https://api.osf.io/v2/preprints/ghptz/review_actions/,https://api.osf.io/v2/preprints/ghptz/requests/,https://api.osf.io/v2/preprints/ghptz/,https://osf.io/preprints/socarxiv/ghptz/,https://doi.org/10.31235/osf.io/ghptz,NA
fm29j,preprints,2021-05-21T18:02:00.442405,2021-05-23T18:33:42.712005,2021-05-23T18:33:14.877136,2021-05-21T04:00:00,NA,"Pro-Environmental Attitudes, Altruism, and COVID-19 Risk Management Behavior","Limiting the spread of COVID-19 during the pandemic is a collective action problem that calls on individuals to act, not just for their benefit but also for the benefit of others in their community. Many environmental problems, especially climate change, share this same characteristic. In this study, we use a survey instrument to examine how pro-environmental attitudes and two types of altruism relate to the tendency to follow social distancing guidelines and limit voluntary social exposure during the pandemic. We find that pro-environmental behaviors predict a feeling of moral obligation to reduce COVID-19 risk and a lower level of voluntary social exposure. Voluntary, individual-level altruism has no relationship with social exposure. These findings point to important insights about the nuances in altruistic behavior. These insights may lead to essential guidance for public health and environmental messaging that respects and leverages the differences in voluntary, individual-level altruism and collective altruism.",TRUE,FALSE,altruism|COVID-19|pro-environmental attitudes|risk behavior,2021-05-23T18:33:42.689136,NA,,TRUE,accepted,2021-05-23T18:33:14.877136,FALSE,NA,no,Email tshrum@uvm.edu for access to the data.,,no,NA,,,5a8c80f7c698300375c76d84|5a8c80f7c698300375c76d98|5a8c80f8c698300375c76dad|Social and Behavioral Sciences|Psychology|Applied Behavior Analysis|5a8c80f7c698300375c76d84|5a8c80f8c698300375c76dbd|Social and Behavioral Sciences|Environmental Studies,,2021,https://api.osf.io/v2/preprints/fm29j/contributors/,https://api.osf.io/v2/preprints/fm29j/bibliographic_contributors/,https://api.osf.io/v2/preprints/fm29j/citation/,fm29j,preprints,https://api.osf.io/v2/preprints/fm29j/identifiers/,https://api.osf.io/v2/preprints/fm29j/relationships/node/,NA,NA,NA,https://api.osf.io/v2/licenses/563c1cf88c5e4a3877f9e96a/,563c1cf88c5e4a3877f9e96a,licenses,https://api.osf.io/v2/providers/preprints/socarxiv/,socarxiv,preprint-providers,https://api.osf.io/v2/preprints/fm29j/files/,https://api.osf.io/v2/files/60a7f59ba480c600c00d200b/,60a7f59ba480c600c00d200b,files,https://api.osf.io/v2/preprints/fm29j/review_actions/,https://api.osf.io/v2/preprints/fm29j/requests/,https://api.osf.io/v2/preprints/fm29j/,https://osf.io/preprints/socarxiv/fm29j/,https://doi.org/10.31235/osf.io/fm29j,NA
