id,type,attributes.date_created,attributes.date_modified,attributes.date_published,attributes.original_publication_date,attributes.doi,attributes.title,attributes.description,attributes.is_published,attributes.is_preprint_orphan,attributes.tags,attributes.preprint_doi_created,attributes.date_withdrawn,attributes.current_user_permissions,attributes.public,attributes.reviews_state,attributes.date_last_transitioned,attributes.has_coi,attributes.conflict_of_interest_statement,attributes.has_data_links,attributes.why_no_data,attributes.data_links,attributes.has_prereg_links,attributes.why_no_prereg,attributes.prereg_links,attributes.prereg_link_info,attributes.subjects,attributes.license_record.copyright_holders,attributes.license_record.year,relationships.contributors.links.related.href,relationships.bibliographic_contributors.links.related.href,relationships.citation.links.related.href,relationships.citation.data.id,relationships.citation.data.type,relationships.identifiers.links.related.href,relationships.node.links.self.href,relationships.node.links.related.href,relationships.node.data.id,relationships.node.data.type,relationships.license.links.related.href,relationships.license.data.id,relationships.license.data.type,relationships.provider.links.related.href,relationships.provider.data.id,relationships.provider.data.type,relationships.files.links.related.href,relationships.primary_file.links.related.href,relationships.primary_file.data.id,relationships.primary_file.data.type,relationships.review_actions.links.related.href,relationships.requests.links.related.href,links.self,links.html,links.preprint_doi,links.doi
h84bq,preprints,2021-01-19T19:46:22.208453,2021-01-20T14:51:43.162924,2021-01-20T14:51:26.087026,2020-09-30T18:30:00,NA,Challenges and Strategies during Pandemic : An Indian Perspective,"The world history has been witnessed of number of pandemics including Russian flu in 1889, Spanish flu in 1918, Asian flu in 1957, HIV/AIDS (human immunodeficiency virus, acquired immunodeficiency syndrome) in 1981, and SARS (severe acute respiratory syndrome) in 2003. Now, the human community is struggling against transmitting disease called COVID-19 (coronavirus disease). Many countries, including China, Italy, the United States of America, Spain, France and Iran, etc. experienced catastrophic COVID-19 attack and lost the lives of their many citizens. India, the world's second-largest population, has not yet experienced the outbreak of corona disease on a community level, but India is most likely to be affected. This paper presents a countryside discussion on the process and importance of a quick response of India as a remedy against COVID-19. This paper is based on secondary data from various resources of world health organization (WHO), the Ministry of Health and Family Welfare, Government of India and other research documents. The analysis demonstrates the decline in the percent of COVID-19 infected people after proper social distancing implementation among the human community.",TRUE,FALSE,Coronavirus|COVID-19|epidemic|hydroxychloroquine|lockdown|pandemic|social distancing,2021-01-20T14:51:43.143176,NA,,TRUE,accepted,2021-01-20T14:51:26.087026,FALSE,NA,not_applicable,NA,,not_applicable,NA,,,"5a8c80f7c698300375c76d84|5a8c80f8c698300375c76ddb|5a8c80f9c698300375c76de2|Social and Behavioral Sciences|Public Affairs, Public Policy and Public Administration|Health Policy",,2021,https://api.osf.io/v2/preprints/h84bq/contributors/,https://api.osf.io/v2/preprints/h84bq/bibliographic_contributors/,https://api.osf.io/v2/preprints/h84bq/citation/,h84bq,preprints,https://api.osf.io/v2/preprints/h84bq/identifiers/,https://api.osf.io/v2/preprints/h84bq/relationships/node/,NA,NA,NA,https://api.osf.io/v2/licenses/563c1cf88c5e4a3877f9e96c/,563c1cf88c5e4a3877f9e96c,licenses,https://api.osf.io/v2/providers/preprints/socarxiv/,socarxiv,preprint-providers,https://api.osf.io/v2/preprints/h84bq/files/,https://api.osf.io/v2/files/6007372386541a08d714a3ff/,6007372386541a08d714a3ff,files,https://api.osf.io/v2/preprints/h84bq/review_actions/,https://api.osf.io/v2/preprints/h84bq/requests/,https://api.osf.io/v2/preprints/h84bq/,https://osf.io/preprints/socarxiv/h84bq/,https://doi.org/10.31235/osf.io/h84bq,NA
grche,preprints,2021-01-19T17:53:37.317213,2021-01-20T14:50:45.301713,2021-01-20T14:50:33.636699,NA,NA,Survey Experiments in the Study of Religions,"Survey experiments are burgeoning in the study of religion/s. A survey experiment is simply an experiment conducted on a survey. Survey experiments address key limitations of non-experimental surveys and experiments on convenience samples. Surveys are great for speaking to patterns in a broader population, but are limited in their ability to examine causal mechanisms (i.e., what exactly causes what). Lab experiments speak to causality, but using convenience samples limits generalizability (i.e., the extent to which the patterns can be expected to apply to a wider population). Survey experiments combine strengths from survey methods and experimental methods, providing leverage on both generalizability and causality. By using population-based sampling frames from survey research, survey experiments can generalize to a broader population. And by using experimental methods, specifically randomly assigning people to experimental conditions, survey experiments can establish whether one thing causes another. Although survey experiments are becoming more common in the social scientific study of religion, we are only beginning to scratch the surface of the range of questions and contexts that could be explored with survey experiments.",TRUE,FALSE,Methods|Religion|Survey Experiments,2021-01-20T14:50:45.285529,NA,,TRUE,accepted,2021-01-20T14:50:33.636699,FALSE,NA,not_applicable,NA,,not_applicable,NA,,,5a8c80f2c698300375c76c7d|5a8c80f4c698300375c76cac|Arts and Humanities|Religion|5a8c80f7c698300375c76d84|5a8c80fac698300375c76e20|5a8c80fac698300375c76e2c|Social and Behavioral Sciences|Sociology|Methodology|5a8c80f7c698300375c76d84|5a8c80fac698300375c76e20|5a8c80fac698300375c76e31|Social and Behavioral Sciences|Sociology|Sociology of Religion,,2021,https://api.osf.io/v2/preprints/grche/contributors/,https://api.osf.io/v2/preprints/grche/bibliographic_contributors/,https://api.osf.io/v2/preprints/grche/citation/,grche,preprints,https://api.osf.io/v2/preprints/grche/identifiers/,https://api.osf.io/v2/preprints/grche/relationships/node/,NA,NA,NA,https://api.osf.io/v2/licenses/563c1cf88c5e4a3877f9e96a/,563c1cf88c5e4a3877f9e96a,licenses,https://api.osf.io/v2/providers/preprints/socarxiv/,socarxiv,preprint-providers,https://api.osf.io/v2/preprints/grche/files/,https://api.osf.io/v2/files/60071ca5e80d37087fa58f9a/,60071ca5e80d37087fa58f9a,files,https://api.osf.io/v2/preprints/grche/review_actions/,https://api.osf.io/v2/preprints/grche/requests/,https://api.osf.io/v2/preprints/grche/,https://osf.io/preprints/socarxiv/grche/,https://doi.org/10.31235/osf.io/grche,NA
5vnke,preprints,2021-01-19T14:12:16.766230,2021-01-22T14:08:13.467380,2021-01-20T14:50:07.232893,2021-01-19T00:00:00,NA,Good news for whom? The Pfizer/BioNTech vaccine announcement reduced political trust,"The announcement of Pfizer/BioNTech’s COVID-19 vaccine success on 9 November 2020 led to a global stock market surge. But how did the general public respond to such good news? We report results of a nation-wide natural experiment in the US and the UK on how the vaccine news influenced citizens' government evaluations, anxiety, beliefs and elicited behaviors. While most outcomes were unaffected by the news, trust in government and elected politicians (and their competency) saw a significant decline in both countries. As the news did not concern the government, and the government did not have time to act on the news, our results suggest a dispositional response to positive news more likely to be explained by a form of the psychological mechanism of motivated reasoning. They also offer a novel insight regarding the association between trust in government and compliance with its policies: anxiety might explain both.",TRUE,FALSE,anxiety|compliance|Covid-19|Covid-19 vaccine|good news|locus of control|trust in government,2021-01-20T14:50:21.336388,NA,,TRUE,accepted,2021-01-20T14:50:07.232893,FALSE,NA,no,Data will be made available upon publication.,,no,NA,,,5a8c80f7c698300375c76d84|5a8c80f7c698300375c76d98|Social and Behavioral Sciences|Psychology|5a8c80f7c698300375c76d84|5a8c80f8c698300375c76daf|Social and Behavioral Sciences|Political Science|5a8c80f7c698300375c76d84|5a8c80f8c698300375c76dbe|5a8c80f8c698300375c76dc5|Social and Behavioral Sciences|Economics|Behavioral Economics,,2021,https://api.osf.io/v2/preprints/5vnke/contributors/,https://api.osf.io/v2/preprints/5vnke/bibliographic_contributors/,https://api.osf.io/v2/preprints/5vnke/citation/,5vnke,preprints,https://api.osf.io/v2/preprints/5vnke/identifiers/,https://api.osf.io/v2/preprints/5vnke/relationships/node/,NA,NA,NA,https://api.osf.io/v2/licenses/563c1cf88c5e4a3877f9e96a/,563c1cf88c5e4a3877f9e96a,licenses,https://api.osf.io/v2/providers/preprints/socarxiv/,socarxiv,preprint-providers,https://api.osf.io/v2/preprints/5vnke/files/,https://api.osf.io/v2/files/6006e8c486541a0878150c8d/,6006e8c486541a0878150c8d,files,https://api.osf.io/v2/preprints/5vnke/review_actions/,https://api.osf.io/v2/preprints/5vnke/requests/,https://api.osf.io/v2/preprints/5vnke/,https://osf.io/preprints/socarxiv/5vnke/,https://doi.org/10.31235/osf.io/5vnke,NA
4pdga,preprints,2021-01-19T13:57:12.101438,2021-01-20T14:49:46.150637,2021-01-20T14:49:17.039639,2021-01-18T16:00:00,10.31014/aior.1993.04.01.170,Development of Content Representation (CoRe) Framework as Analysis Instrument of Pedagogical Content Knowledge Capability for Biology Teachers,"The results of the preliminary study were obtained from 15 prospective biology teacher students related to the initial abilities that must be possessed to become a teacher and the implementation of learning in science learning. In general, 15 prospective teachers were of the opinion that it was not so different about the ability to have to become a teacher. Based on the results of the preliminary study, prospective teacher students already know the abilities that need to be possessed to become a teacher and in the implementation of learning students must be active but still not showing knowledge related to knowledge that combines content and pedagogical knowledge. One way to analyze the ability of prospective teacher PCK is through filling in documents consisting of Content Representation (CoRe). The data presented in the form of student response questionnaire analysis related to CoRe in terms of education and language and the results of test the validity and reliability of items. For linguistic aspects of CoRe instrument in general CoRe instrument have very high frequency, meaning that CoRe instrument that have been developed are able to be accepted and used properly by prospective biology teacher students at Muhammadiyah Metro University with a percentage 70%. For educational aspects of the CoRe instrument in general CoRe instrument have very high criteria, meaning that the CoRe instrument that have been developed are able to be accepted and used properly by prospective biology teachers at the Muhammadiyah Metro University with a percentage 73,33%.",TRUE,FALSE,Biology Teacher|CoRe|Pedagogical Content Knowledge,2021-01-20T14:49:46.116673,NA,,TRUE,accepted,2021-01-20T14:49:17.039639,FALSE,NA,not_applicable,NA,,not_applicable,NA,,,5a8c80f6c698300375c76d4e|Education,,2021,https://api.osf.io/v2/preprints/4pdga/contributors/,https://api.osf.io/v2/preprints/4pdga/bibliographic_contributors/,https://api.osf.io/v2/preprints/4pdga/citation/,4pdga,preprints,https://api.osf.io/v2/preprints/4pdga/identifiers/,https://api.osf.io/v2/preprints/4pdga/relationships/node/,https://api.osf.io/v2/nodes/zuksr/,zuksr,nodes,https://api.osf.io/v2/licenses/563c1cf88c5e4a3877f9e96a/,563c1cf88c5e4a3877f9e96a,licenses,https://api.osf.io/v2/providers/preprints/socarxiv/,socarxiv,preprint-providers,https://api.osf.io/v2/preprints/4pdga/files/,https://api.osf.io/v2/files/6006e53cd77bf1003f677a33/,6006e53cd77bf1003f677a33,files,https://api.osf.io/v2/preprints/4pdga/review_actions/,https://api.osf.io/v2/preprints/4pdga/requests/,https://api.osf.io/v2/preprints/4pdga/,https://osf.io/preprints/socarxiv/4pdga/,https://doi.org/10.31235/osf.io/4pdga,https://doi.org/10.31014/aior.1993.04.01.170
wjtf7,preprints,2021-01-19T13:49:29.384087,2021-01-20T14:49:04.334803,2021-01-20T14:48:52.829414,2021-01-18T16:00:00,10.31014/aior.1993.04.01.169,Educational Needs of Adult Refugees’ Educators: A Greek Case Study,"In the present paper we tried to describe the educational needs of the adult refugees’ educators in the area of Leros, Greece. To collect our data, we used the qualitative approach and conducted interviews throughout the avalanche sampling, so that the participants could express their ideas and perceptions. Our sample consists of adult refugees’ educators working in NGO ECHO100PLUS, which is activated in Leros. The analysis of the data revealed the educators’ inexperience and lack of training, At the same time, those areas where trainers need further training, as well as their preferences for trainers and the type of training, were recorded.",TRUE,FALSE,Adult Education|Educational Needs|Refugees’ Trainers,2021-01-20T14:49:04.284193,NA,,TRUE,accepted,2021-01-20T14:48:52.829414,FALSE,NA,not_applicable,NA,,not_applicable,NA,,,5a8c80f6c698300375c76d4e|Education,,2021,https://api.osf.io/v2/preprints/wjtf7/contributors/,https://api.osf.io/v2/preprints/wjtf7/bibliographic_contributors/,https://api.osf.io/v2/preprints/wjtf7/citation/,wjtf7,preprints,https://api.osf.io/v2/preprints/wjtf7/identifiers/,https://api.osf.io/v2/preprints/wjtf7/relationships/node/,https://api.osf.io/v2/nodes/zuksr/,zuksr,nodes,https://api.osf.io/v2/licenses/563c1cf88c5e4a3877f9e96a/,563c1cf88c5e4a3877f9e96a,licenses,https://api.osf.io/v2/providers/preprints/socarxiv/,socarxiv,preprint-providers,https://api.osf.io/v2/preprints/wjtf7/files/,https://api.osf.io/v2/files/6006e36ee80d370845a57e62/,6006e36ee80d370845a57e62,files,https://api.osf.io/v2/preprints/wjtf7/review_actions/,https://api.osf.io/v2/preprints/wjtf7/requests/,https://api.osf.io/v2/preprints/wjtf7/,https://osf.io/preprints/socarxiv/wjtf7/,https://doi.org/10.31235/osf.io/wjtf7,https://doi.org/10.31014/aior.1993.04.01.169
9ywd2,preprints,2021-01-19T13:37:45.506266,2021-01-20T01:16:06.115664,2021-01-20T01:15:44.710746,2021-01-18T16:00:00,10.31014/aior.1993.04.01.168,New Students’ Perceptions on the Implementation of Zoning-Based PPDB,"This research aims to determine the perceptions of new students on the implementation of zoning-based PPDB (New Learner Admission Activities). The method in this research was mixed-method approach. Primary data was obtained through distributing questionnaires filled out by students. Samples were taken using purposive sampling technique in five cities, including Bandung, Surakarta, Surabaya, Pontianak and Serang. The data analysis technique used the Miles and Huberman model. The results show that the school which initially received the favourite label is still the favourite one because of the facilities and infrastructure and the implementation of the existing learning process in the school. The zoning system based on student perceptions does not reduce enthusiasm for learning. The zoning-based PPDB for junior high school and senior high school is more guaranteed for students who live close to the school to get the target school. The zoning system has been well implemented in four cities, including Surabaya, Bandung, Surakarta and Pontianak. In addition, the zoning system can save money.",TRUE,FALSE,Students’ Perception|Zoning-Based PPDB,2021-01-20T01:16:06.096500,NA,,TRUE,accepted,2021-01-20T01:15:44.710746,FALSE,NA,not_applicable,NA,,not_applicable,NA,,,5a8c80f6c698300375c76d4e|Education,,2021,https://api.osf.io/v2/preprints/9ywd2/contributors/,https://api.osf.io/v2/preprints/9ywd2/bibliographic_contributors/,https://api.osf.io/v2/preprints/9ywd2/citation/,9ywd2,preprints,https://api.osf.io/v2/preprints/9ywd2/identifiers/,https://api.osf.io/v2/preprints/9ywd2/relationships/node/,https://api.osf.io/v2/nodes/zuksr/,zuksr,nodes,https://api.osf.io/v2/licenses/563c1cf88c5e4a3877f9e96a/,563c1cf88c5e4a3877f9e96a,licenses,https://api.osf.io/v2/providers/preprints/socarxiv/,socarxiv,preprint-providers,https://api.osf.io/v2/preprints/9ywd2/files/,https://api.osf.io/v2/files/6006e0b186541a086c1547d3/,6006e0b186541a086c1547d3,files,https://api.osf.io/v2/preprints/9ywd2/review_actions/,https://api.osf.io/v2/preprints/9ywd2/requests/,https://api.osf.io/v2/preprints/9ywd2/,https://osf.io/preprints/socarxiv/9ywd2/,https://doi.org/10.31235/osf.io/9ywd2,https://doi.org/10.31014/aior.1993.04.01.168
t7zne,preprints,2021-01-19T13:23:45.502320,2021-01-20T01:15:47.759689,2021-01-20T01:15:19.358056,2021-01-18T16:00:00,10.31014/aior.1991.04.01.250,Tourism Activities in the Traditional Balinese House: The Challenges of Designing a Homestay in Gianyar Bali,"The development of the tourism sector has had various effects on Balinese people’s traditional practices, including the traditional Balinese house. Since the increase of Bali’s tourist activities, the traditional houses for the Balinese that demonstrated not only a way of shelter but also complex cultural links have become objects of transformation. This transformation tended to fade its meanings and values, even though the Balinese have tried to maintain their culture as tourism resources. This phenomenon is an architectural challenge for the people to produce an innovative design of the transformed house. A descriptive exploratory approach with qualitative methods was used in this paper. Using interviews, field works and architectural examination in Taro, Kendran, and Ubud, this paper explores innovative designs that not only can accommodate traditional functions of the houses but also address the new demands of tourists. Some alternative models of pavilions have been built in many parts of the house, such as in the backyard, adjacent to old pavilions, or by demolishing the old pavilions.",TRUE,FALSE,Balinese Traditional House|Tourism Village|Transformation,2021-01-20T01:15:47.721008,NA,,TRUE,accepted,2021-01-20T01:15:19.358056,FALSE,NA,not_applicable,NA,,not_applicable,NA,,,5a8c80f6c698300375c76d4e|Education|5a8c80f7c698300375c76d84|Social and Behavioral Sciences,,2021,https://api.osf.io/v2/preprints/t7zne/contributors/,https://api.osf.io/v2/preprints/t7zne/bibliographic_contributors/,https://api.osf.io/v2/preprints/t7zne/citation/,t7zne,preprints,https://api.osf.io/v2/preprints/t7zne/identifiers/,https://api.osf.io/v2/preprints/t7zne/relationships/node/,https://api.osf.io/v2/nodes/c7vbg/,c7vbg,nodes,https://api.osf.io/v2/licenses/563c1cf88c5e4a3877f9e96a/,563c1cf88c5e4a3877f9e96a,licenses,https://api.osf.io/v2/providers/preprints/socarxiv/,socarxiv,preprint-providers,https://api.osf.io/v2/preprints/t7zne/files/,https://api.osf.io/v2/files/6006dd6cd77bf1003867a92d/,6006dd6cd77bf1003867a92d,files,https://api.osf.io/v2/preprints/t7zne/review_actions/,https://api.osf.io/v2/preprints/t7zne/requests/,https://api.osf.io/v2/preprints/t7zne/,https://osf.io/preprints/socarxiv/t7zne/,https://doi.org/10.31235/osf.io/t7zne,https://doi.org/10.31014/aior.1991.04.01.250
m95df,preprints,2021-01-19T10:51:27.802622,2021-02-02T15:49:22.776498,2021-01-19T12:16:24.414281,NA,NA,Inequality in employment trajectories and their  socio-economic consequences during the early phase of the COVID-19 pandemic in Germany,"This paper evaluates the inequalities in employment trajectories during the first COVID-19 pandemic lockdown in Germany. We assess individual-level panel data collected weekly between 20 March and 25 June (N=2,297), which allows us to examine the risks of short-time work, furlough, and job loss, as well as changes between working on-site and from home. Using sequence analysis, we detect typical patterns of employment trajectories and analyse how these vary between socio-demographic groups. Finally, we relate the types of employment trajectories to changes in income, subjective job security (compared to values in January and February 2020), and COVID-19 infection risks. Our results show clear gradients in employment risks: low-wage workers were severely affected by furlough and job loss, while highly qualified employees were able to work from home. Furthermore, in contrast to previous crises, service sector and female employees were more affected by short-time work; however, its timing and duration differs compared to male workers in manufacturing. Income loss was pronounced among those who became unemployed and those continuously in short-term work, while everybody—including employees continuously working from home—experienced a significant reduction in subjective job security compared to employees whose employment hours or location have not changed. The infection risk was only increased for individuals who changed from furlough to working on-site.",TRUE,FALSE,COVID-19|COVID-19 infection risks|Employment trajectories|Job Security|Lockdown|Panel data|Remote work|Sequence Analysis|Short-time work|Working from home,2021-01-19T12:16:40.899794,NA,,TRUE,accepted,2021-01-19T12:16:24.414281,FALSE,NA,no,The source data is not yet published.,,no,No preregistration avaiable,,,"5a8c80f7c698300375c76d84|5a8c80f9c698300375c76e0c|Social and Behavioral Sciences|Social Statistics|5a8c80f7c698300375c76d84|5a8c80fac698300375c76e20|5a8c80fac698300375c76e35|Social and Behavioral Sciences|Sociology|Inequality, Poverty, and Mobility|5a8c80f7c698300375c76d84|5a8c80fac698300375c76e20|5a8c80fac698300375c76e38|Social and Behavioral Sciences|Sociology|Organizations, Occupations, and Work",,2021,https://api.osf.io/v2/preprints/m95df/contributors/,https://api.osf.io/v2/preprints/m95df/bibliographic_contributors/,https://api.osf.io/v2/preprints/m95df/citation/,m95df,preprints,https://api.osf.io/v2/preprints/m95df/identifiers/,https://api.osf.io/v2/preprints/m95df/relationships/node/,NA,NA,NA,https://api.osf.io/v2/licenses/563c1cf88c5e4a3877f9e96a/,563c1cf88c5e4a3877f9e96a,licenses,https://api.osf.io/v2/providers/preprints/socarxiv/,socarxiv,preprint-providers,https://api.osf.io/v2/preprints/m95df/files/,https://api.osf.io/v2/files/6006b9b7df7ff00055474318/,6006b9b7df7ff00055474318,files,https://api.osf.io/v2/preprints/m95df/review_actions/,https://api.osf.io/v2/preprints/m95df/requests/,https://api.osf.io/v2/preprints/m95df/,https://osf.io/preprints/socarxiv/m95df/,https://doi.org/10.31235/osf.io/m95df,NA
zqj25,preprints,2021-01-18T23:54:20.917453,2021-01-19T06:05:45.424398,2021-01-19T06:05:01.910689,NA,NA,Short-run and long-run ideologies:  Calculating curves for Christianism and Sovietism,"The research framework of this study is related to the problem of why and how the population´s beliefs born, develop and, finally extinct. In previous work, the kinetics of the groups that remain constant in their empire's nationalistic ideologies was developed. Now, this research tries to calculate how beliefs diminish until disappearing. Founded in basic historical data of two ideologies, Christianism and Sovietism, the aim of this work is to establish that the populations increase is inversely proportional to the difference between that population and the maximum Nm that could reach, dN / (Nm - N), and the elapsed time 1dt, where1  is a coefficient greater than zero. As an eternal duration is impossible, a decrement factor Nmexp (-2t) is introduced. This produces a differential equation that can be interpreted mechanically as the initial impulse that pushes and made it works. The conclusion can be desegregated in three parts: first, in terms of formal equations; second, in sociological terms, to say, religious beliefs are more important than political beliefs; and finally, in terms of political change, that is, slow transformations last very much longer than rapid ones.",TRUE,FALSE,,2021-01-19T06:05:45.402522,NA,,TRUE,accepted,2021-01-19T06:05:01.910689,FALSE,NA,no,The data to calculate the rise and fall curves correspond to the populations of territories under the influence of the ideologies understudy in several years. The years selected and used are arbitrary. Population figures would be found in any encyclopedia.,,no,,,,5a8c80f7c698300375c76d84|5a8c80fac698300375c76e20|5a8c80fac698300375c76e4d|Social and Behavioral Sciences|Sociology|Mathematical Sociology,Pablo Kittl|Jorge Gibert|Gerardo Díaz,2021,https://api.osf.io/v2/preprints/zqj25/contributors/,https://api.osf.io/v2/preprints/zqj25/bibliographic_contributors/,https://api.osf.io/v2/preprints/zqj25/citation/,zqj25,preprints,https://api.osf.io/v2/preprints/zqj25/identifiers/,https://api.osf.io/v2/preprints/zqj25/relationships/node/,NA,NA,NA,https://api.osf.io/v2/licenses/563c1cf88c5e4a3877f9e965/,563c1cf88c5e4a3877f9e965,licenses,https://api.osf.io/v2/providers/preprints/socarxiv/,socarxiv,preprint-providers,https://api.osf.io/v2/preprints/zqj25/files/,https://api.osf.io/v2/files/60061fbce80d370811a5a3f2/,60061fbce80d370811a5a3f2,files,https://api.osf.io/v2/preprints/zqj25/review_actions/,https://api.osf.io/v2/preprints/zqj25/requests/,https://api.osf.io/v2/preprints/zqj25/,https://osf.io/preprints/socarxiv/zqj25/,https://doi.org/10.31235/osf.io/zqj25,NA
