id,type,attributes.date_created,attributes.date_modified,attributes.date_published,attributes.original_publication_date,attributes.doi,attributes.title,attributes.description,attributes.is_published,attributes.is_preprint_orphan,attributes.tags,attributes.preprint_doi_created,attributes.date_withdrawn,attributes.current_user_permissions,attributes.public,attributes.reviews_state,attributes.date_last_transitioned,attributes.has_coi,attributes.conflict_of_interest_statement,attributes.has_data_links,attributes.why_no_data,attributes.data_links,attributes.has_prereg_links,attributes.why_no_prereg,attributes.prereg_links,attributes.prereg_link_info,attributes.subjects,attributes.license_record.copyright_holders,attributes.license_record.year,relationships.contributors.links.related.href,relationships.bibliographic_contributors.links.related.href,relationships.citation.links.related.href,relationships.citation.data.id,relationships.citation.data.type,relationships.identifiers.links.related.href,relationships.node.links.self.href,relationships.node.links.related.href,relationships.node.data.id,relationships.node.data.type,relationships.license.links.related.href,relationships.license.data.id,relationships.license.data.type,relationships.provider.links.related.href,relationships.provider.data.id,relationships.provider.data.type,relationships.files.links.related.href,relationships.primary_file.links.related.href,relationships.primary_file.data.id,relationships.primary_file.data.type,relationships.review_actions.links.related.href,relationships.requests.links.related.href,links.self,links.html,links.preprint_doi,links.doi
zr7hp,preprints,2019-10-14T15:53:24.083458,2019-10-14T22:11:42.217533,2019-10-14T22:11:33.239369,2017-07-18T04:00:00,NA,Is the Jump-Diffusion Model a Good Solution for Credit Risk Modeling? The Case of Convertible Bonds,"This paper argues that the reduced-form jump diffusion model may not be appropriate for credit risk modeling. To correctly value hybrid defaultable financial instruments, e.g., convertible bonds, we present a new framework that relies on the probability distribution of a default jump rather than the default jump itself, as the default jump is usually inaccessible. As such, the model can back out the market prices of convertible bonds. A prevailing belief in the market is that convertible arbitrage is mainly due to convertible underpricing. Empirically, however, we do not find evidence supporting the underpricing hypothesis. Instead, we find that convertibles have relatively large positive gammas. As a typical convertible arbitrage strategy employs delta-neutral hedging, a large positive gamma can make the portfolio highly profitable, especially for a large movement in the underlying stock price.",TRUE,FALSE,asset pricing|convertible arbitrage|convertible bond|convertible underpricing|credit risk modeling|default probability approach|default time approach|jump diffusion,2019-10-14T22:11:42.196388,NA,,TRUE,accepted,2019-10-14T22:11:33.239369,NA,NA,NA,NA,NA,NA,NA,NA,NA,5a8c80f7c698300375c76d84|5a8c80f8c698300375c76dbe|5a8c80f8c698300375c76dbf|Social and Behavioral Sciences|Economics|Finance,,2019,https://api.osf.io/v2/preprints/zr7hp/contributors/,https://api.osf.io/v2/preprints/zr7hp/bibliographic_contributors/,https://api.osf.io/v2/preprints/zr7hp/citation/,zr7hp,preprints,https://api.osf.io/v2/preprints/zr7hp/identifiers/,https://api.osf.io/v2/preprints/zr7hp/relationships/node/,NA,NA,NA,https://api.osf.io/v2/licenses/563c1cf88c5e4a3877f9e96a/,563c1cf88c5e4a3877f9e96a,licenses,https://api.osf.io/v2/providers/preprints/socarxiv/,socarxiv,preprint-providers,https://api.osf.io/v2/preprints/zr7hp/files/,https://api.osf.io/v2/files/5da499f7f6b03e001020852f/,5da499f7f6b03e001020852f,files,https://api.osf.io/v2/preprints/zr7hp/review_actions/,https://api.osf.io/v2/preprints/zr7hp/requests/,https://api.osf.io/v2/preprints/zr7hp/,https://osf.io/preprints/socarxiv/zr7hp/,https://doi.org/10.31235/osf.io/zr7hp,NA
gmd8r,preprints,2019-10-14T15:30:46.238318,2019-10-14T22:14:28.689605,2019-10-14T22:13:57.315009,2018-04-17T23:00:00,10.1080/21582041.2018.1459818,"Using Reflexive Lifelines in Biographical Interviews to aid the Collection, Visualization and Analysis of Resilience","This article demonstrates the use of a reflexive lifeline instrument within a study oriented towards documenting and explaining resilience from a sociological perspective. Informed by both life course and biographical perspectives, our research design comprised two interviews incorporating recursive co-construction of the participant’s lifeline. We aimed to meet three objectives with this method: (1) to collect accurate retrospective data about the timing of lives; (2) to garner biographical data that allowed us to explore lives as wholes; and (3) to elicit participant reflexivity on turning points associated with resilience.  Our approach was distinctive in its explicit use of the lifeline both as a means to bring life stories into dialogue with life histories, and as a dynamic prompt to engage participants in the reflexive co-construction of turning points as fateful moments. We illustrate our approach through a case presentation and analysis of the reflexive lifelines co-constructed with two men who participated in our study.  We also show how the reflexive lifeline interview generated opportunities for participant-led researcher reflexivity.",TRUE,FALSE,biographical method|qualitative longitudinal|reflexivity|resilience,2019-10-14T22:14:28.670312,NA,,TRUE,accepted,2019-10-14T22:13:57.315009,NA,NA,NA,NA,NA,NA,NA,NA,NA,5a8c80f7c698300375c76d84|5a8c80fac698300375c76e20|5a8c80fac698300375c76e2c|Social and Behavioral Sciences|Sociology|Methodology,,2019,https://api.osf.io/v2/preprints/gmd8r/contributors/,https://api.osf.io/v2/preprints/gmd8r/bibliographic_contributors/,https://api.osf.io/v2/preprints/gmd8r/citation/,gmd8r,preprints,https://api.osf.io/v2/preprints/gmd8r/identifiers/,https://api.osf.io/v2/preprints/gmd8r/relationships/node/,NA,NA,NA,https://api.osf.io/v2/licenses/5ad7979bc69830002d8190e3/,5ad7979bc69830002d8190e3,licenses,https://api.osf.io/v2/providers/preprints/socarxiv/,socarxiv,preprint-providers,https://api.osf.io/v2/preprints/gmd8r/files/,https://api.osf.io/v2/files/5da494acfcf91f0012225740/,5da494acfcf91f0012225740,files,https://api.osf.io/v2/preprints/gmd8r/review_actions/,https://api.osf.io/v2/preprints/gmd8r/requests/,https://api.osf.io/v2/preprints/gmd8r/,https://osf.io/preprints/socarxiv/gmd8r/,https://doi.org/10.31235/osf.io/gmd8r,https://doi.org/10.1080/21582041.2018.1459818
t7y82,preprints,2019-10-14T09:45:10.983704,2019-10-15T08:30:25.708770,2019-10-15T08:21:44.979827,2019-01-14T23:00:00,NA,Glasnost: Nine ways Facebook could become a better forum for free speech and democracy,"This short report aims to (a) identify some important issues concerning political information and political speech on Facebook, (b) provide an overview of the major changes that Facebook has made in recent years, and then (c) assess these changes, and offer suggestions as to what more the company could do. We concentrate on three main areas: content policy, the process which develops the rules for what speech and activity is permissible on Facebook, and then enforces those rules across the platform; News Feed, the assemblage of algorithms that directly mediates the information to which Facebook users are exposed; and governance, which goes beyond transparency to the internal governance of Facebook, and the mounting concern that Facebook is not adequately accountable to its users and other stakeholders in the countries and communities in which it operates.",TRUE,FALSE,content moderation|democracy|facebook|free expression,2019-10-15T08:30:25.688611,NA,,TRUE,accepted,2019-10-15T08:21:44.979827,NA,NA,NA,NA,NA,NA,NA,NA,NA,"5a8c80f7c698300375c76d84|5a8c80f8c698300375c76ddb|5a8c80f9c698300375c76ded|Social and Behavioral Sciences|Public Affairs, Public Policy and Public Administration|Science and Technology Policy",,2019,https://api.osf.io/v2/preprints/t7y82/contributors/,https://api.osf.io/v2/preprints/t7y82/bibliographic_contributors/,https://api.osf.io/v2/preprints/t7y82/citation/,t7y82,preprints,https://api.osf.io/v2/preprints/t7y82/identifiers/,https://api.osf.io/v2/preprints/t7y82/relationships/node/,https://api.osf.io/v2/nodes/uxfmb/,uxfmb,nodes,https://api.osf.io/v2/licenses/5ad7979bc69830002d8190e3/,5ad7979bc69830002d8190e3,licenses,https://api.osf.io/v2/providers/preprints/socarxiv/,socarxiv,preprint-providers,https://api.osf.io/v2/preprints/t7y82/files/,https://api.osf.io/v2/files/5da443abf6b03e000d1fc012/,5da443abf6b03e000d1fc012,files,https://api.osf.io/v2/preprints/t7y82/review_actions/,https://api.osf.io/v2/preprints/t7y82/requests/,https://api.osf.io/v2/preprints/t7y82/,https://osf.io/preprints/socarxiv/t7y82/,https://doi.org/10.31235/osf.io/t7y82,NA
8r97e,preprints,2019-10-14T05:53:48.104765,2019-11-18T03:26:31.052653,2019-10-14T22:18:56.229301,NA,NA,Legislature Size and Welfare: Evidence from Brazil,"What is the effect of legislature size on public service provision? While the literature relates legislature size to representation and government expenditure, its implications for welfare remain understudied. In this paper, we investigate the effects of legislature size on welfare, exploiting exogenous changes in city-council size in Brazil between 2005 and 2008. We show that adding a legislator improves education and health care. However, the results prove true for the services that are believed to be highly salient to voters, are easiest to claim credit for, and are easy to provide. In this sense, education quality and preventive health care remain unaffected while infant mortality and primary school enrollment significantly improve. To investigate the mechanism, we surveyed former councilors and analyzed 346,553 bills proposed by municipalities in the period. This analysis largely corroborates our findings, showing that politicians prefer to provide private and local public goods. This paper has implications for the design of legislative institutions.",TRUE,FALSE,Brazil|Education and Heath Care|Legislature Size|Regression Discontinuity Design|Welfare,2019-10-14T22:19:24.280161,NA,,TRUE,accepted,2019-10-14T22:18:56.229301,NA,NA,NA,NA,NA,NA,NA,NA,NA,5a8c80f7c698300375c76d84|5a8c80f8c698300375c76daf|5a8c80f8c698300375c76db2|Social and Behavioral Sciences|Political Science|Comparative Politics,,2019,https://api.osf.io/v2/preprints/8r97e/contributors/,https://api.osf.io/v2/preprints/8r97e/bibliographic_contributors/,https://api.osf.io/v2/preprints/8r97e/citation/,8r97e,preprints,https://api.osf.io/v2/preprints/8r97e/identifiers/,https://api.osf.io/v2/preprints/8r97e/relationships/node/,NA,NA,NA,https://api.osf.io/v2/licenses/563c1cf88c5e4a3877f9e96a/,563c1cf88c5e4a3877f9e96a,licenses,https://api.osf.io/v2/providers/preprints/socarxiv/,socarxiv,preprint-providers,https://api.osf.io/v2/preprints/8r97e/files/,https://api.osf.io/v2/files/5da40d71a7bc73000eecdc3d/,5da40d71a7bc73000eecdc3d,files,https://api.osf.io/v2/preprints/8r97e/review_actions/,https://api.osf.io/v2/preprints/8r97e/requests/,https://api.osf.io/v2/preprints/8r97e/,https://osf.io/preprints/socarxiv/8r97e/,https://doi.org/10.31235/osf.io/8r97e,NA
b9ey2,preprints,2019-10-13T12:15:19.780750,2019-12-12T05:13:17.870316,2019-10-17T17:32:21.129295,NA,NA,The optimal size of a political party based on the Shapley-Shubik Power Index,"Shapley-Shubik Power Index per person (SSPIPP) is defined as the ratio of a political party's Shapley-Shubik Power Index in Parliament to the number of people who voted for the party. SSPIPP can be regarded as the political power each of them has. This model reveals the relationship between the party size and SSPIPP and shows it in a graph. The graph is M-shaped and reveals the optimal party size that maximizes SSPIPP. According to this model, the more votes required to pass bills in Parliament, the smaller the optimal party size becomes. This model also predicts that in countries which require a supermajority vote to pass bills, party system fragmentation tends to last long.",TRUE,FALSE,public choice theory|rational choice theory|Shapley-Shubik Power Index|supermajority,2019-10-17T17:32:43.818718,NA,,TRUE,accepted,2019-10-17T17:32:21.129295,NA,NA,NA,NA,NA,NA,NA,NA,NA,5a8c80f7c698300375c76d84|5a8c80f8c698300375c76daf|5a8c80f8c698300375c76db1|Social and Behavioral Sciences|Political Science|Models and Methods|5a8c80f7c698300375c76d84|5a8c80f8c698300375c76dbe|5a8c80f8c698300375c76dc0|Social and Behavioral Sciences|Economics|Political Economy,Yuuki Maruyama,2019,https://api.osf.io/v2/preprints/b9ey2/contributors/,https://api.osf.io/v2/preprints/b9ey2/bibliographic_contributors/,https://api.osf.io/v2/preprints/b9ey2/citation/,b9ey2,preprints,https://api.osf.io/v2/preprints/b9ey2/identifiers/,https://api.osf.io/v2/preprints/b9ey2/relationships/node/,NA,NA,NA,https://api.osf.io/v2/licenses/563c1cf88c5e4a3877f9e965/,563c1cf88c5e4a3877f9e965,licenses,https://api.osf.io/v2/providers/preprints/socarxiv/,socarxiv,preprint-providers,https://api.osf.io/v2/preprints/b9ey2/files/,https://api.osf.io/v2/files/5da3155dfcf91f000f1e0d70/,5da3155dfcf91f000f1e0d70,files,https://api.osf.io/v2/preprints/b9ey2/review_actions/,https://api.osf.io/v2/preprints/b9ey2/requests/,https://api.osf.io/v2/preprints/b9ey2/,https://osf.io/preprints/socarxiv/b9ey2/,https://doi.org/10.31235/osf.io/b9ey2,NA
keznu,preprints,2019-10-13T12:05:48.580432,2020-02-25T22:36:49.990768,2019-10-14T22:19:55.236426,NA,NA,Bottom-Up Accountability and Public Service Provision: Evidence from a Field Experiment in Brazil,"Does local oversight improve public service delivery? We study the effect of a mobile phone application that allows citizens to monitor school construction projects in Brazilian municipalities. The app prompts users to submit data about construction sites, sends such crowdsourced information to independent engineers, and contacts the mayors' offices about project delays. Our results show that the app has a null impact on school construction indicators. Additionally, we find that politicians are unresponsive to individual requests. The results question the impact of bottom-up monitoring on public service performance and suggest that interventions targeted at other groups, or focused on different issues, may produce better policy outcomes.",TRUE,FALSE,accountability|Brazil|impact evaluation|state capacity|technology,2019-10-14T22:20:23.581203,NA,,TRUE,accepted,2019-10-14T22:19:55.236426,NA,NA,NA,NA,NA,NA,NA,NA,NA,5a8c80f7c698300375c76d84|5a8c80f8c698300375c76daf|5a8c80f8c698300375c76db2|Social and Behavioral Sciences|Political Science|Comparative Politics,,2019,https://api.osf.io/v2/preprints/keznu/contributors/,https://api.osf.io/v2/preprints/keznu/bibliographic_contributors/,https://api.osf.io/v2/preprints/keznu/citation/,keznu,preprints,https://api.osf.io/v2/preprints/keznu/identifiers/,https://api.osf.io/v2/preprints/keznu/relationships/node/,NA,NA,NA,https://api.osf.io/v2/licenses/563c1cf88c5e4a3877f9e96a/,563c1cf88c5e4a3877f9e96a,licenses,https://api.osf.io/v2/providers/preprints/socarxiv/,socarxiv,preprint-providers,https://api.osf.io/v2/preprints/keznu/files/,https://api.osf.io/v2/files/5da31321f6b03e000f219813/,5da31321f6b03e000f219813,files,https://api.osf.io/v2/preprints/keznu/review_actions/,https://api.osf.io/v2/preprints/keznu/requests/,https://api.osf.io/v2/preprints/keznu/,https://osf.io/preprints/socarxiv/keznu/,https://doi.org/10.31235/osf.io/keznu,NA
g8xqw,preprints,2019-10-13T11:53:08.386793,2020-04-02T13:55:54.455364,2019-10-16T16:10:53.608964,NA,NA,Manual Scavengers in India: Living and Working Conditions; with Special Emphasis on the Determining Factors,"While examining the scope and challenges of social and occupational mobility of manual scavengers in India, the basic factors that determine the living and working conditions of the community cannot be overlooked. Unlike the rest of the world, where economic factors play a key role in forcing people to take up such menial and hazardous occupations, the major part in restricting the social mobility of manual scavengers is played by caste in India. Even if one decides to quit the profession and take up other respectable means of livelihood, the spectre of caste identity haunts him/her throughout life and the person has to face humiliations and social boycotts from the exploiters as well as from within the community. This paper attempts to identify the broad factors that determine the living and working conditions of manual scavengers in India, most of which also play a significant part in the vicious circle of social organisation based on that the caste system that restricts and checks their social and occupational mobility.",TRUE,FALSE,Caste|Hygiene|Manual Scavenging|Social Stigma,2019-10-16T18:41:41.674566,NA,,TRUE,accepted,2019-10-16T16:10:53.608964,NA,NA,NA,NA,NA,NA,NA,NA,NA,"5a8c80f7c698300375c76d84|5a8c80f8c698300375c76dcf|Social and Behavioral Sciences|Social Work|5a8c80f7c698300375c76d84|5a8c80fac698300375c76e20|5a8c80fac698300375c76e35|Social and Behavioral Sciences|Sociology|Inequality, Poverty, and Mobility",,2019,https://api.osf.io/v2/preprints/g8xqw/contributors/,https://api.osf.io/v2/preprints/g8xqw/bibliographic_contributors/,https://api.osf.io/v2/preprints/g8xqw/citation/,g8xqw,preprints,https://api.osf.io/v2/preprints/g8xqw/identifiers/,https://api.osf.io/v2/preprints/g8xqw/relationships/node/,NA,NA,NA,https://api.osf.io/v2/licenses/5ad7979bc69830002d8190e3/,5ad7979bc69830002d8190e3,licenses,https://api.osf.io/v2/providers/preprints/socarxiv/,socarxiv,preprint-providers,https://api.osf.io/v2/preprints/g8xqw/files/,https://api.osf.io/v2/files/5da310dd26eb50000b7d7658/,5da310dd26eb50000b7d7658,files,https://api.osf.io/v2/preprints/g8xqw/review_actions/,https://api.osf.io/v2/preprints/g8xqw/requests/,https://api.osf.io/v2/preprints/g8xqw/,https://osf.io/preprints/socarxiv/g8xqw/,https://doi.org/10.31235/osf.io/g8xqw,NA
73rjn,preprints,2019-10-12T12:37:46.651869,2019-10-13T12:25:22.946228,2019-10-13T12:24:59.033045,NA,NA,Student attrition in gender atypical fields of study. A matter of lacking social integration or pressure from significant others?,"In most European countries, the choice of college majors is highly segregated by gender. Only a small amount of students enrolls in a gender atypical major. Previous studies indicated that these students may have a higher attrition rate than their counterparts in gender typical majors. In this paper, I investigated whether this higher attrition rate is caused by lower levels of social integration and pressure from significant others. I built a synthesis of Tinto’s model of student drop out and Kanter’s theory of tokenism and drew on theories of comparative reference groups to test these hypotheses. Using data from the German National Educational Panel Study, which follows undergraduate students who enrolled in 2010, I conducted discrete time survival analysis. I found that men and women in gender atypical majors have a higher risk to switch to a more gender balanced major and – only for women - to drop out than students in gender typical majors. Low levels of social integration and disapproval of the major by significant others increase the attrition risk. However, these two aspects do not contribute to the explanation of the higher attrition risk of students in gender atypical majors. Alternative explanations are discussed.",TRUE,FALSE,gender inequality|significant others|social integration|university student attrition,2019-10-13T12:25:22.929799,NA,,TRUE,accepted,2019-10-13T12:24:59.033045,NA,NA,NA,NA,NA,NA,NA,NA,NA,5a8c80f6c698300375c76d4e|5a8c80f6c698300375c76d5c|Education|Higher Education|5a8c80f7c698300375c76d84|Social and Behavioral Sciences,Regina Jusri,2019,https://api.osf.io/v2/preprints/73rjn/contributors/,https://api.osf.io/v2/preprints/73rjn/bibliographic_contributors/,https://api.osf.io/v2/preprints/73rjn/citation/,73rjn,preprints,https://api.osf.io/v2/preprints/73rjn/identifiers/,https://api.osf.io/v2/preprints/73rjn/relationships/node/,NA,NA,NA,https://api.osf.io/v2/licenses/563c1cf88c5e4a3877f9e965/,563c1cf88c5e4a3877f9e965,licenses,https://api.osf.io/v2/providers/preprints/socarxiv/,socarxiv,preprint-providers,https://api.osf.io/v2/preprints/73rjn/files/,https://api.osf.io/v2/files/5da1c91ffcf91f00121fdfea/,5da1c91ffcf91f00121fdfea,files,https://api.osf.io/v2/preprints/73rjn/review_actions/,https://api.osf.io/v2/preprints/73rjn/requests/,https://api.osf.io/v2/preprints/73rjn/,https://osf.io/preprints/socarxiv/73rjn/,https://doi.org/10.31235/osf.io/73rjn,NA
67jne,preprints,2019-10-11T12:44:36.390129,2020-05-09T21:48:48.492873,2019-10-11T14:25:22.975119,NA,NA,"Counting Everyone: PMM, a Model for Electoral Reform in Canada","Declining voter participation, strategic-voting campaigns, public opinion polls, and myriad other signals highlight the need to improve Canada's current first-past-the-post electoral system.  How the system ought to be changed, however, remains unclear. This paper briefly reviews candidate models for electoral reform from other nations, before putting forward the parsimonious mixed-member (PMM) model. This model was inspired by the mixed-member (MM) proportional representation system, as currently used in, for example, Germany. It is 'parsimonious', however, in the sense that the number of additional MPs brought into parliament to reach proportionality is minimized. Like traditional MM, PMM preserves the individual relationship between every voter and an MP, and it eliminates under-representation of parties. Unlike traditional MM, however, it also preserves the incentive for parties to win local races, it avoids unnecessary dilution of constituency representatives, and it avoids misattributing spoiled ballots to major parties. As such, it can be thought of as an optimization of MM. A key feature of this model is conservatism -it modifies our existing system with the minimal set of changes necessary to resolve the most obvious problems in the current system, without creating new ones. It fixes only what is broken.",TRUE,FALSE,Canada|Elections|Electoral Reform|Mixed-Member|Proportional Representation|Voting,2019-10-11T14:26:41.638374,NA,,TRUE,accepted,2019-10-11T14:25:22.975119,NA,NA,NA,NA,NA,NA,NA,NA,NA,5a8c80f0c698300375c76c07|5a8c80f1c698300375c76c24|Law|Election Law|5a8c80f2c698300375c76c7d|Arts and Humanities|5a8c80f6c698300375c76d4e|Education|5a8c80f7c698300375c76d84|5a8c80f8c698300375c76daf|5a8c80f8c698300375c76db1|Social and Behavioral Sciences|Political Science|Models and Methods|5a8c80f7c698300375c76d84|5a8c80f8c698300375c76daf|5a8c80f8c698300375c76db3|Social and Behavioral Sciences|Political Science|Other Political Science,,2019,https://api.osf.io/v2/preprints/67jne/contributors/,https://api.osf.io/v2/preprints/67jne/bibliographic_contributors/,https://api.osf.io/v2/preprints/67jne/citation/,67jne,preprints,https://api.osf.io/v2/preprints/67jne/identifiers/,https://api.osf.io/v2/preprints/67jne/relationships/node/,https://api.osf.io/v2/nodes/dc3h6/,dc3h6,nodes,https://api.osf.io/v2/licenses/563c1cf88c5e4a3877f9e96a/,563c1cf88c5e4a3877f9e96a,licenses,https://api.osf.io/v2/providers/preprints/socarxiv/,socarxiv,preprint-providers,https://api.osf.io/v2/preprints/67jne/files/,https://api.osf.io/v2/files/5da0793a26eb50000c7c10cf/,5da0793a26eb50000c7c10cf,files,https://api.osf.io/v2/preprints/67jne/review_actions/,https://api.osf.io/v2/preprints/67jne/requests/,https://api.osf.io/v2/preprints/67jne/,https://osf.io/preprints/socarxiv/67jne/,https://doi.org/10.31235/osf.io/67jne,NA
