id,type,attributes.date_created,attributes.date_modified,attributes.date_published,attributes.original_publication_date,attributes.doi,attributes.title,attributes.description,attributes.is_published,attributes.is_preprint_orphan,attributes.tags,attributes.preprint_doi_created,attributes.date_withdrawn,attributes.current_user_permissions,attributes.public,attributes.reviews_state,attributes.date_last_transitioned,attributes.has_coi,attributes.conflict_of_interest_statement,attributes.has_data_links,attributes.why_no_data,attributes.data_links,attributes.has_prereg_links,attributes.why_no_prereg,attributes.prereg_links,attributes.prereg_link_info,attributes.subjects,attributes.license_record.copyright_holders,attributes.license_record.year,relationships.contributors.links.related.href,relationships.bibliographic_contributors.links.related.href,relationships.citation.links.related.href,relationships.citation.data.id,relationships.citation.data.type,relationships.identifiers.links.related.href,relationships.node.links.self.href,relationships.node.links.related.href,relationships.node.data.id,relationships.node.data.type,relationships.license.links.related.href,relationships.license.data.id,relationships.license.data.type,relationships.provider.links.related.href,relationships.provider.data.id,relationships.provider.data.type,relationships.files.links.related.href,relationships.primary_file.links.related.href,relationships.primary_file.data.id,relationships.primary_file.data.type,relationships.review_actions.links.related.href,relationships.requests.links.related.href,links.self,links.html,links.doi,links.preprint_doi
ncb5p,preprints,2020-03-02T22:08:32.323101,2020-08-17T13:29:29.978795,2020-03-03T18:23:11.831886,2020-08-15T23:00:00,10.1111/ecot.12264,Gender Differences in Russia’s Job Mobility and Its Rewards,"This article considers age and gender differences in the probability and consequences of job mobility; specifically firm exits and promotions in Russia. Russia's labour market should have high rates of job mobility, but we will show using IMF figures that the  rate between 2011 and 2015 is on par with the 1980's. Beyond this, little is known about who is mobile and whether mobility has any impact on wages once the characteristics of movers are controlled for. In other words, we will ask whether job mobility is a sorting mechanism, or whether it has premiums in pay in and of itself. Results  show a gender difference in the likelihood of firm exit but not in the likelihood of promotion. When several personal and job characteristics are held constant, young men and women have similar odds of promotion. However, promotions have a positive effect only on the wages of young women; young men's wages are not affected. On the topic of firm exits, when several personal and job characteristics are held constant, exit is more common among young men when compared to young women;  this is also true of middle aged men and women. Further, young men see a significant  decrease in wages following an exit, while young women are not affected by exit. These results are flipped for middle aged workers; middle aged men see no change in wages following an exit, but middle aged women see significant declines in wages following an exit. Using these results, the article shows that the early stages of a respondent's career are marked by periods of high mobility, which is similar to the experience of young workers in other countries. After this period,  mobility becomes increasingly unlikely. Part of this result could stem from the premiums tied to promotion. Results help to understand processes of inequality in wages and conditions that occur due to sorting, and the importance of promotions  (internal job changes with the same employer) as 'life chances' which improve  earnings in the immediate sense. Gender differences in securing these life chances help to understand wider gender gaps in earnings, which emerge later.",TRUE,FALSE,Gender|Inequality|Job mobility|Panel analysis|Russia,2020-03-03T18:57:00.927244,NA,,TRUE,accepted,2020-03-03T18:23:11.831886,FALSE,NA,no,This dataset requires an application.,,NA,NA,,NA,"5a8c80f7c698300375c76d84|5a8c80fac698300375c76e20|5a8c80fac698300375c76e35|Social and Behavioral Sciences|Sociology|Inequality, Poverty, and Mobility",,2020,https://api.osf.io/v2/preprints/ncb5p/contributors/,https://api.osf.io/v2/preprints/ncb5p/bibliographic_contributors/,https://api.osf.io/v2/preprints/ncb5p/citation/,ncb5p,preprints,https://api.osf.io/v2/preprints/ncb5p/identifiers/,https://api.osf.io/v2/preprints/ncb5p/relationships/node/,NA,NA,NA,https://api.osf.io/v2/licenses/563c1cf88c5e4a3877f9e96a/,563c1cf88c5e4a3877f9e96a,licenses,https://api.osf.io/v2/providers/preprints/socarxiv/,socarxiv,preprint-providers,https://api.osf.io/v2/preprints/ncb5p/files/,https://api.osf.io/v2/files/5e5d83e186b40d0042d0536a/,5e5d83e186b40d0042d0536a,files,https://api.osf.io/v2/preprints/ncb5p/review_actions/,https://api.osf.io/v2/preprints/ncb5p/requests/,https://api.osf.io/v2/preprints/ncb5p/,https://osf.io/preprints/socarxiv/ncb5p/,https://doi.org/10.1111/ecot.12264,https://doi.org/10.31235/osf.io/ncb5p
s76mj,preprints,2020-03-02T03:19:27.869782,2020-07-12T22:17:55.968262,2020-03-02T05:44:05.394787,2020-03-01T14:00:00,10.1016/j.annals.2020.102933,Designing for more environmentally friendly tourism,"The environmental (un)sustainability of the tourism industry has been debated for many decades. This debate generated ample empirical evidence of the environmental damage caused by tourism-related human activity. It is underpinned, however, by a passive position: one of largely accepting the tourism industry as it is, and lamenting its negative consequences. An alternative, more active approach, is to deliberately design for environmental sustainability. This article provides examples of how the tourism industry can drive a reduction of environmental damage by actively designing brand-owned touchpoints in a way that entice tourists to behave more environmentally friendly. The article concludes with an overview of promising design approaches and a framework to guide the future design of more environmentally friendly tourism services.",TRUE,FALSE,choice architecture|deisgn|environmental sustainability|experiment|nudging|social norm,2020-03-02T05:44:34.239595,NA,,TRUE,accepted,2020-03-02T05:44:05.394787,FALSE,NA,not_applicable,NA,,NA,NA,,NA,5a8c80f7c698300375c76d84|5a8c80f7c698300375c76d96|Social and Behavioral Sciences|Other Social and Behavioral Sciences|5a8c80f7c698300375c76d84|5a8c80f7c698300375c76d98|Social and Behavioral Sciences|Psychology|5a8c80f7c698300375c76d84|5a8c80f8c698300375c76dbd|Social and Behavioral Sciences|Environmental Studies|5a8c80f7c698300375c76d84|5a8c80f8c698300375c76dd0|Social and Behavioral Sciences|Leisure Studies,,2020,https://api.osf.io/v2/preprints/s76mj/contributors/,https://api.osf.io/v2/preprints/s76mj/bibliographic_contributors/,https://api.osf.io/v2/preprints/s76mj/citation/,s76mj,preprints,https://api.osf.io/v2/preprints/s76mj/identifiers/,https://api.osf.io/v2/preprints/s76mj/relationships/node/,https://api.osf.io/v2/nodes/ahwcb/,ahwcb,nodes,https://api.osf.io/v2/licenses/563c1cf88c5e4a3877f9e96c/,563c1cf88c5e4a3877f9e96c,licenses,https://api.osf.io/v2/providers/preprints/socarxiv/,socarxiv,preprint-providers,https://api.osf.io/v2/preprints/s76mj/files/,https://api.osf.io/v2/files/5e5c7b46b070fc022ee58d8f/,5e5c7b46b070fc022ee58d8f,files,https://api.osf.io/v2/preprints/s76mj/review_actions/,https://api.osf.io/v2/preprints/s76mj/requests/,https://api.osf.io/v2/preprints/s76mj/,https://osf.io/preprints/socarxiv/s76mj/,https://doi.org/10.1016/j.annals.2020.102933,https://doi.org/10.31235/osf.io/s76mj
6cpmr,preprints,2020-03-01T11:56:56.615051,2020-09-16T17:27:27.807144,2020-03-02T02:57:30.847997,2020-09-03T16:00:00,10.3389/fsoc.2020.00055,Unequal occupational mobilities between rural migrant and urban resident workers in urban China,"The current scholarship on inequality of occupational attainment between rural migrant workers (RMW) and urban resident workers (URW) is largely dominated by evidence suggesting a landscape of occupational segregation, whilst there is a lack of studies researching the equality of occupational mobility. To fill this gap, this study compares the occupational mobilities between RMW and URW in China’s urban labor market. Three heatmaps are used to visualize the differences between these two groups in the outflow distributions of occupational mobility. The results show a marked disadvantage of RMW’s mobility into white-collar occupations and a relatively high tendency for them to move to or to stay in the manual and agricultural occupations.",TRUE,FALSE,China|hukou|inequality|occupational mobility|rural migrant|social mobility,2020-03-02T02:57:43.267546,NA,,TRUE,accepted,2020-03-02T02:57:30.847997,FALSE,NA,not_applicable,NA,,not_applicable,NA,,,"5a8c80f7c698300375c76d84|5a8c80fac698300375c76e20|5a8c80fac698300375c76e2d|Social and Behavioral Sciences|Sociology|Economic Sociology|5a8c80f7c698300375c76d84|5a8c80fac698300375c76e20|5a8c80fac698300375c76e35|Social and Behavioral Sciences|Sociology|Inequality, Poverty, and Mobility",,2020,https://api.osf.io/v2/preprints/6cpmr/contributors/,https://api.osf.io/v2/preprints/6cpmr/bibliographic_contributors/,https://api.osf.io/v2/preprints/6cpmr/citation/,6cpmr,preprints,https://api.osf.io/v2/preprints/6cpmr/identifiers/,https://api.osf.io/v2/preprints/6cpmr/relationships/node/,NA,NA,NA,https://api.osf.io/v2/licenses/563c1cf88c5e4a3877f9e96a/,563c1cf88c5e4a3877f9e96a,licenses,https://api.osf.io/v2/providers/preprints/socarxiv/,socarxiv,preprint-providers,https://api.osf.io/v2/preprints/6cpmr/files/,https://api.osf.io/v2/files/5e5ba30bef5d8901d107526e/,5e5ba30bef5d8901d107526e,files,https://api.osf.io/v2/preprints/6cpmr/review_actions/,https://api.osf.io/v2/preprints/6cpmr/requests/,https://api.osf.io/v2/preprints/6cpmr/,https://osf.io/preprints/socarxiv/6cpmr/,https://doi.org/10.3389/fsoc.2020.00055,https://doi.org/10.31235/osf.io/6cpmr
2sx6y,preprints,2020-03-01T11:23:11.377802,2020-03-02T02:56:00.635641,2020-03-02T02:55:52.103067,NA,NA,"Ordered Beta Regression: A Parsimonious, Well-Fitting Model for Survey Sliders and Visual Analog Scales","I propose a new model, ordered beta regression, for data collected from human subjects using slider scales/visual analog scales with lower and upper bounds. This model employs the cutpoint technique popularized by ordered logit to simultaneously estimate the probability that the outcome is at the upper bound, lower bound, or any continuous number in between. This model is contrasted with existing approaches, including ordinary least squares (OLS) regression and the zero-one-inflated beta regression (ZOIB) model. Simulation evidence shows that the proposed model, relative to existing approaches, estimates effects with more accuracy while capturing the full uncertainty in the distribution. Furthermore, an analysis of data on U.S. public opinion towards college professors reveals that the proposed model is better able to combine variation across continuous and degenerate responses. The model can be fit with the R package brms.",TRUE,FALSE,Beta Regression|brms|Feeling Thermometer|Slider Scale|Visual Analog Scale,2020-03-02T02:56:00.614379,NA,,TRUE,accepted,2020-03-02T02:55:52.103067,NA,NA,NA,NA,,NA,NA,,NA,5a8c80f7c698300375c76d84|5a8c80f7c698300375c76d98|Social and Behavioral Sciences|Psychology|5a8c80f7c698300375c76d84|5a8c80f8c698300375c76daf|Social and Behavioral Sciences|Political Science|5a8c80f7c698300375c76d84|5a8c80f8c698300375c76dbe|Social and Behavioral Sciences|Economics|5a8c80f7c698300375c76d84|5a8c80f9c698300375c76e0c|Social and Behavioral Sciences|Social Statistics,,2020,https://api.osf.io/v2/preprints/2sx6y/contributors/,https://api.osf.io/v2/preprints/2sx6y/bibliographic_contributors/,https://api.osf.io/v2/preprints/2sx6y/citation/,2sx6y,preprints,https://api.osf.io/v2/preprints/2sx6y/identifiers/,https://api.osf.io/v2/preprints/2sx6y/relationships/node/,https://api.osf.io/v2/nodes/3r8a6/,3r8a6,nodes,https://api.osf.io/v2/licenses/563c1cf88c5e4a3877f9e96a/,563c1cf88c5e4a3877f9e96a,licenses,https://api.osf.io/v2/providers/preprints/socarxiv/,socarxiv,preprint-providers,https://api.osf.io/v2/preprints/2sx6y/files/,https://api.osf.io/v2/files/5e5b9b23ef5d8901cc0749d2/,5e5b9b23ef5d8901cc0749d2,files,https://api.osf.io/v2/preprints/2sx6y/review_actions/,https://api.osf.io/v2/preprints/2sx6y/requests/,https://api.osf.io/v2/preprints/2sx6y/,https://osf.io/preprints/socarxiv/2sx6y/,NA,https://doi.org/10.31235/osf.io/2sx6y
s6cta,preprints,2020-03-01T10:52:54.271468,2020-03-02T02:55:29.095478,2020-03-02T02:55:06.812144,2020-02-29T17:00:00,NA,"Unsur 9M dalam Kepemimpinan, Keorganisasian dan Kemasyarakatan sebagai Pengembangan dari Unsur 5M Manajemen","The 9M element which consists of Man, Material, Money, Media, Methode, Mission, Mapping, Moral and Movement as one of the elements used in the leadership, organizational and social processes is the development of the 5M Management Element (Man, Method, Material, Money and Machine). This 9M element is related to the sustainability process of leadership, organization and society which must know 9 main elements in mobilizing the organization and the community so that it can be practical and systematic. This development is based on literature study research, through taking data from several reliable sources or references and across literacy. This research aims to: 1) develop the 9M Element in leadership, organization and society as the development of the 5M Element of Management, and 2) as the 9 elements used as principles in leadership, organization and society. Whereas, for the object of this research is the development of the 5M Management Element which was developed into the 9M Element in leadership, organization and society. So, this 9M element is able to: 1) This 9M element can develop and adapt to leadership, organization and society, and 2) This 9M element can be used as one of the principles in leadership, organization and society. Thus, this 9M Element can be a basic element that should be learned in the planning and implementation of leadership, organization and society.",TRUE,FALSE,Element 5M Management|Element 9M|Kemasyarakatan|Keorganisasian|Kepemimpinan|Leadership|Organization|Society|Unsur 5M Manajemen|Unsur 9M,2020-03-02T02:55:29.076326,NA,,TRUE,accepted,2020-03-02T02:55:06.812144,NA,NA,NA,NA,,NA,NA,,NA,5a8c80f0c698300375c76c07|5a8c80f2c698300375c76c59|Law|Organizations Law|5a8c80f6c698300375c76d4e|5a8c80f7c698300375c76d68|Education|Educational Leadership|5a8c80f7c698300375c76d84|5a8c80f7c698300375c76d96|Social and Behavioral Sciences|Other Social and Behavioral Sciences|5a8c80f7c698300375c76d84|5a8c80f8c698300375c76dd1|Social and Behavioral Sciences|Leadership Studies|5a8c80f7c698300375c76d84|5a8c80f9c698300375c76e1f|Social and Behavioral Sciences|Organization Development,,2020,https://api.osf.io/v2/preprints/s6cta/contributors/,https://api.osf.io/v2/preprints/s6cta/bibliographic_contributors/,https://api.osf.io/v2/preprints/s6cta/citation/,s6cta,preprints,https://api.osf.io/v2/preprints/s6cta/identifiers/,https://api.osf.io/v2/preprints/s6cta/relationships/node/,https://api.osf.io/v2/nodes/72dyn/,72dyn,nodes,https://api.osf.io/v2/licenses/563c1cf88c5e4a3877f9e96a/,563c1cf88c5e4a3877f9e96a,licenses,https://api.osf.io/v2/providers/preprints/socarxiv/,socarxiv,preprint-providers,https://api.osf.io/v2/preprints/s6cta/files/,https://api.osf.io/v2/files/5e5b9409ef5d8901cf071270/,5e5b9409ef5d8901cf071270,files,https://api.osf.io/v2/preprints/s6cta/review_actions/,https://api.osf.io/v2/preprints/s6cta/requests/,https://api.osf.io/v2/preprints/s6cta/,https://osf.io/preprints/socarxiv/s6cta/,NA,https://doi.org/10.31235/osf.io/s6cta
zmx5p,preprints,2020-03-01T03:48:24.233345,2021-05-07T11:16:52.048989,2020-03-02T02:50:27.541845,NA,NA,Identifying and debunking environmentally-related false news stories—An experimental study,"Informed decisions are the cornerstone of a functioning democracy. The goal of this paper is to experimentally explore who is good at distinguishing between true and false, and, second, to learn something about the mechanisms to debunk false news stories. While the vast majority of earlier studies tackles political topics, the subjects had to rate environmental-related as correct or false. After this exercise, subjects received systematically varied information about the correctness of the news stories depending on the experimental condition they had been assigned to. After a delay of three weeks, the subjects were asked to evaluate the news stories again. Our main findings are (i) The perceived familiarity with news stories increases the propensity to accept them as true. Actively open-minded thinking helps to distinguish between true and false. But the willingness to think deliberately does not seem to be important. (ii) By repeating false news stories, subjects are more likely to adequately identify them later (i.e., no evidence for a familiarity backfire effect). However, it decreased the ability to adequately identify correct news stories. A somewhat reverse, but weaker effect occurs when true stories are repeated: the correct identification of correct news stories is more successful, but the opposite holds for the identification of false news stories. Detailed explanations of why the false news stories contain false content increases the correct identification of false news stories, but the ability to correctly identify correct news stories is detrimental.",TRUE,FALSE,actively open-minded thinking|cognitive reflection test|environmental economics|experimental economics|False news stories|narratives,2020-03-02T02:50:52.978501,NA,,TRUE,accepted,2020-03-02T02:50:27.541845,FALSE,NA,not_applicable,NA,,not_applicable,NA,,,5a8c80f7c698300375c76d84|5a8c80f8c698300375c76dbe|5a8c80f8c698300375c76dc5|Social and Behavioral Sciences|Economics|Behavioral Economics,,2020,https://api.osf.io/v2/preprints/zmx5p/contributors/,https://api.osf.io/v2/preprints/zmx5p/bibliographic_contributors/,https://api.osf.io/v2/preprints/zmx5p/citation/,zmx5p,preprints,https://api.osf.io/v2/preprints/zmx5p/identifiers/,https://api.osf.io/v2/preprints/zmx5p/relationships/node/,NA,NA,NA,https://api.osf.io/v2/licenses/563c1cf88c5e4a3877f9e96a/,563c1cf88c5e4a3877f9e96a,licenses,https://api.osf.io/v2/providers/preprints/socarxiv/,socarxiv,preprint-providers,https://api.osf.io/v2/preprints/zmx5p/files/,https://api.osf.io/v2/files/5e5b308bef5d8901ca06cc9d/,5e5b308bef5d8901ca06cc9d,files,https://api.osf.io/v2/preprints/zmx5p/review_actions/,https://api.osf.io/v2/preprints/zmx5p/requests/,https://api.osf.io/v2/preprints/zmx5p/,https://osf.io/preprints/socarxiv/zmx5p/,NA,https://doi.org/10.31235/osf.io/zmx5p
kvjaz,preprints,2020-03-01T01:10:49.915530,2020-03-02T02:49:41.989395,2020-03-02T02:49:31.580693,2020-02-29T08:00:00,NA,Broad-spectrum antiviral drugs: a survey of neglect,"Events that could cause human extinction or permanently alter the trajectory of humanity are known as ​existential risks. G​lobal catastrophic biological risks​ (GCBRs) are a recognized subset of these risks, and include both natural and engineered pathogens. Viral pathogens are of particular concern due to their high virulence and transmissibility. Various actors including national governments, scientific agencies and philanthropic institutes have attempted to address the risk posed by viral pathogens by supporting ​broad-spectrum antiviral (BSAV) development. This report aims to describe the global landscape of this effort to date, including: 1: The ​policy and practice​ landscape for BSAV funding and research, internationally; 2: The United States ​policy and practice​ landscape; 3: Past and present United States R​ &amp;D efforts​ towards BSAVs. 
This report will be most useful for those who are interested in biorisk/biosecurity, are somewhat aware of why antivirals are important, and would like to read in-depth regarding the current state of BSAV development.",TRUE,FALSE,antivirals|Broad|disease|emerging|infectious|pandemic|pandemics|policy|preparedness|spectrum,2020-03-02T02:49:41.973369,NA,,TRUE,accepted,2020-03-02T02:49:31.580693,NA,NA,NA,NA,,NA,NA,,NA,5a8c80f0c698300375c76c07|5a8c80f2c698300375c76c71|Law|Health Law and Policy,,2020,https://api.osf.io/v2/preprints/kvjaz/contributors/,https://api.osf.io/v2/preprints/kvjaz/bibliographic_contributors/,https://api.osf.io/v2/preprints/kvjaz/citation/,kvjaz,preprints,https://api.osf.io/v2/preprints/kvjaz/identifiers/,https://api.osf.io/v2/preprints/kvjaz/relationships/node/,NA,NA,NA,https://api.osf.io/v2/licenses/563c1cf88c5e4a3877f9e96a/,563c1cf88c5e4a3877f9e96a,licenses,https://api.osf.io/v2/providers/preprints/socarxiv/,socarxiv,preprint-providers,https://api.osf.io/v2/preprints/kvjaz/files/,https://api.osf.io/v2/files/5e5b0b9eb070fc01d7e5baed/,5e5b0b9eb070fc01d7e5baed,files,https://api.osf.io/v2/preprints/kvjaz/review_actions/,https://api.osf.io/v2/preprints/kvjaz/requests/,https://api.osf.io/v2/preprints/kvjaz/,https://osf.io/preprints/socarxiv/kvjaz/,NA,https://doi.org/10.31235/osf.io/kvjaz
4bf23,preprints,2020-02-29T22:46:02.389623,2020-03-02T02:48:54.005306,2020-03-02T02:48:09.149594,NA,NA,Sustaining citizen science beyond an emergency,"Digital volunteers can act as emergency responders through participating in citizen science. In these contexts, what happens when a project or emergency ends? This article explores aspects of citizen science sustainability, such as what happens when a platform is retired and after the urgency of an emergency. It argues for the importance of open data in citizen science, both in platform design and in citizen science outputs, to support active citizenship and sustainability beyond a funding cycle. 
This article discusses open datasets developed during the Ebola outbreak response in 2014 and the role of collaborative repositories such as GitHub in enabling uses beyond any particular citizen science project. How citizen scientists can creatively contribute in ways aligned with humanitarian aims is explored, emphasising benefits of open licensing for promoting active citizenship and humanitarian disaster responses.",TRUE,FALSE,citizen science|Ebola|emergency|GitHub|open data|open source|pandemic|public health|Pybossa,2020-03-02T02:48:53.989474,NA,,TRUE,accepted,2020-03-02T02:48:09.149594,NA,NA,NA,NA,,NA,NA,,NA,5a8c80f7c698300375c76d84|5a8c80f9c698300375c76df4|Social and Behavioral Sciences|Science and Technology Studies,,2020,https://api.osf.io/v2/preprints/4bf23/contributors/,https://api.osf.io/v2/preprints/4bf23/bibliographic_contributors/,https://api.osf.io/v2/preprints/4bf23/citation/,4bf23,preprints,https://api.osf.io/v2/preprints/4bf23/identifiers/,https://api.osf.io/v2/preprints/4bf23/relationships/node/,https://api.osf.io/v2/nodes/tpka4/,tpka4,nodes,https://api.osf.io/v2/licenses/5ad7979bc69830002d8190e3/,5ad7979bc69830002d8190e3,licenses,https://api.osf.io/v2/providers/preprints/socarxiv/,socarxiv,preprint-providers,https://api.osf.io/v2/preprints/4bf23/files/,https://api.osf.io/v2/files/5e5ae9b3ef5d8901c106bf06/,5e5ae9b3ef5d8901c106bf06,files,https://api.osf.io/v2/preprints/4bf23/review_actions/,https://api.osf.io/v2/preprints/4bf23/requests/,https://api.osf.io/v2/preprints/4bf23/,https://osf.io/preprints/socarxiv/4bf23/,NA,https://doi.org/10.31235/osf.io/4bf23
