id,type,attributes.date_created,attributes.date_modified,attributes.date_published,attributes.original_publication_date,attributes.doi,attributes.title,attributes.description,attributes.is_published,attributes.is_preprint_orphan,attributes.tags,attributes.preprint_doi_created,attributes.date_withdrawn,attributes.current_user_permissions,attributes.public,attributes.reviews_state,attributes.date_last_transitioned,attributes.has_coi,attributes.conflict_of_interest_statement,attributes.has_data_links,attributes.why_no_data,attributes.data_links,attributes.has_prereg_links,attributes.why_no_prereg,attributes.prereg_links,attributes.prereg_link_info,attributes.subjects,attributes.license_record.copyright_holders,attributes.license_record.year,relationships.contributors.links.related.href,relationships.bibliographic_contributors.links.related.href,relationships.citation.links.related.href,relationships.citation.data.id,relationships.citation.data.type,relationships.identifiers.links.related.href,relationships.node.links.self.href,relationships.license.links.related.href,relationships.license.data.id,relationships.license.data.type,relationships.provider.links.related.href,relationships.provider.data.id,relationships.provider.data.type,relationships.files.links.related.href,relationships.primary_file.links.related.href,relationships.primary_file.data.id,relationships.primary_file.data.type,relationships.review_actions.links.related.href,relationships.requests.links.related.href,links.self,links.html,links.doi,links.preprint_doi
8zwah,preprints,2019-07-15T03:21:42.334448,2019-07-17T12:20:42.397302,2019-07-17T12:20:18.441806,NA,10.24093/awej/vol10no2.28,Narrowing the Achievement Gap between EFL Students in Oral Expression through Cooperative Learning,"Any learning is stimulated by the teaching method or technique adopted. When put in traditional competitive settings, students worry more about their self-esteem and tend to shy away from participating in the activities, while, only those with higher level of oral skills volunteer in answering the questions. This inequity in practice causes a discrepancy in students’ performance in the oral expression exams and thus, results in a gap in the achievement. This paper suggests cooperative learning as a means to reduce the achievement gap between high and low achievers in the oral expression classes. This study is an endeavor to highlight the effectiveness of cooperative learning in reducing the disparity between high and low achievers and also to accentuate the benefits of this method in the English as a foreign language (EFL) classroom. The study followed an experimental pretest-posttest non-equivalent groups design with a sample of 44 second year EFL students from the University of Khenchela, Algeria. The intervention lasted for a semester. The results showed that the achievement gap was reduced in the experimental group after using cooperative learning instructions, while the traditional method, in the control group, failed in closing the achievement gap between high and low-achievers. As a conclusion, some recommendations will be given with the aim of promoting the use of cooperative learning in the EFL classrooms as well as fostering teachers’ awareness of the effectiveness of such teaching method in improving students’ performance in oral expression.",TRUE,FALSE,Achievement gap|cooperative learning|effect size|oral skills,2019-07-17T12:20:42.349762,NA,,TRUE,accepted,2019-07-17T12:20:18.441806,NA,NA,NA,NA,NA,NA,NA,NA,NA,5a8c80f2c698300375c76c7d|5a8c80f5c698300375c76d10|Arts and Humanities|English Language and Literature,,2019,https://api.osf.io/v2/preprints/8zwah/contributors/,https://api.osf.io/v2/preprints/8zwah/bibliographic_contributors/,https://api.osf.io/v2/preprints/8zwah/citation/,8zwah,preprints,https://api.osf.io/v2/preprints/8zwah/identifiers/,https://api.osf.io/v2/preprints/8zwah/relationships/node/,https://api.osf.io/v2/licenses/563c1cf88c5e4a3877f9e96a/,563c1cf88c5e4a3877f9e96a,licenses,https://api.osf.io/v2/providers/preprints/socarxiv/,socarxiv,preprint-providers,https://api.osf.io/v2/preprints/8zwah/files/,https://api.osf.io/v2/files/5d2bf14c1c5b4a001aa47c7a/,5d2bf14c1c5b4a001aa47c7a,files,https://api.osf.io/v2/preprints/8zwah/review_actions/,https://api.osf.io/v2/preprints/8zwah/requests/,https://api.osf.io/v2/preprints/8zwah/,https://osf.io/preprints/socarxiv/8zwah/,https://doi.org/10.24093/awej/vol10no2.28,https://doi.org/10.31235/osf.io/8zwah
vyfj3,preprints,2019-07-15T03:17:19.666621,2019-07-21T21:30:01.473589,2019-07-21T21:29:53.207719,NA,10.24093/awej/vol10no2.27,Attitudes of Saudi EFL Learners towards Speaking Skills,"This paper looks at intensive program students’ perceptions of English-speaking skills and emphasizes the immediate need for improving them at all levels of higher education. For this purpose, 100 students (50 males and 50 females) of the intensive program from colleges of Arts, Business and Community, Saudi Arabia were administered a questionnaire. The data were analyzed quantitatively with SPSS. The findings of the study show that male and female students do not differ in their perceptions about learning to speak English and they are now becoming more aware of the growing importance of learning English. It is also found that lack of environment, interest and motivation are the most important factors that affect students’ speaking skills. In addition, female students’ perception towards English learning is more positive. The analysis also indicates that there is an undisputed agreement among the learners that English language will play an important role in Saudi Arabia. Finally, some implications for teachers to develop students' speaking skills are presented.",TRUE,FALSE,attitudes|grammar for speaking|Saudi EFL learners|speaking skills|vocabulary for speaking,2019-07-21T21:30:01.362881,NA,,TRUE,accepted,2019-07-21T21:29:53.207719,NA,NA,NA,NA,NA,NA,NA,NA,NA,5a8c80f2c698300375c76c7d|5a8c80f5c698300375c76d10|Arts and Humanities|English Language and Literature,,2019,https://api.osf.io/v2/preprints/vyfj3/contributors/,https://api.osf.io/v2/preprints/vyfj3/bibliographic_contributors/,https://api.osf.io/v2/preprints/vyfj3/citation/,vyfj3,preprints,https://api.osf.io/v2/preprints/vyfj3/identifiers/,https://api.osf.io/v2/preprints/vyfj3/relationships/node/,https://api.osf.io/v2/licenses/563c1cf88c5e4a3877f9e96a/,563c1cf88c5e4a3877f9e96a,licenses,https://api.osf.io/v2/providers/preprints/socarxiv/,socarxiv,preprint-providers,https://api.osf.io/v2/preprints/vyfj3/files/,https://api.osf.io/v2/files/5d2bf044a26b3400160cfb18/,5d2bf044a26b3400160cfb18,files,https://api.osf.io/v2/preprints/vyfj3/review_actions/,https://api.osf.io/v2/preprints/vyfj3/requests/,https://api.osf.io/v2/preprints/vyfj3/,https://osf.io/preprints/socarxiv/vyfj3/,https://doi.org/10.24093/awej/vol10no2.27,https://doi.org/10.31235/osf.io/vyfj3
83bgn,preprints,2019-07-15T03:14:08.575434,2019-07-21T21:29:45.602737,2019-07-21T21:29:27.020396,NA,10.24093/awej/vol10no2.26,Bloom’s Taxonomy and Moroccan Children’s Vocabulary and Critical Thinking Skills Development,"Children normally feel unable or less confident to express their ideas clearly, freely, and critically both orally and in writing when learning a language. Research has demonstrated that children’s early exposure to Bloom’s Taxonomy levels in stories has a “remarkable power” on them (Dickinson, et al. 2012) and helps develop their language and critical-thinking skills (Egan, 1997; Curtain &amp; Dahlberg 2004). The aim of this research project is to investigate the role of Bloom’s Taxonomy in the development of the vocabulary and critical-thinking skills of young Moroccan English learners. The study adopts a qualitative approach and addresses two research questions, namely, (i) To what extent does Bloom’s Taxonomy contribute to the development of the children’s vocabulary and critical thinking skills? (ii) How can the children’s vocabulary and critical-thinking skills development be justified? The comparison and analysis of the children’s story reviews at the start and end of a term reveals significant improvement, among the Moroccan young learners, especially the average ones. They are able to use a wider range of more appropriate and accurate vocabulary and to make use of a more extended, analytical and relevant discourse. Hence, children’s early exposure to Bloom’s Taxonomy is highly recommended as it contributes to the development of their vocabulary and critical-thinking skills.",TRUE,FALSE,Accurate vocabulary|Bloom’s taxonomy|critical-thinking skills|English learning|language development|Moroccan children,2019-07-21T21:29:45.480879,NA,,TRUE,accepted,2019-07-21T21:29:27.020396,NA,NA,NA,NA,NA,NA,NA,NA,NA,5a8c80f2c698300375c76c7d|5a8c80f5c698300375c76d10|Arts and Humanities|English Language and Literature,,2019,https://api.osf.io/v2/preprints/83bgn/contributors/,https://api.osf.io/v2/preprints/83bgn/bibliographic_contributors/,https://api.osf.io/v2/preprints/83bgn/citation/,83bgn,preprints,https://api.osf.io/v2/preprints/83bgn/identifiers/,https://api.osf.io/v2/preprints/83bgn/relationships/node/,https://api.osf.io/v2/licenses/563c1cf88c5e4a3877f9e96a/,563c1cf88c5e4a3877f9e96a,licenses,https://api.osf.io/v2/providers/preprints/socarxiv/,socarxiv,preprint-providers,https://api.osf.io/v2/preprints/83bgn/files/,https://api.osf.io/v2/files/5d2bef851c5b4a001ba17258/,5d2bef851c5b4a001ba17258,files,https://api.osf.io/v2/preprints/83bgn/review_actions/,https://api.osf.io/v2/preprints/83bgn/requests/,https://api.osf.io/v2/preprints/83bgn/,https://osf.io/preprints/socarxiv/83bgn/,https://doi.org/10.24093/awej/vol10no2.26,https://doi.org/10.31235/osf.io/83bgn
s93q4,preprints,2019-07-15T03:11:10.687485,2019-07-21T21:29:02.013830,2019-07-21T21:28:53.007186,NA,10.24093/awej/vol10no2.25,Linguistic Hegemony of English Language in the Medical Context of King Abdullah Hospital,"This study aims to investigate how the dominance of the English language at Bisha King Abdullah Hospital in Saudi Arabia affects service delivery. Specifically, the research focuses on the attitudes of patients and staff towards communicating in English instead of Arabic, which is the primary official language in Saudi Arabia. First, the study addresses the question of how the dominance of English language in the selected medical context affects service delivery. Second, the study explores the attitude of patients and medical staff towards the dominance of the English language. Third, the study presents a comparison of the attitude of patients and medical staff towards the use of English language. Finally, the study responds to the question of how patients' level of education influences their attitude towards the use of English at the hospital. The study is based on quantitative research, involving 60 participants, where 30 patients and 30 medical staff. The findings reveal that 86.7% of medical staff members find it challenging to communicate with their patients in English. On the same note, 60% of patients interviewed admitted that they find it difficult understanding medical practitioners when they communicate in English. The findings can have significant practical implications since they show a possible communication barrier that can be addressed to improve patient experience at Bisha King Abdullah Hospital. The findings provide statistical evidence to inform evidence-based strategies to improve communication between patients and medical practitioners at the hospital. 
Abbreviations and Acronyms Definition",TRUE,FALSE,Communication barrier|language discordance|linguistic hegemony|medical context|patient’s satisfaction,2019-07-21T21:29:02.000526,NA,,TRUE,accepted,2019-07-21T21:28:53.007186,NA,NA,NA,NA,NA,NA,NA,NA,NA,5a8c80f2c698300375c76c7d|5a8c80f5c698300375c76d10|Arts and Humanities|English Language and Literature,,2019,https://api.osf.io/v2/preprints/s93q4/contributors/,https://api.osf.io/v2/preprints/s93q4/bibliographic_contributors/,https://api.osf.io/v2/preprints/s93q4/citation/,s93q4,preprints,https://api.osf.io/v2/preprints/s93q4/identifiers/,https://api.osf.io/v2/preprints/s93q4/relationships/node/,https://api.osf.io/v2/licenses/563c1cf88c5e4a3877f9e96a/,563c1cf88c5e4a3877f9e96a,licenses,https://api.osf.io/v2/providers/preprints/socarxiv/,socarxiv,preprint-providers,https://api.osf.io/v2/preprints/s93q4/files/,https://api.osf.io/v2/files/5d2beed4a26b3400160cfa0e/,5d2beed4a26b3400160cfa0e,files,https://api.osf.io/v2/preprints/s93q4/review_actions/,https://api.osf.io/v2/preprints/s93q4/requests/,https://api.osf.io/v2/preprints/s93q4/,https://osf.io/preprints/socarxiv/s93q4/,https://doi.org/10.24093/awej/vol10no2.25,https://doi.org/10.31235/osf.io/s93q4
6q7p3,preprints,2019-07-15T03:07:26.476211,2019-07-20T21:37:42.063873,2019-07-20T21:37:24.331160,NA,10.24093/awej/vol10no2.24,Student-Teacher Responsibilities in English Studies: An Empirical Analysis of Arab Student and English Faculty Perceptions,"Given the vast research on the existence of distinctive student-teacher expectations about their roles in the classroom and their significance in shaping prospective actions, there is a scarcity of studies that examine Arab student expectations and contrast them with their teachers’ expectancies. Realizing this research gap, this study aims to analyze Gulf Arab, Non-Gulf Arab and English Faculty expectations about their roles in English studies. The objectives of the study were to answer four research questions: Do student-faculty expectations about their classroom roles correspond on nine given items; where do the differentiations lie; what are the classroom implications of these dissimilarities; and how teachers and students can share and meet each other’s expectations. Using a mixed methods research design, quantitative data were collected from students and faculty through an online bilingual survey followed by individual interviews for further exploration. The data analysis revealed that mismatches exist in teacher-student expectations and these dissimilar beliefs can influence student-teacher relationship. Five out of nine given items were found statistically significant between English faculty and Gulf and Non-Gulf Arab students where students had higher expectations about their responsibilities; however, Gulf Arab and Non-Gulf Arab student expectations differed only on three items. In addition to other practical suggestions for sharing and aligning divergent expectations, the study proposes employing a teacher-student learning contract to augment student and faculty cognizance of their academic and social obligations as well as assist the school administration in catering for their perspectives.",TRUE,FALSE,Arab student expectations|culture and expectations|faculty-student responsibility,2019-07-20T21:37:42.049224,NA,,TRUE,accepted,2019-07-20T21:37:24.331160,NA,NA,NA,NA,NA,NA,NA,NA,NA,5a8c80f2c698300375c76c7d|5a8c80f5c698300375c76d10|Arts and Humanities|English Language and Literature,,2019,https://api.osf.io/v2/preprints/6q7p3/contributors/,https://api.osf.io/v2/preprints/6q7p3/bibliographic_contributors/,https://api.osf.io/v2/preprints/6q7p3/citation/,6q7p3,preprints,https://api.osf.io/v2/preprints/6q7p3/identifiers/,https://api.osf.io/v2/preprints/6q7p3/relationships/node/,https://api.osf.io/v2/licenses/563c1cf88c5e4a3877f9e96a/,563c1cf88c5e4a3877f9e96a,licenses,https://api.osf.io/v2/providers/preprints/socarxiv/,socarxiv,preprint-providers,https://api.osf.io/v2/preprints/6q7p3/files/,https://api.osf.io/v2/files/5d2bee1d45253a001c41c6dc/,5d2bee1d45253a001c41c6dc,files,https://api.osf.io/v2/preprints/6q7p3/review_actions/,https://api.osf.io/v2/preprints/6q7p3/requests/,https://api.osf.io/v2/preprints/6q7p3/,https://osf.io/preprints/socarxiv/6q7p3/,https://doi.org/10.24093/awej/vol10no2.24,https://doi.org/10.31235/osf.io/6q7p3
624nr,preprints,2019-07-15T03:02:55.292199,2019-07-21T21:28:48.752028,2019-07-21T21:28:27.712648,NA,10.24093/awej/vol10no2.23,Understanding of Reading among Teachers and Learners: A Descriptive Study of Pre-university English Language Teaching /Learning in Saudi Arabia,"This study assesses pre-university teachers’ perception about reading comprehension in English as a foreign language (EFL) in Saudi context. It also identifies the difficulties faced by the students in their reading comprehension classes to have a holistic view of learning process. The main aim of the study is to explore the issues related to teaching reading, both from teachers as well as learners’ perspectives, so that the best teaching strategies can be adopted to achieve the desired outcomes. It assesses the ongoing prevalent scenario of learning to read in English as foreign language and observes that the learners’ difficulties are not addressed properly because the teachers/instructors are not trained well or pay less attention to reading skill. A descriptive approach has been used on a sample of instructors from various non-native English-speaking nationalities (n=60) and Saudi learners (n=146). Responses revealed that teachers’ poor awareness of teaching strategies cause poor learning outcomes. Their responses also reveals that their strategies do not take into account learners’ difficulties which somewhere cause learners’ helplessness in getting desired outcome. The results of the study elaborate how the culture and contextual knowledge play significant roles. These are the bases of teaching reading skills along with learners’ needs so that more robust teaching strategies can be followed to truly meet the desired learning outcomes. This will definitely help the teacher-educators as well as the instructors in improvising their teaching practices that suit their classrooms well.",TRUE,FALSE,comprehension|EFL instructors|EFL reading|reading strategies|Saudi learners,2019-07-21T21:28:48.734193,NA,,TRUE,accepted,2019-07-21T21:28:27.712648,NA,NA,NA,NA,NA,NA,NA,NA,NA,5a8c80f2c698300375c76c7d|5a8c80f5c698300375c76d10|Arts and Humanities|English Language and Literature,,2019,https://api.osf.io/v2/preprints/624nr/contributors/,https://api.osf.io/v2/preprints/624nr/bibliographic_contributors/,https://api.osf.io/v2/preprints/624nr/citation/,624nr,preprints,https://api.osf.io/v2/preprints/624nr/identifiers/,https://api.osf.io/v2/preprints/624nr/relationships/node/,https://api.osf.io/v2/licenses/563c1cf88c5e4a3877f9e96a/,563c1cf88c5e4a3877f9e96a,licenses,https://api.osf.io/v2/providers/preprints/socarxiv/,socarxiv,preprint-providers,https://api.osf.io/v2/preprints/624nr/files/,https://api.osf.io/v2/files/5d2bece6a26b3400170a3a17/,5d2bece6a26b3400170a3a17,files,https://api.osf.io/v2/preprints/624nr/review_actions/,https://api.osf.io/v2/preprints/624nr/requests/,https://api.osf.io/v2/preprints/624nr/,https://osf.io/preprints/socarxiv/624nr/,https://doi.org/10.24093/awej/vol10no2.23,https://doi.org/10.31235/osf.io/624nr
aduz3,preprints,2019-07-15T02:58:22.933182,2019-07-21T21:28:22.684074,2019-07-21T21:27:54.037967,NA,10.24093/awej/vol10no2.22,Functioning of Emotive-Evaluative Vocabulary in a Political Text,"This paper is aimed at highlighting the problem of the use of emotive-evaluative vocabulary in the English-language mass media political discourse, which is a relevant topic since the scope of media texts in English is widespread in the information community and the media language is the basic means for communication, phrasing, conveying and storing information. 
Political discourse is a popular area of research of linguistics, as it covers all aspects of modern life and society. Being mainly broadcasted by the politicians, it is considered a complex linguistic phenomenon, whose objectives, direct or indirect, are aimed at disseminating, implementing political authorities and obtaining the majority of votes during the election campaigns. The article is devoted to the evaluation categories, which refer to the semantic and pragmatic categories and can be one of the strongest tools of influence on the public. Within the framework of our research 29 English articles, posted on the Internet, concerning the political leaders of the United States and Great Britain, attributing the personal characteristics to them, were analysed. Using the continuous sampling method there was found 214 examples of English emotive-evaluative vocabulary. During the study, the methods of compilation, interpretation, and descriptive methods were used.",TRUE,FALSE,discourse|emotive-evaluative vocabulary|linguistic manipulation.|linguistic means|media text|political discourse,2019-07-21T21:28:22.662220,NA,,TRUE,accepted,2019-07-21T21:27:54.037967,NA,NA,NA,NA,NA,NA,NA,NA,NA,5a8c80f2c698300375c76c7d|5a8c80f5c698300375c76d10|Arts and Humanities|English Language and Literature,,2019,https://api.osf.io/v2/preprints/aduz3/contributors/,https://api.osf.io/v2/preprints/aduz3/bibliographic_contributors/,https://api.osf.io/v2/preprints/aduz3/citation/,aduz3,preprints,https://api.osf.io/v2/preprints/aduz3/identifiers/,https://api.osf.io/v2/preprints/aduz3/relationships/node/,https://api.osf.io/v2/licenses/563c1cf88c5e4a3877f9e96a/,563c1cf88c5e4a3877f9e96a,licenses,https://api.osf.io/v2/providers/preprints/socarxiv/,socarxiv,preprint-providers,https://api.osf.io/v2/preprints/aduz3/files/,https://api.osf.io/v2/files/5d2bebd745253a001c41c521/,5d2bebd745253a001c41c521,files,https://api.osf.io/v2/preprints/aduz3/review_actions/,https://api.osf.io/v2/preprints/aduz3/requests/,https://api.osf.io/v2/preprints/aduz3/,https://osf.io/preprints/socarxiv/aduz3/,https://doi.org/10.24093/awej/vol10no2.22,https://doi.org/10.31235/osf.io/aduz3
ufm8g,preprints,2019-07-15T02:54:17.579177,2019-07-21T21:27:47.586192,2019-07-21T21:27:14.647628,NA,10.24093/awej/vol10no2.21,"English Language Teaching: Historical Overview, Current Issues and Suggestions for Enhancing Speaking Proficiency in EFL Contexts","The history of English Language Teaching (ELT) and learning in English as a Second and Foreign Language (ESL and EFL) contexts has gone through different practices. The role of memorization and repetition of English language structures has always been a dominant teaching attitude. This attitude has revealed unsuccessful results in promoting speaking proficiency among English language learners when communicating in real-world situations beyond the classroom context. Therefore, it is essential to address such practices and shed light on some of the issues that hinder English Language Learners (ELLs) from effectively using English in real-world communicative situations. This review paper focuses on ELT practices that have been unsuccessful in promoting English language learners’ speaking proficiency. Additionally, it provides implications for classroom teaching instructions that integrate authentic tasks and materials. Implementing meaningful tasks that represent real-world situations could be a promising solution for enhancing ELLs’ language competencies to enable them to transfer the language they learn to real-life situations beyond school settings. Some practical suggestions and recommendations are provided to enhance ELT in EFL contexts.",TRUE,FALSE,Authentic tasks and materials|communication skills|EFL|pronunciation|speaking proficiency,2019-07-21T21:27:47.569468,NA,,TRUE,accepted,2019-07-21T21:27:14.647628,NA,NA,NA,NA,NA,NA,NA,NA,NA,5a8c80f2c698300375c76c7d|5a8c80f5c698300375c76d10|Arts and Humanities|English Language and Literature,,2019,https://api.osf.io/v2/preprints/ufm8g/contributors/,https://api.osf.io/v2/preprints/ufm8g/bibliographic_contributors/,https://api.osf.io/v2/preprints/ufm8g/citation/,ufm8g,preprints,https://api.osf.io/v2/preprints/ufm8g/identifiers/,https://api.osf.io/v2/preprints/ufm8g/relationships/node/,https://api.osf.io/v2/licenses/563c1cf88c5e4a3877f9e96a/,563c1cf88c5e4a3877f9e96a,licenses,https://api.osf.io/v2/providers/preprints/socarxiv/,socarxiv,preprint-providers,https://api.osf.io/v2/preprints/ufm8g/files/,https://api.osf.io/v2/files/5d2beae01c5b4a001da205b6/,5d2beae01c5b4a001da205b6,files,https://api.osf.io/v2/preprints/ufm8g/review_actions/,https://api.osf.io/v2/preprints/ufm8g/requests/,https://api.osf.io/v2/preprints/ufm8g/,https://osf.io/preprints/socarxiv/ufm8g/,https://doi.org/10.24093/awej/vol10no2.21,https://doi.org/10.31235/osf.io/ufm8g
