id,type,attributes.date_created,attributes.date_modified,attributes.date_published,attributes.original_publication_date,attributes.doi,attributes.title,attributes.description,attributes.is_published,attributes.is_preprint_orphan,attributes.tags,attributes.preprint_doi_created,attributes.date_withdrawn,attributes.current_user_permissions,attributes.public,attributes.reviews_state,attributes.date_last_transitioned,attributes.has_coi,attributes.conflict_of_interest_statement,attributes.has_data_links,attributes.why_no_data,attributes.data_links,attributes.has_prereg_links,attributes.why_no_prereg,attributes.prereg_links,attributes.prereg_link_info,attributes.subjects,attributes.license_record.copyright_holders,attributes.license_record.year,relationships.contributors.links.related.href,relationships.bibliographic_contributors.links.related.href,relationships.citation.links.related.href,relationships.citation.data.id,relationships.citation.data.type,relationships.identifiers.links.related.href,relationships.node.links.related.href,relationships.node.links.self.href,relationships.node.data.id,relationships.node.data.type,relationships.license.links.related.href,relationships.license.data.id,relationships.license.data.type,relationships.provider.links.related.href,relationships.provider.data.id,relationships.provider.data.type,relationships.files.links.related.href,relationships.primary_file.links.related.href,relationships.primary_file.data.id,relationships.primary_file.data.type,relationships.review_actions.links.related.href,relationships.requests.links.related.href,links.self,links.html,links.preprint_doi
kfncr,preprints,2019-06-13T10:24:57.239889,2019-06-13T10:28:43.685790,2019-06-13T10:28:17.227989,NA,NA,Assessment of Management Commitment in Malaysian Public Sector,"At present, the public sector is a matter of global concern due to the constant cases of failures in governance, fraud, inefficacy, and corruption. Management commitment is a critical issue as lack of it could lead to failures in governance, fraud, inefficacy, corruption as well as weak financial management, particularly in the public sector. This study evaluated the state of present practices of management commitment among public sector employees from various Malaysian service schemes. Primary data were collected using a questionnaire survey approach with 194 heads of departments in the Malaysian federal ministries. The collection of data was in accordance with the perspective of 10 factors in management commitment practices, using a five-point Likert scale. Factor analysis and descriptive statistics were utilized for data analysis. In addition, data reliability was checked by Cronbach’s alpha test, data normality was examined by Skewness and Kurtosis tests, and data validity was tested by using Kaiser-Meyer Olkin test and Barlett’s test. The findings show that 97% of the participants reported that they practised management commitment within their departments. Nevertheless, the priority for these management commitment factors varied according to the service schemes. In general, management commitment practice was the highest within the groups that used the finance scheme and the lowest among the employees who were under the accounting and audit schemes. The result of the study will help policy makers to take necessary steps to improve the practices of management commitment in the public sector in order to create a more dependable and efficient public sector in Malaysia.",TRUE,FALSE,Factor Analysis|Malaysia|Management commitment|Public Sector,2019-06-13T10:28:43.649576,NA,,TRUE,accepted,2019-06-13T10:28:17.227989,NA,NA,NA,NA,,NA,NA,,NA,5a8c80f7c698300375c76d84|5a8c80f8c698300375c76dbe|5a8c80f8c698300375c76dbf|Social and Behavioral Sciences|Economics|Finance,,2019,https://api.osf.io/v2/preprints/kfncr/contributors/,https://api.osf.io/v2/preprints/kfncr/bibliographic_contributors/,https://api.osf.io/v2/preprints/kfncr/citation/,kfncr,preprints,https://api.osf.io/v2/preprints/kfncr/identifiers/,https://api.osf.io/v2/nodes/uv6b8/,https://api.osf.io/v2/preprints/kfncr/relationships/node/,uv6b8,nodes,https://api.osf.io/v2/licenses/563c1cf88c5e4a3877f9e96c/,563c1cf88c5e4a3877f9e96c,licenses,https://api.osf.io/v2/providers/preprints/socarxiv/,socarxiv,preprint-providers,https://api.osf.io/v2/preprints/kfncr/files/,https://api.osf.io/v2/files/5d02248135988f0019de5a58/,5d02248135988f0019de5a58,files,https://api.osf.io/v2/preprints/kfncr/review_actions/,https://api.osf.io/v2/preprints/kfncr/requests/,https://api.osf.io/v2/preprints/kfncr/,https://osf.io/preprints/socarxiv/kfncr/,https://doi.org/10.31235/osf.io/kfncr
ntz52,preprints,2019-06-13T10:21:22.511330,2019-06-13T10:29:01.609974,2019-06-13T10:28:42.891246,NA,NA,"The Impacts of Environmental, Social, and Governance Factors on Firm Performance: Panel Study of Malaysian Companies","Purpose - The ESG factor, which consists of environmental, social, and governance factors, represents the non-financial performance of a company. United Nations Principles for Responsible Investment (UN-PRI) invites investors to consider ESG issues when evaluating the performance of any company. Moreover, nowadays the contribution of corporations towards sustainable development is a major concern of investors, creditors, government, and other environmental agencies. Therefore, the purpose of this paper is to examine the impact of ESG factors on the performance of Malaysian public limited companies in terms of profitability, firm value, and cost of capital.
Design/methodology/approach – A total of 54 companies are selected from Bloomberg’s ESG database that has complete ESG and financial data from 2010 to 2013. This study conducted panel data regressions such as the pooled OLS, fixed effect, and random effect.
Findings - Based on the regression results, there is no significant relationship between individual and combined factors of ESG and firm profitability (i.e., ROE) as well as firm value (i.e., Tobin’s Q). Moreover, individually, none of the factors of ESG is significant with the cost of capital (WACC), but the combined score of ESG positively and significantly influences the cost of capital (WACC) of a company.
Practical implications - As this is a new study on Malaysia, the findings of this study will be useful to investors, SRI analysts, policy makers, and other related agencies.
Originality/value – To the best of the authors’ knowledge, this study is among the first empirical study to examine the impact of ESG factors on the performance of Malaysian public limited companies in terms of profitability, firm value, and cost of capital.",TRUE,FALSE,,2019-06-13T10:29:01.588481,NA,,TRUE,accepted,2019-06-13T10:28:42.891246,NA,NA,NA,NA,,NA,NA,,NA,5a8c80f7c698300375c76d84|5a8c80f8c698300375c76dbe|5a8c80f8c698300375c76dbf|Social and Behavioral Sciences|Economics|Finance,,2019,https://api.osf.io/v2/preprints/ntz52/contributors/,https://api.osf.io/v2/preprints/ntz52/bibliographic_contributors/,https://api.osf.io/v2/preprints/ntz52/citation/,ntz52,preprints,https://api.osf.io/v2/preprints/ntz52/identifiers/,https://api.osf.io/v2/nodes/p8usr/,https://api.osf.io/v2/preprints/ntz52/relationships/node/,p8usr,nodes,https://api.osf.io/v2/licenses/563c1cf88c5e4a3877f9e96c/,563c1cf88c5e4a3877f9e96c,licenses,https://api.osf.io/v2/providers/preprints/socarxiv/,socarxiv,preprint-providers,https://api.osf.io/v2/preprints/ntz52/files/,https://api.osf.io/v2/files/5d0223ac35988f0019de59ee/,5d0223ac35988f0019de59ee,files,https://api.osf.io/v2/preprints/ntz52/review_actions/,https://api.osf.io/v2/preprints/ntz52/requests/,https://api.osf.io/v2/preprints/ntz52/,https://osf.io/preprints/socarxiv/ntz52/,https://doi.org/10.31235/osf.io/ntz52
wcyg4,preprints,2019-06-13T10:13:42.985406,2020-09-22T15:24:28.405812,2019-06-13T10:31:33.346721,NA,NA,Integrating Religiosity into Fraud Triangle Theory: Empirical Findings from Enforcement Officers,"Recently, employee-fraud has drawn extensive attention due to huge amount of losses of various organizations. This study developed a new model of fraud risk by integrating new elements into a fraud triangle theory. This study simultaneously analyzed religiosity and the three elements of fraud risk factors of employee fraud committed by low and mid-level public officials. The data collected from 120 enforcement officers indicated that religiosity is negatively related to employee fraud. By contrast, all the three elements of fraud triangle theory, namely, pressure, opportunity, and rationalization, are positively related to employee fraud. These results imply that strong religiosity is crucial to mitigate employee fraud. To minimize employee fraud, the opportunity to commit such fraud should be reduced through strong internal control, reduction of negative rationalization, and employee financial pressure. This study contributes to the literature by introducing a new model on employee-fraud occurrence that is not extensively discussed, particularly in the context of local authority in developing countries.",TRUE,FALSE,Local authority; Religiosity; Fraud Triangle; Employees fraud,2019-06-13T10:31:44.869049,NA,,TRUE,accepted,2019-06-13T10:31:33.346721,FALSE,NA,no,NA,,no,NA,,,"5a8c80f7c698300375c76d84|5a8c80f8c698300375c76db8|Social and Behavioral Sciences|Legal Studies|5a8c80f7c698300375c76d84|5a8c80f8c698300375c76dbe|Social and Behavioral Sciences|Economics|5a8c80f7c698300375c76d84|5a8c80f8c698300375c76ddb|5a8c80f8c698300375c76ddd|Social and Behavioral Sciences|Public Affairs, Public Policy and Public Administration|Terrorism Studies",,2019,https://api.osf.io/v2/preprints/wcyg4/contributors/,https://api.osf.io/v2/preprints/wcyg4/bibliographic_contributors/,https://api.osf.io/v2/preprints/wcyg4/citation/,wcyg4,preprints,https://api.osf.io/v2/preprints/wcyg4/identifiers/,https://api.osf.io/v2/nodes/azk7x/,https://api.osf.io/v2/preprints/wcyg4/relationships/node/,azk7x,nodes,https://api.osf.io/v2/licenses/563c1cf88c5e4a3877f9e96c/,563c1cf88c5e4a3877f9e96c,licenses,https://api.osf.io/v2/providers/preprints/socarxiv/,socarxiv,preprint-providers,https://api.osf.io/v2/preprints/wcyg4/files/,https://api.osf.io/v2/files/5d0221e635988f001bde7a8e/,5d0221e635988f001bde7a8e,files,https://api.osf.io/v2/preprints/wcyg4/review_actions/,https://api.osf.io/v2/preprints/wcyg4/requests/,https://api.osf.io/v2/preprints/wcyg4/,https://osf.io/preprints/socarxiv/wcyg4/,https://doi.org/10.31235/osf.io/wcyg4
962yu,preprints,2019-06-13T10:09:00.308702,2019-06-13T10:33:29.622270,2019-06-13T10:33:09.831517,NA,NA,Human Capital Accountability and Construct: Evidence from Islamic Microfinance Institutions in Malaysia,"To identify the human capital construct that significantly relates to the performance of Islamic organizations, this study obtained data from Islamic microfinance organizations in Malaysia using the survey questionnaire method. In addition, we interviewed renowned scholars in the fields of Islamic accounting and Shariah law. Consequently, this study proposes an extended model of human capital that is applicable to Islamic organizations. Apart from knowledge and competency, this study includes spiritual value as another construct of human capital in Islamic organizations. Knowledge includes ideas that are relevant to the accounting and auditing spectra, as well as Shariah principles and jurisprudence. By contrast, competency refers to the ability to innovate unique Shariah-compliant products that are rare and difficult to imitate. Meanwhile, spiritual values embrace the elements of “Siddiq,” “Amanah,” “Fathonah,” and “Tabligh.” This study affirms that knowledge, competency, and satisfaction are the most significant constructs of human capital that explain performance. Factor analysis indicates that spiritual value is embedded in and forms part of the human capital construct. Hence, spiritual value is a key element in company culture and contributes significantly to organizational success. This model can be a platform for human capital reporting in the relevant Islamic and conventional organizations.",TRUE,FALSE,Human capital; Islamic Organization; Microfinance Organization; Human spirit.|Intellectual capital,2019-06-13T10:33:29.573675,NA,,TRUE,accepted,2019-06-13T10:33:09.831517,NA,NA,NA,NA,,NA,NA,,NA,5a8c80f7c698300375c76d84|5a8c80f8c698300375c76dbe|5a8c80f8c698300375c76dbf|Social and Behavioral Sciences|Economics|Finance,,2019,https://api.osf.io/v2/preprints/962yu/contributors/,https://api.osf.io/v2/preprints/962yu/bibliographic_contributors/,https://api.osf.io/v2/preprints/962yu/citation/,962yu,preprints,https://api.osf.io/v2/preprints/962yu/identifiers/,https://api.osf.io/v2/nodes/hj5s7/,https://api.osf.io/v2/preprints/962yu/relationships/node/,hj5s7,nodes,https://api.osf.io/v2/licenses/563c1cf88c5e4a3877f9e96c/,563c1cf88c5e4a3877f9e96c,licenses,https://api.osf.io/v2/providers/preprints/socarxiv/,socarxiv,preprint-providers,https://api.osf.io/v2/preprints/962yu/files/,https://api.osf.io/v2/files/5d0220c8760f110018fbe7c1/,5d0220c8760f110018fbe7c1,files,https://api.osf.io/v2/preprints/962yu/review_actions/,https://api.osf.io/v2/preprints/962yu/requests/,https://api.osf.io/v2/preprints/962yu/,https://osf.io/preprints/socarxiv/962yu/,https://doi.org/10.31235/osf.io/962yu
8bfjy,preprints,2019-06-13T10:04:17.603143,2019-06-14T10:05:43.376475,2019-06-14T10:05:14.752031,NA,NA,Waqf as a Tool for Rendering Social Welfare Services in the Social Entrepreneurship Context,"The concept of Islamic entrepreneurship centers on ensuring community well-being as the priority, which is one of the important objectives (Maqasid) of the Islamic Shari’ah. Historically, waqf played a significant role in the Islamic economic system, particularly in rendering exemplary welfare services in the areas of healthcare, education, social welfare, environmental, and other community-based programs. However, only a few success stories in recent history have institutionally utilized the properties of waqf under proper management to achieve its substantial objectives. This study uses the literature review as basis to analyze the reasons behind the successful utilization of waqf as an effective tool to ensure social welfare services in the past, as well as how this model can be replicated by considering current contexts. This study will assist Islamic value-centric entrepreneurs, regulatory authorities, investors, and researchers to gain an overall insight into the potentials of waqf as a tool for rendering commendable social welfare services.",TRUE,FALSE,waqf; Islamic entrepreneurship; social entrepreneurship; social welfare; third-sector economy.,2019-06-14T10:05:43.355386,NA,,TRUE,accepted,2019-06-14T10:05:14.752031,NA,NA,NA,NA,,NA,NA,,NA,5a8c80f7c698300375c76d84|5a8c80f8c698300375c76dbe|5a8c80f8c698300375c76dbf|Social and Behavioral Sciences|Economics|Finance,,2019,https://api.osf.io/v2/preprints/8bfjy/contributors/,https://api.osf.io/v2/preprints/8bfjy/bibliographic_contributors/,https://api.osf.io/v2/preprints/8bfjy/citation/,8bfjy,preprints,https://api.osf.io/v2/preprints/8bfjy/identifiers/,https://api.osf.io/v2/nodes/267ef/,https://api.osf.io/v2/preprints/8bfjy/relationships/node/,267ef,nodes,https://api.osf.io/v2/licenses/563c1cf88c5e4a3877f9e96c/,563c1cf88c5e4a3877f9e96c,licenses,https://api.osf.io/v2/providers/preprints/socarxiv/,socarxiv,preprint-providers,https://api.osf.io/v2/preprints/8bfjy/files/,https://api.osf.io/v2/files/5d021fae7b8c4d00199b1f39/,5d021fae7b8c4d00199b1f39,files,https://api.osf.io/v2/preprints/8bfjy/review_actions/,https://api.osf.io/v2/preprints/8bfjy/requests/,https://api.osf.io/v2/preprints/8bfjy/,https://osf.io/preprints/socarxiv/8bfjy/,https://doi.org/10.31235/osf.io/8bfjy
4epmy,preprints,2019-06-13T10:00:13.975212,2019-06-14T16:00:02.412679,2019-06-14T15:52:58.477975,NA,NA,Practices of Corporate Integrity and Accountability of Non-Profit Organizations in Malaysia,"Purpose - This paper aims to examine the five dimensions of Corporate Integrity Systems and their effects on accountability outcomes of Non-Profit Organizations (NPOs).
Design/methodology/approach – Data were collected from 550 survey conducted among NPOs in Malaysia registered under Registrar of Society. Regression analysis was conducted to examine the relationships between five dimensions corporate integrity systems and accountability outcomes.
Findings - The findings revealed that all five dimensions of corporate integrity systems (compliance, policies and rules, organizational culture, leadership, ethics training and education, and whistle-blowing) significantly contribute to positive accountability outcomes of NPOs.
Practical implications - In order for NPOs to deliver greater accountability outcomes to their stakeholders, serious emphasis on corporate integrity systems is vital.
Originality/value – To the best of the authors‟ knowledge, this study is among the first empirical study to examine the role of corporate integrity system dimensions and accountability outcomes in the case of NPOs in Malaysia.",TRUE,FALSE,Governance; Corporate Integrity System; Accountability; Non-Profit Organization|Malaysia,2019-06-14T16:00:02.378752,NA,,TRUE,accepted,2019-06-14T15:52:58.477975,NA,NA,NA,NA,,NA,NA,,NA,5a8c80f7c698300375c76d84|5a8c80f8c698300375c76dbe|5a8c80f8c698300375c76dbf|Social and Behavioral Sciences|Economics|Finance,,2019,https://api.osf.io/v2/preprints/4epmy/contributors/,https://api.osf.io/v2/preprints/4epmy/bibliographic_contributors/,https://api.osf.io/v2/preprints/4epmy/citation/,4epmy,preprints,https://api.osf.io/v2/preprints/4epmy/identifiers/,https://api.osf.io/v2/nodes/hd9s7/,https://api.osf.io/v2/preprints/4epmy/relationships/node/,hd9s7,nodes,https://api.osf.io/v2/licenses/563c1cf88c5e4a3877f9e96c/,563c1cf88c5e4a3877f9e96c,licenses,https://api.osf.io/v2/providers/preprints/socarxiv/,socarxiv,preprint-providers,https://api.osf.io/v2/preprints/4epmy/files/,https://api.osf.io/v2/files/5d021eb87b8c4d001a9ae764/,5d021eb87b8c4d001a9ae764,files,https://api.osf.io/v2/preprints/4epmy/review_actions/,https://api.osf.io/v2/preprints/4epmy/requests/,https://api.osf.io/v2/preprints/4epmy/,https://osf.io/preprints/socarxiv/4epmy/,https://doi.org/10.31235/osf.io/4epmy
vd2eh,preprints,2019-06-13T09:55:08.475094,2019-06-14T15:58:28.285241,2019-06-14T15:52:08.181562,NA,NA,"Does Job Satisfaction, Fair Treatment, and Cooperativeness Influence the Whistleblowing Practice in Malaysian Government Linked Companies?","Purpose: Whistleblowing is an important factor in preventing corruption and fraud in organizations. There is a law to promote whistleblowing practices, but the negative subsequent effect of whistleblowing demotivates the reporting of unethical behaviours. Thus, it is important to identify the factors that motivate an employee to exercise whistleblowing in an organization. Therefore, this study aims to examine whether the personal factor of job satisfaction and organizational factors such as fair treatment as well as cooperativeness contribute to the whistleblowing practice in an organization.
Design/methodology/approach: This study collected primary data based on a questionnaire survey from 73 respondents of the seven top most GLCs in Malaysia. The data are analyzed using descriptive statistics, factor analysis, and cross-sectional regression.
Findings: The findings of the study reveal that only fair treatment is statistically significant and positively related to the whistleblowing practice. The findings imply that if employees perceive that the organization provides fair treatment in terms of career advancement, awards, training, performance appraisal, job assignment, and pay increases, they would tend to report wrongdoing activities to protect the image of the organization.
Practical implications: The findings of the study will help the policy makers to ensure better working environment and accountability in the public sector of Malaysia and other similar countries.
Originality/value: This is an original study based on primary data to examine the current practices of whistleblowing and its relationship with the practices of job satisfaction, fair treatment, and cooperativeness in the government linked companies of Malaysia.",TRUE,FALSE,Government Linked Company (GLC); Job Satisfaction; Fair Treatment; Cooperativeness; Whistleblowing practice,2019-06-14T15:58:28.261924,NA,,TRUE,accepted,2019-06-14T15:52:08.181562,NA,NA,NA,NA,,NA,NA,,NA,5a8c80f7c698300375c76d84|5a8c80f8c698300375c76dbe|5a8c80f8c698300375c76dbf|Social and Behavioral Sciences|Economics|Finance,,2019,https://api.osf.io/v2/preprints/vd2eh/contributors/,https://api.osf.io/v2/preprints/vd2eh/bibliographic_contributors/,https://api.osf.io/v2/preprints/vd2eh/citation/,vd2eh,preprints,https://api.osf.io/v2/preprints/vd2eh/identifiers/,https://api.osf.io/v2/nodes/96hpd/,https://api.osf.io/v2/preprints/vd2eh/relationships/node/,96hpd,nodes,https://api.osf.io/v2/licenses/563c1cf88c5e4a3877f9e96c/,563c1cf88c5e4a3877f9e96c,licenses,https://api.osf.io/v2/providers/preprints/socarxiv/,socarxiv,preprint-providers,https://api.osf.io/v2/preprints/vd2eh/files/,https://api.osf.io/v2/files/5d021d8635988f001bde773b/,5d021d8635988f001bde773b,files,https://api.osf.io/v2/preprints/vd2eh/review_actions/,https://api.osf.io/v2/preprints/vd2eh/requests/,https://api.osf.io/v2/preprints/vd2eh/,https://osf.io/preprints/socarxiv/vd2eh/,https://doi.org/10.31235/osf.io/vd2eh
xpqrs,preprints,2019-06-13T09:51:47.523318,2020-09-23T17:00:41.370620,2020-09-23T17:00:22.140040,NA,NA,Integrating Ethical Values into Fraud Triangle Theory in Assessing Employee Fraud: Evidence from the Malaysian Banking Industry,"This study attempts to integrate ethical values into the fraud triangle theory in the context of Malaysian banking industry. Primary data were collected through the survey of 108 questionnaires administered to the employees of the top three largest banks in Malaysia. The findings revealed that ethical values were negatively related to employee fraud, and two elements of fraud triangle theory, namely, opportunity and rationalization, were positively related to employee fraud. This implies that high ethical value is crucial to mitigate employee fraud. To minimize employee fraud, the banking industry should reduce opportunities and employee negative rationalization through strong internal control. This study contributes to literature on the occurrences of employee fraud, which is not widely discussed, especially in the context of the banking industry in developing countries.",TRUE,FALSE,Banking sector|Ethical value|Fraud triangle theory|Malaysia,2020-09-23T17:00:41.351981,NA,,TRUE,accepted,2020-09-23T17:00:22.140040,FALSE,NA,no,NA,,no,NA,,,5a8c80f2c698300375c76c7d|5a8c80f4c698300375c76cac|Arts and Humanities|Religion|5a8c80f2c698300375c76c7d|5a8c80f4c698300375c76cc6|Arts and Humanities|Rhetoric and Composition|5a8c80f7c698300375c76d84|5a8c80f7c698300375c76d98|Social and Behavioral Sciences|Psychology|5a8c80f7c698300375c76d84|5a8c80f8c698300375c76dbe|5a8c80f8c698300375c76dc5|Social and Behavioral Sciences|Economics|Behavioral Economics,,2019,https://api.osf.io/v2/preprints/xpqrs/contributors/,https://api.osf.io/v2/preprints/xpqrs/bibliographic_contributors/,https://api.osf.io/v2/preprints/xpqrs/citation/,xpqrs,preprints,https://api.osf.io/v2/preprints/xpqrs/identifiers/,https://api.osf.io/v2/nodes/5byus/,https://api.osf.io/v2/preprints/xpqrs/relationships/node/,5byus,nodes,https://api.osf.io/v2/licenses/563c1cf88c5e4a3877f9e96c/,563c1cf88c5e4a3877f9e96c,licenses,https://api.osf.io/v2/providers/preprints/socarxiv/,socarxiv,preprint-providers,https://api.osf.io/v2/preprints/xpqrs/files/,https://api.osf.io/v2/files/5d021cbe760f11001afbb1a5/,5d021cbe760f11001afbb1a5,files,https://api.osf.io/v2/preprints/xpqrs/review_actions/,https://api.osf.io/v2/preprints/xpqrs/requests/,https://api.osf.io/v2/preprints/xpqrs/,https://osf.io/preprints/socarxiv/xpqrs/,https://doi.org/10.31235/osf.io/xpqrs
