id,type,attributes.date_created,attributes.date_modified,attributes.date_published,attributes.original_publication_date,attributes.doi,attributes.title,attributes.description,attributes.is_published,attributes.is_preprint_orphan,attributes.tags,attributes.preprint_doi_created,attributes.date_withdrawn,attributes.current_user_permissions,attributes.public,attributes.reviews_state,attributes.date_last_transitioned,attributes.has_coi,attributes.conflict_of_interest_statement,attributes.has_data_links,attributes.why_no_data,attributes.data_links,attributes.has_prereg_links,attributes.why_no_prereg,attributes.prereg_links,attributes.prereg_link_info,attributes.subjects,attributes.license_record.copyright_holders,attributes.license_record.year,relationships.contributors.links.related.href,relationships.bibliographic_contributors.links.related.href,relationships.citation.links.related.href,relationships.citation.data.id,relationships.citation.data.type,relationships.identifiers.links.related.href,relationships.node.links.related.href,relationships.node.links.self.href,relationships.node.data.id,relationships.node.data.type,relationships.license.links.related.href,relationships.license.data.id,relationships.license.data.type,relationships.provider.links.related.href,relationships.provider.data.id,relationships.provider.data.type,relationships.files.links.related.href,relationships.primary_file.links.related.href,relationships.primary_file.data.id,relationships.primary_file.data.type,relationships.review_actions.links.related.href,relationships.requests.links.related.href,links.self,links.html,links.preprint_doi,links.doi
qcm58,preprints,2019-05-06T02:20:49.764465,2019-08-08T20:31:22.075479,2019-05-06T03:21:28.956312,NA,NA,"To Move Home or Move On? Investigating the Impact of Recovery Aid on Migration Status as a Potential Tool for Disaster Risk Reduction in the Aftermath of Volcanic Eruptions in Merapi, Indonesia","Disasters are associated strongly with forced migration. Indeed, migration is a standard survival strategy for those facing disruptions of this kind. Such is the case with Mt. Merapi, Indonesia, where a series of eruptions occurred in 2010. Mechanisms related to forced migration in such scenarios are fairly well understood, yet it remains less clear what factors may influence return migration. Given local interest in facilitating resettlement out of hazardous areas as a means of risk reduction, we seek to better understand the extent to which recovery aid may create incentives for households to move on rather than move home. We draw upon data collected from a pilot study in the aftermath of the 2010 eruptions and use multinomial logistic regression models to explore the influence of various forms of aid on migration status. Of the various forms of aid considered, financial recovery aid provided to households was consistently associated with moving on. The combination of financial recovery aid with remittances resulted in an association with having moved on that was even stronger than just receiving financial recovery aid. Ultimately, analyses of ""aid packages'""  suggest that a combination of most, if not all, of the aid was relatively more effective in fostering resettlement, suggesting that while food and health recovery aid as well as remittances may not have been sufficient in and of themselves to increase resettlement, they may enhance the effect of financial recovery aid.",TRUE,FALSE,,2019-05-06T16:00:25.864784,NA,,TRUE,accepted,2019-05-06T03:21:28.956312,NA,NA,NA,NA,NA,NA,NA,NA,NA,5a8c80f7c698300375c76d84|5a8c80f7c698300375c76d8e|5a8c80f7c698300375c76d90|Social and Behavioral Sciences|International and Area Studies|Asian Studies|5a8c80f7c698300375c76d84|5a8c80fac698300375c76e20|5a8c80fac698300375c76e2f|Social and Behavioral Sciences|Sociology|Environmental Sociology|5a8c80f7c698300375c76d84|5a8c80fac698300375c76e20|5a8c80fac698300375c76e33|Social and Behavioral Sciences|Sociology|Development|5a8c80f7c698300375c76d84|5a8c80fac698300375c76e20|5a8c80fac698300375c76e3e|Social and Behavioral Sciences|Sociology|Population,,2019,https://api.osf.io/v2/preprints/qcm58/contributors/,https://api.osf.io/v2/preprints/qcm58/bibliographic_contributors/,https://api.osf.io/v2/preprints/qcm58/citation/,qcm58,preprints,https://api.osf.io/v2/preprints/qcm58/identifiers/,https://api.osf.io/v2/nodes/mbfdp/,https://api.osf.io/v2/preprints/qcm58/relationships/node/,mbfdp,nodes,https://api.osf.io/v2/licenses/563c1cf88c5e4a3877f9e96a/,563c1cf88c5e4a3877f9e96a,licenses,https://api.osf.io/v2/providers/preprints/socarxiv/,socarxiv,preprint-providers,https://api.osf.io/v2/preprints/qcm58/files/,https://api.osf.io/v2/files/5ccf9a0910339000179d8f88/,5ccf9a0910339000179d8f88,files,https://api.osf.io/v2/preprints/qcm58/review_actions/,https://api.osf.io/v2/preprints/qcm58/requests/,https://api.osf.io/v2/preprints/qcm58/,https://osf.io/preprints/socarxiv/qcm58/,https://doi.org/10.31235/osf.io/qcm58,NA
nj8gx,preprints,2019-05-06T00:42:40.840161,2019-05-06T16:00:03.129274,2019-05-06T03:18:48.526112,2019-05-05T21:00:00,NA,"Internet, Social Media and Conflict Studies: Can Greater Interdisciplinarity Solve the  Analytical Deadlocks in Cybersecurity Research?","In recent years, computational research methods, digital trace data and online human interactions have contributed to the emergence of new technology-oriented sub-fields within International Relations (IR). Although the cybersecurity scholarship had an initial promise to be the primus inter pares among these emerging fields, the main thrust of this new methodological innovation came through the ‘digital conflict studies’ sub-field. By integrating Internet and social media research tools and questions into its core topics of sub-national violence, terrorism and radical mobilization, digital conflict studies has recently succeeded in addressing some of the data validity and methodology problems faced by the cybersecurity scholarship. This article begins by briefly reviewing some of the persistent data and method-oriented hurdles faced by the cybersecurity scholarship. Then, it moves onto a more detailed account of how digital conflict studies have been addressing some of these deadlocks by focusing individually on the literature on onset, mobilization, targeting, intensity/duration and termination phases of conflicts. Ultimately, the article concludes with the suggestion that the cybersecurity scholarship could move past its own deadlocks by building more granular and dedicated research datasets and establishing mechanisms to share event data with the scientific community.",TRUE,FALSE,civil war|conflict studies|cybersecurity|digital media|international relations|internet research|political violence|social media,2019-05-06T16:00:03.106177,NA,,TRUE,accepted,2019-05-06T03:18:48.526112,NA,NA,NA,NA,NA,NA,NA,NA,NA,5a8c80f7c698300375c76d84|5a8c80f8c698300375c76daf|5a8c80f8c698300375c76db0|Social and Behavioral Sciences|Political Science|International Relations,,2019,https://api.osf.io/v2/preprints/nj8gx/contributors/,https://api.osf.io/v2/preprints/nj8gx/bibliographic_contributors/,https://api.osf.io/v2/preprints/nj8gx/citation/,nj8gx,preprints,https://api.osf.io/v2/preprints/nj8gx/identifiers/,NA,https://api.osf.io/v2/preprints/nj8gx/relationships/node/,NA,NA,https://api.osf.io/v2/licenses/563c1cf88c5e4a3877f9e96a/,563c1cf88c5e4a3877f9e96a,licenses,https://api.osf.io/v2/providers/preprints/socarxiv/,socarxiv,preprint-providers,https://api.osf.io/v2/preprints/nj8gx/files/,https://api.osf.io/v2/files/5ccf83067788f50019a9674b/,5ccf83067788f50019a9674b,files,https://api.osf.io/v2/preprints/nj8gx/review_actions/,https://api.osf.io/v2/preprints/nj8gx/requests/,https://api.osf.io/v2/preprints/nj8gx/,https://osf.io/preprints/socarxiv/nj8gx/,https://doi.org/10.31235/osf.io/nj8gx,NA
qm4vp,preprints,2019-05-05T15:17:35.785479,2019-05-06T15:55:49.895834,2019-05-05T20:38:09.739539,NA,NA,The Demography of Drug Abuse in Hong Kong,"Drug abuse is a critical issue impairing social welfare in many societies. This study explores the demographic characteristics of drug abuse among sub-populations in Hong Kong as a developed and ageing society with large socioeconomic disparities. Significant changes in both the number and rate of drug abuse by drug type, age, gender, ethnicity, education and economic activity are documented during 1991 to 2016. Although narcotics analgesics is more common, stimulants and Ketamine are growing popular in Hong Kong, especially among the youth. The number of elderly drug abusers is increasing due to the ageing population, whereas the rate of elderly drug abuse is actually stable or decreasing. In contrast, drug abuse rate is increasing for the middle-aged and for groups with lower education. The findings support social policy design to curb drug abuse, and call for closer attention to these at-risk groups that are overlooked in Hong Kong.",TRUE,FALSE,ageing|demography|drug abuse|Hong Kong|substance use,2019-05-06T15:55:49.840133,NA,,TRUE,accepted,2019-05-05T20:38:09.739539,NA,NA,NA,NA,NA,NA,NA,NA,NA,5a8c80f7c698300375c76d84|5a8c80f8c698300375c76dbe|Social and Behavioral Sciences|Economics|5a8c80f7c698300375c76d84|5a8c80f9c698300375c76e0c|Social and Behavioral Sciences|Social Statistics,,2019,https://api.osf.io/v2/preprints/qm4vp/contributors/,https://api.osf.io/v2/preprints/qm4vp/bibliographic_contributors/,https://api.osf.io/v2/preprints/qm4vp/citation/,qm4vp,preprints,https://api.osf.io/v2/preprints/qm4vp/identifiers/,NA,https://api.osf.io/v2/preprints/qm4vp/relationships/node/,NA,NA,https://api.osf.io/v2/licenses/563c1cf88c5e4a3877f9e96a/,563c1cf88c5e4a3877f9e96a,licenses,https://api.osf.io/v2/providers/preprints/socarxiv/,socarxiv,preprint-providers,https://api.osf.io/v2/preprints/qm4vp/files/,https://api.osf.io/v2/files/5ccefe947788f5001aaa3619/,5ccefe947788f5001aaa3619,files,https://api.osf.io/v2/preprints/qm4vp/review_actions/,https://api.osf.io/v2/preprints/qm4vp/requests/,https://api.osf.io/v2/preprints/qm4vp/,https://osf.io/preprints/socarxiv/qm4vp/,https://doi.org/10.31235/osf.io/qm4vp,NA
h63mz,preprints,2019-05-05T00:09:14.398791,2019-05-06T15:55:30.679452,2019-05-05T20:36:43.202500,2002-05-15T04:00:00,NA,The Computational Complexity of Nash Equilibria,"Although the computation of Nash equlibria for general games is of unknown complexity, there exist many algorithms for specific game classes, some of which are a marked improvement of previous algorithms. This paper reviews general results on the computational complexity of Nash equilibria and discusses the major algorithms for specific game classes.",TRUE,FALSE,computational complexity|data science|game theory|Nash equilibrium,2019-05-06T15:55:30.659229,NA,,TRUE,accepted,2019-05-05T20:36:43.202500,NA,NA,NA,NA,NA,NA,NA,NA,NA,5a8c80f7c698300375c76d84|5a8c80f8c698300375c76dbe|5a8c80f8c698300375c76dca|Social and Behavioral Sciences|Economics|Economic Theory|5a8c80f7c698300375c76d84|5a8c80f9c698300375c76e0c|Social and Behavioral Sciences|Social Statistics,,2019,https://api.osf.io/v2/preprints/h63mz/contributors/,https://api.osf.io/v2/preprints/h63mz/bibliographic_contributors/,https://api.osf.io/v2/preprints/h63mz/citation/,h63mz,preprints,https://api.osf.io/v2/preprints/h63mz/identifiers/,NA,https://api.osf.io/v2/preprints/h63mz/relationships/node/,NA,NA,https://api.osf.io/v2/licenses/563c1cf88c5e4a3877f9e96a/,563c1cf88c5e4a3877f9e96a,licenses,https://api.osf.io/v2/providers/preprints/socarxiv/,socarxiv,preprint-providers,https://api.osf.io/v2/preprints/h63mz/files/,https://api.osf.io/v2/files/5cce29b378c993001dd38554/,5cce29b378c993001dd38554,files,https://api.osf.io/v2/preprints/h63mz/review_actions/,https://api.osf.io/v2/preprints/h63mz/requests/,https://api.osf.io/v2/preprints/h63mz/,https://osf.io/preprints/socarxiv/h63mz/,https://doi.org/10.31235/osf.io/h63mz,NA
tx2uj,preprints,2019-05-04T15:03:27.556987,2019-05-06T15:21:51.665630,2019-05-04T21:28:00.606701,2019-05-04T03:00:00,NA,"Vasijas que cuentan historias. La cerámica de El Sunchal, Anfama","Esta pequeña obra forma parte de una serie de libros de divulgación científica que pretenden acercar el conocimiento que se genera desde la Arqueología a un público más amplio, tratando de expresar de forma sencilla los resultados de las distintas investigaciones que hemos realizado con el Equipo de Arqueología del Sur de las Cumbres Calchaquíes (EASCC) en conjunto con las Comunidades Indígenas Diaguitas.
Este volumen es una adaptación de divulgación de la Tesis de Licenciatura en Historia del autor, dirigida por el Dr. Julián Salazar, titulada La práctica alfarera durante el Primer milenio de la era en El Sunchal, Anfama (Dto. Tafí Viejo, Tucumán, Rep. Argentina). Trayectorias de vida, cadenas operativas y ¿tradición? y defendida en marzo de 2019. El texto y las imágenes seleccionadas tienen por objetivo presentar a un público ampliado los resultados de una investigación científica cuyos formatos y contenidos no son demasiado amigables. Sin embargo, esta operación implica simplificar argumentos, esquematizar interpretaciones y tomar atajos metodológicos, operaciones que no son bienvenidas en los entornos académicos. Para una lectura de pares o la consideración de la construcción de los datos aquí vertidos se sugiere recurrir al trabajo original y/o a las publicaciones en revistas científicas que de él se produjeron.",TRUE,FALSE,Anfama|Archaeology|Cerámica|divulgación|Manufactura|Northwestern Argentina|Obtención de materias primas|Piedemonte,2019-05-06T15:21:51.620885,NA,,TRUE,accepted,2019-05-04T21:28:00.606701,NA,NA,NA,NA,NA,NA,NA,NA,NA,5a8c80f2c698300375c76c7d|Arts and Humanities|5a8c80f7c698300375c76d84|5a8c80f9c698300375c76df6|5a8c80f9c698300375c76dfb|Social and Behavioral Sciences|Anthropology|Archaeological Anthropology,,2019,https://api.osf.io/v2/preprints/tx2uj/contributors/,https://api.osf.io/v2/preprints/tx2uj/bibliographic_contributors/,https://api.osf.io/v2/preprints/tx2uj/citation/,tx2uj,preprints,https://api.osf.io/v2/preprints/tx2uj/identifiers/,NA,https://api.osf.io/v2/preprints/tx2uj/relationships/node/,NA,NA,https://api.osf.io/v2/licenses/563c1cf88c5e4a3877f9e96a/,563c1cf88c5e4a3877f9e96a,licenses,https://api.osf.io/v2/providers/preprints/socarxiv/,socarxiv,preprint-providers,https://api.osf.io/v2/preprints/tx2uj/files/,https://api.osf.io/v2/files/5ccda9c210339000179bff6b/,5ccda9c210339000179bff6b,files,https://api.osf.io/v2/preprints/tx2uj/review_actions/,https://api.osf.io/v2/preprints/tx2uj/requests/,https://api.osf.io/v2/preprints/tx2uj/,https://osf.io/preprints/socarxiv/tx2uj/,https://doi.org/10.31235/osf.io/tx2uj,NA
hqsb4,preprints,2019-05-04T05:43:19.074221,2019-05-06T15:09:48.514680,2019-05-04T11:57:19.535352,2016-01-08T05:00:00,10.1080/21528586.2015.1100095,South African Marriage in Policy and Practice: A Dynamic Story,"Law forms one of the major structural contexts within which family lives play out, yet the precise dynamics connecting these two foundational institutions are still poorly understood. This article attempts to help bridge this gap by applying sociolegal concepts to empirical findings about state law’s role in family, and especially in marriage, drawn from across several decades and disciplines of South Africanist scholarly research. I sketch the broad outlines of a nuanced theoretical approach for analyzing the law-family relationship, which insists that the relationship entails a contingent and dynamic interplay between relatively powerful regulating institutions and relatively powerless regulated populations. Accordingly, while my argument broadly distinguishes the more repressive regimes of colonialism and apartheid from the more expansive post-apartheid legal regime, it also partially undoes that periodisation by highlighting limits and evasions of repressive law and obstacles impeding access to post-apartheid law’s expansive promises.",TRUE,FALSE,apartheid|British colonialism|colonialism|family|law and society|marriage|post-apartheid|post-colonial|sociolegal studies|South Africa,2019-05-06T15:09:48.495537,NA,,TRUE,accepted,2019-05-04T11:57:19.535352,NA,NA,NA,NA,NA,NA,NA,NA,NA,"5a8c80f0c698300375c76c07|5a8c80f0c698300375c76c16|Law|Law and Gender|5a8c80f0c698300375c76c07|5a8c80f1c698300375c76c49|Law|Legal History|5a8c80f0c698300375c76c07|5a8c80f1c698300375c76c4b|Law|Law and Society|5a8c80f0c698300375c76c07|5a8c80f2c698300375c76c5e|Law|Law and Race|5a8c80f0c698300375c76c07|5a8c80f2c698300375c76c5f|Law|Family Law|5a8c80f2c698300375c76c7d|5a8c80f3c698300375c76c99|Arts and Humanities|African Languages and Societies|5a8c80f2c698300375c76c7d|5a8c80f4c698300375c76ccc|5a8c80f4c698300375c76cd2|Arts and Humanities|History|African History|5a8c80f2c698300375c76c7d|5a8c80f5c698300375c76d02|5a8c80f5c698300375c76d05|Arts and Humanities|Feminist, Gender, and Sexuality Studies|Women's Studies|5a8c80f7c698300375c76d84|5a8c80f9c698300375c76df6|5a8c80f9c698300375c76dfa|Social and Behavioral Sciences|Anthropology|Social and Cultural Anthropology|5a8c80f7c698300375c76d84|5a8c80fac698300375c76e20|5a8c80fac698300375c76e30|Social and Behavioral Sciences|Sociology|Global and Transnational Sociology|5a8c80f7c698300375c76d84|5a8c80fac698300375c76e20|5a8c80fac698300375c76e3c|Social and Behavioral Sciences|Sociology|Sociology of Law|5a8c80f7c698300375c76d84|5a8c80fac698300375c76e20|5a8c80fac698300375c76e44|Social and Behavioral Sciences|Sociology|Race, Gender, and Class|5a8c80f7c698300375c76d84|5a8c80fac698300375c76e20|5a8c80fac698300375c76e4c|Social and Behavioral Sciences|Sociology|Family",,2019,https://api.osf.io/v2/preprints/hqsb4/contributors/,https://api.osf.io/v2/preprints/hqsb4/bibliographic_contributors/,https://api.osf.io/v2/preprints/hqsb4/citation/,hqsb4,preprints,https://api.osf.io/v2/preprints/hqsb4/identifiers/,NA,https://api.osf.io/v2/preprints/hqsb4/relationships/node/,NA,NA,https://api.osf.io/v2/licenses/563c1cf88c5e4a3877f9e96a/,563c1cf88c5e4a3877f9e96a,licenses,https://api.osf.io/v2/providers/preprints/socarxiv/,socarxiv,preprint-providers,https://api.osf.io/v2/preprints/hqsb4/files/,https://api.osf.io/v2/files/5ccd267a78c993001cd2948e/,5ccd267a78c993001cd2948e,files,https://api.osf.io/v2/preprints/hqsb4/review_actions/,https://api.osf.io/v2/preprints/hqsb4/requests/,https://api.osf.io/v2/preprints/hqsb4/,https://osf.io/preprints/socarxiv/hqsb4/,https://doi.org/10.31235/osf.io/hqsb4,https://doi.org/10.1080/21528586.2015.1100095
bg37v,preprints,2019-05-04T04:59:16.016435,2019-05-06T15:08:29.682943,2019-05-04T11:56:02.438293,2015-08-17T04:00:00,10.1093/sp/jxv016,Toward a Political Sociology of Conjugal-Recognition Regimes: Gendered Multiculturalism in South African Marriage Law,"While conjugal-recognition policies are often a subject of political debate, scholars rarely attempt to explain the causal roots of such policies. When they do, their methods typically focus on discrete policies in isolation—same-sex marriage, no-fault divorce, etc.—with comparatively little investigation of potential connections among policies. This article begins to develop a more holistic approach focused on identifying and explaining what I call conjugal-recognition regimes. Adapting the concept from the existing literature on welfare regimes, I argue that conjugal-recognition regimes exist when an identifiable pattern or principle organizes an institution’s conjugal-recognition policies. Such regimes shape social relations at multiple levels, both between the individuals in conjugal relationships and among the multiple institutions (state, religious, and so on) that confer official conjugal recognition. I argue that these organizing patterns or principles emerge out of historically specific, institutionally situated, and discursively constructed political debates on specific conjugal issues and, to the extent a regime in fact exists, go on to shape subsequent conjugal-policy controversies. I demonstrate these ideas through an extended analysis of post-apartheid South African marriage law, which has recently incorporated numerous previously excluded conjugal formations but has also assigned each new form to its own statutory and administrative structure or, as I call it, “silo.” I argue that these silos entrench a principle of “gendered multiculturalism” that officially defines cultures in terms of their supposedly characteristic gender relations. This principle increasingly tends to embed religious and cultural elites’ understandings of their respective traditions into the state’s marriage laws.",TRUE,FALSE,African marriage|customary law|customary marriage|gender|historical institutionalism|Islamic marriage|legal pluralism|marriage|multiculturalism|Muslim marriage|policy regimes|post-apartheid|same-sex marriage|South Africa,2019-05-06T15:08:29.657718,NA,,TRUE,accepted,2019-05-04T11:56:02.438293,NA,NA,NA,NA,NA,NA,NA,NA,NA,"5a8c80f0c698300375c76c07|5a8c80f0c698300375c76c16|Law|Law and Gender|5a8c80f0c698300375c76c07|5a8c80f1c698300375c76c4b|Law|Law and Society|5a8c80f0c698300375c76c07|5a8c80f2c698300375c76c5f|Law|Family Law|5a8c80f0c698300375c76c07|5a8c80f2c698300375c76c67|Law|Legislation|5a8c80f2c698300375c76c7d|5a8c80f3c698300375c76c99|Arts and Humanities|African Languages and Societies|5a8c80f7c698300375c76d84|5a8c80f8c698300375c76daf|5a8c80f8c698300375c76db2|Social and Behavioral Sciences|Political Science|Comparative Politics|5a8c80f7c698300375c76d84|5a8c80fac698300375c76e20|5a8c80fac698300375c76e29|Social and Behavioral Sciences|Sociology|Sexualities|5a8c80f7c698300375c76d84|5a8c80fac698300375c76e20|5a8c80fac698300375c76e30|Social and Behavioral Sciences|Sociology|Global and Transnational Sociology|5a8c80f7c698300375c76d84|5a8c80fac698300375c76e20|5a8c80fac698300375c76e39|Social and Behavioral Sciences|Sociology|Collective Behavior and Social Movements|5a8c80f7c698300375c76d84|5a8c80fac698300375c76e20|5a8c80fac698300375c76e3c|Social and Behavioral Sciences|Sociology|Sociology of Law|5a8c80f7c698300375c76d84|5a8c80fac698300375c76e20|5a8c80fac698300375c76e3f|Social and Behavioral Sciences|Sociology|Political Sociology|5a8c80f7c698300375c76d84|5a8c80fac698300375c76e20|5a8c80fac698300375c76e43|Social and Behavioral Sciences|Sociology|Comparative and Historical Sociology|5a8c80f7c698300375c76d84|5a8c80fac698300375c76e20|5a8c80fac698300375c76e44|Social and Behavioral Sciences|Sociology|Race, Gender, and Class|5a8c80f7c698300375c76d84|5a8c80fac698300375c76e20|5a8c80fac698300375c76e49|Social and Behavioral Sciences|Sociology|Sex and Gender",,2019,https://api.osf.io/v2/preprints/bg37v/contributors/,https://api.osf.io/v2/preprints/bg37v/bibliographic_contributors/,https://api.osf.io/v2/preprints/bg37v/citation/,bg37v,preprints,https://api.osf.io/v2/preprints/bg37v/identifiers/,NA,https://api.osf.io/v2/preprints/bg37v/relationships/node/,NA,NA,https://api.osf.io/v2/licenses/563c1cf88c5e4a3877f9e96a/,563c1cf88c5e4a3877f9e96a,licenses,https://api.osf.io/v2/providers/preprints/socarxiv/,socarxiv,preprint-providers,https://api.osf.io/v2/preprints/bg37v/files/,https://api.osf.io/v2/files/5ccd1c27103390001a9b3bcb/,5ccd1c27103390001a9b3bcb,files,https://api.osf.io/v2/preprints/bg37v/review_actions/,https://api.osf.io/v2/preprints/bg37v/requests/,https://api.osf.io/v2/preprints/bg37v/,https://osf.io/preprints/socarxiv/bg37v/,https://doi.org/10.31235/osf.io/bg37v,https://doi.org/10.1093/sp/jxv016
