id,type,attributes.date_created,attributes.date_modified,attributes.date_published,attributes.original_publication_date,attributes.doi,attributes.title,attributes.description,attributes.is_published,attributes.is_preprint_orphan,attributes.tags,attributes.preprint_doi_created,attributes.date_withdrawn,attributes.current_user_permissions,attributes.public,attributes.reviews_state,attributes.date_last_transitioned,attributes.has_coi,attributes.conflict_of_interest_statement,attributes.has_data_links,attributes.why_no_data,attributes.data_links,attributes.has_prereg_links,attributes.why_no_prereg,attributes.prereg_links,attributes.prereg_link_info,attributes.subjects,attributes.license_record.copyright_holders,attributes.license_record.year,relationships.contributors.links.related.href,relationships.bibliographic_contributors.links.related.href,relationships.citation.links.related.href,relationships.citation.data.id,relationships.citation.data.type,relationships.identifiers.links.related.href,relationships.node.links.self.href,relationships.node.links.related.href,relationships.node.data.id,relationships.node.data.type,relationships.license.links.related.href,relationships.license.data.id,relationships.license.data.type,relationships.provider.links.related.href,relationships.provider.data.id,relationships.provider.data.type,relationships.files.links.related.href,relationships.primary_file.links.related.href,relationships.primary_file.data.id,relationships.primary_file.data.type,relationships.review_actions.links.related.href,relationships.requests.links.related.href,links.self,links.html,links.preprint_doi,links.doi
vctuh,preprints,2019-04-15T21:55:08.142285,2020-07-16T21:14:49.428513,2019-04-16T17:30:43.442096,NA,NA,The long term impacts of grants on poverty: 9-year evidence from Uganda’s Youth Opportunities Program,"There is growing enthusiasm for cash grants as a tool to tackle poverty globally, but we have little sense whether the promising short-run impacts persist in the long term. In 2008, Uganda gave $400/person to thousands of young people, to help them start skilled trades. Four years on, an experimental evaluation found grants raised earnings by 38% (Blattman, Fiala, Martinez 2014). We return after 9 years to find these start-up grants raised earnings and consumption temporarily only. Grantees’ investment leveled off; controls eventually increased their incomes through business and casual labor; and so both groups converged in employment, earnings, and consumption. Grants had lasting impacts on assets, skilled work, and possibly child health, but had little effect on mortality, fertility, health or education.",TRUE,FALSE,cash transfers|Education|Employment|Entrepeneurship|Field experiment|Labor market programs|Occupational Choice|Poverty|Uganda,2019-04-16T17:31:10.639966,NA,,TRUE,accepted,2019-04-16T17:30:43.442096,NA,NA,NA,NA,,NA,NA,NA,NA,5a8c80f7c698300375c76d84|5a8c80f8c698300375c76dbe|5a8c80f8c698300375c76dc8|Social and Behavioral Sciences|Economics|Growth and Development,Chris Blattman|Nathan Fiala|Sebastian Martinez,2019,https://api.osf.io/v2/preprints/vctuh/contributors/,https://api.osf.io/v2/preprints/vctuh/bibliographic_contributors/,https://api.osf.io/v2/preprints/vctuh/citation/,vctuh,preprints,https://api.osf.io/v2/preprints/vctuh/identifiers/,https://api.osf.io/v2/preprints/vctuh/relationships/node/,NA,NA,NA,https://api.osf.io/v2/licenses/563c1cf88c5e4a3877f9e965/,563c1cf88c5e4a3877f9e965,licenses,https://api.osf.io/v2/providers/preprints/socarxiv/,socarxiv,preprint-providers,https://api.osf.io/v2/preprints/vctuh/files/,https://api.osf.io/v2/files/5cb4fdc0a3bc97001af05777/,5cb4fdc0a3bc97001af05777,files,https://api.osf.io/v2/preprints/vctuh/review_actions/,https://api.osf.io/v2/preprints/vctuh/requests/,https://api.osf.io/v2/preprints/vctuh/,https://osf.io/preprints/socarxiv/vctuh/,https://doi.org/10.31235/osf.io/vctuh,NA
e96jr,preprints,2019-04-15T21:31:19.956381,2019-11-27T20:47:12.104019,2019-04-16T17:27:58.006222,NA,NA,Perceived Discrimination against Black Americans and White Americans,"A widely-cited study reported evidence that White Americans reported higher ratings of how much Whites are the victims of discrimination in the United States than of how much Blacks are the victims of discrimination in the United States. However, much fewer than half of White Americans rated discrimination against Whites in the United States today to be greater or more frequent than discrimination against Blacks in the United States today, in data from the American National Election Studies 2012 Time Series Study or in preregistered analyses of data from the American National Election Studies 2016 Time Series Study or from a 2017 national nonprobability survey. Given that relative discrimination against Black Americans is a compelling justification for policies to reduce Black disadvantage, results from these three surveys suggest that White Americans' policy preferences have much potential to move in a direction that disfavors programs intended to reduce Black disadvantage.",TRUE,FALSE,discrimination|meta-psychology|perceptions|race,2019-04-16T17:28:28.464021,NA,,TRUE,accepted,2019-04-16T17:27:58.006222,NA,NA,NA,NA,,NA,NA,NA,NA,5a8c80f7c698300375c76d84|5a8c80f7c698300375c76d98|5a8c80f7c698300375c76da2|Social and Behavioral Sciences|Psychology|Social Psychology|5a8c80f7c698300375c76d84|5a8c80f8c698300375c76daf|Social and Behavioral Sciences|Political Science|5a8c80f7c698300375c76d84|5a8c80f9c698300375c76e0c|Social and Behavioral Sciences|Social Statistics|5a8c80f7c698300375c76d84|5a8c80fac698300375c76e20|Social and Behavioral Sciences|Sociology,,2019,https://api.osf.io/v2/preprints/e96jr/contributors/,https://api.osf.io/v2/preprints/e96jr/bibliographic_contributors/,https://api.osf.io/v2/preprints/e96jr/citation/,e96jr,preprints,https://api.osf.io/v2/preprints/e96jr/identifiers/,https://api.osf.io/v2/preprints/e96jr/relationships/node/,https://api.osf.io/v2/nodes/cgjns/,cgjns,nodes,https://api.osf.io/v2/licenses/563c1cf88c5e4a3877f9e96a/,563c1cf88c5e4a3877f9e96a,licenses,https://api.osf.io/v2/providers/preprints/socarxiv/,socarxiv,preprint-providers,https://api.osf.io/v2/preprints/e96jr/files/,https://api.osf.io/v2/files/5cb4f82c399269001813d5bd/,5cb4f82c399269001813d5bd,files,https://api.osf.io/v2/preprints/e96jr/review_actions/,https://api.osf.io/v2/preprints/e96jr/requests/,https://api.osf.io/v2/preprints/e96jr/,https://osf.io/preprints/socarxiv/e96jr/,https://doi.org/10.31235/osf.io/e96jr,NA
w4e6s,preprints,2019-04-15T17:03:00.185273,2019-04-17T14:06:09.163956,2019-04-16T17:23:01.872313,2019-04-17T04:00:00,10.1093/esr/jcz023,"Do changes in material circumstances drive support for populist radical parties? Panel data evidence from The Netherlands during the Great Recession, 2007–2015","Political developments since the 2008 financial crisis have sparked renewed interest in the electoral implications of economic downturns. Research describes a correlation between adverse economic conditions and support for radical parties campaigning on the populist promise to retake the country from a corrupt elite. But does the success of radical parties following economic crises rely on people who are directly affected? To answer this question, we examine whether individual-level changes in economic circumstances drive support for radical parties across the ideological divide. Analyzing eight waves of panel data collected in The Netherlands, before, during, and after the Great Recession (2007–2015), we demonstrate that people who experienced an income loss became more supportive of the radical left but not of the radical right. Looking at these parties’ core concerns, we find that income loss increased support for income redistribution championed by the radical left, but less so for the anti-immigration policies championed by the radical right. Our study establishes more directly than extant research the micro-foundations of support for radical parties across the ideological divide.",TRUE,FALSE,hardship|income loss|inequality|politics|populism|radical left|radical parties|radical right|recession,2019-04-16T17:23:24.871476,NA,,TRUE,accepted,2019-04-16T17:23:01.872313,NA,NA,NA,NA,,NA,NA,NA,NA,"5a8c80f7c698300375c76d84|5a8c80f8c698300375c76daf|5a8c80f8c698300375c76db2|Social and Behavioral Sciences|Political Science|Comparative Politics|5a8c80f7c698300375c76d84|5a8c80f8c698300375c76daf|5a8c80f8c698300375c76db4|Social and Behavioral Sciences|Political Science|Political Theory|5a8c80f7c698300375c76d84|5a8c80f8c698300375c76daf|5a8c80f8c698300375c76db5|Social and Behavioral Sciences|Political Science|American Politics|5a8c80f7c698300375c76d84|5a8c80f8c698300375c76ddb|5a8c80f9c698300375c76de4|Social and Behavioral Sciences|Public Affairs, Public Policy and Public Administration|Social Welfare|5a8c80f7c698300375c76d84|5a8c80f8c698300375c76ddb|5a8c80f9c698300375c76deb|Social and Behavioral Sciences|Public Affairs, Public Policy and Public Administration|Public Policy|5a8c80f7c698300375c76d84|5a8c80fac698300375c76e20|5a8c80fac698300375c76e2d|Social and Behavioral Sciences|Sociology|Economic Sociology|5a8c80f7c698300375c76d84|5a8c80fac698300375c76e20|5a8c80fac698300375c76e35|Social and Behavioral Sciences|Sociology|Inequality, Poverty, and Mobility|5a8c80f7c698300375c76d84|5a8c80fac698300375c76e20|5a8c80fac698300375c76e3f|Social and Behavioral Sciences|Sociology|Political Sociology|5a8c80f7c698300375c76d84|5a8c80fac698300375c76e20|5a8c80fac698300375c76e43|Social and Behavioral Sciences|Sociology|Comparative and Historical Sociology|5a8c80f7c698300375c76d84|5a8c80fac698300375c76e20|5a8c80fac698300375c76e51|Social and Behavioral Sciences|Sociology|Culture",,2019,https://api.osf.io/v2/preprints/w4e6s/contributors/,https://api.osf.io/v2/preprints/w4e6s/bibliographic_contributors/,https://api.osf.io/v2/preprints/w4e6s/citation/,w4e6s,preprints,https://api.osf.io/v2/preprints/w4e6s/identifiers/,https://api.osf.io/v2/preprints/w4e6s/relationships/node/,NA,NA,NA,https://api.osf.io/v2/licenses/563c1cf88c5e4a3877f9e96a/,563c1cf88c5e4a3877f9e96a,licenses,https://api.osf.io/v2/providers/preprints/socarxiv/,socarxiv,preprint-providers,https://api.osf.io/v2/preprints/w4e6s/files/,https://api.osf.io/v2/files/5cb4b949a3bc970018f2441d/,5cb4b949a3bc970018f2441d,files,https://api.osf.io/v2/preprints/w4e6s/review_actions/,https://api.osf.io/v2/preprints/w4e6s/requests/,https://api.osf.io/v2/preprints/w4e6s/,https://osf.io/preprints/socarxiv/w4e6s/,https://doi.org/10.31235/osf.io/w4e6s,https://doi.org/10.1093/esr/jcz023
g95pr,preprints,2019-04-15T14:38:50.414975,2020-07-16T21:14:58.397233,2019-04-16T17:19:39.880303,NA,NA,Communication networks do not explain the growth or survival of early-stage peer production projects,"Communication enables coordination and social integration in collaborative groups. In the contexts of work groups and teams, prior research finds that more dense and integrated communication structures support better performance. We explore the relationship between communication structure and group performance in a population of early-stage peer production wiki communities engaged in the collaborative production of shared information resources. We theorize that there is an especially strong need for coordination and social integration in small, newly formed online communities, and that communities with relatively more integrative communication networks will be more successful. We test this theory by measuring communication network structure and group outcomes in a population of 1,002 nascent wikis. Contrary to prior literature and our expectations, we find a very weak relationship between communication structure and collaborative performance. We suggest a number of explanations, including the role of shared artifacts in coordinating work and integrating newcomers.",TRUE,FALSE,,2019-04-16T17:20:02.598131,NA,,TRUE,accepted,2019-04-16T17:19:39.880303,NA,NA,NA,NA,,NA,NA,NA,NA,5a8c80f7c698300375c76d84|5a8c80f9c698300375c76e0d|5a8c80f9c698300375c76e15|Social and Behavioral Sciences|Communication|Organizational Communication,,2019,https://api.osf.io/v2/preprints/g95pr/contributors/,https://api.osf.io/v2/preprints/g95pr/bibliographic_contributors/,https://api.osf.io/v2/preprints/g95pr/citation/,g95pr,preprints,https://api.osf.io/v2/preprints/g95pr/identifiers/,https://api.osf.io/v2/preprints/g95pr/relationships/node/,NA,NA,NA,https://api.osf.io/v2/licenses/563c1cf88c5e4a3877f9e96a/,563c1cf88c5e4a3877f9e96a,licenses,https://api.osf.io/v2/providers/preprints/socarxiv/,socarxiv,preprint-providers,https://api.osf.io/v2/preprints/g95pr/files/,https://api.osf.io/v2/files/5cb49781f2be3c00160208dc/,5cb49781f2be3c00160208dc,files,https://api.osf.io/v2/preprints/g95pr/review_actions/,https://api.osf.io/v2/preprints/g95pr/requests/,https://api.osf.io/v2/preprints/g95pr/,https://osf.io/preprints/socarxiv/g95pr/,https://doi.org/10.31235/osf.io/g95pr,NA
z95sq,preprints,2019-04-15T09:35:27.678891,2020-07-08T16:16:44.276870,2019-04-16T17:34:23.924370,2019-01-10T23:00:00,NA,"Nazionalità, migrazione e apprendimenti in Italia: una comparazione  tra livelli scolastici [Ethnicity, Migration and educational achievement in Italy: a comparison across educational levels]","The chapter focus on the educational ethnic gap of children of immigrants in Italy. Previous studies mainly adopted a synchronic approach, implicitly assuming that the differences between students with and without a migration background, as well as mechanisms underlying these differences, are constant throughout the educational career. This hypothesis is empirically tested thanks to INVALSI data and a series of  four-levels random intercept regression models (student, class, school and province). Results indicate that the importance of contextual factors on the ethnic gap in achievements is marginal to the relevance of individual characteristics, and that children of immigrants underperform natives at each educational level. However, assessing the independent role of ethnicity on the one hand, and migration on the other, it emerges that: while the negative influence of the migration experience is strongest at higher grades, the effect of ethnicity changes from negative to positive during the educational career. The chapter discusses the mechanisms underlying the results and the possible implications in terms of social policies.",TRUE,FALSE,children of immigrants|educational achievement|educational career|ethnic penalty|italy|migration|second generations,2019-04-16T17:34:49.828777,NA,,TRUE,accepted,2019-04-16T17:34:23.924370,FALSE,NA,no,Data are available upon written request to INVALSI at: https://www.invalsi.it/invalsi/index.php,,NA,NA,NA,NA,5a8c80f7c698300375c76d84|5a8c80fac698300375c76e20|5a8c80fac698300375c76e26|Social and Behavioral Sciences|Sociology|Sociology of Education,,2019,https://api.osf.io/v2/preprints/z95sq/contributors/,https://api.osf.io/v2/preprints/z95sq/bibliographic_contributors/,https://api.osf.io/v2/preprints/z95sq/citation/,z95sq,preprints,https://api.osf.io/v2/preprints/z95sq/identifiers/,https://api.osf.io/v2/preprints/z95sq/relationships/node/,NA,NA,NA,https://api.osf.io/v2/licenses/5ad7979bc69830002d8190e3/,5ad7979bc69830002d8190e3,licenses,https://api.osf.io/v2/providers/preprints/socarxiv/,socarxiv,preprint-providers,https://api.osf.io/v2/preprints/z95sq/files/,https://api.osf.io/v2/files/5cb45063a3bc97001aefe2a0/,5cb45063a3bc97001aefe2a0,files,https://api.osf.io/v2/preprints/z95sq/review_actions/,https://api.osf.io/v2/preprints/z95sq/requests/,https://api.osf.io/v2/preprints/z95sq/,https://osf.io/preprints/socarxiv/z95sq/,https://doi.org/10.31235/osf.io/z95sq,NA
s5nvp,preprints,2019-04-14T22:19:35.776206,2020-07-16T21:15:10.529802,2019-04-15T01:57:19.233167,NA,NA,Commuter Couples and Careers: Moving Together for Him and Apart for Her,"Research on the migration patterns of couples has found that men's human capital has a larger impact than women's on family location choices, but an emerging qualitative literature shows that some couples avoid location-related tradeoffs between their careers by living apart. I propose a new method of identifying couples who live apart in the American Community Survey and use the method to construct the first nationally representative sample of matched noncohabiting husbands and wives. Consistent with previous research, I find that husbands' education has a larger impact than wives' on the probability that couples migrate together. In contrast, wives' education has a larger impact on the probability that couples live apart. I argue that family location choices are analogous to marital naming choices: husbands rarely accommodate wives, whatever their circumstances, but wives accommodate husbands unless the cost of accommodation is unusually high.",TRUE,FALSE,commuter couples|family migration|marital non-cohabitation,2019-04-15T01:57:50.836935,NA,,TRUE,accepted,2019-04-15T01:57:19.233167,NA,NA,NA,NA,,NA,NA,NA,NA,5a8c80f7c698300375c76d84|5a8c80f8c698300375c76dbe|Social and Behavioral Sciences|Economics|5a8c80f7c698300375c76d84|5a8c80fac698300375c76e20|Social and Behavioral Sciences|Sociology,,2019,https://api.osf.io/v2/preprints/s5nvp/contributors/,https://api.osf.io/v2/preprints/s5nvp/bibliographic_contributors/,https://api.osf.io/v2/preprints/s5nvp/citation/,s5nvp,preprints,https://api.osf.io/v2/preprints/s5nvp/identifiers/,https://api.osf.io/v2/preprints/s5nvp/relationships/node/,NA,NA,NA,https://api.osf.io/v2/licenses/563c1cf88c5e4a3877f9e96a/,563c1cf88c5e4a3877f9e96a,licenses,https://api.osf.io/v2/providers/preprints/socarxiv/,socarxiv,preprint-providers,https://api.osf.io/v2/preprints/s5nvp/files/,https://api.osf.io/v2/files/5cb3b1fd39926900190f3d84/,5cb3b1fd39926900190f3d84,files,https://api.osf.io/v2/preprints/s5nvp/review_actions/,https://api.osf.io/v2/preprints/s5nvp/requests/,https://api.osf.io/v2/preprints/s5nvp/,https://osf.io/preprints/socarxiv/s5nvp/,https://doi.org/10.31235/osf.io/s5nvp,NA
a9dc8,preprints,2019-04-14T22:00:22.880663,2019-04-15T01:56:51.869259,2019-04-15T01:56:29.725875,NA,NA,Living Far Apart Together: Dual-Career Location Constraints and Marital Noncohabitation,"For dual-career couples, ""two-body"" or ""co-location"" problems may put their relationships and careers in conflict. This paper uses data from the 2000 United States census to estimate the probability of non-cohabitation among married, college-educated workers and to examine the association between non-cohabitation and three proxies for career-related location constraint: education beyond college, the geographic mobility of workers in a person's occupation, and the geographic clustering of workers in the occupation. I find that non-cohabitation is unusual but not unknown among highly educated workers; the prevalence of non-cohabitation among all college-educated workers was 1.9 percent, and the prevalence was as high as 2.8 percent for women and 4.2 percent for men under 30. Consistent with the idea that some couples live apart to solve a dual-career location problem, I also find that non-cohabitation is more common among workers with higher levels of education and workers in occupations with high degrees of geographic clustering. Contrary to my expectations, however, I find that non-cohabitation is less prevalent among workers in occupations with high rates of geographic mobility.",TRUE,FALSE,commuter couples|family migration|marital noncohabitation,2019-04-15T01:56:51.847195,NA,,TRUE,accepted,2019-04-15T01:56:29.725875,NA,NA,NA,NA,,NA,NA,NA,NA,5a8c80f7c698300375c76d84|5a8c80f8c698300375c76dbe|Social and Behavioral Sciences|Economics|5a8c80f7c698300375c76d84|5a8c80fac698300375c76e20|Social and Behavioral Sciences|Sociology,,2019,https://api.osf.io/v2/preprints/a9dc8/contributors/,https://api.osf.io/v2/preprints/a9dc8/bibliographic_contributors/,https://api.osf.io/v2/preprints/a9dc8/citation/,a9dc8,preprints,https://api.osf.io/v2/preprints/a9dc8/identifiers/,https://api.osf.io/v2/preprints/a9dc8/relationships/node/,NA,NA,NA,https://api.osf.io/v2/licenses/563c1cf88c5e4a3877f9e96a/,563c1cf88c5e4a3877f9e96a,licenses,https://api.osf.io/v2/providers/preprints/socarxiv/,socarxiv,preprint-providers,https://api.osf.io/v2/preprints/a9dc8/files/,https://api.osf.io/v2/files/5cb3ad7af2be3c0017048a74/,5cb3ad7af2be3c0017048a74,files,https://api.osf.io/v2/preprints/a9dc8/review_actions/,https://api.osf.io/v2/preprints/a9dc8/requests/,https://api.osf.io/v2/preprints/a9dc8/,https://osf.io/preprints/socarxiv/a9dc8/,https://doi.org/10.31235/osf.io/a9dc8,NA
hgyqk,preprints,2019-04-14T20:15:16.211807,2019-04-15T02:02:02.139816,2019-04-15T02:01:37.022598,2019-04-12T22:00:00,NA,Tópicos emergentes en la formación de cuidadores de mayores,"El aumento de la longevidad supone el desarrollo de nuevas profesiones así como la actualización de otras. Los cuidadores de personas mayores necesitan revisar los contenidos en que formarse. El proyecto EldiCare que se está desarrollando actualmente, ha solicitado la identificación de los tópicos que están emergiendo en la formación de cuidadores. Con esta finalidad, se ha llevado a cabo un análisis cienciométrico, así como una clasificación mediante análisis jerárquico lineal, de los proyectos europeos centrados en el tema recogidos en la base CORDIS, así como de las publicaciones registradas en SCOPUS. Los resultados muestran que el principal tema emergente en los últimos años es la tecnología.",TRUE,FALSE,Adultos mayores|Cuidadores|Erasmus+|Formación|Minería de textos,2019-04-15T02:02:02.092742,NA,,TRUE,accepted,2019-04-15T02:01:37.022598,NA,NA,NA,NA,,NA,NA,NA,NA,5a8c80f6c698300375c76d4e|5a8c80f7c698300375c76d63|Education|Curriculum and Instruction,,2019,https://api.osf.io/v2/preprints/hgyqk/contributors/,https://api.osf.io/v2/preprints/hgyqk/bibliographic_contributors/,https://api.osf.io/v2/preprints/hgyqk/citation/,hgyqk,preprints,https://api.osf.io/v2/preprints/hgyqk/identifiers/,https://api.osf.io/v2/preprints/hgyqk/relationships/node/,https://api.osf.io/v2/nodes/utmj9/,utmj9,nodes,https://api.osf.io/v2/licenses/563c1cf88c5e4a3877f9e96a/,563c1cf88c5e4a3877f9e96a,licenses,https://api.osf.io/v2/providers/preprints/socarxiv/,socarxiv,preprint-providers,https://api.osf.io/v2/preprints/hgyqk/files/,https://api.osf.io/v2/files/5cb394d7f2be3c0016015ebf/,5cb394d7f2be3c0016015ebf,files,https://api.osf.io/v2/preprints/hgyqk/review_actions/,https://api.osf.io/v2/preprints/hgyqk/requests/,https://api.osf.io/v2/preprints/hgyqk/,https://osf.io/preprints/socarxiv/hgyqk/,https://doi.org/10.31235/osf.io/hgyqk,NA
n6fgp,preprints,2019-04-13T20:47:32.666775,2019-05-14T19:31:09.761202,2019-04-15T01:54:52.775332,NA,NA,Standing out and Sorting in: Exploring the Role of Racial Composition in Racial Disparities in Special Education,"Schools differentially sort students into special education by race, though researchers debate the extent to which this is caused by racist school practices versus variation in student need due to other racial inequalities. I test the interaction between school-level racial composition and student-level race as a predictor of special education receipt. I find that as the proportion of White students increases, the risk of lower-status disabilities, such as intellectual disability, increases for Black, Latinx, and Native American students. As the proportion of White students decreases, White students’ risk of higher status disabilities, such as speech/language impairment, increases relative to students of color. Thus, in the context of racial distinctiveness, student race becomes salient to sorting into special education.",TRUE,FALSE,disability|race|racial composition|special education,2019-04-15T01:55:03.242486,NA,,TRUE,accepted,2019-04-15T01:54:52.775332,NA,NA,NA,NA,,NA,NA,NA,NA,5a8c80f7c698300375c76d84|5a8c80fac698300375c76e20|5a8c80fac698300375c76e26|Social and Behavioral Sciences|Sociology|Sociology of Education,Rachel Fish,2019,https://api.osf.io/v2/preprints/n6fgp/contributors/,https://api.osf.io/v2/preprints/n6fgp/bibliographic_contributors/,https://api.osf.io/v2/preprints/n6fgp/citation/,n6fgp,preprints,https://api.osf.io/v2/preprints/n6fgp/identifiers/,https://api.osf.io/v2/preprints/n6fgp/relationships/node/,NA,NA,NA,https://api.osf.io/v2/licenses/563c1cf88c5e4a3877f9e965/,563c1cf88c5e4a3877f9e965,licenses,https://api.osf.io/v2/providers/preprints/socarxiv/,socarxiv,preprint-providers,https://api.osf.io/v2/preprints/n6fgp/files/,https://api.osf.io/v2/files/5cb24aeb39926900181100a7/,5cb24aeb39926900181100a7,files,https://api.osf.io/v2/preprints/n6fgp/review_actions/,https://api.osf.io/v2/preprints/n6fgp/requests/,https://api.osf.io/v2/preprints/n6fgp/,https://osf.io/preprints/socarxiv/n6fgp/,https://doi.org/10.31235/osf.io/n6fgp,NA
