id,type,attributes.date_created,attributes.date_modified,attributes.date_published,attributes.original_publication_date,attributes.doi,attributes.title,attributes.description,attributes.is_published,attributes.is_preprint_orphan,attributes.tags,attributes.preprint_doi_created,attributes.date_withdrawn,attributes.current_user_permissions,attributes.public,attributes.reviews_state,attributes.date_last_transitioned,attributes.has_coi,attributes.conflict_of_interest_statement,attributes.has_data_links,attributes.why_no_data,attributes.data_links,attributes.has_prereg_links,attributes.why_no_prereg,attributes.prereg_links,attributes.prereg_link_info,attributes.subjects,attributes.license_record.copyright_holders,attributes.license_record.year,relationships.contributors.links.related.href,relationships.bibliographic_contributors.links.related.href,relationships.citation.links.related.href,relationships.citation.data.id,relationships.citation.data.type,relationships.identifiers.links.related.href,relationships.node.links.self.href,relationships.node.links.related.href,relationships.node.data.id,relationships.node.data.type,relationships.license.links.related.href,relationships.license.data.id,relationships.license.data.type,relationships.provider.links.related.href,relationships.provider.data.id,relationships.provider.data.type,relationships.files.links.related.href,relationships.primary_file.links.related.href,relationships.primary_file.data.id,relationships.primary_file.data.type,relationships.review_actions.links.related.href,relationships.requests.links.related.href,links.self,links.html,links.doi,links.preprint_doi
axdv3,preprints,2019-09-06T07:43:06.938734,2020-02-10T11:22:21.606477,2019-09-06T15:27:36.563948,2019-09-05T22:00:00,10.1017/asr.2019.59,"The Role of Islam, Ajami writings and educational reform in Sulemaana Kantè's N'ko","The written words of African Muslims have recently received renewed attention. This stems from a push to go beyond colonial archives as well as concerns with terrorism and Islamic radicalization. While Ajami—that is, writing African languages in Arabic-script—has been a part of this trend, Manding-language publications in the N’ko script have been overlooked. And yet, this literary industry is distinctly Islamic. Putting the writings of Sulemaana Kantè into conversation with historical authors and his contemporaries, Donaldson demonstrates that N’ko represents an iteration of Afro-Muslim vernacular thought. He thereby illuminates Kantè and a body of N’ko and Ajami publications.",TRUE,FALSE,Ajami|Manding|N'ko|Sulemaana Kantè|West Africa,2019-09-06T15:28:03.502836,NA,,TRUE,accepted,2019-09-06T15:27:36.563948,NA,NA,NA,NA,,NA,NA,,NA,5a8c80f2c698300375c76c7d|5a8c80f3c698300375c76c99|Arts and Humanities|African Languages and Societies|5a8c80f7c698300375c76d84|5a8c80f9c698300375c76df6|5a8c80f9c698300375c76df9|Social and Behavioral Sciences|Anthropology|Linguistic Anthropology,,2019,https://api.osf.io/v2/preprints/axdv3/contributors/,https://api.osf.io/v2/preprints/axdv3/bibliographic_contributors/,https://api.osf.io/v2/preprints/axdv3/citation/,axdv3,preprints,https://api.osf.io/v2/preprints/axdv3/identifiers/,https://api.osf.io/v2/preprints/axdv3/relationships/node/,NA,NA,NA,https://api.osf.io/v2/licenses/563c1cf88c5e4a3877f9e96a/,563c1cf88c5e4a3877f9e96a,licenses,https://api.osf.io/v2/providers/preprints/socarxiv/,socarxiv,preprint-providers,https://api.osf.io/v2/preprints/axdv3/files/,https://api.osf.io/v2/files/5d720e188bde9400196309f9/,5d720e188bde9400196309f9,files,https://api.osf.io/v2/preprints/axdv3/review_actions/,https://api.osf.io/v2/preprints/axdv3/requests/,https://api.osf.io/v2/preprints/axdv3/,https://osf.io/preprints/socarxiv/axdv3/,https://doi.org/10.1017/asr.2019.59,https://doi.org/10.31235/osf.io/axdv3
fmu7d,preprints,2019-09-06T07:13:52.769075,2020-02-24T00:18:47.106138,2019-09-06T15:23:41.496117,NA,NA,A story of how a climate change sceptic politician changed their mind,"Inherent in deliberative democracy is the possibility of individuals changing their position on an issue in response to persuasive communication. This is a case study of how a person in a position of power changed their mind about climate change in response to deliberations, then used their position to put on record their thought processes in changing mind. Reactions to the public announcement are explored, as are factors contributing to the change of mind and decision to publicly speak about it. Power dynamics that enabled the public discussion of changing mind are also discussed.",TRUE,FALSE,climate change|climate change consensus|climate denialism|deliberative democracy|political communication|public deliberation|science communication,2019-09-06T15:24:03.742269,NA,,TRUE,accepted,2019-09-06T15:23:41.496117,NA,NA,NA,NA,,NA,NA,,NA,"5a8c80f7c698300375c76d84|5a8c80f8c698300375c76daf|5a8c80f8c698300375c76db4|Social and Behavioral Sciences|Political Science|Political Theory|5a8c80f7c698300375c76d84|5a8c80f8c698300375c76ddb|5a8c80f9c698300375c76ded|Social and Behavioral Sciences|Public Affairs, Public Policy and Public Administration|Science and Technology Policy|5a8c80f7c698300375c76d84|5a8c80f8c698300375c76ddb|5a8c80f9c698300375c76dee|Social and Behavioral Sciences|Public Affairs, Public Policy and Public Administration|Emergency and Disaster Management|5a8c80f7c698300375c76d84|5a8c80f8c698300375c76ddb|5a8c80f9c698300375c76df0|Social and Behavioral Sciences|Public Affairs, Public Policy and Public Administration|Environmental Policy|5a8c80f7c698300375c76d84|5a8c80f9c698300375c76df4|Social and Behavioral Sciences|Science and Technology Studies|5a8c80f7c698300375c76d84|5a8c80f9c698300375c76e0d|Social and Behavioral Sciences|Communication|5a8c80f7c698300375c76d84|5a8c80fac698300375c76e20|5a8c80fac698300375c76e2f|Social and Behavioral Sciences|Sociology|Environmental Sociology|5a8c80f7c698300375c76d84|5a8c80fac698300375c76e20|5a8c80fac698300375c76e34|Social and Behavioral Sciences|Sociology|Communication, Information Technologies, and Media Sociology|5a8c80f7c698300375c76d84|5a8c80fac698300375c76e20|5a8c80fac698300375c76e3f|Social and Behavioral Sciences|Sociology|Political Sociology",,2019,https://api.osf.io/v2/preprints/fmu7d/contributors/,https://api.osf.io/v2/preprints/fmu7d/bibliographic_contributors/,https://api.osf.io/v2/preprints/fmu7d/citation/,fmu7d,preprints,https://api.osf.io/v2/preprints/fmu7d/identifiers/,https://api.osf.io/v2/preprints/fmu7d/relationships/node/,https://api.osf.io/v2/nodes/bsa7y/,bsa7y,nodes,https://api.osf.io/v2/licenses/563c1cf88c5e4a3877f9e96a/,563c1cf88c5e4a3877f9e96a,licenses,https://api.osf.io/v2/providers/preprints/socarxiv/,socarxiv,preprint-providers,https://api.osf.io/v2/preprints/fmu7d/files/,https://api.osf.io/v2/files/5d72073501a9f9001750e3c5/,5d72073501a9f9001750e3c5,files,https://api.osf.io/v2/preprints/fmu7d/review_actions/,https://api.osf.io/v2/preprints/fmu7d/requests/,https://api.osf.io/v2/preprints/fmu7d/,https://osf.io/preprints/socarxiv/fmu7d/,NA,https://doi.org/10.31235/osf.io/fmu7d
f6whm,preprints,2019-09-06T01:56:43.108072,2019-11-13T05:42:59.346024,2019-09-06T15:22:28.453737,NA,NA,"Once bitten, twice shy: An exploratory study of victim impact from and adoption of self-protective behaviours against cyber abuse","Crime can have a significant and long-lasting effect on its victims. While the literature on victim impact from traditional types of crime like robbery or assault is well established, little of the published research examining the impact of online crime like cyber abuse. The current paper examines victim impact and self-protective behaviours following victimization from different types of cyber abuse. Using the data from a large sample of American adults (N = 1,463) we identified the factors predictive of higher victim impact and adoption of self-protective behaviours, modelling the data using a Bayesian variable selection procedure implemented via a stochastic search algorithm in AutoStat\textregistered. Our findings suggest that controlling for socio-demographic characteristics such as age, gender, race and employment, different types of cyber abuse are important explanations of both victim impact and self-protective behaviours following cyber abuse victimization. Findings from this study contribute to both our understanding of cyber abuse as a broad crime category, the mechanism of adoption self-protective behaviours following victimization, as well as help inform policy responses to the needs of cyber abuse victims.",TRUE,FALSE,,2019-09-06T15:22:45.612980,NA,,TRUE,accepted,2019-09-06T15:22:28.453737,NA,NA,NA,NA,,NA,NA,,NA,"5a8c80f7c698300375c76d84|5a8c80fac698300375c76e20|5a8c80fac698300375c76e2b|Social and Behavioral Sciences|Sociology|Crime, Law, and Deviance",,2019,https://api.osf.io/v2/preprints/f6whm/contributors/,https://api.osf.io/v2/preprints/f6whm/bibliographic_contributors/,https://api.osf.io/v2/preprints/f6whm/citation/,f6whm,preprints,https://api.osf.io/v2/preprints/f6whm/identifiers/,https://api.osf.io/v2/preprints/f6whm/relationships/node/,NA,NA,NA,https://api.osf.io/v2/licenses/563c1cf88c5e4a3877f9e96a/,563c1cf88c5e4a3877f9e96a,licenses,https://api.osf.io/v2/providers/preprints/socarxiv/,socarxiv,preprint-providers,https://api.osf.io/v2/preprints/f6whm/files/,https://api.osf.io/v2/files/5d71bcde01a9f9001a508635/,5d71bcde01a9f9001a508635,files,https://api.osf.io/v2/preprints/f6whm/review_actions/,https://api.osf.io/v2/preprints/f6whm/requests/,https://api.osf.io/v2/preprints/f6whm/,https://osf.io/preprints/socarxiv/f6whm/,NA,https://doi.org/10.31235/osf.io/f6whm
3bh6t,preprints,2019-09-05T19:34:03.349105,2019-09-06T15:22:06.854656,2019-09-06T15:21:27.833730,NA,NA,"Factors Associated with an Unmet Need for Contraception in the United States, 2002-2017","This study investigates the association between individual-level characteristics and the risk of having an unmet need for contraception in the United States between 2002 and 2017 for women who were sexually active, not pregnant or postpartum, fecund, and wanted no more children. Using data from the National Survey of Family Growth, logistic regression models are used to estimate the association between demographic, socioeconomic, and reproductive characteristics and the probability of having an unmet need for any contraception and for modern methods.  The results show that 6.8% of the women at risk did not use any form of contraception and 12.1% did not use any modern method. Women who were black, Catholic, insured by Medicaid or uninsured, nulliparous, and who had not used contraception at their first sex had the greatest odds of having an unmet need, suggesting that specific groups are disproportionately vulnerable to unwanted pregnancy in the United States.",TRUE,FALSE,contraception|inequality|United States,2019-09-06T15:22:06.810138,NA,,TRUE,accepted,2019-09-06T15:21:27.833730,NA,NA,NA,NA,,NA,NA,,NA,5a8c80f7c698300375c76d84|5a8c80fac698300375c76e20|5a8c80fac698300375c76e3e|Social and Behavioral Sciences|Sociology|Population,,2019,https://api.osf.io/v2/preprints/3bh6t/contributors/,https://api.osf.io/v2/preprints/3bh6t/bibliographic_contributors/,https://api.osf.io/v2/preprints/3bh6t/citation/,3bh6t,preprints,https://api.osf.io/v2/preprints/3bh6t/identifiers/,https://api.osf.io/v2/preprints/3bh6t/relationships/node/,NA,NA,NA,https://api.osf.io/v2/licenses/563c1cf88c5e4a3877f9e96a/,563c1cf88c5e4a3877f9e96a,licenses,https://api.osf.io/v2/providers/preprints/socarxiv/,socarxiv,preprint-providers,https://api.osf.io/v2/preprints/3bh6t/files/,https://api.osf.io/v2/files/5d7163307215100019a47d39/,5d7163307215100019a47d39,files,https://api.osf.io/v2/preprints/3bh6t/review_actions/,https://api.osf.io/v2/preprints/3bh6t/requests/,https://api.osf.io/v2/preprints/3bh6t/,https://osf.io/preprints/socarxiv/3bh6t/,NA,https://doi.org/10.31235/osf.io/3bh6t
qzmf8,preprints,2019-09-05T15:45:49.668459,2019-12-17T10:20:33.561507,2019-09-06T15:20:15.938256,2019-09-04T22:00:00,NA,Decentralising the Patent System,"This paper proposes a substantive re-think of the modern patent system. The patent system has come under intensive criticism in the past, and many scholars have proposed ways to improve it. Ideas for improvement include, e.g., prior-art bounties, contracting out examination and dynamic fee setting. However, many of these ideas have gone unheeded due to the cost of administering them and the rigidity of the patent system. We explore how distributed ledger technologies enable these major changes.",TRUE,FALSE,blockchain|distributed ledger|intellectual property|patent|smart contract,2019-09-06T15:21:06.719471,NA,,TRUE,accepted,2019-09-06T15:20:15.938256,NA,NA,NA,NA,,NA,NA,,NA,"5a8c80f0c698300375c76c07|5a8c80f2c698300375c76c4e|Law|Intellectual Property Law|5a8c80f7c698300375c76d84|5a8c80f8c698300375c76ddb|5a8c80f9c698300375c76ded|Social and Behavioral Sciences|Public Affairs, Public Policy and Public Administration|Science and Technology Policy|5a8c80f7c698300375c76d84|5a8c80f9c698300375c76df4|Social and Behavioral Sciences|Science and Technology Studies",,2019,https://api.osf.io/v2/preprints/qzmf8/contributors/,https://api.osf.io/v2/preprints/qzmf8/bibliographic_contributors/,https://api.osf.io/v2/preprints/qzmf8/citation/,qzmf8,preprints,https://api.osf.io/v2/preprints/qzmf8/identifiers/,https://api.osf.io/v2/preprints/qzmf8/relationships/node/,NA,NA,NA,https://api.osf.io/v2/licenses/563c1cf88c5e4a3877f9e96a/,563c1cf88c5e4a3877f9e96a,licenses,https://api.osf.io/v2/providers/preprints/socarxiv/,socarxiv,preprint-providers,https://api.osf.io/v2/preprints/qzmf8/files/,https://api.osf.io/v2/files/5d712db0536cf500188a24bb/,5d712db0536cf500188a24bb,files,https://api.osf.io/v2/preprints/qzmf8/review_actions/,https://api.osf.io/v2/preprints/qzmf8/requests/,https://api.osf.io/v2/preprints/qzmf8/,https://osf.io/preprints/socarxiv/qzmf8/,NA,https://doi.org/10.31235/osf.io/qzmf8
hbj9k,preprints,2019-09-05T04:06:57.630687,2019-09-05T15:35:23.495518,2019-09-05T15:34:55.831679,2015-09-05T04:00:00,NA,"The Intersection of Race and Gender in Leadership of Cooperatives in North America: Of whom, By whom, and For whom?","This paper describes the intersection of class, gender and race in the leadership of cooperatives in North America. Movement of labour across North American borders changes the membership of cooperatives as well as the leadership and formation of cooperatives.  The socio-economic shifts that affect cooperatives are also accompanied by marginalization of particular populations, including Indigenous communities and racial minorities. International cooperative principles remain ideals to aspire to rather than a reality in practice. Although women and racial minorities have made some advances in equity in cooperatives, racialized women in particular are not represented in leadership positions in cooperatives in proportion to membership in the broader population. On an optimistic note, cooperatives continue to be more egalitarian organizations than other types of organizations and therefore have the potential for leading as positive role models, addressing the intersection of gender and race for other organizations to follow.  Women leading cooperatives will form different types of cooperatives than men leading cooperatives in the same industry.  Additionally women of colour leading cooperatives will form different types of organizations than traditional cooperatives, providing for enriched plurality of organizational forms required for addressing complex socio-economic problems.",TRUE,FALSE,Canada|Cooperatives|Culture|El Salvador|Ethnicity|Gender|Guatemala|Immigrant|Indigenous|Mexico|Neoliberalism|Nicaraguua|Organizational Behavior|Race|United States|Women,2019-09-05T15:35:23.375313,NA,,TRUE,accepted,2019-09-05T15:34:55.831679,NA,NA,NA,NA,,NA,NA,,NA,5a8c80f7c698300375c76d84|5a8c80f9c698300375c76e1f|Social and Behavioral Sciences|Organization Development,Journal of Co-operative Studies,2015,https://api.osf.io/v2/preprints/hbj9k/contributors/,https://api.osf.io/v2/preprints/hbj9k/bibliographic_contributors/,https://api.osf.io/v2/preprints/hbj9k/citation/,hbj9k,preprints,https://api.osf.io/v2/preprints/hbj9k/identifiers/,https://api.osf.io/v2/preprints/hbj9k/relationships/node/,NA,NA,NA,https://api.osf.io/v2/licenses/563c1cf88c5e4a3877f9e965/,563c1cf88c5e4a3877f9e965,licenses,https://api.osf.io/v2/providers/preprints/socarxiv/,socarxiv,preprint-providers,https://api.osf.io/v2/preprints/hbj9k/files/,https://api.osf.io/v2/files/5d7089e95a289c001c4a6ba6/,5d7089e95a289c001c4a6ba6,files,https://api.osf.io/v2/preprints/hbj9k/review_actions/,https://api.osf.io/v2/preprints/hbj9k/requests/,https://api.osf.io/v2/preprints/hbj9k/,https://osf.io/preprints/socarxiv/hbj9k/,NA,https://doi.org/10.31235/osf.io/hbj9k
2qvjb,preprints,2019-09-04T22:04:32.186231,2019-09-05T15:33:01.779013,2019-09-05T15:32:38.425986,NA,NA,Social tariffs and democratic choice – do population-based health state values reflect the will of the people?,"In economic evaluations of health technologies, health outcomes are commonly measured in terms of QALYs. QALYs are the product of time and health-related quality of life. Health-related quality of life, in turn, is determined by a social tariff, which is supposed to reflect the public’s preference over health states. This paper argues that, because of the tariff’s role in the societal decision making process, it should not be understood as merely a statistical model, but as a major instrument of democratic participation. I outline what implications this might have for both the method used to aggregate individual preferences, and the set of individuals whose preferences should count. Alternative tariff specifications are explored, and future research directions are proposed.",TRUE,FALSE,conceptual model|decision making|democracy|health state|normative theory|QALY|social choice|social tariff|valuation,2019-09-05T15:33:01.752943,NA,,TRUE,accepted,2019-09-05T15:32:38.425986,NA,NA,NA,NA,,NA,NA,,NA,5a8c80f7c698300375c76d84|5a8c80f8c698300375c76dbe|5a8c80f8c698300375c76dcd|Social and Behavioral Sciences|Economics|Health Economics,,2019,https://api.osf.io/v2/preprints/2qvjb/contributors/,https://api.osf.io/v2/preprints/2qvjb/bibliographic_contributors/,https://api.osf.io/v2/preprints/2qvjb/citation/,2qvjb,preprints,https://api.osf.io/v2/preprints/2qvjb/identifiers/,https://api.osf.io/v2/preprints/2qvjb/relationships/node/,NA,NA,NA,https://api.osf.io/v2/licenses/563c1cf88c5e4a3877f9e96a/,563c1cf88c5e4a3877f9e96a,licenses,https://api.osf.io/v2/providers/preprints/socarxiv/,socarxiv,preprint-providers,https://api.osf.io/v2/preprints/2qvjb/files/,https://api.osf.io/v2/files/5d7034f4536cf500188985c1/,5d7034f4536cf500188985c1,files,https://api.osf.io/v2/preprints/2qvjb/review_actions/,https://api.osf.io/v2/preprints/2qvjb/requests/,https://api.osf.io/v2/preprints/2qvjb/,https://osf.io/preprints/socarxiv/2qvjb/,NA,https://doi.org/10.31235/osf.io/2qvjb
6r3ym,preprints,2019-09-04T21:46:24.543791,2021-03-16T01:17:13.607984,2019-09-05T15:31:47.450804,NA,NA,Change We Can Believe In: Structural and Content Dynamics within Belief Networks,"Presumably, network analysis supplies an analytical framework for exploring the empirical properties of ideology. This manuscript incorporates two important, though ignored features in past research by inves- tigating how time shapes the properties of belief networks for different populations of people – those who exhibit high and low levels of political knowledge. Subsequent analysis produces several findings: (1) belief network density increases asymmetrically among people with high relative to low knowledge; (2) symbolic preferences are always more central to belief networks irrespective of survey timing or popula- tion; in contrast, policy beliefs exhibit some increase in centrality over time among the politically knowl- edgeable; and, (3) centrality does not predict variance within standard parametric models. This latter finding, in particular, presents problems for describing belief networks using the vernacular of Conversian belief systems – a disconnect that seems grounded in the mismatch between Converse’s individual-level theory and network analysis’ population-based properties.",TRUE,FALSE,ANES|belief networks|centrality|ideology|panel data|political psychology,2019-09-05T15:32:02.174668,NA,,TRUE,accepted,2019-09-05T15:31:47.450804,NA,NA,available,NA,https://electionstudies.org/data-center/,no,(no preregistration),,,5a8c80f7c698300375c76d84|5a8c80f7c698300375c76d98|5a8c80f8c698300375c76dac|Social and Behavioral Sciences|Psychology|Other Psychology|5a8c80f7c698300375c76d84|5a8c80f8c698300375c76daf|5a8c80f8c698300375c76db3|Social and Behavioral Sciences|Political Science|Other Political Science|5a8c80f7c698300375c76d84|5a8c80f8c698300375c76daf|5a8c80f8c698300375c76db5|Social and Behavioral Sciences|Political Science|American Politics,,2019,https://api.osf.io/v2/preprints/6r3ym/contributors/,https://api.osf.io/v2/preprints/6r3ym/bibliographic_contributors/,https://api.osf.io/v2/preprints/6r3ym/citation/,6r3ym,preprints,https://api.osf.io/v2/preprints/6r3ym/identifiers/,https://api.osf.io/v2/preprints/6r3ym/relationships/node/,https://api.osf.io/v2/nodes/qhaxb/,qhaxb,nodes,https://api.osf.io/v2/licenses/563c1cf88c5e4a3877f9e96a/,563c1cf88c5e4a3877f9e96a,licenses,https://api.osf.io/v2/providers/preprints/socarxiv/,socarxiv,preprint-providers,https://api.osf.io/v2/preprints/6r3ym/files/,https://api.osf.io/v2/files/5d7030c45a289c00194a8a3b/,5d7030c45a289c00194a8a3b,files,https://api.osf.io/v2/preprints/6r3ym/review_actions/,https://api.osf.io/v2/preprints/6r3ym/requests/,https://api.osf.io/v2/preprints/6r3ym/,https://osf.io/preprints/socarxiv/6r3ym/,NA,https://doi.org/10.31235/osf.io/6r3ym
dfex5,preprints,2019-09-04T19:00:53.569002,2019-09-04T19:53:22.378358,2019-09-04T19:52:58.988131,NA,10.1111/1745-9133.12431,The Politics of Correctional Privatization in the United States,"Research Summary: Private correctional firms are political actors. They work to create favorable conditions to market their services. At the same time, they are constrained by external political forces, including political parties, social movements, and public opinion. This article reviews what we know about the reciprocal relationship between the private corrections industry and politics. 
Policy Implications: The review of extant research yields several implications for practitioners and policymakers. First, correctional privatization is not uniformly accepted, a fact that presents challenges for the industry and opportunities for critics. Second, punitive policies that appear beneficial to industry (particularly, those related to tough immigration policy) may in fact pose real reputational risks. Third, new forms of privatization—namely, social impact bonds—may prove more tolerable to the general public. Finally, consideration of political activity by private industry should not distract from political activity by public sector actors (e.g., prison guard unions).",TRUE,FALSE,immigration|politics|private prisons|privatization|public policy,2019-09-04T19:53:22.343126,NA,,TRUE,accepted,2019-09-04T19:52:58.988131,NA,NA,NA,NA,,NA,NA,,NA,"5a8c80f7c698300375c76d84|5a8c80f8c698300375c76ddb|5a8c80f9c698300375c76deb|Social and Behavioral Sciences|Public Affairs, Public Policy and Public Administration|Public Policy|5a8c80f7c698300375c76d84|5a8c80fac698300375c76e20|Social and Behavioral Sciences|Sociology",,2019,https://api.osf.io/v2/preprints/dfex5/contributors/,https://api.osf.io/v2/preprints/dfex5/bibliographic_contributors/,https://api.osf.io/v2/preprints/dfex5/citation/,dfex5,preprints,https://api.osf.io/v2/preprints/dfex5/identifiers/,https://api.osf.io/v2/preprints/dfex5/relationships/node/,https://api.osf.io/v2/nodes/wzrpq/,wzrpq,nodes,https://api.osf.io/v2/licenses/563c1cf88c5e4a3877f9e96a/,563c1cf88c5e4a3877f9e96a,licenses,https://api.osf.io/v2/providers/preprints/socarxiv/,socarxiv,preprint-providers,https://api.osf.io/v2/preprints/dfex5/files/,https://api.osf.io/v2/files/5d7009ea7215100019a2cd2b/,5d7009ea7215100019a2cd2b,files,https://api.osf.io/v2/preprints/dfex5/review_actions/,https://api.osf.io/v2/preprints/dfex5/requests/,https://api.osf.io/v2/preprints/dfex5/,https://osf.io/preprints/socarxiv/dfex5/,https://doi.org/10.1111/1745-9133.12431,https://doi.org/10.31235/osf.io/dfex5
