id,type,attributes.date_created,attributes.date_modified,attributes.date_published,attributes.original_publication_date,attributes.doi,attributes.title,attributes.description,attributes.is_published,attributes.is_preprint_orphan,attributes.tags,attributes.preprint_doi_created,attributes.date_withdrawn,attributes.current_user_permissions,attributes.public,attributes.reviews_state,attributes.date_last_transitioned,attributes.has_coi,attributes.conflict_of_interest_statement,attributes.has_data_links,attributes.why_no_data,attributes.data_links,attributes.has_prereg_links,attributes.why_no_prereg,attributes.prereg_links,attributes.prereg_link_info,attributes.subjects,attributes.license_record.copyright_holders,attributes.license_record.year,relationships.contributors.links.related.href,relationships.bibliographic_contributors.links.related.href,relationships.citation.links.related.href,relationships.citation.data.id,relationships.citation.data.type,relationships.identifiers.links.related.href,relationships.node.links.self.href,relationships.license.links.related.href,relationships.license.data.id,relationships.license.data.type,relationships.provider.links.related.href,relationships.provider.data.id,relationships.provider.data.type,relationships.files.links.related.href,relationships.primary_file.links.related.href,relationships.primary_file.data.id,relationships.primary_file.data.type,relationships.review_actions.links.related.href,relationships.requests.links.related.href,links.self,links.html,links.doi,links.preprint_doi
yqw6v,preprints,2019-09-03T22:09:07.302951,2019-09-04T02:36:45.703236,2019-09-04T02:36:28.551575,NA,10.24093/awejtls/vol3no3.11,Orientalism in Children’s Literature: Representations of Egyptian and Jordanian Families in Elsa Marston’s Stories,"Children’s literature plays a significant role in people’s lives. For children and young adults, a story is a discursive space where they find answers, solutions, and ideas. Contrastingly, to adult writers, it is a space dedicated to promoting ideological beliefs and values to young readers. Thus, this study attempts to investigate the problematic representation of Arab city and village families found in two children stories written by American author Elsa Marston (1933-2017). She classifies families into two opposing extremes; the civilized city families and the poor, conservative village families. Using Edward Said’s Orientalist discourse analysis, alongside David Spurr’s rhetorical trope of Classification, the researcher explores how and why Jordanian and Egyptian families are classified with disregard to cultural differences. The analysis reveals that Arab families, both Jordanian and Egyptian, are equally classified based on education, social class, and culture. City families are viewed as developed due to their interaction with the west, whereas village families are portrayed as ignorant and uncivilized for their lack of communication with the west. The analysis also detects the author’s negative attitude towards village families.",TRUE,FALSE,children’s literature|colonial enterprise|Egyptian families|Elsa Marston|Jordanian families|orientalism|representation,2019-09-04T02:36:45.689130,NA,,TRUE,accepted,2019-09-04T02:36:28.551575,NA,NA,NA,NA,NA,NA,NA,NA,NA,5a8c80f2c698300375c76c7d|5a8c80f5c698300375c76d10|Arts and Humanities|English Language and Literature,,2019,https://api.osf.io/v2/preprints/yqw6v/contributors/,https://api.osf.io/v2/preprints/yqw6v/bibliographic_contributors/,https://api.osf.io/v2/preprints/yqw6v/citation/,yqw6v,preprints,https://api.osf.io/v2/preprints/yqw6v/identifiers/,https://api.osf.io/v2/preprints/yqw6v/relationships/node/,https://api.osf.io/v2/licenses/563c1cf88c5e4a3877f9e96a/,563c1cf88c5e4a3877f9e96a,licenses,https://api.osf.io/v2/providers/preprints/socarxiv/,socarxiv,preprint-providers,https://api.osf.io/v2/preprints/yqw6v/files/,https://api.osf.io/v2/files/5d6ee4887215100019a1a3b8/,5d6ee4887215100019a1a3b8,files,https://api.osf.io/v2/preprints/yqw6v/review_actions/,https://api.osf.io/v2/preprints/yqw6v/requests/,https://api.osf.io/v2/preprints/yqw6v/,https://osf.io/preprints/socarxiv/yqw6v/,https://doi.org/10.24093/awejtls/vol3no3.11,https://doi.org/10.31235/osf.io/yqw6v
8t7vb,preprints,2019-09-03T22:05:02.635302,2019-09-04T02:37:25.275827,2019-09-04T02:37:02.373118,NA,10.24093/awejtls/vol3no3.10,Translation Challenges of Arabic Built-in-Language Repetition into English,"The present paper investigates Arabic built-in-language repetition that the researchers select from speeches delivered by the late president of Egypt Jamal Abdul Nasser, and the frequency of this phenomenon. The sample consists of 16 examples taken from chosen speeches. To ensure maximum accuracy, the researcher enlists the help of a professional translator to translate the study’s samples. The study aims at detecting and shedding some light on translation’s problems that the translator face when translating political texts. The results of the study indicate that built-in-language repetition exists in the Arabic translated text, and the use of repetition, in general, is more frequent in Arabic. The results also suggest that the translator should be fully aware of the Arabic and English linguistic systems as well as its culture to be able to convey the proper meaning.",TRUE,FALSE,built-in-language repetition|political discourse|problems,2019-09-04T02:37:25.258297,NA,,TRUE,accepted,2019-09-04T02:37:02.373118,NA,NA,NA,NA,NA,NA,NA,NA,NA,5a8c80f2c698300375c76c7d|5a8c80f5c698300375c76d10|Arts and Humanities|English Language and Literature,,2019,https://api.osf.io/v2/preprints/8t7vb/contributors/,https://api.osf.io/v2/preprints/8t7vb/bibliographic_contributors/,https://api.osf.io/v2/preprints/8t7vb/citation/,8t7vb,preprints,https://api.osf.io/v2/preprints/8t7vb/identifiers/,https://api.osf.io/v2/preprints/8t7vb/relationships/node/,https://api.osf.io/v2/licenses/563c1cf88c5e4a3877f9e96a/,563c1cf88c5e4a3877f9e96a,licenses,https://api.osf.io/v2/providers/preprints/socarxiv/,socarxiv,preprint-providers,https://api.osf.io/v2/preprints/8t7vb/files/,https://api.osf.io/v2/files/5d6ee393536cf5001a8d0cd9/,5d6ee393536cf5001a8d0cd9,files,https://api.osf.io/v2/preprints/8t7vb/review_actions/,https://api.osf.io/v2/preprints/8t7vb/requests/,https://api.osf.io/v2/preprints/8t7vb/,https://osf.io/preprints/socarxiv/8t7vb/,https://doi.org/10.24093/awejtls/vol3no3.10,https://doi.org/10.31235/osf.io/8t7vb
3ckn9,preprints,2019-09-03T22:00:21.574062,2019-09-04T02:37:44.523997,2019-09-04T02:37:27.798746,NA,10.24093/awejtls/vol3no3.9,The Awakening of Female Consciousness in Kate Chopin’s The Story of an Hour (1894) and Charlotte Perkins Gilman’s The Yellow Wallpaper (1892),"This paper aims to analyze the two short stories The Story of an Hour (1894) by Kate Chopin and The Yellow Wallpaper (1892) by Charlotte Perkins Gilman in an attempt to unfold the journey that leads the female characters to awaken their consciousness and to stand against the dominating male figures in their lives. In both short stories, the central characters Louise Mallard and Jane, undergo an essential journey of self-realization, which leads them to finally freeing themselves from patriarchal authority and oppression. Moreover, the paper stresses the impact of the authors as females on their characters’ development throughout that journey. Following the analytical approach within the feminist theory, the article is influenced by two major feminist critiques; Virginia Woolf and Simone De Beauvoir, who believed that women should incorporate their voices into their writings to depict more realistic female characters. Finally, both characters rejected being subordinate and oppressed and formed a reaction against it. Moreover, both authors succeeded in portraying the true characteristics of a female character; they were able to voice their own opinions and represent their true feelings.",TRUE,FALSE,Charlotte Perkins Gilman|female consciousness|feminism|feminist literature|Kate Chopin|short story,2019-09-04T02:37:44.506437,NA,,TRUE,accepted,2019-09-04T02:37:27.798746,NA,NA,NA,NA,NA,NA,NA,NA,NA,5a8c80f2c698300375c76c7d|5a8c80f5c698300375c76d10|Arts and Humanities|English Language and Literature,,2019,https://api.osf.io/v2/preprints/3ckn9/contributors/,https://api.osf.io/v2/preprints/3ckn9/bibliographic_contributors/,https://api.osf.io/v2/preprints/3ckn9/citation/,3ckn9,preprints,https://api.osf.io/v2/preprints/3ckn9/identifiers/,https://api.osf.io/v2/preprints/3ckn9/relationships/node/,https://api.osf.io/v2/licenses/563c1cf88c5e4a3877f9e96a/,563c1cf88c5e4a3877f9e96a,licenses,https://api.osf.io/v2/providers/preprints/socarxiv/,socarxiv,preprint-providers,https://api.osf.io/v2/preprints/3ckn9/files/,https://api.osf.io/v2/files/5d6ee27b80f9b5001666ddff/,5d6ee27b80f9b5001666ddff,files,https://api.osf.io/v2/preprints/3ckn9/review_actions/,https://api.osf.io/v2/preprints/3ckn9/requests/,https://api.osf.io/v2/preprints/3ckn9/,https://osf.io/preprints/socarxiv/3ckn9/,https://doi.org/10.24093/awejtls/vol3no3.9,https://doi.org/10.31235/osf.io/3ckn9
bucgx,preprints,2019-09-03T21:56:23.885094,2019-09-04T02:38:02.905559,2019-09-04T02:37:48.953435,NA,10.24093/awejtls/vol3no3.8,Fadia Faqir The Cry of the Dove (2007): Identity Wandering between Tradition and Modernity,"It is widely known that Western invasion brought new ideologies over colonized countries, from eradicating its traditions to impressive news reforms. Thus, the colonized country becomes torn between former traditions and newly modern perspectives. In this respect, the focus of this research paper will fall over as it witnessed Western imposition over its society that tried, in its turn, to maintain a traditional lifestyle, while there were attempts for change. Hence, the researcher attempts to shed light on Jordan-as it sways between traditions and imposed reforms- through the literary work of Fadia Ahmed Faqir, whose main motivation resides in the strong messages she conveys in her novel The Cry of the Dove. Thus, the concern of this paper is how far carrying a double identity affects people’s sense of belonging? In this respect, the article introduces a hint of the author’s life embodied in the protagonist Salma, who carries a swaying identity torn between tradition and modernity through her adventures.  Salma moves forward and backward through time, then she- the protagonist-wins a voice in a foreign country and adopts a new standard of living, releasing herself from the cultural boundaries of Jordan. Salma is naïve but loses her original identity while she had an opportunity to be a wife, with her husband who travels to provide for his family. But she flies to Britain rejecting the double life she leads between her traditional and modern habits. As this paper submits, the addressees should depict the impact of living a double identity adopted by a traditional character living in an imposed body and culture.",TRUE,FALSE,Cultural boundaries|double identity|social change|tradition vs. modernity|Western reforms|women’s oppression,2019-09-04T02:38:02.877880,NA,,TRUE,accepted,2019-09-04T02:37:48.953435,NA,NA,NA,NA,NA,NA,NA,NA,NA,5a8c80f2c698300375c76c7d|5a8c80f5c698300375c76d10|Arts and Humanities|English Language and Literature,,2019,https://api.osf.io/v2/preprints/bucgx/contributors/,https://api.osf.io/v2/preprints/bucgx/bibliographic_contributors/,https://api.osf.io/v2/preprints/bucgx/citation/,bucgx,preprints,https://api.osf.io/v2/preprints/bucgx/identifiers/,https://api.osf.io/v2/preprints/bucgx/relationships/node/,https://api.osf.io/v2/licenses/563c1cf88c5e4a3877f9e96a/,563c1cf88c5e4a3877f9e96a,licenses,https://api.osf.io/v2/providers/preprints/socarxiv/,socarxiv,preprint-providers,https://api.osf.io/v2/preprints/bucgx/files/,https://api.osf.io/v2/files/5d6ee18e6f41fc001b35c108/,5d6ee18e6f41fc001b35c108,files,https://api.osf.io/v2/preprints/bucgx/review_actions/,https://api.osf.io/v2/preprints/bucgx/requests/,https://api.osf.io/v2/preprints/bucgx/,https://osf.io/preprints/socarxiv/bucgx/,https://doi.org/10.24093/awejtls/vol3no3.8,https://doi.org/10.31235/osf.io/bucgx
ez35r,preprints,2019-09-03T21:52:51.857816,2019-09-04T02:38:44.251014,2019-09-04T02:38:26.304144,NA,10.24093/awejtls/vol3no3.7,Machine Translation and Technicalities of Website Localization,"Machine translation tools are widely used by companies. The tools are on an increasing demand. Translators need to equip themselves with the knowledge and the mastering of these tools. This study explores two machine translation tools involved in website localization. These tools are Alchemy Catalyst and Trados Tageditor. The study adopts an evaluative methodology to shed light on the intricacies and technicalities of these two localization tools. It discusses some of the cultural issues that localizers come across in the process of localization. In addition, it delves into the technical issues, mainly focusing on localizing into Arabic with a special focus on string, text, lexis, and orthography. The study concludes that the process of localization requires teamwork and involvement of computer engineers, and both localization tools are valuable in achieving a localization task.",TRUE,FALSE,Alchemy Catalyst|Arabic|localization|machine translation|Trados,2019-09-04T02:38:44.235807,NA,,TRUE,accepted,2019-09-04T02:38:26.304144,NA,NA,NA,NA,NA,NA,NA,NA,NA,5a8c80f2c698300375c76c7d|5a8c80f5c698300375c76d10|Arts and Humanities|English Language and Literature,,2019,https://api.osf.io/v2/preprints/ez35r/contributors/,https://api.osf.io/v2/preprints/ez35r/bibliographic_contributors/,https://api.osf.io/v2/preprints/ez35r/citation/,ez35r,preprints,https://api.osf.io/v2/preprints/ez35r/identifiers/,https://api.osf.io/v2/preprints/ez35r/relationships/node/,https://api.osf.io/v2/licenses/563c1cf88c5e4a3877f9e96a/,563c1cf88c5e4a3877f9e96a,licenses,https://api.osf.io/v2/providers/preprints/socarxiv/,socarxiv,preprint-providers,https://api.osf.io/v2/preprints/ez35r/files/,https://api.osf.io/v2/files/5d6ee0b87215100019a1a103/,5d6ee0b87215100019a1a103,files,https://api.osf.io/v2/preprints/ez35r/review_actions/,https://api.osf.io/v2/preprints/ez35r/requests/,https://api.osf.io/v2/preprints/ez35r/,https://osf.io/preprints/socarxiv/ez35r/,https://doi.org/10.24093/awejtls/vol3no3.7,https://doi.org/10.31235/osf.io/ez35r
u2awp,preprints,2019-09-03T21:46:14.730610,2019-09-04T02:42:06.026234,2019-09-04T02:41:41.912097,NA,10.24093/awejtls/vol3no3.6,Critical Stylistic analysis of the Concept of Extremism in DeLillo's Falling Man (2007),"The increase in the number of terrorist attacks, especially the shocking event of 9/11 led to the wide coverage of  topics such as terrorism and extremism. Such coverage is not only conveyed by the media and newspaper articles, but also by creating novels. As a result, the current study focuses on the concept of extremism. The hallmark of this study is to illustrate how such concept is ideologically embedded within a text. Thus, this study is confined to Don DeLillo's Falling man (2007). In this novel, DeLillo describes the trauma caused by 9/11 attacks. It is important to note that he  recruits his language to mirror Islam as an extreme religion.  To access the concept of extremism in this novel, the researchers will apply a critical stylistic approach. Therefore, the analysis will  depend heavily on the textual conceptual model that is represented by Jeffries (2010) to uncover the hidden ideologies related to extremism. The aims of current study is to investigate the way the linguistic meaning is used as a vehicle for constructing the ideology of extremism in the selected novel; in addition to identify the textual meaning that underlies extremism in the selected novel.  With the aid of critical stylistic tools, the researchers find out that DeLillo employs the use of certain linguistic choices in his novel. These choices tackle the concept of extremism focusing on the violent attitude behind such a concept with an attempt to link this concept to Islam and Muslims.",TRUE,FALSE,9/11 attacks|critical stylistics|extremism|Islam &amp; Muslims|terrorism,2019-09-04T02:42:06.000895,NA,,TRUE,accepted,2019-09-04T02:41:41.912097,NA,NA,NA,NA,NA,NA,NA,NA,NA,5a8c80f2c698300375c76c7d|5a8c80f5c698300375c76d10|Arts and Humanities|English Language and Literature,,2019,https://api.osf.io/v2/preprints/u2awp/contributors/,https://api.osf.io/v2/preprints/u2awp/bibliographic_contributors/,https://api.osf.io/v2/preprints/u2awp/citation/,u2awp,preprints,https://api.osf.io/v2/preprints/u2awp/identifiers/,https://api.osf.io/v2/preprints/u2awp/relationships/node/,https://api.osf.io/v2/licenses/563c1cf88c5e4a3877f9e96a/,563c1cf88c5e4a3877f9e96a,licenses,https://api.osf.io/v2/providers/preprints/socarxiv/,socarxiv,preprint-providers,https://api.osf.io/v2/preprints/u2awp/files/,https://api.osf.io/v2/files/5d6edf2c536cf5001888863b/,5d6edf2c536cf5001888863b,files,https://api.osf.io/v2/preprints/u2awp/review_actions/,https://api.osf.io/v2/preprints/u2awp/requests/,https://api.osf.io/v2/preprints/u2awp/,https://osf.io/preprints/socarxiv/u2awp/,https://doi.org/10.24093/awejtls/vol3no3.6,https://doi.org/10.31235/osf.io/u2awp
us6er,preprints,2019-09-03T21:42:45.069074,2019-09-04T02:42:24.545608,2019-09-04T02:41:59.826058,NA,10.24093/awejtls/vol3no3.5,On Translating Arabic Verbal Emphasis into English,"The translators constitute facing a challenge in the translation of Arabic verbal emphasis structure. Therefore, this study investigates the translation of Arabic verbal emphasis category and its subcategories into English from semantic and pragmatic perspectives. It draws upon an examination of several translations of these emphatic devices and structures into English. Specifically, it draws upon the translations of Naguib Mahfouz’s novels The Thief and the Dogs (1961), Children of Gebalawi (1988) and the Harafish (2013) and Ghassan Kanafani’s short stories Palestine’s Children (2000). The study highlights the erroneous strategies adopted by the translators of these literary works and suggests more suitable alternative translations. As a result of several mismatches between Arabic and English leads to such errors. This study attempts to handle a gape in literature and help translators to overcome the obstacles they may face in rendering such Arabic structures in English. The article concludes that translating Arabic verbal emphatic structure into English would be affected by the syntactic, semantic and pragmatic symmetries and asymmetries between the two languages.",TRUE,FALSE,Arabic verbal emphasis|repetition|translation,2019-09-04T02:42:24.529622,NA,,TRUE,accepted,2019-09-04T02:41:59.826058,NA,NA,NA,NA,NA,NA,NA,NA,NA,5a8c80f2c698300375c76c7d|5a8c80f5c698300375c76d10|Arts and Humanities|English Language and Literature,,2019,https://api.osf.io/v2/preprints/us6er/contributors/,https://api.osf.io/v2/preprints/us6er/bibliographic_contributors/,https://api.osf.io/v2/preprints/us6er/citation/,us6er,preprints,https://api.osf.io/v2/preprints/us6er/identifiers/,https://api.osf.io/v2/preprints/us6er/relationships/node/,https://api.osf.io/v2/licenses/563c1cf88c5e4a3877f9e96a/,563c1cf88c5e4a3877f9e96a,licenses,https://api.osf.io/v2/providers/preprints/socarxiv/,socarxiv,preprint-providers,https://api.osf.io/v2/preprints/us6er/files/,https://api.osf.io/v2/files/5d6ede5980f9b5001666db5a/,5d6ede5980f9b5001666db5a,files,https://api.osf.io/v2/preprints/us6er/review_actions/,https://api.osf.io/v2/preprints/us6er/requests/,https://api.osf.io/v2/preprints/us6er/,https://osf.io/preprints/socarxiv/us6er/,https://doi.org/10.24093/awejtls/vol3no3.5,https://doi.org/10.31235/osf.io/us6er
gfm78,preprints,2019-09-03T21:38:12.552486,2019-09-04T02:42:45.637849,2019-09-04T02:42:22.281831,NA,10.24093/awejtls/vol3no3.4,"Silence as a Tactic of Communication in Pragmatics, Novel, and Poetry","This study aims to discuss the meaning of the ‘silence’ notion pragmatically and literary; in novel and poetry. As far as pragmatics is concerned, it means an important means of communication within a context, and it is a culture dependent. As for silence in literature, it offers the example in which silence is not only present and comprehended but also a substantial part of communication that encapsulate a sender and a receiver. In novels, it is considered as a new humanistic tactic through which a writer would force the reader to feel words rather than reading them plus more intensity and strength. Novelists tend to use silence in writing their novels as it is an integral part of voices and a revelation of so many hidden things, but it mistakenly might be understood as a refusal for communication. Finally, the notion of ‘silence’ in poetry offers the readers many examples where the poet invites the readers to hear ""silence."" In some cases, it is even personified and is given a physical being.",TRUE,FALSE,articulation|communication function|pauses|silence|unspeakable,2019-09-04T02:42:45.619845,NA,,TRUE,accepted,2019-09-04T02:42:22.281831,NA,NA,NA,NA,NA,NA,NA,NA,NA,5a8c80f2c698300375c76c7d|5a8c80f5c698300375c76d10|Arts and Humanities|English Language and Literature,,2019,https://api.osf.io/v2/preprints/gfm78/contributors/,https://api.osf.io/v2/preprints/gfm78/bibliographic_contributors/,https://api.osf.io/v2/preprints/gfm78/citation/,gfm78,preprints,https://api.osf.io/v2/preprints/gfm78/identifiers/,https://api.osf.io/v2/preprints/gfm78/relationships/node/,https://api.osf.io/v2/licenses/563c1cf88c5e4a3877f9e96a/,563c1cf88c5e4a3877f9e96a,licenses,https://api.osf.io/v2/providers/preprints/socarxiv/,socarxiv,preprint-providers,https://api.osf.io/v2/preprints/gfm78/files/,https://api.osf.io/v2/files/5d6edd4b6f41fc001b35bcd5/,5d6edd4b6f41fc001b35bcd5,files,https://api.osf.io/v2/preprints/gfm78/review_actions/,https://api.osf.io/v2/preprints/gfm78/requests/,https://api.osf.io/v2/preprints/gfm78/,https://osf.io/preprints/socarxiv/gfm78/,https://doi.org/10.24093/awejtls/vol3no3.4,https://doi.org/10.31235/osf.io/gfm78
e84gm,preprints,2019-09-03T21:33:06.654237,2019-09-04T02:43:01.230864,2019-09-04T02:42:39.889734,NA,10.24093/awejtls/vol3no3.3,An investigation into the interpreters’ challenges in conflict zones: The case of Darfur region in Sudan,"The study is aimed to investigate and shed light on some of the challenges encountered by local interpreters and language assistants working for UN peace-keeping missions, operating in conflict zones, namely in Darfur region, western Sudan. The study addresses the following research questions: what are the linguistic, social-cultural, mistrust and communication-related barriers that are encountered by interpreters and language assistants in conflict zones, how do they cope with these challenges, and what could be done to train them to handle such challenges and difficulties. The study adopted a qualitative methodology with semi-structured interviews being the main method of data collection. Twenty participants agreed to voluntarily take part in the investigation by allowing face-to-face interviews. Interview data was transcribed, coded and analyzed thematically. The results of data analysis showed that participants faced a range of challenges that negatively affected their job. They reported difficulties understanding and dealing with some social and cultural issues specific to the region. They also reported some serious life-threatening incidents ranging from physical and verbal attacks. For example, interpreters encountered hostilities from their fellow citizens accusing them of siding with enemy parties involved in the conflicts. Additionally, communication barriers were reported by participants as being the most salient challenge they experienced even when they interpreted accurately, as they would still encounter communication breakdowns caused by the inherent differences in the indigenous languages and varieties in addition to some cultural barriers. The paper offers some insights and implications for the conflict zones’ interpreters’ training and professional development.",TRUE,FALSE,challenges|conflict zones|interpreter training|professional development|Sudan,2019-09-04T02:43:01.210762,NA,,TRUE,accepted,2019-09-04T02:42:39.889734,NA,NA,NA,NA,NA,NA,NA,NA,NA,5a8c80f2c698300375c76c7d|5a8c80f5c698300375c76d10|Arts and Humanities|English Language and Literature,,2019,https://api.osf.io/v2/preprints/e84gm/contributors/,https://api.osf.io/v2/preprints/e84gm/bibliographic_contributors/,https://api.osf.io/v2/preprints/e84gm/citation/,e84gm,preprints,https://api.osf.io/v2/preprints/e84gm/identifiers/,https://api.osf.io/v2/preprints/e84gm/relationships/node/,https://api.osf.io/v2/licenses/563c1cf88c5e4a3877f9e96a/,563c1cf88c5e4a3877f9e96a,licenses,https://api.osf.io/v2/providers/preprints/socarxiv/,socarxiv,preprint-providers,https://api.osf.io/v2/preprints/e84gm/files/,https://api.osf.io/v2/files/5d6edc1580f9b50018641795/,5d6edc1580f9b50018641795,files,https://api.osf.io/v2/preprints/e84gm/review_actions/,https://api.osf.io/v2/preprints/e84gm/requests/,https://api.osf.io/v2/preprints/e84gm/,https://osf.io/preprints/socarxiv/e84gm/,https://doi.org/10.24093/awejtls/vol3no3.3,https://doi.org/10.31235/osf.io/e84gm
