id,type,attributes.date_created,attributes.date_modified,attributes.date_published,attributes.original_publication_date,attributes.doi,attributes.title,attributes.description,attributes.is_published,attributes.is_preprint_orphan,attributes.tags,attributes.preprint_doi_created,attributes.date_withdrawn,attributes.current_user_permissions,attributes.public,attributes.reviews_state,attributes.date_last_transitioned,attributes.has_coi,attributes.conflict_of_interest_statement,attributes.has_data_links,attributes.why_no_data,attributes.data_links,attributes.has_prereg_links,attributes.why_no_prereg,attributes.prereg_links,attributes.prereg_link_info,attributes.subjects,attributes.license_record.copyright_holders,attributes.license_record.year,relationships.contributors.links.related.href,relationships.bibliographic_contributors.links.related.href,relationships.citation.links.related.href,relationships.citation.data.id,relationships.citation.data.type,relationships.identifiers.links.related.href,relationships.node.links.related.href,relationships.node.links.self.href,relationships.node.data.id,relationships.node.data.type,relationships.license.links.related.href,relationships.license.data.id,relationships.license.data.type,relationships.provider.links.related.href,relationships.provider.data.id,relationships.provider.data.type,relationships.files.links.related.href,relationships.primary_file.links.related.href,relationships.primary_file.data.id,relationships.primary_file.data.type,relationships.review_actions.links.related.href,relationships.requests.links.related.href,links.self,links.html,links.preprint_doi,links.doi
vj9nm,preprints,2021-05-21T13:59:47.503372,2021-05-23T18:31:01.106261,2021-05-23T18:30:37.797935,2021-05-20T23:00:00,NA,The role of sustainability in the UK synthetic biology programme,"Policy interventions in support of emerging technologies are often justified through their potential to support sustainability transitions. Synthetic biology is one such technology with potential applications across a wide range of sectors with promised sustainability benefits. Over the past decade, the field in the UK has been subject to active policy intervention and support. This article explores the role played by the sustainability agenda in policy debates and the policy mix in support of this emerging field in the UK. Through an exploratory case study approach, I describe the processes through which synthetic biology came to be the subject of policy intervention where wider sustainability goals were situated as subsidiary to the commercialisation agenda. Analysis of the policy mix reveals how this has fed through into a supply-side bias with limited consideration given to actively create or stimulate demand for sustainable synthetic biology applications. These features, combined with limited capacity for anticipation and monitoring, are likely to limit the capacity of the field to drive socio-technical transformation due to a lack of attention to policy coordination, reflexivity, and directionality.",TRUE,FALSE,emerging technology|policy mix|sustainability transitions|synthetic biology|transformational innovation policy,2021-05-23T18:31:01.081360,NA,,TRUE,accepted,2021-05-23T18:30:37.797935,TRUE,"Nicholas E. Matthews was employed part-time as a paid contractor by the UK Government Office for Science during the period that the research for this article was undertaken. During this time, he was not involved in policy relating to synthetic biology. All research for this study was carried out in his capacity as a PhD researcher at the University of Manchester.",not_applicable,NA,,not_applicable,NA,,,"5a8c80f7c698300375c76d84|5a8c80f8c698300375c76ddb|5a8c80f9c698300375c76ded|Social and Behavioral Sciences|Public Affairs, Public Policy and Public Administration|Science and Technology Policy|5a8c80f7c698300375c76d84|5a8c80f8c698300375c76ddb|5a8c80f9c698300375c76df0|Social and Behavioral Sciences|Public Affairs, Public Policy and Public Administration|Environmental Policy",,2021,https://api.osf.io/v2/preprints/vj9nm/contributors/,https://api.osf.io/v2/preprints/vj9nm/bibliographic_contributors/,https://api.osf.io/v2/preprints/vj9nm/citation/,vj9nm,preprints,https://api.osf.io/v2/preprints/vj9nm/identifiers/,https://api.osf.io/v2/nodes/7mfzj/,https://api.osf.io/v2/preprints/vj9nm/relationships/node/,7mfzj,nodes,https://api.osf.io/v2/licenses/563c1cf88c5e4a3877f9e96a/,563c1cf88c5e4a3877f9e96a,licenses,https://api.osf.io/v2/providers/preprints/socarxiv/,socarxiv,preprint-providers,https://api.osf.io/v2/preprints/vj9nm/files/,https://api.osf.io/v2/files/60a7bcdb8a5d3d00970cae24/,60a7bcdb8a5d3d00970cae24,files,https://api.osf.io/v2/preprints/vj9nm/review_actions/,https://api.osf.io/v2/preprints/vj9nm/requests/,https://api.osf.io/v2/preprints/vj9nm/,https://osf.io/preprints/socarxiv/vj9nm/,https://doi.org/10.31235/osf.io/vj9nm,NA
rw58y,preprints,2021-05-21T12:48:57.033075,2021-05-23T18:30:21.106133,2021-05-23T18:30:04.460563,NA,NA,Peer Production Practices: Design Strategies in Online Citizen Science Platforms,"Citizen science is an umbrella term covering a broad range of practices, all related to engaging individuals actively in scientific research. There is a tension about the nature and scope of participation in citizen science, with the majority of projects being scientific authority-driven crowdsourcing approaches, allowing individuals to perform only narrowly defined microtasks. On the other side of the spectrum, there is peer production: A decentralized way of production that relies on self-organizing communities of individuals, known for example from open source software or Wikipedia.
In this article, we inspect three online citizen science platforms - iNaturalist, Public Lab and Zooniverse - from a peer production perspective. We introduce a working model of peer production ecosystems that we apply to perform qualitative analyses of the projects’ online platforms. Our results show that peer production is partly already practiced in citizen science today and we provide concrete examples of features. The amount of peer production elements vary strongly between the case studies, relative to orientation of the projects as a support for professional researchers or for community activism. We argue for the potential of peer production approaches for more inclusive and democratic citizen science and aim to orient readers on why and how they might put peer production elements into practice in their own citizen science projects.",TRUE,FALSE,citizen science|knowledge production|participatory research|peer production|user experience|web design,2021-05-23T18:30:21.078688,NA,,TRUE,accepted,2021-05-23T18:30:04.460563,FALSE,NA,not_applicable,NA,,not_applicable,NA,,,5a8c80f7c698300375c76d84|5a8c80f9c698300375c76df4|Social and Behavioral Sciences|Science and Technology Studies,,2021,https://api.osf.io/v2/preprints/rw58y/contributors/,https://api.osf.io/v2/preprints/rw58y/bibliographic_contributors/,https://api.osf.io/v2/preprints/rw58y/citation/,rw58y,preprints,https://api.osf.io/v2/preprints/rw58y/identifiers/,https://api.osf.io/v2/nodes/m89vh/,https://api.osf.io/v2/preprints/rw58y/relationships/node/,m89vh,nodes,https://api.osf.io/v2/licenses/563c1cf88c5e4a3877f9e96a/,563c1cf88c5e4a3877f9e96a,licenses,https://api.osf.io/v2/providers/preprints/socarxiv/,socarxiv,preprint-providers,https://api.osf.io/v2/preprints/rw58y/files/,https://api.osf.io/v2/files/60a7ac3ca480c6008f0d1702/,60a7ac3ca480c6008f0d1702,files,https://api.osf.io/v2/preprints/rw58y/review_actions/,https://api.osf.io/v2/preprints/rw58y/requests/,https://api.osf.io/v2/preprints/rw58y/,https://osf.io/preprints/socarxiv/rw58y/,https://doi.org/10.31235/osf.io/rw58y,NA
75ubp,preprints,2021-05-21T08:07:44.737403,2021-05-23T18:29:47.763235,2021-05-23T18:29:28.364255,1993-06-30T14:00:00,NA,"REFUTING 'ANTI-IMPERIALIST' MYTHS A Review of Warren's Imperialism, Pioneer of Capitalism","Bill Warren's book, Imperialism, Pioneer of Capitalism, performs a useful service by refuting much of the mythology that the left has embraced in the name of 'anti-imperialism'. On the other hand, he manages to create his own brand of confusion. He does this, firstly, by blaming Lenin's Imperialism the Highest Stage of Capitalism for many of the left's erroneous views. And secondly, he is so busy extolling the historical mission of capitalism, that no effort is devoted to discussing how capitalism is an obstacle to human development and is becoming increasingly obsolete. Despite these shortcomings it is the myth shattering quality of the book that predominates.",TRUE,FALSE,colonialism|globalization|imperialism|Marxism,2021-05-23T18:29:47.738396,NA,,TRUE,accepted,2021-05-23T18:29:28.364255,FALSE,NA,not_applicable,NA,,not_applicable,NA,,,5a8c80f2c698300375c76c7d|5a8c80f4c698300375c76ccc|5a8c80f4c698300375c76ce2|Arts and Humanities|History|Political History|5a8c80f7c698300375c76d84|5a8c80f8c698300375c76daf|5a8c80f8c698300375c76db0|Social and Behavioral Sciences|Political Science|International Relations|5a8c80f7c698300375c76d84|5a8c80f8c698300375c76dbe|5a8c80f8c698300375c76dc8|Social and Behavioral Sciences|Economics|Growth and Development|5a8c80f7c698300375c76d84|5a8c80f8c698300375c76dbe|5a8c80f8c698300375c76dcc|Social and Behavioral Sciences|Economics|International Economics,,2021,https://api.osf.io/v2/preprints/75ubp/contributors/,https://api.osf.io/v2/preprints/75ubp/bibliographic_contributors/,https://api.osf.io/v2/preprints/75ubp/citation/,75ubp,preprints,https://api.osf.io/v2/preprints/75ubp/identifiers/,NA,https://api.osf.io/v2/preprints/75ubp/relationships/node/,NA,NA,https://api.osf.io/v2/licenses/563c1cf88c5e4a3877f9e96a/,563c1cf88c5e4a3877f9e96a,licenses,https://api.osf.io/v2/providers/preprints/socarxiv/,socarxiv,preprint-providers,https://api.osf.io/v2/preprints/75ubp/files/,https://api.osf.io/v2/files/60a76a540b6c69004b9ba00f/,60a76a540b6c69004b9ba00f,files,https://api.osf.io/v2/preprints/75ubp/review_actions/,https://api.osf.io/v2/preprints/75ubp/requests/,https://api.osf.io/v2/preprints/75ubp/,https://osf.io/preprints/socarxiv/75ubp/,https://doi.org/10.31235/osf.io/75ubp,NA
tnxw4,preprints,2021-05-21T03:20:30.731606,2021-05-23T18:25:09.718206,2021-05-23T18:24:40.314070,NA,NA,The Growth of Negative Sentiment in Post-Umbrella Movement Hong Kong: Analyzing Public Opinion Online from 2017 to 2019,"This report presents a part of the findings from the Hong Kong Online Public Opinion Data Mining Project (http://www.webopinion.hk/) that aims to collect and analyze online public opinion towards different issues and topics in Hong Kong. The report provides an overview of public opinion on a variety of topics such as public figures, organizations, and social issues. A total of 12 online platforms including discussion forums, news portal sites, and online news media are included in the analysis (for methodological details, see Text-Mining Online Public Opinion in Hong Kong: Methods and Procedures  https://osf.io/preprints/socarxiv/b2mex/). The time span of the analysis in this report is from July 2017 to December 2019.",TRUE,FALSE,Hong Kong|political attitude|public opinion|sentiment analysis|text mining,2021-05-23T18:25:09.697196,NA,,TRUE,accepted,2021-05-23T18:24:40.314070,FALSE,NA,available,NA,http://www.webopinion.hk/,no,NA,,,5a8c80f7c698300375c76d84|5a8c80f8c698300375c76daf|Social and Behavioral Sciences|Political Science|5a8c80f7c698300375c76d84|5a8c80f9c698300375c76e0c|Social and Behavioral Sciences|Social Statistics|5a8c80f7c698300375c76d84|5a8c80f9c698300375c76e0d|5a8c80f9c698300375c76e18|Social and Behavioral Sciences|Communication|Social Media|5a8c80f7c698300375c76d84|5a8c80f9c698300375c76e0d|5a8c80f9c698300375c76e1d|Social and Behavioral Sciences|Communication|Social Influence and Political Communication,,2021,https://api.osf.io/v2/preprints/tnxw4/contributors/,https://api.osf.io/v2/preprints/tnxw4/bibliographic_contributors/,https://api.osf.io/v2/preprints/tnxw4/citation/,tnxw4,preprints,https://api.osf.io/v2/preprints/tnxw4/identifiers/,https://api.osf.io/v2/nodes/uzp56/,https://api.osf.io/v2/preprints/tnxw4/relationships/node/,uzp56,nodes,https://api.osf.io/v2/licenses/563c1cf88c5e4a3877f9e96a/,563c1cf88c5e4a3877f9e96a,licenses,https://api.osf.io/v2/providers/preprints/socarxiv/,socarxiv,preprint-providers,https://api.osf.io/v2/preprints/tnxw4/files/,https://api.osf.io/v2/files/60a72703a480c600270d7749/,60a72703a480c600270d7749,files,https://api.osf.io/v2/preprints/tnxw4/review_actions/,https://api.osf.io/v2/preprints/tnxw4/requests/,https://api.osf.io/v2/preprints/tnxw4/,https://osf.io/preprints/socarxiv/tnxw4/,https://doi.org/10.31235/osf.io/tnxw4,NA
52zbm,preprints,2021-05-21T03:00:09.928689,2021-05-23T18:24:10.183398,2021-05-23T18:23:43.342247,NA,NA,The Ebb and Flow of Public Sentiments in Hong Kong: Analyzing Public Opinion Online from 2000 to 2017,"This report presents a part of the findings from the Hong Kong Online Public Opinion Data Mining Project (http://www.webopinion.hk/) that aims to collect and analyze online public opinion towards different issues and topics in Hong Kong. The report provides an overview of public opinion on a variety of topics such as public figures, organizations, and social issues. A total of 12 online platforms including discussion forums, news portal sites, and online news media are included in the analysis (for methodological details, see Text-Mining Online Public Opinion in Hong Kong: Methods and Procedures  https://osf.io/preprints/socarxiv/b2mex/).  The time span of the analysis in this report is from January 2000 (i.e., the earliest data point obtained) to June 2017 (i.e., the end of the third Chief Executive Leung Chun-ying’s administration).",TRUE,FALSE,Hong Kong|polarization|political attitudes|public opinion|text mining,2021-05-23T18:24:09.997657,NA,,TRUE,accepted,2021-05-23T18:23:43.342247,FALSE,NA,available,NA,http://www.webopinion.hk/,no,NA,,,5a8c80f7c698300375c76d84|5a8c80f8c698300375c76daf|Social and Behavioral Sciences|Political Science|5a8c80f7c698300375c76d84|5a8c80f9c698300375c76e0c|Social and Behavioral Sciences|Social Statistics|5a8c80f7c698300375c76d84|5a8c80f9c698300375c76e0d|5a8c80f9c698300375c76e18|Social and Behavioral Sciences|Communication|Social Media|5a8c80f7c698300375c76d84|5a8c80f9c698300375c76e0d|5a8c80f9c698300375c76e1d|Social and Behavioral Sciences|Communication|Social Influence and Political Communication,,2021,https://api.osf.io/v2/preprints/52zbm/contributors/,https://api.osf.io/v2/preprints/52zbm/bibliographic_contributors/,https://api.osf.io/v2/preprints/52zbm/citation/,52zbm,preprints,https://api.osf.io/v2/preprints/52zbm/identifiers/,https://api.osf.io/v2/nodes/uzp56/,https://api.osf.io/v2/preprints/52zbm/relationships/node/,uzp56,nodes,https://api.osf.io/v2/licenses/563c1cf88c5e4a3877f9e96a/,563c1cf88c5e4a3877f9e96a,licenses,https://api.osf.io/v2/providers/preprints/socarxiv/,socarxiv,preprint-providers,https://api.osf.io/v2/preprints/52zbm/files/,https://api.osf.io/v2/files/60a7223d0b6c69003a9bc41b/,60a7223d0b6c69003a9bc41b,files,https://api.osf.io/v2/preprints/52zbm/review_actions/,https://api.osf.io/v2/preprints/52zbm/requests/,https://api.osf.io/v2/preprints/52zbm/,https://osf.io/preprints/socarxiv/52zbm/,https://doi.org/10.31235/osf.io/52zbm,NA
5xtbz,preprints,2021-05-20T14:56:06.688578,2021-05-23T18:21:33.895517,2021-05-23T18:21:04.973932,2021-01-29T22:00:00,10.15347/WJH/2021.001,"Osman I, father of kings","Osman I. or Osman Bay was the leader of the Kayı Turkic clan, one of the border governors for the Sultanate of Rûm, and the founder of the Ottoman dynasty that ruled over the Balkans, Anatolia, the Levant, and North Africa for 600 years until it expired with the establishment of the Turkish Republic in 1922. This Article addresses his life, time, and events surrounding his state.",TRUE,FALSE,Osman Bey|Osman Gazi|Osman I|Sultan Osman Gazi|Sultan Osman I,2021-05-23T18:21:33.848353,NA,,TRUE,accepted,2021-05-23T18:21:04.973932,FALSE,NA,not_applicable,NA,,not_applicable,NA,,,5a8c80f2c698300375c76c7d|5a8c80f4c698300375c76ccc|5a8c80f4c698300375c76cd7|Arts and Humanities|History|Islamic World and Near East History,,2021,https://api.osf.io/v2/preprints/5xtbz/contributors/,https://api.osf.io/v2/preprints/5xtbz/bibliographic_contributors/,https://api.osf.io/v2/preprints/5xtbz/citation/,5xtbz,preprints,https://api.osf.io/v2/preprints/5xtbz/identifiers/,NA,https://api.osf.io/v2/preprints/5xtbz/relationships/node/,NA,NA,https://api.osf.io/v2/licenses/563c1cf88c5e4a3877f9e96a/,563c1cf88c5e4a3877f9e96a,licenses,https://api.osf.io/v2/providers/preprints/socarxiv/,socarxiv,preprint-providers,https://api.osf.io/v2/preprints/5xtbz/files/,https://api.osf.io/v2/files/60a6789c8b826b01788baa35/,60a6789c8b826b01788baa35,files,https://api.osf.io/v2/preprints/5xtbz/review_actions/,https://api.osf.io/v2/preprints/5xtbz/requests/,https://api.osf.io/v2/preprints/5xtbz/,https://osf.io/preprints/socarxiv/5xtbz/,https://doi.org/10.31235/osf.io/5xtbz,https://doi.org/10.15347/WJH/2021.001
eq35n,preprints,2021-05-20T10:59:45.916762,2021-05-20T12:22:45.295279,2021-05-20T12:22:17.121977,NA,NA,"Bad job, bad health? A longitudinal analysis of the interaction between precariousness, gender and self-perceived health in Germany.","Over the last few decades in all European countries more and more people have been experiencing a condition of precariousness during their working lives. Whether employment precariousness could affect working people's health and whether there exists a gender differential in the relationship are crucial questions that have not been fully explored yet. Then, the aim of this paper is twofold: Firstly, it investigates the relationship between precariousness and general health in Germany; secondly, it explores whether and in which direction the health consequences of precariousness vary by gender. 
Data from the German Socio-economic Panel (SOEP, waves 2003 2007 2011 2015) are used for the analysis. By using multiple correspondence analysis, I develop a new multi-dimensional and continuous measure of precariousness, which summarizes seven different dimensions of insecurity. Further, I analyze the effect of precariousness on men’s and women’s self-perceived health by implementing ordered probit correlated random-effects models and controlling for both observed and unobserved heterogeneity.
The findings suggest that employment precariousness could be detrimental for self-perceived health for both men and women, with men being more penalized. The social consequences of employment de-standardization need to be investigated taking into account the gender norms that characterize specific cultural and institutional contexts. Further research on this topic is needed.",TRUE,FALSE,Correlated Random Models|Employment Precariousness|Gender Inequalities|Self-Rated Health|SOEP,2021-05-20T12:22:45.273332,NA,,TRUE,accepted,2021-05-20T12:22:17.121977,FALSE,NA,no,SOEP Data are accessible via a signed agreement with DIW Berlin.,,no,NA,,,5a8c80f7c698300375c76d84|5a8c80fac698300375c76e20|5a8c80fac698300375c76e4e|Social and Behavioral Sciences|Sociology|Medical Sociology|5a8c80f7c698300375c76d84|5a8c80fac698300375c76e20|5a8c80fac698300375c76e50|Social and Behavioral Sciences|Sociology|Other Sociology,Giulia Tattarini,2021,https://api.osf.io/v2/preprints/eq35n/contributors/,https://api.osf.io/v2/preprints/eq35n/bibliographic_contributors/,https://api.osf.io/v2/preprints/eq35n/citation/,eq35n,preprints,https://api.osf.io/v2/preprints/eq35n/identifiers/,https://api.osf.io/v2/nodes/psxmv/,https://api.osf.io/v2/preprints/eq35n/relationships/node/,psxmv,nodes,https://api.osf.io/v2/licenses/563c1cf88c5e4a3877f9e965/,563c1cf88c5e4a3877f9e965,licenses,https://api.osf.io/v2/providers/preprints/socarxiv/,socarxiv,preprint-providers,https://api.osf.io/v2/preprints/eq35n/files/,https://api.osf.io/v2/files/60a64126e2a9800169a69771/,60a64126e2a9800169a69771,files,https://api.osf.io/v2/preprints/eq35n/review_actions/,https://api.osf.io/v2/preprints/eq35n/requests/,https://api.osf.io/v2/preprints/eq35n/,https://osf.io/preprints/socarxiv/eq35n/,https://doi.org/10.31235/osf.io/eq35n,NA
fdy52,preprints,2021-05-20T05:46:39.382066,2021-05-20T13:43:41.118866,2021-05-20T13:43:28.380075,NA,10.24093/awej/covid.27,The Impact of Metacognitive Online Reading Strategies on Online Reading Disposition of Saudi EFL Learners,"The scientific knowledge related to online reading dispositions and factors affecting the occurrence of these dispositions is limited. Therefore, this treatise aims at studying the impact of metacognitive online reading strategies on online reading dispositions. To achieve this goal, the mixed method was employed using questionnaires and semi-structured interviews. Students’ responses were keyed to AMOS software. The statistical analysis has shown students’ preference for utilizing support strategies to tackle the problems they might face while they engage with online materials. Reflection, as a disposition, was the most frequently reported by students through their responses to the questionnaires. Further, the results confirmed the impact of metacognitive online reading strategies on online reading dispositions, which was the aim of this paper. These findings provide a holistic understanding of the nature of the relationship between metacognition and dispositions, paving the way for further research that touch other aspects of online reading dispositions.",TRUE,FALSE,dispositions|metacognition|Online reading|reading strategies|Saudi EFL learners,2021-05-20T13:43:41.052316,NA,,TRUE,accepted,2021-05-20T13:43:28.380075,FALSE,NA,not_applicable,NA,,not_applicable,NA,,,5a8c80f2c698300375c76c7d|5a8c80f5c698300375c76d10|Arts and Humanities|English Language and Literature,,2021,https://api.osf.io/v2/preprints/fdy52/contributors/,https://api.osf.io/v2/preprints/fdy52/bibliographic_contributors/,https://api.osf.io/v2/preprints/fdy52/citation/,fdy52,preprints,https://api.osf.io/v2/preprints/fdy52/identifiers/,NA,https://api.osf.io/v2/preprints/fdy52/relationships/node/,NA,NA,https://api.osf.io/v2/licenses/563c1cf88c5e4a3877f9e96a/,563c1cf88c5e4a3877f9e96a,licenses,https://api.osf.io/v2/providers/preprints/socarxiv/,socarxiv,preprint-providers,https://api.osf.io/v2/preprints/fdy52/files/,https://api.osf.io/v2/files/60a5f7c22cb36e0148c144ea/,60a5f7c22cb36e0148c144ea,files,https://api.osf.io/v2/preprints/fdy52/review_actions/,https://api.osf.io/v2/preprints/fdy52/requests/,https://api.osf.io/v2/preprints/fdy52/,https://osf.io/preprints/socarxiv/fdy52/,https://doi.org/10.31235/osf.io/fdy52,https://doi.org/10.24093/awej/covid.27
ym7js,preprints,2021-05-20T05:43:20.508537,2021-05-20T13:44:02.920529,2021-05-20T13:43:43.170967,NA,10.24093/awej/covid.28,Female Saudi University Students’ Perceptions of Online Education Amid COVID-19 Pandemic,"The outbreak of the COVID-19 pandemic has wreaked havoc and caused world-wide disruptions to daily activities, including education. Numerous mitigation measures were taken to slow down the rapid spread of this pandemic. The situation, subsequently, entailed utilizing technology to ensure the continuation of the educational process. The abrupt shift to online education presented significant challenges to teachers and learners alike. Uncovering students’ perceptions of their online education experience will help address and deal with these challenges. This study attempted to explore the perceptions of Saudi female undergraduate students of their online education experience amid the COVID-19 pandemic. The total of 241 female students at the College of Languages and Translation at King Saud University in Riyadh answered a multi-item online survey. The results revealed that many of the respondents were happy with their online learning experience, enjoyed learning online and looked forward to their online classes. However, when asked to compare online learning to brick-and-mortar classes, more than half of the participants stated that they prefer traditional, face-to-face learning. The results of this study also revealed that the significant problems students faced in online education related to staying motivated, technical issues and the absence of face-to-face interaction. Despite the many challenges they face when learning online, the most cited advantage for online education mentioned by the participants is that it is more convenient. The results also indicated that this education mode seemed to suit shy students more, as they stated that they participate and ask questions more in online classes.",TRUE,FALSE,COVID-19 pandemic|e-learning; online education; technology|female Saudi EFL university learners’ perceptions,2021-05-20T13:44:02.894926,NA,,TRUE,accepted,2021-05-20T13:43:43.170967,FALSE,NA,not_applicable,NA,,not_applicable,NA,,,5a8c80f2c698300375c76c7d|5a8c80f5c698300375c76d10|Arts and Humanities|English Language and Literature,,2021,https://api.osf.io/v2/preprints/ym7js/contributors/,https://api.osf.io/v2/preprints/ym7js/bibliographic_contributors/,https://api.osf.io/v2/preprints/ym7js/citation/,ym7js,preprints,https://api.osf.io/v2/preprints/ym7js/identifiers/,NA,https://api.osf.io/v2/preprints/ym7js/relationships/node/,NA,NA,https://api.osf.io/v2/licenses/563c1cf88c5e4a3877f9e96a/,563c1cf88c5e4a3877f9e96a,licenses,https://api.osf.io/v2/providers/preprints/socarxiv/,socarxiv,preprint-providers,https://api.osf.io/v2/preprints/ym7js/files/,https://api.osf.io/v2/files/60a5f6fb8b826b014b8bd7ae/,60a5f6fb8b826b014b8bd7ae,files,https://api.osf.io/v2/preprints/ym7js/review_actions/,https://api.osf.io/v2/preprints/ym7js/requests/,https://api.osf.io/v2/preprints/ym7js/,https://osf.io/preprints/socarxiv/ym7js/,https://doi.org/10.31235/osf.io/ym7js,https://doi.org/10.24093/awej/covid.28
