id,type,attributes.date_created,attributes.date_modified,attributes.date_published,attributes.original_publication_date,attributes.doi,attributes.title,attributes.description,attributes.is_published,attributes.is_preprint_orphan,attributes.tags,attributes.preprint_doi_created,attributes.date_withdrawn,attributes.current_user_permissions,attributes.public,attributes.reviews_state,attributes.date_last_transitioned,attributes.has_coi,attributes.conflict_of_interest_statement,attributes.has_data_links,attributes.why_no_data,attributes.data_links,attributes.has_prereg_links,attributes.why_no_prereg,attributes.prereg_links,attributes.prereg_link_info,attributes.subjects,attributes.license_record.copyright_holders,attributes.license_record.year,relationships.contributors.links.related.href,relationships.bibliographic_contributors.links.related.href,relationships.citation.links.related.href,relationships.citation.data.id,relationships.citation.data.type,relationships.identifiers.links.related.href,relationships.node.links.self.href,relationships.node.links.related.href,relationships.node.data.id,relationships.node.data.type,relationships.license.links.related.href,relationships.license.data.id,relationships.license.data.type,relationships.provider.links.related.href,relationships.provider.data.id,relationships.provider.data.type,relationships.files.links.related.href,relationships.primary_file.links.related.href,relationships.primary_file.data.id,relationships.primary_file.data.type,relationships.review_actions.links.related.href,relationships.requests.links.related.href,links.self,links.html,links.doi,links.preprint_doi
5t4mf,preprints,2019-06-03T17:30:51.231149,2020-07-19T12:57:00.177035,2019-06-05T03:17:55.260068,2019-06-01T04:00:00,10.1177/2329496519852691,Eco-Moms and Climate Change: The Moderating Effects of Fertility in Explaining Gender Differences in Concern,"Women typically report greater concern for the environment, including climate change, than men. The eco-mom theory—the belief that women have greater environmental concern than men because mothers primarily care about the health and safety of their children, while fathers primarily care about the economic support of their household—is often proffered as an explanation for this difference. Researchers who have previously tested the eco-mom theory have narrowly operationalized parenthood; we are skeptical of this theory and believe it needs additional testing. We look at fertility in relation to concern for climate change using the 2010 General Social Survey. Modeling parenthood like previous studies, we find no differences in concern for climate change between women who have children and those who do not. Modeling fertility, we find that having more children is associated with less concern for climate change for women but not men. Additionally, we find no gender difference in concern for climate change for those with many children, but these findings are complicated by education. Overall, we refute the eco-mom theory and call for new climate change survey data that better capture gender roles and identity as well as more qualitative inquiries into public concern for climate change.",TRUE,FALSE,climate change|eco-mom theory|environmental concern|gender|social roles theory,2019-06-05T03:18:29.818616,NA,,TRUE,accepted,2019-06-05T03:17:55.260068,NA,NA,NA,NA,,NA,NA,,NA,5a8c80f7c698300375c76d84|5a8c80fac698300375c76e20|5a8c80fac698300375c76e2f|Social and Behavioral Sciences|Sociology|Environmental Sociology,,2019,https://api.osf.io/v2/preprints/5t4mf/contributors/,https://api.osf.io/v2/preprints/5t4mf/bibliographic_contributors/,https://api.osf.io/v2/preprints/5t4mf/citation/,5t4mf,preprints,https://api.osf.io/v2/preprints/5t4mf/identifiers/,https://api.osf.io/v2/preprints/5t4mf/relationships/node/,NA,NA,NA,https://api.osf.io/v2/licenses/563c1cf88c5e4a3877f9e96a/,563c1cf88c5e4a3877f9e96a,licenses,https://api.osf.io/v2/providers/preprints/socarxiv/,socarxiv,preprint-providers,https://api.osf.io/v2/preprints/5t4mf/files/,https://api.osf.io/v2/files/5cf5594ed987b5001688f180/,5cf5594ed987b5001688f180,files,https://api.osf.io/v2/preprints/5t4mf/review_actions/,https://api.osf.io/v2/preprints/5t4mf/requests/,https://api.osf.io/v2/preprints/5t4mf/,https://osf.io/preprints/socarxiv/5t4mf/,https://doi.org/10.1177/2329496519852691,https://doi.org/10.31235/osf.io/5t4mf
azvhs,preprints,2019-06-03T14:42:11.157676,2020-07-19T12:57:07.899041,2019-06-04T11:26:02.757258,2019-06-01T22:00:00,10.1007/978-3-319-91206-6_125-2,"Puerto Rico, Colonialism, and Neocolonialism","This essay aims to briefly collect the historical context of colonialism in Puerto Rico since the Spanish era but primarily focuses on revealing the reasons to consider Puerto Rico as a colony and non-self-governing territory of the US – rather than a neocolony of the US. Later, the article addresses the three non-colonial options recognized by the 1514 United Nations (UN) Resolution and the results of the five referendums on the political status of the Caribbean archipelago held over the last five decades. The essay concludes that Puerto Rico is undoubtedly a colony and asks for the United Nations and the sovereign countries of the world to denounce this illegal colonial relationship that subordinates residents of Puerto Rico to the will of the US Congress where they have no voting representatives.",TRUE,FALSE,Caribbean|colonialism|Imperialism|Latin America|Puerto Rico|Small island state|United states,2019-06-04T11:32:50.462570,NA,,TRUE,accepted,2019-06-04T11:26:02.757258,NA,NA,not_applicable,NA,,NA,NA,,NA,5a8c80f7c698300375c76d84|5a8c80f7c698300375c76d8e|5a8c80f7c698300375c76d8f|Social and Behavioral Sciences|International and Area Studies|Latin American Studies|5a8c80f7c698300375c76d84|5a8c80f8c698300375c76daf|Social and Behavioral Sciences|Political Science,,2019,https://api.osf.io/v2/preprints/azvhs/contributors/,https://api.osf.io/v2/preprints/azvhs/bibliographic_contributors/,https://api.osf.io/v2/preprints/azvhs/citation/,azvhs,preprints,https://api.osf.io/v2/preprints/azvhs/identifiers/,https://api.osf.io/v2/preprints/azvhs/relationships/node/,NA,NA,NA,https://api.osf.io/v2/licenses/5ad7979bc69830002d8190e3/,5ad7979bc69830002d8190e3,licenses,https://api.osf.io/v2/providers/preprints/socarxiv/,socarxiv,preprint-providers,https://api.osf.io/v2/preprints/azvhs/files/,https://api.osf.io/v2/files/5cf531c76677ac0019f30ed9/,5cf531c76677ac0019f30ed9,files,https://api.osf.io/v2/preprints/azvhs/review_actions/,https://api.osf.io/v2/preprints/azvhs/requests/,https://api.osf.io/v2/preprints/azvhs/,https://osf.io/preprints/socarxiv/azvhs/,https://doi.org/10.1007/978-3-319-91206-6_125-2,https://doi.org/10.31235/osf.io/azvhs
ygh8d,preprints,2019-06-03T14:38:22.853736,2020-07-19T12:57:13.238017,2019-06-04T11:26:28.454518,2019-04-16T22:00:00,10.4324/9780429471087,"Comparative social policy in contemporary Latin America: Concepts, theories and a research agenda",This is the introductory chapter of the book Welfare and Social Protection in Contemporary Latin America. The purpose of the book is threefold: (i) to present a historical and theoretical analysis of social protection systems and welfare regimes in contemporary Latin America; (ii) to discuss the politics of contemporary social protection and how national/global actors and institutions shape social policy in the region; and (iii) to examine several debates on social protection and welfare systems in contemporary Latin America. The chapter presents state-of-the-art research in the areas of social policy and welfare that is examined in each of the three parts of the book. What do we know about welfare regimes in Latin America? What do we know about the role of (f)actors shaping social protection development and inclusion? What do we know about recent debates regarding social protection and welfare in Latin America? Particular attention is paid to the contribution made by chapters in this edited volume to the social policy literature. The chapter finishes with a description of the content and results of each chapter in this edited volume.,TRUE,FALSE,Caribbean|Comparative Politics|Latin America|social protection|welfare state,2019-06-04T11:33:08.368589,NA,,TRUE,accepted,2019-06-04T11:26:28.454518,NA,NA,NA,NA,,NA,NA,,NA,"5a8c80f7c698300375c76d84|5a8c80f8c698300375c76ddb|5a8c80f9c698300375c76de0|Social and Behavioral Sciences|Public Affairs, Public Policy and Public Administration|Social Policy",,2019,https://api.osf.io/v2/preprints/ygh8d/contributors/,https://api.osf.io/v2/preprints/ygh8d/bibliographic_contributors/,https://api.osf.io/v2/preprints/ygh8d/citation/,ygh8d,preprints,https://api.osf.io/v2/preprints/ygh8d/identifiers/,https://api.osf.io/v2/preprints/ygh8d/relationships/node/,NA,NA,NA,https://api.osf.io/v2/licenses/5ad7979bc69830002d8190e3/,5ad7979bc69830002d8190e3,licenses,https://api.osf.io/v2/providers/preprints/socarxiv/,socarxiv,preprint-providers,https://api.osf.io/v2/preprints/ygh8d/files/,https://api.osf.io/v2/files/5cf530e4b1efc000178db10e/,5cf530e4b1efc000178db10e,files,https://api.osf.io/v2/preprints/ygh8d/review_actions/,https://api.osf.io/v2/preprints/ygh8d/requests/,https://api.osf.io/v2/preprints/ygh8d/,https://osf.io/preprints/socarxiv/ygh8d/,https://doi.org/10.4324/9780429471087,https://doi.org/10.31235/osf.io/ygh8d
c6rvq,preprints,2019-06-03T11:49:49.123848,2019-06-05T03:16:50.417317,2019-06-05T03:16:29.165913,NA,NA,Review of What is Political Sociology? by Nga Than,"In What is Political Sociology?, Elisabeth S. Clemens offers a smart primer on political sociology that asks what is distinct about this sub-field. By surveying its main concepts and research agendas—power and politics, states, nation-states, social movements, social change, and transnationalism—she shows how political sociology examines social processes that influence both formal politics and the politics that take place in everyday settings. Clemens notes that that political sociology differs from political science in that the former studies politics in various settings and that patterns of political participation and the distribution of political power are shaped by social relations, while the latter studies “the formal institutions and acts of governing” (p.1).",TRUE,FALSE,Political Sociology|Social Cage|Social Closure,2019-06-05T03:16:50.396506,NA,,TRUE,accepted,2019-06-05T03:16:29.165913,NA,NA,NA,NA,,NA,NA,,NA,5a8c80f7c698300375c76d84|5a8c80fac698300375c76e20|5a8c80fac698300375c76e3f|Social and Behavioral Sciences|Sociology|Political Sociology,Nga Than,2019,https://api.osf.io/v2/preprints/c6rvq/contributors/,https://api.osf.io/v2/preprints/c6rvq/bibliographic_contributors/,https://api.osf.io/v2/preprints/c6rvq/citation/,c6rvq,preprints,https://api.osf.io/v2/preprints/c6rvq/identifiers/,https://api.osf.io/v2/preprints/c6rvq/relationships/node/,NA,NA,NA,https://api.osf.io/v2/licenses/563c1cf88c5e4a3877f9e965/,563c1cf88c5e4a3877f9e965,licenses,https://api.osf.io/v2/providers/preprints/socarxiv/,socarxiv,preprint-providers,https://api.osf.io/v2/preprints/c6rvq/files/,https://api.osf.io/v2/files/5cf509622a50c4001789bd10/,5cf509622a50c4001789bd10,files,https://api.osf.io/v2/preprints/c6rvq/review_actions/,https://api.osf.io/v2/preprints/c6rvq/requests/,https://api.osf.io/v2/preprints/c6rvq/,https://osf.io/preprints/socarxiv/c6rvq/,NA,https://doi.org/10.31235/osf.io/c6rvq
324wv,preprints,2019-06-02T17:39:11.922166,2020-02-12T18:17:33.723737,2019-06-04T11:28:33.554681,2017-07-31T04:00:00,NA,A Coding of Social Class for the General Social Survey,"This report provides a coding of EGP social classes that can be implemented for data sources, such as the General Social Survey, that utilize the 2010 US Census occupational classification. The report explains the rationale for the coding as well as the specific coding decisions. It demonstrates how to implement the coding for the General Social Survey, and it presents a comparison of EGP social classes in both the GSS and the American Community Survey.",TRUE,FALSE,American Community Surveys|class analysis|General Social Survey|occupation|social class,2019-06-04T11:33:10.149597,NA,,TRUE,accepted,2019-06-04T11:28:33.554681,NA,NA,NA,NA,,NA,NA,,NA,5a8c80f7c698300375c76d84|5a8c80fac698300375c76e20|Social and Behavioral Sciences|Sociology,,2019,https://api.osf.io/v2/preprints/324wv/contributors/,https://api.osf.io/v2/preprints/324wv/bibliographic_contributors/,https://api.osf.io/v2/preprints/324wv/citation/,324wv,preprints,https://api.osf.io/v2/preprints/324wv/identifiers/,https://api.osf.io/v2/preprints/324wv/relationships/node/,https://api.osf.io/v2/nodes/9nkrw/,9nkrw,nodes,https://api.osf.io/v2/licenses/563c1cf88c5e4a3877f9e96a/,563c1cf88c5e4a3877f9e96a,licenses,https://api.osf.io/v2/providers/preprints/socarxiv/,socarxiv,preprint-providers,https://api.osf.io/v2/preprints/324wv/files/,https://api.osf.io/v2/files/5cf409c323fec40018eac8b6/,5cf409c323fec40018eac8b6,files,https://api.osf.io/v2/preprints/324wv/review_actions/,https://api.osf.io/v2/preprints/324wv/requests/,https://api.osf.io/v2/preprints/324wv/,https://osf.io/preprints/socarxiv/324wv/,NA,https://doi.org/10.31235/osf.io/324wv
nmxcr,preprints,2019-06-02T14:52:54.494894,2019-11-05T19:19:37.144440,2019-06-02T15:08:38.799992,2019-06-02T04:00:00,10.1177/2378023119871119,Economic Populism and Bandwagon Bigotry:  Obama-to-Trump Voters and the Cross Pressures of the 2016 Election,"Through an analysis of validated voters in the 2016 American National Election Study, this article considers the voters who supported Obama in 2012 and Trump in 2016.  More than 5.7 million in total, Obama-to-Trump voters were essential to Trump’s victory in the Electoral College.  They were more likely to be white, working class, and resident in the Midwest.  They had lower levels of political interest, were centrist in both party affiliation and ideology, and were late deciders for the 2016 election.  On economic interests, they were centrists, except for trade policy, which they viewed, on average, as a greater threat than other voters.  They claimed to have more experience with economic vulnerability than Democratic loyalists of comparable social standing.  On racial attitudes, including the racialized economic topic of immigration, they had a profile similar to Republican loyalists.  While their support of Trump may be attributable to surging white nativism, this article argues for an alternative explanation.  Voters who were attracted by Trump’s economic populism only joined his coalition if they could accept his racialized rhetoric.  As a result, the Trump bandwagon predominantly attracted generically bigoted voters with racial attitudes similar to Republican loyalists.",TRUE,FALSE,Cross pressures|Obama|Populism|Trump|Votes,2019-06-02T15:09:01.211510,NA,,TRUE,accepted,2019-06-02T15:08:38.799992,NA,NA,NA,NA,,NA,NA,,NA,5a8c80f7c698300375c76d84|5a8c80f8c698300375c76daf|5a8c80f8c698300375c76db5|Social and Behavioral Sciences|Political Science|American Politics|5a8c80f7c698300375c76d84|5a8c80fac698300375c76e20|5a8c80fac698300375c76e3f|Social and Behavioral Sciences|Sociology|Political Sociology,,2019,https://api.osf.io/v2/preprints/nmxcr/contributors/,https://api.osf.io/v2/preprints/nmxcr/bibliographic_contributors/,https://api.osf.io/v2/preprints/nmxcr/citation/,nmxcr,preprints,https://api.osf.io/v2/preprints/nmxcr/identifiers/,https://api.osf.io/v2/preprints/nmxcr/relationships/node/,NA,NA,NA,https://api.osf.io/v2/licenses/563c1cf88c5e4a3877f9e96a/,563c1cf88c5e4a3877f9e96a,licenses,https://api.osf.io/v2/providers/preprints/socarxiv/,socarxiv,preprint-providers,https://api.osf.io/v2/preprints/nmxcr/files/,https://api.osf.io/v2/files/5cf3e2cd35f2580018ac4484/,5cf3e2cd35f2580018ac4484,files,https://api.osf.io/v2/preprints/nmxcr/review_actions/,https://api.osf.io/v2/preprints/nmxcr/requests/,https://api.osf.io/v2/preprints/nmxcr/,https://osf.io/preprints/socarxiv/nmxcr/,https://doi.org/10.1177/2378023119871119,https://doi.org/10.31235/osf.io/nmxcr
twx9v,preprints,2019-06-02T12:02:05.630186,2019-06-04T11:33:27.056950,2019-06-04T11:29:10.219120,2016-12-09T00:00:00,NA,Scuba Diving and Sensing the Deep,"Research into the sensuous practices which constitute the phenomenological foundations of sporting experience has been relatively underdeveloped. This paper seeks to address this state of affairs by portraying the sensory activity involved in doing scuba diving. Drawing on the work of Bourdieu and Crossley and using data from interviews with an expert scuba diving instructor, the paper details a spectrum of sensuous activity encompassing moving, touching, listening and hearing in the underwater environment. The paper concludes with a call for the development of sensory studies across the spectrum of sporting activity so as to provide a more adequate foundational link to theorising about sport.",TRUE,FALSE,scuba|senses|sociology of sport|sport|sport psychology,2019-06-04T11:33:27.007506,NA,,TRUE,accepted,2019-06-04T11:29:10.219120,NA,NA,NA,NA,,NA,NA,,NA,5a8c80f7c698300375c76d84|5a8c80f7c698300375c76d98|5a8c80f8c698300375c76dac|Social and Behavioral Sciences|Psychology|Other Psychology|5a8c80f7c698300375c76d84|5a8c80f9c698300375c76df5|Social and Behavioral Sciences|Sports Studies|5a8c80f7c698300375c76d84|5a8c80fac698300375c76e20|5a8c80fac698300375c76e50|Social and Behavioral Sciences|Sociology|Other Sociology,,2016,https://api.osf.io/v2/preprints/twx9v/contributors/,https://api.osf.io/v2/preprints/twx9v/bibliographic_contributors/,https://api.osf.io/v2/preprints/twx9v/citation/,twx9v,preprints,https://api.osf.io/v2/preprints/twx9v/identifiers/,https://api.osf.io/v2/preprints/twx9v/relationships/node/,NA,NA,NA,https://api.osf.io/v2/licenses/563c1cf88c5e4a3877f9e96a/,563c1cf88c5e4a3877f9e96a,licenses,https://api.osf.io/v2/providers/preprints/socarxiv/,socarxiv,preprint-providers,https://api.osf.io/v2/preprints/twx9v/files/,https://api.osf.io/v2/files/5cf3bac68d6e05001a62e3fa/,5cf3bac68d6e05001a62e3fa,files,https://api.osf.io/v2/preprints/twx9v/review_actions/,https://api.osf.io/v2/preprints/twx9v/requests/,https://api.osf.io/v2/preprints/twx9v/,https://osf.io/preprints/socarxiv/twx9v/,NA,https://doi.org/10.31235/osf.io/twx9v
45fn6,preprints,2019-06-01T21:03:12.773440,2019-08-20T17:24:04.035671,2019-06-04T11:29:33.589386,NA,NA,"Where there is smoke: Solid fuel externalities, gender, and adult respiratory health in India","Chronic respiratory conditions are a leading cause of death in the world. Using data on lung obstruction from the WHO Survey of Global AGEing and Adult Health (WHO-SAGE 2007-08), this paper studies the determinants of respiratory health in India, home to a third of all deaths from Chronic Obstructive Pulmonary Disease. First, we find that smokers and members of households that use solid fuels (wood, biomass, coal or dung) for cooking have higher lung obstruction. Second, even if a respondent's household uses clean fuels, their lung obstruction is higher if their neighbors use solid fuels. In neighborhoods with high solid fuel use, the lungs of members of households that use clean fuels can be as obstructed as lungs of members of households that use solid fuels. These negative externalities of solid fuel use are robust to additional controls for neighborhood socioeconomic status, falsification tests, tests with placebo measures, and tests using alternative measures of respiratory health as outcomes. Third, the influence of the determinants is patterned by gender. Smoking tobacco is an important influence on lung obstruction among men. Confirming non-linear dose-response relationships, we find that women from households that use solid fuels are the only group not further harmed by neighborhood solid fuel smoke, possibly because of high exposure to pollutants while cooking. The study improves our understanding of behavioral, social, and environmental determinants of respiratory health in India. Importantly, it makes a case for greater public investments to promote the adoption and use of cleaner fuels.",TRUE,FALSE,gender|India|lung obstruction|negative externalities|respiratory health|solid fuels,2019-06-04T11:33:52.763942,NA,,TRUE,accepted,2019-06-04T11:29:33.589386,NA,NA,NA,NA,,NA,NA,,NA,"5a8c80f7c698300375c76d84|5a8c80f8c698300375c76db6|Social and Behavioral Sciences|Agricultural and Resource Economics|5a8c80f7c698300375c76d84|5a8c80f8c698300375c76dbd|Social and Behavioral Sciences|Environmental Studies|5a8c80f7c698300375c76d84|5a8c80f8c698300375c76dbe|5a8c80f8c698300375c76dcd|Social and Behavioral Sciences|Economics|Health Economics|5a8c80f7c698300375c76d84|5a8c80f8c698300375c76ddb|5a8c80f9c698300375c76de2|Social and Behavioral Sciences|Public Affairs, Public Policy and Public Administration|Health Policy|5a8c80f7c698300375c76d84|5a8c80f8c698300375c76ddb|5a8c80f9c698300375c76de6|Social and Behavioral Sciences|Public Affairs, Public Policy and Public Administration|Energy Policy|5a8c80f7c698300375c76d84|5a8c80f8c698300375c76ddb|5a8c80f9c698300375c76df0|Social and Behavioral Sciences|Public Affairs, Public Policy and Public Administration|Environmental Policy|5a8c80f7c698300375c76d84|5a8c80fac698300375c76e20|5a8c80fac698300375c76e2f|Social and Behavioral Sciences|Sociology|Environmental Sociology|5a8c80f7c698300375c76d84|5a8c80fac698300375c76e20|5a8c80fac698300375c76e33|Social and Behavioral Sciences|Sociology|Development",,2019,https://api.osf.io/v2/preprints/45fn6/contributors/,https://api.osf.io/v2/preprints/45fn6/bibliographic_contributors/,https://api.osf.io/v2/preprints/45fn6/citation/,45fn6,preprints,https://api.osf.io/v2/preprints/45fn6/identifiers/,https://api.osf.io/v2/preprints/45fn6/relationships/node/,NA,NA,NA,https://api.osf.io/v2/licenses/563c1cf88c5e4a3877f9e96a/,563c1cf88c5e4a3877f9e96a,licenses,https://api.osf.io/v2/providers/preprints/socarxiv/,socarxiv,preprint-providers,https://api.osf.io/v2/preprints/45fn6/files/,https://api.osf.io/v2/files/5cf2e8202a50c4001983cfe2/,5cf2e8202a50c4001983cfe2,files,https://api.osf.io/v2/preprints/45fn6/review_actions/,https://api.osf.io/v2/preprints/45fn6/requests/,https://api.osf.io/v2/preprints/45fn6/,https://osf.io/preprints/socarxiv/45fn6/,NA,https://doi.org/10.31235/osf.io/45fn6
85ez6,preprints,2019-06-01T00:16:31.275290,2019-06-01T00:33:47.223361,2019-06-01T00:33:21.941903,NA,NA,A simulation model of diffusion with schemas,"Although models for network diffusion have proliferated over the last 25 years, few have accounted for a fundamental truth about diffusion: ideas, information, and innovations change as they diffuse.  This study develops a simulation model that incorporates two of the ways that ideas can change as they spread from person to person.  First, ideas can be misinterpreted, or repeated to another person with error.  Second, people can generate new ideas by recombining two schemas, meaning two frameworks for ideas that they already know.  To simulate this, I seed a population with a set of 3 bit idea frameworks, which I refer to as schemas, and then simulate communication by letting a person draw a 5 bit string from the 3 bit schema, or by creatively recombining 2 3-bit frameworks into a 5 bit string.  The recipient of the 5-bit string matches the received string to the set of schemas that he or she already knows.  If he or she receives several bits that cannot be matched to an existing schema, he or she creates a new one.  To explore the parameter space, I vary the probability with which people draw from a single schema versus combining two existing schemas.  The results of this simulation suggest, paradoxically, that creatively recombining schemas leads to less diverse outcomes, and that some ideas are more likely to stick than others.",TRUE,FALSE,,2019-06-01T00:33:46.958504,NA,,TRUE,accepted,2019-06-01T00:33:21.941903,NA,NA,NA,NA,,NA,NA,,NA,5a8c80f7c698300375c76d84|5a8c80fac698300375c76e20|Social and Behavioral Sciences|Sociology,,2019,https://api.osf.io/v2/preprints/85ez6/contributors/,https://api.osf.io/v2/preprints/85ez6/bibliographic_contributors/,https://api.osf.io/v2/preprints/85ez6/citation/,85ez6,preprints,https://api.osf.io/v2/preprints/85ez6/identifiers/,https://api.osf.io/v2/preprints/85ez6/relationships/node/,NA,NA,NA,https://api.osf.io/v2/licenses/563c1cf88c5e4a3877f9e96a/,563c1cf88c5e4a3877f9e96a,licenses,https://api.osf.io/v2/providers/preprints/socarxiv/,socarxiv,preprint-providers,https://api.osf.io/v2/preprints/85ez6/files/,https://api.osf.io/v2/files/5cf1c3e623fec4001ae8ef50/,5cf1c3e623fec4001ae8ef50,files,https://api.osf.io/v2/preprints/85ez6/review_actions/,https://api.osf.io/v2/preprints/85ez6/requests/,https://api.osf.io/v2/preprints/85ez6/,https://osf.io/preprints/socarxiv/85ez6/,NA,https://doi.org/10.31235/osf.io/85ez6
