id,type,attributes.date_created,attributes.date_modified,attributes.date_published,attributes.original_publication_date,attributes.doi,attributes.title,attributes.description,attributes.is_published,attributes.is_preprint_orphan,attributes.tags,attributes.preprint_doi_created,attributes.date_withdrawn,attributes.current_user_permissions,attributes.public,attributes.reviews_state,attributes.date_last_transitioned,attributes.has_coi,attributes.conflict_of_interest_statement,attributes.has_data_links,attributes.why_no_data,attributes.data_links,attributes.has_prereg_links,attributes.why_no_prereg,attributes.prereg_links,attributes.prereg_link_info,attributes.subjects,attributes.license_record.copyright_holders,attributes.license_record.year,relationships.contributors.links.related.href,relationships.bibliographic_contributors.links.related.href,relationships.citation.links.related.href,relationships.citation.data.id,relationships.citation.data.type,relationships.identifiers.links.related.href,relationships.node.links.self.href,relationships.node.links.related.href,relationships.node.data.id,relationships.node.data.type,relationships.license.links.related.href,relationships.license.data.id,relationships.license.data.type,relationships.provider.links.related.href,relationships.provider.data.id,relationships.provider.data.type,relationships.files.links.related.href,relationships.primary_file.links.related.href,relationships.primary_file.data.id,relationships.primary_file.data.type,relationships.review_actions.links.related.href,relationships.requests.links.related.href,links.self,links.html,links.preprint_doi,links.doi
rz9gw,preprints,2019-04-10T17:06:31.481886,2019-04-11T23:41:25.235877,2019-04-11T23:40:58.150445,2016-12-20T05:00:00,NA,"Power, Discourse, and Knowledge in Computer Science Education Advocacy: An Analysis of Popular Code.org Videos","Universal computer science education (CS for All) policies have been gaining momentum in localities across the United States. The value of CS education is often presented to the public as non-partisan and non-controversial. To uncover the kinds of discourses about CS education that have become “discursive facts,” and how they define and frame notions of “equity” within CS for All initiatives, I apply theories from poststructural, deconstructionist, and critical traditions to the analysis of two different versions of a popular CS education advocacy video created by the non-profit Code.org. Arguments for computer science education offered in these texts merge historical and traditional views of “science” as apolitical and objective with neoliberal notions about competition, personal agency and individualism, constructions that view programming as tools to further an omniscient male gaze, and programmers themselves as “magic.” By reifying neoliberal and gendered subject positions, such discursive moves in CS ed advocacy potentially hinder equity work in the long-run",TRUE,FALSE,Code.org|Computer Science Education|CS4All|CS for All|Discourse analysis|Foucault,2019-04-11T23:41:25.218093,NA,,TRUE,accepted,2019-04-11T23:40:58.150445,NA,NA,NA,NA,NA,NA,NA,NA,NA,"5a8c80f6c698300375c76d4e|5a8c80f7c698300375c76d65|Education|Other Education|5a8c80f6c698300375c76d4e|5a8c80f7c698300375c76d66|Education|Bilingual, Multilingual, and Multicultural Education|5a8c80f6c698300375c76d4e|5a8c80f7c698300375c76d6a|Education|Disability and Equity in Education",,2019,https://api.osf.io/v2/preprints/rz9gw/contributors/,https://api.osf.io/v2/preprints/rz9gw/bibliographic_contributors/,https://api.osf.io/v2/preprints/rz9gw/citation/,rz9gw,preprints,https://api.osf.io/v2/preprints/rz9gw/identifiers/,https://api.osf.io/v2/preprints/rz9gw/relationships/node/,NA,NA,NA,https://api.osf.io/v2/licenses/563c1cf88c5e4a3877f9e96a/,563c1cf88c5e4a3877f9e96a,licenses,https://api.osf.io/v2/providers/preprints/socarxiv/,socarxiv,preprint-providers,https://api.osf.io/v2/preprints/rz9gw/files/,https://api.osf.io/v2/files/5cae2299353c58001b975486/,5cae2299353c58001b975486,files,https://api.osf.io/v2/preprints/rz9gw/review_actions/,https://api.osf.io/v2/preprints/rz9gw/requests/,https://api.osf.io/v2/preprints/rz9gw/,https://osf.io/preprints/socarxiv/rz9gw/,https://doi.org/10.31235/osf.io/rz9gw,NA
9s5hj,preprints,2019-04-10T16:58:42.576976,2019-04-11T16:46:10.098331,2019-04-11T16:44:50.428937,2019-04-09T22:00:00,NA,Subgrouping the Timor-Alor-Pantar languages using systematic Bayesian inference,"This paper refines the subgroupings of the Timor-Alor-Pantar (TAP) family of Papuan languages, using a systematic Bayesian phylogenetics study. While recent work indicates that the TAP family comprises a Timor (T) branch and an Alor Pantar (AP) branch (Holton et al. 2012, Schapper et al. 2017) the internal structure of the AP branch has proven to be a challenging issue, and earlier studies leave large gaps in our understanding. Our Bayesian inference study is based on an extensive set of TAP lexical data from the online LexiRumah database (Kaiping &amp; Klamer, 2019). Systematically testing different approaches to cognate coding, loan exclusion, and explicit modelling choices, we arrive at a subgrouping structure of the TAP family that is based on features of the phylogenies shared across the different analyses. Our TAP tree differs from all earlier proposals by inferring the East-Alor subgroup as an early split-off from all other AP languages, instead of the most deeply embedded subgroup inside that branch.",TRUE,FALSE,Automatic cognate detection|Bayesian phylogenetics|Language family|Languages of Indonesia|Languages of Timor-Leste|Lexical database|Timor-Alor-Pantar languages,2019-04-11T16:46:10.071350,NA,,TRUE,accepted,2019-04-11T16:44:50.428937,NA,NA,NA,NA,NA,NA,NA,NA,NA,5a8c80f7c698300375c76d84|5a8c80f9c698300375c76dfd|5a8c80f9c698300375c76dff|Social and Behavioral Sciences|Linguistics|Computational Linguistics|5a8c80f7c698300375c76d84|5a8c80f9c698300375c76dfd|5a8c80f9c698300375c76e09|Social and Behavioral Sciences|Linguistics|Comparative and Historical Linguistics,Gereon A. Kaiping|Marian Klamer,2019,https://api.osf.io/v2/preprints/9s5hj/contributors/,https://api.osf.io/v2/preprints/9s5hj/bibliographic_contributors/,https://api.osf.io/v2/preprints/9s5hj/citation/,9s5hj,preprints,https://api.osf.io/v2/preprints/9s5hj/identifiers/,https://api.osf.io/v2/preprints/9s5hj/relationships/node/,https://api.osf.io/v2/nodes/gpnxm/,gpnxm,nodes,https://api.osf.io/v2/licenses/563c1cf88c5e4a3877f9e965/,563c1cf88c5e4a3877f9e965,licenses,https://api.osf.io/v2/providers/preprints/socarxiv/,socarxiv,preprint-providers,https://api.osf.io/v2/preprints/9s5hj/files/,https://api.osf.io/v2/files/5cae20d4a3bc97001aec7b34/,5cae20d4a3bc97001aec7b34,files,https://api.osf.io/v2/preprints/9s5hj/review_actions/,https://api.osf.io/v2/preprints/9s5hj/requests/,https://api.osf.io/v2/preprints/9s5hj/,https://osf.io/preprints/socarxiv/9s5hj/,https://doi.org/10.31235/osf.io/9s5hj,NA
hr86y,preprints,2019-04-10T12:45:31.901250,2019-04-11T16:44:44.397956,2019-04-11T16:43:05.409916,NA,NA,Understanding the Moral Attitudes Scale in International Surveys: an Exploratory Study,"Several large international surveys, including the World Values Survey and the European Values Study, have been using the moral attitudes scale (MAS) to measure individual and country differences for decades. However, the validity of the instrument has been barely assessed. The current study addressed the concurrent and content validity of four popular MAS items (justifiability of homosexuality, suicide, prostitution, and euthanasia). A sample of 493 Russians completed both MAS and the four validated multi-item scales. Results demonstrated that, except for the homosexuality item, the MAS items had low concurrent validity, explaining less than 50% of the variance of the corresponding multi-item scales. The MAS items underestimated the justifiability of homosexuality, prostitution, and suicide, and overestimated the justifiability of euthanasia. The MAS homosexuality item appeared to be a precise measure of attitude towards male (but not female) homosexuality, responses to the prostitution and suicide items overlooked the positive arguments, and the euthanasia item tapped more into attitudes towards euthanasia of a dying person. The four items showed strong dependence on the overall justifiability. We conclude that separate MAS items should be used with caution, given the detected content bias and the items’ strong link to non-specific overall justifiability.",TRUE,FALSE,Concurrent validity|European Values Study|Justifiability|Moral Attitudes Scale,2019-04-11T16:44:44.361038,NA,,TRUE,accepted,2019-04-11T16:43:05.409916,NA,NA,NA,NA,NA,NA,NA,NA,NA,5a8c80f7c698300375c76d84|5a8c80fac698300375c76e20|5a8c80fac698300375c76e2c|Social and Behavioral Sciences|Sociology|Methodology,,2019,https://api.osf.io/v2/preprints/hr86y/contributors/,https://api.osf.io/v2/preprints/hr86y/bibliographic_contributors/,https://api.osf.io/v2/preprints/hr86y/citation/,hr86y,preprints,https://api.osf.io/v2/preprints/hr86y/identifiers/,https://api.osf.io/v2/preprints/hr86y/relationships/node/,NA,NA,NA,https://api.osf.io/v2/licenses/563c1cf88c5e4a3877f9e96a/,563c1cf88c5e4a3877f9e96a,licenses,https://api.osf.io/v2/providers/preprints/socarxiv/,socarxiv,preprint-providers,https://api.osf.io/v2/preprints/hr86y/files/,https://api.osf.io/v2/files/5cade571e3915600175eea32/,5cade571e3915600175eea32,files,https://api.osf.io/v2/preprints/hr86y/review_actions/,https://api.osf.io/v2/preprints/hr86y/requests/,https://api.osf.io/v2/preprints/hr86y/,https://osf.io/preprints/socarxiv/hr86y/,https://doi.org/10.31235/osf.io/hr86y,NA
3v26f,preprints,2019-04-10T09:29:07.409084,2019-04-10T12:05:42.027709,2019-04-10T12:05:21.338300,2019-04-09T22:00:00,NA,"Why Bosnian Church did not belong to Bogomilism? ""Kr'stjani"" (mystics) vs ""Bogomili"" (dualists)","This paper in a simple and transparent way critically examines the rejected belief in science that Bosnian Church and its followers doctrinally and organisationally belonged to the dualist sect of Bogomilism. The research was carried out by a comparative analysis of the basic dualistic postulates of Gnosticism, Manichaeism and Bogomilism on the one hand and the available domestic sources of the Bosnian Church on the other. The importance of the work is reflected in the concise and detailed scientific argumentation that undermines ""Bogomil Bosnian Church"" myth, while offering a new scientific thesis on the religious and doctrinological affiliation of the ""Bosnian faith"" and the Bosnian ""krs'tjani"". In the first part, the paper deals with the problem of extreme and moderate dualism, with a special emphasis on the Neognostic, Neomanichaean and Bogomil communities in medieval Balkans. In the second part, the basic premises of Christian mysticism are given, including the possibility of its philosophical and theological compatibility with the teachings of the Bosnian Church, where for the first time the phenomenon of the name ""kr'stjani"" is explained in relation to the mystical union (""unio mystica"").",TRUE,FALSE,apocalypse|bogomilism|Bosnian Church|christian mysticism|dualism|extreme dualism|gnosticism|krstjani|manichaeism|moderate dualism|new testament|ordo de Bulgaria|ordo de Drugonthia|ordo de Sclavonia,2019-04-10T12:05:41.967473,NA,,TRUE,accepted,2019-04-10T12:05:21.338300,NA,NA,NA,NA,NA,NA,NA,NA,NA,5a8c80f2c698300375c76c7d|5a8c80f4c698300375c76cac|Arts and Humanities|Religion|5a8c80f2c698300375c76c7d|5a8c80f4c698300375c76ccc|Arts and Humanities|History|5a8c80f2c698300375c76c7d|5a8c80f6c698300375c76d21|Arts and Humanities|Medieval Studies,,2019,https://api.osf.io/v2/preprints/3v26f/contributors/,https://api.osf.io/v2/preprints/3v26f/bibliographic_contributors/,https://api.osf.io/v2/preprints/3v26f/citation/,3v26f,preprints,https://api.osf.io/v2/preprints/3v26f/identifiers/,https://api.osf.io/v2/preprints/3v26f/relationships/node/,NA,NA,NA,https://api.osf.io/v2/licenses/563c1cf88c5e4a3877f9e96c/,563c1cf88c5e4a3877f9e96c,licenses,https://api.osf.io/v2/providers/preprints/socarxiv/,socarxiv,preprint-providers,https://api.osf.io/v2/preprints/3v26f/files/,https://api.osf.io/v2/files/5cadb76ae3915600175eb0db/,5cadb76ae3915600175eb0db,files,https://api.osf.io/v2/preprints/3v26f/review_actions/,https://api.osf.io/v2/preprints/3v26f/requests/,https://api.osf.io/v2/preprints/3v26f/,https://osf.io/preprints/socarxiv/3v26f/,https://doi.org/10.31235/osf.io/3v26f,NA
4adhe,preprints,2019-04-10T08:44:16.834698,2020-12-04T12:14:50.248069,2019-04-10T12:06:06.348549,NA,NA,"Positional, mobility and reference effects: How does social class affect life satisfaction in Europe?","In this study, we analyse the effects of social class on life satisfaction and develop a theoretical framework that shows how social class affects life satisfaction through five pathways. Informed by this framework, we estimate the direct effects of class destination and class origin, the effect of own intergenerational class mobility as well as the effects of others’ class position and mobility (so-called reference effects). To do so, we utilize European Social Survey (ESS) waves 1 to 5 (2002-2010). We obtain information on life satisfaction as well as destination and origin class for about 100,000 respondents in 32 European countries. Our mobility analyses are performed with diagonal reference models, which allow for the consistent estimation of mobility effects. We find: (1) Class destination consistently and strongly structures life satisfaction across Europe. (2) Own class mobility positively impacts life satisfaction, particularly in Eastern Europe. (3) Other’s class mobility has a strong negative effect on life satisfaction. Especially the latter finding points to the hitherto neglected importance of reference effects when considering the impact of social class on
life satisfaction.",TRUE,FALSE,diagonal reference models|ESeC|reference effects|social class|social mobility|subjective well-being,2019-04-10T12:06:27.372133,NA,,TRUE,accepted,2019-04-10T12:06:06.348549,NA,NA,NA,NA,NA,NA,NA,NA,NA,5a8c80f7c698300375c76d84|5a8c80fac698300375c76e20|Social and Behavioral Sciences|Sociology,Caspar Kaiser|Nhat An Trinh,2019,https://api.osf.io/v2/preprints/4adhe/contributors/,https://api.osf.io/v2/preprints/4adhe/bibliographic_contributors/,https://api.osf.io/v2/preprints/4adhe/citation/,4adhe,preprints,https://api.osf.io/v2/preprints/4adhe/identifiers/,https://api.osf.io/v2/preprints/4adhe/relationships/node/,https://api.osf.io/v2/nodes/4wx26/,4wx26,nodes,https://api.osf.io/v2/licenses/563c1cf88c5e4a3877f9e96a/,563c1cf88c5e4a3877f9e96a,licenses,https://api.osf.io/v2/providers/preprints/socarxiv/,socarxiv,preprint-providers,https://api.osf.io/v2/preprints/4adhe/files/,https://api.osf.io/v2/files/5cadace666464b0017a3c417/,5cadace666464b0017a3c417,files,https://api.osf.io/v2/preprints/4adhe/review_actions/,https://api.osf.io/v2/preprints/4adhe/requests/,https://api.osf.io/v2/preprints/4adhe/,https://osf.io/preprints/socarxiv/4adhe/,https://doi.org/10.31235/osf.io/4adhe,NA
xnb7t,preprints,2019-04-09T21:30:56.872327,2019-04-11T13:14:41.682709,2019-04-09T22:03:17.612200,2019-04-09T05:00:00,NA,Power of Persuasion: Regime Legitimation During Authoritarian Elections,"Legitimation, the ways governments seek to justify their rule, is becoming an essential component of our understanding of authoritarian regimes. This paper seeks to measure the changes in legitimation efforts around the time of elections in authoritarian regimes. It is well understood that authoritarian regimes can benefit from the process and image of elections, as long as they remain managed. But it is less clear how these governments justify the management of such elections, and whether they are accepted by the population. Relying on detailed events data measuring the frequency of certain legitimating government statements, this paper tests whether electoral authoritarian regimes increase their justifications for remaining in power or devote their efforts to undermining the legitimacy of opposition parties in order to reduce the uncertainty of electoral loss.",TRUE,FALSE,Authoritarian Regimes|Elections|Human Rights|Legitimation|Propaganda|State Repression,2019-04-09T22:06:33.075967,NA,,TRUE,accepted,2019-04-09T22:03:17.612200,NA,NA,NA,NA,NA,NA,NA,NA,NA,5a8c80f7c698300375c76d84|5a8c80f8c698300375c76daf|5a8c80f8c698300375c76db0|Social and Behavioral Sciences|Political Science|International Relations|5a8c80f7c698300375c76d84|5a8c80f8c698300375c76daf|5a8c80f8c698300375c76db2|Social and Behavioral Sciences|Political Science|Comparative Politics,,2019,https://api.osf.io/v2/preprints/xnb7t/contributors/,https://api.osf.io/v2/preprints/xnb7t/bibliographic_contributors/,https://api.osf.io/v2/preprints/xnb7t/citation/,xnb7t,preprints,https://api.osf.io/v2/preprints/xnb7t/identifiers/,https://api.osf.io/v2/preprints/xnb7t/relationships/node/,https://api.osf.io/v2/nodes/5sjem/,5sjem,nodes,https://api.osf.io/v2/licenses/563c1cf88c5e4a3877f9e96a/,563c1cf88c5e4a3877f9e96a,licenses,https://api.osf.io/v2/providers/preprints/socarxiv/,socarxiv,preprint-providers,https://api.osf.io/v2/preprints/xnb7t/files/,https://api.osf.io/v2/files/5cad0f14404d5f0019efd9db/,5cad0f14404d5f0019efd9db,files,https://api.osf.io/v2/preprints/xnb7t/review_actions/,https://api.osf.io/v2/preprints/xnb7t/requests/,https://api.osf.io/v2/preprints/xnb7t/,https://osf.io/preprints/socarxiv/xnb7t/,https://doi.org/10.31235/osf.io/xnb7t,NA
kn9z7,preprints,2019-04-09T18:12:51.517187,2019-04-09T19:22:27.774121,2019-04-09T19:15:04.909833,2019-04-08T23:00:00,10.1177/0038038519838752,"The Rhetoric of Recessions: How British Newspapers Talk about the Poor When Unemployment Rises, 1896–2000","Recessions appear to coincide with an increasingly stigmatising presentation of poverty in parts of the media. Previous research on the connection between high unemployment and media discourse has often relied on case studies of periods when stigmatising rhetoric about the poor was increasing. We build on earlier work on how economic context affects media representations of poverty by creating a unique dataset that measures how often stigmatising descriptions of the poor are used in five centrist and right-wing British newspapers between 1896 and 2000. Our results suggest stigmatising rhetoric about the poor increases when unemployment rises, except at the peak of very deep recessions (e.g. the 1930s and 1980s). This pattern is consistent with the idea that newspapers deploy deeply embedded Malthusian explanations for poverty when those ideas resonate with the economic context, and so this stigmatising rhetoric of recessions is likely to recur during future economic crises.",TRUE,FALSE,media|poverty|recession,2019-04-09T19:22:27.684619,NA,,TRUE,accepted,2019-04-09T19:15:04.909833,NA,NA,NA,NA,NA,NA,NA,NA,NA,"5a8c80f7c698300375c76d84|5a8c80fac698300375c76e20|5a8c80fac698300375c76e35|Social and Behavioral Sciences|Sociology|Inequality, Poverty, and Mobility",,2019,https://api.osf.io/v2/preprints/kn9z7/contributors/,https://api.osf.io/v2/preprints/kn9z7/bibliographic_contributors/,https://api.osf.io/v2/preprints/kn9z7/citation/,kn9z7,preprints,https://api.osf.io/v2/preprints/kn9z7/identifiers/,https://api.osf.io/v2/preprints/kn9z7/relationships/node/,https://api.osf.io/v2/nodes/atse3/,atse3,nodes,https://api.osf.io/v2/licenses/563c1cf88c5e4a3877f9e96a/,563c1cf88c5e4a3877f9e96a,licenses,https://api.osf.io/v2/providers/preprints/socarxiv/,socarxiv,preprint-providers,https://api.osf.io/v2/preprints/kn9z7/files/,https://api.osf.io/v2/files/5cace0ace3915600165d2a6e/,5cace0ace3915600165d2a6e,files,https://api.osf.io/v2/preprints/kn9z7/review_actions/,https://api.osf.io/v2/preprints/kn9z7/requests/,https://api.osf.io/v2/preprints/kn9z7/,https://osf.io/preprints/socarxiv/kn9z7/,https://doi.org/10.31235/osf.io/kn9z7,https://doi.org/10.1177/0038038519838752
shp68,preprints,2019-04-09T05:04:08.453619,2021-01-29T17:02:52.441653,2019-04-09T10:51:47.521918,NA,10.3389/feart.2020.620856,Hydroclimate variability influenced social interaction in the prehistoric American Southwest,"When droughts and floods struck ancient agrarian societies, complex networks of exchange and interaction channeled resources into affected settlements and migrant flows away from them. Did these networks evolve in part to connect populations living in differing climate regimes? Here, I examine this relationship with a long-term archaeological case study in the pre-Hispanic North American Southwest, analyzing 7.5 million artifacts from a 250-year period at nearly 500 archaeological sites. I use these artifacts to estimate how the flow of social information changed over time, and to measure how the intensity of social interaction between sites varied as a function of distance and several regional drought patterns. Social interaction decayed with distance, but ties between sites in differing oceanic and continental climate regimes were often stronger than expected. Accounting for these different regional drivers of local climate variability will be crucial for understanding the social impacts of droughts and floods in the past and present.",TRUE,FALSE,archaeological networks|drought patterns|spatial interaction model,2019-04-09T10:52:02.041066,NA,,TRUE,accepted,2019-04-09T10:51:47.521918,NA,NA,NA,NA,NA,NA,NA,NA,NA,5a8c80f7c698300375c76d84|5a8c80f7c698300375c76d86|5a8c80f7c698300375c76d8c|Social and Behavioral Sciences|Geography|Nature and Society Relations|5a8c80f7c698300375c76d84|5a8c80f9c698300375c76df6|5a8c80f9c698300375c76dfb|Social and Behavioral Sciences|Anthropology|Archaeological Anthropology,,2019,https://api.osf.io/v2/preprints/shp68/contributors/,https://api.osf.io/v2/preprints/shp68/bibliographic_contributors/,https://api.osf.io/v2/preprints/shp68/citation/,shp68,preprints,https://api.osf.io/v2/preprints/shp68/identifiers/,https://api.osf.io/v2/preprints/shp68/relationships/node/,NA,NA,NA,https://api.osf.io/v2/licenses/563c1cf88c5e4a3877f9e96c/,563c1cf88c5e4a3877f9e96c,licenses,https://api.osf.io/v2/providers/preprints/socarxiv/,socarxiv,preprint-providers,https://api.osf.io/v2/preprints/shp68/files/,https://api.osf.io/v2/files/5cac27cae3915600175c9bf4/,5cac27cae3915600175c9bf4,files,https://api.osf.io/v2/preprints/shp68/review_actions/,https://api.osf.io/v2/preprints/shp68/requests/,https://api.osf.io/v2/preprints/shp68/,https://osf.io/preprints/socarxiv/shp68/,https://doi.org/10.31235/osf.io/shp68,https://doi.org/10.3389/feart.2020.620856
4yxp2,preprints,2019-04-08T17:29:26.117255,2019-04-09T13:24:02.984247,2019-04-08T22:25:43.860727,2019-04-07T23:00:00,NA,The impact of IoT security labelling on consumer product choice and willingness to pay,"Internet of Things (IoT) devices such as security cameras and smart TVs vary considerably in the extent to which they provide security features to protect users from online threats, and it is currently difficult for consumers to differentiate between them.  This creates a barrier to the adoption of purchasing behaviours that would help protect consumers from cybercrime.  One proposal to address this is for IoT devices to carry a security label to help consumers navigate the market. Using a discrete choice experiment, we estimate the potential impact of such labels on participant’s decision making, after controlling for the influence of device functionality and price.  We estimate the impact of three different labelling schemes on consumer choice, and their willingness to pay for devices that carried each of them.  With the exception of a Graded label that implied a device had weak security, participants were significantly more likely to select a device that carried a label than one that did not. Participants were also willing to pay more for devices with premium functionality and those that came with a security label.  While they were generally willing to pay more for premium functionality than security, for two of the labels tested, they were prepared to pay the same amounts. Qualitative responses suggest that participants would use a label to inform purchasing decisions, and that the labels did not generate a false sense of security.  Our findings suggest that the use of a security label represents a policy option that could influence behaviour and that should be seriously considered.",TRUE,FALSE,Internet of Things|Labelling schemes|Willingness to Pay,2019-04-08T22:26:01.492933,NA,,TRUE,accepted,2019-04-08T22:25:43.860727,NA,NA,NA,NA,NA,NA,NA,NA,NA,5a8c80f7c698300375c76d84|5a8c80f9c698300375c76df4|Social and Behavioral Sciences|Science and Technology Studies,Shane D Johnson|John Blythe|Matthew Manning|and Gabriel Wong,2019,https://api.osf.io/v2/preprints/4yxp2/contributors/,https://api.osf.io/v2/preprints/4yxp2/bibliographic_contributors/,https://api.osf.io/v2/preprints/4yxp2/citation/,4yxp2,preprints,https://api.osf.io/v2/preprints/4yxp2/identifiers/,https://api.osf.io/v2/preprints/4yxp2/relationships/node/,NA,NA,NA,https://api.osf.io/v2/licenses/563c1cf88c5e4a3877f9e965/,563c1cf88c5e4a3877f9e965,licenses,https://api.osf.io/v2/providers/preprints/socarxiv/,socarxiv,preprint-providers,https://api.osf.io/v2/preprints/4yxp2/files/,https://api.osf.io/v2/files/5cab84f9641d10001abfc6d8/,5cab84f9641d10001abfc6d8,files,https://api.osf.io/v2/preprints/4yxp2/review_actions/,https://api.osf.io/v2/preprints/4yxp2/requests/,https://api.osf.io/v2/preprints/4yxp2/,https://osf.io/preprints/socarxiv/4yxp2/,https://doi.org/10.31235/osf.io/4yxp2,NA
