id,type,attributes.date_created,attributes.date_modified,attributes.date_published,attributes.original_publication_date,attributes.doi,attributes.title,attributes.description,attributes.is_published,attributes.is_preprint_orphan,attributes.tags,attributes.preprint_doi_created,attributes.date_withdrawn,attributes.current_user_permissions,attributes.public,attributes.reviews_state,attributes.date_last_transitioned,attributes.has_coi,attributes.conflict_of_interest_statement,attributes.has_data_links,attributes.why_no_data,attributes.data_links,attributes.has_prereg_links,attributes.why_no_prereg,attributes.prereg_links,attributes.prereg_link_info,attributes.subjects,attributes.license_record.copyright_holders,attributes.license_record.year,relationships.contributors.links.related.href,relationships.bibliographic_contributors.links.related.href,relationships.citation.links.related.href,relationships.citation.data.id,relationships.citation.data.type,relationships.identifiers.links.related.href,relationships.node.links.related.href,relationships.node.links.self.href,relationships.node.data.id,relationships.node.data.type,relationships.license.links.related.href,relationships.license.data.id,relationships.license.data.type,relationships.provider.links.related.href,relationships.provider.data.id,relationships.provider.data.type,relationships.files.links.related.href,relationships.primary_file.links.related.href,relationships.primary_file.data.id,relationships.primary_file.data.type,relationships.review_actions.links.related.href,relationships.requests.links.related.href,links.self,links.html,links.preprint_doi,links.doi
8t9cx,preprints,2018-10-16T20:42:00.095532,2018-10-16T22:04:41.843576,2018-10-16T22:03:54.688436,2017-10-25T23:00:00,NA,"Danisi, Carmelo, Dustin, Moira and Ferreira, Nuno (2017) Queering brexit. The UK in a Changing Europe.","On 24 June 2016, many people had the feeling that they had gone to bed the night before in the United Kingdom and had woken up in Little Britain – a country prone to isolationism and protectionism, risking hurting its economic and social development for the sake of imperial nostalgia and moral panic about ‘loss of sovereignty’ and ‘mass migration’. That feeling inevitably affected many individuals who identify as lesbian, gay, bisexual, trans, intersex, queer and other (LGBTIQ+). Although the possible impact of Brexit seems to have been scrutinised from most angles, there has been limited analysis of how it may affect LGBTIQ+ individuals.

There is certainly more than one ‘gay in the village’, so it is worth assessing Brexit in relation to the situation of LGBTIQ+ individuals. This is particularly timely in the light of the recent UK Supreme Court decision in Walker v Innospec Limited, where the Court relied on European Union (EU) law to hold a provision of the Equality Act 2010 unlawful for violating pension rights of same-sex couples.",TRUE,FALSE,|Brexit|European Union|LGBTIQ+|queer|UK,2018-10-16T22:04:41.828980,NA,,TRUE,accepted,2018-10-16T22:03:54.688436,NA,NA,NA,NA,NA,NA,NA,NA,NA,5a8c80f0c698300375c76c07|5a8c80f0c698300375c76c0f|Law|Public Law and Legal Theory|5a8c80f0c698300375c76c07|5a8c80f0c698300375c76c16|Law|Law and Gender|5a8c80f0c698300375c76c07|5a8c80f1c698300375c76c34|Law|Human Rights Law|5a8c80f0c698300375c76c07|5a8c80f1c698300375c76c35|Law|Sexuality and the Law|5a8c80f0c698300375c76c07|5a8c80f1c698300375c76c3b|Law|Civil Rights and Discrimination|5a8c80f0c698300375c76c07|5a8c80f1c698300375c76c4b|Law|Law and Society|5a8c80f0c698300375c76c07|5a8c80f2c698300375c76c70|Law|European Law,,2018,https://api.osf.io/v2/preprints/8t9cx/contributors/,https://api.osf.io/v2/preprints/8t9cx/bibliographic_contributors/,https://api.osf.io/v2/preprints/8t9cx/citation/,8t9cx,preprints,https://api.osf.io/v2/preprints/8t9cx/identifiers/,https://api.osf.io/v2/nodes/pf2ay/,https://api.osf.io/v2/preprints/8t9cx/relationships/node/,pf2ay,nodes,https://api.osf.io/v2/licenses/563c1cf88c5e4a3877f9e96a/,563c1cf88c5e4a3877f9e96a,licenses,https://api.osf.io/v2/providers/preprints/socarxiv/,socarxiv,preprint-providers,https://api.osf.io/v2/preprints/8t9cx/files/,https://api.osf.io/v2/files/5bc64d1753cec40018ade988/,5bc64d1753cec40018ade988,files,https://api.osf.io/v2/preprints/8t9cx/review_actions/,https://api.osf.io/v2/preprints/8t9cx/requests/,https://api.osf.io/v2/preprints/8t9cx/,https://osf.io/preprints/socarxiv/8t9cx/,https://doi.org/10.31235/osf.io/8t9cx,NA
rtzgu,preprints,2018-10-16T20:26:37.582938,2018-10-16T21:58:22.025946,2018-10-16T21:57:52.504776,2017-11-24T00:00:00,NA,"Ferreira, Nuno and Venturi, Denise (2017) Tell me what you see and I’ll tell you if you’re gay: analysing the advocate general’s opinion in case C-473/16, F v Bevándorlási és Állampolgársági Hivatal.","Hungary has been in the spotlight for all the wrong reasons for quite a while. From legislation targeting ‘foreign-operating universities’ to border walls to keep refugees from entering Hungarian territory, the populist right-wing government of Viktor Orban has been sparking outrage in many sectors of Hungarian society, and the European institutions. The most recent reason for alarm again relates to migration and refugees, an area of widespread criticism of Hungarian authorities. Building on extremely hostile policies towards refugees that have been admonished by both the Court of Justice of the European Union (CJEU) and the European Court of Human Rights (ECtHR), Hungarian authorities now intend to resort to highly dubious means to assess the applications of individuals claiming asylum on grounds related to their sexual orientation. It was already public knowledge that this category of claimants was subjected to poor treatment by the Hungarian authorities, but recent events suggest that the authorities have reached a new low.",TRUE,FALSE,|Asylum|European Court of Human Rights|European Court of Justice|Human Rights|Sexuality|Sexual Orientation,2018-10-16T21:58:21.999125,NA,,TRUE,accepted,2018-10-16T21:57:52.504776,NA,NA,NA,NA,NA,NA,NA,NA,NA,5a8c80f0c698300375c76c07|5a8c80f0c698300375c76c16|Law|Law and Gender|5a8c80f0c698300375c76c07|5a8c80f0c698300375c76c1b|Law|Immigration Law|5a8c80f0c698300375c76c07|5a8c80f1c698300375c76c34|Law|Human Rights Law|5a8c80f0c698300375c76c07|5a8c80f1c698300375c76c35|Law|Sexuality and the Law|5a8c80f0c698300375c76c07|5a8c80f1c698300375c76c3b|Law|Civil Rights and Discrimination|5a8c80f0c698300375c76c07|5a8c80f1c698300375c76c4b|Law|Law and Society|5a8c80f0c698300375c76c07|5a8c80f2c698300375c76c70|Law|European Law,,2018,https://api.osf.io/v2/preprints/rtzgu/contributors/,https://api.osf.io/v2/preprints/rtzgu/bibliographic_contributors/,https://api.osf.io/v2/preprints/rtzgu/citation/,rtzgu,preprints,https://api.osf.io/v2/preprints/rtzgu/identifiers/,https://api.osf.io/v2/nodes/uftne/,https://api.osf.io/v2/preprints/rtzgu/relationships/node/,uftne,nodes,https://api.osf.io/v2/licenses/563c1cf88c5e4a3877f9e96a/,563c1cf88c5e4a3877f9e96a,licenses,https://api.osf.io/v2/providers/preprints/socarxiv/,socarxiv,preprint-providers,https://api.osf.io/v2/preprints/rtzgu/files/,https://api.osf.io/v2/files/5bc6497c8811c10018566286/,5bc6497c8811c10018566286,files,https://api.osf.io/v2/preprints/rtzgu/review_actions/,https://api.osf.io/v2/preprints/rtzgu/requests/,https://api.osf.io/v2/preprints/rtzgu/,https://osf.io/preprints/socarxiv/rtzgu/,https://doi.org/10.31235/osf.io/rtzgu,NA
ukg8a,preprints,2018-10-16T19:51:49.339606,2018-10-16T20:11:41.845427,2018-10-16T20:11:32.945371,2018-01-24T00:00:00,NA,"Ferreira, Nuno (2018) Working children in England and Wales: does anyone care about their rights? British Politics and Policy LSE blog, London.","Judged by the level of political debate, public policy and academic literature, the work of children (under-18s) in England and Wales is neither of interest nor of concern. And yet the absence of this topic from the policy agenda is far from indicative of its lack of relevance or timeliness. In fact, figures from the Labour Force Survey suggest that about a third of young people aged 16-17 are active in the labour market. Many of these young people, and others even younger, work illegally for a range of reasons: because of the number of hours worked, their age, the type of work carried out, the time of day worked, or because they lack a work permit. 
Indeed, in 2013, Nils Muižnieks – the Council of Europe’s Commissioner for Human Rights – reported on children working long hours in the UK as a consequence of the late 2000s economic crisis. And in 2015, at a seminar held in Liverpool, several children of high school age spoke candidly about practices of dubious legality that they experienced at work, including low pay, informal work arrangements, deficient health and safety conditions, and sexist recruitment procedures, not to speak of detrimental effects to their education. More generally, we should be alarmed that children who work mainly carry out unskilled and manual labour, are poorly paid, acquire limited recognisable skills, jeopardise their educational attainment, sustain accidental injuries (in particular in delivery and agricultural work), may not be covered by insurance and accident cover, are often burdened with caring duties, and may even be recruited by the military. So, what is being done to address these issues?",TRUE,FALSE,child labour|Children and Young Persons Act 1933|child work|Gangmasters and Labour Abuse Authority|right to education|work permits|Young Workers Directive,2018-10-16T20:11:41.809580,NA,,TRUE,accepted,2018-10-16T20:11:32.945371,NA,NA,NA,NA,NA,NA,NA,NA,NA,5a8c80f0c698300375c76c07|5a8c80f1c698300375c76c33|Law|Labor and Employment Law|5a8c80f0c698300375c76c07|5a8c80f1c698300375c76c34|Law|Human Rights Law|5a8c80f0c698300375c76c07|5a8c80f2c698300375c76c70|Law|European Law,,2018,https://api.osf.io/v2/preprints/ukg8a/contributors/,https://api.osf.io/v2/preprints/ukg8a/bibliographic_contributors/,https://api.osf.io/v2/preprints/ukg8a/citation/,ukg8a,preprints,https://api.osf.io/v2/preprints/ukg8a/identifiers/,https://api.osf.io/v2/nodes/fm7hg/,https://api.osf.io/v2/preprints/ukg8a/relationships/node/,fm7hg,nodes,https://api.osf.io/v2/licenses/563c1cf88c5e4a3877f9e96a/,563c1cf88c5e4a3877f9e96a,licenses,https://api.osf.io/v2/providers/preprints/socarxiv/,socarxiv,preprint-providers,https://api.osf.io/v2/preprints/ukg8a/files/,https://api.osf.io/v2/files/5bc641548811c1001b552ce9/,5bc641548811c1001b552ce9,files,https://api.osf.io/v2/preprints/ukg8a/review_actions/,https://api.osf.io/v2/preprints/ukg8a/requests/,https://api.osf.io/v2/preprints/ukg8a/,https://osf.io/preprints/socarxiv/ukg8a/,https://doi.org/10.31235/osf.io/ukg8a,NA
bmq5n,preprints,2018-10-16T18:59:48.017865,2018-11-28T15:11:46.847192,2018-10-16T20:12:03.796038,NA,NA,Britain First and the UK Independence Party: Social Media and Movement-Party Dynamics,"Social movement scholars have recently turned their attention to the interactions between political parties and social movements, but little is known about how social media have impacted these relationships, despite widespread adoption of these technologies. We present a case study of the relationship between Britain First, a far-right anti-Muslim social movement, and the U.K. Independence Party, the Eurosceptic political party that spearheaded the Brexit campaign. The movement appeared marginal in the press but it dominated social media, and used this presence to support to the party. We examine the dynamics of the relationship between these groups from 2013 until 2017, drawing upon data from social media, newspapers, and other online sources, and focusing both interactions on between elites and rank-and-file supporters. Our findings illustrate how far-right groups have used new technologies to generate an unprecedented amount of popular support and to attempt to influence the political mainstream.",TRUE,FALSE,brexit|computational sociology|facebook|far-right|political parties|social media|social movements,2018-10-16T20:12:21.039270,NA,,TRUE,accepted,2018-10-16T20:12:03.796038,NA,NA,NA,NA,NA,NA,NA,NA,NA,5a8c80f7c698300375c76d84|5a8c80fac698300375c76e20|5a8c80fac698300375c76e3f|Social and Behavioral Sciences|Sociology|Political Sociology,,2018,https://api.osf.io/v2/preprints/bmq5n/contributors/,https://api.osf.io/v2/preprints/bmq5n/bibliographic_contributors/,https://api.osf.io/v2/preprints/bmq5n/citation/,bmq5n,preprints,https://api.osf.io/v2/preprints/bmq5n/identifiers/,https://api.osf.io/v2/nodes/42ygr/,https://api.osf.io/v2/preprints/bmq5n/relationships/node/,42ygr,nodes,https://api.osf.io/v2/licenses/563c1cf88c5e4a3877f9e96a/,563c1cf88c5e4a3877f9e96a,licenses,https://api.osf.io/v2/providers/preprints/socarxiv/,socarxiv,preprint-providers,https://api.osf.io/v2/preprints/bmq5n/files/,https://api.osf.io/v2/files/5bc6352353cec4001bae7ba3/,5bc6352353cec4001bae7ba3,files,https://api.osf.io/v2/preprints/bmq5n/review_actions/,https://api.osf.io/v2/preprints/bmq5n/requests/,https://api.osf.io/v2/preprints/bmq5n/,https://osf.io/preprints/socarxiv/bmq5n/,https://doi.org/10.31235/osf.io/bmq5n,NA
yhtpu,preprints,2018-10-16T14:36:59.015587,2018-10-17T05:02:22.490621,2018-10-16T17:07:46.565815,NA,NA,The Future Strikes Back. Using Future Treatments to Detect and Reduce Hidden Bias,"Conventional advice discourages controlling for post-outcome variables in regression analysis. Here, we show that controlling for commonly available post-outcome (i.e. future) values of the treatment variable can help detect, reduce, and even remove omitted variable bias (unobserved confounding). The premise is that the same unobserved confounders that affect treatment also affect future values of the treatment. Future treatments thus proxy for the unmeasured confounder, and researchers can exploit these proxy measures productively. We establish several new results: Regarding a commonly assumed data-generating process involving future treatments, we (1) introduce a simple new approach to reduce bias and show that it strictly reduces bias; (2) elaborate on existing approaches and show that they can increase bias; (3) assess the relative merits of approaches; (4) analyze true state dependence and selection as key challenges; and (5) demonstrate that future treatments can test for hidden bias, even when they fail to reduce bias. We illustrate these results empirically with an analysis of the effect of parental income on children’s educational attainment.",TRUE,FALSE,causal inference|DAG,2018-10-17T05:02:22.470857,NA,,TRUE,accepted,2018-10-16T17:07:46.565815,NA,NA,NA,NA,NA,NA,NA,NA,NA,"5a8c80f7c698300375c76d84|5a8c80fac698300375c76e20|5a8c80fac698300375c76e2c|Social and Behavioral Sciences|Sociology|Methodology|5a8c80f7c698300375c76d84|5a8c80fac698300375c76e20|5a8c80fac698300375c76e35|Social and Behavioral Sciences|Sociology|Inequality, Poverty, and Mobility",,2018,https://api.osf.io/v2/preprints/yhtpu/contributors/,https://api.osf.io/v2/preprints/yhtpu/bibliographic_contributors/,https://api.osf.io/v2/preprints/yhtpu/citation/,yhtpu,preprints,https://api.osf.io/v2/preprints/yhtpu/identifiers/,https://api.osf.io/v2/nodes/ne6mc/,https://api.osf.io/v2/preprints/yhtpu/relationships/node/,ne6mc,nodes,https://api.osf.io/v2/licenses/563c1cf88c5e4a3877f9e96a/,563c1cf88c5e4a3877f9e96a,licenses,https://api.osf.io/v2/providers/preprints/socarxiv/,socarxiv,preprint-providers,https://api.osf.io/v2/preprints/yhtpu/files/,https://api.osf.io/v2/files/5b76cf2a95f24f0016ede883/,5b76cf2a95f24f0016ede883,files,https://api.osf.io/v2/preprints/yhtpu/review_actions/,https://api.osf.io/v2/preprints/yhtpu/requests/,https://api.osf.io/v2/preprints/yhtpu/,https://osf.io/preprints/socarxiv/yhtpu/,https://doi.org/10.31235/osf.io/yhtpu,NA
5nxb4,preprints,2018-10-16T13:54:00.809190,2018-10-16T17:10:22.723616,2018-10-16T17:08:12.672854,2018-10-15T23:00:00,NA,"Testing liberal norms: the public policy and public security derogations and the cracks in European Union citizenship. Working Paper. Legal Studies Research Paper No. 2013-18, University of Warwick","European Union law has curtailed the traditional discretion Member States have in ordering non-nationals to leave their territory. Although Directive 2004/28 (the Citizenship Directive) has enhanced the system of protection afforded to offending European Union citizens, it still contains a number of cracks that lead to policy incoherence and gaps in rights protection. This is evident in the first rulings on Article 28(3) of Directive 2004/38 concerning the deportation of offending EU citizens. These issues also threaten to transform European Union citizenship from a fundamental status into a thin overlay that, under pressure from national executive power, loses its effect and significance. To be sure, EU citizenship has demonstrated that community belonging does not have to be based on organic-national qualities, cultural commonalities, or individuals' conformity to national values, but the continued deportation of long-term resident Union citizens makes nationality the ultimate determinant of belonging. The subsequent discussion suggests possible remedies and makes recommendations for institutional reform.",TRUE,FALSE,|Deportation|derogations|Derogations from Free Movement|European citizenship|expulsion|free movement|International Migration Law|migration|Public Policy|Public Security,2018-10-16T17:10:22.711107,NA,,TRUE,accepted,2018-10-16T17:08:12.672854,NA,NA,NA,NA,NA,NA,NA,NA,NA,5a8c80f0c698300375c76c07|5a8c80f1c698300375c76c33|Law|Labor and Employment Law|5a8c80f0c698300375c76c07|5a8c80f1c698300375c76c34|Law|Human Rights Law|5a8c80f0c698300375c76c07|5a8c80f1c698300375c76c3b|Law|Civil Rights and Discrimination|5a8c80f0c698300375c76c07|5a8c80f1c698300375c76c4b|Law|Law and Society|5a8c80f0c698300375c76c07|5a8c80f1c698300375c76c4d|Law|Social Welfare Law|5a8c80f0c698300375c76c07|5a8c80f2c698300375c76c70|Law|European Law,,2018,https://api.osf.io/v2/preprints/5nxb4/contributors/,https://api.osf.io/v2/preprints/5nxb4/bibliographic_contributors/,https://api.osf.io/v2/preprints/5nxb4/citation/,5nxb4,preprints,https://api.osf.io/v2/preprints/5nxb4/identifiers/,https://api.osf.io/v2/nodes/v42gc/,https://api.osf.io/v2/preprints/5nxb4/relationships/node/,v42gc,nodes,https://api.osf.io/v2/licenses/563c1cf88c5e4a3877f9e96a/,563c1cf88c5e4a3877f9e96a,licenses,https://api.osf.io/v2/providers/preprints/socarxiv/,socarxiv,preprint-providers,https://api.osf.io/v2/preprints/5nxb4/files/,https://api.osf.io/v2/files/5bc5ed7753cec40019ad5a89/,5bc5ed7753cec40019ad5a89,files,https://api.osf.io/v2/preprints/5nxb4/review_actions/,https://api.osf.io/v2/preprints/5nxb4/requests/,https://api.osf.io/v2/preprints/5nxb4/,https://osf.io/preprints/socarxiv/5nxb4/,https://doi.org/10.31235/osf.io/5nxb4,NA
96zpj,preprints,2018-10-16T13:43:49.357939,2018-10-16T21:56:43.543899,2018-10-16T21:56:33.231561,2009-03-02T00:00:00,10.5771/9783845213859-49,"Fundamental rights, constitutional principles, and the law of torts: tortfeasors v. tort victims. In: Liability in the third millennium : liber amicorum Gert Brüggemeier. Nomos, pp. 49-84","There is an increasing effect of fundamental rights outside of the citizen-state relationship, invading domains such as labour law, contract law, family law, and property law. These rights and principles have often served as much more than mere interpretive aids and have become actual substantive rules of law, independent of whether their invocation resulted in a successful or unsuccessful claim. This debate, commonly referred to as the horizontal effect of fundamental rights, has also undoubtedly affected the law of torts. The development of the debate surrounding the horizontal effect of fundamental rights and the readiness of several courts to permit basic rights to influence the outcome of a case, have led to an increasingly decisive role for constitutional texts in the field of torts. 
The effect of fundamental rights in the field of the law of torts is undoubtedly more often felt in regard to the position of the tort victim, and the entitlement of the victim to damages, rather than in regard to the position of the tortfeasor strictu sensu. By this it is implied that, despite judges sometimes balancing the fundamental rights of both tort victims and tortfeasors, the influence of fundamental rights in the law of torts impacts, most often, directly the position of tort victims, either by strengthening or weakening their position, always concentrating more intensively on their interests. The position of tortfeasors is commonly only affected indirectly, as a consequence of the consideration of the fundamental rights of tort victims. This can be easily illustrated by references to the English, German and Italian jurisdictions, among others.
By drawing from scholarly writings and case-law from several European and non-European jurisdictions, this book chapter contributes to a change from the focus on the position of the tort victim to that of the tortfeasor. In order for the law of torts to fulfil and satisfy all its different functions and interests, while simultaneously respecting and promoting commonly accepted legal values, the position of the tortfeasor should be analysed in se, not as a mere reflection of the position of the tort victim. No other instrument could perform this task better than fundamental rights, dynamic tools that they are. In addition, the thorough fulfilment of all fundamental rights equally requires such change in the legal mindset, as the law of torts has to give respect to the fundamental rights of both the tort victim and the tortfeasor in a balanced and just way. A refocus of the debate surrounding the horizontal effect of fundamental rights on the law of torts is therefore proposed, thus also assessing the impact that fundamental rights and principles may have directly on the position of the tortfeasor strictu sensu.",TRUE,FALSE,|comparative law|constitutional law|fundamental rights|human rights|tortfesors|tort law|tort victims,2018-10-16T21:56:43.528480,NA,,TRUE,accepted,2018-10-16T21:56:33.231561,NA,NA,NA,NA,NA,NA,NA,NA,NA,5a8c80f0c698300375c76c07|5a8c80f1c698300375c76c34|Law|Human Rights Law|5a8c80f0c698300375c76c07|5a8c80f1c698300375c76c3b|Law|Civil Rights and Discrimination|5a8c80f0c698300375c76c07|5a8c80f2c698300375c76c61|Law|Torts,Nuno Ferreira,2009,https://api.osf.io/v2/preprints/96zpj/contributors/,https://api.osf.io/v2/preprints/96zpj/bibliographic_contributors/,https://api.osf.io/v2/preprints/96zpj/citation/,96zpj,preprints,https://api.osf.io/v2/preprints/96zpj/identifiers/,https://api.osf.io/v2/nodes/xds2n/,https://api.osf.io/v2/preprints/96zpj/relationships/node/,xds2n,nodes,https://api.osf.io/v2/licenses/563c1cf88c5e4a3877f9e965/,563c1cf88c5e4a3877f9e965,licenses,https://api.osf.io/v2/providers/preprints/socarxiv/,socarxiv,preprint-providers,https://api.osf.io/v2/preprints/96zpj/files/,https://api.osf.io/v2/files/5bc5eb1453cec4001badeb52/,5bc5eb1453cec4001badeb52,files,https://api.osf.io/v2/preprints/96zpj/review_actions/,https://api.osf.io/v2/preprints/96zpj/requests/,https://api.osf.io/v2/preprints/96zpj/,https://osf.io/preprints/socarxiv/96zpj/,https://doi.org/10.31235/osf.io/96zpj,https://doi.org/10.5771/9783845213859-49
b8fkv,preprints,2018-10-16T12:25:26.906950,2018-10-16T17:44:45.182669,2018-10-16T17:43:59.961074,2016-03-17T00:00:00,10.3224/978384740193d,Child labour and EU law and policy: a regional solution for a global issue,"This chapter will explore the role of the EU in creating and developing labour policies that affect children. The analysis will be framed within the context of the global debates about child labour, and will highlight the role that the EU might play in those debates. The chapter starts by sketching the main lines of the ‘child labour’ debate, the qualitative and quantitative significance of children in the EU labour market, and the relevant EU competences. It will then touch upon a range of EU labour law instruments that affect children, both as direct addressees – especially the Young Workers Directive – and collateral beneficiaries, including a variety of tools that address sex discrimination. Finally, the chapter will assess the compatibility between the instruments and policies considered and, amongst others, the CRC, the relevant ILO instruments, and the EU Charter of Fundamental Rights. The conclusion will determine the scope for improvement of the current state of affairs, and present policy recommendations.",TRUE,FALSE,child labour|children's rights|child work|employment law|European law|labour law|social rights|Young Workers Directive,2018-10-16T17:44:45.164170,NA,,TRUE,accepted,2018-10-16T17:43:59.961074,NA,NA,NA,NA,NA,NA,NA,NA,NA,5a8c80f0c698300375c76c07|5a8c80f1c698300375c76c33|Law|Labor and Employment Law|5a8c80f0c698300375c76c07|5a8c80f1c698300375c76c34|Law|Human Rights Law|5a8c80f0c698300375c76c07|5a8c80f1c698300375c76c3b|Law|Civil Rights and Discrimination|5a8c80f0c698300375c76c07|5a8c80f2c698300375c76c70|Law|European Law,,2018,https://api.osf.io/v2/preprints/b8fkv/contributors/,https://api.osf.io/v2/preprints/b8fkv/bibliographic_contributors/,https://api.osf.io/v2/preprints/b8fkv/citation/,b8fkv,preprints,https://api.osf.io/v2/preprints/b8fkv/identifiers/,https://api.osf.io/v2/nodes/7gkpw/,https://api.osf.io/v2/preprints/b8fkv/relationships/node/,7gkpw,nodes,https://api.osf.io/v2/licenses/563c1cf88c5e4a3877f9e96a/,563c1cf88c5e4a3877f9e96a,licenses,https://api.osf.io/v2/providers/preprints/socarxiv/,socarxiv,preprint-providers,https://api.osf.io/v2/preprints/b8fkv/files/,https://api.osf.io/v2/files/5bc5d8b653cec4001badc8b7/,5bc5d8b653cec4001badc8b7,files,https://api.osf.io/v2/preprints/b8fkv/review_actions/,https://api.osf.io/v2/preprints/b8fkv/requests/,https://api.osf.io/v2/preprints/b8fkv/,https://osf.io/preprints/socarxiv/b8fkv/,https://doi.org/10.31235/osf.io/b8fkv,https://doi.org/10.3224/978384740193d
