id,type,attributes.date_created,attributes.date_modified,attributes.date_published,attributes.original_publication_date,attributes.doi,attributes.title,attributes.description,attributes.is_published,attributes.is_preprint_orphan,attributes.tags,attributes.preprint_doi_created,attributes.date_withdrawn,attributes.current_user_permissions,attributes.public,attributes.reviews_state,attributes.date_last_transitioned,attributes.has_coi,attributes.conflict_of_interest_statement,attributes.has_data_links,attributes.why_no_data,attributes.data_links,attributes.has_prereg_links,attributes.why_no_prereg,attributes.prereg_links,attributes.prereg_link_info,attributes.subjects,attributes.license_record.copyright_holders,attributes.license_record.year,relationships.contributors.links.related.href,relationships.bibliographic_contributors.links.related.href,relationships.citation.links.related.href,relationships.citation.data.id,relationships.citation.data.type,relationships.identifiers.links.related.href,relationships.node.links.self.href,relationships.node.links.related.href,relationships.node.data.id,relationships.node.data.type,relationships.license.links.related.href,relationships.license.data.id,relationships.license.data.type,relationships.provider.links.related.href,relationships.provider.data.id,relationships.provider.data.type,relationships.files.links.related.href,relationships.primary_file.links.related.href,relationships.primary_file.data.id,relationships.primary_file.data.type,relationships.review_actions.links.related.href,relationships.requests.links.related.href,links.self,links.html,links.doi,links.preprint_doi
hf53d,preprints,2019-04-02T16:56:01.804052,2019-04-04T18:44:11.925763,2019-04-02T18:04:57.625513,2018-08-18T06:00:00,10.1007/s10834-018-9588-1,"Sharing or Limiting the Wealth? Coresidence, Parental Support, and Wealth Outcomes in Canada","This paper examines the relationship between coresidence with adult children, wealth, and economic security using data from the 1999-2012 Canadian Survey of Financial Security (SFS). The results, obtained via propensity score matching and linear regression, show that coresidence with and parental support for adult children is negatively associated with non-home assets and positively associated with debt levels among Canadian households. Further analyses suggest that these relationships stem from differences in financial assets, retirement savings, student loan debt, and credit card balances. By linking theories of economic insecurity, social capital, and life course studies, this study demonstrates how changing trajectories among young adults and financial hardship can influence broader household resources and stability.",TRUE,FALSE,Economic insecurity|Emerging adulthood|Family demography|Family structure|Life course|Parents|Wealth,2019-04-02T18:05:27.602877,NA,,TRUE,accepted,2019-04-02T18:04:57.625513,NA,NA,NA,NA,,NA,NA,NA,NA,"5a8c80f7c698300375c76d84|5a8c80fac698300375c76e20|5a8c80fac698300375c76e35|Social and Behavioral Sciences|Sociology|Inequality, Poverty, and Mobility",,2019,https://api.osf.io/v2/preprints/hf53d/contributors/,https://api.osf.io/v2/preprints/hf53d/bibliographic_contributors/,https://api.osf.io/v2/preprints/hf53d/citation/,hf53d,preprints,https://api.osf.io/v2/preprints/hf53d/identifiers/,https://api.osf.io/v2/preprints/hf53d/relationships/node/,NA,NA,NA,https://api.osf.io/v2/licenses/563c1cf88c5e4a3877f9e96a/,563c1cf88c5e4a3877f9e96a,licenses,https://api.osf.io/v2/providers/preprints/socarxiv/,socarxiv,preprint-providers,https://api.osf.io/v2/preprints/hf53d/files/,https://api.osf.io/v2/files/5ca3942524df75001ac44a97/,5ca3942524df75001ac44a97,files,https://api.osf.io/v2/preprints/hf53d/review_actions/,https://api.osf.io/v2/preprints/hf53d/requests/,https://api.osf.io/v2/preprints/hf53d/,https://osf.io/preprints/socarxiv/hf53d/,https://doi.org/10.1007/s10834-018-9588-1,https://doi.org/10.31235/osf.io/hf53d
prm5j,preprints,2019-04-02T16:46:06.432623,2019-04-04T18:44:22.260632,2019-04-02T18:04:03.516141,2018-09-11T06:00:00,10.1177/0891243218794648,"Hierarchies of Categorical Disadvantage: Economic Insecurity at the Intersection of Disability, Gender, and Race","Intersectional feminist scholars emphasize how overlapping systems of oppression structure gender inequality, but in focusing on the gendered, classed, and racialized bases of stratification, many often overlook disability as an important social category in determining economic outcomes. This is a significant omission given that disability severely limits opportunities and contributes to cumulative disadvantage. We draw from feminist disability and intersectional theories to account for how disability intersects with gender, race, and education to produce economic insecurity. The findings from our analyses of 2015 American Community Survey data provide strong empirical support for hierarchies of disadvantage, where women and racial minority groups with disabilities and less education experience the highest poverty levels, report the lowest total income, and have a greater reliance on sources outside the labor market for economic security. By taking disability into account, our study demonstrates how these multiple characteristics lead to overlapping oppressions that become embedded and reproduced within the larger social structure.",TRUE,FALSE,Class|Disability|Gender|Inequality|Poverty and Welfare|Race|Stratification and Mobility,2019-04-02T18:04:22.332035,NA,,TRUE,accepted,2019-04-02T18:04:03.516141,NA,NA,NA,NA,,NA,NA,NA,NA,5a8c80f7c698300375c76d84|5a8c80fac698300375c76e20|5a8c80fac698300375c76e41|Social and Behavioral Sciences|Sociology|Disability and Society,,2019,https://api.osf.io/v2/preprints/prm5j/contributors/,https://api.osf.io/v2/preprints/prm5j/bibliographic_contributors/,https://api.osf.io/v2/preprints/prm5j/citation/,prm5j,preprints,https://api.osf.io/v2/preprints/prm5j/identifiers/,https://api.osf.io/v2/preprints/prm5j/relationships/node/,NA,NA,NA,https://api.osf.io/v2/licenses/563c1cf88c5e4a3877f9e96a/,563c1cf88c5e4a3877f9e96a,licenses,https://api.osf.io/v2/providers/preprints/socarxiv/,socarxiv,preprint-providers,https://api.osf.io/v2/preprints/prm5j/files/,https://api.osf.io/v2/files/5ca391d4c5a2eb001aa3e9e2/,5ca391d4c5a2eb001aa3e9e2,files,https://api.osf.io/v2/preprints/prm5j/review_actions/,https://api.osf.io/v2/preprints/prm5j/requests/,https://api.osf.io/v2/preprints/prm5j/,https://osf.io/preprints/socarxiv/prm5j/,https://doi.org/10.1177/0891243218794648,https://doi.org/10.31235/osf.io/prm5j
3nywd,preprints,2019-04-02T16:40:36.108643,2019-04-04T18:44:28.899691,2019-04-02T18:02:53.175614,2018-10-08T06:00:00,10.1007/s13524-018-0716-1,"Saving, Sharing, or Spending? The Wealth Consequences of Raising Children","This study uses 1986-2012 National Longitudinal Survey of Youth 1979 cohort data to investigate the relationship between raising children and net worth among younger baby boomer parents. I combine fixed effects and unconditional quantile regression models to estimate changes in net worth associated with having children in different age groups across the wealth distribution. This allows me to test whether standard economic models for savings and consumption over the life course hold for families at different wealth levels. My findings show that the wealth effects of children vary throughout the distribution. Among families at or below the median, children of all ages were associated with wealth declines, likely due to the costs of childrearing. However, at the 75th percentile and above, wealth increased with the presence of younger children but decreased once those children reached age 18. My results, therefore, provide evidence for a saving and investment model of childrearing among wealthier families, but not among families at or below median wealth levels. For these families, the costs of raising children largely outweighed motivations for saving.",TRUE,FALSE,Children|Families|Inequality|Intergenerational transfers|Life course|Wealth,2019-04-02T18:03:22.667232,NA,,TRUE,accepted,2019-04-02T18:02:53.175614,NA,NA,NA,NA,,NA,NA,NA,NA,"5a8c80f7c698300375c76d84|5a8c80fac698300375c76e20|5a8c80fac698300375c76e35|Social and Behavioral Sciences|Sociology|Inequality, Poverty, and Mobility",,2019,https://api.osf.io/v2/preprints/3nywd/contributors/,https://api.osf.io/v2/preprints/3nywd/bibliographic_contributors/,https://api.osf.io/v2/preprints/3nywd/citation/,3nywd,preprints,https://api.osf.io/v2/preprints/3nywd/identifiers/,https://api.osf.io/v2/preprints/3nywd/relationships/node/,NA,NA,NA,https://api.osf.io/v2/licenses/563c1cf88c5e4a3877f9e96a/,563c1cf88c5e4a3877f9e96a,licenses,https://api.osf.io/v2/providers/preprints/socarxiv/,socarxiv,preprint-providers,https://api.osf.io/v2/preprints/3nywd/files/,https://api.osf.io/v2/files/5ca3908924df750017c44faf/,5ca3908924df750017c44faf,files,https://api.osf.io/v2/preprints/3nywd/review_actions/,https://api.osf.io/v2/preprints/3nywd/requests/,https://api.osf.io/v2/preprints/3nywd/,https://osf.io/preprints/socarxiv/3nywd/,https://doi.org/10.1007/s13524-018-0716-1,https://doi.org/10.31235/osf.io/3nywd
e37cu,preprints,2019-04-01T18:30:37.634761,2019-04-02T12:34:27.256882,2019-04-02T12:34:02.568767,2019-04-01T04:00:00,NA,"Race, Ethnicity, and the Future of Work","Leading up to and following the 2016 American presidential election, “White working class” employment and political agency has become particularly salient. A simultaneous discussion on the role of automation in unemployment complicates the political narrative; by one estimate, 47% of American jobs are at risk of computerization (Frey and Osborne, 2013). This study analyzes how occupational automation corresponds with racial and ethnic demographics within occupational groups from both a historical and contemporary perspective. I find that throughout American industrialization, non-White and immigrant workers shifted to low-wage, unskilled work because of the political and social limitations imposed upon these groups. In the context of today’s AI-driven automation, I find that White workers are more heavily affected by automatability than other racial groups. Conversely, however, I found that the proportion of White workers in an occupation is negatively correlated with an occupation’s automatability. I conclude with suggestions for a susceptibility-based approach to predicting employment outcomes from AI-driven automation.",TRUE,FALSE,artificial intelligence|automation|ethnicity|labor|race|skill|work,2019-04-02T12:34:27.233509,NA,,TRUE,accepted,2019-04-02T12:34:02.568767,NA,NA,NA,NA,,NA,NA,NA,NA,5a8c80f7c698300375c76d84|5a8c80f8c698300375c76dbe|Social and Behavioral Sciences|Economics|5a8c80f7c698300375c76d84|5a8c80f9c698300375c76df4|Social and Behavioral Sciences|Science and Technology Studies,Pegah Moradi,2018,https://api.osf.io/v2/preprints/e37cu/contributors/,https://api.osf.io/v2/preprints/e37cu/bibliographic_contributors/,https://api.osf.io/v2/preprints/e37cu/citation/,e37cu,preprints,https://api.osf.io/v2/preprints/e37cu/identifiers/,https://api.osf.io/v2/preprints/e37cu/relationships/node/,NA,NA,NA,https://api.osf.io/v2/licenses/563c1cf88c5e4a3877f9e965/,563c1cf88c5e4a3877f9e965,licenses,https://api.osf.io/v2/providers/preprints/socarxiv/,socarxiv,preprint-providers,https://api.osf.io/v2/preprints/e37cu/files/,https://api.osf.io/v2/files/5ca258dcecd788001998c0ac/,5ca258dcecd788001998c0ac,files,https://api.osf.io/v2/preprints/e37cu/review_actions/,https://api.osf.io/v2/preprints/e37cu/requests/,https://api.osf.io/v2/preprints/e37cu/,https://osf.io/preprints/socarxiv/e37cu/,NA,https://doi.org/10.31235/osf.io/e37cu
cp4zk,preprints,2019-04-01T14:27:08.105206,2019-04-02T12:33:48.430113,2019-04-02T12:33:32.099865,2019-03-31T23:00:00,NA,Social engagement and cognitive health in a population-based study of older men and women in rural South Africa,"We investigated how patterns of social engagement and cognitive health in the
HAALSI population-based study of over 5000 individuals aged ≥ 40 years in rural South Africa
fit with three existing theories of how social engagement and cognitive function are
interconnected in older age. We found that respondents with lower cognitive function had
smaller, denser social networks that were more local and more kin-based than their peers.
Lower cognitive function was associated with receipt of less social support in general, but this
difference was stronger for emotional and informational than for financial and physical
support. These patterns suggest that cognitively impaired older adults in this setting rely on
their core social networks for support, and that theories developed in higher-income and
higher-education settings may also apply elsewhere in the world.",TRUE,FALSE,cognition|cognitive impairment|gender|social engagement|social networks|social support|South Africa,2019-04-02T12:33:48.403883,NA,,TRUE,accepted,2019-04-02T12:33:32.099865,NA,NA,NA,NA,,NA,NA,NA,NA,5a8c80f7c698300375c76d84|5a8c80f7c698300375c76d96|Social and Behavioral Sciences|Other Social and Behavioral Sciences,,2019,https://api.osf.io/v2/preprints/cp4zk/contributors/,https://api.osf.io/v2/preprints/cp4zk/bibliographic_contributors/,https://api.osf.io/v2/preprints/cp4zk/citation/,cp4zk,preprints,https://api.osf.io/v2/preprints/cp4zk/identifiers/,https://api.osf.io/v2/preprints/cp4zk/relationships/node/,NA,NA,NA,https://api.osf.io/v2/licenses/563c1cf88c5e4a3877f9e96a/,563c1cf88c5e4a3877f9e96a,licenses,https://api.osf.io/v2/providers/preprints/socarxiv/,socarxiv,preprint-providers,https://api.osf.io/v2/preprints/cp4zk/files/,https://api.osf.io/v2/files/5ca21fc00a13d700198cc192/,5ca21fc00a13d700198cc192,files,https://api.osf.io/v2/preprints/cp4zk/review_actions/,https://api.osf.io/v2/preprints/cp4zk/requests/,https://api.osf.io/v2/preprints/cp4zk/,https://osf.io/preprints/socarxiv/cp4zk/,NA,https://doi.org/10.31235/osf.io/cp4zk
98kz4,preprints,2019-03-30T09:31:09.116590,2019-05-02T15:16:20.036758,2019-03-30T14:38:11.880883,2019-03-30T04:00:00,10.1016/j.jadohealth.2006.11.080,Mind the parent-adolescent gap: A comparison of parents’ and adolescents’ assessments of their relationship and discussions about sex,"Purpose:  To compare parent and child reports on their relationship and communication about sex; quantify agreement; and find characteristics associated with higher agreement.

Methods:  Data is baseline data from an evaluation of Talking Parents, Healthy Teens, a multi-session worksite-based parenting program.  Participants are 569 parents of 6-10th grades who responded to an advertisement posted in their workplace, and their 6-10th grade children (n=683): 683 parent-child dyads.  Self-administered survey data were collected in Southern California from 2002-2004.  We compare parent and child responses to 68 items about their relationships and communication about sex, and computed polychoric correlation (PCC), an agreement measure that corrects for possible parent-child differences in response threshholds, across dyads and across items.  Factors associated with higher agreement were found through bivariate comparison of PCC; linear regression on intra-dyad PCC; and linear regression on raw bias.

Results:  After adjusting for possible parent-child differences in response threshholds, PCC for items were low, with median 0.34 (inter-quartile range (IQR) (0.22, 0.41)).  Agreement was higher for sexual discussion topics (median 0.41 (IQR (0.37, 0.46))) than other items (Wilcoxon p&lt;0.001); in general, agreement was higher for factual than emotionally negative or hypothetical items.  PCC for dyads was very high, with median 0.87 (IQR (0.84, 0.91)), but left-skewed (skewness = -3.1).  Factors associated with greater parent-child agreement include younger child age, better parenting skills, parent married or living as married, and parent recollection of good communication with their own parents.  Agreement was not associated with socioeconomic factors.
Conclusions:  Survey-response discordance appears not to be solely attributable to response bias.  Items about concrete events yield better agreement than hypothetical items.  Response discordance may be partially attributable to different parent and child perceptions of their relationship because less discordance is evidence among parents with good parenting skills or who recall good communication with their own parents.",TRUE,FALSE,agreement; polychoric correlation; sex education; adolescents; parents; parent-adolescent communication,2019-03-30T14:38:26.931871,NA,,TRUE,accepted,2019-03-30T14:38:11.880883,NA,NA,NA,NA,,NA,NA,NA,NA,5a8c80f7c698300375c76d84|5a8c80fac698300375c76e20|5a8c80fac698300375c76e47|Social and Behavioral Sciences|Sociology|Children and Youth|5a8c80f7c698300375c76d84|5a8c80fac698300375c76e20|5a8c80fac698300375c76e4c|Social and Behavioral Sciences|Sociology|Family,,2019,https://api.osf.io/v2/preprints/98kz4/contributors/,https://api.osf.io/v2/preprints/98kz4/bibliographic_contributors/,https://api.osf.io/v2/preprints/98kz4/citation/,98kz4,preprints,https://api.osf.io/v2/preprints/98kz4/identifiers/,https://api.osf.io/v2/preprints/98kz4/relationships/node/,NA,NA,NA,https://api.osf.io/v2/licenses/563c1cf88c5e4a3877f9e96a/,563c1cf88c5e4a3877f9e96a,licenses,https://api.osf.io/v2/providers/preprints/socarxiv/,socarxiv,preprint-providers,https://api.osf.io/v2/preprints/98kz4/files/,https://api.osf.io/v2/files/5c9f37630a13d7001a8a1f6c/,5c9f37630a13d7001a8a1f6c,files,https://api.osf.io/v2/preprints/98kz4/review_actions/,https://api.osf.io/v2/preprints/98kz4/requests/,https://api.osf.io/v2/preprints/98kz4/,https://osf.io/preprints/socarxiv/98kz4/,https://doi.org/10.1016/j.jadohealth.2006.11.080,https://doi.org/10.31235/osf.io/98kz4
yv2es,preprints,2019-03-30T00:10:20.654631,2020-06-29T06:11:52.433837,2019-03-30T02:26:36.044135,2019-03-29T04:00:00,NA,Persistence of solid fuel use despite increases in LPG ownership: New survey evidence from rural north India,"Solid fuel use is an important contributor to air pollution and disease burden in India. We present survey evidence documenting LPG ownership and cooking fuel use in rural north India. LPG ownership has increased rapidly, substantially driven by the Ujjwala Yojana. Three-quarters of rural households in Bihar, Madhya Pradesh, Rajasthan, and Uttar Pradesh now have LPG. Almost all of these households also have a stove that uses solid fuels, and among those owning both, almost three-quarters used solid fuels the day before the survey. Household economic status, relative costs of cooking fuels, gender inequality, and beliefs regarding the ease, food taste, and health impacts of cooking with solid fuels versus LPG are important contributors to high solid fuel use despite LPG ownership. Households that continue to use solid fuels continue to expose themselves and their neighbours to harmful air pollution. To realize the full health benefits of Ujjwala’s expansion in LPG ownership, attention must now be turned towards discouraging the use of solid fuels and promoting exclusive use of LPG. This is an urgent priority for research, policy, and action.",TRUE,FALSE,Environment|Gender|India|North India|Pollution|Rural India|Solid Fuels|Ujjwala,2019-03-30T02:27:07.640610,NA,,TRUE,accepted,2019-03-30T02:26:36.044135,FALSE,NA,available,NA,https://riceinstitute.org/data/2014-and-2018-rural-sanitation-surveys/,NA,NA,NA,NA,"5a8c80f7c698300375c76d84|5a8c80f7c698300375c76d86|Social and Behavioral Sciences|Geography|5a8c80f7c698300375c76d84|5a8c80f7c698300375c76d8e|Social and Behavioral Sciences|International and Area Studies|5a8c80f7c698300375c76d84|5a8c80f8c698300375c76db6|Social and Behavioral Sciences|Agricultural and Resource Economics|5a8c80f7c698300375c76d84|5a8c80f8c698300375c76dbd|Social and Behavioral Sciences|Environmental Studies|5a8c80f7c698300375c76d84|5a8c80f8c698300375c76ddb|Social and Behavioral Sciences|Public Affairs, Public Policy and Public Administration|5a8c80f7c698300375c76d84|5a8c80fac698300375c76e20|Social and Behavioral Sciences|Sociology",,2019,https://api.osf.io/v2/preprints/yv2es/contributors/,https://api.osf.io/v2/preprints/yv2es/bibliographic_contributors/,https://api.osf.io/v2/preprints/yv2es/citation/,yv2es,preprints,https://api.osf.io/v2/preprints/yv2es/identifiers/,https://api.osf.io/v2/preprints/yv2es/relationships/node/,NA,NA,NA,https://api.osf.io/v2/licenses/563c1cf88c5e4a3877f9e96a/,563c1cf88c5e4a3877f9e96a,licenses,https://api.osf.io/v2/providers/preprints/socarxiv/,socarxiv,preprint-providers,https://api.osf.io/v2/preprints/yv2es/files/,https://api.osf.io/v2/files/5c9eb3f6653f06001834f9b6/,5c9eb3f6653f06001834f9b6,files,https://api.osf.io/v2/preprints/yv2es/review_actions/,https://api.osf.io/v2/preprints/yv2es/requests/,https://api.osf.io/v2/preprints/yv2es/,https://osf.io/preprints/socarxiv/yv2es/,NA,https://doi.org/10.31235/osf.io/yv2es
sj6h2,preprints,2019-03-29T06:57:15.539923,2019-04-10T14:42:24.942371,2019-03-29T12:16:01.431921,NA,NA,The evolution of wealth-income ratios in India 1860-2012,"This article is about the metamorphoses of aggregate Indian wealth over fifteen politically transformative decades. Based on a comprehensive new database, I find that wealth-income ratios have fluctuated by large margins in the twentieth century. In emerging India of the twenty first century, wealth is steadily approaching the same disproportionate size (relative to national income) that was seen during sharp economic downturns in interwar colonial India. The long run 1939-2012 U shaped trajectories of wealth-income ratios are reasonably explained by a mid century asset price slowdown and the return of high land shares in national wealth. These results corroborate the secular increase of wealth-income ratios in most large economies since the 1980s. The manifestation of this phenomena appears to be independent of the stage of development.",TRUE,FALSE,Development|Economic growth|India|Land prices|Property ownership|Wealth-income ratios|Wealth inequality,2019-03-29T12:16:23.931498,NA,,TRUE,accepted,2019-03-29T12:16:01.431921,NA,NA,NA,NA,,NA,NA,NA,NA,5a8c80f7c698300375c76d84|5a8c80f8c698300375c76dbe|5a8c80f8c698300375c76dc0|Social and Behavioral Sciences|Economics|Political Economy|5a8c80f7c698300375c76d84|5a8c80f8c698300375c76dbe|5a8c80f8c698300375c76dc2|Social and Behavioral Sciences|Economics|Income Distribution|5a8c80f7c698300375c76d84|5a8c80f8c698300375c76dbe|5a8c80f8c698300375c76dc4|Social and Behavioral Sciences|Economics|Economic History|5a8c80f7c698300375c76d84|5a8c80f8c698300375c76dbe|5a8c80f8c698300375c76dc8|Social and Behavioral Sciences|Economics|Growth and Development,Rishabh Kumar,2019,https://api.osf.io/v2/preprints/sj6h2/contributors/,https://api.osf.io/v2/preprints/sj6h2/bibliographic_contributors/,https://api.osf.io/v2/preprints/sj6h2/citation/,sj6h2,preprints,https://api.osf.io/v2/preprints/sj6h2/identifiers/,https://api.osf.io/v2/preprints/sj6h2/relationships/node/,https://api.osf.io/v2/nodes/djymf/,djymf,nodes,https://api.osf.io/v2/licenses/563c1cf88c5e4a3877f9e96a/,563c1cf88c5e4a3877f9e96a,licenses,https://api.osf.io/v2/providers/preprints/socarxiv/,socarxiv,preprint-providers,https://api.osf.io/v2/preprints/sj6h2/files/,https://api.osf.io/v2/files/5c9dc1d1246078001bfd2984/,5c9dc1d1246078001bfd2984,files,https://api.osf.io/v2/preprints/sj6h2/review_actions/,https://api.osf.io/v2/preprints/sj6h2/requests/,https://api.osf.io/v2/preprints/sj6h2/,https://osf.io/preprints/socarxiv/sj6h2/,NA,https://doi.org/10.31235/osf.io/sj6h2
