id,type,attributes.date_created,attributes.date_modified,attributes.date_published,attributes.original_publication_date,attributes.doi,attributes.title,attributes.description,attributes.is_published,attributes.is_preprint_orphan,attributes.tags,attributes.preprint_doi_created,attributes.date_withdrawn,attributes.current_user_permissions,attributes.public,attributes.reviews_state,attributes.date_last_transitioned,attributes.has_coi,attributes.conflict_of_interest_statement,attributes.has_data_links,attributes.why_no_data,attributes.data_links,attributes.has_prereg_links,attributes.why_no_prereg,attributes.prereg_links,attributes.prereg_link_info,attributes.subjects,attributes.license_record.copyright_holders,attributes.license_record.year,relationships.contributors.links.related.href,relationships.bibliographic_contributors.links.related.href,relationships.citation.links.related.href,relationships.citation.data.id,relationships.citation.data.type,relationships.identifiers.links.related.href,relationships.node.links.related.href,relationships.node.links.self.href,relationships.node.data.id,relationships.node.data.type,relationships.license.links.related.href,relationships.license.data.id,relationships.license.data.type,relationships.provider.links.related.href,relationships.provider.data.id,relationships.provider.data.type,relationships.files.links.related.href,relationships.primary_file.links.related.href,relationships.primary_file.data.id,relationships.primary_file.data.type,relationships.review_actions.links.related.href,relationships.requests.links.related.href,links.self,links.html,links.preprint_doi,links.doi
fyz7m,preprints,2018-08-21T14:24:47.832249,2018-08-22T13:02:21.091477,2018-08-22T13:01:57.485438,NA,NA,"Now you see it, now you don’t: On the (in)visibility of police stop and search in Northern Ireland","Police stop and search practices have been subject to voluminous debate for over forty years in the United Kingdom. Yet critical debate related to the use of ‘everyday’ stop and search powers by the Police Service of Northern Ireland (PSNI) has, despite the hyper-accountable policing system of Northern Ireland, been marked by its absence. This paper presents the first ever analysis of PSNI’s use of PACE-type powers - currently used at a higher rate and with poorer outcomes compared to the rest of the U.K. While it can only be considered as an elusive power, about which detailed research evidence is markedly lacking, stop and search in Northern Ireland seems to serve as a classificatory tool for PSNI to control mainly young, socio-economically marginal male populations. The paper provides new theoretical insight into stop and search as a simultaneous overt and covert practice, and speaks to wider issues of mundane police power – and practice – within highly contested and politically fractured contexts.

Keywords: stop and search; Police Service of Northern Ireland; police powers; social control",TRUE,FALSE,police powers|police service of northern ireland|policing|stop and search,2018-08-22T13:02:21.073338,NA,,TRUE,accepted,2018-08-22T13:01:57.485438,NA,NA,NA,NA,NA,NA,NA,NA,NA,"5a8c80f7c698300375c76d84|5a8c80fac698300375c76e20|5a8c80fac698300375c76e2b|Social and Behavioral Sciences|Sociology|Crime, Law, and Deviance",,2018,https://api.osf.io/v2/preprints/fyz7m/contributors/,https://api.osf.io/v2/preprints/fyz7m/bibliographic_contributors/,https://api.osf.io/v2/preprints/fyz7m/citation/,fyz7m,preprints,https://api.osf.io/v2/preprints/fyz7m/identifiers/,https://api.osf.io/v2/nodes/7jadw/,https://api.osf.io/v2/preprints/fyz7m/relationships/node/,7jadw,nodes,https://api.osf.io/v2/licenses/563c1cf88c5e4a3877f9e96a/,563c1cf88c5e4a3877f9e96a,licenses,https://api.osf.io/v2/providers/preprints/socarxiv/,socarxiv,preprint-providers,https://api.osf.io/v2/preprints/fyz7m/files/,https://api.osf.io/v2/files/5b7c20af2da7bb0019715da8/,5b7c20af2da7bb0019715da8,files,https://api.osf.io/v2/preprints/fyz7m/review_actions/,https://api.osf.io/v2/preprints/fyz7m/requests/,https://api.osf.io/v2/preprints/fyz7m/,https://osf.io/preprints/socarxiv/fyz7m/,https://doi.org/10.31235/osf.io/fyz7m,NA
7bwyq,preprints,2018-08-21T12:50:22.391828,2018-08-21T13:12:01.416761,2018-08-21T13:11:48.926956,NA,NA,"Eliciting individual risk attitudes – different procedures, different findings","We compare three procedures for eliciting individual risk attitudes: Holt-and-Laury (2002), Eckel-and-Grossman (2002), and the general willingness-to-take-risks question of the German socio-economic panel (Dohmen et al. 2011). Using a within-subject design, we carry out a classroom experiment with students who are enrolled in the degree programs Physics, Computer Sciences, Agricultural Sciences, Law, and History. We find that the risk attitudes as measured by the three procedures diverge substantially. This poses a serious challenge to the validity of these measurement instruments. Reconnoitering the room for improvement in the elicitation of risk atti-tudes, we discuss potential reasons for this divergence such as flawed design, overhasty interpretations, and confusion on the conceptual level.",TRUE,FALSE,bounded rationality|Eckel-and-Grossman procedure|Holt-and-Laury procedure|Risk-attitude|self-reported willing-ness-to-take-risks,2018-08-21T13:12:01.400192,NA,,TRUE,accepted,2018-08-21T13:11:48.926956,NA,NA,NA,NA,NA,NA,NA,NA,NA,5a8c80f7c698300375c76d84|5a8c80f8c698300375c76dbe|5a8c80f8c698300375c76dc5|Social and Behavioral Sciences|Economics|Behavioral Economics,Authors of the paper,2018,https://api.osf.io/v2/preprints/7bwyq/contributors/,https://api.osf.io/v2/preprints/7bwyq/bibliographic_contributors/,https://api.osf.io/v2/preprints/7bwyq/citation/,7bwyq,preprints,https://api.osf.io/v2/preprints/7bwyq/identifiers/,https://api.osf.io/v2/nodes/vrc9w/,https://api.osf.io/v2/preprints/7bwyq/relationships/node/,vrc9w,nodes,https://api.osf.io/v2/licenses/563c1cf88c5e4a3877f9e965/,563c1cf88c5e4a3877f9e965,licenses,https://api.osf.io/v2/providers/preprints/socarxiv/,socarxiv,preprint-providers,https://api.osf.io/v2/preprints/7bwyq/files/,https://api.osf.io/v2/files/5b7c0a8dd4676c0019ac2422/,5b7c0a8dd4676c0019ac2422,files,https://api.osf.io/v2/preprints/7bwyq/review_actions/,https://api.osf.io/v2/preprints/7bwyq/requests/,https://api.osf.io/v2/preprints/7bwyq/,https://osf.io/preprints/socarxiv/7bwyq/,https://doi.org/10.31235/osf.io/7bwyq,NA
qcf4t,preprints,2018-08-21T03:19:31.418561,2018-09-27T15:38:33.871279,2018-08-21T13:21:18.045512,2018-08-20T04:00:00,NA,Territorial Expansion in the Virú State: Updating Old Settlement Patterns to Explore New Ideas,"The territorial-expansion model, recently proposed as a general model to explain the development of first-generation states, is tested in the Virú Valley of Peru. The Virú state developed around 200 BC and is the earliest known state on the north coast of Peru. The settlement patterns and settlement hierarchies of the Virú Period (ca. 200 BC – 600 AD) are compared with those of the earlier Puerto Morin Period (ca. 400 – 200 BC) to investigate processes of territorial expansion. Two independent polities and several outlying communities occupied the valley during the Puerto Morin Period whereas settlement during the Virú Period was extensive, populations surged, and large swaths of the valley were settled for the first time. Evidence is presented to show that the Virú state incorporated the earlier Puerto Morin polities and that a three-tiered settlement hierarchy existed at this time. Drawing from cross-cultural evidence and recent studies on Virú expansionary dynamics, I propose a hypothesis that the Virú state expanded rapidly throughout the valley early in its developmental history and pursued a policy of territorial consolidation later in its history. Ultimately, the Virú case supports the territorial-expansion model of early state development.",TRUE,FALSE,Early Intermediate Period|Early States|north coast|Peru|Puerto Morin|settlement hierarchies|settlement patterns|territorial expansion model|Virú,2018-08-21T13:21:41.757750,NA,,TRUE,accepted,2018-08-21T13:21:18.045512,NA,NA,NA,NA,NA,NA,NA,NA,NA,5a8c80f7c698300375c76d84|5a8c80f9c698300375c76df6|5a8c80f9c698300375c76dfb|Social and Behavioral Sciences|Anthropology|Archaeological Anthropology,,2018,https://api.osf.io/v2/preprints/qcf4t/contributors/,https://api.osf.io/v2/preprints/qcf4t/bibliographic_contributors/,https://api.osf.io/v2/preprints/qcf4t/citation/,qcf4t,preprints,https://api.osf.io/v2/preprints/qcf4t/identifiers/,https://api.osf.io/v2/nodes/zpytf/,https://api.osf.io/v2/preprints/qcf4t/relationships/node/,zpytf,nodes,https://api.osf.io/v2/licenses/563c1cf88c5e4a3877f9e96a/,563c1cf88c5e4a3877f9e96a,licenses,https://api.osf.io/v2/providers/preprints/socarxiv/,socarxiv,preprint-providers,https://api.osf.io/v2/preprints/qcf4t/files/,https://api.osf.io/v2/files/5b7b84c2d4676c0018ac0b6d/,5b7b84c2d4676c0018ac0b6d,files,https://api.osf.io/v2/preprints/qcf4t/review_actions/,https://api.osf.io/v2/preprints/qcf4t/requests/,https://api.osf.io/v2/preprints/qcf4t/,https://osf.io/preprints/socarxiv/qcf4t/,https://doi.org/10.31235/osf.io/qcf4t,NA
uf5z3,preprints,2018-08-21T01:47:29.574803,2019-07-05T04:01:25.237048,2018-08-21T13:21:48.829220,NA,10.1057/s41599-019-0221-1,Cultural evolution of music,"The concept of cultural evolution was fundamental to the foundation of academic musicology and the subfield of comparative musicology,  but largely disappeared from discussion after World War II, despite a recent resurgence of interest in cultural evolution in other fields. In this article, I draw on recent advances in the scientific understanding of cultural evolution to clarify persistent misconceptions about the roles of genes and progress in musical evolution and review literature relevant to musical evolution ranging from macroevolution of global song-style to microevolution of tune families. I also address criticisms regarding issues of musical agency, meaning, and reductionism, and highlight potential applications including music copyright, education, and sustainability. While cultural evolution will never explain all aspects of music in culture, it offers a useful theoretical framework for understanding diversity and change in the world’s music.",TRUE,FALSE,,2018-08-21T13:22:01.781782,NA,,TRUE,accepted,2018-08-21T13:21:48.829220,NA,NA,NA,NA,NA,NA,NA,NA,NA,5a8c80f2c698300375c76c7d|5a8c80f6c698300375c76d43|5a8c80f6c698300375c76d46|Arts and Humanities|Music|Ethnomusicology,,2018,https://api.osf.io/v2/preprints/uf5z3/contributors/,https://api.osf.io/v2/preprints/uf5z3/bibliographic_contributors/,https://api.osf.io/v2/preprints/uf5z3/citation/,uf5z3,preprints,https://api.osf.io/v2/preprints/uf5z3/identifiers/,https://api.osf.io/v2/nodes/hcepf/,https://api.osf.io/v2/preprints/uf5z3/relationships/node/,hcepf,nodes,https://api.osf.io/v2/licenses/563c1cf88c5e4a3877f9e96a/,563c1cf88c5e4a3877f9e96a,licenses,https://api.osf.io/v2/providers/preprints/socarxiv/,socarxiv,preprint-providers,https://api.osf.io/v2/preprints/uf5z3/files/,https://api.osf.io/v2/files/5b7b6f302da7bb001b70914e/,5b7b6f302da7bb001b70914e,files,https://api.osf.io/v2/preprints/uf5z3/review_actions/,https://api.osf.io/v2/preprints/uf5z3/requests/,https://api.osf.io/v2/preprints/uf5z3/,https://osf.io/preprints/socarxiv/uf5z3/,https://doi.org/10.31235/osf.io/uf5z3,https://doi.org/10.1057/s41599-019-0221-1
bevug,preprints,2018-08-21T00:52:33.475538,2018-08-21T13:22:20.896502,2018-08-21T13:22:09.848414,NA,10.24093/awej/MEC1.11,Enhancing English Language Teaching through Films in General Foundation Programs,"Enhancing English Language Teaching (ELT) through films in General Foundation Programs (GFPs), Oman is a practical research paper which aims at exploiting of technologies in ELT in order to develop linguistic competence and learner autonomy of students in the GFP. Research in communicative approach to language has shown that competence in oral and written language grows as the learners actively use the language in and out of the classroom. The aim of this paper is to engage learners in activities that demand their autonomous participation and develop linguistic competence and learner autonomy. The vital question every teacher has to ponder upon is “Can we expect what was taught in the previous class is retained in the next class?” The present study focuses on how films can aid in enhancing ELT in the GFP in Oman. The research data collected will be empirical and qualitative in nature. GFP students will be the main subjects of this research. The research will be carried out on different levels and groups in the GFP. The activities based on films expose the learners to authentic language input, help them learn how language operates and challenge them to use the language independently. The rich visual imagery, the action and motions of the films deliver the learners with multi-sensory involvement (Arcario, 1993). Infusing technology into Education serves a variety of purposes in language teaching. The observation of cultural aspects such as traditions helps to understand the function of the language. By this pragmatic approach an innovative teacher can aid students’ critical thinking skills as well as their linguistic competence. Hence it is suggested that a judicious selection of digital materials along with several learner-friendly tasks can be incorporated in syllabus of ELT.",TRUE,FALSE,ELT|films|GFP|learner autonomy|linguistic competence,2018-08-21T13:22:20.879110,NA,,TRUE,accepted,2018-08-21T13:22:09.848414,NA,NA,NA,NA,NA,NA,NA,NA,NA,5a8c80f2c698300375c76c7d|5a8c80f5c698300375c76d10|Arts and Humanities|English Language and Literature,,2018,https://api.osf.io/v2/preprints/bevug/contributors/,https://api.osf.io/v2/preprints/bevug/bibliographic_contributors/,https://api.osf.io/v2/preprints/bevug/citation/,bevug,preprints,https://api.osf.io/v2/preprints/bevug/identifiers/,https://api.osf.io/v2/nodes/esytv/,https://api.osf.io/v2/preprints/bevug/relationships/node/,esytv,nodes,https://api.osf.io/v2/licenses/563c1cf88c5e4a3877f9e96a/,563c1cf88c5e4a3877f9e96a,licenses,https://api.osf.io/v2/providers/preprints/socarxiv/,socarxiv,preprint-providers,https://api.osf.io/v2/preprints/bevug/files/,https://api.osf.io/v2/files/5b7b6250d4676c0018abf0e3/,5b7b6250d4676c0018abf0e3,files,https://api.osf.io/v2/preprints/bevug/review_actions/,https://api.osf.io/v2/preprints/bevug/requests/,https://api.osf.io/v2/preprints/bevug/,https://osf.io/preprints/socarxiv/bevug/,https://doi.org/10.31235/osf.io/bevug,https://doi.org/10.24093/awej/MEC1.11
hq528,preprints,2018-08-21T00:43:23.917990,2018-08-21T13:24:21.325713,2018-08-21T13:24:03.845011,NA,10.24093/awej/MEC1.9,A rose by any other name…:  Exploiting any literary text in the ESL/EFL classroom,"The paper argues that literature provides authentic materials for developing reading and related language skills in addition to other real world texts (e.g. advertisements, or multimodal texts downloaded from the Internet). Hence, the paper aims to demonstrate how literary texts can be employed in the English as a Second Language (ESL) or English as a Foreign Language (EFL) classroom to facilitate reading, language acquisition, and related critical skills, particularly at the pre-intermediate stage and above. Text selections from popular novels were analysed using Johns and Davies’ (1983) Text as Vehicle of Information (TAVI), and Text as Linguistic Object (TALO), as well as Clandfield’s (2005) Text as Springboard for Production (TASP) as a framework to design language learning/use activities. Source texts were selected from Ishiguro’s The Remains of the Day, Austen’s Pride and Prejudice, and Martel’s Life of Pi in view of these novels’ current salience in the literary world to address key research questions: 1) What reading skills and sub-skills can the literary texts help develop among ESL/EFL students? 2) What aspects of grammar and vocabulary can be exploited in the texts? 3) How can the texts be used as reflections of social reality to generate discussion of critical issues among students? The fact that these novels have been produced as films, which the learners could also watch in whole or part, is expected to stimulate further critical appreciation. The paper concludes that the value of such informed use of any literary text is that it exploits the literature-language nexus to provide the synergy needed for student learning in the ESL/EFL classroom and beyond.",TRUE,FALSE,,2018-08-21T13:24:21.271772,NA,,TRUE,accepted,2018-08-21T13:24:03.845011,NA,NA,NA,NA,NA,NA,NA,NA,NA,5a8c80f2c698300375c76c7d|5a8c80f5c698300375c76d10|Arts and Humanities|English Language and Literature,,2018,https://api.osf.io/v2/preprints/hq528/contributors/,https://api.osf.io/v2/preprints/hq528/bibliographic_contributors/,https://api.osf.io/v2/preprints/hq528/citation/,hq528,preprints,https://api.osf.io/v2/preprints/hq528/identifiers/,https://api.osf.io/v2/nodes/j8ynd/,https://api.osf.io/v2/preprints/hq528/relationships/node/,j8ynd,nodes,https://api.osf.io/v2/licenses/563c1cf88c5e4a3877f9e96a/,563c1cf88c5e4a3877f9e96a,licenses,https://api.osf.io/v2/providers/preprints/socarxiv/,socarxiv,preprint-providers,https://api.osf.io/v2/preprints/hq528/files/,https://api.osf.io/v2/files/5b7b602bd4676c0017abcfff/,5b7b602bd4676c0017abcfff,files,https://api.osf.io/v2/preprints/hq528/review_actions/,https://api.osf.io/v2/preprints/hq528/requests/,https://api.osf.io/v2/preprints/hq528/,https://osf.io/preprints/socarxiv/hq528/,https://doi.org/10.31235/osf.io/hq528,https://doi.org/10.24093/awej/MEC1.9
7dqkw,preprints,2018-08-21T00:40:15.851181,2018-08-21T13:25:42.189602,2018-08-21T13:25:14.930801,NA,10.24093/awej/MEC1.8,"Male and Female EFL Teachers' Consciousness of Self-disclosure: A Case Study from Al Baha University, Saudia Arabia","Teacher self-disclosure (TSD) is a communication strategy that may positively affect students' learning by encouraging them to participate effectively in English as Foreign Language (EFL) or English as a Second Language (ESL) classroom activities. In addition, it can be considered a Second Language (L2) teaching method that can increase learner’s engagement and language learning outcomes. Owning to its context-sensitive and culture-dependent nature, however, TSD topics, purposes, and considerations may vary cross-culturally. This study is an endeavor to investigate EFL University teachers' consciousness of suitability and appropriateness of TSD as well as to find out differences and similarities between male and female EFL teachers' conceptions of the relevance of TSD to successful L2 teaching. In order to achieve these objectives, the Appropriateness of Teacher Self-Disclosure Scale is administered to 60 EFL teachers (30 females and 30 males) from the Foreign Languages Departments at the Faculties of Arts and Humanities of Al Baha University, KSA. Results of the current study refer to the extent to which EFL teachers consider TSD topics, purposes, and considerations to be proper or improper. Moreover, the study finds out concurrence and indifference between male and female teachers' conceptions in topics of TSD, the purposes TSD achieves in classroom settings, and considerations the teachers consider when practicing TSD. The results of the study recommend that EFL teachers can use TSD as a teaching and career development tool to improve learning despite the fact that they should be alert of its influences in some features as TSD is culture and context oriented.",TRUE,FALSE,EFL|teacher consciousness|teacher self-disclosure,2018-08-21T13:25:42.175273,NA,,TRUE,accepted,2018-08-21T13:25:14.930801,NA,NA,NA,NA,NA,NA,NA,NA,NA,5a8c80f2c698300375c76c7d|5a8c80f5c698300375c76d10|Arts and Humanities|English Language and Literature,,2018,https://api.osf.io/v2/preprints/7dqkw/contributors/,https://api.osf.io/v2/preprints/7dqkw/bibliographic_contributors/,https://api.osf.io/v2/preprints/7dqkw/citation/,7dqkw,preprints,https://api.osf.io/v2/preprints/7dqkw/identifiers/,https://api.osf.io/v2/nodes/z7ahn/,https://api.osf.io/v2/preprints/7dqkw/relationships/node/,z7ahn,nodes,https://api.osf.io/v2/licenses/563c1cf88c5e4a3877f9e96a/,563c1cf88c5e4a3877f9e96a,licenses,https://api.osf.io/v2/providers/preprints/socarxiv/,socarxiv,preprint-providers,https://api.osf.io/v2/preprints/7dqkw/files/,https://api.osf.io/v2/files/5b7b5f6f2da7bb001b708999/,5b7b5f6f2da7bb001b708999,files,https://api.osf.io/v2/preprints/7dqkw/review_actions/,https://api.osf.io/v2/preprints/7dqkw/requests/,https://api.osf.io/v2/preprints/7dqkw/,https://osf.io/preprints/socarxiv/7dqkw/,https://doi.org/10.31235/osf.io/7dqkw,https://doi.org/10.24093/awej/MEC1.8
8kagh,preprints,2018-08-21T00:37:19.921315,2018-08-21T13:26:00.785676,2018-08-21T13:25:43.380283,NA,NA,Effective Use of Benchmarking: The Context of the Centre for Preparatory Studies in Oman,"This paper examines the importance and the process of developing benchmarks for the courses offered at the Centre for Preparatory Studies, Sultan Qaboos University, Oman. Benchmarks are necessary for improving the quality of instruction. Considering the importance of benchmarking and taking it as a point of reference, a small study was undertaken at the Centre for Preparatory Studies to develop benchmarks for each course offered in the General Foundation Program. One of the aims of developing benchmarks was to make it clear to students what is expected of them at the end of each course. The study draws on some examples of benchmarking models to draft benchmarks for the purpose of study. The exploratory method was followed for gaining insights to write benchmarks. Literature review showed that course objectives are used synonymously with benchmarks. The outcomes of the research project played a significant role in designing curricula for the GFP courses though it was quite a challenging task. It is important to draft concise and clear benchmarks, which are accessible and comprehensible for students and teachers. So, using the level-specific proficiency descriptors, can-do statements for each skill bench markers were written to make it comprehensible for students to know what is expected of them by the end of each course. Benchmarks used in one context may not be effective in other contexts. One important insight gained was what benchmarking is and what it is not.",TRUE,FALSE,benchmarks|challenges|implementation|objectives|standards,2018-08-21T13:26:00.769053,NA,,TRUE,accepted,2018-08-21T13:25:43.380283,NA,NA,NA,NA,NA,NA,NA,NA,NA,5a8c80f2c698300375c76c7d|5a8c80f5c698300375c76d10|Arts and Humanities|English Language and Literature,,2018,https://api.osf.io/v2/preprints/8kagh/contributors/,https://api.osf.io/v2/preprints/8kagh/bibliographic_contributors/,https://api.osf.io/v2/preprints/8kagh/citation/,8kagh,preprints,https://api.osf.io/v2/preprints/8kagh/identifiers/,https://api.osf.io/v2/nodes/acv8m/,https://api.osf.io/v2/preprints/8kagh/relationships/node/,acv8m,nodes,https://api.osf.io/v2/licenses/563c1cf88c5e4a3877f9e96a/,563c1cf88c5e4a3877f9e96a,licenses,https://api.osf.io/v2/providers/preprints/socarxiv/,socarxiv,preprint-providers,https://api.osf.io/v2/preprints/8kagh/files/,https://api.osf.io/v2/files/5b7b5ebf2da7bb001970b341/,5b7b5ebf2da7bb001970b341,files,https://api.osf.io/v2/preprints/8kagh/review_actions/,https://api.osf.io/v2/preprints/8kagh/requests/,https://api.osf.io/v2/preprints/8kagh/,https://osf.io/preprints/socarxiv/8kagh/,https://doi.org/10.31235/osf.io/8kagh,NA
