id,type,attributes.date_created,attributes.date_modified,attributes.date_published,attributes.original_publication_date,attributes.doi,attributes.title,attributes.description,attributes.is_published,attributes.is_preprint_orphan,attributes.tags,attributes.preprint_doi_created,attributes.date_withdrawn,attributes.current_user_permissions,attributes.public,attributes.reviews_state,attributes.date_last_transitioned,attributes.has_coi,attributes.conflict_of_interest_statement,attributes.has_data_links,attributes.why_no_data,attributes.data_links,attributes.has_prereg_links,attributes.why_no_prereg,attributes.prereg_links,attributes.prereg_link_info,attributes.subjects,attributes.license_record.copyright_holders,attributes.license_record.year,relationships.contributors.links.related.href,relationships.bibliographic_contributors.links.related.href,relationships.citation.links.related.href,relationships.citation.data.id,relationships.citation.data.type,relationships.identifiers.links.related.href,relationships.node.links.self.href,relationships.node.links.related.href,relationships.node.data.id,relationships.node.data.type,relationships.license.links.related.href,relationships.license.data.id,relationships.license.data.type,relationships.provider.links.related.href,relationships.provider.data.id,relationships.provider.data.type,relationships.files.links.related.href,relationships.primary_file.links.related.href,relationships.primary_file.data.id,relationships.primary_file.data.type,relationships.review_actions.links.related.href,relationships.requests.links.related.href,links.self,links.html,links.preprint_doi,links.doi
csfpy,preprints,2019-02-20T09:59:08.860139,2019-02-20T13:38:44.230925,2019-02-20T13:12:50.463340,NA,NA,Luck as a Double-Edged Sword: Personnel and Performance Changes after Lucky Outcomes in the National Football League,"Luck is an omnipresent factor which influences experiences and outcomes for individuals and organizations. This article analyzes how lucky and unlucky outcomes influence future organizational learning, decision-making and performance. Team statistics and outcomes are analyzed over 769 National Football League seasons for 32 franchises from 1990-2015. Four specific sources of luck are identified and measured: 1) divergence of win outcomes from actual team quality; 2) difficulty of opposition; 3) fumble recovery rates and 4) player injuries. Teams and players have little or no influence over these lucky factors, which nevertheless influence game outcomes, and by extension, the careers of players and coaches. Luck alters game outcomes and in turn significantly influences the retention or firing of coaches and players, which shapes their career incentives and decision-making. In addition to negatively affecting future performance via distorted learning, luck can also generate perverse incentives; in this case, encouraging risk aversion and scapegoating. Mistaking noise for signal – and conflating luck with skill – is conducive to poorer future decisions and outcomes. Paradoxically, luck can provide a means of skill-based advantage for savvy decision-makers, who learn more effectively from noisy feedback than others who are misled.",TRUE,FALSE,careers|decision-making|football|luck|randomness|sports|sports analytics,2019-02-20T13:38:44.210742,NA,,TRUE,accepted,2019-02-20T13:12:50.463340,NA,NA,NA,NA,NA,NA,NA,NA,NA,5a8c80f7c698300375c76d84|Social and Behavioral Sciences,,2019,https://api.osf.io/v2/preprints/csfpy/contributors/,https://api.osf.io/v2/preprints/csfpy/bibliographic_contributors/,https://api.osf.io/v2/preprints/csfpy/citation/,csfpy,preprints,https://api.osf.io/v2/preprints/csfpy/identifiers/,https://api.osf.io/v2/preprints/csfpy/relationships/node/,NA,NA,NA,https://api.osf.io/v2/licenses/563c1cf88c5e4a3877f9e96a/,563c1cf88c5e4a3877f9e96a,licenses,https://api.osf.io/v2/providers/preprints/socarxiv/,socarxiv,preprint-providers,https://api.osf.io/v2/preprints/csfpy/files/,https://api.osf.io/v2/files/5c6d24f182a3950019c88972/,5c6d24f182a3950019c88972,files,https://api.osf.io/v2/preprints/csfpy/review_actions/,https://api.osf.io/v2/preprints/csfpy/requests/,https://api.osf.io/v2/preprints/csfpy/,https://osf.io/preprints/socarxiv/csfpy/,https://doi.org/10.31235/osf.io/csfpy,NA
vd3uk,preprints,2019-02-20T09:56:19.596636,2020-07-09T13:10:11.303441,2019-02-20T14:37:58.403410,2019-02-20T00:00:00,NA,Geosilhouettes: geographical measures of cluster fit,"Regionalization, under various guises and descriptions, is a longstanding and pervasive interest of urban studies. With an increasingly large number of studies on urban place detection in language, behavior, pricing, and demography, recent critiques of longstanding regional science perspectives on place detection have focused on the arbitrariness and non-geographical nature of measures of best fit. In this paper, we develop new explicitly-geographical measures of cluster fit. These hybrid spatial-social measures, called geosilhouettes, are demonstrated to capture the ""core"" of geographical clusters in racial data on census blocks in Brooklyn neighborhoods. These new geosilhouettes are also useful in a variety of boundary analysis and outlier detection uses. These new measures are defined, demonstrated, and new directions are suggested.",TRUE,FALSE,clustering|data science|geography|regionalization|segregation|sociology|unsupervised learning|urban analytics|urban geography,2019-02-20T14:49:08.467410,NA,,TRUE,accepted,2019-02-20T14:37:58.403410,NA,NA,NA,NA,NA,NA,NA,NA,NA,5a8c80f7c698300375c76d84|5a8c80f7c698300375c76d86|5a8c80f7c698300375c76d8d|Social and Behavioral Sciences|Geography|Spatial Science,,2019,https://api.osf.io/v2/preprints/vd3uk/contributors/,https://api.osf.io/v2/preprints/vd3uk/bibliographic_contributors/,https://api.osf.io/v2/preprints/vd3uk/citation/,vd3uk,preprints,https://api.osf.io/v2/preprints/vd3uk/identifiers/,https://api.osf.io/v2/preprints/vd3uk/relationships/node/,https://api.osf.io/v2/nodes/gmydq/,gmydq,nodes,https://api.osf.io/v2/licenses/563c1cf88c5e4a3877f9e96a/,563c1cf88c5e4a3877f9e96a,licenses,https://api.osf.io/v2/providers/preprints/socarxiv/,socarxiv,preprint-providers,https://api.osf.io/v2/preprints/vd3uk/files/,https://api.osf.io/v2/files/5c6d24468d5d98001c2fa784/,5c6d24468d5d98001c2fa784,files,https://api.osf.io/v2/preprints/vd3uk/review_actions/,https://api.osf.io/v2/preprints/vd3uk/requests/,https://api.osf.io/v2/preprints/vd3uk/,https://osf.io/preprints/socarxiv/vd3uk/,https://doi.org/10.31235/osf.io/vd3uk,NA
etmzk,preprints,2019-02-20T08:57:14.960898,2020-07-09T13:10:33.996082,2019-02-20T19:28:29.484910,NA,NA,Import Inflows of Bangladesh: The Gravity Model Approach,"Bangladesh suffers from a chronic deficit in her trade balance. The paper is an attempt to explore the imports of Bangladesh which is one of the most significant factors responsible for unfavorable trade balance of the country. The aim of the study is to intend some initiatives for an attempt to ultimately reshaping the trade balance of Bangladesh with her foreign trade partners. The paper examines the existence of the gravity theory for the imports of Bangladesh with its eight major trading partner countries- India, China, Singapore, Japan, Hong Kong, South Korea, USA and Malaysia. The data set consists of yearly data from 1985 to 2003 in a panel approach. The paper comes across with the findings that the gravity theory is consistent with the imports of Bangladesh. That is, the geographical distance of Bangladesh with its partner countries has significant impacts on its imports. But in near future this may change because of different factors such as profitability, easy trade procedures, product delivery time etc. that influence the imports decision more than does the geographical distance. This paper finds mixed relationship between the GDP and imports of Bangladesh. It also shows that the imports of Bangladesh influence the domestic production very little because Bangladesh mostly imports consumer goods rather than capital goods. Moreover, the population of Bangladesh has significant impacts on imports which in turn implies that Bangladesh is not capable of producing adequate consumer goods to meet the increased demand resulted from high population growth. It also shows that partner countries‟ GDP has significant positive impacts and partner countries‟ population has mixed impact on imports of Bangladesh. This paper concludes that it will be an alarming situation for trade balance of Bangladesh if the imports continue to increase in such a pattern that the rate increases five to eight times more in respect of population increases and at the same time the ratio of capital goods in proportion of total imports decreases.",TRUE,FALSE,Geographical Distance|Gravity Model|Gross Domestic Product (GDP)|Imports|Panel study|Population,2019-02-20T19:30:03.068902,NA,,TRUE,accepted,2019-02-20T19:28:29.484910,NA,NA,NA,NA,NA,NA,NA,NA,NA,5a8c80f7c698300375c76d84|5a8c80f8c698300375c76dbe|5a8c80f8c698300375c76dbf|Social and Behavioral Sciences|Economics|Finance,,2019,https://api.osf.io/v2/preprints/etmzk/contributors/,https://api.osf.io/v2/preprints/etmzk/bibliographic_contributors/,https://api.osf.io/v2/preprints/etmzk/citation/,etmzk,preprints,https://api.osf.io/v2/preprints/etmzk/identifiers/,https://api.osf.io/v2/preprints/etmzk/relationships/node/,https://api.osf.io/v2/nodes/mn8yw/,mn8yw,nodes,https://api.osf.io/v2/licenses/563c1cf88c5e4a3877f9e96c/,563c1cf88c5e4a3877f9e96c,licenses,https://api.osf.io/v2/providers/preprints/socarxiv/,socarxiv,preprint-providers,https://api.osf.io/v2/preprints/etmzk/files/,https://api.osf.io/v2/files/5c6d166f82a3950017c94948/,5c6d166f82a3950017c94948,files,https://api.osf.io/v2/preprints/etmzk/review_actions/,https://api.osf.io/v2/preprints/etmzk/requests/,https://api.osf.io/v2/preprints/etmzk/,https://osf.io/preprints/socarxiv/etmzk/,https://doi.org/10.31235/osf.io/etmzk,NA
xh9na,preprints,2019-02-20T08:51:18.459541,2020-07-15T12:42:03.463957,2019-02-20T19:28:14.585095,NA,10.2753/0577-5132510608,Questioning Bangladesh's Microcredit,"The microcredit (MC) program of Bangladesh has been a well-known success story for generation of self-employment, and poverty alleviation. Variants of this MC model are being implemented in more than 60 different countries of the world. It has become almost a universal antidote for poverty especially from 2006 when Professor Muhammad Yunus- the founder of the Grameen Bank (GB) and the bank itself shared the Nobel peace prize. Although the GB is the pioneer of MC program in Bangladesh, there are many other non-governmental organizations (NGO)s that offer the same program in Bangladesh in different forms and names. The providers of MCs claim that the overwhelming majority of the borrowers are using the loan funds profitably for productive purposes, repaying the loans and interest regularly, and thus improving their socio-economic conditions steadily. The findings of the present study are somewhat contrary and disturbing to the claim of the MC programs. This study finds that a bulk of the MC is borrowed for non productive purposes. About one quarter of the borrowers use the credit exclusively for consumption and debt repayment purposes. Nearly half of them use the credits entirely for investment purposes. For all, the return on investment is very meager. About two-third of the borrowers, on average have an impressive 83% net return on investment available for payment of interest and dividend in addition to the principal. But in case of as high as one third of them, average return on investment is not enough even to cover the most minimum or tolerance level of wages for family labors, let alone paying any interest and making any profit after keeping aside the principal.",TRUE,FALSE,implicit cost of labor|microcredit|microenterprise|Microlending|small business,2019-02-20T19:29:02.447801,NA,,TRUE,accepted,2019-02-20T19:28:14.585095,NA,NA,NA,NA,NA,NA,NA,NA,NA,5a8c80f7c698300375c76d84|5a8c80f8c698300375c76dbe|5a8c80f8c698300375c76dbf|Social and Behavioral Sciences|Economics|Finance,,2019,https://api.osf.io/v2/preprints/xh9na/contributors/,https://api.osf.io/v2/preprints/xh9na/bibliographic_contributors/,https://api.osf.io/v2/preprints/xh9na/citation/,xh9na,preprints,https://api.osf.io/v2/preprints/xh9na/identifiers/,https://api.osf.io/v2/preprints/xh9na/relationships/node/,https://api.osf.io/v2/nodes/9hq4g/,9hq4g,nodes,https://api.osf.io/v2/licenses/563c1cf88c5e4a3877f9e96c/,563c1cf88c5e4a3877f9e96c,licenses,https://api.osf.io/v2/providers/preprints/socarxiv/,socarxiv,preprint-providers,https://api.osf.io/v2/preprints/xh9na/files/,https://api.osf.io/v2/files/5c6d150d62c82a001ad6442b/,5c6d150d62c82a001ad6442b,files,https://api.osf.io/v2/preprints/xh9na/review_actions/,https://api.osf.io/v2/preprints/xh9na/requests/,https://api.osf.io/v2/preprints/xh9na/,https://osf.io/preprints/socarxiv/xh9na/,https://doi.org/10.31235/osf.io/xh9na,https://doi.org/10.2753/0577-5132510608
hgpvk,preprints,2019-02-20T08:44:00.009608,2019-02-24T08:12:12.951053,2019-02-20T14:32:16.126396,NA,NA,A Reflection on Economics of Microcredit Borrowing in Rural Bangladesh,"There is no room for denying the critical importance of microcredit for economic emancipation of rural poor in Bangladesh or any such other country. In analyzing the effectiveness of microcredit program the microcredit providers (NGOs) use accounting profit of the borrowers’ enterprises ignoring implicit costs on the plea that the opportunity cost of labor is near zero in those countries. This plea is certainly not tenable. In this research we use the principle of economic profit taking into account the implicit cost of family labor. From the results of this pilot study we get the reflection that a bulk of the microcredit is borrowed for non productive purposes. As high as 24% of borrowers used the credit exclusively for consumption and debt repayment purposes, and therefore demand for payment of interest from them is nonsensical. Only 48 % of the borrowers used the credits entirely for investment purposes. However, they are faced with very low-return investment opportunities in rural areas. About 68% of them on average had an impressive 83% net return on investment available for payment of interest and dividend. But in case of as high as 32% of them average return on investment was not enough even to cover the most minimum or tolerance level of wages for family labors. In their cases any payment of interest for capital has to be at the expense of the sacrifice of this subsistence level wages of the family labors. They are trapped in a vicious circle of loans. In the absence of a built in mechanism for debt relief they have no scope to be freed from this bondage of debt. An Islamic microcredit model based on Mudarabah principle (whereby the lender and borrower share the business surplus/profit on an agreed ratio, but in case of loss the lender alone bears the loss) may be a better alternative for them. There are indications that it requires an investment of around Tk 12,000 for creating job opportunity for one rural labor for the whole year.",TRUE,FALSE,,2019-02-20T14:36:41.668607,NA,,TRUE,accepted,2019-02-20T14:32:16.126396,NA,NA,NA,NA,NA,NA,NA,NA,NA,5a8c80f7c698300375c76d84|5a8c80f8c698300375c76dbe|5a8c80f8c698300375c76dbf|Social and Behavioral Sciences|Economics|Finance,,2019,https://api.osf.io/v2/preprints/hgpvk/contributors/,https://api.osf.io/v2/preprints/hgpvk/bibliographic_contributors/,https://api.osf.io/v2/preprints/hgpvk/citation/,hgpvk,preprints,https://api.osf.io/v2/preprints/hgpvk/identifiers/,https://api.osf.io/v2/preprints/hgpvk/relationships/node/,https://api.osf.io/v2/nodes/m2g69/,m2g69,nodes,https://api.osf.io/v2/licenses/563c1cf88c5e4a3877f9e96c/,563c1cf88c5e4a3877f9e96c,licenses,https://api.osf.io/v2/providers/preprints/socarxiv/,socarxiv,preprint-providers,https://api.osf.io/v2/preprints/hgpvk/files/,https://api.osf.io/v2/files/5c6d135462c82a0019d69352/,5c6d135462c82a0019d69352,files,https://api.osf.io/v2/preprints/hgpvk/review_actions/,https://api.osf.io/v2/preprints/hgpvk/requests/,https://api.osf.io/v2/preprints/hgpvk/,https://osf.io/preprints/socarxiv/hgpvk/,https://doi.org/10.31235/osf.io/hgpvk,NA
udpwj,preprints,2019-02-20T08:38:25.320167,2020-07-09T13:10:42.718981,2019-02-20T14:31:34.179820,NA,NA,An Empirical Evidence of Fisher Effect in Bangladesh: A Time-Series Approach,"This paper is an attempt to trace the relationship between interest rates and rates of inflation in the economy of Bangladesh. In view of this, a time series approach is considered to examine the empirical evidence of Fisher’s effect in the country. By applying OLS and Unit Root test, the estimated value is used to determine the casual relationship between interest rates and inflation for the monthly sample period of August 1996 to December 2003. The empirical results suggest that there does not exist any co-movement of inflation with interest rates and the relationship between the variables is also not significant for Bangladesh. Further, the trends advocate that the inflation premium, equal to expected inflation that investors add to real-risk free rate of return, is ineffective in the country.",TRUE,FALSE,Bangladesh|Inflation|Interest rate,2019-02-20T14:34:42.446196,NA,,TRUE,accepted,2019-02-20T14:31:34.179820,NA,NA,NA,NA,NA,NA,NA,NA,NA,5a8c80f7c698300375c76d84|5a8c80f8c698300375c76dbe|5a8c80f8c698300375c76dbf|Social and Behavioral Sciences|Economics|Finance,,2019,https://api.osf.io/v2/preprints/udpwj/contributors/,https://api.osf.io/v2/preprints/udpwj/bibliographic_contributors/,https://api.osf.io/v2/preprints/udpwj/citation/,udpwj,preprints,https://api.osf.io/v2/preprints/udpwj/identifiers/,https://api.osf.io/v2/preprints/udpwj/relationships/node/,https://api.osf.io/v2/nodes/d45t8/,d45t8,nodes,https://api.osf.io/v2/licenses/563c1cf88c5e4a3877f9e96c/,563c1cf88c5e4a3877f9e96c,licenses,https://api.osf.io/v2/providers/preprints/socarxiv/,socarxiv,preprint-providers,https://api.osf.io/v2/preprints/udpwj/files/,https://api.osf.io/v2/files/5c6d12068d5d98001c2f9e4e/,5c6d12068d5d98001c2f9e4e,files,https://api.osf.io/v2/preprints/udpwj/review_actions/,https://api.osf.io/v2/preprints/udpwj/requests/,https://api.osf.io/v2/preprints/udpwj/,https://osf.io/preprints/socarxiv/udpwj/,https://doi.org/10.31235/osf.io/udpwj,NA
wsjkq,preprints,2019-02-20T08:32:10.146971,2019-02-24T08:12:42.918136,2019-02-20T14:30:37.457058,NA,NA,Market Depth and Risk Return Analysis of Dhaka Stock Exchange: An Empirical Test of Market Efficiency,"It is customary that when security prices fully reflect all available information, the markets for those securities are said to be efficient. And if markets are inefficient, investors can use available information ignored by the market to earn abnormally high returns on their investments. In this context this paper tries to find evidence supporting the reality of weak-form efficiency of the Dhaka Stock Exchange (DSE) by examining the issues of market risk-return relationship and market depth or liquidity for DSE. The study uses a data set of daily market index and returns for the period of 1994 to 2005 and weekly market capital turnover in proportion of total market capital for the period of 1994 to 2005. The paper also looks about the market risk (systemic risk) and return where it is found that market rate of return of DSE is very low or sometimes negative. Eventually Capital Asset Pricing Model (CAPM), which envisages the relationship between risk and the expected rate of return on a risky security, is found unrelated in DSE market. As proper risk-return relationships of the market is seems to be deficient in DSE and the market is not liquid, interest of the available investors are bring into being very insignificant. All these issues are very noteworthy to the security analysts, investors and security exchange regulatory bodies in their policy making decisions to progress the market condition.",TRUE,FALSE,Dhaka Stock Exchange and Capital Asset Pricing Model|Market Efficiency,2019-02-20T14:32:46.801369,NA,,TRUE,accepted,2019-02-20T14:30:37.457058,NA,NA,NA,NA,NA,NA,NA,NA,NA,5a8c80f7c698300375c76d84|5a8c80f8c698300375c76dbe|5a8c80f8c698300375c76dc8|Social and Behavioral Sciences|Economics|Growth and Development,,2019,https://api.osf.io/v2/preprints/wsjkq/contributors/,https://api.osf.io/v2/preprints/wsjkq/bibliographic_contributors/,https://api.osf.io/v2/preprints/wsjkq/citation/,wsjkq,preprints,https://api.osf.io/v2/preprints/wsjkq/identifiers/,https://api.osf.io/v2/preprints/wsjkq/relationships/node/,https://api.osf.io/v2/nodes/78j6w/,78j6w,nodes,https://api.osf.io/v2/licenses/563c1cf88c5e4a3877f9e96c/,563c1cf88c5e4a3877f9e96c,licenses,https://api.osf.io/v2/providers/preprints/socarxiv/,socarxiv,preprint-providers,https://api.osf.io/v2/preprints/wsjkq/files/,https://api.osf.io/v2/files/5c6d108e8d5d98001a314a80/,5c6d108e8d5d98001a314a80,files,https://api.osf.io/v2/preprints/wsjkq/review_actions/,https://api.osf.io/v2/preprints/wsjkq/requests/,https://api.osf.io/v2/preprints/wsjkq/,https://osf.io/preprints/socarxiv/wsjkq/,https://doi.org/10.31235/osf.io/wsjkq,NA
2hne4,preprints,2019-02-19T22:58:29.348603,2020-07-15T12:42:06.588531,2019-02-20T13:11:29.446713,2018-04-02T04:00:00,NA,Open Smart Cities Guide,"This document intends to guide city stakeholders (public officials, civil society, technology innovators, private sector, academics, residents, etc.) toward formulating and strategically aligning practices with their agreed upon and unique Open Smart City vision. The Open Smart City definition and guide are relevant to city leaders and community leaders at multiple levels of governance (e.g., provincial, territorial, and federal).  This is part of a series of documents from the Natural Resources Canada GeoConnections funded Open Smart Cities project at Open North and led by Dr. Tracey P. Lauriault in collaboration with Jean-Noe Landry and Rachel Bloom of Open North.                                                                       
                                                                           
     Open Smart Cities in Canada is a collaborative project. We would like to thank smart city representatives from the cities of Edmonton, Guelph, Montréal, and Ottawa and officials from the provinces of British Columbia and Ontario for sharing their time, expertise, and experiences with us. Furthermore, this project benefits from contributions made by the project’s core team of experts and researchers. We are grateful to Professor David Fewer, LL.M., (Canadian Internet Policy and Public Interest Clinic (CIPPIC)), and Professor Mark Fox (University of Toronto) for providing their expert advice on the design of research and its outputs. Finally, we thank graduate students Stephen Letts and Carly Livingstone (Carleton University) for research assistance and editing over the course of the project.",TRUE,FALSE,Ethical IoT|Governance|Guide|Large technical systems|Openess|Open Smart Cities|Open smart city guide|Socio-technological assemblage|Transparency|Trust,2019-02-20T13:35:07.631679,NA,,TRUE,accepted,2019-02-20T13:11:29.446713,NA,NA,NA,NA,NA,NA,NA,NA,NA,5a8c80f2c698300375c76c7d|Arts and Humanities|5a8c80f7c698300375c76d84|5a8c80f9c698300375c76df4|Social and Behavioral Sciences|Science and Technology Studies,,2019,https://api.osf.io/v2/preprints/2hne4/contributors/,https://api.osf.io/v2/preprints/2hne4/bibliographic_contributors/,https://api.osf.io/v2/preprints/2hne4/citation/,2hne4,preprints,https://api.osf.io/v2/preprints/2hne4/identifiers/,https://api.osf.io/v2/preprints/2hne4/relationships/node/,https://api.osf.io/v2/nodes/4kq78/,4kq78,nodes,https://api.osf.io/v2/licenses/563c1cf88c5e4a3877f9e96a/,563c1cf88c5e4a3877f9e96a,licenses,https://api.osf.io/v2/providers/preprints/socarxiv/,socarxiv,preprint-providers,https://api.osf.io/v2/preprints/2hne4/files/,https://api.osf.io/v2/files/5c6c8a1962c82a0019d622f7/,5c6c8a1962c82a0019d622f7,files,https://api.osf.io/v2/preprints/2hne4/review_actions/,https://api.osf.io/v2/preprints/2hne4/requests/,https://api.osf.io/v2/preprints/2hne4/,https://osf.io/preprints/socarxiv/2hne4/,https://doi.org/10.31235/osf.io/2hne4,NA
