id,type,attributes.date_created,attributes.date_modified,attributes.date_published,attributes.original_publication_date,attributes.doi,attributes.title,attributes.description,attributes.is_published,attributes.is_preprint_orphan,attributes.tags,attributes.preprint_doi_created,attributes.date_withdrawn,attributes.current_user_permissions,attributes.public,attributes.reviews_state,attributes.date_last_transitioned,attributes.has_coi,attributes.conflict_of_interest_statement,attributes.has_data_links,attributes.why_no_data,attributes.data_links,attributes.has_prereg_links,attributes.why_no_prereg,attributes.prereg_links,attributes.prereg_link_info,attributes.subjects,attributes.license_record.copyright_holders,attributes.license_record.year,relationships.contributors.links.related.href,relationships.bibliographic_contributors.links.related.href,relationships.citation.links.related.href,relationships.citation.data.id,relationships.citation.data.type,relationships.identifiers.links.related.href,relationships.node.links.related.href,relationships.node.links.self.href,relationships.node.data.id,relationships.node.data.type,relationships.license.links.related.href,relationships.license.data.id,relationships.license.data.type,relationships.provider.links.related.href,relationships.provider.data.id,relationships.provider.data.type,relationships.files.links.related.href,relationships.primary_file.links.related.href,relationships.primary_file.data.id,relationships.primary_file.data.type,relationships.review_actions.links.related.href,relationships.requests.links.related.href,links.self,links.html,links.doi,links.preprint_doi
sw85m,preprints,2018-08-03T22:13:30.499587,2018-08-04T01:26:41.096738,2018-08-04T01:26:23.580227,2016-12-01T05:00:00,10.22148/16.010,Understanding Gender and Character Agency in the 19th Century Novel,"The relationship between character identity and character action is an established topic of literary study. In Morphology of the Folktale, Vladimir Propp argues against the separation of ""who acts"" from ""the question of the actions themselves,"" instead advocating an approach that studies characters according to their functions. Similarly, the notion of the literary archetype, as influenced by both Joseph Campbell and Carl Jung, highlights the way in which what characters do influences the way we perceive who characters are. The notion of literary stereotypes is also tied to this discussion. As Bamman, O'Connor, and Smith observe in their study of personas in film, stereotypical characters are ""defined by a fixed set of actions widely known to be representative of a class."" While actions are only one part of a complex network of descriptive tools that authors may use to create characters, they may offer us a useful insight into the way that certain behaviors can align with various character identity traits in literature.  A study of character action may serve as a proxy to not only demarcate character types, but also to investigate what behaviors, and types of behaviors, were conventionally aligned with different groups of characters. Bamman, Underwood, and Smith (2014) attempt something similar in ""A Bayesian Mixed Effects Model of Literary Character."" In that work, the authors focus on modeling specific character ""personas"" by studying semantically related words that occur in proximity to character mentions.  The authors note that ""articulating what a true 'persona' might be for characters is inherently problematic"" and they acknowledge that the ""personas learned so far [by their model] do not align neatly with character types known to literary historians."" Nevertheless, their study revealed compelling associations between certain personas and certain genres and, more importantly for our current research, that certain personas were ""clearly gendered."" In noting the later, the authors write that ""analysis of latent character types might cast new light on the history of gender in fiction."" Our work attempts a more direct and specific study of character agency in the context of character gender.  To do this, we explore trends in behavior associated with male and female characters in 3,329 19th century novels.",TRUE,FALSE,,2018-08-04T01:26:41.078467,NA,,TRUE,accepted,2018-08-04T01:26:23.580227,NA,NA,NA,NA,NA,NA,NA,NA,NA,5a8c80f2c698300375c76c7d|5a8c80f4c698300375c76ccb|Arts and Humanities|Digital Humanities,,2018,https://api.osf.io/v2/preprints/sw85m/contributors/,https://api.osf.io/v2/preprints/sw85m/bibliographic_contributors/,https://api.osf.io/v2/preprints/sw85m/citation/,sw85m,preprints,https://api.osf.io/v2/preprints/sw85m/identifiers/,https://api.osf.io/v2/nodes/av7g4/,https://api.osf.io/v2/preprints/sw85m/relationships/node/,av7g4,nodes,https://api.osf.io/v2/licenses/563c1cf88c5e4a3877f9e96a/,563c1cf88c5e4a3877f9e96a,licenses,https://api.osf.io/v2/providers/preprints/socarxiv/,socarxiv,preprint-providers,https://api.osf.io/v2/preprints/sw85m/files/,https://api.osf.io/v2/files/5b64d3897e433e0016038685/,5b64d3897e433e0016038685,files,https://api.osf.io/v2/preprints/sw85m/review_actions/,https://api.osf.io/v2/preprints/sw85m/requests/,https://api.osf.io/v2/preprints/sw85m/,https://osf.io/preprints/socarxiv/sw85m/,https://doi.org/10.22148/16.010,https://doi.org/10.31235/osf.io/sw85m
gybqw,preprints,2018-08-03T17:53:56.451875,2018-08-03T19:57:41.736184,2018-08-03T18:26:00.026619,NA,NA,Teaching your first political science course,"This working paper discusses the process of designing your first political science course. It covers the preparation of a diverse syllabus, developing learning objectives, structuring lectures and class activities, designing assignments, and setting up an efficient mode of course communication between the instructor and students.",TRUE,FALSE,designing a course|first class|learning technology|political science|syllabus|teaching,2018-08-03T19:57:41.717735,NA,,TRUE,accepted,2018-08-03T18:26:00.026619,NA,NA,NA,NA,NA,NA,NA,NA,NA,5a8c80f7c698300375c76d84|5a8c80f8c698300375c76daf|5a8c80f8c698300375c76db3|Social and Behavioral Sciences|Political Science|Other Political Science,,2018,https://api.osf.io/v2/preprints/gybqw/contributors/,https://api.osf.io/v2/preprints/gybqw/bibliographic_contributors/,https://api.osf.io/v2/preprints/gybqw/citation/,gybqw,preprints,https://api.osf.io/v2/preprints/gybqw/identifiers/,https://api.osf.io/v2/nodes/uftsb/,https://api.osf.io/v2/preprints/gybqw/relationships/node/,uftsb,nodes,https://api.osf.io/v2/licenses/563c1cf88c5e4a3877f9e96a/,563c1cf88c5e4a3877f9e96a,licenses,https://api.osf.io/v2/providers/preprints/socarxiv/,socarxiv,preprint-providers,https://api.osf.io/v2/preprints/gybqw/files/,https://api.osf.io/v2/files/5b6496b04539170010c4542c/,5b6496b04539170010c4542c,files,https://api.osf.io/v2/preprints/gybqw/review_actions/,https://api.osf.io/v2/preprints/gybqw/requests/,https://api.osf.io/v2/preprints/gybqw/,https://osf.io/preprints/socarxiv/gybqw/,NA,https://doi.org/10.31235/osf.io/gybqw
xzqbe,preprints,2018-08-03T09:40:04.040591,2018-08-03T10:47:25.145235,2018-08-03T10:46:43.712705,NA,NA,"Patrilocal, Matrilocal or Neolocal? Intergenerational Proximity of Married Couples in China","Objective: The study describes current patterns of intergenerational proximity in
China, and analyzes the structural conditions that are associated with couples' proximity to the husband's and the wife's parents.
Background: Patrilocality is a core aspect of the traditional Chinese kinship system,
and is deeply rooted in Confucian beliefs. In recent decades, however, this custom has been challenged by internal migration as well changes in family values and preferences.
Method: We model the effect of each spouse's household registration (hukou) origin, education level, and sibling structure on intergenerational proximity, using a nationally representative sample of 4,256 couples derived from the 2010 China Family Panel Studies.
Results: Almost 75% of married Chinese couples live with or in close proximity to
the husband's parents. There is, however, a strong social gradient in intergenerational proximity, and patrilocality is particularly pronounced among rural-origin and less educated couples. Matrilocal residence remains unusual, although it is more likely when the wife has no brothers.
Conclusion: The custom of patrilocal residence demonstrates a remarkable resilience, even as other patriarchal traditions have crumbled in the face of China's 'Great Transformation'.
Implications: We provide explanations for the persistence of patrilocality and discuss implications for intergenerational support, gender inequality and son preference.",TRUE,FALSE,China|China Family Panel Studies|Coresidence|Gender|Intergenerational Relations|Matrilocality|Patrilocality|Proximity,2018-08-03T10:47:25.126345,NA,,TRUE,accepted,2018-08-03T10:46:43.712705,NA,NA,NA,NA,NA,NA,NA,NA,NA,5a8c80f7c698300375c76d84|5a8c80fac698300375c76e20|5a8c80fac698300375c76e4c|Social and Behavioral Sciences|Sociology|Family,,2018,https://api.osf.io/v2/preprints/xzqbe/contributors/,https://api.osf.io/v2/preprints/xzqbe/bibliographic_contributors/,https://api.osf.io/v2/preprints/xzqbe/citation/,xzqbe,preprints,https://api.osf.io/v2/preprints/xzqbe/identifiers/,https://api.osf.io/v2/nodes/d2gms/,https://api.osf.io/v2/preprints/xzqbe/relationships/node/,d2gms,nodes,https://api.osf.io/v2/licenses/563c1cf88c5e4a3877f9e96a/,563c1cf88c5e4a3877f9e96a,licenses,https://api.osf.io/v2/providers/preprints/socarxiv/,socarxiv,preprint-providers,https://api.osf.io/v2/preprints/xzqbe/files/,https://api.osf.io/v2/files/5b6422f3aeba2d001014e23f/,5b6422f3aeba2d001014e23f,files,https://api.osf.io/v2/preprints/xzqbe/review_actions/,https://api.osf.io/v2/preprints/xzqbe/requests/,https://api.osf.io/v2/preprints/xzqbe/,https://osf.io/preprints/socarxiv/xzqbe/,NA,https://doi.org/10.31235/osf.io/xzqbe
tgra8,preprints,2018-08-03T07:41:54.691067,2018-08-03T10:57:05.541968,2018-08-03T10:56:52.241829,NA,NA,"Deploying, Updating and Running Electric Vehicles Charging Facilities in the US","The electric vehicles, or may be called plug-in cars, are continuing to make waves across the modern vehicle industry. So far electric vehicles can be distorted by pure and hybrid, which are usually called Plug-in Electric Vehicles and Plug-in Hybrid Electric Vehicles. (James Larminie, 2012) The electric vehicles have contribution to protect environment through reducing carbon emission and pollution by improving the using efficiency of fuel and electricity, and indirect use of pollution-free energy, like wind energy, waterpower and nuclear. 

Electric vehicles need electricity as fuel, so the charging facilities are becoming an important infrastructure. Up to now, the US has about 120,000 gas stations while charging stations are only 10,000. Unfortunately, most of them are slow charging piles, like Level 1 or 2. (James Larminie, 2012) So sufficient charging facilities, especially Level 3 piles, should be deployed in order to meet the increasing of electric vehicles quantity. However, we have to consider about many following problems. This paper introduced some simple technical details of batteries and all levels of stations, and discussed about where and how to deploy, cost and benefit, safety issues and other challenges, and gave a prediction of what the future tendency will be.",TRUE,FALSE,charge|electric vehicle|plug-in|vehicle,2018-08-03T10:57:05.523761,NA,,TRUE,accepted,2018-08-03T10:56:52.241829,NA,NA,NA,NA,NA,NA,NA,NA,NA,5a8c80f7c698300375c76d84|5a8c80f9c698300375c76df4|Social and Behavioral Sciences|Science and Technology Studies,,2018,https://api.osf.io/v2/preprints/tgra8/contributors/,https://api.osf.io/v2/preprints/tgra8/bibliographic_contributors/,https://api.osf.io/v2/preprints/tgra8/citation/,tgra8,preprints,https://api.osf.io/v2/preprints/tgra8/identifiers/,https://api.osf.io/v2/nodes/ykmsf/,https://api.osf.io/v2/preprints/tgra8/relationships/node/,ykmsf,nodes,https://api.osf.io/v2/licenses/563c1cf88c5e4a3877f9e96a/,563c1cf88c5e4a3877f9e96a,licenses,https://api.osf.io/v2/providers/preprints/socarxiv/,socarxiv,preprint-providers,https://api.osf.io/v2/preprints/tgra8/files/,https://api.osf.io/v2/files/5b640742aeba2d001214b10b/,5b640742aeba2d001214b10b,files,https://api.osf.io/v2/preprints/tgra8/review_actions/,https://api.osf.io/v2/preprints/tgra8/requests/,https://api.osf.io/v2/preprints/tgra8/,https://osf.io/preprints/socarxiv/tgra8/,NA,https://doi.org/10.31235/osf.io/tgra8
6zqsd,preprints,2018-08-03T03:16:19.240148,2018-08-03T10:46:02.238666,2018-08-03T10:45:30.792985,NA,NA,Gender/Professional Identity Integration Promotes Women’s Negotiation Performance via Reduced Social Backlash Concerns,"In the context of competitive negotiations, a stereotypically masculine task, state gender-profession identity integration was expected to facilitate women’s performance. Across three studies examining women’s first offers in competitive negotiations we found evidence supporting this proposition. Furthermore, a factor previously identified associated with gender differences in negotiation performance- reduced social backlash concerns- was identified as the mediating factor for enhancing the performance of high state identity integration women. We discuss the implications of these findings for ongoing research and theory on gender, identity, and negotiations.",TRUE,FALSE,gender|identity|negotiations,2018-08-03T10:46:02.209846,NA,,TRUE,accepted,2018-08-03T10:45:30.792985,NA,NA,NA,NA,NA,NA,NA,NA,NA,5a8c80f7c698300375c76d84|5a8c80f7c698300375c76d98|5a8c80f8c698300375c76da6|Social and Behavioral Sciences|Psychology|Industrial and Organizational Psychology,shira Mor,2018,https://api.osf.io/v2/preprints/6zqsd/contributors/,https://api.osf.io/v2/preprints/6zqsd/bibliographic_contributors/,https://api.osf.io/v2/preprints/6zqsd/citation/,6zqsd,preprints,https://api.osf.io/v2/preprints/6zqsd/identifiers/,https://api.osf.io/v2/nodes/3czhk/,https://api.osf.io/v2/preprints/6zqsd/relationships/node/,3czhk,nodes,https://api.osf.io/v2/licenses/563c1cf88c5e4a3877f9e965/,563c1cf88c5e4a3877f9e965,licenses,https://api.osf.io/v2/providers/preprints/socarxiv/,socarxiv,preprint-providers,https://api.osf.io/v2/preprints/6zqsd/files/,https://api.osf.io/v2/files/5b63c902aeba2d00121488ce/,5b63c902aeba2d00121488ce,files,https://api.osf.io/v2/preprints/6zqsd/review_actions/,https://api.osf.io/v2/preprints/6zqsd/requests/,https://api.osf.io/v2/preprints/6zqsd/,https://osf.io/preprints/socarxiv/6zqsd/,NA,https://doi.org/10.31235/osf.io/6zqsd
93mdj,preprints,2018-08-02T22:35:13.965103,2018-08-03T10:44:40.929866,2018-08-03T10:44:15.326745,2016-12-20T05:00:00,10.22148/16.011,Fictionality,"The distinction between fiction and non-fiction, between a text that is true and one that is not, is one of the oldest on record. Ever since we have been thinking about the act of narration, we have addressed the related meanings of truth and imagination. This is what Aristotle designated as the difference between the communicative use of language (legein) and its creative use (poiein). For millennia, we have been debating whether there are inherent features of being fictional or whether it is simply a matter of intention, that perhaps there is nothing unique to the language of fictional discourse after all. How do we know when a text is signalling that it is ""true"" or, by extension, not true? And what might quantity have to tell us about this most elementary of distinctions?",TRUE,FALSE,,2018-08-03T10:44:40.901057,NA,,TRUE,accepted,2018-08-03T10:44:15.326745,NA,NA,NA,NA,NA,NA,NA,NA,NA,5a8c80f2c698300375c76c7d|5a8c80f4c698300375c76ccb|Arts and Humanities|Digital Humanities,,2018,https://api.osf.io/v2/preprints/93mdj/contributors/,https://api.osf.io/v2/preprints/93mdj/bibliographic_contributors/,https://api.osf.io/v2/preprints/93mdj/citation/,93mdj,preprints,https://api.osf.io/v2/preprints/93mdj/identifiers/,https://api.osf.io/v2/nodes/7t3uz/,https://api.osf.io/v2/preprints/93mdj/relationships/node/,7t3uz,nodes,https://api.osf.io/v2/licenses/563c1cf88c5e4a3877f9e96a/,563c1cf88c5e4a3877f9e96a,licenses,https://api.osf.io/v2/providers/preprints/socarxiv/,socarxiv,preprint-providers,https://api.osf.io/v2/preprints/93mdj/files/,https://api.osf.io/v2/files/5b6387214297ff000eecab50/,5b6387214297ff000eecab50,files,https://api.osf.io/v2/preprints/93mdj/review_actions/,https://api.osf.io/v2/preprints/93mdj/requests/,https://api.osf.io/v2/preprints/93mdj/,https://osf.io/preprints/socarxiv/93mdj/,https://doi.org/10.22148/16.011,https://doi.org/10.31235/osf.io/93mdj
ysx5d,preprints,2018-08-02T13:34:37.000962,2018-08-02T21:22:21.346692,2018-08-02T21:21:57.066636,NA,NA,Engage Me: How YouTube Motor Vloggers Can Maximise User Engagement,"Without a true understanding of how users engage with content on social media, it can be difficult to understand its value, impact, and how to exploit it to one’s advantage. How a user engages can be divided up into many sub sections, but in its simplest notion it’s how a person interacts with the content that is presented to them. Engagement is also a sing that a person has payed attention to what is being presented to them.
YouTube was created by former PayPal employees Steve Chen, Jawed Karim and Chad Hurley in 2005, and today with 1 billion monthly active users, it is the most used social networking and video sharing platform on the internet. YouTube also has a powerful effect in that it enables people to spread content effortlessly and freely to a wide and open audience. Understanding the incredible power of YouTube can be highlighted by examples such as Justin Bieber who rocketed to international stardom and fame via the platform, or how the world stopped and focused on Kony in 2012. Much of this success and popularity of the website has been explained by the fact that users are able to communicate “through textual and video responses as well as video rating systems” (Milliken, Gibson, O’Donnell &amp; Singer 2008).
This research paper serves to make important contributions to topics of viral marketing and engagement behaviours of users on YouTube. This is important when considering the popularity of YouTube and the numbers of users actively engaging in content, especially for business and individuals who use YouTube as their source of income. Research on various microblogging platforms has revealed “that microblogs can be tailored to facilitate informal communication between colleagues in organizations”, (Suh, Hong, Pirolli, &amp; Chi, 2010) but there is little research that explores video blogging communities on YouTube. This research paper will explore how tags and the length of videos impact user engagement in the Motor Vlogging community.
In section 2, a general overview of related in relevant research is presented, followed by the research question and hypothesis in section 3 which explores the relationship between social engagement on YouTube Motor Vlogger videos from Australia and how the presence of tags and the length of the videos impact on the levels of engagement. The methodology of the research is presented in section 4 with results presented and discussed in sections 5 and 6 respectively.",TRUE,FALSE,,2018-08-02T21:22:21.328963,NA,,TRUE,accepted,2018-08-02T21:21:57.066636,NA,NA,NA,NA,NA,NA,NA,NA,NA,5a8c80f7c698300375c76d84|5a8c80f9c698300375c76e0d|5a8c80f9c698300375c76e0f|Social and Behavioral Sciences|Communication|Communication Technology and New Media,,2018,https://api.osf.io/v2/preprints/ysx5d/contributors/,https://api.osf.io/v2/preprints/ysx5d/bibliographic_contributors/,https://api.osf.io/v2/preprints/ysx5d/citation/,ysx5d,preprints,https://api.osf.io/v2/preprints/ysx5d/identifiers/,https://api.osf.io/v2/nodes/jhe5p/,https://api.osf.io/v2/preprints/ysx5d/relationships/node/,jhe5p,nodes,https://api.osf.io/v2/licenses/563c1cf88c5e4a3877f9e96a/,563c1cf88c5e4a3877f9e96a,licenses,https://api.osf.io/v2/providers/preprints/socarxiv/,socarxiv,preprint-providers,https://api.osf.io/v2/preprints/ysx5d/files/,https://api.osf.io/v2/files/5b63086cdedf030013c14031/,5b63086cdedf030013c14031,files,https://api.osf.io/v2/preprints/ysx5d/review_actions/,https://api.osf.io/v2/preprints/ysx5d/requests/,https://api.osf.io/v2/preprints/ysx5d/,https://osf.io/preprints/socarxiv/ysx5d/,NA,https://doi.org/10.31235/osf.io/ysx5d
uz2h6,preprints,2018-08-02T11:13:43.865163,2018-08-02T21:20:25.723469,2018-08-02T21:19:53.808310,NA,NA,Women in Science: Surpassing Subtle and Overt Biases through Intervention Programs,"This study discusses factors that keep women from entering science and technology, which include social stereotypes that they struggle against, lack of maternity leave and other basic human rights, and the climate that makes them leave research positions for administrative ones. We then describe intervention processes that have been successful in bringing the ratio of women close to parity, compare different minorities in the US, and also consider data from India, Western and Eastern Europe. We conjecture that programs that connect the different levels of education are needed in addition to hiring more women, providing them with basic human rights from when they begin their PhD onwards and promoting support networks for existing employees. 
 The authors of this paper hail from Sri Lanka, Romania, India, and the United States. We hold undergraduate and graduate degrees in physics or chemistry from the United States, India and Switzerland. Our conclusions are based on data that is publicly available, on data we have gathered, and on anecdotal evidence from our own experience.",TRUE,FALSE,women in science and technology,2018-08-02T21:20:25.704879,NA,,TRUE,accepted,2018-08-02T21:19:53.808310,NA,NA,NA,NA,NA,NA,NA,NA,NA,"5a8c80f7c698300375c76d84|5a8c80fac698300375c76e20|5a8c80fac698300375c76e34|Social and Behavioral Sciences|Sociology|Communication, Information Technologies, and Media Sociology|5a8c80f7c698300375c76d84|5a8c80fac698300375c76e20|5a8c80fac698300375c76e39|Social and Behavioral Sciences|Sociology|Collective Behavior and Social Movements|5a8c80f7c698300375c76d84|5a8c80fac698300375c76e20|5a8c80fac698300375c76e40|Social and Behavioral Sciences|Sociology|Science, Knowledge, and Technology",,2018,https://api.osf.io/v2/preprints/uz2h6/contributors/,https://api.osf.io/v2/preprints/uz2h6/bibliographic_contributors/,https://api.osf.io/v2/preprints/uz2h6/citation/,uz2h6,preprints,https://api.osf.io/v2/preprints/uz2h6/identifiers/,https://api.osf.io/v2/nodes/r6zv7/,https://api.osf.io/v2/preprints/uz2h6/relationships/node/,r6zv7,nodes,https://api.osf.io/v2/licenses/563c1cf88c5e4a3877f9e96a/,563c1cf88c5e4a3877f9e96a,licenses,https://api.osf.io/v2/providers/preprints/socarxiv/,socarxiv,preprint-providers,https://api.osf.io/v2/preprints/uz2h6/files/,https://api.osf.io/v2/files/5b62e767af7ffc000e5c52c2/,5b62e767af7ffc000e5c52c2,files,https://api.osf.io/v2/preprints/uz2h6/review_actions/,https://api.osf.io/v2/preprints/uz2h6/requests/,https://api.osf.io/v2/preprints/uz2h6/,https://osf.io/preprints/socarxiv/uz2h6/,NA,https://doi.org/10.31235/osf.io/uz2h6
4svrx,preprints,2018-08-02T08:59:02.814841,2018-08-02T13:43:41.067694,2018-08-02T13:42:09.241703,2018-08-01T23:00:00,NA,"Party Identification, the Policy Space, and Business Donations to Political Parties","Political finance scholars have paid little attention to the partisan preferences of business donors.  This was because business donors were overwhelmingly concerned with the left-right dimension and enjoyed stable relationships with centre-right parties.  These parties are increasingly tempted by nationalist positions on a globalisation dimension.  This new ideological flux provides an opportunity to measure the extent to which donors are party identifiers or react to changes in the policy space. Dramatic shifts in party policy on both dimensions and a relatively transparent political finance regime make the UK a particularly apposite case to study this question. I analyse 19,000 donations to the Conservative Party and show that business donors reacted strongly to recent shifts on both the left-right and globalisation dimensions.  Thus, centre-right parties cannot rely on party identification and their left-right position to maintain business funding.  Economic nationalism costs centre-right parties money.",TRUE,FALSE,Brexit|business and politics|Conservative Party|policy space|political finance|political parties,2018-08-02T13:43:41.049155,NA,,TRUE,accepted,2018-08-02T13:42:09.241703,NA,NA,NA,NA,NA,NA,NA,NA,NA,5a8c80f7c698300375c76d84|5a8c80f8c698300375c76daf|5a8c80f8c698300375c76db2|Social and Behavioral Sciences|Political Science|Comparative Politics,None,2018,https://api.osf.io/v2/preprints/4svrx/contributors/,https://api.osf.io/v2/preprints/4svrx/bibliographic_contributors/,https://api.osf.io/v2/preprints/4svrx/citation/,4svrx,preprints,https://api.osf.io/v2/preprints/4svrx/identifiers/,https://api.osf.io/v2/nodes/r8ecz/,https://api.osf.io/v2/preprints/4svrx/relationships/node/,r8ecz,nodes,https://api.osf.io/v2/licenses/563c1cf88c5e4a3877f9e965/,563c1cf88c5e4a3877f9e965,licenses,https://api.osf.io/v2/providers/preprints/socarxiv/,socarxiv,preprint-providers,https://api.osf.io/v2/preprints/4svrx/files/,https://api.osf.io/v2/files/5b62c7d5dedf030012c106ae/,5b62c7d5dedf030012c106ae,files,https://api.osf.io/v2/preprints/4svrx/review_actions/,https://api.osf.io/v2/preprints/4svrx/requests/,https://api.osf.io/v2/preprints/4svrx/,https://osf.io/preprints/socarxiv/4svrx/,NA,https://doi.org/10.31235/osf.io/4svrx
