id,type,attributes.date_created,attributes.date_modified,attributes.date_published,attributes.original_publication_date,attributes.doi,attributes.title,attributes.description,attributes.is_published,attributes.is_preprint_orphan,attributes.tags,attributes.preprint_doi_created,attributes.date_withdrawn,attributes.current_user_permissions,attributes.public,attributes.reviews_state,attributes.date_last_transitioned,attributes.has_coi,attributes.conflict_of_interest_statement,attributes.has_data_links,attributes.why_no_data,attributes.data_links,attributes.has_prereg_links,attributes.why_no_prereg,attributes.prereg_links,attributes.prereg_link_info,attributes.subjects,attributes.license_record.copyright_holders,attributes.license_record.year,relationships.contributors.links.related.href,relationships.bibliographic_contributors.links.related.href,relationships.citation.links.related.href,relationships.citation.data.id,relationships.citation.data.type,relationships.identifiers.links.related.href,relationships.node.links.self.href,relationships.license.links.related.href,relationships.license.data.id,relationships.license.data.type,relationships.provider.links.related.href,relationships.provider.data.id,relationships.provider.data.type,relationships.files.links.related.href,relationships.primary_file.links.related.href,relationships.primary_file.data.id,relationships.primary_file.data.type,relationships.review_actions.links.related.href,relationships.requests.links.related.href,links.self,links.html,links.preprint_doi,links.doi
ga5w7,preprints,2019-01-02T19:54:42.943621,2019-01-03T19:41:12.849176,2019-01-03T19:30:44.525521,NA,NA,"The Emergence of Systemic Risk: Federal Reserve, Bailouts, and Monetary Government at the Limits","Why does the Federal Reserve govern finance in violation of a core principle of political liberalism, private risk–private loss? To solve this puzzle, this paper examines the emergence of systemic risk and its management by the Fed since 1951. Using Fed publications, interviews with officials, and transcripts of congressional hearings, it argues that systemic risk is a pathology of the monetary government of the economy. As such, systemic risk is at once the effect of the overflow of the financial architecture through which the Fed governs and a discursive object that purifies not only this overflow but also the breaches the Fed’s emergency management strategies cause in the state-economy boundary. By turning regulatory capture theory on its head, the paper shows that the Fed put itself in such a politico-economically precarious position in managing financial emergencies because it is captured not by financial interests, but by systemic risk.",TRUE,FALSE,,2019-01-03T19:41:12.824756,NA,,TRUE,accepted,2019-01-03T19:30:44.525521,NA,NA,NA,NA,NA,NA,NA,NA,NA,"5a8c80f7c698300375c76d84|5a8c80fac698300375c76e20|5a8c80fac698300375c76e2d|Social and Behavioral Sciences|Sociology|Economic Sociology|5a8c80f7c698300375c76d84|5a8c80fac698300375c76e20|5a8c80fac698300375c76e40|Social and Behavioral Sciences|Sociology|Science, Knowledge, and Technology|5a8c80f7c698300375c76d84|5a8c80fac698300375c76e20|5a8c80fac698300375c76e43|Social and Behavioral Sciences|Sociology|Comparative and Historical Sociology",Onur Ozgode,2019,https://api.osf.io/v2/preprints/ga5w7/contributors/,https://api.osf.io/v2/preprints/ga5w7/bibliographic_contributors/,https://api.osf.io/v2/preprints/ga5w7/citation/,ga5w7,preprints,https://api.osf.io/v2/preprints/ga5w7/identifiers/,https://api.osf.io/v2/preprints/ga5w7/relationships/node/,https://api.osf.io/v2/licenses/563c1cf88c5e4a3877f9e965/,563c1cf88c5e4a3877f9e965,licenses,https://api.osf.io/v2/providers/preprints/socarxiv/,socarxiv,preprint-providers,https://api.osf.io/v2/preprints/ga5w7/files/,https://api.osf.io/v2/files/5c2d170aa7c0a70018412631/,5c2d170aa7c0a70018412631,files,https://api.osf.io/v2/preprints/ga5w7/review_actions/,https://api.osf.io/v2/preprints/ga5w7/requests/,https://api.osf.io/v2/preprints/ga5w7/,https://osf.io/preprints/socarxiv/ga5w7/,https://doi.org/10.31235/osf.io/ga5w7,NA
5b6w9,preprints,2019-01-02T19:13:39.136575,2020-05-11T19:26:23.356202,2019-01-03T19:29:15.464927,NA,NA,"Exploring the Similarities and Differences in Offender Characteristics Across Aspiring, Probable, and Successful Serial Homicide Offenders: The Importance of an Inclusive Approach to the Study of Homicide","The current study examines potential serial homicide offenders (SHOs), a previously unacknowledged offender group comprised of aspiring and probable SHOs, and compares them to successful SHOs. Data on 17 aspiring, 46 probable, and 16 successful SHOs were collected. The study results indicate that potential serial killers share more in common with successful SHOs than they do with one-off homicide offenders. While there is overlap among these groups, there is insufficient evidence to suggest discreet transitions among categories or that being a potential SHO is the final step on a pathway towards becoming a successful SHO. Potential SHOs cannot reliably be thought of as prospective SHOs if all things were equal. An as yet identified factor, such as resiliency, still separates potential SHOs from successful SHOs. Early identification and timely intervention is important to interrupt impending murders by potential SHOs and halt them at this pivotal point in their developmental trajectory.",TRUE,FALSE,crime prevention|criminal victimization|critical criminology|sex crimes|violent behavior,2019-01-03T19:40:49.025847,NA,,TRUE,accepted,2019-01-03T19:29:15.464927,FALSE,NA,NA,NA,NA,NA,NA,NA,NA,5a8c80f0c698300375c76c07|5a8c80f1c698300375c76c2f|Law|Law Enforcement and Corrections|5a8c80f7c698300375c76d84|Social and Behavioral Sciences,,2019,https://api.osf.io/v2/preprints/5b6w9/contributors/,https://api.osf.io/v2/preprints/5b6w9/bibliographic_contributors/,https://api.osf.io/v2/preprints/5b6w9/citation/,5b6w9,preprints,https://api.osf.io/v2/preprints/5b6w9/identifiers/,https://api.osf.io/v2/preprints/5b6w9/relationships/node/,https://api.osf.io/v2/licenses/563c1cf88c5e4a3877f9e96c/,563c1cf88c5e4a3877f9e96c,licenses,https://api.osf.io/v2/providers/preprints/socarxiv/,socarxiv,preprint-providers,https://api.osf.io/v2/preprints/5b6w9/files/,https://api.osf.io/v2/files/5c2d0d67a7c0a70018411c3b/,5c2d0d67a7c0a70018411c3b,files,https://api.osf.io/v2/preprints/5b6w9/review_actions/,https://api.osf.io/v2/preprints/5b6w9/requests/,https://api.osf.io/v2/preprints/5b6w9/,https://osf.io/preprints/socarxiv/5b6w9/,https://doi.org/10.31235/osf.io/5b6w9,NA
kxe9j,preprints,2019-01-02T04:07:38.115290,2019-01-03T19:39:22.470854,2019-01-03T19:33:56.035751,NA,10.24093/awej/vol9no4.4,Difficulties in Teaching English Modal Auxiliaries to Turkish Students:  A Cognitive Pragmatic Approach,"Recently, attention in modern linguistic theory has been shifted to facilitating a broader understanding of the world, in which language is a tool to establish a bridge between the interlocutor and the recipient. To do so, the development of linguistic, communicative and socio-pragmatic competences enriched with socio-cultural inputs in English as a Foreign Language (EFL) or Second Language (L2) teaching and learning contexts have a significant impact on language learners both to develop their perception as native speakers of English and to facilitate the progress of cognitive skills and capabilities. The aim of this paper is to demonstrate a case study to show some of the difficulties in teaching English modal auxiliaries to Turkish students in EFL/L2 contexts which arise not only from structural characteristics, but also from insufficiently developed linguistic, communicative and socio-pragmatic competencies. It is also asserted that only teaching the lexical properties of modal auxiliaries in isolation from their socio-pragmatic and semiotic contexts alone cannot help learners to become successful communicators in the target language as it ends in communication failures, hesitation, a slower L2 progress, fear and misunderstandings. Therefore, role-play activities, cloze tests, research assignments, writing tasks and songs can also be integrated into the teaching-learning process to assist learners to become more aware of their actual authentic usages in a wide range of contexts through different activities. On the whole, this would also free language learners to refer to their First Language (L1) input and shape a broader understanding of the Foreign Language (FL) framed with its actual authentic usage.",TRUE,FALSE,cognitive linguistics|competence|curriculum|language learning-teaching|modal auxiliaries,2019-01-03T19:39:22.448815,NA,,TRUE,accepted,2019-01-03T19:33:56.035751,NA,NA,NA,NA,NA,NA,NA,NA,NA,5a8c80f2c698300375c76c7d|5a8c80f5c698300375c76d10|Arts and Humanities|English Language and Literature,,2019,https://api.osf.io/v2/preprints/kxe9j/contributors/,https://api.osf.io/v2/preprints/kxe9j/bibliographic_contributors/,https://api.osf.io/v2/preprints/kxe9j/citation/,kxe9j,preprints,https://api.osf.io/v2/preprints/kxe9j/identifiers/,https://api.osf.io/v2/preprints/kxe9j/relationships/node/,https://api.osf.io/v2/licenses/563c1cf88c5e4a3877f9e96a/,563c1cf88c5e4a3877f9e96a,licenses,https://api.osf.io/v2/providers/preprints/socarxiv/,socarxiv,preprint-providers,https://api.osf.io/v2/preprints/kxe9j/files/,https://api.osf.io/v2/files/5c2c390ea7c0a7001b3cdafd/,5c2c390ea7c0a7001b3cdafd,files,https://api.osf.io/v2/preprints/kxe9j/review_actions/,https://api.osf.io/v2/preprints/kxe9j/requests/,https://api.osf.io/v2/preprints/kxe9j/,https://osf.io/preprints/socarxiv/kxe9j/,https://doi.org/10.31235/osf.io/kxe9j,https://doi.org/10.24093/awej/vol9no4.4
j4vr9,preprints,2019-01-02T03:43:40.181344,2019-01-05T04:55:21.502382,2019-01-05T04:55:12.130956,NA,10.24093/awej/vol9no4.7,WhatsApp: An Online Platform for University-Level English Language Education,"Technology has developed immensely and its role in the aspects of learning a language has grown bigger and bigger.  Among the university level students, WhatsApp at present is  getting into the frontline as one of the most widespread online social networking platforms concerning  to language learning. The research work undertaken tries to understand if university level students consider WhatsApp as a significant learning platform that can develop and support their language learning skills.  Moreover, , the research work focuses   on the routine practices or use of WhatsApp by students. The outcome of the survey data reveals that students consider that WhatsApp may be utilized as a teaching cum learning online platform to assist them in the process of language learning. They also highlighted the necessity of imitating language courses associated with WhatsApp, integration of technology through WhatsApp for the access of class materials with a set of objectives and outcomes explicitly focused on learning language to create meaningful experiences for students. Pedagogically, the study concludes by emphasizing the efficacy and prospective role of WhatsApp in improving the capability of students with regard to learning a language at university level.",TRUE,FALSE,e-learning|English language learning|survey study|use of technology|WhatsApp,2019-01-05T04:55:21.485722,NA,,TRUE,accepted,2019-01-05T04:55:12.130956,NA,NA,NA,NA,NA,NA,NA,NA,NA,5a8c80f2c698300375c76c7d|5a8c80f5c698300375c76d10|Arts and Humanities|English Language and Literature,,2019,https://api.osf.io/v2/preprints/j4vr9/contributors/,https://api.osf.io/v2/preprints/j4vr9/bibliographic_contributors/,https://api.osf.io/v2/preprints/j4vr9/citation/,j4vr9,preprints,https://api.osf.io/v2/preprints/j4vr9/identifiers/,https://api.osf.io/v2/preprints/j4vr9/relationships/node/,https://api.osf.io/v2/licenses/563c1cf88c5e4a3877f9e96a/,563c1cf88c5e4a3877f9e96a,licenses,https://api.osf.io/v2/providers/preprints/socarxiv/,socarxiv,preprint-providers,https://api.osf.io/v2/preprints/j4vr9/files/,https://api.osf.io/v2/files/5c2c336f0e8efd0019cdf98c/,5c2c336f0e8efd0019cdf98c,files,https://api.osf.io/v2/preprints/j4vr9/review_actions/,https://api.osf.io/v2/preprints/j4vr9/requests/,https://api.osf.io/v2/preprints/j4vr9/,https://osf.io/preprints/socarxiv/j4vr9/,https://doi.org/10.31235/osf.io/j4vr9,https://doi.org/10.24093/awej/vol9no4.7
8p4qy,preprints,2019-01-02T03:35:58.055657,2019-01-05T04:55:01.264909,2019-01-05T04:54:49.227176,NA,10.24093/awej/vol9no4.34,Peculiarities of Ethnic Stereotypes Usage in English Political Discourse,"This paper aims to highlight ethnic stereotyping in the English-language mass media political discourse, which is an actual issue since the scope of media texts in English prevails in the global information space, which cannot but affect the viewpoint of an ""average"" English speaking reader. According to the cognitive linguistic approach, the stereotype is considered to be an element of the cultural and linguistic world view and an integral part of reality categorization mechanism. Ethnic stereotypes are very important in the process of intercultural communication since they can increase its effectiveness and eliminate interethnic problems or they can act vice versa. So auto- and hetero-stereotypes play a significant role in intercultural communication. This fact underlines the relevance of ethnic stereotype studies. The notions of ""auto- stereotype” and “hetero-stereotype"" are considered in the article, using the examples of English-language political media text headlines. Special attention is given to the headlines of English-language media texts about Russia. Basic features of the stereotype ""modern Russia"", formed by the English-language media, are defined by the analyzed political media text material.",TRUE,FALSE,auto- stereotype|cultural and linguistic world-view|ethnic stereotype|hetero-stereotype|political discourse,2019-01-05T04:55:01.244956,NA,,TRUE,accepted,2019-01-05T04:54:49.227176,NA,NA,NA,NA,NA,NA,NA,NA,NA,5a8c80f2c698300375c76c7d|5a8c80f5c698300375c76d10|Arts and Humanities|English Language and Literature,,2019,https://api.osf.io/v2/preprints/8p4qy/contributors/,https://api.osf.io/v2/preprints/8p4qy/bibliographic_contributors/,https://api.osf.io/v2/preprints/8p4qy/citation/,8p4qy,preprints,https://api.osf.io/v2/preprints/8p4qy/identifiers/,https://api.osf.io/v2/preprints/8p4qy/relationships/node/,https://api.osf.io/v2/licenses/563c1cf88c5e4a3877f9e96a/,563c1cf88c5e4a3877f9e96a,licenses,https://api.osf.io/v2/providers/preprints/socarxiv/,socarxiv,preprint-providers,https://api.osf.io/v2/preprints/8p4qy/files/,https://api.osf.io/v2/files/5c2c31a3a7c0a70018404880/,5c2c31a3a7c0a70018404880,files,https://api.osf.io/v2/preprints/8p4qy/review_actions/,https://api.osf.io/v2/preprints/8p4qy/requests/,https://api.osf.io/v2/preprints/8p4qy/,https://osf.io/preprints/socarxiv/8p4qy/,https://doi.org/10.31235/osf.io/8p4qy,https://doi.org/10.24093/awej/vol9no4.34
bwxcy,preprints,2019-01-02T03:31:38.166045,2019-01-05T04:54:21.977588,2019-01-05T04:54:08.884421,NA,10.24093/awej/vol9no4.33,An Analysis of the Use of English with Political Correctness: A Case Study of Graduate Students in Thailand,"This study aims to examine the use of English with political correctness of master’s degree students in a university in Bangkok, Thailand and to identify their attitudes and opinions towards the use of English with political correctness. The subjects of this study were 100 students from different backgrounds who had been exposed to the English language for a significant period of time. They were asked to complete a questionnaire consisting of a test on the use of politically correct English vocabularies and terms, and a survey of their opinions and attitudes towards the use of English with political correctness. Five of the respondents were interviewed about their attitudes. The findings reveal that students are able to identify certain politically correct words and terms regardless of the categories. Respondents also have positive attitudes and they consider this type of language as a formal and respectful language. They also suggest that this type of language is important and it should be implemented in workplaces and certain fields. However, there are few limitations of English with political correctness as it is considered unclear and sometimes it is overused. Moreover, there is no institution or academic initiative to standardize the use of English with political correctness. The findings could be useful to develop the use of English with political correctness in society, to objectify politically correct language, and to promote the importance of politically correct language, which is viewed as formal and respectful language that can reduce conflicts in international communications.",TRUE,FALSE,inclusive language|political correctness|racism|sexism,2019-01-05T04:54:21.961797,NA,,TRUE,accepted,2019-01-05T04:54:08.884421,NA,NA,NA,NA,NA,NA,NA,NA,NA,5a8c80f2c698300375c76c7d|5a8c80f5c698300375c76d10|Arts and Humanities|English Language and Literature,,2019,https://api.osf.io/v2/preprints/bwxcy/contributors/,https://api.osf.io/v2/preprints/bwxcy/bibliographic_contributors/,https://api.osf.io/v2/preprints/bwxcy/citation/,bwxcy,preprints,https://api.osf.io/v2/preprints/bwxcy/identifiers/,https://api.osf.io/v2/preprints/bwxcy/relationships/node/,https://api.osf.io/v2/licenses/563c1cf88c5e4a3877f9e96a/,563c1cf88c5e4a3877f9e96a,licenses,https://api.osf.io/v2/providers/preprints/socarxiv/,socarxiv,preprint-providers,https://api.osf.io/v2/preprints/bwxcy/files/,https://api.osf.io/v2/files/5c2c309e0e8efd0016cd5811/,5c2c309e0e8efd0016cd5811,files,https://api.osf.io/v2/preprints/bwxcy/review_actions/,https://api.osf.io/v2/preprints/bwxcy/requests/,https://api.osf.io/v2/preprints/bwxcy/,https://osf.io/preprints/socarxiv/bwxcy/,https://doi.org/10.31235/osf.io/bwxcy,https://doi.org/10.24093/awej/vol9no4.33
r6j2e,preprints,2019-01-02T03:27:28.259749,2019-01-05T04:54:25.901300,2019-01-05T04:53:50.739532,NA,10.24093/awej/vol9no4.32,Foreign Language Learners’ Attitudes and Perceptions of L1 Use in L2 Classroom,"Whether to avoid learners’ first language (L1) or to make use of it in the second language (L2) classes is a controversial issue. Some studies have challenged the effectiveness of the monolingual approach to foreign language learning. This study investigates Saudi university learners’ attitudes and perceptions towards incorporating their L1(Arabic) in English class. This study also sheds light into the relationship between students’ perceptions and proficiency level in the target language. To this end, Gaebler's questionnaire (2014) was administered to 60 female learners studying in the preparatory year at a Saudi university. They were from three different English proficiency levels. The results showed that advanced learners hold a negative attitude towards the use of L1 in their English classes, whereas elementary and intermediate learners generally perceive the judicious use of their L1 positively.",TRUE,FALSE,L1 use|learners’ attitudes|Learning foreign language|monolingual approach|role of L1,2019-01-05T04:54:25.884663,NA,,TRUE,accepted,2019-01-05T04:53:50.739532,NA,NA,NA,NA,NA,NA,NA,NA,NA,5a8c80f2c698300375c76c7d|5a8c80f5c698300375c76d10|Arts and Humanities|English Language and Literature,,2019,https://api.osf.io/v2/preprints/r6j2e/contributors/,https://api.osf.io/v2/preprints/r6j2e/bibliographic_contributors/,https://api.osf.io/v2/preprints/r6j2e/citation/,r6j2e,preprints,https://api.osf.io/v2/preprints/r6j2e/identifiers/,https://api.osf.io/v2/preprints/r6j2e/relationships/node/,https://api.osf.io/v2/licenses/563c1cf88c5e4a3877f9e96a/,563c1cf88c5e4a3877f9e96a,licenses,https://api.osf.io/v2/providers/preprints/socarxiv/,socarxiv,preprint-providers,https://api.osf.io/v2/preprints/r6j2e/files/,https://api.osf.io/v2/files/5c2c2fa428af78001c64825a/,5c2c2fa428af78001c64825a,files,https://api.osf.io/v2/preprints/r6j2e/review_actions/,https://api.osf.io/v2/preprints/r6j2e/requests/,https://api.osf.io/v2/preprints/r6j2e/,https://osf.io/preprints/socarxiv/r6j2e/,https://doi.org/10.31235/osf.io/r6j2e,https://doi.org/10.24093/awej/vol9no4.32
g9y7r,preprints,2019-01-02T03:20:26.340208,2019-01-05T04:54:01.627309,2019-01-05T04:53:37.152613,NA,10.24093/awej/vol9no4.31,Exploring Academic Writing Needs of Indonesian EFL Undergraduate Students,"Academic writing is noteworthy competence to be accomplished for English as a foreign language (EFL) students to fulfill their academic needs at the university. To do so, Indonesian tertiary universities accommodate and foster this competence using academic writing course. The study, therefore, sought to look into: 1. what undergraduate EFL students’ perceptions of the importance of academic writing to their current study and future career, 2. what the students’ perceptions of the difficulties of academic writing, 3. what the students’ attitudes towards their previous and future academic writing courses. The present study investigates students’ needs emerging in academic writing during classroom practices to gain insightful and profound perspectives for forthcoming needs of the course. Data were collected through a five scaled questionnaire of need analysis distributed to thirty-four EFL students from a private university, and a focus group interview involving nine participants. Results indicate 61% (Mdifficulties=3.05) of students faced difficulties in both general skills and language problems of academic writing and a new course was expected to provide moves/steps for writing the sections in a research article. The present study then suggests that e-database resources are needed for academic papers models and references hence its efficiency and flexibility in prospective academic writing.",TRUE,FALSE,academic writing|EFL students|need analysis,2019-01-05T04:54:01.610130,NA,,TRUE,accepted,2019-01-05T04:53:37.152613,NA,NA,NA,NA,NA,NA,NA,NA,NA,5a8c80f2c698300375c76c7d|5a8c80f5c698300375c76d10|Arts and Humanities|English Language and Literature,,2019,https://api.osf.io/v2/preprints/g9y7r/contributors/,https://api.osf.io/v2/preprints/g9y7r/bibliographic_contributors/,https://api.osf.io/v2/preprints/g9y7r/citation/,g9y7r,preprints,https://api.osf.io/v2/preprints/g9y7r/identifiers/,https://api.osf.io/v2/preprints/g9y7r/relationships/node/,https://api.osf.io/v2/licenses/563c1cf88c5e4a3877f9e96a/,563c1cf88c5e4a3877f9e96a,licenses,https://api.osf.io/v2/providers/preprints/socarxiv/,socarxiv,preprint-providers,https://api.osf.io/v2/preprints/g9y7r/files/,https://api.osf.io/v2/files/5c2c2dffa7c0a700193c8741/,5c2c2dffa7c0a700193c8741,files,https://api.osf.io/v2/preprints/g9y7r/review_actions/,https://api.osf.io/v2/preprints/g9y7r/requests/,https://api.osf.io/v2/preprints/g9y7r/,https://osf.io/preprints/socarxiv/g9y7r/,https://doi.org/10.31235/osf.io/g9y7r,https://doi.org/10.24093/awej/vol9no4.31
xsku9,preprints,2019-01-02T03:15:09.818795,2019-01-05T04:53:47.231652,2019-01-05T04:53:24.455612,NA,10.24093/awej/vol9no4.30,Professional Learning through Coaching: toward the Enhancement of the Teachers’ Pedagogical Competence,"Coaching is mainly purposed to build teacher capacity to enhance the success of learning and the quality of education in general. This paper is aimed at describing the coaching materials, methods, and the effectiveness of coaching in English Foreign Language (EFL) learning to strengthen the teachers’ pedagogical competence. Six Junior High School EFL teachers of Central Java, Indonesia (T1, T2, T3, T4, T5, and T6) attended three-month weekly coachee-centered coaching leading to the implementation of student-centered learning. Observation of the teaching-learning process, review of the lesson plan, and an interview with the EFL teachers through Focus Group Discussion were done before coaching was carried out to identify the coachees’ preliminary pedagogical competence and needs. The coaching materials encompassed using songs in EFL class, learning principles and activity-based learning, teaching methods, teaching vocabulary, teaching grammar, teaching the four language skills, assessing attitude, knowledge, and skill, and process skills. Coachee-centered coaching was implemented to present the materials through such methods as Demonstration, Scientific Approach, Lecturing and Discussion, Problem-Based Learning, Task-Based Learning, Inquiry Learning, Presentation-Practice-Production.",TRUE,FALSE,coaching|pedagogical competence|professional learning,2019-01-05T04:53:47.215473,NA,,TRUE,accepted,2019-01-05T04:53:24.455612,NA,NA,NA,NA,NA,NA,NA,NA,NA,5a8c80f2c698300375c76c7d|5a8c80f5c698300375c76d10|Arts and Humanities|English Language and Literature,,2019,https://api.osf.io/v2/preprints/xsku9/contributors/,https://api.osf.io/v2/preprints/xsku9/bibliographic_contributors/,https://api.osf.io/v2/preprints/xsku9/citation/,xsku9,preprints,https://api.osf.io/v2/preprints/xsku9/identifiers/,https://api.osf.io/v2/preprints/xsku9/relationships/node/,https://api.osf.io/v2/licenses/563c1cf88c5e4a3877f9e96a/,563c1cf88c5e4a3877f9e96a,licenses,https://api.osf.io/v2/providers/preprints/socarxiv/,socarxiv,preprint-providers,https://api.osf.io/v2/preprints/xsku9/files/,https://api.osf.io/v2/files/5c2c2cc228af78001b651f84/,5c2c2cc228af78001b651f84,files,https://api.osf.io/v2/preprints/xsku9/review_actions/,https://api.osf.io/v2/preprints/xsku9/requests/,https://api.osf.io/v2/preprints/xsku9/,https://osf.io/preprints/socarxiv/xsku9/,https://doi.org/10.31235/osf.io/xsku9,https://doi.org/10.24093/awej/vol9no4.30
