id,type,attributes.date_created,attributes.date_modified,attributes.date_published,attributes.original_publication_date,attributes.doi,attributes.title,attributes.description,attributes.is_published,attributes.is_preprint_orphan,attributes.tags,attributes.preprint_doi_created,attributes.date_withdrawn,attributes.current_user_permissions,attributes.public,attributes.reviews_state,attributes.date_last_transitioned,attributes.has_coi,attributes.conflict_of_interest_statement,attributes.has_data_links,attributes.why_no_data,attributes.data_links,attributes.has_prereg_links,attributes.why_no_prereg,attributes.prereg_links,attributes.prereg_link_info,attributes.subjects,attributes.license_record.copyright_holders,attributes.license_record.year,relationships.contributors.links.related.href,relationships.bibliographic_contributors.links.related.href,relationships.citation.links.related.href,relationships.citation.data.id,relationships.citation.data.type,relationships.identifiers.links.related.href,relationships.node.links.related.href,relationships.node.links.self.href,relationships.node.data.id,relationships.node.data.type,relationships.license.links.related.href,relationships.license.data.id,relationships.license.data.type,relationships.provider.links.related.href,relationships.provider.data.id,relationships.provider.data.type,relationships.files.links.related.href,relationships.primary_file.links.related.href,relationships.primary_file.data.id,relationships.primary_file.data.type,relationships.review_actions.links.related.href,relationships.requests.links.related.href,links.self,links.html,links.doi,links.preprint_doi
7gjdc,preprints,2018-05-21T19:17:42.655076,2018-07-02T11:53:25.792633,2018-05-21T22:32:40.411088,2018-05-21T06:00:00,10.1177/0003122418772034,Income Inequality and Class Divides in Parental Investments,"Historic increases in income inequality have coincided with widening class divides in parental investments of money and time in children. These widening class gaps are significant because parental investment is one pathway by which advantage is transmitted across generations. Using over three decades of micro-data from the Consumer Expenditure Survey and the American Heritage Time Use Survey linked to state-year measures of income inequality, we test the relationship between income inequality and class gaps in parental investment. We find robust evidence of wider class gaps in parental financial investments in children—but not parental time investments in children—when state-level income inequality is higher. We explore mechanisms that may drive the relationship between rising income inequality and widening class gaps in parental financial investments in children. This relationship is partially explained by the increasing concentration of income at the top of the income distribution in state-years with higher inequality, which gives higher-earning households more money to spend on financial investments in children. In addition, we find evidence for contextual effects of higher income inequality that reshape parental preferences toward financial investment in children differentially by class.",TRUE,FALSE,family|inequality|parenting,2018-07-02T11:53:25.783670,NA,,TRUE,accepted,2018-05-21T22:32:40.411088,NA,NA,NA,NA,NA,NA,NA,NA,NA,"5a8c80f7c698300375c76d84|5a8c80fac698300375c76e20|5a8c80fac698300375c76e26|Social and Behavioral Sciences|Sociology|Sociology of Education|5a8c80f7c698300375c76d84|5a8c80fac698300375c76e20|5a8c80fac698300375c76e2d|Social and Behavioral Sciences|Sociology|Economic Sociology|5a8c80f7c698300375c76d84|5a8c80fac698300375c76e20|5a8c80fac698300375c76e35|Social and Behavioral Sciences|Sociology|Inequality, Poverty, and Mobility|5a8c80f7c698300375c76d84|5a8c80fac698300375c76e20|5a8c80fac698300375c76e36|Social and Behavioral Sciences|Sociology|Consumers and Consumption|5a8c80f7c698300375c76d84|5a8c80fac698300375c76e20|5a8c80fac698300375c76e47|Social and Behavioral Sciences|Sociology|Children and Youth|5a8c80f7c698300375c76d84|5a8c80fac698300375c76e20|5a8c80fac698300375c76e4c|Social and Behavioral Sciences|Sociology|Family",,2018,https://api.osf.io/v2/preprints/7gjdc/contributors/,https://api.osf.io/v2/preprints/7gjdc/bibliographic_contributors/,https://api.osf.io/v2/preprints/7gjdc/citation/,7gjdc,preprints,https://api.osf.io/v2/preprints/7gjdc/identifiers/,https://api.osf.io/v2/nodes/628ku/,https://api.osf.io/v2/preprints/7gjdc/relationships/node/,628ku,nodes,https://api.osf.io/v2/licenses/563c1cf88c5e4a3877f9e96a/,563c1cf88c5e4a3877f9e96a,licenses,https://api.osf.io/v2/providers/preprints/socarxiv/,socarxiv,preprint-providers,https://api.osf.io/v2/preprints/7gjdc/files/,https://api.osf.io/v2/files/5b031b55e9cb340010b3ddd6/,5b031b55e9cb340010b3ddd6,files,https://api.osf.io/v2/preprints/7gjdc/review_actions/,https://api.osf.io/v2/preprints/7gjdc/requests/,https://api.osf.io/v2/preprints/7gjdc/,https://osf.io/preprints/socarxiv/7gjdc/,https://doi.org/10.1177/0003122418772034,https://doi.org/10.31235/osf.io/7gjdc
embg4,preprints,2018-05-21T08:04:08.775445,2018-07-02T11:53:24.649674,2018-05-21T22:38:30.693919,NA,10.17605/OSF.IO/UT4FB,Motivations of Cosplayers to Participate in the Anime Fandom,"We examined differences between cosplaying and non-cosplaying anime fans with regard to their motivation to participate in the anime fandom. Participants, all anime fans, completed scales assessing a myriad of possible motivations for anime fandom participation. Cosplayers rated all of the assessed motivations higher than non-cosplayers. The highest-rated motivations for cosplayers included entertainment, escape from everyday life, belongingness, eustress, and aesthetic beauty. Modest sex differences were also found, as women were more likely than men to cosplay and, even among cosplayers, women reported higher belongingness, family, self-esteem, and escape motivations. With the exception of sexual attraction, however, where men were considerably more motivated by sexual attraction than women, the effect sizes for sex differences were fairly small, suggesting little true difference between male and female cosplayers. The results are discussed in relation to past research examining anime cosplayers.",TRUE,FALSE,anime|belongingness|cosplay|cosplayer|escape|fandom,2018-07-02T11:53:24.639299,NA,,TRUE,accepted,2018-05-21T22:38:30.693919,NA,NA,NA,NA,NA,NA,NA,NA,NA,5a8c80f7c698300375c76d84|5a8c80f7c698300375c76d98|Social and Behavioral Sciences|Psychology,,2018,https://api.osf.io/v2/preprints/embg4/contributors/,https://api.osf.io/v2/preprints/embg4/bibliographic_contributors/,https://api.osf.io/v2/preprints/embg4/citation/,embg4,preprints,https://api.osf.io/v2/preprints/embg4/identifiers/,https://api.osf.io/v2/nodes/ut4fb/,https://api.osf.io/v2/preprints/embg4/relationships/node/,ut4fb,nodes,https://api.osf.io/v2/licenses/563c1cf88c5e4a3877f9e96a/,563c1cf88c5e4a3877f9e96a,licenses,https://api.osf.io/v2/providers/preprints/socarxiv/,socarxiv,preprint-providers,https://api.osf.io/v2/preprints/embg4/files/,https://api.osf.io/v2/files/5b027b32e9cb340011b1fb02/,5b027b32e9cb340011b1fb02,files,https://api.osf.io/v2/preprints/embg4/review_actions/,https://api.osf.io/v2/preprints/embg4/requests/,https://api.osf.io/v2/preprints/embg4/,https://osf.io/preprints/socarxiv/embg4/,https://doi.org/10.17605/OSF.IO/UT4FB,https://doi.org/10.31235/osf.io/embg4
g6ez4,preprints,2018-05-21T07:49:53.725221,2018-07-02T11:53:24.574640,2018-05-21T22:37:03.673468,NA,10.17605/OSF.IO/H4YBT,"""Something Wicked This Way Comes"": Apocalyptic Overtones and the Descent into Ennui in John Logan's TV Series Penny Dreadful","While scholars have provided some insight into Penny Dreadful, no one has addressed the relationship of the piece’s overall design to the writer’s vision. Indeed, Penny Dreadful is offered as a warning of a darker age to come. Accordingly, writer John Logan sets his series in a late Victorian, Gothicized London that serves as a microcosm for a contemporary Western world experiencing a psychological and spiritual disintegration that touches the individual and the larger culture. Logan calls attention to the anxieties generated by this disintegration by incorporating into his series characters from late Victorian Gothic fiction: Frankenstein and his creature, Dracula, the Wolf Man, Dorian Gray, and Dr. Jekyll. The individual and cultural anxieties suggested by these characters’ “monstrous” behaviors have their basis not only in their sexual dysfunctions but in their despair over God’s absence. This crisis is centered in sexually adventurous Vanessa Ives, whose attempts to return to the Christ Who has rejected her hold the series together. In the series’ final episode, just before her death, Vanessa has a vision of Jesus. In response to Vanessa’s death, most of the remaining characters are seized by an ennui that has its counterpart in our own culture. The suggestion is that Logan uses Vanessa Ives as a symbolic representation of a dying world view, which, somewhat ironically, provided for her remaining friends a hope that sustained them.",TRUE,FALSE,Gothic|John Logan|Media|Penny Dreadful|Television|TV,2018-07-02T11:53:24.565022,NA,,TRUE,accepted,2018-05-21T22:37:03.673468,NA,NA,NA,NA,NA,NA,NA,NA,NA,5a8c80f2c698300375c76c7d|5a8c80f3c698300375c76c90|Arts and Humanities|Television,,2018,https://api.osf.io/v2/preprints/g6ez4/contributors/,https://api.osf.io/v2/preprints/g6ez4/bibliographic_contributors/,https://api.osf.io/v2/preprints/g6ez4/citation/,g6ez4,preprints,https://api.osf.io/v2/preprints/g6ez4/identifiers/,https://api.osf.io/v2/nodes/h4ybt/,https://api.osf.io/v2/preprints/g6ez4/relationships/node/,h4ybt,nodes,https://api.osf.io/v2/licenses/563c1cf88c5e4a3877f9e96a/,563c1cf88c5e4a3877f9e96a,licenses,https://api.osf.io/v2/providers/preprints/socarxiv/,socarxiv,preprint-providers,https://api.osf.io/v2/preprints/g6ez4/files/,https://api.osf.io/v2/files/5b027640a556d0001306f4df/,5b027640a556d0001306f4df,files,https://api.osf.io/v2/preprints/g6ez4/review_actions/,https://api.osf.io/v2/preprints/g6ez4/requests/,https://api.osf.io/v2/preprints/g6ez4/,https://osf.io/preprints/socarxiv/g6ez4/,https://doi.org/10.17605/OSF.IO/H4YBT,https://doi.org/10.31235/osf.io/g6ez4
7n9bd,preprints,2018-05-20T11:28:27.862822,2018-07-02T11:53:23.234912,2018-05-20T23:39:35.583670,NA,NA,Rural Manx vernacular buildings are not protected by planning policy: an evidence-informed approach reveals inconsistency in policy application and assessment,"The Isle of Man is a UNESCO Biosphere Reserve, awarded in recognition of the uniqueness of the island’s cultural landscapes. As a predominantly rural country (with 80% of land used for agriculture), rural planning policy is a key modifier of Manx cultural landscapes. Manx vernacular farmhouses, cottages, and farm buildings, alongside Manx sod hedges and small field structure, contribute to the ‘sense of place’. Current policy only allows for rural development in exceptional circumstances, which includes ‘replacement dwellings’, a policy mandating the clearance of existing rural development. There has been to date no assessment of the effectiveness of Manx planning policies at protecting built heritage within cultural landscapes. I created an evidence-based methodology with decision-trees to assess: (a) the completeness of policy implementation; and (b) its influence on decision-making. The method is demonstrated for the ‘replacement dwelling’ policy for the last 3.5 years. Public records were screened for relevance, with those remaining assigned policy assessment, compliance, and policy balance scores. Of 62 relevant applications, 58 had recommendations contrary to ‘replacement dwelling’ policy. In total, 50% of the replacement dwelling requirements were assessed by case officers in the applications. In particular, requirements establishing the principle of demolition / redevelopment (including protection for existing historic buildings) were only assessed with 23% completeness, and 14% compliance. 27 applications permitted demolition and replacement of vernacular buildings, including 17 farmhouses. Assessments of historic and architectural merit, required by policy, were uncommon, and only once was a conservation report obtained. The requirements for siting, size, and design of approved replacements were complied with 47% of the time, with 38% of these deemed ‘exceptional circumstances’. The evidence strongly suggests that policy application is inconsistent and incomplete, with the policies assessed here having no relation to the recommendations issued. Policy thus fails to provide protection to the historic buildings. I suggest that the method developed here could be used to overcome subjectivity in policy application, and allow performance tracking of individual policies.",TRUE,FALSE,cultural heritage|evidence-informed approach|rural planning|UNESCO biosphere,2018-07-02T11:53:23.222516,NA,,TRUE,accepted,2018-05-20T23:39:35.583670,NA,NA,NA,NA,NA,NA,NA,NA,NA,5a8c80f7c698300375c76d84|5a8c80f7c698300375c76d97|Social and Behavioral Sciences|Urban Studies and Planning,,2018,https://api.osf.io/v2/preprints/7n9bd/contributors/,https://api.osf.io/v2/preprints/7n9bd/bibliographic_contributors/,https://api.osf.io/v2/preprints/7n9bd/citation/,7n9bd,preprints,https://api.osf.io/v2/preprints/7n9bd/identifiers/,https://api.osf.io/v2/nodes/nzk3p/,https://api.osf.io/v2/preprints/7n9bd/relationships/node/,nzk3p,nodes,https://api.osf.io/v2/licenses/563c1cf88c5e4a3877f9e96a/,563c1cf88c5e4a3877f9e96a,licenses,https://api.osf.io/v2/providers/preprints/socarxiv/,socarxiv,preprint-providers,https://api.osf.io/v2/preprints/7n9bd/files/,https://api.osf.io/v2/files/5b015bdae9cb340012b185ae/,5b015bdae9cb340012b185ae,files,https://api.osf.io/v2/preprints/7n9bd/review_actions/,https://api.osf.io/v2/preprints/7n9bd/requests/,https://api.osf.io/v2/preprints/7n9bd/,https://osf.io/preprints/socarxiv/7n9bd/,NA,https://doi.org/10.31235/osf.io/7n9bd
hujgs,preprints,2018-05-20T06:36:43.826746,2018-07-02T11:53:22.886653,2018-05-20T23:37:59.787524,NA,10.17605/OSF.IO/HUJGS,"""Coming Out"" as an Anime Fan: Cosplayers in the Anime Fandom, Fan Disclosure, and Well-Being","In the present study we tested the hypothesis that cosplayers experience greater well-being than non-cosplayers within the anime fandom in part because they are more likely to disclose their fan identity to non-fans. Anime fans indicated whether they engaged in cosplaying or not, and rated the degree to which they disclose their anime fan identity to non-fans, satisfaction with life, self-esteem, and depression. Compared to non-cosplayers, cosplayers reported greater self-disclosure and better well-being across a number of indicators. Mediation analyses revealed that the relationship between cosplaying and well-being was consistently mediated by disclosure, a finding in-line with existing research. These are discussed within the context of existing research, providing both a conceptual replication of past findings from related fandoms (i.e., the furry fandom) while also suggesting a myriad of possible directions for future research on the subject.",TRUE,FALSE,anime|cosplay|cosplayers|satisfaction with life|well being|well-being,2018-07-02T11:53:22.875471,NA,,TRUE,accepted,2018-05-20T23:37:59.787524,NA,NA,NA,NA,NA,NA,NA,NA,NA,5a8c80f7c698300375c76d84|5a8c80f7c698300375c76d98|Social and Behavioral Sciences|Psychology,,2018,https://api.osf.io/v2/preprints/hujgs/contributors/,https://api.osf.io/v2/preprints/hujgs/bibliographic_contributors/,https://api.osf.io/v2/preprints/hujgs/citation/,hujgs,preprints,https://api.osf.io/v2/preprints/hujgs/identifiers/,https://api.osf.io/v2/nodes/u96xw/,https://api.osf.io/v2/preprints/hujgs/relationships/node/,u96xw,nodes,https://api.osf.io/v2/licenses/563c1cf88c5e4a3877f9e96a/,563c1cf88c5e4a3877f9e96a,licenses,https://api.osf.io/v2/providers/preprints/socarxiv/,socarxiv,preprint-providers,https://api.osf.io/v2/preprints/hujgs/files/,https://api.osf.io/v2/files/5b01177ae9cb340011b14b79/,5b01177ae9cb340011b14b79,files,https://api.osf.io/v2/preprints/hujgs/review_actions/,https://api.osf.io/v2/preprints/hujgs/requests/,https://api.osf.io/v2/preprints/hujgs/,https://osf.io/preprints/socarxiv/hujgs/,https://doi.org/10.17605/OSF.IO/HUJGS,https://doi.org/10.31235/osf.io/hujgs
fxgms,preprints,2018-05-19T15:21:38.897132,2018-07-02T11:53:22.355988,2018-05-20T03:30:43.827231,NA,NA,Market crises as disasters: the social meaning of financial risk in 401(k) retirement accounts,"This study seeks to extend the social meaning of money to account for the valorization of distinct forms of household wealth, using the 401(k) retirement account as an exemplar. In doing so, particular economic shocks are framed within the disasters literature for the first time. The institutional shift from corporate pensions to individual retirement accounts since the 1980’s changed the social and economic logics of retirement, making this financial location salient, where shocks to the stock market reveal a distinct pattern of economic action. Using the 401(k) retirement account data, I show that bear market years in 2002 and 2008 caused retirement savers to orient their portfolios toward durable conservatism – a finding that deviates from predictions made by either neoclassical or behavioral economic theory. Rather, a sociological mechanism developed in the disasters literature – the social amplification of risk framework (SARF) – provides a plausible explanation for the empirical findings. Interestingly, the practical rule of conservation that works well for many disaster scenarios, for retirement savers creates an unfortunate discrepancy between the objective chances of retirement security and the subjective aspirations of 401(k) savers by causing underinvestment in stocks that can produce suboptimal portfolio returns manifesting itself as latent retirement inequality, especially impacting the youngest savers who have the most at stake.",TRUE,FALSE,disasters|economic sociology|retirement|risk|social amplification of risk,2018-07-02T11:53:22.346077,NA,,TRUE,accepted,2018-05-20T03:30:43.827231,NA,NA,NA,NA,NA,NA,NA,NA,NA,5a8c80f7c698300375c76d84|5a8c80fac698300375c76e20|5a8c80fac698300375c76e2d|Social and Behavioral Sciences|Sociology|Economic Sociology,Adam Hayes,2018,https://api.osf.io/v2/preprints/fxgms/contributors/,https://api.osf.io/v2/preprints/fxgms/bibliographic_contributors/,https://api.osf.io/v2/preprints/fxgms/citation/,fxgms,preprints,https://api.osf.io/v2/preprints/fxgms/identifiers/,https://api.osf.io/v2/nodes/kpcfd/,https://api.osf.io/v2/preprints/fxgms/relationships/node/,kpcfd,nodes,https://api.osf.io/v2/licenses/563c1cf88c5e4a3877f9e965/,563c1cf88c5e4a3877f9e965,licenses,https://api.osf.io/v2/providers/preprints/socarxiv/,socarxiv,preprint-providers,https://api.osf.io/v2/preprints/fxgms/files/,https://api.osf.io/v2/files/5b004102a556d0001405ca25/,5b004102a556d0001405ca25,files,https://api.osf.io/v2/preprints/fxgms/review_actions/,https://api.osf.io/v2/preprints/fxgms/requests/,https://api.osf.io/v2/preprints/fxgms/,https://osf.io/preprints/socarxiv/fxgms/,NA,https://doi.org/10.31235/osf.io/fxgms
3ag7k,preprints,2018-05-18T16:50:37.896417,2018-07-24T12:21:03.148809,2018-05-18T17:57:49.952370,NA,10.1177/2378023118790189,Gun Control in the Crosshairs: Christian Nationalism and Opposition to Stricter Gun Laws,"Despite increasingly frequent mass shootings and a growing dissatisfaction with current gun laws, American opposition to federal gun legislation remains strong. We show that opposition to stricter gun control is closely linked to Christian nationalism, a religious cultural framework that mandates a symbiotic relationship between Christianity and civil society. Using data from a national population-based survey, we show that Christian nationalism is an exceptionally strong predictor of opposition to the federal government enacting stricter gun laws. In fact, of all the variables we considered only general political orientation has more predictive power than Christian nationalism. We propose that the gun control debate is complicated by deeply held moral and religious schemas that discussions focused solely on rational public safety calculations do not sufficiently address. For the substantial proportion of American society who are Christian nationalists, gun rights are God-given and sacred. Consequently, attempts to reform existing gun laws must attend to the deeper cultural and religious identities that undergird Americans’ beliefs about gun control.",TRUE,FALSE,Christian nationalism|gun control|guns|religion|United States,2018-07-02T11:53:09.931580,NA,,TRUE,accepted,2018-05-18T17:57:49.952370,NA,NA,NA,NA,NA,NA,NA,NA,NA,5a8c80f7c698300375c76d84|5a8c80fac698300375c76e20|Social and Behavioral Sciences|Sociology,,2018,https://api.osf.io/v2/preprints/3ag7k/contributors/,https://api.osf.io/v2/preprints/3ag7k/bibliographic_contributors/,https://api.osf.io/v2/preprints/3ag7k/citation/,3ag7k,preprints,https://api.osf.io/v2/preprints/3ag7k/identifiers/,https://api.osf.io/v2/nodes/geuzq/,https://api.osf.io/v2/preprints/3ag7k/relationships/node/,geuzq,nodes,https://api.osf.io/v2/licenses/563c1cf88c5e4a3877f9e96c/,563c1cf88c5e4a3877f9e96c,licenses,https://api.osf.io/v2/providers/preprints/socarxiv/,socarxiv,preprint-providers,https://api.osf.io/v2/preprints/3ag7k/files/,https://api.osf.io/v2/files/5aff045d365b68000f571725/,5aff045d365b68000f571725,files,https://api.osf.io/v2/preprints/3ag7k/review_actions/,https://api.osf.io/v2/preprints/3ag7k/requests/,https://api.osf.io/v2/preprints/3ag7k/,https://osf.io/preprints/socarxiv/3ag7k/,https://doi.org/10.1177/2378023118790189,https://doi.org/10.31235/osf.io/3ag7k
uqvd3,preprints,2018-05-18T04:34:02.103719,2018-07-02T11:53:09.369689,2018-05-18T10:44:49.704458,NA,NA,Beyond Social Contagion: Associative Diffusion and the Emergence of Cultural Variation,"Network models of diffusion predominantly think about cultural variation as a product of social contagion. But culture does not spread like a virus. In this paper, we propose an alternative explanation which we refer to as associative diffusion. Drawing on two insights from research in cognition—that meaning inheres in cognitive associations between concepts, and that such perceived associations constrain people’s actions—we propose a model wherein, rather than beliefs or behaviors per-se, the things being transmitted between individuals are perceptions about what beliefs or behaviors are compatible with one another. Conventional contagion models require an assumption of network segregation to explain cultural variation. In contrast, we demonstrate that the endogenous emergence of cultural differentiation can be entirely attributable to social cognition and does not necessitate a clustered social network or a preexisting
division into groups. Moreover, we show that prevailing assumptions about the effects of network topology do not hold when diffusion is associative.",TRUE,FALSE,cultural differentiation|cultural evolution|culture|diffusion|polarization|social contagion|social networks,2018-07-02T11:53:09.359814,NA,,TRUE,accepted,2018-05-18T10:44:49.704458,NA,NA,NA,NA,NA,NA,NA,NA,NA,5a8c80f7c698300375c76d84|5a8c80fac698300375c76e20|5a8c80fac698300375c76e37|Social and Behavioral Sciences|Sociology|Theory|5a8c80f7c698300375c76d84|5a8c80fac698300375c76e20|5a8c80fac698300375c76e4d|Social and Behavioral Sciences|Sociology|Mathematical Sociology|5a8c80f7c698300375c76d84|5a8c80fac698300375c76e20|5a8c80fac698300375c76e51|Social and Behavioral Sciences|Sociology|Culture,,2018,https://api.osf.io/v2/preprints/uqvd3/contributors/,https://api.osf.io/v2/preprints/uqvd3/bibliographic_contributors/,https://api.osf.io/v2/preprints/uqvd3/citation/,uqvd3,preprints,https://api.osf.io/v2/preprints/uqvd3/identifiers/,https://api.osf.io/v2/nodes/5ke7n/,https://api.osf.io/v2/preprints/uqvd3/relationships/node/,5ke7n,nodes,https://api.osf.io/v2/licenses/563c1cf88c5e4a3877f9e96a/,563c1cf88c5e4a3877f9e96a,licenses,https://api.osf.io/v2/providers/preprints/socarxiv/,socarxiv,preprint-providers,https://api.osf.io/v2/preprints/uqvd3/files/,https://api.osf.io/v2/files/5afe57b9d1a5a0000dfae85e/,5afe57b9d1a5a0000dfae85e,files,https://api.osf.io/v2/preprints/uqvd3/review_actions/,https://api.osf.io/v2/preprints/uqvd3/requests/,https://api.osf.io/v2/preprints/uqvd3/,https://osf.io/preprints/socarxiv/uqvd3/,NA,https://doi.org/10.31235/osf.io/uqvd3
