id,type,attributes.date_created,attributes.date_modified,attributes.date_published,attributes.original_publication_date,attributes.doi,attributes.title,attributes.description,attributes.is_published,attributes.is_preprint_orphan,attributes.tags,attributes.preprint_doi_created,attributes.date_withdrawn,attributes.current_user_permissions,attributes.public,attributes.reviews_state,attributes.date_last_transitioned,attributes.has_coi,attributes.conflict_of_interest_statement,attributes.has_data_links,attributes.why_no_data,attributes.data_links,attributes.has_prereg_links,attributes.why_no_prereg,attributes.prereg_links,attributes.prereg_link_info,attributes.subjects,attributes.license_record.copyright_holders,attributes.license_record.year,relationships.contributors.links.related.href,relationships.bibliographic_contributors.links.related.href,relationships.citation.links.related.href,relationships.citation.data.id,relationships.citation.data.type,relationships.identifiers.links.related.href,relationships.node.links.self.href,relationships.node.links.related.href,relationships.node.data.id,relationships.node.data.type,relationships.license.links.related.href,relationships.license.data.id,relationships.license.data.type,relationships.provider.links.related.href,relationships.provider.data.id,relationships.provider.data.type,relationships.files.links.related.href,relationships.primary_file.links.related.href,relationships.primary_file.data.id,relationships.primary_file.data.type,relationships.review_actions.links.related.href,relationships.requests.links.related.href,links.self,links.html,links.doi,links.preprint_doi
jqh94,preprints,2020-12-21T11:07:46.228511,2021-02-20T08:42:17.729447,2020-12-21T15:04:43.874125,2021-02-19T23:00:00,10.5539/hes.v11n2p1,Remote Collaboration in Higher Game Development Education. Online Practices and Learning Processes of Students Between Professional Routines and Psychosocial Challenges,"The development of digital games over physical distance is a common practice in the gaming industry, yet widely neglected in the curricula of digital game development programs at university level. The coronavirus pandemic, however, pushed project-oriented game programs all over the world towards an implementation of ad hoc approaches to remote development in their project-based courses. The present article demonstrates  practice-based research examining such a course and its 30 third-year undergraduate students of game arts, game design, and game programming, who remotely collaborated in interdisciplinary groups of two to five persons over the course of half a semester during Germany’s logdown in spring 2020. Applying a mixed-method approach including quantitative and qualitative analyses of survey data (n=22) and qualitative content analyses of students’ postmortem documentations (n=30), this exploratory study reconstructed the online practices, experiences, and learning processes of these students between their professional routines and psychosocial challenges. The results of this study can be used in curriculum development to inform the advancement of courses focused on the development of prototypes over physical distance, which may not only be relevant for the field of games education, but also for related creative and project-oriented fields of higher education, such as design, digital media, and software engineering.",TRUE,FALSE,community of practice|coronavirus pandemic|covid-19|distance education|game development|higher education|online collaboration|remote learning|remote work,2020-12-21T15:05:24.442704,NA,,TRUE,accepted,2020-12-21T15:04:43.874125,FALSE,NA,no,NA,,no,NA,,,5a8c80f6c698300375c76d4e|5a8c80f6c698300375c76d5c|Education|Higher Education|5a8c80f6c698300375c76d4e|5a8c80f7c698300375c76d82|Education|Online and Distance Education,André Czauderna &amp; Emmanuel Guardiola,2020,https://api.osf.io/v2/preprints/jqh94/contributors/,https://api.osf.io/v2/preprints/jqh94/bibliographic_contributors/,https://api.osf.io/v2/preprints/jqh94/citation/,jqh94,preprints,https://api.osf.io/v2/preprints/jqh94/identifiers/,https://api.osf.io/v2/preprints/jqh94/relationships/node/,NA,NA,NA,https://api.osf.io/v2/licenses/563c1cf88c5e4a3877f9e965/,563c1cf88c5e4a3877f9e965,licenses,https://api.osf.io/v2/providers/preprints/socarxiv/,socarxiv,preprint-providers,https://api.osf.io/v2/preprints/jqh94/files/,https://api.osf.io/v2/files/5fe08206f0df54069f2ef8dd/,5fe08206f0df54069f2ef8dd,files,https://api.osf.io/v2/preprints/jqh94/review_actions/,https://api.osf.io/v2/preprints/jqh94/requests/,https://api.osf.io/v2/preprints/jqh94/,https://osf.io/preprints/socarxiv/jqh94/,https://doi.org/10.5539/hes.v11n2p1,https://doi.org/10.31235/osf.io/jqh94
68fpr,preprints,2020-12-21T01:36:12.796911,2020-12-23T19:47:19.888672,2020-12-21T03:12:19.120256,NA,NA,How to Get Away with Spreading COVID-19: Political Connections and Pandemic Response,"While the aim of COVID-19 policies is to suppress the pandemic, many fear that the burden of the restrictions will fall more heavily on less privileged groups. We show one potential mechanism for COVID-19 responses to increase inequality by examining the intersection of business restrictions and business political connections. Using an online survey of 2,735 business employees and managers in Ukraine, Egypt and Venezuela over the summer of 2020, we show that businesses with political connections to government officials were significantly less likely to shut down as a result of COVID-19 policies. This finding suggests that measures designed to mitigate COVID-19 are less effective in countries with a weak rule of law if politically connected firms are able to circumvent restrictions by leveraging political connections to receive preferential treatment. In addition, politically-connected firms are no more likely--and sometimes even less likely--to engage in social-distancing policies to mitigate the pandemic despite the fact that they are more likely to remain open.",TRUE,FALSE,business politics|corruption|COVID-19|politically-connected companies,2020-12-21T03:12:41.741737,NA,,TRUE,accepted,2020-12-21T03:12:19.120256,FALSE,NA,no,NA,,no,NA,,,5a8c80f7c698300375c76d84|5a8c80f8c698300375c76daf|Social and Behavioral Sciences|Political Science|5a8c80f7c698300375c76d84|5a8c80f8c698300375c76dbe|Social and Behavioral Sciences|Economics,,2020,https://api.osf.io/v2/preprints/68fpr/contributors/,https://api.osf.io/v2/preprints/68fpr/bibliographic_contributors/,https://api.osf.io/v2/preprints/68fpr/citation/,68fpr,preprints,https://api.osf.io/v2/preprints/68fpr/identifiers/,https://api.osf.io/v2/preprints/68fpr/relationships/node/,NA,NA,NA,https://api.osf.io/v2/licenses/563c1cf88c5e4a3877f9e96a/,563c1cf88c5e4a3877f9e96a,licenses,https://api.osf.io/v2/providers/preprints/socarxiv/,socarxiv,preprint-providers,https://api.osf.io/v2/preprints/68fpr/files/,https://api.osf.io/v2/files/5fdffc10149e75061b028260/,5fdffc10149e75061b028260,files,https://api.osf.io/v2/preprints/68fpr/review_actions/,https://api.osf.io/v2/preprints/68fpr/requests/,https://api.osf.io/v2/preprints/68fpr/,https://osf.io/preprints/socarxiv/68fpr/,NA,https://doi.org/10.31235/osf.io/68fpr
9cqta,preprints,2020-12-21T00:04:59.395520,2020-12-30T13:39:01.170806,2020-12-21T03:10:55.723822,NA,NA,"Human enhancement, biocyborg and self-experimentation: biopower in the age of synthetic biology and gene editing","Synthetic biology and gene editing opens new possibilities for human enhancement requiring ethical, societal and biopolitical considerations to evaluate its implications on the biopower and the human species. In this article, from a critical and exploratory analysis, we advocate that recent biotechnological developments allowed by synthetic biology (including gene editing) are transforming the line of forces of biopower and biopolitics. After having described the paradigm of life as an engineering discipline conveyed by synthetic biology, we first analyze using the concept of somatechnology that this technoscience is transforming the figure of the cyborg towards the biocyborg blurring the distinctions natural/artificial and man/machine. In second, we investigate the bioeconomy of enhancement and its effect on how the individuals developed new modes of subjectivation and how they consider their own bodies. We end the article by analysing the transformations of biopower with gene editing and the use of technologies of genetic self-modification by self-experimenters.",TRUE,FALSE,biocyborg|biohacking|biopolitics|biopower|gene editing|human enhancement|synthetic biology,2020-12-21T03:11:22.320333,NA,,TRUE,accepted,2020-12-21T03:10:55.723822,FALSE,NA,not_applicable,NA,,not_applicable,NA,,,"5a8c80f7c698300375c76d84|5a8c80f8c698300375c76daf|5a8c80f8c698300375c76db3|Social and Behavioral Sciences|Political Science|Other Political Science|5a8c80f7c698300375c76d84|5a8c80f9c698300375c76df4|Social and Behavioral Sciences|Science and Technology Studies|5a8c80f7c698300375c76d84|5a8c80fac698300375c76e20|5a8c80fac698300375c76e21|Social and Behavioral Sciences|Sociology|Evolution, Biology, and Society|5a8c80f7c698300375c76d84|5a8c80fac698300375c76e20|5a8c80fac698300375c76e40|Social and Behavioral Sciences|Sociology|Science, Knowledge, and Technology",Léo Pio-Lopez,2020,https://api.osf.io/v2/preprints/9cqta/contributors/,https://api.osf.io/v2/preprints/9cqta/bibliographic_contributors/,https://api.osf.io/v2/preprints/9cqta/citation/,9cqta,preprints,https://api.osf.io/v2/preprints/9cqta/identifiers/,https://api.osf.io/v2/preprints/9cqta/relationships/node/,NA,NA,NA,https://api.osf.io/v2/licenses/563c1cf88c5e4a3877f9e965/,563c1cf88c5e4a3877f9e965,licenses,https://api.osf.io/v2/providers/preprints/socarxiv/,socarxiv,preprint-providers,https://api.osf.io/v2/preprints/9cqta/files/,https://api.osf.io/v2/files/5fdfe6b00694b7068cf3fd48/,5fdfe6b00694b7068cf3fd48,files,https://api.osf.io/v2/preprints/9cqta/review_actions/,https://api.osf.io/v2/preprints/9cqta/requests/,https://api.osf.io/v2/preprints/9cqta/,https://osf.io/preprints/socarxiv/9cqta/,NA,https://doi.org/10.31235/osf.io/9cqta
hbdsf,preprints,2020-12-20T20:57:48.346086,2020-12-21T03:07:41.608425,2020-12-21T03:07:21.590142,NA,NA,A Brain Mapping Approach to Inspect the Underlying Neural Correlates upon Perceiving Persian Metaphors,"Metaphors are frequently used in our daily life communications to comprehend and convey abstract concepts. Different neuroimaging studies also show a wide neural connection to metaphor perception. This study used a brain mapping setup (quantitative electroencephalography) to examine large-scale brain networks in participants when they were submitted to non-metaphorical sentences as compared to creative and conventional metaphorical phrases. To this end, 20 healthy right-handed individuals with Persian as their mother-tongue language consented to participate in the above language task. Having evaluated the functional connectivity across key cortical hubs, no significant or predominant role of the right hemisphere was observed upon comprehension of the conventional and creative metaphorical phrases.  Rather, a wide interhemispheric functional connectivity is proposed to play a key part in the above task. Further understanding about the neural networks involved in the semantic processing of metaphors may potentially open new avenues to neural modulation in patients who find it challenging to comprehend figurative language or abstract metaphorical meanings (e.g. schizophrenics).",TRUE,FALSE,Creativity|Figurative language|Metaphors|Networks|qEEG|Semantic processing,2020-12-21T03:07:41.585043,NA,,TRUE,accepted,2020-12-21T03:07:21.590142,FALSE,NA,no,NA,,not_applicable,NA,,,5a8c80f7c698300375c76d84|5a8c80f9c698300375c76dfd|5a8c80f9c698300375c76e00|Social and Behavioral Sciences|Linguistics|Psycholinguistics and Neurolinguistics,,2020,https://api.osf.io/v2/preprints/hbdsf/contributors/,https://api.osf.io/v2/preprints/hbdsf/bibliographic_contributors/,https://api.osf.io/v2/preprints/hbdsf/citation/,hbdsf,preprints,https://api.osf.io/v2/preprints/hbdsf/identifiers/,https://api.osf.io/v2/preprints/hbdsf/relationships/node/,NA,NA,NA,https://api.osf.io/v2/licenses/563c1cf88c5e4a3877f9e96a/,563c1cf88c5e4a3877f9e96a,licenses,https://api.osf.io/v2/providers/preprints/socarxiv/,socarxiv,preprint-providers,https://api.osf.io/v2/preprints/hbdsf/files/,https://api.osf.io/v2/files/5fdfbad6f0df54064a2ef2b5/,5fdfbad6f0df54064a2ef2b5,files,https://api.osf.io/v2/preprints/hbdsf/review_actions/,https://api.osf.io/v2/preprints/hbdsf/requests/,https://api.osf.io/v2/preprints/hbdsf/,https://osf.io/preprints/socarxiv/hbdsf/,NA,https://doi.org/10.31235/osf.io/hbdsf
h3z7s,preprints,2020-12-20T04:30:04.237982,2020-12-21T03:06:01.789262,2020-12-21T03:05:38.849683,NA,NA,PERAN LAYANAN SOSIAL DALAM MENGELOLA ANAK JALANAN DI BANJARMASIN,"Metode yang digunakan dalam penelitian ini adalah metode kualitatif. Pengumpulan data berdasarkan observasi, wawancara dan studi pustaka. Analisis kualitatif digunakan dalam analisis data yang meliputi pengumpulan, reduksi, dan penyajian data. Validitas data diperiksa dengan triangulasi dan menggunakan bahan referensi. Hasil penelitian ini menunjukkan bahwa : (1) untuk menghadapi prosedur pengelolaan anak jalanan secara edukatif seperti : pengetahuan, keterampilan, penekanan pada pengetahuan dan sikap pendidikan psikologi. (2) Pelaksanaan program pencegahan anak jalanan didasarkan pada data yang dikumpulkam oleh penggrebekan Satpol PP atau Trantib dan datanya kemudian dijadikan input pencegahan anak jalanan. (3) Mengatasi kendala yang dihadapi oleh anak jalanan yaitu anak jalanan harus kembali pada lingkungan perkembangan yang saat ini cenderung hidup di jalanan dan melakukan kegiatan ekonomi. Cara mengatasi kendala anak jalanan antara lain dengan bersosialisasi kepada masyarakat khususnya pengendara sepeda motor dan mobil agar tidak memberikan uang kepada anak jalanan. Berdasarkan hasil tersebut maka dapat disarankan : (1) Pengabdian kepada masyarakat harus mampu menciptakan model baru dalam pengelolaan dan pengawasan anak jalanan, selain memberikan pengetahuan tentang bahaya narkoba karena anak jalanan sangat rentan terhadap bahaya narkoba. (2) Tidak hanya mengacu pada anak jalanan yang ditangkap satpol pp, tetapi juga melibatkan peran masyarakat sekitar dalam pelaksanaan program ini agar bisa dicegah sebisa mungkin. (3) Dalam menghadapi anak jalanan setelah mendapat pembinaaan, mereka cenderung kembali ke kehidupan anak jalanan dan melakukan kegiatan ekonomi di jalan. Oleh karena itu, kita dapat memberikan memberikan keterampilan intruksional yang dapat digunakan anak-anak agar mereka tidak lagi berada di jalanan.",TRUE,FALSE,,2020-12-21T03:06:01.766020,NA,,TRUE,accepted,2020-12-21T03:05:38.849683,FALSE,NA,no,NA,,no,NA,,,5a8c80f7c698300375c76d84|Social and Behavioral Sciences,,2020,https://api.osf.io/v2/preprints/h3z7s/contributors/,https://api.osf.io/v2/preprints/h3z7s/bibliographic_contributors/,https://api.osf.io/v2/preprints/h3z7s/citation/,h3z7s,preprints,https://api.osf.io/v2/preprints/h3z7s/identifiers/,https://api.osf.io/v2/preprints/h3z7s/relationships/node/,NA,NA,NA,https://api.osf.io/v2/licenses/5ad7979bc69830002d8190e3/,5ad7979bc69830002d8190e3,licenses,https://api.osf.io/v2/providers/preprints/socarxiv/,socarxiv,preprint-providers,https://api.osf.io/v2/preprints/h3z7s/files/,https://api.osf.io/v2/files/5fded3510694b7063bf38964/,5fded3510694b7063bf38964,files,https://api.osf.io/v2/preprints/h3z7s/review_actions/,https://api.osf.io/v2/preprints/h3z7s/requests/,https://api.osf.io/v2/preprints/h3z7s/,https://osf.io/preprints/socarxiv/h3z7s/,NA,https://doi.org/10.31235/osf.io/h3z7s
6r85m,preprints,2020-12-19T19:59:08.901407,2020-12-20T03:03:41.875219,2020-12-20T03:03:28.198947,NA,NA,A story of two national research evaluation systems: Towards a comparative sociology of quantification,"National research evaluation systems that use metrics for the assessment of academic
institutions are usually regarded as exemplifying the same neo-liberal model of governance that,
with minor variations, is implemented worldwide. This paper argues, however, that, despite
apparent similarities, metrics are used for different aims in different national cases. We compare
the use of figures in the UK RAE/REF, a prototypical neo-liberal framework, with various schemas
of assessment used to evaluate Russian universities in recent decades. We argue that in the
RAE/REF, the principal role of numbers is to solve “the lazy agent” problem by creating a
prisoner’s dilemma situation for academic institutions. In the Russian case, numbers serve to
solve “the corrupt knower” problem, preventing collusion between the assessor and the assessed
by leaving unambiguous and inspectable traces of decision-making processes open for future
scrutiny. While not incompatible, these usages in no way assume each other. In the UK, few
precautions were taken against assessors’ unreliability, and in Russia the element of competition
between universities was suppressed. We conclude by putting forward some hypotheses on the
cultural and institutional origins of different approaches to quantification.",TRUE,FALSE,higher education in Russia|neo-liberalism|principal-agent modela|principal-agent models|research evaluation|Research Excellence Framework|sociology of quantification|sociology of science|soiology of valuation,2020-12-20T03:03:41.854101,NA,,TRUE,accepted,2020-12-20T03:03:28.198947,FALSE,NA,no,The study was based on a secondary analysis of open sources (cited in the paper) and interviews (unavailable because of their sensitive character),,not_applicable,NA,,,"5a8c80f7c698300375c76d84|5a8c80fac698300375c76e20|5a8c80fac698300375c76e40|Social and Behavioral Sciences|Sociology|Science, Knowledge, and Technology|5a8c80f7c698300375c76d84|5a8c80fac698300375c76e20|5a8c80fac698300375c76e43|Social and Behavioral Sciences|Sociology|Comparative and Historical Sociology",,2020,https://api.osf.io/v2/preprints/6r85m/contributors/,https://api.osf.io/v2/preprints/6r85m/bibliographic_contributors/,https://api.osf.io/v2/preprints/6r85m/citation/,6r85m,preprints,https://api.osf.io/v2/preprints/6r85m/identifiers/,https://api.osf.io/v2/preprints/6r85m/relationships/node/,https://api.osf.io/v2/nodes/ph28n/,ph28n,nodes,https://api.osf.io/v2/licenses/563c1cf88c5e4a3877f9e96a/,563c1cf88c5e4a3877f9e96a,licenses,https://api.osf.io/v2/providers/preprints/socarxiv/,socarxiv,preprint-providers,https://api.osf.io/v2/preprints/6r85m/files/,https://api.osf.io/v2/files/5fde5b8ef0df5405d42ed5e2/,5fde5b8ef0df5405d42ed5e2,files,https://api.osf.io/v2/preprints/6r85m/review_actions/,https://api.osf.io/v2/preprints/6r85m/requests/,https://api.osf.io/v2/preprints/6r85m/,https://osf.io/preprints/socarxiv/6r85m/,NA,https://doi.org/10.31235/osf.io/6r85m
ydvcs,preprints,2020-12-19T19:36:18.147897,2020-12-20T03:03:00.683012,2020-12-20T03:02:50.479798,NA,NA,Paying inattention:  The art of ignoring others' work among Russian social scientists,"Why do scholars pay attention to some works, and recognize the influence of their authors, but not others? The Mertonian approach suggests that scholars search for information instrumental in producing their knowledge claims and reward authors for making important contributions. The critical sociology of science approach explains recognition (e.g. in the form of citing) as rhetorical practices that strengthen one’s credibility. Both models fail to explain why academics sometimes ignore apparently relevant sources or how groups of scholars turn into bubbles, censoring information about findings made outside of them. According to the theoretical model suggested in this paper, what governs information search is not first-order relevance (what individual academics considers relevant), but second-order awareness (what they know their audiences are aware of). In this model, the search for information is mostly governed by the necessity to make successful claims of novelty – to present findings that are new to one’s audience. Individuals easily disregard findings their audiences are unaware of. Institutionally organized audiences thus serve as enforcers of information search, and their members may tacitly collaborate in maintaining unawareness of intellectual developments outside of their common attention space In the empirical part of the paper, we use the example of post-Soviet sociology to test the predictions following from this model: (1) that scarcity of enforcement results in an overall shrinking of individuals’ attention spaces, and in their attaining idiosyncratic configurations; (2) that when borders of audiences cross-cut legitimate classifications, attention spaces are shaped by the former, rather than the latter; (3) that as a reaction to such cross-cutting, new classifications are introduced, legitimizing existing inattention.",TRUE,FALSE,,2020-12-20T03:03:00.663437,NA,,TRUE,accepted,2020-12-20T03:02:50.479798,FALSE,NA,no,"Interviews and ethnographic records are not available due to their sensitive character, Survey data can be downloaded from https://dataverse.harvard.edu/dataset.xhtml?persistentId=doi:10.7910/DVN/JOEOWE",,no,The project was a micro-historical study,,,"5a8c80f7c698300375c76d84|5a8c80fac698300375c76e20|5a8c80fac698300375c76e40|Social and Behavioral Sciences|Sociology|Science, Knowledge, and Technology|5a8c80f7c698300375c76d84|5a8c80fac698300375c76e20|5a8c80fac698300375c76e4f|Social and Behavioral Sciences|Sociology|History of Sociology",,2020,https://api.osf.io/v2/preprints/ydvcs/contributors/,https://api.osf.io/v2/preprints/ydvcs/bibliographic_contributors/,https://api.osf.io/v2/preprints/ydvcs/citation/,ydvcs,preprints,https://api.osf.io/v2/preprints/ydvcs/identifiers/,https://api.osf.io/v2/preprints/ydvcs/relationships/node/,NA,NA,NA,https://api.osf.io/v2/licenses/563c1cf88c5e4a3877f9e96a/,563c1cf88c5e4a3877f9e96a,licenses,https://api.osf.io/v2/providers/preprints/socarxiv/,socarxiv,preprint-providers,https://api.osf.io/v2/preprints/ydvcs/files/,https://api.osf.io/v2/files/5fde5635f0df5405cc2f7ee8/,5fde5635f0df5405cc2f7ee8,files,https://api.osf.io/v2/preprints/ydvcs/review_actions/,https://api.osf.io/v2/preprints/ydvcs/requests/,https://api.osf.io/v2/preprints/ydvcs/,https://osf.io/preprints/socarxiv/ydvcs/,NA,https://doi.org/10.31235/osf.io/ydvcs
ah45u,preprints,2020-12-19T17:20:24.265083,2020-12-20T03:01:01.273811,2020-12-20T03:00:45.140907,2017-12-31T07:00:00,NA,Mystical Experience and Global Revolution,"Since Marx first declared religion to be the opiate of the masses, institutions of religion and spirituality have often been resisted by scholars. The assumption of many seems to always be that religion is either a reactionary response to difficult realities or a mere illusion, delusion, or epiphenomenon of brain/social function. This paper looks at the ""authentic core"" of religious institutions, religious/mystical experience, and, using biographical examples from the literature, argues that far from being a reactionary holdout of our primitive past, human spirituality is, in fact, essentially revolutionary. It is suggested that, in the context of a growing global ecological, political, and economic crises, the revolutionary authentic core of religion and spirituality has to be examined, recovered, and even embraced as part of any local or global strategy of transformation.",TRUE,FALSE,Marxism|Mystical Experience|Mysticism|Sociology.,2020-12-20T03:01:01.252240,NA,,TRUE,accepted,2020-12-20T03:00:45.140907,FALSE,NA,no,NA,,no,NA,,,5a8c80f7c698300375c76d84|5a8c80fac698300375c76e20|5a8c80fac698300375c76e31|Social and Behavioral Sciences|Sociology|Sociology of Religion,,2020,https://api.osf.io/v2/preprints/ah45u/contributors/,https://api.osf.io/v2/preprints/ah45u/bibliographic_contributors/,https://api.osf.io/v2/preprints/ah45u/citation/,ah45u,preprints,https://api.osf.io/v2/preprints/ah45u/identifiers/,https://api.osf.io/v2/preprints/ah45u/relationships/node/,NA,NA,NA,https://api.osf.io/v2/licenses/5ad7979bc69830002d8190e3/,5ad7979bc69830002d8190e3,licenses,https://api.osf.io/v2/providers/preprints/socarxiv/,socarxiv,preprint-providers,https://api.osf.io/v2/preprints/ah45u/files/,https://api.osf.io/v2/files/5fde366f0694b70604f3c49c/,5fde366f0694b70604f3c49c,files,https://api.osf.io/v2/preprints/ah45u/review_actions/,https://api.osf.io/v2/preprints/ah45u/requests/,https://api.osf.io/v2/preprints/ah45u/,https://osf.io/preprints/socarxiv/ah45u/,NA,https://doi.org/10.31235/osf.io/ah45u
