ex9bq,preprints,2020-12-19T13:15:28.192997,2020-12-20T02:59:01.015142,2020-12-20T02:58:42.418228,2020-10-14T22:00:00,NA,Risarcimento Internazionale degli Stati e Diritti Umani,"Questo contributo affronta il tema della risarcibilità dei danni alla salute pubblica da parte di alcuni Stati ad altri. Si fa
riferimento alla tendenza che i trattati internazionali registrano negli ultimi anni, specie in ambito europeo (il noto Statuto di
Roma della Corte penale internazionale, in particolare, e le convenzioni che ad esso si richiamano), a tutelare i diritti umani
oltre il limite normalmente riconosciuto alla sovranità degli Stati. Il tema è attuale dato che alcuni Stati del mondo hanno, per
esempio, invocato contro la pandemia del Covid 19 l’obbligo della Cina, uno Stato indipendente, di risarcire i danni alla salute
che Stati terzi hanno subito come contraccolpo dell’emergenza sanitaria in termini di vite umane e di danno all’economia
nazionale. L’effetto prevedibile e “de jure condendo” è che in un futuro non molto lontano si configuri la risarcibilità tra Stati
come obbligo assoluto, anziché come esito della condanna da parte di una Corte di Giustizia Internazionale che operi in forma
arbitrale e con il mero consenso degli Stati legati da un trattato. Il tema merita riflessione per definire il grado di progresso della
pace tra le nazioni alla luce degli ideali regolativi già formulati in passato dalla filosofia del diritto occidentale, uno per tutti
quello autenticamente illuminista di I. Kant. in “Per la Pace Perpetua”. E’ sicuramente dubbio che i recenti fatti, vale a dire le
possibili ed eventuali negligenze di alcuni Stati, non solo la Cina, costituiscano Crimini contro l'umanità, ma è per di più difficile
sostenere che vi sia qualche norma relativa alla grave negligenza che con certezza possa essere entrata a far parte del diritto
consuetudinario internazionale. Tuttavia, le violazioni dei diritti umani, in particolare di quello della vita e della salute personale,
sono già sanzionate in molti strumenti pattizi internazionali, per cui può almeno dirsi che è in via di maturazione una
consuetudine internazionale incriminatrice, anche di tipo giurisdizionale. Il problema dei delitti internazionali è che gli
inadempimenti di obblighi pattizi presentano la gravissima difficoltà di scindere la responsabilità dello Stato inadempiente da
quella del soggetto agente. Lo Stato estero che pretendesse di perseguire tali fatti dinanzi a qualsiasi tribunale internazionale
subirebbe l'opposizione dell'eccezione di immunità fondata sulla funzione svolta: Il funzionario dello stato colpevole inoltre
potrebbe eccepire che “par in parem non habet iurisdictionem” (principio di sovrana uguaglianza tra gli Stati, di cui all'articolo
2 par. 1 della Carta delle Nazioni Unite). In via subordinata, il noto meccanismo arbitrale (la clausola compromissoria, in caso
di convenzioni che leghino lo Stato inadempiente ad un sistema sovranazionale di salvaguardia dei diritti umani) non assicura
la soluzione dell’altro grave problema dell’indeterminatezza definitoria dei crimini internazionali contro l’umanità. Anche se la
prassi internazionale ormai ne riconosce un certo numero (p.e., le convenzioni siglate da buona parte degli Stati, come quella
sulla tortura o contro l'apartheid, come elencati dall'articolo 7 dello statuto della Corte penale internazionale), diventa facile,
anche in un arbitrato pubblico internazionale di un corte sovranazionale di giustizia, eccepire la violazione del principio “nullum
crimen sine lege”. Analizzeremo, perciò, come ipotesi di lavoro, ma anche come precedente storico, per il concetto di “obbligo
assoluto di condanna” e “giurisdizione universale sui diritti umani”, la Convenzione del 1984 sulla Tortura, dalla quale i “Law
Lords” inglesi ritennero di ricavare il principio della giurisdizione universale nel caso Pinochet. Nel considerare questi fatti
come un avanzamento nella direzione tratteggiata da Kant per la Pace Perpetua Internazionale, si farà riferimento anche alla
lezione di Gaetano Filangieri e alla sua tesi per cui se la ragione è universale, i princípi della legislazione varranno per tutti i
popoli del mondo; e all’ex vice- presidente degli Stati Uniti, Al Gore e alla sua difesa della libertà democratica, dello stato di
diritto e dei diritti umani dai poteri forti delle oligarchie finanziarie interne agli Stati, che ordinariamente ostacolano il sistema
sanzionatorio internazionale alle violazioni dei diritti umani.",TRUE,FALSE,Covid-19|diritti umani|diritto|internazionale|risarcimento|salute|sanzione|sociologia,2020-12-20T02:59:00.980228,NA,,TRUE,accepted,2020-12-20T02:58:42.418228,FALSE,NA,not_applicable,NA,,not_applicable,NA,,,5a8c80f0c698300375c76c07|5a8c80f2c698300375c76c58|Law|Law and Philosophy,,2020,https://api.osf.io/v2/preprints/ex9bq/contributors/,https://api.osf.io/v2/preprints/ex9bq/bibliographic_contributors/,https://api.osf.io/v2/preprints/ex9bq/citation/,ex9bq,preprints,https://api.osf.io/v2/preprints/ex9bq/identifiers/,https://api.osf.io/v2/preprints/ex9bq/relationships/node/,NA,NA,NA,https://api.osf.io/v2/licenses/563c1cf88c5e4a3877f9e96c/,563c1cf88c5e4a3877f9e96c,licenses,https://api.osf.io/v2/providers/preprints/socarxiv/,socarxiv,preprint-providers,https://api.osf.io/v2/preprints/ex9bq/files/,https://api.osf.io/v2/files/5fddfcf3149e750580030351/,5fddfcf3149e750580030351,files,https://api.osf.io/v2/preprints/ex9bq/review_actions/,https://api.osf.io/v2/preprints/ex9bq/requests/,https://api.osf.io/v2/preprints/ex9bq/,https://osf.io/preprints/socarxiv/ex9bq/,NA,https://doi.org/10.31235/osf.io/ex9bq
m5r78,preprints,2020-12-19T07:58:45.417957,2020-12-20T02:49:41.605395,2020-12-20T02:49:14.328093,2020-11-29T23:00:00,NA,Deindustrialization and deaths of despair: mapping the impact of industrial decline on ill health,"A growing literature on deaths of despair has argued that workers’ declining life expectancy in deindustrialized rustbelt areas in the U.S. and the associated deepening of health inequalities signal the profound existential crisis of contemporary capitalism. Competing explanations downplay the negative consequences of “creative destruction” and focus instead on unhealthy lifestyles. This article contributes to this debate by presenting the first empirical analysis of the role of deindustrialization in the deaths of despair epidemic that hit Eastern Europe in the 1990s. Drawing on the thematic analysis of 82 semi-structured interviews in four deindustrialized towns in Hungary, the article constructs a general sociological framework for analyzing deaths of despair applicable to other rustbelt areas. Deindustrialization engenders individual and social processes that affect health by increasing stress and eroding coping resources. By conceptualizing deindustrialization as a fundamental cause of ill health, sociology has great potential to contribute to understanding the root causes of deaths of despair.",TRUE,FALSE,deaths of despair|deindustrialization|fundamental cause|health inequality|psychosocial stress,2020-12-20T02:49:41.582739,NA,,TRUE,accepted,2020-12-20T02:49:14.328093,FALSE,NA,not_applicable,NA,,not_applicable,NA,,,"5a8c80f7c698300375c76d84|5a8c80fac698300375c76e20|5a8c80fac698300375c76e35|Social and Behavioral Sciences|Sociology|Inequality, Poverty, and Mobility|5a8c80f7c698300375c76d84|5a8c80fac698300375c76e20|5a8c80fac698300375c76e3a|Social and Behavioral Sciences|Sociology|Alcohol, Drugs, Tobacco|5a8c80f7c698300375c76d84|5a8c80fac698300375c76e20|5a8c80fac698300375c76e4e|Social and Behavioral Sciences|Sociology|Medical Sociology",,2020,https://api.osf.io/v2/preprints/m5r78/contributors/,https://api.osf.io/v2/preprints/m5r78/bibliographic_contributors/,https://api.osf.io/v2/preprints/m5r78/citation/,m5r78,preprints,https://api.osf.io/v2/preprints/m5r78/identifiers/,https://api.osf.io/v2/preprints/m5r78/relationships/node/,NA,NA,NA,https://api.osf.io/v2/licenses/5ad7979bc69830002d8190e3/,5ad7979bc69830002d8190e3,licenses,https://api.osf.io/v2/providers/preprints/socarxiv/,socarxiv,preprint-providers,https://api.osf.io/v2/preprints/m5r78/files/,https://api.osf.io/v2/files/5fddb2b8149e75058102a807/,5fddb2b8149e75058102a807,files,https://api.osf.io/v2/preprints/m5r78/review_actions/,https://api.osf.io/v2/preprints/m5r78/requests/,https://api.osf.io/v2/preprints/m5r78/,https://osf.io/preprints/socarxiv/m5r78/,NA,https://doi.org/10.31235/osf.io/m5r78
