id,type,attributes.date_created,attributes.date_modified,attributes.date_published,attributes.original_publication_date,attributes.doi,attributes.title,attributes.description,attributes.is_published,attributes.is_preprint_orphan,attributes.tags,attributes.preprint_doi_created,attributes.date_withdrawn,attributes.current_user_permissions,attributes.public,attributes.reviews_state,attributes.date_last_transitioned,attributes.has_coi,attributes.conflict_of_interest_statement,attributes.has_data_links,attributes.why_no_data,attributes.data_links,attributes.has_prereg_links,attributes.why_no_prereg,attributes.prereg_links,attributes.prereg_link_info,attributes.subjects,attributes.license_record.copyright_holders,attributes.license_record.year,relationships.contributors.links.related.href,relationships.bibliographic_contributors.links.related.href,relationships.citation.links.related.href,relationships.citation.data.id,relationships.citation.data.type,relationships.identifiers.links.related.href,relationships.node.links.related.href,relationships.node.links.self.href,relationships.node.data.id,relationships.node.data.type,relationships.license.links.related.href,relationships.license.data.id,relationships.license.data.type,relationships.provider.links.related.href,relationships.provider.data.id,relationships.provider.data.type,relationships.files.links.related.href,relationships.primary_file.links.related.href,relationships.primary_file.data.id,relationships.primary_file.data.type,relationships.review_actions.links.related.href,relationships.requests.links.related.href,links.self,links.html,links.doi,links.preprint_doi
2stw3,preprints,2017-12-29T03:33:22.613123,2018-07-02T11:31:09.582320,2017-12-29T05:19:32.586076,NA,10.24093/awej/vol8no4.20,Using Portfolio as an Alternative Assessment Tool to Enhance Thai EFL  Students’ Writing skill,"This present study investigates the effects of portfolios on the development of English as a foreign language ( EFL) learners’ writing skills. For the purpose of this study 56 senior Thai undergraduate students majoring in Business English at an International University in Thailand were selected and divided into experimental and control groups. Each group, consists of 26 students, both of them were given pretest to ensure the same proficiency level. Throughout the eight weeks in which the experiment was carried, the experimental group was taught through portfolio assessment technique and the control group was taught using the conventional method. Besides, an independent sample t-test was carried out to see the significant differences between the two groups. In order to see the differences within each group, a paired sample t-test was applied. The statistical results showed that there was a significant difference between the experimental and control groups which signifies that those receiving the treatment, in this case, the portfolio based assessment, outperformed their control group counterpart in the area of writing skill.",TRUE,FALSE,EFL writing|portfolio assessment|portfolios,2018-07-02T11:31:09.573538,NA,,TRUE,accepted,2017-12-29T05:19:32.586076,NA,NA,NA,NA,NA,NA,NA,NA,NA,5a8c80f2c698300375c76c7d|5a8c80f5c698300375c76d10|Arts and Humanities|English Language and Literature,,2017,https://api.osf.io/v2/preprints/2stw3/contributors/,https://api.osf.io/v2/preprints/2stw3/bibliographic_contributors/,https://api.osf.io/v2/preprints/2stw3/citation/,2stw3,preprints,https://api.osf.io/v2/preprints/2stw3/identifiers/,https://api.osf.io/v2/nodes/y2ezt/,https://api.osf.io/v2/preprints/2stw3/relationships/node/,y2ezt,nodes,https://api.osf.io/v2/licenses/563c1cf88c5e4a3877f9e96a/,563c1cf88c5e4a3877f9e96a,licenses,https://api.osf.io/v2/providers/preprints/socarxiv/,socarxiv,preprint-providers,https://api.osf.io/v2/preprints/2stw3/files/,https://api.osf.io/v2/files/5a45b781b794960011b1bf95/,5a45b781b794960011b1bf95,files,https://api.osf.io/v2/preprints/2stw3/review_actions/,https://api.osf.io/v2/preprints/2stw3/requests/,https://api.osf.io/v2/preprints/2stw3/,https://osf.io/preprints/socarxiv/2stw3/,https://doi.org/10.24093/awej/vol8no4.20,https://doi.org/10.31235/osf.io/2stw3
68kzj,preprints,2017-12-29T03:25:08.272146,2018-07-02T11:31:09.549122,2017-12-29T05:19:55.281803,NA,10.24093/awej/vol8no4.19,Mind Mapping and Students' Writing Performance,"This study examines the potential effect of mind mapping strategy on developing Jordanian students' writing performance. The researchers claim that mind mapping strategy has the potential to improve Jordanian students' writing performance. The study follows a quasi- experimental design in which an experimental group and a control group were purposefully chosen from eleventh grade students at Al Hashymiah School for Boys, Zarqa in Jordan during the second semester of the academic year 2016/2017. In the experimental group, 20 students were taught by mind mapping strategy and 20 students of control group were taught by the conventional teaching method as outlined in the Teacher’s Book. To collect the data, a pre-test and a post-test was utilized. ANCOVA was used to measure statistical differences in the mean scores of the participants of the study. The findings reveal statistically significant differences (at α≤0.05) between the two mean scores of experimental and control groups in the post- test in favor of experimental group. The study recommends an integration of the mind mapping strategy into the English as a foreign Language (EFL) curriculum in Jordan as it facilitates developing students' writing skill. The study also recommends  to examine the effect of using mind mapping strategy on EFL students' achievements in other language skills and sub skills. Teachers are also advised to use the mind mapping strategy to increase students’ interest and motivation to write more often",TRUE,FALSE,EFL students|Jordan|mind mapping|writing performance,2018-07-02T11:31:09.540296,NA,,TRUE,accepted,2017-12-29T05:19:55.281803,NA,NA,NA,NA,NA,NA,NA,NA,NA,5a8c80f2c698300375c76c7d|5a8c80f5c698300375c76d10|Arts and Humanities|English Language and Literature,,2017,https://api.osf.io/v2/preprints/68kzj/contributors/,https://api.osf.io/v2/preprints/68kzj/bibliographic_contributors/,https://api.osf.io/v2/preprints/68kzj/citation/,68kzj,preprints,https://api.osf.io/v2/preprints/68kzj/identifiers/,https://api.osf.io/v2/nodes/7k25p/,https://api.osf.io/v2/preprints/68kzj/relationships/node/,7k25p,nodes,https://api.osf.io/v2/licenses/563c1cf88c5e4a3877f9e96a/,563c1cf88c5e4a3877f9e96a,licenses,https://api.osf.io/v2/providers/preprints/socarxiv/,socarxiv,preprint-providers,https://api.osf.io/v2/preprints/68kzj/files/,https://api.osf.io/v2/files/5a45b593b794960011b1befc/,5a45b593b794960011b1befc,files,https://api.osf.io/v2/preprints/68kzj/review_actions/,https://api.osf.io/v2/preprints/68kzj/requests/,https://api.osf.io/v2/preprints/68kzj/,https://osf.io/preprints/socarxiv/68kzj/,https://doi.org/10.24093/awej/vol8no4.19,https://doi.org/10.31235/osf.io/68kzj
eygmw,preprints,2017-12-29T03:20:49.819321,2018-07-02T11:31:09.516261,2017-12-29T05:20:19.590024,NA,10.24093/awej/vol8no4.18,An Analysis of Algerian Manufacturing and Engineering Master’s Students’ Needs,"Needs analysis is considered as an effective tool to design a course of English for Specific Purposes (ESP) that best fits the students’ needs. Thus, the present paper responds to a main research question focuses on what the Algerian Manufacturing and Engineering Master’s students need English for. It aims at investigating the students’ language needs and identifying the stakeholders’ perceptions of the ESP course. For this purpose, this research is based on a case study design through which a target situation, a present situation, a learner factor and teaching content analyses were undertaken. In fact, this is done in order to help teachers and education leaders in Algeria to draw a clear policy to ensure successful implementation of ESP courses. Two questionnaires and two semi-structured interviews were addressed to Algerian Engineering Master’s students, English language teachers, subject-specialists and administrators. The results revealed that Engineering students were highly motivated to learn English. They also indicated that there is an absence of an adequate proficiency level of English from the part of the students as they are unable to practice effectively the four skills namely listening, speaking, and communication. This is why they need to learn English in order to write exam answer, read textbooks, course handouts, follow lectures, and listen to instructions and explanations. Finally, designing a more focused English language course, training teachers, and providing financial support are highly recommended.",TRUE,FALSE,English for Specific Purposes (ESP)|Manufacturing and Engineering students|needs analysis|present situation|target situation,2018-07-02T11:31:09.506935,NA,,TRUE,accepted,2017-12-29T05:20:19.590024,NA,NA,NA,NA,NA,NA,NA,NA,NA,5a8c80f2c698300375c76c7d|5a8c80f5c698300375c76d10|Arts and Humanities|English Language and Literature,,2017,https://api.osf.io/v2/preprints/eygmw/contributors/,https://api.osf.io/v2/preprints/eygmw/bibliographic_contributors/,https://api.osf.io/v2/preprints/eygmw/citation/,eygmw,preprints,https://api.osf.io/v2/preprints/eygmw/identifiers/,https://api.osf.io/v2/nodes/k7tn8/,https://api.osf.io/v2/preprints/eygmw/relationships/node/,k7tn8,nodes,https://api.osf.io/v2/licenses/563c1cf88c5e4a3877f9e96a/,563c1cf88c5e4a3877f9e96a,licenses,https://api.osf.io/v2/providers/preprints/socarxiv/,socarxiv,preprint-providers,https://api.osf.io/v2/preprints/eygmw/files/,https://api.osf.io/v2/files/5a45b49167d19e000c6aade3/,5a45b49167d19e000c6aade3,files,https://api.osf.io/v2/preprints/eygmw/review_actions/,https://api.osf.io/v2/preprints/eygmw/requests/,https://api.osf.io/v2/preprints/eygmw/,https://osf.io/preprints/socarxiv/eygmw/,https://doi.org/10.24093/awej/vol8no4.18,https://doi.org/10.31235/osf.io/eygmw
d7jcf,preprints,2017-12-29T03:16:47.749970,2018-07-02T11:31:09.483325,2017-12-29T05:20:55.367555,NA,10.24093/awej/vol8no4.17,Perceiving Native English Speaking Teachers: EFL University Students’ Perspectives,"To allude to the ‘native speaker’ concept and investigate the native speaker effects, this research looks into the perceptions of 25 Thai EFL university students towards native English speaking teachers. How native English speaking teachers influence the participants’ learning behaviours and motivation to learn English are also perceptually reported. Two research instruments, the survey questionnaire and the semi-structured interview, are employed for this study. The findings indicate overall positive perceptions towards native English speaking teachers, pointing that their classes are mostly fun, interactive and motivating. The flexible and interactive teaching methods and styles used by native English speaking teachers are found to be most favoured, followed by their approachable personality traits and the students’ vast opportunity to practice oral and written English. Most participants, if given an option to choose a teacher, have a salient preference to study with native English speaking teachers in which case neither teachers’ age nor gender matters. There seems to be a strong relationship between studying with native English speaking teachers and the participants’ learning behaviours and motivation to learn English.",TRUE,FALSE,EFL|Learning Behaviours|Native English Speaking Teachers|Perceptions|University Students,2018-07-02T11:31:09.474184,NA,,TRUE,accepted,2017-12-29T05:20:55.367555,NA,NA,NA,NA,NA,NA,NA,NA,NA,5a8c80f2c698300375c76c7d|5a8c80f5c698300375c76d10|Arts and Humanities|English Language and Literature,,2017,https://api.osf.io/v2/preprints/d7jcf/contributors/,https://api.osf.io/v2/preprints/d7jcf/bibliographic_contributors/,https://api.osf.io/v2/preprints/d7jcf/citation/,d7jcf,preprints,https://api.osf.io/v2/preprints/d7jcf/identifiers/,https://api.osf.io/v2/nodes/9hrgj/,https://api.osf.io/v2/preprints/d7jcf/relationships/node/,9hrgj,nodes,https://api.osf.io/v2/licenses/563c1cf88c5e4a3877f9e96a/,563c1cf88c5e4a3877f9e96a,licenses,https://api.osf.io/v2/providers/preprints/socarxiv/,socarxiv,preprint-providers,https://api.osf.io/v2/preprints/d7jcf/files/,https://api.osf.io/v2/files/5a45b39f67d19e000d6c6f02/,5a45b39f67d19e000d6c6f02,files,https://api.osf.io/v2/preprints/d7jcf/review_actions/,https://api.osf.io/v2/preprints/d7jcf/requests/,https://api.osf.io/v2/preprints/d7jcf/,https://osf.io/preprints/socarxiv/d7jcf/,https://doi.org/10.24093/awej/vol8no4.17,https://doi.org/10.31235/osf.io/d7jcf
3rycz,preprints,2017-12-29T03:07:46.978746,2018-07-02T11:31:09.441878,2017-12-29T05:21:30.845849,NA,10.24093/awej/vol8no4.16,The Significance of Teacher Leadership in TESOL: A Theoretical Perspective,"This paper reviews literature on the notion of teacher leadership to ascertain what skills, knowledge and competencies teachers require to assume leadership roles in educational institutions. The historical evolution of teacher leadership through various phases gives useful insights into how this concept has emerged, developed and perceived in different educational contexts and how it appears in today’s institutions around the world. The definitions of teacher leadership delineate various features of teachers’ roles, responsibilities and their expected contribution to organisational effectiveness while operating in a wide range of formal and informal leadership roles. Review of the literature also shows the significance of leadership knowledge and skills for the academic leadership positions that need to be fostered in a school context.  Moreover, it highlights factors that might hinder the emergence of teacher leadership in academic institutions. The last section of this paper indicates a void in the literature on the issue of teacher leadership in the field of Teaching of English to the Speakers of Other Languages (TESOL) that also directs researchers’ endeavours towards investigating this concept in the context of English language teaching.",TRUE,FALSE,Leadership knowledge and skills|teacher leadership in TESOL|teacher leadership roles,2018-07-02T11:31:09.429088,NA,,TRUE,accepted,2017-12-29T05:21:30.845849,NA,NA,NA,NA,NA,NA,NA,NA,NA,5a8c80f2c698300375c76c7d|5a8c80f5c698300375c76d10|Arts and Humanities|English Language and Literature,,2017,https://api.osf.io/v2/preprints/3rycz/contributors/,https://api.osf.io/v2/preprints/3rycz/bibliographic_contributors/,https://api.osf.io/v2/preprints/3rycz/citation/,3rycz,preprints,https://api.osf.io/v2/preprints/3rycz/identifiers/,https://api.osf.io/v2/nodes/er3ba/,https://api.osf.io/v2/preprints/3rycz/relationships/node/,er3ba,nodes,https://api.osf.io/v2/licenses/563c1cf88c5e4a3877f9e96a/,563c1cf88c5e4a3877f9e96a,licenses,https://api.osf.io/v2/providers/preprints/socarxiv/,socarxiv,preprint-providers,https://api.osf.io/v2/preprints/3rycz/files/,https://api.osf.io/v2/files/5a45b182b794960013afc6c7/,5a45b182b794960013afc6c7,files,https://api.osf.io/v2/preprints/3rycz/review_actions/,https://api.osf.io/v2/preprints/3rycz/requests/,https://api.osf.io/v2/preprints/3rycz/,https://osf.io/preprints/socarxiv/3rycz/,https://doi.org/10.24093/awej/vol8no4.16,https://doi.org/10.31235/osf.io/3rycz
v4b56,preprints,2017-12-29T03:03:27.898064,2018-07-02T11:31:09.403530,2017-12-29T05:23:06.441590,NA,10.24093/awej/vol8no4.15,Post-Class Reflections of English Language Lecturers Working at a Kazakhstani University,"This study describes post-class reflections of 10 English language lecturers working at a university located in Almaty, Kazakhstan in order to learn more about their perceptions of reflection in education and different ways they engage with teacher reflections after conducting their English as a foreign language (EFL) classes. The research design utilized multiple semi-structured, recorded interviews. The participants’ responses were grouped and analyzed through a reflection framework comprised by Hatton and Smith (1995), which discusses four types of reflections: technical, descriptive, dialogic, and critical. The findings revealed that most participants understood the concept of reflection in education similarly rather than differently. Second, the results showed that the most frequently produced single reflection type was descriptive, followed by technical, dialogic and critical. Overall, all 10 participants produced different single as well as hybrid reflection types, which was a rather important finding of this study as hybrid reflections have not yet been thoroughly explored in the research literature. The use of hybrid reflections also indicated that reflective thinking is not a linear process that can be easily categorized based on a certain reflection type. Third, the study describes a few characteristics of highly and less reflective participants. The main teaching implication entails a need for the organization of seminars focused on introducing and exploring the impact of different types of reflections on EFL teaching in higher education.",TRUE,FALSE,education|English|reflection|teacher|university,2018-07-02T11:31:09.394051,NA,,TRUE,accepted,2017-12-29T05:23:06.441590,NA,NA,NA,NA,NA,NA,NA,NA,NA,5a8c80f2c698300375c76c7d|5a8c80f5c698300375c76d10|Arts and Humanities|English Language and Literature,,2017,https://api.osf.io/v2/preprints/v4b56/contributors/,https://api.osf.io/v2/preprints/v4b56/bibliographic_contributors/,https://api.osf.io/v2/preprints/v4b56/citation/,v4b56,preprints,https://api.osf.io/v2/preprints/v4b56/identifiers/,https://api.osf.io/v2/nodes/qhs3c/,https://api.osf.io/v2/preprints/v4b56/relationships/node/,qhs3c,nodes,https://api.osf.io/v2/licenses/563c1cf88c5e4a3877f9e96a/,563c1cf88c5e4a3877f9e96a,licenses,https://api.osf.io/v2/providers/preprints/socarxiv/,socarxiv,preprint-providers,https://api.osf.io/v2/preprints/v4b56/files/,https://api.osf.io/v2/files/5a45b07e67d19e000d6c6d69/,5a45b07e67d19e000d6c6d69,files,https://api.osf.io/v2/preprints/v4b56/review_actions/,https://api.osf.io/v2/preprints/v4b56/requests/,https://api.osf.io/v2/preprints/v4b56/,https://osf.io/preprints/socarxiv/v4b56/,https://doi.org/10.24093/awej/vol8no4.15,https://doi.org/10.31235/osf.io/v4b56
nt9g2,preprints,2017-12-29T02:09:44.128606,2018-07-02T11:31:09.336007,2017-12-29T05:26:10.914789,NA,10.24093/awej/vol8no4.12,Using Habits of Mind to Develop EFL Writing Skills and Autonomy,The main purpose of this study was to determine the impact of habits of mind (HoM) based strategies on students’ writing skills and autonomy. Questions formulated to achieve the purpose of the study focused on. (1) Determining the habits of mind suitable for EFL students. (2) Finding out differences in both English as a foreign language (EFL) students’ writing performance test regarding experimental and control group. (3) Finding out differences in both EFL students’ autonomy scale of experimental and control group. Thirty three EFL students constituted the sample for this study and four instruments-designed by the researchers- were used for data collection. Results indicated that students of experimental group outperformed their counterparts of the control group in EFL writing performance test and autonomy scale scores. The effect of using HoM on students writing skills and autonomy was profound and significant.,TRUE,FALSE,Autonomy|EFL Writing Skills|Habits of Mind,2018-07-02T11:31:09.326684,NA,,TRUE,accepted,2017-12-29T05:26:10.914789,NA,NA,NA,NA,NA,NA,NA,NA,NA,5a8c80f2c698300375c76c7d|5a8c80f5c698300375c76d10|Arts and Humanities|English Language and Literature,,2017,https://api.osf.io/v2/preprints/nt9g2/contributors/,https://api.osf.io/v2/preprints/nt9g2/bibliographic_contributors/,https://api.osf.io/v2/preprints/nt9g2/citation/,nt9g2,preprints,https://api.osf.io/v2/preprints/nt9g2/identifiers/,https://api.osf.io/v2/nodes/mw7yb/,https://api.osf.io/v2/preprints/nt9g2/relationships/node/,mw7yb,nodes,https://api.osf.io/v2/licenses/563c1cf88c5e4a3877f9e96a/,563c1cf88c5e4a3877f9e96a,licenses,https://api.osf.io/v2/providers/preprints/socarxiv/,socarxiv,preprint-providers,https://api.osf.io/v2/preprints/nt9g2/files/,https://api.osf.io/v2/files/5a45a3e767d19e000d6c6892/,5a45a3e767d19e000d6c6892,files,https://api.osf.io/v2/preprints/nt9g2/review_actions/,https://api.osf.io/v2/preprints/nt9g2/requests/,https://api.osf.io/v2/preprints/nt9g2/,https://osf.io/preprints/socarxiv/nt9g2/,https://doi.org/10.24093/awej/vol8no4.12,https://doi.org/10.31235/osf.io/nt9g2
3hn4c,preprints,2017-12-29T02:05:08.299755,2018-07-02T11:31:09.301385,2017-12-29T05:26:39.125746,NA,10.24093/awej/vol8no4.11,Integrating Local Knowledge into Language Learning: A Study on the Your Language My Culture (YLMC) Project,"Language and culture share a nebulous relationship with multiple considerations like which culture and how it should be represented, taking into account the diverse contexts in which English is taught. This paper investigates the integration of local knowledge into English language learning by examining the cultural content of the Your Language My Culture supplementary reading module and teachers and students’ acceptance of the module. Using a conceptual framework that incorporated types of culture, cultural senses and representation of cultural information, data were collected using a questionnaire, reflective blogs and evaluation checklists from 57 teachers from various schools in the state of Terengganu in Malaysia. Content and thematic analysis were carried out and the findings show that while local, target and international culture were represented, the emphasis was towards local culture. Most of the cultural information was represented in the form of visual illustrations and less in dialogue and video recordings with the aesthetic sense dominating in terms of cultural sense. It is recommended that types of representations like dialogues, recordings, written tasks, visuals, texts and realia be included to help students attain pragmatic skills to use the language. A richer inclusion of the cultural senses in a balanced way can help students reach a holistic understanding of culture and recognize different perspectives embedded in the language.",TRUE,FALSE,cultural representations|cultural senses|language learning|local knowledge|types of culture,2018-07-02T11:31:09.291484,NA,,TRUE,accepted,2017-12-29T05:26:39.125746,NA,NA,NA,NA,NA,NA,NA,NA,NA,5a8c80f2c698300375c76c7d|5a8c80f5c698300375c76d10|Arts and Humanities|English Language and Literature,,2017,https://api.osf.io/v2/preprints/3hn4c/contributors/,https://api.osf.io/v2/preprints/3hn4c/bibliographic_contributors/,https://api.osf.io/v2/preprints/3hn4c/citation/,3hn4c,preprints,https://api.osf.io/v2/preprints/3hn4c/identifiers/,https://api.osf.io/v2/nodes/jec4t/,https://api.osf.io/v2/preprints/3hn4c/relationships/node/,jec4t,nodes,https://api.osf.io/v2/licenses/563c1cf88c5e4a3877f9e96a/,563c1cf88c5e4a3877f9e96a,licenses,https://api.osf.io/v2/providers/preprints/socarxiv/,socarxiv,preprint-providers,https://api.osf.io/v2/preprints/3hn4c/files/,https://api.osf.io/v2/files/5a45a2d3b794960012aff47c/,5a45a2d3b794960012aff47c,files,https://api.osf.io/v2/preprints/3hn4c/review_actions/,https://api.osf.io/v2/preprints/3hn4c/requests/,https://api.osf.io/v2/preprints/3hn4c/,https://osf.io/preprints/socarxiv/3hn4c/,https://doi.org/10.24093/awej/vol8no4.11,https://doi.org/10.31235/osf.io/3hn4c
