id,type,attributes.date_created,attributes.date_modified,attributes.date_published,attributes.original_publication_date,attributes.doi,attributes.title,attributes.description,attributes.is_published,attributes.is_preprint_orphan,attributes.tags,attributes.preprint_doi_created,attributes.date_withdrawn,attributes.current_user_permissions,attributes.public,attributes.reviews_state,attributes.date_last_transitioned,attributes.has_coi,attributes.conflict_of_interest_statement,attributes.has_data_links,attributes.why_no_data,attributes.data_links,attributes.has_prereg_links,attributes.why_no_prereg,attributes.prereg_links,attributes.prereg_link_info,attributes.subjects,attributes.license_record.copyright_holders,attributes.license_record.year,relationships.contributors.links.related.href,relationships.bibliographic_contributors.links.related.href,relationships.citation.links.related.href,relationships.citation.data.id,relationships.citation.data.type,relationships.identifiers.links.related.href,relationships.node.links.related.href,relationships.node.links.self.href,relationships.node.data.id,relationships.node.data.type,relationships.license.links.related.href,relationships.license.data.id,relationships.license.data.type,relationships.provider.links.related.href,relationships.provider.data.id,relationships.provider.data.type,relationships.files.links.related.href,relationships.primary_file.links.related.href,relationships.primary_file.data.id,relationships.primary_file.data.type,relationships.review_actions.links.related.href,relationships.requests.links.related.href,links.self,links.html,links.doi,links.preprint_doi
q2mxt,preprints,2017-12-13T15:25:03.756041,2018-07-02T11:29:44.665127,2017-12-13T16:55:50.843211,NA,10.1016/j.jebo.2016.07.004,"Negative Emotions, Income, and Welfare: Causal Estimates from the PSID","I use instrumental variables to estimate the causal effect of family income on the frequency with which individuals experience negative emotions. Doubling income reduces the experience of negative emotions by 0.26 SD on average. Percentage changes in income have a constant effect on negative emotion for family incomes below $80,000. Above $80,000, the effect of percentage changes declines, reaching zero at $200,000. A dollar change in family income has an eight times larger effect at the 20th percentile of income than the 80th percentile. Effects of income are similar on the high levels of negative emotion characteristic of mental illness, except there is no satiation.",TRUE,FALSE,affect|emotion|income|mental illness|welfare|well-being,2018-07-02T11:29:44.653878,NA,,TRUE,accepted,2017-12-13T16:55:50.843211,NA,NA,NA,NA,NA,NA,NA,NA,NA,5a8c80f7c698300375c76d84|5a8c80f8c698300375c76dbe|5a8c80f8c698300375c76dc5|Social and Behavioral Sciences|Economics|Behavioral Economics|5a8c80f7c698300375c76d84|5a8c80f8c698300375c76dbe|5a8c80f8c698300375c76dce|Social and Behavioral Sciences|Economics|Public Economics,,2017,https://api.osf.io/v2/preprints/q2mxt/contributors/,https://api.osf.io/v2/preprints/q2mxt/bibliographic_contributors/,https://api.osf.io/v2/preprints/q2mxt/citation/,q2mxt,preprints,https://api.osf.io/v2/preprints/q2mxt/identifiers/,https://api.osf.io/v2/nodes/ym4a2/,https://api.osf.io/v2/preprints/q2mxt/relationships/node/,ym4a2,nodes,https://api.osf.io/v2/licenses/563c1cf88c5e4a3877f9e96a/,563c1cf88c5e4a3877f9e96a,licenses,https://api.osf.io/v2/providers/preprints/socarxiv/,socarxiv,preprint-providers,https://api.osf.io/v2/preprints/q2mxt/files/,https://api.osf.io/v2/files/5a31464ffdec39000f61aa05/,5a31464ffdec39000f61aa05,files,https://api.osf.io/v2/preprints/q2mxt/review_actions/,https://api.osf.io/v2/preprints/q2mxt/requests/,https://api.osf.io/v2/preprints/q2mxt/,https://osf.io/preprints/socarxiv/q2mxt/,https://doi.org/10.1016/j.jebo.2016.07.004,https://doi.org/10.31235/osf.io/q2mxt
yzpvf,preprints,2017-12-13T15:12:50.280065,2018-07-02T11:29:44.626673,2017-12-13T16:56:17.707490,NA,10.1287/mnsc.2017.2882,Training Aspiring Entrepreneurs to Pitch Experienced Investors: Evidence from a Field Experiment in the United States,"Accredited investors finance more than 75,000 U.S. start-ups annually. We explain how training aspiring entrepreneurs to pitch their new business ideas to these investors affects their odds of continued funding discussions. We model accredited investors’ decision to continue investigation as a real option whose value is a function of their experience and the information contained in the entrepreneurs’ pitches. We derive four hypotheses from the model, which we test through a field experiment that randomly assigns pitch training at four elevator pitch competitions. The data support all four hypotheses, and are inconsistent with alternative explanations.",TRUE,FALSE,entrepreneurship|experiment|investment|pitching|start-ups|training,2018-07-02T11:29:44.613851,NA,,TRUE,accepted,2017-12-13T16:56:17.707490,NA,NA,NA,NA,NA,NA,NA,NA,NA,5a8c80f7c698300375c76d84|5a8c80f7c698300375c76d96|Social and Behavioral Sciences|Other Social and Behavioral Sciences|5a8c80f7c698300375c76d84|5a8c80f8c698300375c76dbe|5a8c80f8c698300375c76dbf|Social and Behavioral Sciences|Economics|Finance,David Clingingsmith|Scott Shane,2017,https://api.osf.io/v2/preprints/yzpvf/contributors/,https://api.osf.io/v2/preprints/yzpvf/bibliographic_contributors/,https://api.osf.io/v2/preprints/yzpvf/citation/,yzpvf,preprints,https://api.osf.io/v2/preprints/yzpvf/identifiers/,https://api.osf.io/v2/nodes/d79fm/,https://api.osf.io/v2/preprints/yzpvf/relationships/node/,d79fm,nodes,https://api.osf.io/v2/licenses/563c1cf88c5e4a3877f9e96a/,563c1cf88c5e4a3877f9e96a,licenses,https://api.osf.io/v2/providers/preprints/socarxiv/,socarxiv,preprint-providers,https://api.osf.io/v2/preprints/yzpvf/files/,https://api.osf.io/v2/files/5a314371fdec39000c61bbfe/,5a314371fdec39000c61bbfe,files,https://api.osf.io/v2/preprints/yzpvf/review_actions/,https://api.osf.io/v2/preprints/yzpvf/requests/,https://api.osf.io/v2/preprints/yzpvf/,https://osf.io/preprints/socarxiv/yzpvf/,https://doi.org/10.1287/mnsc.2017.2882,https://doi.org/10.31235/osf.io/yzpvf
f5h4w,preprints,2017-12-13T15:02:30.478235,2019-08-21T16:37:51.388342,2017-12-13T16:57:04.456972,NA,10.1007/s40881-019-00072-2,Mental Accounts and the Marginal Propensity to Give,"Neoclassical theory holds that different sources of income are fungible at the margin. In contrast, mental accounting holds that appropriate uses for income vary by source, making them infungible. This study investigates which theory better describes giving at the margin when income may have multiple sources. Dictators accrue differing amounts of (1) earned income from a real-effort task, (2) windfall income, or (3) both. I find that dictators treat marginal earned and windfall income as partially infungible, supporting mental accounting. Dictators who had a single income source gave 14% of a marginal windfall token and 5% of a marginal earned token. Strikingly, dictators who had income from both sources were sharply less generous with each, giving only 2% and 1%, respectively. Multiple accounts enabled greater selfishness at the margin. A follow-up experiment shows that two accounts must be qualitatively different, not just multiple in number, to produce this effect.",TRUE,FALSE,dictator game|field experiment|mental accounts|social preferences,2018-07-02T11:29:44.567616,NA,,TRUE,accepted,2017-12-13T16:57:04.456972,NA,NA,NA,NA,NA,NA,NA,NA,NA,5a8c80f7c698300375c76d84|5a8c80f8c698300375c76dbe|5a8c80f8c698300375c76dc5|Social and Behavioral Sciences|Economics|Behavioral Economics|5a8c80f7c698300375c76d84|5a8c80f8c698300375c76dbe|5a8c80f8c698300375c76dce|Social and Behavioral Sciences|Economics|Public Economics,David Clingingsmith,2017,https://api.osf.io/v2/preprints/f5h4w/contributors/,https://api.osf.io/v2/preprints/f5h4w/bibliographic_contributors/,https://api.osf.io/v2/preprints/f5h4w/citation/,f5h4w,preprints,https://api.osf.io/v2/preprints/f5h4w/identifiers/,https://api.osf.io/v2/nodes/jwqkf/,https://api.osf.io/v2/preprints/f5h4w/relationships/node/,jwqkf,nodes,https://api.osf.io/v2/licenses/563c1cf88c5e4a3877f9e965/,563c1cf88c5e4a3877f9e965,licenses,https://api.osf.io/v2/providers/preprints/socarxiv/,socarxiv,preprint-providers,https://api.osf.io/v2/preprints/f5h4w/files/,https://api.osf.io/v2/files/5a314105ba26c6000c17c0c9/,5a314105ba26c6000c17c0c9,files,https://api.osf.io/v2/preprints/f5h4w/review_actions/,https://api.osf.io/v2/preprints/f5h4w/requests/,https://api.osf.io/v2/preprints/f5h4w/,https://osf.io/preprints/socarxiv/f5h4w/,https://doi.org/10.1007/s40881-019-00072-2,https://doi.org/10.31235/osf.io/f5h4w
75zhc,preprints,2017-12-13T01:38:17.293807,2018-07-02T11:28:50.978940,2017-12-13T14:51:56.049764,NA,NA,History and Practice of Archaeology in Laos,"As the smallest and only landlocked country of Southeast Asia, the history and practice of archaeology in the Lao People's Democratic Republic (hereafter Laos) has been strongly influenced by activities of its neighbours, especially Vietnam. The earliest mentions of Laos in western archaeological literature are due to the activities of the French government in Indochina (Laos, Cambodia, and Vietnam), specifically the Geological Service of Indochina and the École Française d’Extrême-Orient. By the 1930s publications were appearing by GSA and EFEO officials that indicated a cultural chronology from the Late Pleistocene (Tam Hang - Arambourg and Fromaget, 1938) through to the late Holocene (The Plain of Jars - Colani, 1932). The history of these early French archaeologists has been well described elsewhere (Malleret, 1969, Saurin, 1971, White and Bouasisengpaseuth, 2008), here we will concentrate on how that work, and more recent research, has added to our current understanding of the origins, behavior, and identities of the prehistoric human populations of Laos, as well as their biological, linguistic and cultural diversity and commonalities.",TRUE,FALSE,archaeology|Laos|Southeast Asia,2018-07-02T11:28:50.968161,NA,,TRUE,accepted,2017-12-13T14:51:56.049764,NA,NA,NA,NA,NA,NA,NA,NA,NA,"5a8c80f2c698300375c76c7d|5a8c80f4c698300375c76ccc|5a8c80f4c698300375c76ccf|Arts and Humanities|History|Asian History|5a8c80f2c698300375c76c7d|5a8c80f4c698300375c76ccc|5a8c80f4c698300375c76cd6|Arts and Humanities|History|History of Science, Technology, and Medicine|5a8c80f7c698300375c76d84|5a8c80f9c698300375c76df6|5a8c80f9c698300375c76dfb|Social and Behavioral Sciences|Anthropology|Archaeological Anthropology",,2017,https://api.osf.io/v2/preprints/75zhc/contributors/,https://api.osf.io/v2/preprints/75zhc/bibliographic_contributors/,https://api.osf.io/v2/preprints/75zhc/citation/,75zhc,preprints,https://api.osf.io/v2/preprints/75zhc/identifiers/,https://api.osf.io/v2/nodes/dtrj3/,https://api.osf.io/v2/preprints/75zhc/relationships/node/,dtrj3,nodes,https://api.osf.io/v2/licenses/563c1cf88c5e4a3877f9e96a/,563c1cf88c5e4a3877f9e96a,licenses,https://api.osf.io/v2/providers/preprints/socarxiv/,socarxiv,preprint-providers,https://api.osf.io/v2/preprints/75zhc/files/,https://api.osf.io/v2/files/5a3084870f8f53000e48d3cc/,5a3084870f8f53000e48d3cc,files,https://api.osf.io/v2/preprints/75zhc/review_actions/,https://api.osf.io/v2/preprints/75zhc/requests/,https://api.osf.io/v2/preprints/75zhc/,https://osf.io/preprints/socarxiv/75zhc/,NA,https://doi.org/10.31235/osf.io/75zhc
mh8zg,preprints,2017-12-12T20:01:43.623547,2018-07-02T11:28:50.846727,2017-12-13T14:51:14.136951,NA,NA,Trajectories of Poverty and Economic Hardship among American Families Supporting a Child with a Neurodisability,"Caring for a child with a neurodisability (ND) impacts the financial decisions, relationships, and well-being of family members. Using the Panel Study of Income Dynamics (PSID), we tracked families from 5 years before child with ND birth until the child reached 20 years of age and used latent growth curve modeling to estimate different trajectories for risk of two indicators: poverty and economic hardship. In bivariate terms, families raising a child with ND had higher risks of poverty and economic hardship across time. Five latent growth trajectories were identified for each indicator. After controlling for family and caregiver characteristics that preceded the birth of the child with an ND, families raising a child with a ND were more likely to experience persistent economic hardship. However, raising a child with a ND was not associated with a unique poverty risk, suggesting that families already in poverty are more likely to remain poor if they have a child with a ND. The study establishes descriptive evidence for how having a child with a ND relates to changes in family economic conditions. The importance of social and economic conditions that precede the child’s birth lend support for a social causation framework of health inequalities.",TRUE,FALSE,disability|economic hardship|neurodisability|poverty,2018-07-02T11:28:50.837779,NA,,TRUE,accepted,2017-12-13T14:51:14.136951,NA,NA,NA,NA,NA,NA,NA,NA,NA,5a8c80f7c698300375c76d84|5a8c80f7c698300375c76d96|Social and Behavioral Sciences|Other Social and Behavioral Sciences,,2017,https://api.osf.io/v2/preprints/mh8zg/contributors/,https://api.osf.io/v2/preprints/mh8zg/bibliographic_contributors/,https://api.osf.io/v2/preprints/mh8zg/citation/,mh8zg,preprints,https://api.osf.io/v2/preprints/mh8zg/identifiers/,https://api.osf.io/v2/nodes/398qj/,https://api.osf.io/v2/preprints/mh8zg/relationships/node/,398qj,nodes,https://api.osf.io/v2/licenses/563c1cf88c5e4a3877f9e96a/,563c1cf88c5e4a3877f9e96a,licenses,https://api.osf.io/v2/providers/preprints/socarxiv/,socarxiv,preprint-providers,https://api.osf.io/v2/preprints/mh8zg/files/,https://api.osf.io/v2/files/5a3035a60f8f5300114857e5/,5a3035a60f8f5300114857e5,files,https://api.osf.io/v2/preprints/mh8zg/review_actions/,https://api.osf.io/v2/preprints/mh8zg/requests/,https://api.osf.io/v2/preprints/mh8zg/,https://osf.io/preprints/socarxiv/mh8zg/,NA,https://doi.org/10.31235/osf.io/mh8zg
a4qvk,preprints,2017-12-12T16:45:19.328004,2018-07-02T11:28:50.779309,2017-12-12T20:05:16.862762,NA,NA,Birds of a Feather Succeed Together? Racial Residential Segregation and Educational Attainment,"Is racial residential segregation or integration a stronger predictor of educational attainment? Does the racialized direction of this relationship matter? Drawing from Wilson’s (1987) social isolation theory and Massey and Denton’s (1993) theory of racial segregation and poor neighborhood formation, I propose that 1) greater residential racial homogeneity and 2) greater white residential segregation will increase average educational attainment at the county level. I analyze data from the 2016 County Health Rankings and Roadmaps along with the 5-year 2011-2015 American Community Survey, both of which yield a total population size of 3,141 counties. The study reveals that the impact of residential segregation on academic achievement is indeed racialized: white residential segregation most strongly affects county percent high school graduation. General residential segregation, however, is positively and significantly related to high school and graduate/PhD degree level completion. Nevertheless, median household income and county rurality are consistently the strongest predictors of high school and graduate/PhD completion across four regression models. While these results confirm both hypotheses, they highlight the strength of alternative explanations for educational gaps in the United States—gaps that may be more directly tied to social capital and rurality. The findings suggest that policies intending to alleviate disparities in educational attainment cannot center segregation alone, they must also offer a broader solution to social isolation and resource deprivation patterns by targeting counties with lower median household incomes and greater rurality.",TRUE,FALSE,education|income inequality|residential segregation,2018-07-02T11:28:50.771164,NA,,TRUE,accepted,2017-12-12T20:05:16.862762,NA,NA,NA,NA,NA,NA,NA,NA,NA,"5a8c80f7c698300375c76d84|5a8c80fac698300375c76e20|5a8c80fac698300375c76e26|Social and Behavioral Sciences|Sociology|Sociology of Education|5a8c80f7c698300375c76d84|5a8c80fac698300375c76e20|5a8c80fac698300375c76e35|Social and Behavioral Sciences|Sociology|Inequality, Poverty, and Mobility|5a8c80f7c698300375c76d84|5a8c80fac698300375c76e20|5a8c80fac698300375c76e44|Social and Behavioral Sciences|Sociology|Race, Gender, and Class",,2017,https://api.osf.io/v2/preprints/a4qvk/contributors/,https://api.osf.io/v2/preprints/a4qvk/bibliographic_contributors/,https://api.osf.io/v2/preprints/a4qvk/citation/,a4qvk,preprints,https://api.osf.io/v2/preprints/a4qvk/identifiers/,https://api.osf.io/v2/nodes/qe3gf/,https://api.osf.io/v2/preprints/a4qvk/relationships/node/,qe3gf,nodes,https://api.osf.io/v2/licenses/563c1cf88c5e4a3877f9e96c/,563c1cf88c5e4a3877f9e96c,licenses,https://api.osf.io/v2/providers/preprints/socarxiv/,socarxiv,preprint-providers,https://api.osf.io/v2/preprints/a4qvk/files/,https://api.osf.io/v2/files/5a30079e9da410000feb014d/,5a30079e9da410000feb014d,files,https://api.osf.io/v2/preprints/a4qvk/review_actions/,https://api.osf.io/v2/preprints/a4qvk/requests/,https://api.osf.io/v2/preprints/a4qvk/,https://osf.io/preprints/socarxiv/a4qvk/,NA,https://doi.org/10.31235/osf.io/a4qvk
pqr53,preprints,2017-12-12T15:32:21.925711,2018-07-02T11:28:50.714618,2017-12-12T20:03:20.642354,NA,NA,[Supplementary material to book chapter] Google Scholar as a data source for research assessment,"The launch of Google Scholar (GS) marked the beginning of a revolution in the scientific information market. This search engine, unlike traditional databases, automatically indexes information from the academic web. Its ease of use, together with its wide coverage and fast indexing speed, have made it the first tool most scientists currently turn to when they need to carry out a literature search. Additionally, the fact that its search results were accompanied from the beginning by citation counts, as well as the later development of secondary products which leverage this citation data (such as Google Scholar Metrics and Google Scholar Citations), made many scientists wonder about its potential as a source of data for bibliometric analyses. The goal of this chapter is to lay the foundations for the use of GS as a supplementary source (and in some disciplines, arguably the best alternative) for scientific evaluation. First, we present a general overview of how GS works. Second, we present empirical evidences about its main characteristics (size, coverage, and growth rate). Third, we carry out a systematic analysis of the main limitations this search engine presents as a tool for the evaluation of scientific performance. Lastly, we discuss the main differences between GS and other more traditional bibliographic databases in light of the correlations found between their citation data. We conclude that Google Scholar presents a broader view of the academic world because it has brought to light a great amount of sources that were not previously visible.",TRUE,FALSE,,2018-07-02T11:28:50.705997,NA,,TRUE,accepted,2017-12-12T20:03:20.642354,NA,NA,NA,NA,NA,NA,NA,NA,NA,5a8c80f7c698300375c76d84|5a8c80f8c698300375c76dd4|5a8c80f8c698300375c76dd9|Social and Behavioral Sciences|Library and Information Science|Scholarly Communication,,2017,https://api.osf.io/v2/preprints/pqr53/contributors/,https://api.osf.io/v2/preprints/pqr53/bibliographic_contributors/,https://api.osf.io/v2/preprints/pqr53/citation/,pqr53,preprints,https://api.osf.io/v2/preprints/pqr53/identifiers/,https://api.osf.io/v2/nodes/uswcg/,https://api.osf.io/v2/preprints/pqr53/relationships/node/,uswcg,nodes,https://api.osf.io/v2/licenses/563c1cf88c5e4a3877f9e96a/,563c1cf88c5e4a3877f9e96a,licenses,https://api.osf.io/v2/providers/preprints/socarxiv/,socarxiv,preprint-providers,https://api.osf.io/v2/preprints/pqr53/files/,https://api.osf.io/v2/files/5a2ff6859da410000eeaf3d6/,5a2ff6859da410000eeaf3d6,files,https://api.osf.io/v2/preprints/pqr53/review_actions/,https://api.osf.io/v2/preprints/pqr53/requests/,https://api.osf.io/v2/preprints/pqr53/,https://osf.io/preprints/socarxiv/pqr53/,NA,https://doi.org/10.31235/osf.io/pqr53
f4exy,preprints,2017-12-12T14:12:53.298203,2018-07-02T11:28:50.682563,2017-12-12T20:01:53.659293,NA,NA,Beyond cynicism and fatalism: Three lessons for a social studies of financial regulation,"This chapter argues for the benefits of going beyond existing approaches to financial regulation centred on capture theory and critical commentary on the epistemic limits of regulatory enterprise. Building upon the research programme of science studies and the social studies of finance, three lessons are identified which may help researchers break free from the critical doom loop of cynicism and fatalism: (1) Listen to the actors, (2) models matter, and (3) discover that macro in the micro.",TRUE,FALSE,financial regulation|methodology|social studies of finance|sociology of finance,2018-07-02T11:28:50.673946,NA,,TRUE,accepted,2017-12-12T20:01:53.659293,NA,NA,NA,NA,NA,NA,NA,NA,NA,"5a8c80f7c698300375c76d84|5a8c80fac698300375c76e20|5a8c80fac698300375c76e2d|Social and Behavioral Sciences|Sociology|Economic Sociology|5a8c80f7c698300375c76d84|5a8c80fac698300375c76e20|5a8c80fac698300375c76e38|Social and Behavioral Sciences|Sociology|Organizations, Occupations, and Work|5a8c80f7c698300375c76d84|5a8c80fac698300375c76e20|5a8c80fac698300375c76e48|Social and Behavioral Sciences|Sociology|Labor and Labor Movements",Nathan Coombs,2017,https://api.osf.io/v2/preprints/f4exy/contributors/,https://api.osf.io/v2/preprints/f4exy/bibliographic_contributors/,https://api.osf.io/v2/preprints/f4exy/citation/,f4exy,preprints,https://api.osf.io/v2/preprints/f4exy/identifiers/,https://api.osf.io/v2/nodes/qbdkr/,https://api.osf.io/v2/preprints/f4exy/relationships/node/,qbdkr,nodes,https://api.osf.io/v2/licenses/563c1cf88c5e4a3877f9e965/,563c1cf88c5e4a3877f9e965,licenses,https://api.osf.io/v2/providers/preprints/socarxiv/,socarxiv,preprint-providers,https://api.osf.io/v2/preprints/f4exy/files/,https://api.osf.io/v2/files/5a2fe3e4b9f235000f3ea5cd/,5a2fe3e4b9f235000f3ea5cd,files,https://api.osf.io/v2/preprints/f4exy/review_actions/,https://api.osf.io/v2/preprints/f4exy/requests/,https://api.osf.io/v2/preprints/f4exy/,https://osf.io/preprints/socarxiv/f4exy/,NA,https://doi.org/10.31235/osf.io/f4exy
95xbj,preprints,2017-12-12T13:33:56.292800,2020-04-14T17:12:22.657910,2017-12-12T20:00:50.926738,NA,NA,Does Peer Adoption Increase the Diffusion of Pollution Prevention Practices?,"Voluntary adoption of pollution prevention (P2) practices has been used to reduce toxic emissions in the US. Spillovers among facilities owned by the same firm likely play an important role in the diffusion of P2 practices. This paper estimates the intrafirm spillover effects of P2 adoption. Using instrumental variables methods applied to facility panel data from the Toxics Release Inventory, we find that a facility’s own adoption of P2 practices increases in response to greater P2 adoption by facilities from the same firm. Intrafirm spillovers are stronger among small firms and firms with higher degree of sibling homophily.",TRUE,FALSE,information disclosure|Pollution prevention|spillovers|Toxics Release Inventory (TRI),2018-07-02T11:28:50.572384,NA,,TRUE,accepted,2017-12-12T20:00:50.926738,NA,NA,NA,NA,NA,NA,NA,NA,NA,5a8c80f7c698300375c76d84|5a8c80f8c698300375c76dbd|Social and Behavioral Sciences|Environmental Studies|5a8c80f7c698300375c76d84|5a8c80f8c698300375c76dbe|5a8c80f8c698300375c76dc1|Social and Behavioral Sciences|Economics|Other Economics,,2017,https://api.osf.io/v2/preprints/95xbj/contributors/,https://api.osf.io/v2/preprints/95xbj/bibliographic_contributors/,https://api.osf.io/v2/preprints/95xbj/citation/,95xbj,preprints,https://api.osf.io/v2/preprints/95xbj/identifiers/,https://api.osf.io/v2/nodes/tsjrh/,https://api.osf.io/v2/preprints/95xbj/relationships/node/,tsjrh,nodes,https://api.osf.io/v2/licenses/563c1cf88c5e4a3877f9e96c/,563c1cf88c5e4a3877f9e96c,licenses,https://api.osf.io/v2/providers/preprints/socarxiv/,socarxiv,preprint-providers,https://api.osf.io/v2/preprints/95xbj/files/,https://api.osf.io/v2/files/5a2fd9c7b9f235000d3ea169/,5a2fd9c7b9f235000d3ea169,files,https://api.osf.io/v2/preprints/95xbj/review_actions/,https://api.osf.io/v2/preprints/95xbj/requests/,https://api.osf.io/v2/preprints/95xbj/,https://osf.io/preprints/socarxiv/95xbj/,NA,https://doi.org/10.31235/osf.io/95xbj
