mz6n5,preprints,2017-09-25T07:57:01.434916,2018-07-02T11:13:27.805343,2017-09-25T08:04:44.458289,NA,NA,"On the justification of intergroup violence: The roles of procedural justice, police legitimacy and group identity in attitudes towards violence among indigenous people","Objective: Why do people justify intergroup violence? In this paper we examine attitudes towards violence perpetrated by indigenous activists to claim for rights and violence by pólice officers against indigenous people. We assess the role that perceived pólice legitimacy, procedurally just policing towards the indigenous minority group and group identity play in the justification of intergroup violence.  

Method: We present findings from two surveys (Study 1, n=1493, Study 2, n=198) and an experiment (Study 3, n=76) conducted among indigenous people in Chile. Studies 1 and 2 measure perceptions of police procedural justice towards indigenous people. Study 3 manipulates the fairness with which police officers treat indigenous people. Effects of procedural justice on police legitimacy (Studies 2 and 3) and attitudes towards violence for social change and social control (Studies 1-3) are analyzed. 

Result: Higher perceptions of procedurally just policing towards indigenous people predict more support for police violence and less support for violence perpetrated by indigenous activists. These effects are mediated by perceived police legitimacy and moderated by identification with the minority group. Among people who identify strongly with their indigenous group, perceiving high procedural justice predicts greater police legitimacy, greater support for police violence, and lesser support for violence perpetrated by indigenous activists. 

Conclusions: Findings contribute to an emerging literature on the roles of procedural justice and legitimacy in violence perceptions. Fair, respectful and neutral treatment of pólice officers may reduce the support for violence among minority group members and increase trust in the violence used by police officers.",TRUE,FALSE,Intergroup violence|legitimacy|procedural justice|social identity,2018-07-02T11:13:27.797662,NA,,TRUE,accepted,2017-09-25T08:04:44.458289,NA,NA,NA,NA,NA,NA,NA,NA,NA,5a8c80f7c698300375c76d84|5a8c80f7c698300375c76d98|5a8c80f7c698300375c76da2|Social and Behavioral Sciences|Psychology|Social Psychology,,2017,https://api.osf.io/v2/preprints/mz6n5/contributors/,https://api.osf.io/v2/preprints/mz6n5/bibliographic_contributors/,https://api.osf.io/v2/preprints/mz6n5/citation/,mz6n5,preprints,https://api.osf.io/v2/preprints/mz6n5/identifiers/,https://api.osf.io/v2/nodes/rvz32/,https://api.osf.io/v2/preprints/mz6n5/relationships/node/,rvz32,nodes,https://api.osf.io/v2/licenses/563c1cf88c5e4a3877f9e96a/,563c1cf88c5e4a3877f9e96a,licenses,https://api.osf.io/v2/providers/preprints/socarxiv/,socarxiv,preprint-providers,https://api.osf.io/v2/preprints/mz6n5/files/,https://api.osf.io/v2/files/59c8b6cc594d900250ea1d88/,59c8b6cc594d900250ea1d88,files,https://api.osf.io/v2/preprints/mz6n5/review_actions/,https://api.osf.io/v2/preprints/mz6n5/requests/,https://api.osf.io/v2/preprints/mz6n5/,https://osf.io/preprints/socarxiv/mz6n5/,https://doi.org/10.31235/osf.io/mz6n5
xwq7m,preprints,2017-09-24T01:05:35.505371,2018-07-02T11:13:27.239473,2017-09-24T01:07:27.780916,NA,NA,Designing Personal Sustainability into Organizational Culture:  The Case of Burning Man,"Efforts to improve the efficiency and effectiveness of organizations has been ongoing for over a century, starting with the “scientific management” approach of Frederick Taylor and the “functions and principles” approach of Henri Fayol that gained popularity in the first two decades of the 1900s. More recently, the notion of sustainability -- that is, the efficient use of energy and resources at both the personal and organizational levels -- has been recognized as a contributor to developing competitive advantage. Personal sustainability contributes to organizational sustainability by raising awareness about sustainability at the organizational level, promoting engagement among members of an organization, and ensuring that individuals have the energy and resources to contribute to the overall mission of the organization. For this interplay to occur, though, sustainability must be part of the organization’s core values. In this case study, we examine the culture of the annual Burning Man event in the Black Rock Desert of northwestern Nevada, and examine how personal sustainability impacts the success of the event, while helping to create a strong cultural identity among participants known as “Burners”.",TRUE,FALSE,Burning Man|culture|design|quality|sustainability,2018-07-02T11:13:27.231587,NA,,TRUE,accepted,2017-09-24T01:07:27.780916,NA,NA,NA,NA,NA,NA,NA,NA,NA,5a8c80f7c698300375c76d84|5a8c80f9c698300375c76e1f|Social and Behavioral Sciences|Organization Development,Palgrave Macmillan,2017,https://api.osf.io/v2/preprints/xwq7m/contributors/,https://api.osf.io/v2/preprints/xwq7m/bibliographic_contributors/,https://api.osf.io/v2/preprints/xwq7m/citation/,xwq7m,preprints,https://api.osf.io/v2/preprints/xwq7m/identifiers/,https://api.osf.io/v2/nodes/wu57h/,https://api.osf.io/v2/preprints/xwq7m/relationships/node/,wu57h,nodes,https://api.osf.io/v2/licenses/563c1cf88c5e4a3877f9e965/,563c1cf88c5e4a3877f9e965,licenses,https://api.osf.io/v2/providers/preprints/socarxiv/,socarxiv,preprint-providers,https://api.osf.io/v2/preprints/xwq7m/files/,https://api.osf.io/v2/files/59c704de6c613b025ce25361/,59c704de6c613b025ce25361,files,https://api.osf.io/v2/preprints/xwq7m/review_actions/,https://api.osf.io/v2/preprints/xwq7m/requests/,https://api.osf.io/v2/preprints/xwq7m/,https://osf.io/preprints/socarxiv/xwq7m/,https://doi.org/10.31235/osf.io/xwq7m
zpwje,preprints,2017-09-22T23:49:59.951253,2018-07-02T11:12:50.631926,2017-09-22T23:50:50.763702,NA,NA,Party and Cleavage in the 2016 Election,"I fit non-parametric spatial models to a novel set of survey data on the 2016 election (N=8,000). I find two underlying dimensions: ""race/identity"" and ""trade-plus."" Attitudes toward Muslim immigration and transgender people emerge as the clearest divides between Trump and Clinton voters. Trade is nearly orthogonal to ""race/identity"" and cleaves both candidates' blocs. Attitudes toward redistributive policies split both parties, depending on the question asked. Supporters of Republican and Democratic candidates reflect distinct positions on ""race/identity"" (except those of Kasich). Sanders supporters are at least as liberal as Clinton supporters on ""race/identity."" They are slightly to the left of all others on ""trade-plus."" Those Sanders voters who voted for Trump are more conservative on ""race/identity"" and slightly more liberal on ""trade-plus.""",TRUE,FALSE,Bernie Sanders|Democratic Party|Donald Trump|Hillary Clinton|ideal points|John Kasich|optimal classification|political parties|presidency|public opinion|Republican Party,2018-07-02T11:12:50.623437,NA,,TRUE,accepted,2017-09-22T23:50:50.763702,NA,NA,NA,NA,NA,NA,NA,NA,NA,5a8c80f7c698300375c76d84|5a8c80f8c698300375c76daf|5a8c80f8c698300375c76db1|Social and Behavioral Sciences|Political Science|Models and Methods|5a8c80f7c698300375c76d84|5a8c80f8c698300375c76daf|5a8c80f8c698300375c76db5|Social and Behavioral Sciences|Political Science|American Politics,,2017,https://api.osf.io/v2/preprints/zpwje/contributors/,https://api.osf.io/v2/preprints/zpwje/bibliographic_contributors/,https://api.osf.io/v2/preprints/zpwje/citation/,zpwje,preprints,https://api.osf.io/v2/preprints/zpwje/identifiers/,https://api.osf.io/v2/nodes/z4gx3/,https://api.osf.io/v2/preprints/zpwje/relationships/node/,z4gx3,nodes,https://api.osf.io/v2/licenses/563c1cf88c5e4a3877f9e96a/,563c1cf88c5e4a3877f9e96a,licenses,https://api.osf.io/v2/providers/preprints/socarxiv/,socarxiv,preprint-providers,https://api.osf.io/v2/preprints/zpwje/files/,https://api.osf.io/v2/files/59c122639ad5a1025b4a1cf5/,59c122639ad5a1025b4a1cf5,files,https://api.osf.io/v2/preprints/zpwje/review_actions/,https://api.osf.io/v2/preprints/zpwje/requests/,https://api.osf.io/v2/preprints/zpwje/,https://osf.io/preprints/socarxiv/zpwje/,https://doi.org/10.31235/osf.io/zpwje
