id,type,attributes.date_created,attributes.date_modified,attributes.date_published,attributes.original_publication_date,attributes.doi,attributes.title,attributes.description,attributes.is_published,attributes.is_preprint_orphan,attributes.tags,attributes.preprint_doi_created,attributes.date_withdrawn,attributes.current_user_permissions,attributes.public,attributes.reviews_state,attributes.date_last_transitioned,attributes.has_coi,attributes.conflict_of_interest_statement,attributes.has_data_links,attributes.why_no_data,attributes.data_links,attributes.has_prereg_links,attributes.why_no_prereg,attributes.prereg_links,attributes.prereg_link_info,attributes.subjects,attributes.license_record.copyright_holders,attributes.license_record.year,relationships.contributors.links.related.href,relationships.bibliographic_contributors.links.related.href,relationships.citation.links.related.href,relationships.citation.data.id,relationships.citation.data.type,relationships.identifiers.links.related.href,relationships.node.links.related.href,relationships.node.links.self.href,relationships.node.data.id,relationships.node.data.type,relationships.license.links.related.href,relationships.license.data.id,relationships.license.data.type,relationships.provider.links.related.href,relationships.provider.data.id,relationships.provider.data.type,relationships.files.links.related.href,relationships.primary_file.links.related.href,relationships.primary_file.data.id,relationships.primary_file.data.type,relationships.review_actions.links.related.href,relationships.requests.links.related.href,links.self,links.html,links.preprint_doi
k4gms,preprints,2017-09-29T09:53:55.275274,2018-07-02T11:13:33.246188,2017-09-29T09:57:15.826987,NA,NA,"Journal of the History of Economic Thought Preprints - Monetary Theory and Cameralist Economic Management, c. 1500-1900 A.D.​","More than England and other states the German principalities were, in the preindustrial period, hampered by silver outflow and persistent pressures on the balance of payments which led to idiosyncratic models and strategies of economic development usually but not entirely helpfully called “Cameralism”. It is less well understood how Cameralism as a policy of order and development and monetary theory went together. The present paper will attempt a sketch of these working mechanisms as well as provide a few angles for new perspectives and future research. A first section after the brief introduction studies general issues of development in relation to balance of payment constraints (II), followed by the discourses on whether the domestic currency ought to remain stable in terms of intrinsic (silver) value (III), or whether it may be debased so as to raise domestic exports and competitiveness (IV). Both options were considered, at times and by varying actors, as valid strategies of promoting economic development, especially export-led growth, although most contemporaries viewed coin debasement as harmful to the economy. A fifth section discusses an alternative to the aforementioned strategies, by raising effective monetary mass through increasing velocity. Since the middle ages and into the nineteenth century the German economic tradition had a clear understanding of how velocity could be managed and the common weal stimulated by an increase in “vivacity” of circulation (V). Upon hindsight it appears that we find here a powerful programme towards promoting economic development and Europe’s rise towards capitalism. A conclusion will offer some thoughts for further research (VI).",TRUE,FALSE,Cameralism|E|Economic History|Economic Theory|Heterodox Economics|Mercantilism,2018-07-02T11:13:33.238659,NA,,TRUE,accepted,2017-09-29T09:57:15.826987,NA,NA,NA,NA,NA,NA,NA,NA,NA,5a8c80f2c698300375c76c7d|5a8c80f4c698300375c76ccc|5a8c80f4c698300375c76cd1|Arts and Humanities|History|Intellectual History|5a8c80f2c698300375c76c7d|5a8c80f4c698300375c76ccc|5a8c80f4c698300375c76ce3|Arts and Humanities|History|European History|5a8c80f7c698300375c76d84|5a8c80f8c698300375c76dbe|5a8c80f8c698300375c76dc4|Social and Behavioral Sciences|Economics|Economic History|5a8c80f7c698300375c76d84|5a8c80f8c698300375c76dbe|5a8c80f8c698300375c76dca|Social and Behavioral Sciences|Economics|Economic Theory,,2017,https://api.osf.io/v2/preprints/k4gms/contributors/,https://api.osf.io/v2/preprints/k4gms/bibliographic_contributors/,https://api.osf.io/v2/preprints/k4gms/citation/,k4gms,preprints,https://api.osf.io/v2/preprints/k4gms/identifiers/,https://api.osf.io/v2/nodes/zbpga/,https://api.osf.io/v2/preprints/k4gms/relationships/node/,zbpga,nodes,https://api.osf.io/v2/licenses/563c1cf88c5e4a3877f9e96c/,563c1cf88c5e4a3877f9e96c,licenses,https://api.osf.io/v2/providers/preprints/socarxiv/,socarxiv,preprint-providers,https://api.osf.io/v2/preprints/k4gms/files/,https://api.osf.io/v2/files/59ce18326c613b02958eec75/,59ce18326c613b02958eec75,files,https://api.osf.io/v2/preprints/k4gms/review_actions/,https://api.osf.io/v2/preprints/k4gms/requests/,https://api.osf.io/v2/preprints/k4gms/,https://osf.io/preprints/socarxiv/k4gms/,https://doi.org/10.31235/osf.io/k4gms
5pfe4,preprints,2017-09-28T14:30:37.318469,2018-07-02T11:13:32.694196,2017-09-28T14:33:38.803766,NA,NA,Fake Archives: Doppelgängers and the Search for Openness in Scholarly Communication Platforms,"viXra.org is a preprint repository that mimics the design, logo, structure and functioning of arXiv.org, the open access website that collects articles from physics, mathematics and other quantitative sciences before or regardless of their submission and publication in a peer-reviewed journal. Launched in 2009 as an answer to the role of arXiv as the dominant platform for scholarly publishing in some areas, viXra is an ironic copycat version of the “official” website, of which it spells the name backwards.",TRUE,FALSE,Media studies|Physics and society|preprint archives|Science communication,2018-07-02T11:13:32.686080,NA,,TRUE,accepted,2017-09-28T14:33:38.803766,NA,NA,NA,NA,NA,NA,NA,NA,NA,5a8c80f7c698300375c76d84|5a8c80f9c698300375c76df4|Social and Behavioral Sciences|Science and Technology Studies|5a8c80f7c698300375c76d84|5a8c80f9c698300375c76e0d|5a8c80f9c698300375c76e0f|Social and Behavioral Sciences|Communication|Communication Technology and New Media,,2017,https://api.osf.io/v2/preprints/5pfe4/contributors/,https://api.osf.io/v2/preprints/5pfe4/bibliographic_contributors/,https://api.osf.io/v2/preprints/5pfe4/citation/,5pfe4,preprints,https://api.osf.io/v2/preprints/5pfe4/identifiers/,https://api.osf.io/v2/nodes/26rcv/,https://api.osf.io/v2/preprints/5pfe4/relationships/node/,26rcv,nodes,https://api.osf.io/v2/licenses/563c1cf88c5e4a3877f9e96a/,563c1cf88c5e4a3877f9e96a,licenses,https://api.osf.io/v2/providers/preprints/socarxiv/,socarxiv,preprint-providers,https://api.osf.io/v2/preprints/5pfe4/files/,https://api.osf.io/v2/files/59cd078c9ad5a102be63e8dc/,59cd078c9ad5a102be63e8dc,files,https://api.osf.io/v2/preprints/5pfe4/review_actions/,https://api.osf.io/v2/preprints/5pfe4/requests/,https://api.osf.io/v2/preprints/5pfe4/,https://osf.io/preprints/socarxiv/5pfe4/,https://doi.org/10.31235/osf.io/5pfe4
g6jtx,preprints,2017-09-26T11:01:52.125859,2018-07-02T11:13:30.907612,2017-09-26T11:04:08.022626,NA,NA,The epistemic value of p-values,"How do p-values relate to beliefs? p-values are widely used in data analytic contexts, and the misuse of p-values can have grave consequences. In order to get a better grip on p-values, we need to make epistemological sense of them. I argue that the least inappropriate way of understanding the relation of p-values to beliefs is  to regard p-values as a degree of epistemic luck, or, in the rare contexts in which the belief in a null model is justified, as a degree of justifiedness. When we handle p-values in an epistemically responsible way, there is no need to abandon them. What should be abandoned, however, is the use of p-values as a default tool in data analysis: Instead of relying on default tools, we should justify our data analysis tools each time we perform some data analytic task.",TRUE,FALSE,bayesian|epistemology|nhst|p-value|statistical significance|statistics,2018-07-02T11:13:30.875327,NA,,TRUE,accepted,2017-09-26T11:04:08.022626,NA,NA,NA,NA,NA,NA,NA,NA,NA,5a8c80f2c698300375c76c7d|5a8c80f5c698300375c76cf4|5a8c80f5c698300375c76cf5|Arts and Humanities|Philosophy|Epistemology,,2017,https://api.osf.io/v2/preprints/g6jtx/contributors/,https://api.osf.io/v2/preprints/g6jtx/bibliographic_contributors/,https://api.osf.io/v2/preprints/g6jtx/citation/,g6jtx,preprints,https://api.osf.io/v2/preprints/g6jtx/identifiers/,https://api.osf.io/v2/nodes/v95eb/,https://api.osf.io/v2/preprints/g6jtx/relationships/node/,v95eb,nodes,https://api.osf.io/v2/licenses/563c1cf88c5e4a3877f9e96a/,563c1cf88c5e4a3877f9e96a,licenses,https://api.osf.io/v2/providers/preprints/socarxiv/,socarxiv,preprint-providers,https://api.osf.io/v2/preprints/g6jtx/files/,https://api.osf.io/v2/files/59ca339f594d900253eab02c/,59ca339f594d900253eab02c,files,https://api.osf.io/v2/preprints/g6jtx/review_actions/,https://api.osf.io/v2/preprints/g6jtx/requests/,https://api.osf.io/v2/preprints/g6jtx/,https://osf.io/preprints/socarxiv/g6jtx/,https://doi.org/10.31235/osf.io/g6jtx
vxnw6,preprints,2017-09-26T07:10:39.679424,2018-07-02T11:13:30.095602,2017-09-26T07:15:35.538516,NA,NA,"Journal Scholar Metrics: building an Arts, Humanities, and Social Sciences journal ranking with Google Scholar data","This paper describes the creation of “Journal Scholar Metrics” (JSM), a prototype web application that ranks journals in the areas of Arts, Humanities, and Social Sciences (AH&amp;SS) on the basis of the citations their articles have received according to Google Scholar Metrics (GSM). To identify as many AH&amp;SS journals as possible, a master list of 66,454 journals covered by various databases was developed. All AH&amp;SS journals in that list were searched on GSM. Additionally, a series of keyword searches were carried out to identify journals covered by GSM which weren’t present in the master list. A total of 9,188 AH&amp;SS journals with names written in Latin characters were found in the 2015 edition of GSM (which displays data about articles published between 2010 and 2014). Besides the journal-level indicators provided by GSM (H5-index and H5-median), several additional indicators were computed (H5-citations, H5-index and H5-citations without journal self-citations, and journal self-citation rate). Journals are displayed by subject categories and by country of publication. Quartiles were computed for each category, and journals in a category were further classified either as core (high affinity to the category) or related (partial affinity). A detail page for each journal is also available, displaying journal indicators, as well as a list of other databases were the journal is indexed.",TRUE,FALSE,Arts|Google Scholar|H Index|Humanities|Journal Rankings|Social Sciences|Web applicaion,2018-07-02T11:13:30.082271,NA,,TRUE,accepted,2017-09-26T07:15:35.538516,NA,NA,NA,NA,NA,NA,NA,NA,NA,5a8c80f7c698300375c76d84|5a8c80f8c698300375c76dd4|5a8c80f8c698300375c76dd9|Social and Behavioral Sciences|Library and Information Science|Scholarly Communication,The authors,2017,https://api.osf.io/v2/preprints/vxnw6/contributors/,https://api.osf.io/v2/preprints/vxnw6/bibliographic_contributors/,https://api.osf.io/v2/preprints/vxnw6/citation/,vxnw6,preprints,https://api.osf.io/v2/preprints/vxnw6/identifiers/,https://api.osf.io/v2/nodes/qvrym/,https://api.osf.io/v2/preprints/vxnw6/relationships/node/,qvrym,nodes,https://api.osf.io/v2/licenses/563c1cf88c5e4a3877f9e965/,563c1cf88c5e4a3877f9e965,licenses,https://api.osf.io/v2/providers/preprints/socarxiv/,socarxiv,preprint-providers,https://api.osf.io/v2/preprints/vxnw6/files/,https://api.osf.io/v2/files/59c9fd6e594d900250ea734b/,59c9fd6e594d900250ea734b,files,https://api.osf.io/v2/preprints/vxnw6/review_actions/,https://api.osf.io/v2/preprints/vxnw6/requests/,https://api.osf.io/v2/preprints/vxnw6/,https://osf.io/preprints/socarxiv/vxnw6/,https://doi.org/10.31235/osf.io/vxnw6
3ruhs,preprints,2017-09-26T00:26:09.082109,2018-07-02T11:13:29.584750,2017-09-26T00:30:25.723861,NA,NA,An Unusual Power: Scientific Revolution,The actual nature of the scientific revolution from the 16th and 17th centuries in relation to the medical profession.,TRUE,FALSE,17th century|medical profession|professional classes|revolution|science,2018-07-02T11:13:29.575758,NA,,TRUE,accepted,2017-09-26T00:30:25.723861,NA,NA,NA,NA,NA,NA,NA,NA,NA,"5a8c80f7c698300375c76d84|5a8c80f7c698300375c76d96|Social and Behavioral Sciences|Other Social and Behavioral Sciences|5a8c80f7c698300375c76d84|5a8c80f7c698300375c76d98|Social and Behavioral Sciences|Psychology|5a8c80f7c698300375c76d84|5a8c80f9c698300375c76df4|Social and Behavioral Sciences|Science and Technology Studies|5a8c80f7c698300375c76d84|5a8c80f9c698300375c76e1f|Social and Behavioral Sciences|Organization Development|5a8c80f7c698300375c76d84|5a8c80fac698300375c76e20|5a8c80fac698300375c76e24|Social and Behavioral Sciences|Sociology|Sociological Practice and Public Sociology|5a8c80f7c698300375c76d84|5a8c80fac698300375c76e20|5a8c80fac698300375c76e26|Social and Behavioral Sciences|Sociology|Sociology of Education|5a8c80f7c698300375c76d84|5a8c80fac698300375c76e20|5a8c80fac698300375c76e28|Social and Behavioral Sciences|Sociology|Rationality and Society|5a8c80f7c698300375c76d84|5a8c80fac698300375c76e20|5a8c80fac698300375c76e2d|Social and Behavioral Sciences|Sociology|Economic Sociology|5a8c80f7c698300375c76d84|5a8c80fac698300375c76e20|5a8c80fac698300375c76e34|Social and Behavioral Sciences|Sociology|Communication, Information Technologies, and Media Sociology|5a8c80f7c698300375c76d84|5a8c80fac698300375c76e20|5a8c80fac698300375c76e37|Social and Behavioral Sciences|Sociology|Theory|5a8c80f7c698300375c76d84|5a8c80fac698300375c76e20|5a8c80fac698300375c76e38|Social and Behavioral Sciences|Sociology|Organizations, Occupations, and Work|5a8c80f7c698300375c76d84|5a8c80fac698300375c76e20|5a8c80fac698300375c76e3e|Social and Behavioral Sciences|Sociology|Population|5a8c80f7c698300375c76d84|5a8c80fac698300375c76e20|5a8c80fac698300375c76e3f|Social and Behavioral Sciences|Sociology|Political Sociology|5a8c80f7c698300375c76d84|5a8c80fac698300375c76e20|5a8c80fac698300375c76e40|Social and Behavioral Sciences|Sociology|Science, Knowledge, and Technology|5a8c80f7c698300375c76d84|5a8c80fac698300375c76e20|5a8c80fac698300375c76e45|Social and Behavioral Sciences|Sociology|Animals and Society|5a8c80f7c698300375c76d84|5a8c80fac698300375c76e20|5a8c80fac698300375c76e48|Social and Behavioral Sciences|Sociology|Labor and Labor Movements|5a8c80f7c698300375c76d84|5a8c80fac698300375c76e20|5a8c80fac698300375c76e4a|Social and Behavioral Sciences|Sociology|Marxist Sociology|5a8c80f7c698300375c76d84|5a8c80fac698300375c76e20|5a8c80fac698300375c76e4b|Social and Behavioral Sciences|Sociology|Social Psychology and Interaction|5a8c80f7c698300375c76d84|5a8c80fac698300375c76e20|5a8c80fac698300375c76e51|Social and Behavioral Sciences|Sociology|Culture",,2017,https://api.osf.io/v2/preprints/3ruhs/contributors/,https://api.osf.io/v2/preprints/3ruhs/bibliographic_contributors/,https://api.osf.io/v2/preprints/3ruhs/citation/,3ruhs,preprints,https://api.osf.io/v2/preprints/3ruhs/identifiers/,https://api.osf.io/v2/nodes/bmj4r/,https://api.osf.io/v2/preprints/3ruhs/relationships/node/,bmj4r,nodes,https://api.osf.io/v2/licenses/563c1cf88c5e4a3877f9e96a/,563c1cf88c5e4a3877f9e96a,licenses,https://api.osf.io/v2/providers/preprints/socarxiv/,socarxiv,preprint-providers,https://api.osf.io/v2/preprints/3ruhs/files/,https://api.osf.io/v2/files/59c99ea0594d900250ea5f47/,59c99ea0594d900250ea5f47,files,https://api.osf.io/v2/preprints/3ruhs/review_actions/,https://api.osf.io/v2/preprints/3ruhs/requests/,https://api.osf.io/v2/preprints/3ruhs/,https://osf.io/preprints/socarxiv/3ruhs/,https://doi.org/10.31235/osf.io/3ruhs
vf6zy,preprints,2017-09-26T00:16:28.898737,2018-07-02T11:13:29.516264,2017-09-26T00:21:52.847667,NA,NA,AN UNUSUAL POWER: The rise and influence of medical doctors,"The history and development of the medical profession considering to what degree its different sections are scientific, if they are not what are they, and if not scientific what are the actual effects of their procedures.",TRUE,FALSE,actuality|history|medical profession|professions,2018-07-02T11:13:29.507911,NA,,TRUE,accepted,2017-09-26T00:21:52.847667,NA,NA,NA,NA,NA,NA,NA,NA,NA,"5a8c80f7c698300375c76d84|5a8c80f7c698300375c76d98|5a8c80f8c698300375c76dad|Social and Behavioral Sciences|Psychology|Applied Behavior Analysis|5a8c80f7c698300375c76d84|5a8c80f8c698300375c76dcf|Social and Behavioral Sciences|Social Work|5a8c80f7c698300375c76d84|5a8c80f8c698300375c76ddb|Social and Behavioral Sciences|Public Affairs, Public Policy and Public Administration|5a8c80f7c698300375c76d84|5a8c80f9c698300375c76df4|Social and Behavioral Sciences|Science and Technology Studies|5a8c80f7c698300375c76d84|5a8c80f9c698300375c76e1f|Social and Behavioral Sciences|Organization Development|5a8c80f7c698300375c76d84|5a8c80fac698300375c76e20|5a8c80fac698300375c76e23|Social and Behavioral Sciences|Sociology|Human Rights|5a8c80f7c698300375c76d84|5a8c80fac698300375c76e20|5a8c80fac698300375c76e24|Social and Behavioral Sciences|Sociology|Sociological Practice and Public Sociology|5a8c80f7c698300375c76d84|5a8c80fac698300375c76e20|5a8c80fac698300375c76e26|Social and Behavioral Sciences|Sociology|Sociology of Education|5a8c80f7c698300375c76d84|5a8c80fac698300375c76e20|5a8c80fac698300375c76e28|Social and Behavioral Sciences|Sociology|Rationality and Society|5a8c80f7c698300375c76d84|5a8c80fac698300375c76e20|5a8c80fac698300375c76e31|Social and Behavioral Sciences|Sociology|Sociology of Religion|5a8c80f7c698300375c76d84|5a8c80fac698300375c76e20|5a8c80fac698300375c76e34|Social and Behavioral Sciences|Sociology|Communication, Information Technologies, and Media Sociology|5a8c80f7c698300375c76d84|5a8c80fac698300375c76e20|5a8c80fac698300375c76e37|Social and Behavioral Sciences|Sociology|Theory|5a8c80f7c698300375c76d84|5a8c80fac698300375c76e20|5a8c80fac698300375c76e39|Social and Behavioral Sciences|Sociology|Collective Behavior and Social Movements|5a8c80f7c698300375c76d84|5a8c80fac698300375c76e20|5a8c80fac698300375c76e3b|Social and Behavioral Sciences|Sociology|Political Economy of the World System|5a8c80f7c698300375c76d84|5a8c80fac698300375c76e20|5a8c80fac698300375c76e3e|Social and Behavioral Sciences|Sociology|Population|5a8c80f7c698300375c76d84|5a8c80fac698300375c76e20|5a8c80fac698300375c76e40|Social and Behavioral Sciences|Sociology|Science, Knowledge, and Technology|5a8c80f7c698300375c76d84|5a8c80fac698300375c76e20|5a8c80fac698300375c76e42|Social and Behavioral Sciences|Sociology|Peace, War, and Social Conflict|5a8c80f7c698300375c76d84|5a8c80fac698300375c76e20|5a8c80fac698300375c76e45|Social and Behavioral Sciences|Sociology|Animals and Society|5a8c80f7c698300375c76d84|5a8c80fac698300375c76e20|5a8c80fac698300375c76e4a|Social and Behavioral Sciences|Sociology|Marxist Sociology|5a8c80f7c698300375c76d84|5a8c80fac698300375c76e20|5a8c80fac698300375c76e4b|Social and Behavioral Sciences|Sociology|Social Psychology and Interaction|5a8c80f7c698300375c76d84|5a8c80fac698300375c76e20|5a8c80fac698300375c76e51|Social and Behavioral Sciences|Sociology|Culture|5a8c80f7c698300375c76d84|5a8c80fac698300375c76e20|5a8c80fac698300375c76e53|Social and Behavioral Sciences|Sociology|Altruism, Morality, and Social Solidarity",stanley wilkin,2017,https://api.osf.io/v2/preprints/vf6zy/contributors/,https://api.osf.io/v2/preprints/vf6zy/bibliographic_contributors/,https://api.osf.io/v2/preprints/vf6zy/citation/,vf6zy,preprints,https://api.osf.io/v2/preprints/vf6zy/identifiers/,https://api.osf.io/v2/nodes/n4wmb/,https://api.osf.io/v2/preprints/vf6zy/relationships/node/,n4wmb,nodes,https://api.osf.io/v2/licenses/563c1cf88c5e4a3877f9e96a/,563c1cf88c5e4a3877f9e96a,licenses,https://api.osf.io/v2/providers/preprints/socarxiv/,socarxiv,preprint-providers,https://api.osf.io/v2/preprints/vf6zy/files/,https://api.osf.io/v2/files/59c99c5bb83f69025c6a29d2/,59c99c5bb83f69025c6a29d2,files,https://api.osf.io/v2/preprints/vf6zy/review_actions/,https://api.osf.io/v2/preprints/vf6zy/requests/,https://api.osf.io/v2/preprints/vf6zy/,https://osf.io/preprints/socarxiv/vf6zy/,https://doi.org/10.31235/osf.io/vf6zy
8abrk,preprints,2017-09-25T08:59:15.446505,2018-07-02T11:13:27.857131,2017-09-25T09:04:52.561054,NA,NA,The Economic Dynamics and the Calculus of Variations in the Interwar Period,"Abstract
Analogies with rational mechanics played a pivotal role in the search for formal models in economics. In the period between the two world wars, a small group of mathematical economists tried to extend this view from statics to dynamics. The main result was the extensive application of calculus of variations to obtain a dynamic representation of e-conomic variables. This approach began with the contributions put forward by Griffith C.Evans, a mathematician who in the first phase of his scientific career published wi-dely in economics. Evans' research was further developed by his student, Charles Roos. At the international level, this dynamic approach found its main followers in Italy, within the Paretian tradition. During the 1930s, Luigi Amoroso, the leading exponent of the Paretian School, made major contributions along with his student, Giulio La Volpe that anticipated the concept of temporary equilibrium. The analysis of the application of the calculus of variations to economic dynamics in the interwar period raises a set of questions on the application of mathematics designed to study mechanics and physics to economics",TRUE,FALSE,,2018-07-02T11:13:27.849579,NA,,TRUE,accepted,2017-09-25T09:04:52.561054,NA,NA,NA,NA,NA,NA,NA,NA,NA,5a8c80f7c698300375c76d84|5a8c80f8c698300375c76dbe|5a8c80f8c698300375c76dc4|Social and Behavioral Sciences|Economics|Economic History,,2017,https://api.osf.io/v2/preprints/8abrk/contributors/,https://api.osf.io/v2/preprints/8abrk/bibliographic_contributors/,https://api.osf.io/v2/preprints/8abrk/citation/,8abrk,preprints,https://api.osf.io/v2/preprints/8abrk/identifiers/,https://api.osf.io/v2/nodes/8eacb/,https://api.osf.io/v2/preprints/8abrk/relationships/node/,8eacb,nodes,https://api.osf.io/v2/licenses/563c1cf88c5e4a3877f9e96c/,563c1cf88c5e4a3877f9e96c,licenses,https://api.osf.io/v2/providers/preprints/socarxiv/,socarxiv,preprint-providers,https://api.osf.io/v2/preprints/8abrk/files/,https://api.osf.io/v2/files/59c8c5629ad5a1025fb4e3ce/,59c8c5629ad5a1025fb4e3ce,files,https://api.osf.io/v2/preprints/8abrk/review_actions/,https://api.osf.io/v2/preprints/8abrk/requests/,https://api.osf.io/v2/preprints/8abrk/,https://osf.io/preprints/socarxiv/8abrk/,https://doi.org/10.31235/osf.io/8abrk
