id,type,attributes.date_created,attributes.date_modified,attributes.date_published,attributes.original_publication_date,attributes.doi,attributes.title,attributes.description,attributes.is_published,attributes.is_preprint_orphan,attributes.tags,attributes.preprint_doi_created,attributes.date_withdrawn,attributes.current_user_permissions,attributes.public,attributes.reviews_state,attributes.date_last_transitioned,attributes.has_coi,attributes.conflict_of_interest_statement,attributes.has_data_links,attributes.why_no_data,attributes.data_links,attributes.has_prereg_links,attributes.why_no_prereg,attributes.prereg_links,attributes.prereg_link_info,attributes.subjects,attributes.license_record.copyright_holders,attributes.license_record.year,relationships.contributors.links.related.href,relationships.bibliographic_contributors.links.related.href,relationships.citation.links.related.href,relationships.citation.data.id,relationships.citation.data.type,relationships.identifiers.links.related.href,relationships.node.links.related.href,relationships.node.links.self.href,relationships.node.data.id,relationships.node.data.type,relationships.license.links.related.href,relationships.license.data.id,relationships.license.data.type,relationships.provider.links.related.href,relationships.provider.data.id,relationships.provider.data.type,relationships.files.links.related.href,relationships.primary_file.links.related.href,relationships.primary_file.data.id,relationships.primary_file.data.type,relationships.review_actions.links.related.href,relationships.requests.links.related.href,links.self,links.html,links.preprint_doi,links.doi
zshqv,preprints,2020-12-06T03:16:40.480243,2020-12-06T15:58:02.125968,2020-12-06T15:57:40.957623,NA,NA,How to Calculate the Costs of Poverty in Canada: Comment on the Nathan Laurie Approach and Recommended Improvements,"In 2008, Nathan Laurie calculated the costs of poverty in Canada and Ontario for the first time. Since then, several researchers have used the approach he developed to calculate the costs of poverty for most of the Canadian provinces. This research has had a substantial impact on the thinking of the public and policy makers around poverty and poverty reduction in Canada. In this working paper, we distill the central tenants of Laurie’s approach and recommend several improvements that can be made to it. In effect, Laurie’s approach works with readily available data to answer the counterfactual question: what would the savings and gains be to individuals and society if we raised the standard of living of the poor to the modest level achieved by the second income quintile or higher? In several places, however, his approach results in estimates of costs that are insensitive to changes in widely recognized measures of poverty, including Canada’s new Official Poverty Line, otherwise known as the Market  Basket Measure (MBM). In the latter sections of this paper, we reproduce Laurie’s original calculations and contrast these with results based on our own recommendations in the same year. Our recommendations generate comparable results.",TRUE,FALSE,Canada|cost of poverty|Nathan Laurie|poverty reduction|social investment,2020-12-06T15:58:01.924768,NA,,TRUE,accepted,2020-12-06T15:57:40.957623,FALSE,NA,available,NA,https://search2.odesi.ca,not_applicable,NA,,,5a8c80f7c698300375c76d84|5a8c80f8c698300375c76dbe|5a8c80f8c698300375c76dce|Social and Behavioral Sciences|Economics|Public Economics,Charles Plante,2020,https://api.osf.io/v2/preprints/zshqv/contributors/,https://api.osf.io/v2/preprints/zshqv/bibliographic_contributors/,https://api.osf.io/v2/preprints/zshqv/citation/,zshqv,preprints,https://api.osf.io/v2/preprints/zshqv/identifiers/,https://api.osf.io/v2/nodes/93bdz/,https://api.osf.io/v2/preprints/zshqv/relationships/node/,93bdz,nodes,https://api.osf.io/v2/licenses/563c1cf88c5e4a3877f9e965/,563c1cf88c5e4a3877f9e965,licenses,https://api.osf.io/v2/providers/preprints/socarxiv/,socarxiv,preprint-providers,https://api.osf.io/v2/preprints/zshqv/files/,https://api.osf.io/v2/files/5fcc4d1c6ebcc602c946e733/,5fcc4d1c6ebcc602c946e733,files,https://api.osf.io/v2/preprints/zshqv/review_actions/,https://api.osf.io/v2/preprints/zshqv/requests/,https://api.osf.io/v2/preprints/zshqv/,https://osf.io/preprints/socarxiv/zshqv/,https://doi.org/10.31235/osf.io/zshqv,NA
am49t,preprints,2020-12-05T22:41:45.047716,2020-12-06T16:01:44.123996,2020-12-06T16:01:15.886552,2020-12-02T05:00:00,10.1111/acem.14188,Emergency Physicians and Personal Narratives Improve the Perceived Effectiveness of COVID-19 Public Health Recommendations on Social Media: A Randomized Experiment,"Background: Containment of the coronavirus disease 2019 (COVID-19) pandemic requires the public to change behavior under social distancing mandates. Social media are important information dissemination platforms that can augment traditional channels communicating public health recommendations. The objective of the study is to assess the effectiveness of COVID-19 public health messaging on Twitter when delivered by emergency physicians and containing personal narratives. 
Methods: On April 30, 2020, we randomly assigned 2007 U.S. adults to an online survey using a 2x2 factorial design. Participants rated 1 of 4 simulated Twitter posts varied by messenger type (emergency physician vs federal official) and content (personal narrative vs impersonal guidance). Main outcomes were: perceived message effectiveness (35-point scale); perceived attitude effectiveness (15-point scale); likelihood to share Tweets (7-point scale); and writing a letter to their governor to continue COVID-19 restrictions (write letter or none).
Results: The physician/personal message had the strongest effect and significantly improved all main messaging outcomes except for letter-writing. Unadjusted mean differences between physician/personal and federal/impersonal were: perceived messaging effectiveness (3.2 [95%CI, 2.4-4.0]); perceived attitude effectiveness (1.3 [95%CI, 0.8-1.7]); likelihood to share (0.4 [95%CI, 0.15-0.7]). For letter-writing, physician/ personal made no significant impact compared to federal/ impersonal (odds ratio 1.14 [95%CI, 0.89-1.46]). 
Conclusions: Emergency physicians sharing personal narratives on Twitter are perceived to be more effective at communicating COVID-19 health recommendations compared to federal officials sharing impersonal guidance.",TRUE,FALSE,civic engagement|COVID-19|emergency physicians|health education|perceived message effectiveness|physician advocacy|public health|public health messaging|randomized controlled trial|randomized experiment|social media|survey experiment|twitter,2020-12-06T16:01:43.926845,NA,,TRUE,accepted,2020-12-06T16:01:15.886552,FALSE,NA,no,Please contact the corresponding author for data sharing agreement,,available,NA,https://osf.io/kabvr/,prereg_both,"5a8c80f7c698300375c76d84|5a8c80f7c698300375c76d98|5a8c80f8c698300375c76da4|Social and Behavioral Sciences|Psychology|Health Psychology|5a8c80f7c698300375c76d84|5a8c80f8c698300375c76ddb|Social and Behavioral Sciences|Public Affairs, Public Policy and Public Administration|5a8c80f7c698300375c76d84|5a8c80f9c698300375c76df4|Social and Behavioral Sciences|Science and Technology Studies",,2020,https://api.osf.io/v2/preprints/am49t/contributors/,https://api.osf.io/v2/preprints/am49t/bibliographic_contributors/,https://api.osf.io/v2/preprints/am49t/citation/,am49t,preprints,https://api.osf.io/v2/preprints/am49t/identifiers/,https://api.osf.io/v2/nodes/t8g5w/,https://api.osf.io/v2/preprints/am49t/relationships/node/,t8g5w,nodes,https://api.osf.io/v2/licenses/563c1cf88c5e4a3877f9e96a/,563c1cf88c5e4a3877f9e96a,licenses,https://api.osf.io/v2/providers/preprints/socarxiv/,socarxiv,preprint-providers,https://api.osf.io/v2/preprints/am49t/files/,https://api.osf.io/v2/files/5fcc0caeaa60b802c78949bb/,5fcc0caeaa60b802c78949bb,files,https://api.osf.io/v2/preprints/am49t/review_actions/,https://api.osf.io/v2/preprints/am49t/requests/,https://api.osf.io/v2/preprints/am49t/,https://osf.io/preprints/socarxiv/am49t/,https://doi.org/10.31235/osf.io/am49t,https://doi.org/10.1111/acem.14188
zmfb5,preprints,2020-12-05T13:30:54.519898,2020-12-06T16:06:21.948469,2020-12-06T16:06:04.414211,NA,NA,Dual use research of concern in the pharmaceutical industry,"Research that benefits the society but could also be applied to disrupt or harm this society is referred to as Dual Use Research (DUR).  Although, certain experiments in nuclear physics, technology and engineering have some dual use character, all research conducted in the life sciences carries the potential to be deliberately misused. Minimising the risks and threats to society that are posed by the misuse of such research warrants putting in place mechanisms that caution, safeguard and prepare those that work with DUR. At the inter/national level, instruments to do so include laws and regulations that forbid the misuse of life sciences research techniques to develop weapons of mass destruction. They also restrict and control the exchange of high-risk biological agents and equipment. At the institutional level, efforts to govern DUR are often voluntary and done through codes of conduct, increasing awareness, as well as training members about the dual use potential of their research. This then equips an individual researcher working with such institutions to identify possible misuse of DUR to identify if misuse of  and  could  with which DUR is conducted and it's misuse may be identified. While researchers associated with academic and government funded institutions carefully scrutinise the potential of misuse of DUR, the same is not reflected in privately funded biopharmaceutical institutions. Despite being a significant part of the life sciences community and carrying out extensive DUR only This implies that besides the laws and regulations that govern DUR at the (inter)national level, the biopharmaceutical industry is expected to voluntarily initiate and address dual use concerns at the institutional and individual level. 
Thus, following an inventory of the various instruments available for the governance of DUR, the approaches adopted by 10 leading companies in the global biopharmaceutical market to address dual use issues were analysed. 
The results revealed that only 1 out of the 10 companies identified the potential misuse of high risk biological agents and the need to ensure biosecurity within the company. However, there was no explicit mention of dual use issues even though, instruments that deal with other ethical problems encountered by an employee, are in place. Also, owing to insufficient attention given to dual use issues in this industry, there is a serious lack of awareness and expertise that is crucial to dealing with such dilemmas. 
The surprisingly limited attention given to the dual use dilemma in the biopharmaceutical industry justifies the need for codes and education to raise awareness and motivate efforts towards the ethical resolution of conflicts concerning the misuse of such research.",TRUE,FALSE,Biotechnology|Bioterrorism|Biowarfare|Dual use research of concern|Pharmaceutical industry|Research ethics|Whistleblowing,2020-12-06T16:06:21.924449,NA,,TRUE,accepted,2020-12-06T16:06:04.414211,FALSE,NA,no,NA,,no,NA,,,"5a8c80f0c698300375c76c07|Law|5a8c80f2c698300375c76c7d|5a8c80f5c698300375c76cf4|5a8c80f5c698300375c76cfe|Arts and Humanities|Philosophy|Ethics and Political Philosophy|5a8c80f7c698300375c76d84|5a8c80f8c698300375c76ddb|5a8c80f8c698300375c76ddd|Social and Behavioral Sciences|Public Affairs, Public Policy and Public Administration|Terrorism Studies|5a8c80f7c698300375c76d84|5a8c80f8c698300375c76ddb|5a8c80f9c698300375c76de1|Social and Behavioral Sciences|Public Affairs, Public Policy and Public Administration|Peace and Conflict|5a8c80f7c698300375c76d84|5a8c80f8c698300375c76ddb|5a8c80f9c698300375c76dee|Social and Behavioral Sciences|Public Affairs, Public Policy and Public Administration|Emergency and Disaster Management|5a8c80f7c698300375c76d84|5a8c80f8c698300375c76ddb|5a8c80f9c698300375c76df2|Social and Behavioral Sciences|Public Affairs, Public Policy and Public Administration|Defense and Security Studies",,2020,https://api.osf.io/v2/preprints/zmfb5/contributors/,https://api.osf.io/v2/preprints/zmfb5/bibliographic_contributors/,https://api.osf.io/v2/preprints/zmfb5/citation/,zmfb5,preprints,https://api.osf.io/v2/preprints/zmfb5/identifiers/,NA,https://api.osf.io/v2/preprints/zmfb5/relationships/node/,NA,NA,https://api.osf.io/v2/licenses/563c1cf88c5e4a3877f9e96a/,563c1cf88c5e4a3877f9e96a,licenses,https://api.osf.io/v2/providers/preprints/socarxiv/,socarxiv,preprint-providers,https://api.osf.io/v2/preprints/zmfb5/files/,https://api.osf.io/v2/files/5fcb8b926ebcc60293470ca4/,5fcb8b926ebcc60293470ca4,files,https://api.osf.io/v2/preprints/zmfb5/review_actions/,https://api.osf.io/v2/preprints/zmfb5/requests/,https://api.osf.io/v2/preprints/zmfb5/,https://osf.io/preprints/socarxiv/zmfb5/,https://doi.org/10.31235/osf.io/zmfb5,NA
gbzcr,preprints,2020-12-05T12:41:45.910728,2020-12-06T05:03:01.745337,2020-12-06T05:02:46.315571,NA,NA,Age-Related Differences in Home Experiences and Worries During COVID-19,"The Coronavirus pandemic differentially impacted older adults in comparison to other age groups, creating extended time at home and even limiting interaction with others. In order to understand how individuals are coping with extensive time at home, we used a representative sample of community-dwelling adults to examine how home experiences and personal worries during the COVID-19 pandemic may differ across age groups, including among older adults. Overall, we find fewer older adults experienced home-based stressors (e.g. household conflict, lack of personal space) and fewer worries (e.g. related to finances or boredom) that may arise during a disease outbreak with lockdown measures. Those ages 70+ who were living alone also faced fewer negative home experiences and worries than individuals 60-69 years old living in single-person households. Supportive services to manage such home stressors and worries might benefit all age groups.",TRUE,FALSE,age groups|covid19|home experiences|older adults|wellbeing|worries,2020-12-06T05:03:01.709657,NA,,TRUE,accepted,2020-12-06T05:02:46.315571,FALSE,NA,no,NA,,no,NA,,,5a8c80f7c698300375c76d84|5a8c80fac698300375c76e20|5a8c80fac698300375c76e46|Social and Behavioral Sciences|Sociology|Aging and the Life Course,,2020,https://api.osf.io/v2/preprints/gbzcr/contributors/,https://api.osf.io/v2/preprints/gbzcr/bibliographic_contributors/,https://api.osf.io/v2/preprints/gbzcr/citation/,gbzcr,preprints,https://api.osf.io/v2/preprints/gbzcr/identifiers/,NA,https://api.osf.io/v2/preprints/gbzcr/relationships/node/,NA,NA,https://api.osf.io/v2/licenses/5ad7979bc69830002d8190e3/,5ad7979bc69830002d8190e3,licenses,https://api.osf.io/v2/providers/preprints/socarxiv/,socarxiv,preprint-providers,https://api.osf.io/v2/preprints/gbzcr/files/,https://api.osf.io/v2/files/5fcb800e4269db02b61cbdcf/,5fcb800e4269db02b61cbdcf,files,https://api.osf.io/v2/preprints/gbzcr/review_actions/,https://api.osf.io/v2/preprints/gbzcr/requests/,https://api.osf.io/v2/preprints/gbzcr/,https://osf.io/preprints/socarxiv/gbzcr/,https://doi.org/10.31235/osf.io/gbzcr,NA
dnzqr,preprints,2020-12-05T12:07:53.406730,2020-12-08T05:53:41.487468,2020-12-08T05:50:08.840287,NA,NA,Toquenitzar el català: la llengua com a bé comú,"This is a short essay on dialogue, culture and identities. In addition to the public good policy adopted by the Catalan Government over the last four decades, it examines the Catalan language from a commons-based perspective. It contends that its survival and evolution in a digital age will mainly depend on the social institutions that can be created to manage it as a commons good. To foster cultural innovation and plurality, against diglossic stances, blockchain technologies could be used by Catalan speakers to create a social community to freely manage their own language.",TRUE,FALSE,blockchain technologies|Catalan language|commons|dialogue|identity|token,2020-12-08T05:53:41.467778,NA,,TRUE,accepted,2020-12-08T05:50:08.840287,FALSE,NA,not_applicable,NA,,not_applicable,NA,,,"5a8c80f7c698300375c76d84|5a8c80f8c698300375c76ddb|Social and Behavioral Sciences|Public Affairs, Public Policy and Public Administration",,2020,https://api.osf.io/v2/preprints/dnzqr/contributors/,https://api.osf.io/v2/preprints/dnzqr/bibliographic_contributors/,https://api.osf.io/v2/preprints/dnzqr/citation/,dnzqr,preprints,https://api.osf.io/v2/preprints/dnzqr/identifiers/,NA,https://api.osf.io/v2/preprints/dnzqr/relationships/node/,NA,NA,https://api.osf.io/v2/licenses/563c1cf88c5e4a3877f9e96a/,563c1cf88c5e4a3877f9e96a,licenses,https://api.osf.io/v2/providers/preprints/socarxiv/,socarxiv,preprint-providers,https://api.osf.io/v2/preprints/dnzqr/files/,https://api.osf.io/v2/files/5fcb781c6ebcc6029346ccba/,5fcb781c6ebcc6029346ccba,files,https://api.osf.io/v2/preprints/dnzqr/review_actions/,https://api.osf.io/v2/preprints/dnzqr/requests/,https://api.osf.io/v2/preprints/dnzqr/,https://osf.io/preprints/socarxiv/dnzqr/,https://doi.org/10.31235/osf.io/dnzqr,NA
rs4ph,preprints,2020-12-04T21:29:19.679388,2020-12-06T16:08:21.299637,2020-12-06T16:07:59.382362,NA,NA,Racial Disparities in COVID-19 and Excess Mortality in Minnesota,"The COVID-19 pandemic has produced vastly disproportionate deaths for communities of color in the United States. Minnesota seemingly stands out as an exception to this national pattern, with white Minnesotans accounting for 80% of the population and 82% of COVID-19 deaths. We examine confirmed COVID mortality alongside deaths indirectly attributable to the pandemic -- ‘excess mortality’ -- in Minnesota. This analysis reveals profound racial disparities: age-adjusted excess mortality rates for whites are exceeded by a factor of 2.8-5.3 for all other racial groups, with the highest rates among Black, Latino, and Native Minnesotans. The seemingly small disparities in COVID deaths in Minnesota reflect the interaction of three factors: the natural history of the disease whose early toll was heavily concentrated in nursing homes; an exceptionally divergent age distribution in the state; and a greatly different proportion of excess mortality captured in confirmed-COVID rates for white Minnesotans compared with most other groups.",TRUE,FALSE,COVID-19|excess mortality|racial disparities,2020-12-06T16:08:21.220465,NA,,TRUE,accepted,2020-12-06T16:07:59.382362,FALSE,NA,no,Data access is controlled by the Minnesota Department of Health.,,no,NA,,,"5a8c80f7c698300375c76d84|5a8c80f7c698300375c76d96|Social and Behavioral Sciences|Other Social and Behavioral Sciences|5a8c80f7c698300375c76d84|5a8c80f8c698300375c76ddb|5a8c80f9c698300375c76de2|Social and Behavioral Sciences|Public Affairs, Public Policy and Public Administration|Health Policy|5a8c80f7c698300375c76d84|5a8c80fac698300375c76e20|Social and Behavioral Sciences|Sociology",,2020,https://api.osf.io/v2/preprints/rs4ph/contributors/,https://api.osf.io/v2/preprints/rs4ph/bibliographic_contributors/,https://api.osf.io/v2/preprints/rs4ph/citation/,rs4ph,preprints,https://api.osf.io/v2/preprints/rs4ph/identifiers/,NA,https://api.osf.io/v2/preprints/rs4ph/relationships/node/,NA,NA,https://api.osf.io/v2/licenses/5ad7979bc69830002d8190e3/,5ad7979bc69830002d8190e3,licenses,https://api.osf.io/v2/providers/preprints/socarxiv/,socarxiv,preprint-providers,https://api.osf.io/v2/preprints/rs4ph/files/,https://api.osf.io/v2/files/5fcaaa33aa60b8025e895ebf/,5fcaaa33aa60b8025e895ebf,files,https://api.osf.io/v2/preprints/rs4ph/review_actions/,https://api.osf.io/v2/preprints/rs4ph/requests/,https://api.osf.io/v2/preprints/rs4ph/,https://osf.io/preprints/socarxiv/rs4ph/,https://doi.org/10.31235/osf.io/rs4ph,NA
u5wba,preprints,2020-12-04T19:26:45.222110,2020-12-06T16:10:40.929566,2020-12-06T16:10:17.797737,NA,NA,Rise of the War Machines: Charting the Evolution of Military Technologies from the Neolithic to the Industrial Revolution,"The causes and consequences of technological evolution in world history have been much debated. Of particular importance in many of the theoretical and empirical studies on this topic is innovation in military technologies, details of which are comparatively well preserved in the archaeology and historical record and which are often seen as drivers of broad socio-cultural processes. Here we analyze data on the evolution of key military technologies in a stratified sample of the world’s political systems from the Neolithic to the industrial revolution using Seshat: Global History Databank. Empirically testing a series of previously speculative theories reveals that world population size (as proxy for the potential numbers of innovators), the connectivity between areas of innovation and adoption, and major past innovations such as iron metallurgy and horse riding, all serve as strong predictors of change in military technology. We discuss how the approach showcased here could be extended not only to explain more of the causes and consequences of military innovation but of technological change more generally, with important ramifications for our understanding of the drivers of world history and of the evolution of social complexity.",TRUE,FALSE,cliodynamics|cultural evolution|Evolution of technology|military history|Seshat: Global History Databank,2020-12-06T16:10:40.889229,NA,,TRUE,accepted,2020-12-06T16:10:17.797737,FALSE,NA,no,Will be made available along with article publication in peer-reviewed journal,,no,NA,,,"5a8c80f2c698300375c76c7d|5a8c80f4c698300375c76ccc|5a8c80f4c698300375c76cd6|Arts and Humanities|History|History of Science, Technology, and Medicine|5a8c80f2c698300375c76c7d|5a8c80f4c698300375c76ccc|5a8c80f4c698300375c76ce4|Arts and Humanities|History|Military History|5a8c80f7c698300375c76d84|5a8c80f7c698300375c76d96|Social and Behavioral Sciences|Other Social and Behavioral Sciences",,2020,https://api.osf.io/v2/preprints/u5wba/contributors/,https://api.osf.io/v2/preprints/u5wba/bibliographic_contributors/,https://api.osf.io/v2/preprints/u5wba/citation/,u5wba,preprints,https://api.osf.io/v2/preprints/u5wba/identifiers/,https://api.osf.io/v2/nodes/mkhde/,https://api.osf.io/v2/preprints/u5wba/relationships/node/,mkhde,nodes,https://api.osf.io/v2/licenses/563c1cf88c5e4a3877f9e96a/,563c1cf88c5e4a3877f9e96a,licenses,https://api.osf.io/v2/providers/preprints/socarxiv/,socarxiv,preprint-providers,https://api.osf.io/v2/preprints/u5wba/files/,https://api.osf.io/v2/files/5fca8d794269db02771c56c9/,5fca8d794269db02771c56c9,files,https://api.osf.io/v2/preprints/u5wba/review_actions/,https://api.osf.io/v2/preprints/u5wba/requests/,https://api.osf.io/v2/preprints/u5wba/,https://osf.io/preprints/socarxiv/u5wba/,https://doi.org/10.31235/osf.io/u5wba,NA
a3rn6,preprints,2020-12-04T19:08:15.772484,2020-12-06T05:15:40.846181,2020-12-06T05:15:14.225627,NA,NA,"Contribution of Socioeconomic, Lifestyle, and Medical Risk Factors to Disparities in Dementia and Mortality","Extensive literature in the United States documents racial/ethnic and gender disparities in the incidence and prevalence of dementia yet few studies have examined how race/ethnicity and gender intersect to shape inequalities in the risk of dementia. Moreover, few studies have examined heterogeneity in the contribution of known risk factors to dementia across these demographic strata while properly accounting for the semi-competing risk of death. To better characterize sources of inequality in the risk of dementia, I calculated the proportion of dementia cases attributable to socioeconomic, lifestyle, and medical risk factors across demographic strata using data from the US Health and Retirement Study and a multistate framework that accounts for the semi-competing risk of death. Socioeconomic resources contributed to the largest number of dementia cases but the magnitude of this contribution varied across strata defined by race/ethnicity and gender. The greatest potential for dementia prevention was observed among non-Hispanic black and Hispanic men and women, supporting an intersectionality approach, and underscoring the need for culturally sensitive intervention and public health initiatives to address the growing burden of dementia.",TRUE,FALSE,dementia|health inequality|intersectionality|mortality|multistate|population attributable fraction,2020-12-06T05:15:40.620293,NA,,TRUE,accepted,2020-12-06T05:15:14.225627,FALSE,NA,available,NA,https://hrs.isr.umich.edu/data-products,no,NA,,,5a8c80f7c698300375c76d84|5a8c80fac698300375c76e20|5a8c80fac698300375c76e46|Social and Behavioral Sciences|Sociology|Aging and the Life Course,,2020,https://api.osf.io/v2/preprints/a3rn6/contributors/,https://api.osf.io/v2/preprints/a3rn6/bibliographic_contributors/,https://api.osf.io/v2/preprints/a3rn6/citation/,a3rn6,preprints,https://api.osf.io/v2/preprints/a3rn6/identifiers/,NA,https://api.osf.io/v2/preprints/a3rn6/relationships/node/,NA,NA,https://api.osf.io/v2/licenses/563c1cf88c5e4a3877f9e96a/,563c1cf88c5e4a3877f9e96a,licenses,https://api.osf.io/v2/providers/preprints/socarxiv/,socarxiv,preprint-providers,https://api.osf.io/v2/preprints/a3rn6/files/,https://api.osf.io/v2/files/5fca89236ebcc6024b46cb0b/,5fca89236ebcc6024b46cb0b,files,https://api.osf.io/v2/preprints/a3rn6/review_actions/,https://api.osf.io/v2/preprints/a3rn6/requests/,https://api.osf.io/v2/preprints/a3rn6/,https://osf.io/preprints/socarxiv/a3rn6/,https://doi.org/10.31235/osf.io/a3rn6,NA
