id,type,attributes.date_created,attributes.date_modified,attributes.date_published,attributes.original_publication_date,attributes.doi,attributes.title,attributes.description,attributes.is_published,attributes.is_preprint_orphan,attributes.tags,attributes.preprint_doi_created,attributes.date_withdrawn,attributes.current_user_permissions,attributes.public,attributes.reviews_state,attributes.date_last_transitioned,attributes.has_coi,attributes.conflict_of_interest_statement,attributes.has_data_links,attributes.why_no_data,attributes.data_links,attributes.has_prereg_links,attributes.why_no_prereg,attributes.prereg_links,attributes.prereg_link_info,attributes.subjects,attributes.license_record.copyright_holders,attributes.license_record.year,relationships.contributors.links.related.href,relationships.bibliographic_contributors.links.related.href,relationships.citation.links.related.href,relationships.citation.data.id,relationships.citation.data.type,relationships.identifiers.links.related.href,relationships.node.links.related.href,relationships.node.links.self.href,relationships.node.data.id,relationships.node.data.type,relationships.license.links.related.href,relationships.license.data.id,relationships.license.data.type,relationships.provider.links.related.href,relationships.provider.data.id,relationships.provider.data.type,relationships.files.links.related.href,relationships.primary_file.links.related.href,relationships.primary_file.data.id,relationships.primary_file.data.type,relationships.review_actions.links.related.href,relationships.requests.links.related.href,links.self,links.html,links.doi,links.preprint_doi
3qudt,preprints,2017-06-16T14:51:35.451193,2018-07-02T10:59:34.518186,2017-06-16T15:12:45.517573,NA,10.15761/MHAR.1000136,Older adults and mobile technology: Factors that enhance and inhibit utilization in the context of behavioral health,"While numbers and proportions of older adults with behavioral health issues are expected to substantially increase, there is also a widening gap in available services for older adults. Mobile health interventions (mhealth) are a way to address existing barriers to treatment, provide frontline assessment and increase access to services for older adults. Due to perpetuated stereotypes, many assume that older adults do not utilize mobile technology nor will they accept a mHealth intervention. The purpose of this paper is to synthesize contemporary literature from information technology and healthcare regarding: (1) current mobile technology utilization by older adults, particularly in regards to health; (2) factors affecting older adult motivation to engage with mobile technology; and (3) older adult preferences for interacting with mobile technology. Findings reveal that significant proportions of older adults: already utilize mobile technology; are willing to engage in existing mobile interventions for health reasons; and have positive attitudes overall towards mobile technology. Finally, recommendations for optimizing mobile interventions to better suit older adults with behavioral health problems are reviewed.",TRUE,FALSE,behavioral health|mHealth|mobile health|mobile technology|older adults,2018-07-02T10:59:34.508446,NA,,TRUE,accepted,2017-06-16T15:12:45.517573,NA,NA,NA,NA,NA,NA,NA,NA,NA,5a8c80f7c698300375c76d84|5a8c80f8c698300375c76dcf|Social and Behavioral Sciences|Social Work,Alexis Kuerbis|Adina Mulliken|Frederick Muench|Alison A . Moore|Daniel Gardner,2017,https://api.osf.io/v2/preprints/3qudt/contributors/,https://api.osf.io/v2/preprints/3qudt/bibliographic_contributors/,https://api.osf.io/v2/preprints/3qudt/citation/,3qudt,preprints,https://api.osf.io/v2/preprints/3qudt/identifiers/,https://api.osf.io/v2/nodes/bjk95/,https://api.osf.io/v2/preprints/3qudt/relationships/node/,bjk95,nodes,https://api.osf.io/v2/licenses/563c1cf88c5e4a3877f9e96c/,563c1cf88c5e4a3877f9e96c,licenses,https://api.osf.io/v2/providers/preprints/socarxiv/,socarxiv,preprint-providers,https://api.osf.io/v2/preprints/3qudt/files/,https://api.osf.io/v2/files/5943f077b83f69022aba0815/,5943f077b83f69022aba0815,files,https://api.osf.io/v2/preprints/3qudt/review_actions/,https://api.osf.io/v2/preprints/3qudt/requests/,https://api.osf.io/v2/preprints/3qudt/,https://osf.io/preprints/socarxiv/3qudt/,https://doi.org/10.15761/MHAR.1000136,https://doi.org/10.31235/osf.io/3qudt
62xbd,preprints,2017-06-16T11:36:55.809024,2018-07-02T10:59:34.484379,2017-06-16T11:43:40.983551,NA,NA,An Analytic Approach to Culture,"In this paper, I outline a general framework for cultural analysis that is consistent with an “analytic” approach to explanation in science, emphasizing the identification and specification of cultural phenomena within concrete interactive systems. These dynamic cultural causal systems (DCCSs) are subject to the heuristic discovery strategies of localization and decomposition. Culture is always located somewhere and every cultural phenomenon is always decomposable into its lower level component units. Decomposition does not imply reduction, as emergence of higher level phenomena from the interaction of persons, their relations, and processes of recombination, transmission, learning, and memory is allowed for. I show that such an approach can be useful for handling most of the “meta-phenomena” of interest to cultural analysts, inclusive of the most important one of all, which is concerned with processes of cultural genesis and change.",TRUE,FALSE,Analytical Sociology|Cultural Analysis|Cultural Change|Cultural Dynamics|Cultural Units|Culture|Mechanisms,2018-07-02T10:59:34.475786,NA,,TRUE,accepted,2017-06-16T11:43:40.983551,NA,NA,NA,NA,NA,NA,NA,NA,NA,"5a8c80f7c698300375c76d84|5a8c80fac698300375c76e20|5a8c80fac698300375c76e34|Social and Behavioral Sciences|Sociology|Communication, Information Technologies, and Media Sociology|5a8c80f7c698300375c76d84|5a8c80fac698300375c76e20|5a8c80fac698300375c76e51|Social and Behavioral Sciences|Sociology|Culture",,2017,https://api.osf.io/v2/preprints/62xbd/contributors/,https://api.osf.io/v2/preprints/62xbd/bibliographic_contributors/,https://api.osf.io/v2/preprints/62xbd/citation/,62xbd,preprints,https://api.osf.io/v2/preprints/62xbd/identifiers/,https://api.osf.io/v2/nodes/zrk23/,https://api.osf.io/v2/preprints/62xbd/relationships/node/,zrk23,nodes,https://api.osf.io/v2/licenses/563c1cf88c5e4a3877f9e96c/,563c1cf88c5e4a3877f9e96c,licenses,https://api.osf.io/v2/providers/preprints/socarxiv/,socarxiv,preprint-providers,https://api.osf.io/v2/preprints/62xbd/files/,https://api.osf.io/v2/files/5943c2d7b83f69022cba2ae3/,5943c2d7b83f69022cba2ae3,files,https://api.osf.io/v2/preprints/62xbd/review_actions/,https://api.osf.io/v2/preprints/62xbd/requests/,https://api.osf.io/v2/preprints/62xbd/,https://osf.io/preprints/socarxiv/62xbd/,NA,https://doi.org/10.31235/osf.io/62xbd
7hf8t,preprints,2017-06-16T09:13:41.249105,2018-07-02T10:59:34.385096,2017-06-16T09:15:38.373927,NA,10.5153/sro.2785,Drinking with and without fun: Female students’ accounts of pre-drinking and club-drinking,"Pre-drinking, also known as pre-partying, pre-gaming, and front- or pre-loading, is the intensive pair or group consumption of alcohol in a private home prior to going out for the night, with the intention of ensuring maximum levels of intoxication. It has emerged as a distinct component of heavy drinking practice among young adults approximately between the ages of 18-25. This paper examines reflective accounts of female students’ pre-drinking and club-drinking. It explores the experience of pre-drinking in the context of the overall drinking sequence undertaken throughout the evening in and the night out. It finds that pre-drinking has a specific purpose for young women in managing risk, as well as ensuring a shared level of intoxication in preparation for entry into public drinking spaces.  Their accounts illustrate the performative nature of intoxication. Pre-drinking is highly directed, bounded, and ritualised. It was frequently, though not always, recounted as lacking in pleasure for these reasons.  It was associated with preparation for entry to a particular kind of superpub or nightclub especially, where the emphasis was on further rapid alcohol consumption.  Accounts of continued drinking in the nightclubs were dualistic, emphasising pleasure and disgust, along with risk and vulnerability. Risk was experienced as individualised, and the women had shared responsibility for guarding against risk from unsafe others in the nightclub environment. This coding of risk is supported by public health messages targeted at women drinkers and by the more general societal and drinks industry promoted representation of alcohol consumption as normal and abstinence as deviant, which students were critical of.  One attraction of pre-drinking for female students was as a way of protecting and supporting female agency in conditions of generalised, individualised vulnerability.",TRUE,FALSE,agency|alcohol|binge drinking|gender|predrinking|students,2018-07-02T10:59:34.376343,NA,,TRUE,accepted,2017-06-16T09:15:38.373927,NA,NA,NA,NA,NA,NA,NA,NA,NA,5a8c80f7c698300375c76d84|5a8c80fac698300375c76e20|Social and Behavioral Sciences|Sociology,Angus Bancroft,2012,https://api.osf.io/v2/preprints/7hf8t/contributors/,https://api.osf.io/v2/preprints/7hf8t/bibliographic_contributors/,https://api.osf.io/v2/preprints/7hf8t/citation/,7hf8t,preprints,https://api.osf.io/v2/preprints/7hf8t/identifiers/,https://api.osf.io/v2/nodes/z2rcp/,https://api.osf.io/v2/preprints/7hf8t/relationships/node/,z2rcp,nodes,https://api.osf.io/v2/licenses/563c1cf88c5e4a3877f9e965/,563c1cf88c5e4a3877f9e965,licenses,https://api.osf.io/v2/providers/preprints/socarxiv/,socarxiv,preprint-providers,https://api.osf.io/v2/preprints/7hf8t/files/,https://api.osf.io/v2/files/5943a144594d900047bee77a/,5943a144594d900047bee77a,files,https://api.osf.io/v2/preprints/7hf8t/review_actions/,https://api.osf.io/v2/preprints/7hf8t/requests/,https://api.osf.io/v2/preprints/7hf8t/,https://osf.io/preprints/socarxiv/7hf8t/,https://doi.org/10.5153/sro.2785,https://doi.org/10.31235/osf.io/7hf8t
769xf,preprints,2017-06-16T08:51:52.738727,2018-07-02T10:59:34.358076,2017-06-16T09:07:31.002775,NA,10.1080/1369118X.2016.1187643,Challenging the techno-politics of anonymity: the case of cryptomarket users,"Anonymity is treated as a problem of governance that can be subject to technical resolution. We use the example of the darknet to critically examine this approach. We explore the background assumptions that have been made about anonymity as a quality of social life. We conceive of anonymity as a way of engaging and maintaining social relationships in an anonymous mode. We draw on a study of darknet ‘cryptomarket’ users who mainly use the darknet to buy and sell illicit drugs, discuss drug quality and share information on safe and effective use. We identify the personal satisfaction that comes from interacting anonymously online, the challenges this represents for maintaining trusted interactions and how they are overcome, and the combination of technology and action involved in maintaining anonymity. We argue that attempts to promote de-anonymising norms and technology are based on an erroneous understanding of what anonymity is.",TRUE,FALSE,anonymity|cryptomarkets|darknet|digital sociology|drugs|Tor,2018-07-02T10:59:34.349340,NA,,TRUE,accepted,2017-06-16T09:07:31.002775,NA,NA,NA,NA,NA,NA,NA,NA,NA,"5a8c80f7c698300375c76d84|5a8c80fac698300375c76e20|5a8c80fac698300375c76e2b|Social and Behavioral Sciences|Sociology|Crime, Law, and Deviance",Angus Bancroft|Peter Scott Reid,2017,https://api.osf.io/v2/preprints/769xf/contributors/,https://api.osf.io/v2/preprints/769xf/bibliographic_contributors/,https://api.osf.io/v2/preprints/769xf/citation/,769xf,preprints,https://api.osf.io/v2/preprints/769xf/identifiers/,https://api.osf.io/v2/nodes/8uhjm/,https://api.osf.io/v2/preprints/769xf/relationships/node/,8uhjm,nodes,https://api.osf.io/v2/licenses/563c1cf88c5e4a3877f9e965/,563c1cf88c5e4a3877f9e965,licenses,https://api.osf.io/v2/providers/preprints/socarxiv/,socarxiv,preprint-providers,https://api.osf.io/v2/preprints/769xf/files/,https://api.osf.io/v2/files/59439c27594d900044beba5a/,59439c27594d900044beba5a,files,https://api.osf.io/v2/preprints/769xf/review_actions/,https://api.osf.io/v2/preprints/769xf/requests/,https://api.osf.io/v2/preprints/769xf/,https://osf.io/preprints/socarxiv/769xf/,https://doi.org/10.1080/1369118X.2016.1187643,https://doi.org/10.31235/osf.io/769xf
pc7nw,preprints,2017-06-16T06:52:34.732148,2020-11-18T18:27:45.724734,2017-06-16T07:35:20.647641,NA,NA,"In Status We Trust: Socioeconomic Status, Reputation and Interpersonal Trust in Peer-to-Peer Markets","Online peer-to-peer markets decentralize distribution of resources, creating a trust problem in economic exchange on the internet. Individual characteristics of trustees, as determinants for being trusted, are thus getting increasingly important. In light of this societal development, this study is concerned with socioeconomic status and reputation as part of the explanans for interpersonal trust. Some have argued that lower status trustees are trusted more easily because of their repeated reliance on resources in their social network. Others state that higher status trustees are trusted more easily, for they are more vulnerable to social control and loss of reputation.

We propose a novel, quasi-experimental method for examining interpersonal trust situations mimicking the reality of peer-to-peer market platforms. 626 respondents were asked to place trust in their preferable trustee based on the asking price, and seller's characteristics. Conditional logistic regression models were estimated and showed that status increases perceived trustworthiness, and positively affects the trust premium for past trustworthy behavior. Strong reputation effects were found, sending out a warning for inequitable emergent hierarchies through reputation cascading.",TRUE,FALSE,peer-to-peer markets|reputation|socioeconomic status|trust|vignette experiment,2018-07-02T10:59:34.278915,NA,,TRUE,accepted,2017-06-16T07:35:20.647641,NA,NA,NA,NA,NA,NA,NA,NA,NA,"5a8c80f7c698300375c76d84|5a8c80fac698300375c76e20|5a8c80fac698300375c76e2d|Social and Behavioral Sciences|Sociology|Economic Sociology|5a8c80f7c698300375c76d84|5a8c80fac698300375c76e20|5a8c80fac698300375c76e38|Social and Behavioral Sciences|Sociology|Organizations, Occupations, and Work|5a8c80f7c698300375c76d84|5a8c80fac698300375c76e20|5a8c80fac698300375c76e48|Social and Behavioral Sciences|Sociology|Labor and Labor Movements",Marijn A. Keijzer|Rense Corten,2020,https://api.osf.io/v2/preprints/pc7nw/contributors/,https://api.osf.io/v2/preprints/pc7nw/bibliographic_contributors/,https://api.osf.io/v2/preprints/pc7nw/citation/,pc7nw,preprints,https://api.osf.io/v2/preprints/pc7nw/identifiers/,https://api.osf.io/v2/nodes/wfjgz/,https://api.osf.io/v2/preprints/pc7nw/relationships/node/,wfjgz,nodes,https://api.osf.io/v2/licenses/563c1cf88c5e4a3877f9e965/,563c1cf88c5e4a3877f9e965,licenses,https://api.osf.io/v2/providers/preprints/socarxiv/,socarxiv,preprint-providers,https://api.osf.io/v2/preprints/pc7nw/files/,https://api.osf.io/v2/files/59438031594d900045bea922/,59438031594d900045bea922,files,https://api.osf.io/v2/preprints/pc7nw/review_actions/,https://api.osf.io/v2/preprints/pc7nw/requests/,https://api.osf.io/v2/preprints/pc7nw/,https://osf.io/preprints/socarxiv/pc7nw/,NA,https://doi.org/10.31235/osf.io/pc7nw
wzcgj,preprints,2017-06-15T21:49:56.509913,2019-10-11T18:48:50.925792,2017-06-15T21:51:19.883703,NA,10.1111/pbaf.12239,The Fiscal Impacts of Urban Sprawl: Evidence from U.S. County Areas,"This paper examines the fiscal impacts of urban development patterns in the United States. Previous studies have indicated that low-density, spatially expansive development patterns are costly to provide public services leading to higher per capita expenditures. However, theory would suggest alternate outcomes. These two possibilities are examined empirically using a panel dataset of U.S. county areas from 1982 to 2012 and a specification allowing for a potential non-linearity between development patterns and per capita expenditures. Estimates indicate that the spatial extent of urban development is the most important, suggesting that more compact development is less costly to provide public services. Increased density increases per capita expenditures suggesting ""urban harshness""; however, the effects are quantitatively small.",TRUE,FALSE,local government finance|population density|urban sprawl,2018-07-02T10:59:34.144376,NA,,TRUE,accepted,2017-06-15T21:51:19.883703,NA,NA,NA,NA,NA,NA,NA,NA,NA,5a8c80f7c698300375c76d84|5a8c80f7c698300375c76d97|Social and Behavioral Sciences|Urban Studies and Planning|5a8c80f7c698300375c76d84|5a8c80f8c698300375c76dbe|5a8c80f8c698300375c76dce|Social and Behavioral Sciences|Economics|Public Economics,,2017,https://api.osf.io/v2/preprints/wzcgj/contributors/,https://api.osf.io/v2/preprints/wzcgj/bibliographic_contributors/,https://api.osf.io/v2/preprints/wzcgj/citation/,wzcgj,preprints,https://api.osf.io/v2/preprints/wzcgj/identifiers/,https://api.osf.io/v2/nodes/2nmjw/,https://api.osf.io/v2/preprints/wzcgj/relationships/node/,2nmjw,nodes,https://api.osf.io/v2/licenses/563c1cf88c5e4a3877f9e96a/,563c1cf88c5e4a3877f9e96a,licenses,https://api.osf.io/v2/providers/preprints/socarxiv/,socarxiv,preprint-providers,https://api.osf.io/v2/preprints/wzcgj/files/,https://api.osf.io/v2/files/59430104b83f69022cb9f5e9/,59430104b83f69022cb9f5e9,files,https://api.osf.io/v2/preprints/wzcgj/review_actions/,https://api.osf.io/v2/preprints/wzcgj/requests/,https://api.osf.io/v2/preprints/wzcgj/,https://osf.io/preprints/socarxiv/wzcgj/,https://doi.org/10.1111/pbaf.12239,https://doi.org/10.31235/osf.io/wzcgj
3rd7v,preprints,2017-06-15T18:09:50.663394,2018-08-20T03:07:23.490000,2017-06-15T18:15:56.140832,NA,NA,Do Cities and Counties Attempt to Circumvent Changes in their Autonomy by Creating Special Districts?,"This study uses forty years of data from the US Census of Governments to examine the impact of changes in local autonomy on the creation of the fastest growing form of local governments, special districts. Using fixed effects regression specified at the urban county and metropolitan statistical area level, we find that restrictions of fiscal autonomy of cities is associated with creation of new special districts. When the limits on fiscal autonomy interacts with grants of functional autonomy, amplification occurs. We find no analogous effects for county governments. These two findings are consistent with the circumvention argument made in the local autonomy literature.",TRUE,FALSE,Home rule|Local governments|Special districts|Tax and expenditure limitations,2018-07-02T10:59:34.014012,NA,,TRUE,accepted,2017-06-15T18:15:56.140832,NA,NA,NA,NA,NA,NA,NA,NA,NA,"5a8c80f7c698300375c76d84|5a8c80f8c698300375c76daf|5a8c80f8c698300375c76db5|Social and Behavioral Sciences|Political Science|American Politics|5a8c80f7c698300375c76d84|5a8c80f8c698300375c76ddb|Social and Behavioral Sciences|Public Affairs, Public Policy and Public Administration",,2017,https://api.osf.io/v2/preprints/3rd7v/contributors/,https://api.osf.io/v2/preprints/3rd7v/bibliographic_contributors/,https://api.osf.io/v2/preprints/3rd7v/citation/,3rd7v,preprints,https://api.osf.io/v2/preprints/3rd7v/identifiers/,https://api.osf.io/v2/nodes/5wn4c/,https://api.osf.io/v2/preprints/3rd7v/relationships/node/,5wn4c,nodes,https://api.osf.io/v2/licenses/563c1cf88c5e4a3877f9e96a/,563c1cf88c5e4a3877f9e96a,licenses,https://api.osf.io/v2/providers/preprints/socarxiv/,socarxiv,preprint-providers,https://api.osf.io/v2/preprints/3rd7v/files/,https://api.osf.io/v2/files/5942cd6d6c613b022ba11c44/,5942cd6d6c613b022ba11c44,files,https://api.osf.io/v2/preprints/3rd7v/review_actions/,https://api.osf.io/v2/preprints/3rd7v/requests/,https://api.osf.io/v2/preprints/3rd7v/,https://osf.io/preprints/socarxiv/3rd7v/,NA,https://doi.org/10.31235/osf.io/3rd7v
2vjxk,preprints,2017-06-14T20:06:38.829853,2018-07-02T10:59:33.663296,2017-06-14T20:07:36.361704,NA,NA,"A possible case of mycetoma in ancient Rome (Italy, 2nd-3rd centuries AD)","Reports of historical individuals with mycetoma are anecdotal in the palaeopathology literature, particularly in more temperate areas of the world. This article details a probable case of mycetoma in Imperial-era Rome, Italy. Differential diagnoses of leprosy, erosive arthropathy, sarcoidosis, and mycoses are considered. Given the morphology and pattern of the lower leg lesions and the ecology of the disease, the authors conclude that mycetoma is the most likely explanation.",TRUE,FALSE,,2018-07-02T10:59:33.654564,NA,,TRUE,accepted,2017-06-14T20:07:36.361704,NA,NA,NA,NA,NA,NA,NA,NA,NA,5a8c80f7c698300375c76d84|5a8c80f9c698300375c76df6|5a8c80f9c698300375c76dfc|Social and Behavioral Sciences|Anthropology|Biological and Physical Anthropology,,2017,https://api.osf.io/v2/preprints/2vjxk/contributors/,https://api.osf.io/v2/preprints/2vjxk/bibliographic_contributors/,https://api.osf.io/v2/preprints/2vjxk/citation/,2vjxk,preprints,https://api.osf.io/v2/preprints/2vjxk/identifiers/,https://api.osf.io/v2/nodes/48x9s/,https://api.osf.io/v2/preprints/2vjxk/relationships/node/,48x9s,nodes,https://api.osf.io/v2/licenses/563c1cf88c5e4a3877f9e96a/,563c1cf88c5e4a3877f9e96a,licenses,https://api.osf.io/v2/providers/preprints/socarxiv/,socarxiv,preprint-providers,https://api.osf.io/v2/preprints/2vjxk/files/,https://api.osf.io/v2/files/5941974e9ad5a1004682ce7c/,5941974e9ad5a1004682ce7c,files,https://api.osf.io/v2/preprints/2vjxk/review_actions/,https://api.osf.io/v2/preprints/2vjxk/requests/,https://api.osf.io/v2/preprints/2vjxk/,https://osf.io/preprints/socarxiv/2vjxk/,NA,https://doi.org/10.31235/osf.io/2vjxk
g8nqy,preprints,2017-06-14T09:19:37.597532,2018-07-18T15:55:40.886824,2017-06-14T09:22:02.024141,NA,10.1007/s11266-018-0025-8,Do Millennials care about NPOs? Intergenerational differences in attitudes towards nonprofit organizations,"In this study, we analyze whether there are differences in attitudes towards nonprofit organizations (NPOs) between the generational cohorts of Baby Boomers, Generation X, and Millennials. We do so by analyzing survey data from Switzerland in two steps, a Bayesian estimation as well as a cluster analysis. The overall results suggest that there are, at best, only few and small intergenerational differences: The only consistent effect we find are the more negative attitudes of the Baby Boomer cohort towards professional associations and towards sports NPOs, but those differences could be due to life cycle rather than intergenerational effects. Overall, our results suggest that the Millennial generational cohort is at least as interested in and willing to engage with NPOs as previous generational cohorts.",TRUE,FALSE,attitudes|babyboomers|generations|generation x|gen x|millennials|nonprofits|npos|values,2018-07-02T10:59:33.484213,NA,,TRUE,accepted,2017-06-14T09:22:02.024141,NA,NA,NA,NA,NA,NA,NA,NA,NA,5a8c80f7c698300375c76d84|5a8c80fac698300375c76e20|Social and Behavioral Sciences|Sociology,,2017,https://api.osf.io/v2/preprints/g8nqy/contributors/,https://api.osf.io/v2/preprints/g8nqy/bibliographic_contributors/,https://api.osf.io/v2/preprints/g8nqy/citation/,g8nqy,preprints,https://api.osf.io/v2/preprints/g8nqy/identifiers/,https://api.osf.io/v2/nodes/8rsd4/,https://api.osf.io/v2/preprints/g8nqy/relationships/node/,8rsd4,nodes,https://api.osf.io/v2/licenses/563c1cf88c5e4a3877f9e96a/,563c1cf88c5e4a3877f9e96a,licenses,https://api.osf.io/v2/providers/preprints/socarxiv/,socarxiv,preprint-providers,https://api.osf.io/v2/preprints/g8nqy/files/,https://api.osf.io/v2/files/5940ffa89ad5a10046828b35/,5940ffa89ad5a10046828b35,files,https://api.osf.io/v2/preprints/g8nqy/review_actions/,https://api.osf.io/v2/preprints/g8nqy/requests/,https://api.osf.io/v2/preprints/g8nqy/,https://osf.io/preprints/socarxiv/g8nqy/,https://doi.org/10.1007/s11266-018-0025-8,https://doi.org/10.31235/osf.io/g8nqy
