k5tb7,preprints,2017-10-31T17:27:03.661642,2018-07-02T11:19:49.034651,2017-10-31T17:33:20.555146,NA,10.1017/nws.2017.16,Social influence on 5-year survival in a longitudinal chemotherapy ward co-presence network,"Chemotherapy is often administered in openly designed hospital wards, where the possibility
of patient–patient social influence on health exists. Previous research found that social
relationships influence cancer patient’s health; however, we have yet to understand social
influence among patients receiving chemotherapy in the hospital. We investigate the influence
of co-presence in a chemotherapy ward. We use data on 4,691 cancer patients undergoing
chemotherapy in Oxfordshire, United Kingdom who average 59.8 years of age, and 44% are
Male. We construct a network of patients where edges exist when patients are co-present
in the ward, weighted by both patients’ time in the ward. Social influence is based on total
weighted co-presence with focal patients’ immediate neighbors, considering neighbors’ 5-year
mortality. Generalized estimating equations evaluated the effect of neighbors’ 5-year mortality
on focal patient’s 5-year mortality. Each 1,000-unit increase in weighted co-presence with a
patient who dies within 5 years increases a patient’s mortality odds by 42% (β = 0.357,
CI:0.204,0.510). Each 1,000-unit increase in co-presence with a patient surviving 5 years
reduces a patient’s odds of dying by 30% (β = −0.344, CI:−0.538,0.149). Our results suggest
that social influence occurs in chemotherapy wards, and thus may need to be considered in
chemotherapy delivery.",TRUE,FALSE,,2018-07-02T11:19:49.016441,NA,,TRUE,accepted,2017-10-31T17:33:20.555146,NA,NA,NA,NA,NA,NA,NA,NA,NA,5a8c80f7c698300375c76d84|5a8c80fac698300375c76e20|5a8c80fac698300375c76e2e|Social and Behavioral Sciences|Sociology|Mental Health|5a8c80f7c698300375c76d84|5a8c80fac698300375c76e20|5a8c80fac698300375c76e4e|Social and Behavioral Sciences|Sociology|Medical Sociology,US Government,2017,https://api.osf.io/v2/preprints/k5tb7/contributors/,https://api.osf.io/v2/preprints/k5tb7/bibliographic_contributors/,https://api.osf.io/v2/preprints/k5tb7/citation/,k5tb7,preprints,https://api.osf.io/v2/preprints/k5tb7/identifiers/,https://api.osf.io/v2/nodes/pfndk/,https://api.osf.io/v2/preprints/k5tb7/relationships/node/,pfndk,nodes,https://api.osf.io/v2/licenses/563c1cf88c5e4a3877f9e96a/,563c1cf88c5e4a3877f9e96a,licenses,https://api.osf.io/v2/providers/preprints/socarxiv/,socarxiv,preprint-providers,https://api.osf.io/v2/preprints/k5tb7/files/,https://api.osf.io/v2/files/59f8b267594d90026cd8062f/,59f8b267594d90026cd8062f,files,https://api.osf.io/v2/preprints/k5tb7/review_actions/,https://api.osf.io/v2/preprints/k5tb7/requests/,https://api.osf.io/v2/preprints/k5tb7/,https://osf.io/preprints/socarxiv/k5tb7/,https://doi.org/10.31235/osf.io/k5tb7,https://doi.org/10.1017/nws.2017.16
ewqk9,preprints,2017-10-31T17:09:18.544863,2018-07-02T11:19:48.938836,2017-10-31T17:11:18.946298,NA,10.1093/ije/dyx183,Uncertainties in addressing the ‘health gap’,Invited commentary of Michael Marmot's book 'The Health Gap'.,TRUE,FALSE,,2018-07-02T11:19:48.929497,NA,,TRUE,accepted,2017-10-31T17:11:18.946298,NA,NA,NA,NA,NA,NA,NA,NA,NA,5a8c80f7c698300375c76d84|5a8c80fac698300375c76e20|5a8c80fac698300375c76e2e|Social and Behavioral Sciences|Sociology|Mental Health|5a8c80f7c698300375c76d84|5a8c80fac698300375c76e20|5a8c80fac698300375c76e4e|Social and Behavioral Sciences|Sociology|Medical Sociology,Oxford Academic,2017,https://api.osf.io/v2/preprints/ewqk9/contributors/,https://api.osf.io/v2/preprints/ewqk9/bibliographic_contributors/,https://api.osf.io/v2/preprints/ewqk9/citation/,ewqk9,preprints,https://api.osf.io/v2/preprints/ewqk9/identifiers/,https://api.osf.io/v2/nodes/9s4eq/,https://api.osf.io/v2/preprints/ewqk9/relationships/node/,9s4eq,nodes,https://api.osf.io/v2/licenses/563c1cf88c5e4a3877f9e965/,563c1cf88c5e4a3877f9e965,licenses,https://api.osf.io/v2/providers/preprints/socarxiv/,socarxiv,preprint-providers,https://api.osf.io/v2/preprints/ewqk9/files/,https://api.osf.io/v2/files/59f8ae3d9ad5a1026d125647/,59f8ae3d9ad5a1026d125647,files,https://api.osf.io/v2/preprints/ewqk9/review_actions/,https://api.osf.io/v2/preprints/ewqk9/requests/,https://api.osf.io/v2/preprints/ewqk9/,https://osf.io/preprints/socarxiv/ewqk9/,https://doi.org/10.31235/osf.io/ewqk9,https://doi.org/10.1093/ije/dyx183
9v8js,preprints,2017-10-31T13:59:17.068587,2018-07-02T11:19:48.560542,2017-10-31T14:16:20.884593,NA,NA,Constitutional Perspectives on Machine Learning,"This paper discusses the notions of individual fairness and group fairness discussed in the fairness, accountability and transparency in machine learning (FATML) literature, in the light of equality and anti-discrimination provisions in The Constitution of India.",TRUE,FALSE,discrimination|equality|fairness|indian constitution|machine learning,2018-07-02T11:19:48.549878,NA,,TRUE,accepted,2017-10-31T14:16:20.884593,NA,NA,NA,NA,NA,NA,NA,NA,NA,5a8c80f0c698300375c76c07|5a8c80f1c698300375c76c3e|Law|Constitutional Law,,2017,https://api.osf.io/v2/preprints/9v8js/contributors/,https://api.osf.io/v2/preprints/9v8js/bibliographic_contributors/,https://api.osf.io/v2/preprints/9v8js/citation/,9v8js,preprints,https://api.osf.io/v2/preprints/9v8js/identifiers/,https://api.osf.io/v2/nodes/e8mnv/,https://api.osf.io/v2/preprints/9v8js/relationships/node/,e8mnv,nodes,https://api.osf.io/v2/licenses/563c1cf88c5e4a3877f9e96a/,563c1cf88c5e4a3877f9e96a,licenses,https://api.osf.io/v2/providers/preprints/socarxiv/,socarxiv,preprint-providers,https://api.osf.io/v2/preprints/9v8js/files/,https://api.osf.io/v2/files/59f881b39ad5a1026d123f46/,59f881b39ad5a1026d123f46,files,https://api.osf.io/v2/preprints/9v8js/review_actions/,https://api.osf.io/v2/preprints/9v8js/requests/,https://api.osf.io/v2/preprints/9v8js/,https://osf.io/preprints/socarxiv/9v8js/,https://doi.org/10.31235/osf.io/9v8js,NA
