id,type,attributes.date_created,attributes.date_modified,attributes.date_published,attributes.original_publication_date,attributes.doi,attributes.title,attributes.description,attributes.is_published,attributes.is_preprint_orphan,attributes.tags,attributes.preprint_doi_created,attributes.date_withdrawn,attributes.current_user_permissions,attributes.public,attributes.reviews_state,attributes.date_last_transitioned,attributes.has_coi,attributes.conflict_of_interest_statement,attributes.has_data_links,attributes.why_no_data,attributes.data_links,attributes.has_prereg_links,attributes.why_no_prereg,attributes.prereg_links,attributes.prereg_link_info,attributes.subjects,attributes.license_record.copyright_holders,attributes.license_record.year,relationships.contributors.links.related.href,relationships.bibliographic_contributors.links.related.href,relationships.citation.links.related.href,relationships.citation.data.id,relationships.citation.data.type,relationships.identifiers.links.related.href,relationships.node.links.related.href,relationships.node.links.self.href,relationships.node.data.id,relationships.node.data.type,relationships.license.links.related.href,relationships.license.data.id,relationships.license.data.type,relationships.provider.links.related.href,relationships.provider.data.id,relationships.provider.data.type,relationships.files.links.related.href,relationships.primary_file.links.related.href,relationships.primary_file.data.id,relationships.primary_file.data.type,relationships.review_actions.links.related.href,relationships.requests.links.related.href,links.self,links.html,links.preprint_doi,links.doi
5acrw,preprints,2017-11-03T12:13:39.902133,2018-07-02T11:20:44.976904,2017-11-03T12:15:24.973653,NA,NA,Degrees of Freedom Analysis in Educational Research and Decision-Making: Leveraging Qualitative Data to Promote Excellence in Bioinformatics Training and Education,"This manuscript is in press (November, 2017) at Briefings in Bioinformatics. 

Qualitative data are commonly collected in higher, graduate, and post-graduate education; however, perhaps especially in the quantitative sciences, utilization of this qualitative data for decision-making can be challenging. A method for the analysis of qualitative data is the Degrees of Freedom Analysis, published in 1975. Given its origins in political science and its application in mainly business contexts, the degrees-of-freedom analysis method (DoFA) is unlikely to be discoverable or used to understand survey or other educational data obtained from teaching, training, or evaluation. This paper therefore introduces and demonstrates the DoFA with modifications specifically to support educational research and decision-making with examples in bioinformatics. DoFA identifies and aligns theoretical or applied principles with qualitative evidence. The demonstrations include two hypothetical examples, and a case study of the role of scaffolding in an independent project (“capstone”) of a graduate course in biostatistics. Included to promote inquiry, inquiry-based learning, and the development of research skills, the capstone is often scaffolded (instructor-supported and therefore, formative), although it is actually intended to be summative. The case analysis addresses the question of whether the scaffolding provided for a capstone assignment affects its utility for formative or summative assessment. The DoFA is also used to evaluate the relative efficacies of other models for scaffolding the capstone project. These examples are intended to both explain this method and to demonstrate how it can be used to make decisions within a curriculum or for bioinformatics training.",TRUE,FALSE,,2018-07-02T11:20:44.967254,NA,,TRUE,accepted,2017-11-03T12:15:24.973653,NA,NA,NA,NA,NA,NA,NA,NA,NA,5a8c80f6c698300375c76d4e|5a8c80f6c698300375c76d56|Education|Adult and Continuing Education|5a8c80f6c698300375c76d4e|5a8c80f6c698300375c76d5c|Education|Higher Education|5a8c80f6c698300375c76d4e|5a8c80f7c698300375c76d63|Education|Curriculum and Instruction|5a8c80f6c698300375c76d4e|5a8c80f7c698300375c76d65|Education|Other Education,,2017,https://api.osf.io/v2/preprints/5acrw/contributors/,https://api.osf.io/v2/preprints/5acrw/bibliographic_contributors/,https://api.osf.io/v2/preprints/5acrw/citation/,5acrw,preprints,https://api.osf.io/v2/preprints/5acrw/identifiers/,https://api.osf.io/v2/nodes/e64jd/,https://api.osf.io/v2/preprints/5acrw/relationships/node/,e64jd,nodes,https://api.osf.io/v2/licenses/563c1cf88c5e4a3877f9e96a/,563c1cf88c5e4a3877f9e96a,licenses,https://api.osf.io/v2/providers/preprints/socarxiv/,socarxiv,preprint-providers,https://api.osf.io/v2/preprints/5acrw/files/,https://api.osf.io/v2/files/59fc5d73b83f69026e610404/,59fc5d73b83f69026e610404,files,https://api.osf.io/v2/preprints/5acrw/review_actions/,https://api.osf.io/v2/preprints/5acrw/requests/,https://api.osf.io/v2/preprints/5acrw/,https://osf.io/preprints/socarxiv/5acrw/,https://doi.org/10.31235/osf.io/5acrw,NA
z6fht,preprints,2017-11-03T12:03:41.583739,2018-07-02T11:20:44.915855,2017-11-03T12:10:42.088335,NA,10.1177/1464884917722453,"Valuing subjectivity in journalism: Bias, emotions, and self-interest as tools in arts reporting","This article examines the meanings and norms surrounding subjectivity across traditional and new forms of cultural journalism. While the ideal of objectivity is key to American journalism and its development as a profession, recent scholarship and new media developments have challenged the dominance of objectivity as a professional norm. This article begins with the understanding that subjectivity is an intractable part of knowing (and reporting on) the world around us to build our understanding of different modes of subjectivity and how these animate journalistic practices. Taking arts reporting, specifically reviewing, as a case study, the analysis draws on interviews with 40 book reviewers who write for major American newspapers, including The New York Times, The Los Angeles Times, The Washington Post, and prominent blogs. Findings reveal how emotions, bias, and self-interest are salient – sometimes as vice and sometimes as virtue – across the workflow of critics writing for traditional print outlets and book blogs and that these differences can be conceptualized as different epistemic styles.",TRUE,FALSE,bias|Blogs|books|critics|emotion|epistemology|journalism|newspapers|objectivity|online media|practice|reviews|subjectivity,2018-07-02T11:20:44.900344,NA,,TRUE,accepted,2017-11-03T12:10:42.088335,NA,NA,NA,NA,NA,NA,NA,NA,NA,"5a8c80f7c698300375c76d84|5a8c80f7c698300375c76d96|Social and Behavioral Sciences|Other Social and Behavioral Sciences|5a8c80f7c698300375c76d84|5a8c80f9c698300375c76e0d|Social and Behavioral Sciences|Communication|5a8c80f7c698300375c76d84|5a8c80fac698300375c76e20|5a8c80fac698300375c76e28|Social and Behavioral Sciences|Sociology|Rationality and Society|5a8c80f7c698300375c76d84|5a8c80fac698300375c76e20|5a8c80fac698300375c76e34|Social and Behavioral Sciences|Sociology|Communication, Information Technologies, and Media Sociology|5a8c80f7c698300375c76d84|5a8c80fac698300375c76e20|5a8c80fac698300375c76e37|Social and Behavioral Sciences|Sociology|Theory|5a8c80f7c698300375c76d84|5a8c80fac698300375c76e20|5a8c80fac698300375c76e40|Social and Behavioral Sciences|Sociology|Science, Knowledge, and Technology|5a8c80f7c698300375c76d84|5a8c80fac698300375c76e20|5a8c80fac698300375c76e4a|Social and Behavioral Sciences|Sociology|Marxist Sociology|5a8c80f7c698300375c76d84|5a8c80fac698300375c76e20|5a8c80fac698300375c76e51|Social and Behavioral Sciences|Sociology|Culture",,2017,https://api.osf.io/v2/preprints/z6fht/contributors/,https://api.osf.io/v2/preprints/z6fht/bibliographic_contributors/,https://api.osf.io/v2/preprints/z6fht/citation/,z6fht,preprints,https://api.osf.io/v2/preprints/z6fht/identifiers/,https://api.osf.io/v2/nodes/2kzdx/,https://api.osf.io/v2/preprints/z6fht/relationships/node/,2kzdx,nodes,https://api.osf.io/v2/licenses/563c1cf88c5e4a3877f9e96c/,563c1cf88c5e4a3877f9e96c,licenses,https://api.osf.io/v2/providers/preprints/socarxiv/,socarxiv,preprint-providers,https://api.osf.io/v2/preprints/z6fht/files/,https://api.osf.io/v2/files/59fc5b1c9ad5a102665bd6cc/,59fc5b1c9ad5a102665bd6cc,files,https://api.osf.io/v2/preprints/z6fht/review_actions/,https://api.osf.io/v2/preprints/z6fht/requests/,https://api.osf.io/v2/preprints/z6fht/,https://osf.io/preprints/socarxiv/z6fht/,https://doi.org/10.31235/osf.io/z6fht,https://doi.org/10.1177/1464884917722453
uz4gd,preprints,2017-11-03T09:38:34.174742,2018-07-02T11:20:44.826165,2017-11-03T09:44:39.784403,NA,10.1108/S1529-212620170000024006,"Another science war: fictitious evidence on women's fertility and the ""egg aging"" panic in 2010s Japan","In the early 2010s, Japanese society recognized and experienced a panic about increasing infertility and people's lack of knowledge about human reproduction. This paper focuses on several graphs that misrepresented or distorted scientific findings that were used in the campaign related to this panic and explores (1) how the graphs were made, used, and authorized, and (2) how they contributed to changes in discourses and policies. Findings are the following: (1) The graphs were made in the field of obstetrics, gynecology, and reproductive medicine by questionable methods, including falsifying, trimming, and misunderstanding of data. (2) Researchers in the field of fertility study relied on secondary and tertiary sources thus ignoring and compounding errors. (3) Such inauthentic research was approved and politically mobilized by professional organizations, rather than being penalized or criticized. (4) Discourse based on such unscientific knowledge may have encouraged a pronatalist policy of promoting early marriage and education about human fertility and life planning, targeted at teenage girls.",TRUE,FALSE,academic integrity|biology|education|fecundity|fertility|gender|Japan|medicine|population|pronatalist policy|pseudoscience|reproductive medicine|reproductive rights|research ethics,2018-07-02T11:20:44.814955,NA,,TRUE,accepted,2017-11-03T09:44:39.784403,NA,NA,NA,NA,NA,NA,NA,NA,NA,"5a8c80f7c698300375c76d84|5a8c80f8c698300375c76ddb|Social and Behavioral Sciences|Public Affairs, Public Policy and Public Administration|5a8c80f7c698300375c76d84|5a8c80f9c698300375c76df4|Social and Behavioral Sciences|Science and Technology Studies|5a8c80f7c698300375c76d84|5a8c80fac698300375c76e20|5a8c80fac698300375c76e28|Social and Behavioral Sciences|Sociology|Rationality and Society|5a8c80f7c698300375c76d84|5a8c80fac698300375c76e20|5a8c80fac698300375c76e29|Social and Behavioral Sciences|Sociology|Sexualities|5a8c80f7c698300375c76d84|5a8c80fac698300375c76e20|5a8c80fac698300375c76e2e|Social and Behavioral Sciences|Sociology|Mental Health|5a8c80f7c698300375c76d84|5a8c80fac698300375c76e20|5a8c80fac698300375c76e37|Social and Behavioral Sciences|Sociology|Theory|5a8c80f7c698300375c76d84|5a8c80fac698300375c76e20|5a8c80fac698300375c76e3e|Social and Behavioral Sciences|Sociology|Population|5a8c80f7c698300375c76d84|5a8c80fac698300375c76e20|5a8c80fac698300375c76e40|Social and Behavioral Sciences|Sociology|Science, Knowledge, and Technology|5a8c80f7c698300375c76d84|5a8c80fac698300375c76e20|5a8c80fac698300375c76e45|Social and Behavioral Sciences|Sociology|Animals and Society|5a8c80f7c698300375c76d84|5a8c80fac698300375c76e20|5a8c80fac698300375c76e49|Social and Behavioral Sciences|Sociology|Sex and Gender|5a8c80f7c698300375c76d84|5a8c80fac698300375c76e20|5a8c80fac698300375c76e4a|Social and Behavioral Sciences|Sociology|Marxist Sociology|5a8c80f7c698300375c76d84|5a8c80fac698300375c76e20|5a8c80fac698300375c76e4e|Social and Behavioral Sciences|Sociology|Medical Sociology",,2017,https://api.osf.io/v2/preprints/uz4gd/contributors/,https://api.osf.io/v2/preprints/uz4gd/bibliographic_contributors/,https://api.osf.io/v2/preprints/uz4gd/citation/,uz4gd,preprints,https://api.osf.io/v2/preprints/uz4gd/identifiers/,https://api.osf.io/v2/nodes/5qshk/,https://api.osf.io/v2/preprints/uz4gd/relationships/node/,5qshk,nodes,https://api.osf.io/v2/licenses/563c1cf88c5e4a3877f9e96a/,563c1cf88c5e4a3877f9e96a,licenses,https://api.osf.io/v2/providers/preprints/socarxiv/,socarxiv,preprint-providers,https://api.osf.io/v2/preprints/uz4gd/files/,https://api.osf.io/v2/files/59fc3919b83f69026c60f570/,59fc3919b83f69026c60f570,files,https://api.osf.io/v2/preprints/uz4gd/review_actions/,https://api.osf.io/v2/preprints/uz4gd/requests/,https://api.osf.io/v2/preprints/uz4gd/,https://osf.io/preprints/socarxiv/uz4gd/,https://doi.org/10.31235/osf.io/uz4gd,https://doi.org/10.1108/S1529-212620170000024006
by96x,preprints,2017-11-02T04:47:27.123619,2018-07-02T11:20:43.473620,2017-11-02T04:49:21.555928,NA,NA,The Hyperreality of the Alt Right: How Meme Magic Works to Create a Space for Far Right Politics.,"An analysis of the interconnection between the Alt Right and the ironic and irreverent communication style of 4Chan. Using Baudrillard and Bourdieu to understand both the ways this mode of communication is used to hide ones politics whilst openly espousing them, and how the use of such ironic humour can create a space for these politics to grow.",TRUE,FALSE,4chan|alt right|Baudrillard|Bourdieu|memes|right wing extremism,2018-07-02T11:20:43.463617,NA,,TRUE,accepted,2017-11-02T04:49:21.555928,NA,NA,NA,NA,NA,NA,NA,NA,NA,5a8c80f2c698300375c76c7d|Arts and Humanities|5a8c80f7c698300375c76d84|5a8c80f9c698300375c76e0d|5a8c80f9c698300375c76e13|Social and Behavioral Sciences|Communication|Critical and Cultural Studies,Dan Prisk,2017,https://api.osf.io/v2/preprints/by96x/contributors/,https://api.osf.io/v2/preprints/by96x/bibliographic_contributors/,https://api.osf.io/v2/preprints/by96x/citation/,by96x,preprints,https://api.osf.io/v2/preprints/by96x/identifiers/,https://api.osf.io/v2/nodes/3pqkd/,https://api.osf.io/v2/preprints/by96x/relationships/node/,3pqkd,nodes,https://api.osf.io/v2/licenses/563c1cf88c5e4a3877f9e965/,563c1cf88c5e4a3877f9e965,licenses,https://api.osf.io/v2/providers/preprints/socarxiv/,socarxiv,preprint-providers,https://api.osf.io/v2/preprints/by96x/files/,https://api.osf.io/v2/files/59faa35eb83f69026ce48191/,59faa35eb83f69026ce48191,files,https://api.osf.io/v2/preprints/by96x/review_actions/,https://api.osf.io/v2/preprints/by96x/requests/,https://api.osf.io/v2/preprints/by96x/,https://osf.io/preprints/socarxiv/by96x/,https://doi.org/10.31235/osf.io/by96x,NA
xrqak,preprints,2017-11-02T02:49:12.956110,2018-07-02T11:20:43.218948,2017-11-02T02:53:22.009520,NA,NA,Google Books Rejected: Taking the Orphans to the Digital Public Library of Alexandria,"The idea of the Library of Alexandria has powerfully expanded over the centuries, embodying the dream of universal wisdom and knowledge centralized in one single place. Digitization projects, such as the Google books project, are reviving the hope that this dream may come true. Moreover, the ubiquity of the networked environment promises to open access to this über-library to everybody with an internet connection. Today the entire collection of human knowledge may be only one click away. Whether the dream of the Library of Alexandria may be achieved by the Google books project is highly debated. Recently, a court decision concluded that perhaps that dream is not within Google’s reach at the moment. In this paper I will review the Google books project as both an opportunity to discuss the orphan works problem and to examine the copyright strictures impinging on digitization projects. In looking at the Google books litigation, I will investigate the sustainability of Google’s fair use defense before delving into the description of the Google books settlement. I will then discuss the recent opinion from the Court of the Southern District of New York rejecting the settlement in its present form. I will argue that the Google books settlement is an additional move towards propertization and privatization of culture, though admittedly furthering public interest as well. This time, privatization involves memory institutions. In warning against this privatization, I will argue that we need a global effort towards the creation of a World Digital Public Library.",TRUE,FALSE,copyright|digital library|digitization|Europeana|Google books|Goolgle|litigation|opt out|orphan works|settlement,2018-07-02T11:20:43.208390,NA,,TRUE,accepted,2017-11-02T02:53:22.009520,NA,NA,NA,NA,NA,NA,NA,NA,NA,"5a8c80f0c698300375c76c07|5a8c80f0c698300375c76c15|Law|Science and Technology Law|5a8c80f0c698300375c76c07|5a8c80f1c698300375c76c22|Law|Computer Law|5a8c80f0c698300375c76c07|5a8c80f1c698300375c76c3a|Law|Civil Law|5a8c80f0c698300375c76c07|5a8c80f1c698300375c76c3f|Law|Litigation|5a8c80f0c698300375c76c07|5a8c80f1c698300375c76c42|Law|Commercial Law|5a8c80f0c698300375c76c07|5a8c80f1c698300375c76c4b|Law|Law and Society|5a8c80f0c698300375c76c07|5a8c80f2c698300375c76c4e|Law|Intellectual Property Law|5a8c80f0c698300375c76c07|5a8c80f2c698300375c76c54|Law|Entertainment, Arts, and Sports Law|5a8c80f0c698300375c76c07|5a8c80f2c698300375c76c62|Law|Jurisprudence|5a8c80f0c698300375c76c07|5a8c80f2c698300375c76c69|Law|Internet Law",,2017,https://api.osf.io/v2/preprints/xrqak/contributors/,https://api.osf.io/v2/preprints/xrqak/bibliographic_contributors/,https://api.osf.io/v2/preprints/xrqak/citation/,xrqak,preprints,https://api.osf.io/v2/preprints/xrqak/identifiers/,https://api.osf.io/v2/nodes/5crfq/,https://api.osf.io/v2/preprints/xrqak/relationships/node/,5crfq,nodes,https://api.osf.io/v2/licenses/563c1cf88c5e4a3877f9e96a/,563c1cf88c5e4a3877f9e96a,licenses,https://api.osf.io/v2/providers/preprints/socarxiv/,socarxiv,preprint-providers,https://api.osf.io/v2/preprints/xrqak/files/,https://api.osf.io/v2/files/59fa87a79ad5a1026d130358/,59fa87a79ad5a1026d130358,files,https://api.osf.io/v2/preprints/xrqak/review_actions/,https://api.osf.io/v2/preprints/xrqak/requests/,https://api.osf.io/v2/preprints/xrqak/,https://osf.io/preprints/socarxiv/xrqak/,https://doi.org/10.31235/osf.io/xrqak,NA
jx2rb,preprints,2017-11-02T02:37:29.475665,2018-07-02T11:20:43.184418,2017-11-02T02:40:45.489825,NA,10.1093/jiplp/jpx061,From Horizontal to Vertical: An Intermediary Liability Earthquake in Europe,"As part of its Digital Single Market Strategy, the European Commission would like to introduce vertical regulations, replacing — or better conflicting with — the well-established eCommerce Directive horizontal intermediary liability regime. An upcoming revision of the Audio-visual Media Services Directive would ask platforms to put in place measures to protect minors from harmful content and to protect everyone from incitement to hatred. Meanwhile — under the assumption of closing a ‘value gap’ between rightholders and online platforms allegedly exploiting protected content — the Draft Directive on Copyright in the Digital Single Market would implement filtering obligations for intermediaries. Finally, the EU Digital Single Market Strategy has also endorsed voluntary measures as a privileged tool to curb illicit and infringing activities online. Each of these actions will erode the eCommerce intermediary liability arrangement by bringing in — in a way or another — proactive monitoring obligations and causing a systemic shift from a negligence-based to a strict liability regime for hosting providers. This systemic shift would apparently occur against public consensus and absent any justification based on empirical evidence. Nonetheless, it will bring about dire consequences by pushing privatization of enforcement online through algorithmic intelligence, based on murky, privately-enforced standards, rather than transparent legal obligations. This reform might cause a policy earthquake that will shake and crack EU law’s systemic consistency, due process and fundamental rights online.",TRUE,FALSE,Copyright|European Law|Infringement|Intermediary Liability|Internet|Online Platform|Piracy|Platform Economy|Reform,2018-07-02T11:20:43.172478,NA,,TRUE,accepted,2017-11-02T02:40:45.489825,NA,NA,NA,NA,NA,NA,NA,NA,NA,5a8c80f0c698300375c76c07|5a8c80f0c698300375c76c15|Law|Science and Technology Law|5a8c80f0c698300375c76c07|5a8c80f1c698300375c76c3a|Law|Civil Law|5a8c80f0c698300375c76c07|5a8c80f1c698300375c76c42|Law|Commercial Law|5a8c80f0c698300375c76c07|5a8c80f1c698300375c76c4b|Law|Law and Society|5a8c80f0c698300375c76c07|5a8c80f2c698300375c76c4e|Law|Intellectual Property Law|5a8c80f0c698300375c76c07|5a8c80f2c698300375c76c61|Law|Torts|5a8c80f0c698300375c76c07|5a8c80f2c698300375c76c69|Law|Internet Law,,2017,https://api.osf.io/v2/preprints/jx2rb/contributors/,https://api.osf.io/v2/preprints/jx2rb/bibliographic_contributors/,https://api.osf.io/v2/preprints/jx2rb/citation/,jx2rb,preprints,https://api.osf.io/v2/preprints/jx2rb/identifiers/,https://api.osf.io/v2/nodes/g9y3f/,https://api.osf.io/v2/preprints/jx2rb/relationships/node/,g9y3f,nodes,https://api.osf.io/v2/licenses/563c1cf88c5e4a3877f9e96a/,563c1cf88c5e4a3877f9e96a,licenses,https://api.osf.io/v2/providers/preprints/socarxiv/,socarxiv,preprint-providers,https://api.osf.io/v2/preprints/jx2rb/files/,https://api.osf.io/v2/files/59fa84e86c613b026a52db6e/,59fa84e86c613b026a52db6e,files,https://api.osf.io/v2/preprints/jx2rb/review_actions/,https://api.osf.io/v2/preprints/jx2rb/requests/,https://api.osf.io/v2/preprints/jx2rb/,https://osf.io/preprints/socarxiv/jx2rb/,https://doi.org/10.31235/osf.io/jx2rb,https://doi.org/10.1093/jiplp/jpx061
xd37b,preprints,2017-10-31T18:52:26.190633,2018-07-02T11:19:49.347328,2017-10-31T18:54:30.782829,NA,NA,The Persistent and Exceptional Intensity of American Religion: A Response to Recent Research,"Recent research argues that the United States is secularizing, that this religious change is consistent with the secularization thesis, and that American religion is not exceptional. But we show that rather than religion fading into irrelevance as the secularization thesis would suggest, intense religion—strong affiliation, very frequent practice, literalism, and evangelicalism—is persistent and, in fact, only moderate religion is on the decline in the United States. We also show that in comparable countries intense religion is on the decline or already at very low levels. Therefore, the intensity of American religion is actually becoming more exceptional over time. We conclude that intense religion in the United States is persistent and exceptional in ways that do not fit the secularization thesis.",TRUE,FALSE,Religion|Secularization|Social Change,2018-07-02T11:19:49.333029,NA,,TRUE,accepted,2017-10-31T18:54:30.782829,NA,NA,NA,NA,NA,NA,NA,NA,NA,"5a8c80f2c698300375c76c7d|5a8c80f4c698300375c76cac|Arts and Humanities|Religion|5a8c80f7c698300375c76d84|5a8c80fac698300375c76e20|5a8c80fac698300375c76e23|Social and Behavioral Sciences|Sociology|Human Rights|5a8c80f7c698300375c76d84|5a8c80fac698300375c76e20|5a8c80fac698300375c76e31|Social and Behavioral Sciences|Sociology|Sociology of Religion|5a8c80f7c698300375c76d84|5a8c80fac698300375c76e20|5a8c80fac698300375c76e39|Social and Behavioral Sciences|Sociology|Collective Behavior and Social Movements|5a8c80f7c698300375c76d84|5a8c80fac698300375c76e20|5a8c80fac698300375c76e3b|Social and Behavioral Sciences|Sociology|Political Economy of the World System|5a8c80f7c698300375c76d84|5a8c80fac698300375c76e20|5a8c80fac698300375c76e42|Social and Behavioral Sciences|Sociology|Peace, War, and Social Conflict|5a8c80f7c698300375c76d84|5a8c80fac698300375c76e20|5a8c80fac698300375c76e53|Social and Behavioral Sciences|Sociology|Altruism, Morality, and Social Solidarity",,2017,https://api.osf.io/v2/preprints/xd37b/contributors/,https://api.osf.io/v2/preprints/xd37b/bibliographic_contributors/,https://api.osf.io/v2/preprints/xd37b/citation/,xd37b,preprints,https://api.osf.io/v2/preprints/xd37b/identifiers/,https://api.osf.io/v2/nodes/f7bps/,https://api.osf.io/v2/preprints/xd37b/relationships/node/,f7bps,nodes,https://api.osf.io/v2/licenses/563c1cf88c5e4a3877f9e96a/,563c1cf88c5e4a3877f9e96a,licenses,https://api.osf.io/v2/providers/preprints/socarxiv/,socarxiv,preprint-providers,https://api.osf.io/v2/preprints/xd37b/files/,https://api.osf.io/v2/files/59f8c669594d90026cd810c0/,59f8c669594d90026cd810c0,files,https://api.osf.io/v2/preprints/xd37b/review_actions/,https://api.osf.io/v2/preprints/xd37b/requests/,https://api.osf.io/v2/preprints/xd37b/,https://osf.io/preprints/socarxiv/xd37b/,https://doi.org/10.31235/osf.io/xd37b,NA
