id,type,attributes.date_created,attributes.date_modified,attributes.date_published,attributes.original_publication_date,attributes.doi,attributes.title,attributes.description,attributes.is_published,attributes.is_preprint_orphan,attributes.tags,attributes.preprint_doi_created,attributes.date_withdrawn,attributes.current_user_permissions,attributes.public,attributes.reviews_state,attributes.date_last_transitioned,attributes.has_coi,attributes.conflict_of_interest_statement,attributes.has_data_links,attributes.why_no_data,attributes.data_links,attributes.has_prereg_links,attributes.why_no_prereg,attributes.prereg_links,attributes.prereg_link_info,attributes.subjects,attributes.license_record.copyright_holders,attributes.license_record.year,relationships.contributors.links.related.href,relationships.bibliographic_contributors.links.related.href,relationships.citation.links.related.href,relationships.citation.data.id,relationships.citation.data.type,relationships.identifiers.links.related.href,relationships.node.links.related.href,relationships.node.links.self.href,relationships.node.data.id,relationships.node.data.type,relationships.license.links.related.href,relationships.license.data.id,relationships.license.data.type,relationships.provider.links.related.href,relationships.provider.data.id,relationships.provider.data.type,relationships.files.links.related.href,relationships.primary_file.links.related.href,relationships.primary_file.data.id,relationships.primary_file.data.type,relationships.review_actions.links.related.href,relationships.requests.links.related.href,links.self,links.html,links.preprint_doi,links.doi
ch8qt,preprints,2017-01-11T21:04:52.716000,2018-07-02T10:48:28.460095,2017-01-11T21:06:06.903000,NA,NA,Response Error and the Medicaid Undercount in the Current Population Survey,"The Current Population Survey Annual Social and Economic Supplement (CPS ASEC) is an important source for estimates of the uninsured population. Previous research has shown that survey estimates produce an undercount of beneficiaries compared to Medicaid enrollment records. We extend past work by examining the Medicaid undercount in the 2007-2011 CPS ASEC compared to enrollment data from the Medicaid Statistical Information System for calendar years 2006-2010. By linking individuals across datasets, we analyze two types of response error regarding Medicaid enrollment – false negative error and false positive error. We use regression analysis to identify factors associated with these two types of response error in the 2011 CPS ASEC. We find that the Medicaid undercount was between 22 and 31 percent from 2007 to 2011. In 2011, the false negative rate was 40 percent, and 27 percent of Medicaid reports in CPS ASEC were false positives. False negative error is associated with the duration of enrollment in Medicaid, enrollment in Medicare and private insurance, and Medicaid enrollment in the survey year. False positive error is associated with enrollment in Medicare and shared Medicaid coverage in the household. We discuss implications for survey reports of health insurance coverage and for estimating the uninsured population.",TRUE,FALSE,Administrative data|Medicaid undercount|Record linkage|Response error|Uninsured,2018-07-02T10:48:28.435840,NA,,TRUE,accepted,2017-01-11T21:06:06.903000,NA,NA,NA,NA,NA,NA,NA,NA,NA,5a8c80f7c698300375c76d84|5a8c80f9c698300375c76e0c|Social and Behavioral Sciences|Social Statistics|5a8c80f7c698300375c76d84|5a8c80fac698300375c76e20|5a8c80fac698300375c76e3e|Social and Behavioral Sciences|Sociology|Population|5a8c80f7c698300375c76d84|5a8c80fac698300375c76e20|5a8c80fac698300375c76e45|Social and Behavioral Sciences|Sociology|Animals and Society,,2017,https://api.osf.io/v2/preprints/ch8qt/contributors/,https://api.osf.io/v2/preprints/ch8qt/bibliographic_contributors/,https://api.osf.io/v2/preprints/ch8qt/citation/,ch8qt,preprints,https://api.osf.io/v2/preprints/ch8qt/identifiers/,https://api.osf.io/v2/nodes/96u68/,https://api.osf.io/v2/preprints/ch8qt/relationships/node/,96u68,nodes,https://api.osf.io/v2/licenses/563c1cf88c5e4a3877f9e96c/,563c1cf88c5e4a3877f9e96c,licenses,https://api.osf.io/v2/providers/preprints/socarxiv/,socarxiv,preprint-providers,https://api.osf.io/v2/preprints/ch8qt/files/,https://api.osf.io/v2/files/58769c73b83f6901fa172b05/,58769c73b83f6901fa172b05,files,https://api.osf.io/v2/preprints/ch8qt/review_actions/,https://api.osf.io/v2/preprints/ch8qt/requests/,https://api.osf.io/v2/preprints/ch8qt/,https://osf.io/preprints/socarxiv/ch8qt/,https://doi.org/10.31235/osf.io/ch8qt,NA
5xhh6,preprints,2017-01-11T20:50:15.303000,2018-07-02T10:46:26.316539,2017-01-11T20:56:57.562000,NA,NA,When Race and Hispanic Origin Reporting are Discrepant Across Administrative Records and Third Party Sources: Exploring Methods to Assign Responses,"The U.S. Census Bureau is researching uses of administrative records and third party data in survey and decennial census operations. One potential use of administrative records is to utilize these data when race and Hispanic origin responses are missing. When federal and third party administrative records are compiled, race and Hispanic origin responses are not always the same for an individual across sources. We explore different methods to assign one race and one Hispanic response when these responses are discrepant. We also describe the characteristics of individuals with matching, non-matching, and missing race and Hispanic origin data by demographic, household, and contextual variables. We find that minorities, especially Hispanics, are more likely to have non-matching Hispanic origin and race responses in administrative records and third party data compared to the 2010 Census. Minority groups and individuals ages 0-17 are more likely to have missing race or Hispanic origin data in administrative records and third party data. Larger households tend to have more missing race data in administrative records and third party data than smaller households.",TRUE,FALSE,Administrative records|Hispanic origin|Race|Record linkage,2018-07-02T10:46:26.307399,NA,,TRUE,accepted,2017-01-11T20:56:57.562000,NA,NA,NA,NA,NA,NA,NA,NA,NA,5a8c80f7c698300375c76d84|5a8c80fac698300375c76e20|5a8c80fac698300375c76e2a|Social and Behavioral Sciences|Sociology|Racial and Ethnic Minorities|5a8c80f7c698300375c76d84|5a8c80fac698300375c76e20|5a8c80fac698300375c76e3d|Social and Behavioral Sciences|Sociology|Latina/o Sociology|5a8c80f7c698300375c76d84|5a8c80fac698300375c76e20|5a8c80fac698300375c76e3e|Social and Behavioral Sciences|Sociology|Population|5a8c80f7c698300375c76d84|5a8c80fac698300375c76e20|5a8c80fac698300375c76e45|Social and Behavioral Sciences|Sociology|Animals and Society,,2017,https://api.osf.io/v2/preprints/5xhh6/contributors/,https://api.osf.io/v2/preprints/5xhh6/bibliographic_contributors/,https://api.osf.io/v2/preprints/5xhh6/citation/,5xhh6,preprints,https://api.osf.io/v2/preprints/5xhh6/identifiers/,https://api.osf.io/v2/nodes/9hdv2/,https://api.osf.io/v2/preprints/5xhh6/relationships/node/,9hdv2,nodes,https://api.osf.io/v2/licenses/563c1cf88c5e4a3877f9e96c/,563c1cf88c5e4a3877f9e96c,licenses,https://api.osf.io/v2/providers/preprints/socarxiv/,socarxiv,preprint-providers,https://api.osf.io/v2/preprints/5xhh6/files/,https://api.osf.io/v2/files/58769a806c613b01fb6d0b9d/,58769a806c613b01fb6d0b9d,files,https://api.osf.io/v2/preprints/5xhh6/review_actions/,https://api.osf.io/v2/preprints/5xhh6/requests/,https://api.osf.io/v2/preprints/5xhh6/,https://osf.io/preprints/socarxiv/5xhh6/,https://doi.org/10.31235/osf.io/5xhh6,NA
xeqne,preprints,2017-01-11T19:30:05.357000,2018-07-02T10:53:50.951876,2017-01-11T19:34:44.414000,NA,NA,An outside view: What do observers say about others’ races and Hispanic origins?,"Outsiders’ views of a person’s race or Hispanic origin can impact how she sees herself, how she reports her race and Hispanic origins, and her social and economic experiences. The way outsiders describe non-strangers in terms of their race and Hispanic origin may reveal popular assumptions about which race/Hispanic categories are salient for Americans, which kinds of people are seen as multiracial, and the types of cues people use when identifying another person’s race. We study patterns of observer identification using a unique, large, linked data source with two measures of a person’s race and Hispanic origin. One measure (from Census 2000 or the 2010 Census) was provided by a household respondent and the other (from the other census year) was provided by a census proxy reporter (e.g., a neighbor) who responded on behalf of a non-responsive household. We ask: Does an outsider’s report of a person’s race and Hispanic origin match a household report? We find that in about 90% of our 3.7 million (nonrepresentative) cases, proxy reports of a person’s race and Hispanic origin match responses given by the household in a different census year. Match rates are high for the largest groups: non-Hispanic whites, blacks, and Asians and for Hispanics, though proxies are not very able to replicate the race responses of Hispanics. Matches are much less common for people in smaller groups (American Indian/Alaska Native, Pacific Islander, Some Other Race, and multiracial). We also ask: What predicts a matched response and what predicts a particular unmatched response? We find evidence of the persistence of hypodescent for blacks and hyperdescent for American Indians. Biracial Asian-whites and Pacific Islander-whites are more often seen by others as non-Hispanic white than as people of color. Proxy reporters tend to identify children as multiple race and elders as single race, whether they are or not. The race/Hispanic composition of the tract is more powerfully predictive of a particular unmatched response than are tract-level measures of socioeconomic status; unmatched responses are often consistent with the race/Hispanic characteristics of the neighborhood.",TRUE,FALSE,2010 Census|Census 2000|Hispanic origin|proxy response|race|record linkage,2018-07-02T10:53:50.943312,NA,,TRUE,accepted,2017-01-11T19:34:44.414000,NA,NA,NA,NA,NA,NA,NA,NA,NA,5a8c80f7c698300375c76d84|5a8c80fac698300375c76e20|5a8c80fac698300375c76e2a|Social and Behavioral Sciences|Sociology|Racial and Ethnic Minorities|5a8c80f7c698300375c76d84|5a8c80fac698300375c76e20|5a8c80fac698300375c76e3d|Social and Behavioral Sciences|Sociology|Latina/o Sociology|5a8c80f7c698300375c76d84|5a8c80fac698300375c76e20|5a8c80fac698300375c76e3e|Social and Behavioral Sciences|Sociology|Population|5a8c80f7c698300375c76d84|5a8c80fac698300375c76e20|5a8c80fac698300375c76e45|Social and Behavioral Sciences|Sociology|Animals and Society,,2017,https://api.osf.io/v2/preprints/xeqne/contributors/,https://api.osf.io/v2/preprints/xeqne/bibliographic_contributors/,https://api.osf.io/v2/preprints/xeqne/citation/,xeqne,preprints,https://api.osf.io/v2/preprints/xeqne/identifiers/,https://api.osf.io/v2/nodes/8x7zz/,https://api.osf.io/v2/preprints/xeqne/relationships/node/,8x7zz,nodes,https://api.osf.io/v2/licenses/563c1cf88c5e4a3877f9e96c/,563c1cf88c5e4a3877f9e96c,licenses,https://api.osf.io/v2/providers/preprints/socarxiv/,socarxiv,preprint-providers,https://api.osf.io/v2/preprints/xeqne/files/,https://api.osf.io/v2/files/587687b69ad5a10201a19eca/,587687b69ad5a10201a19eca,files,https://api.osf.io/v2/preprints/xeqne/review_actions/,https://api.osf.io/v2/preprints/xeqne/requests/,https://api.osf.io/v2/preprints/xeqne/,https://osf.io/preprints/socarxiv/xeqne/,https://doi.org/10.31235/osf.io/xeqne,NA
dy9pg,preprints,2017-01-11T19:19:15.114000,2018-07-02T10:48:34.141046,2017-01-11T19:23:20.303000,NA,NA,Evaluating Race and Hispanic Origin Responses of Medicaid Participants Using Census Data,"Health and health care disparities associated with race or Hispanic origin are complex and continue to challenge researchers and policy makers. With the intention of improving the measurement and monitoring of these disparities, provisions of the Patient Protection and Affordable Care Act (ACA) of 2010 require states to collect, report and analyze data on demographic characteristics of applicants and participants in Medicaid and other federally supported programs. By linking Medicaid records to 2010 Census, American Community Survey, and Census 2000, this new large-scale study examines and documents the extent to which pre-ACA Medicaid administrative records match self-reported race and Hispanic origin in Census data. Linked records allow comparisons between individuals with matching and non-matching race and Hispanic origin data across several demographic, socioeconomic and neighborhood characteristics, such as age, gender, language proficiency, education and Census tract variables. Identification of the groups most likely to have non-matching and missing race and Hispanic origin data in Medicaid relative to Census data can inform strategies to improve the quality of demographic data collected from Medicaid populations.",TRUE,FALSE,Census|Hispanic origin|Medicaid|Rac|Record linkage,2018-07-02T10:48:34.127250,NA,,TRUE,accepted,2017-01-11T19:23:20.303000,NA,NA,NA,NA,NA,NA,NA,NA,NA,5a8c80f7c698300375c76d84|5a8c80fac698300375c76e20|5a8c80fac698300375c76e2a|Social and Behavioral Sciences|Sociology|Racial and Ethnic Minorities|5a8c80f7c698300375c76d84|5a8c80fac698300375c76e20|5a8c80fac698300375c76e3d|Social and Behavioral Sciences|Sociology|Latina/o Sociology|5a8c80f7c698300375c76d84|5a8c80fac698300375c76e20|5a8c80fac698300375c76e3e|Social and Behavioral Sciences|Sociology|Population|5a8c80f7c698300375c76d84|5a8c80fac698300375c76e20|5a8c80fac698300375c76e45|Social and Behavioral Sciences|Sociology|Animals and Society,,2017,https://api.osf.io/v2/preprints/dy9pg/contributors/,https://api.osf.io/v2/preprints/dy9pg/bibliographic_contributors/,https://api.osf.io/v2/preprints/dy9pg/citation/,dy9pg,preprints,https://api.osf.io/v2/preprints/dy9pg/identifiers/,https://api.osf.io/v2/nodes/9h5xm/,https://api.osf.io/v2/preprints/dy9pg/relationships/node/,9h5xm,nodes,https://api.osf.io/v2/licenses/563c1cf88c5e4a3877f9e96c/,563c1cf88c5e4a3877f9e96c,licenses,https://api.osf.io/v2/providers/preprints/socarxiv/,socarxiv,preprint-providers,https://api.osf.io/v2/preprints/dy9pg/files/,https://api.osf.io/v2/files/5876852b9ad5a101ffa19e3a/,5876852b9ad5a101ffa19e3a,files,https://api.osf.io/v2/preprints/dy9pg/review_actions/,https://api.osf.io/v2/preprints/dy9pg/requests/,https://api.osf.io/v2/preprints/dy9pg/,https://osf.io/preprints/socarxiv/dy9pg/,https://doi.org/10.31235/osf.io/dy9pg,NA
nk8mg,preprints,2017-01-11T19:17:21.897000,2018-07-02T10:51:45.224766,2017-01-11T19:23:14.388000,NA,NA,Work-Family Calendars for Family Sociology Research,"We present an active learning exercise for students in family sociology, gender, or population studies. The main contribution is to introduce a standard work-family history calendar which students use to structure inter-views with women ages 34-65. We offer details on the exercise, the attendant research paper assignment, and suggestions for class activities and discussions to enhance the learning experience. Feedback from students suggests the calendar exercise helps organize the interview, recognize patterns in the data, and develop an ar-gument for the research paper. Finally, we present a simple quantitative data manipulation, based on several hundred student calendars, as an example of the potential benefit of aggregating the calendars within or across classes performing the exercise.",TRUE,FALSE,family sociology|life history|teaching sociology,2018-07-02T10:51:45.216169,NA,,TRUE,accepted,2017-01-11T19:23:14.388000,NA,NA,NA,NA,NA,NA,NA,NA,NA,5a8c80f7c698300375c76d84|5a8c80fac698300375c76e20|5a8c80fac698300375c76e46|Social and Behavioral Sciences|Sociology|Aging and the Life Course|5a8c80f7c698300375c76d84|5a8c80fac698300375c76e20|5a8c80fac698300375c76e47|Social and Behavioral Sciences|Sociology|Children and Youth,,2017,https://api.osf.io/v2/preprints/nk8mg/contributors/,https://api.osf.io/v2/preprints/nk8mg/bibliographic_contributors/,https://api.osf.io/v2/preprints/nk8mg/citation/,nk8mg,preprints,https://api.osf.io/v2/preprints/nk8mg/identifiers/,https://api.osf.io/v2/nodes/6hhyq/,https://api.osf.io/v2/preprints/nk8mg/relationships/node/,6hhyq,nodes,https://api.osf.io/v2/licenses/563c1cf88c5e4a3877f9e96c/,563c1cf88c5e4a3877f9e96c,licenses,https://api.osf.io/v2/providers/preprints/socarxiv/,socarxiv,preprint-providers,https://api.osf.io/v2/preprints/nk8mg/files/,https://api.osf.io/v2/files/587684ba9ad5a101fea19e14/,587684ba9ad5a101fea19e14,files,https://api.osf.io/v2/preprints/nk8mg/review_actions/,https://api.osf.io/v2/preprints/nk8mg/requests/,https://api.osf.io/v2/preprints/nk8mg/,https://osf.io/preprints/socarxiv/nk8mg/,https://doi.org/10.31235/osf.io/nk8mg,NA
z8a62,preprints,2017-01-11T19:06:58.723000,2018-07-02T10:55:05.573899,2017-01-11T19:13:55.101000,NA,NA,Exploring Administrative Records Use for Race and Hispanic Origin Item Non-Response,"Race and Hispanic origin data are required to produce official statistics in the United States. Data collected through the American Community Survey and decennial census address missing data through traditional imputation methods, often relying on information from neighbors. These methods work well if neighbors share similar characteristics, however, the shape and patterns of neighborhoods in the United States are changing. Administrative records may provide more accurate data compared to traditional imputation methods for missing race and Hispanic origin responses. This paper first describes the characteristics of persons with missing demographic data, then assesses the coverage of administrative records data for respondents who do not answer race and Hispanic origin questions in Census data. The paper also discusses the distributional impact of using administrative records race and Hispanic origin data to complete missing responses in a decennial census or survey context.",TRUE,FALSE,Administrative Records|Hispanic Origin|Race|Record LInkage,2018-07-02T10:55:05.563743,NA,,TRUE,accepted,2017-01-11T19:13:55.101000,NA,NA,NA,NA,NA,NA,NA,NA,NA,5a8c80f7c698300375c76d84|5a8c80fac698300375c76e20|5a8c80fac698300375c76e2a|Social and Behavioral Sciences|Sociology|Racial and Ethnic Minorities|5a8c80f7c698300375c76d84|5a8c80fac698300375c76e20|5a8c80fac698300375c76e3d|Social and Behavioral Sciences|Sociology|Latina/o Sociology|5a8c80f7c698300375c76d84|5a8c80fac698300375c76e20|5a8c80fac698300375c76e3e|Social and Behavioral Sciences|Sociology|Population|5a8c80f7c698300375c76d84|5a8c80fac698300375c76e20|5a8c80fac698300375c76e45|Social and Behavioral Sciences|Sociology|Animals and Society,,2017,https://api.osf.io/v2/preprints/z8a62/contributors/,https://api.osf.io/v2/preprints/z8a62/bibliographic_contributors/,https://api.osf.io/v2/preprints/z8a62/citation/,z8a62,preprints,https://api.osf.io/v2/preprints/z8a62/identifiers/,https://api.osf.io/v2/nodes/z2reb/,https://api.osf.io/v2/preprints/z8a62/relationships/node/,z2reb,nodes,https://api.osf.io/v2/licenses/563c1cf88c5e4a3877f9e96c/,563c1cf88c5e4a3877f9e96c,licenses,https://api.osf.io/v2/providers/preprints/socarxiv/,socarxiv,preprint-providers,https://api.osf.io/v2/preprints/z8a62/files/,https://api.osf.io/v2/files/5876824a9ad5a10202a19e0a/,5876824a9ad5a10202a19e0a,files,https://api.osf.io/v2/preprints/z8a62/review_actions/,https://api.osf.io/v2/preprints/z8a62/requests/,https://api.osf.io/v2/preprints/z8a62/,https://osf.io/preprints/socarxiv/z8a62/,https://doi.org/10.31235/osf.io/z8a62,NA
ktmz9,preprints,2017-01-11T18:55:45.504000,2018-07-02T10:51:09.335581,2017-01-11T18:56:22.455000,NA,NA,Coverage and Agreement of Administrative Records and 2010 American Community Survey Demographic Data,"The U.S. Census Bureau is researching possible uses of administrative records in decennial census and survey operations. The 2010 Census Match Study and American Community Survey (ACS) Match Study represent recent efforts by the Census Bureau to evaluate the extent to which administrative records provide data on persons and addresses in the 2010 Census and 2010 ACS. The 2010 Census Match Study also examines demographic response data collected in administrative records. Building on this analysis, we match data from the 2010 ACS to federal administrative records and third party data as well as to previous census data and examine administrative records coverage and agreement of ACS age, sex, race, and Hispanic origin responses. We find high levels of coverage and agreement for sex and age responses and variable coverage and agreement across race and Hispanic origin groups. These results are similar to findings from the 2010 Census Match Study.",TRUE,FALSE,Administrative records|American Community Survey|Record linkage,2018-07-02T10:51:09.310104,NA,,TRUE,accepted,2017-01-11T18:56:22.455000,NA,NA,NA,NA,NA,NA,NA,NA,NA,5a8c80f7c698300375c76d84|5a8c80fac698300375c76e20|5a8c80fac698300375c76e2a|Social and Behavioral Sciences|Sociology|Racial and Ethnic Minorities|5a8c80f7c698300375c76d84|5a8c80fac698300375c76e20|5a8c80fac698300375c76e3d|Social and Behavioral Sciences|Sociology|Latina/o Sociology|5a8c80f7c698300375c76d84|5a8c80fac698300375c76e20|5a8c80fac698300375c76e3e|Social and Behavioral Sciences|Sociology|Population|5a8c80f7c698300375c76d84|5a8c80fac698300375c76e20|5a8c80fac698300375c76e45|Social and Behavioral Sciences|Sociology|Animals and Society,,2017,https://api.osf.io/v2/preprints/ktmz9/contributors/,https://api.osf.io/v2/preprints/ktmz9/bibliographic_contributors/,https://api.osf.io/v2/preprints/ktmz9/citation/,ktmz9,preprints,https://api.osf.io/v2/preprints/ktmz9/identifiers/,https://api.osf.io/v2/nodes/8m6n2/,https://api.osf.io/v2/preprints/ktmz9/relationships/node/,8m6n2,nodes,https://api.osf.io/v2/licenses/563c1cf88c5e4a3877f9e96c/,563c1cf88c5e4a3877f9e96c,licenses,https://api.osf.io/v2/providers/preprints/socarxiv/,socarxiv,preprint-providers,https://api.osf.io/v2/preprints/ktmz9/files/,https://api.osf.io/v2/files/58767dcc9ad5a101fea19e0b/,58767dcc9ad5a101fea19e0b,files,https://api.osf.io/v2/preprints/ktmz9/review_actions/,https://api.osf.io/v2/preprints/ktmz9/requests/,https://api.osf.io/v2/preprints/ktmz9/,https://osf.io/preprints/socarxiv/ktmz9/,https://doi.org/10.31235/osf.io/ktmz9,NA
