id,type,attributes.date_created,attributes.date_modified,attributes.date_published,attributes.original_publication_date,attributes.doi,attributes.title,attributes.description,attributes.is_published,attributes.is_preprint_orphan,attributes.tags,attributes.preprint_doi_created,attributes.date_withdrawn,attributes.current_user_permissions,attributes.public,attributes.reviews_state,attributes.date_last_transitioned,attributes.has_coi,attributes.conflict_of_interest_statement,attributes.has_data_links,attributes.why_no_data,attributes.data_links,attributes.has_prereg_links,attributes.why_no_prereg,attributes.prereg_links,attributes.prereg_link_info,attributes.subjects,attributes.license_record.copyright_holders,attributes.license_record.year,relationships.contributors.links.related.href,relationships.bibliographic_contributors.links.related.href,relationships.citation.links.related.href,relationships.citation.data.id,relationships.citation.data.type,relationships.identifiers.links.related.href,relationships.node.links.related.href,relationships.node.links.self.href,relationships.node.data.id,relationships.node.data.type,relationships.license.links.related.href,relationships.license.data.id,relationships.license.data.type,relationships.provider.links.related.href,relationships.provider.data.id,relationships.provider.data.type,relationships.files.links.related.href,relationships.primary_file.links.related.href,relationships.primary_file.data.id,relationships.primary_file.data.type,relationships.review_actions.links.related.href,relationships.requests.links.related.href,links.self,links.html,links.preprint_doi,links.doi
hfpqj,preprints,2017-08-26T21:54:40.044915,2018-07-02T11:08:11.217389,2017-08-26T22:00:41.507545,NA,NA,strategi perlawanan petani tambang tradisional dalam menjaga kelangsungan hidup ditengah rendahnya imbal jasa,"Mining activity at the old wells done by public Wonocolo and its
surroundings since the 1942, and existence of oil wells traditional
remains this Dutch becomes source of main living for countryside
public Wonocolo and its surroundings. Mining activity done by public
Wonocolo, on the way is felt is against the legislation applied namely;
UU No. 44 the year 1960 jo UU No. 08 the year 1971, in the Law affirms
that mining enterpasing of Migas (oil and gas) done by state with the
state company (Pertamina) as the executor or mining convidential of
clerk.
This research aim, to know the resistance strategy applied by the mining
peasant to take care of continuity of life in the middle of the low wage’s
given by Pertamina. This research, applies qualitative method with
approach of grounded reseacrh. Data collecting technique ; nonparticipant
observation and in-depth interview, and with cycle data
analysis technique : data reduction, data presentation, verification and
conclusion withdrawal. The result in this research, indicates that;
strategy applied by the mining peasant to take care of continuity of life,
by the way ; does distillation self-supportingly, mine proceeds sale
without through KUD Bogo Sasono, and reduction of supply mining
products.
Keyword ; Strategy, resistance of mine peasant, wage",TRUE,FALSE,,2018-07-02T11:08:11.207425,NA,,TRUE,accepted,2017-08-26T22:00:41.507545,NA,NA,NA,NA,NA,NA,NA,NA,NA,"5a8c80f7c698300375c76d84|5a8c80f8c698300375c76daf|5a8c80f8c698300375c76db3|Social and Behavioral Sciences|Political Science|Other Political Science|5a8c80f7c698300375c76d84|5a8c80f8c698300375c76daf|5a8c80f8c698300375c76db4|Social and Behavioral Sciences|Political Science|Political Theory|5a8c80f7c698300375c76d84|5a8c80f8c698300375c76ddb|Social and Behavioral Sciences|Public Affairs, Public Policy and Public Administration|5a8c80f7c698300375c76d84|5a8c80fac698300375c76e20|Social and Behavioral Sciences|Sociology",,2017,https://api.osf.io/v2/preprints/hfpqj/contributors/,https://api.osf.io/v2/preprints/hfpqj/bibliographic_contributors/,https://api.osf.io/v2/preprints/hfpqj/citation/,hfpqj,preprints,https://api.osf.io/v2/preprints/hfpqj/identifiers/,https://api.osf.io/v2/nodes/sj5ay/,https://api.osf.io/v2/preprints/hfpqj/relationships/node/,sj5ay,nodes,https://api.osf.io/v2/licenses/563c1cf88c5e4a3877f9e96c/,563c1cf88c5e4a3877f9e96c,licenses,https://api.osf.io/v2/providers/preprints/socarxiv/,socarxiv,preprint-providers,https://api.osf.io/v2/preprints/hfpqj/files/,https://api.osf.io/v2/files/59a1ee1cb83f69025b17c42d/,59a1ee1cb83f69025b17c42d,files,https://api.osf.io/v2/preprints/hfpqj/review_actions/,https://api.osf.io/v2/preprints/hfpqj/requests/,https://api.osf.io/v2/preprints/hfpqj/,https://osf.io/preprints/socarxiv/hfpqj/,https://doi.org/10.31235/osf.io/hfpqj,NA
vztxn,preprints,2017-08-26T12:25:42.274435,2018-07-02T11:08:10.973977,2017-08-26T12:26:45.417414,NA,NA,Performance of Players and Data Quality in a Citizen Science Casual Game,"Background: Citizen science games are a type of Games with a Purpose (GWAPs), whose aim is to harness the skills of volunteers for solving scientific problems or contributing to action projects, where citizens intervene in social concerns. Employing games to collect data, classify images or even solve major scientific problems is a relatively new but growing phenomenon in citizen science. A main concern in citizen science is to ensure data quality. As games can be seen as having adverse effects on data quality, it is important to understand how citizen scientists produce data using games, how accurate this data can be, and whether and how games influence data quality. 
	
Objective: The objective of this study was to evaluate the performance of individual players’ data quality in MalariaSpot, a citizen science casual game in which volunteers are tasked with detecting parasites in digitized blood sample images.
	
Methods: We used descriptive statistics to analyze a subset of the gameplays recorded and stored in the MalariaSpot database, comparing its clicks to the Gold Standard position of the parasites. This subset includes 15,546 gameplays played over 38 known images that correspond to 97,200 clicks from 1,278 different players. Gameplays have been played via the Android and iOS applications and via the web version of the game. Images were acquired in three different locations and therefore sample preparation have been done by different lab technicians. Two distinct technologies were used for sample digitalization.

Results: The overall values for sensibility, specificity, and accuracy of the individual gameplays for the 38 images are 0.82, 0.60, and 0.29 respectively. High presence of parasites in an image makes it easier for players to detect them as their structures tend to look alike and can be compared. Being a simple casual game, the learning curve is very fast and after few minutes, players attend their typical performance level. Data quality is considerably lower in images acquired with mobile phones coupled to the microscope ocular compared to those digitized with standardized digitalization technologies. 
		 
Conclusions: The results indicate that data quality is influenced by the game, the technologies for image digitalization and the sampling preparation.",TRUE,FALSE,crowdsourcing; malaria; image analysis; games for health,2018-07-02T11:08:10.959516,NA,,TRUE,accepted,2017-08-26T12:26:45.417414,NA,NA,NA,NA,NA,NA,NA,NA,NA,5a8c80f7c698300375c76d84|5a8c80f7c698300375c76d96|Social and Behavioral Sciences|Other Social and Behavioral Sciences,,2017,https://api.osf.io/v2/preprints/vztxn/contributors/,https://api.osf.io/v2/preprints/vztxn/bibliographic_contributors/,https://api.osf.io/v2/preprints/vztxn/citation/,vztxn,preprints,https://api.osf.io/v2/preprints/vztxn/identifiers/,https://api.osf.io/v2/nodes/jztpn/,https://api.osf.io/v2/preprints/vztxn/relationships/node/,jztpn,nodes,https://api.osf.io/v2/licenses/563c1cf88c5e4a3877f9e96a/,563c1cf88c5e4a3877f9e96a,licenses,https://api.osf.io/v2/providers/preprints/socarxiv/,socarxiv,preprint-providers,https://api.osf.io/v2/preprints/vztxn/files/,https://api.osf.io/v2/files/59a066fe9ad5a10253d3be16/,59a066fe9ad5a10253d3be16,files,https://api.osf.io/v2/preprints/vztxn/review_actions/,https://api.osf.io/v2/preprints/vztxn/requests/,https://api.osf.io/v2/preprints/vztxn/,https://osf.io/preprints/socarxiv/vztxn/,https://doi.org/10.31235/osf.io/vztxn,NA
q2h8a,preprints,2017-08-26T03:59:55.826312,2018-07-02T11:08:10.619814,2017-08-26T04:01:18.024999,NA,NA,Are Women Bad at Orgasms? Understanding the Gender Gap,"Women who have sex with men have about one orgasm for every three her partner enjoys. We call this the “orgasm gap,” a persistent average difference in the frequency of orgasm for men and women who have heterosexual sex. In this paper, I discredit one common explanation for this gap—the idea that women are somehow bad at orgasms—and offer alternative explanations for the gendered asymmetry in this one type of sexual pleasure: a lack of knowledge, the de-prioritization of female sexual pleasure, sexual objectification and self-objectification, and the coital imperative in the sexual script.",TRUE,FALSE,coital imperative|gender|gender inequality|knowledge|orgasm|orgasm gap|self-objectification|sex|sex education|sexism|sexual behavior|sexuality|sexual objectification|sexual oientation|sexual pleasure|sexual script|women,2018-07-02T11:08:10.602667,NA,,TRUE,accepted,2017-08-26T04:01:18.024999,NA,NA,NA,NA,NA,NA,NA,NA,NA,5a8c80f7c698300375c76d84|5a8c80fac698300375c76e20|5a8c80fac698300375c76e29|Social and Behavioral Sciences|Sociology|Sexualities|5a8c80f7c698300375c76d84|5a8c80fac698300375c76e20|5a8c80fac698300375c76e49|Social and Behavioral Sciences|Sociology|Sex and Gender,,2017,https://api.osf.io/v2/preprints/q2h8a/contributors/,https://api.osf.io/v2/preprints/q2h8a/bibliographic_contributors/,https://api.osf.io/v2/preprints/q2h8a/citation/,q2h8a,preprints,https://api.osf.io/v2/preprints/q2h8a/identifiers/,https://api.osf.io/v2/nodes/hw9tf/,https://api.osf.io/v2/preprints/q2h8a/relationships/node/,hw9tf,nodes,https://api.osf.io/v2/licenses/563c1cf88c5e4a3877f9e96c/,563c1cf88c5e4a3877f9e96c,licenses,https://api.osf.io/v2/providers/preprints/socarxiv/,socarxiv,preprint-providers,https://api.osf.io/v2/preprints/q2h8a/files/,https://api.osf.io/v2/files/59a0f23b9ad5a10252d3a20f/,59a0f23b9ad5a10252d3a20f,files,https://api.osf.io/v2/preprints/q2h8a/review_actions/,https://api.osf.io/v2/preprints/q2h8a/requests/,https://api.osf.io/v2/preprints/q2h8a/,https://osf.io/preprints/socarxiv/q2h8a/,https://doi.org/10.31235/osf.io/q2h8a,NA
bxac9,preprints,2017-08-26T03:39:20.204539,2018-07-02T11:08:10.557439,2017-08-26T03:46:32.687121,NA,NA,Hookup Culture and Higher Education,"In this entry, we offer historical context for understanding the emergence of hookup culture in higher education, review the basics of what we know, and make suggestions for future research.",TRUE,FALSE,alcohol|campus|class|college|cultural sociology|dating|higher education|history|history of sex|hooking up|hookup culture|inequality|mental health|partying|pluralistic ignorance|race|relationships|religion|residential campuses|review|sex|sexual assault|sexual attitudes|sexual behavior|sexual cultures|sexuality|sexual objectification|sexual orientation|sexual pleasure|sexual scripts|sexual violence|social scripts|students|university|well-being,2018-07-02T11:08:10.545240,NA,,TRUE,accepted,2017-08-26T03:46:32.687121,NA,NA,NA,NA,NA,NA,NA,NA,NA,5a8c80f7c698300375c76d84|5a8c80fac698300375c76e20|5a8c80fac698300375c76e29|Social and Behavioral Sciences|Sociology|Sexualities|5a8c80f7c698300375c76d84|5a8c80fac698300375c76e20|5a8c80fac698300375c76e49|Social and Behavioral Sciences|Sociology|Sex and Gender,,2017,https://api.osf.io/v2/preprints/bxac9/contributors/,https://api.osf.io/v2/preprints/bxac9/bibliographic_contributors/,https://api.osf.io/v2/preprints/bxac9/citation/,bxac9,preprints,https://api.osf.io/v2/preprints/bxac9/identifiers/,https://api.osf.io/v2/nodes/kq2mj/,https://api.osf.io/v2/preprints/bxac9/relationships/node/,kq2mj,nodes,https://api.osf.io/v2/licenses/563c1cf88c5e4a3877f9e96c/,563c1cf88c5e4a3877f9e96c,licenses,https://api.osf.io/v2/providers/preprints/socarxiv/,socarxiv,preprint-providers,https://api.osf.io/v2/preprints/bxac9/files/,https://api.osf.io/v2/files/59a0ed67594d90004678fc9d/,59a0ed67594d90004678fc9d,files,https://api.osf.io/v2/preprints/bxac9/review_actions/,https://api.osf.io/v2/preprints/bxac9/requests/,https://api.osf.io/v2/preprints/bxac9/,https://osf.io/preprints/socarxiv/bxac9/,https://doi.org/10.31235/osf.io/bxac9,NA
rvyz3,preprints,2017-08-24T19:57:50.647915,2018-07-02T11:08:08.241711,2017-08-24T20:01:45.275879,NA,10.1177/0265407517709537,When Equity Matters for Marital Stability: Comparing German and American Couples,"Comparing West Germany and the United States, we analyze the association between equity - in terms of the relative gender division of paid and unpaid work hours – and the risk of marriage dissolution.  Our aim is to identify under what conditions equity influences couple stability. We apply event-history analysis to marriage histories using data from the German Socio-Economic Panel for Western Germany and the Panel Study of Income Dynamics for the United States for the period 1986 to 2009. For the United States, we find that deviation from equity is particularly destabilizing when the wife under-benefits, and when both partners' paid work hours are similar. In West Germany, equity is less salient. Instead we find that the male breadwinner model remains the single most stable arrangement.",TRUE,FALSE,couple arrangements|divorce|equity|norms,2018-07-02T11:08:08.233053,NA,,TRUE,accepted,2017-08-24T20:01:45.275879,NA,NA,NA,NA,NA,NA,NA,NA,NA,5a8c80f7c698300375c76d84|5a8c80fac698300375c76e20|5a8c80fac698300375c76e46|Social and Behavioral Sciences|Sociology|Aging and the Life Course|5a8c80f7c698300375c76d84|5a8c80fac698300375c76e20|5a8c80fac698300375c76e47|Social and Behavioral Sciences|Sociology|Children and Youth,Daniela Bellani|Gøsta Esping Andersen|Léa Pessin,2017,https://api.osf.io/v2/preprints/rvyz3/contributors/,https://api.osf.io/v2/preprints/rvyz3/bibliographic_contributors/,https://api.osf.io/v2/preprints/rvyz3/citation/,rvyz3,preprints,https://api.osf.io/v2/preprints/rvyz3/identifiers/,https://api.osf.io/v2/nodes/h9yn4/,https://api.osf.io/v2/preprints/rvyz3/relationships/node/,h9yn4,nodes,https://api.osf.io/v2/licenses/563c1cf88c5e4a3877f9e96a/,563c1cf88c5e4a3877f9e96a,licenses,https://api.osf.io/v2/providers/preprints/socarxiv/,socarxiv,preprint-providers,https://api.osf.io/v2/preprints/rvyz3/files/,https://api.osf.io/v2/files/599f2fbeb83f690259169681/,599f2fbeb83f690259169681,files,https://api.osf.io/v2/preprints/rvyz3/review_actions/,https://api.osf.io/v2/preprints/rvyz3/requests/,https://api.osf.io/v2/preprints/rvyz3/,https://osf.io/preprints/socarxiv/rvyz3/,https://doi.org/10.31235/osf.io/rvyz3,https://doi.org/10.1177/0265407517709537
b7grn,preprints,2017-08-24T17:22:42.523028,2018-07-02T11:08:07.798715,2017-08-24T17:26:45.830766,NA,10.1016/j.poetic.2018.03.002,Culture and Choice: Toward Integrating Cultural Sociology with the Judgment and Decision-Making Sciences,"Cultural sociologists frequently theorize about choices and decisions, although we tend to shy away from this language and from concepts that are used by the judgment and decision-making (JDM) sciences. We show that cultural sociology and JDM are compatible and complementary fields by dispelling some common misunderstandings about JDM. We advocate for a strategic assimilation approach in which cultural sociologists are able to translate their work into key JDM terms like beliefs, preferences, and endowments. Learning to speak the JDM language will allow cultural sociologists to make important, and uniquely sociological, contributions to social scientific explanations of choices and decisions.",TRUE,FALSE,beliefs|cognition|culture|decision science|judgment|preferences|theory,2018-07-02T11:08:07.788453,NA,,TRUE,accepted,2017-08-24T17:26:45.830766,NA,NA,NA,NA,NA,NA,NA,NA,NA,"5a8c80f7c698300375c76d84|5a8c80fac698300375c76e20|5a8c80fac698300375c76e34|Social and Behavioral Sciences|Sociology|Communication, Information Technologies, and Media Sociology|5a8c80f7c698300375c76d84|5a8c80fac698300375c76e20|5a8c80fac698300375c76e51|Social and Behavioral Sciences|Sociology|Culture",,2017,https://api.osf.io/v2/preprints/b7grn/contributors/,https://api.osf.io/v2/preprints/b7grn/bibliographic_contributors/,https://api.osf.io/v2/preprints/b7grn/citation/,b7grn,preprints,https://api.osf.io/v2/preprints/b7grn/identifiers/,https://api.osf.io/v2/nodes/s6au7/,https://api.osf.io/v2/preprints/b7grn/relationships/node/,s6au7,nodes,https://api.osf.io/v2/licenses/563c1cf88c5e4a3877f9e96a/,563c1cf88c5e4a3877f9e96a,licenses,https://api.osf.io/v2/providers/preprints/socarxiv/,socarxiv,preprint-providers,https://api.osf.io/v2/preprints/b7grn/files/,https://api.osf.io/v2/files/599f0b62b83f690259168b8c/,599f0b62b83f690259168b8c,files,https://api.osf.io/v2/preprints/b7grn/review_actions/,https://api.osf.io/v2/preprints/b7grn/requests/,https://api.osf.io/v2/preprints/b7grn/,https://osf.io/preprints/socarxiv/b7grn/,https://doi.org/10.31235/osf.io/b7grn,https://doi.org/10.1016/j.poetic.2018.03.002
9e6cq,preprints,2017-08-24T06:02:46.827741,2018-07-02T11:08:06.834957,2017-08-24T06:04:38.087990,NA,NA,The Incidental Orgasm: The Presence of Clitoral Knowledge and the Absence of Orgasm for Women,"Women report anorgasmia and other difficulties achieving orgasm. One approach to alleviating this problem is to teach women about the clitoris. This assumes that women lack information about the clitoris and that knowledge about the clitoris is correlated with orgasm. Using a non-random sample of 833 undergraduate students, our study investigates both assumptions. First, we test the amount of knowledge about the clitoris, the reported sources of this knowledge, and the correlation between citing a source and actual knowledge. Second, we measure the correlation between clitoral knowledge and orgasm in both masturbation and partnered sex. Among a sample of undergraduate students, the most frequently cited sources of clitoral knowledge (school and friends) were associated with the least amount of tested knowledge. The source most likely to correlate with clitoral knowledge (self-exploration) was among the most rarely cited. Despite this, respondents correctly answered, on average, three of the five clitoral knowledge measures. Knowledge correlated significantly with the frequency of women’s orgasm in masturbation but not partnered sex. Our results are discussed in light of gender inequality and a social construction of sexuality, endorsed by both men and women, that privileges men’s sexual pleasure over women’s, such that orgasm for women is pleasing, but ultimately incidental.",TRUE,FALSE,anorgasmia|clitoris|comprehensive sex education|education|friends|gender|gender inequality|knowledge|masturbation|media|orgasm|parents|pornography|sex|sex education|sexuality|sexual knowledge|sexual satisfaction,2018-07-02T11:08:06.826114,NA,,TRUE,accepted,2017-08-24T06:04:38.087990,NA,NA,NA,NA,NA,NA,NA,NA,NA,5a8c80f7c698300375c76d84|5a8c80fac698300375c76e20|5a8c80fac698300375c76e29|Social and Behavioral Sciences|Sociology|Sexualities|5a8c80f7c698300375c76d84|5a8c80fac698300375c76e20|5a8c80fac698300375c76e49|Social and Behavioral Sciences|Sociology|Sex and Gender,,2017,https://api.osf.io/v2/preprints/9e6cq/contributors/,https://api.osf.io/v2/preprints/9e6cq/bibliographic_contributors/,https://api.osf.io/v2/preprints/9e6cq/citation/,9e6cq,preprints,https://api.osf.io/v2/preprints/9e6cq/identifiers/,https://api.osf.io/v2/nodes/gesy8/,https://api.osf.io/v2/preprints/9e6cq/relationships/node/,gesy8,nodes,https://api.osf.io/v2/licenses/563c1cf88c5e4a3877f9e96c/,563c1cf88c5e4a3877f9e96c,licenses,https://api.osf.io/v2/providers/preprints/socarxiv/,socarxiv,preprint-providers,https://api.osf.io/v2/preprints/9e6cq/files/,https://api.osf.io/v2/files/599e6c06594d90004477eb5e/,599e6c06594d90004477eb5e,files,https://api.osf.io/v2/preprints/9e6cq/review_actions/,https://api.osf.io/v2/preprints/9e6cq/requests/,https://api.osf.io/v2/preprints/9e6cq/,https://osf.io/preprints/socarxiv/9e6cq/,https://doi.org/10.31235/osf.io/9e6cq,NA
bg97a,preprints,2017-08-24T05:58:13.402736,2018-07-02T11:08:06.761883,2017-08-24T05:59:27.502854,NA,NA,"Review of ""American Allegory: Lindy Hop and the Racial Imagination""","American Allegory uses lindy hop—a social dance invented in the 1920s by black youth in Harlem and now practiced mostly by white dancers—to gain insight into the relationship between black and white Americans and their cultural forms. It aims to contribute to theory about how superordinate groups manipulate culture to maintain power, while also accounting for cultural change and exchange.   

On page 204 Hancock begins to ask sophisticated theoretical questions but, by then, it is far too late to answer them. While Hancock’s central premise is one to which I am sympathetic—that the community of primarily white people who dance lindy hop today are participating in an appropriation of black culture—he’s never able to move past his premise to a useful contribution.",TRUE,FALSE,african american|black americans|cultural appropriation|dance|ethnography|historical sociology|lindy hop|race|social dance|swing|swing dance,2018-07-02T11:08:06.751943,NA,,TRUE,accepted,2017-08-24T05:59:27.502854,NA,NA,NA,NA,NA,NA,NA,NA,NA,5a8c80f7c698300375c76d84|5a8c80fac698300375c76e20|5a8c80fac698300375c76e2a|Social and Behavioral Sciences|Sociology|Racial and Ethnic Minorities|5a8c80f7c698300375c76d84|5a8c80fac698300375c76e20|5a8c80fac698300375c76e3d|Social and Behavioral Sciences|Sociology|Latina/o Sociology,,2017,https://api.osf.io/v2/preprints/bg97a/contributors/,https://api.osf.io/v2/preprints/bg97a/bibliographic_contributors/,https://api.osf.io/v2/preprints/bg97a/citation/,bg97a,preprints,https://api.osf.io/v2/preprints/bg97a/identifiers/,https://api.osf.io/v2/nodes/zwhg6/,https://api.osf.io/v2/preprints/bg97a/relationships/node/,zwhg6,nodes,https://api.osf.io/v2/licenses/563c1cf88c5e4a3877f9e96c/,563c1cf88c5e4a3877f9e96c,licenses,https://api.osf.io/v2/providers/preprints/socarxiv/,socarxiv,preprint-providers,https://api.osf.io/v2/preprints/bg97a/files/,https://api.osf.io/v2/files/599e6af4b83f690259166206/,599e6af4b83f690259166206,files,https://api.osf.io/v2/preprints/bg97a/review_actions/,https://api.osf.io/v2/preprints/bg97a/requests/,https://api.osf.io/v2/preprints/bg97a/,https://osf.io/preprints/socarxiv/bg97a/,https://doi.org/10.31235/osf.io/bg97a,NA
7hgvx,preprints,2017-08-24T05:40:09.792633,2018-07-02T11:08:06.575951,2017-08-24T05:42:28.219040,NA,NA,The New Science of Sex Difference,"While scientists across the academy have abandoned the nature/nurture dichotomy, evidence for the influences of society on our biology is greater than ever. This article reviews new developments in the biological sciences—in the sub-fields of genetics, hormones, and neuroscience—with special attention to the implications for sociologists interested in gender.  The article closes with an argument that embracing these developments has both theoretical and methodological promise and can enhance rather than harm research and activism regarding gender equality and other social hierarchies.",TRUE,FALSE,biology|biosociology|brain organization theory|brain plasticity|epigenetics|gender|gender differences|gender inequality|gender similarities|genes|genetics|hormonal feedback loop|hormones|nature vs. nurture|neurology|sexuality|social hierarchy|social inequality,2018-07-02T11:08:06.566976,NA,,TRUE,accepted,2017-08-24T05:42:28.219040,NA,NA,NA,NA,NA,NA,NA,NA,NA,5a8c80f7c698300375c76d84|5a8c80fac698300375c76e20|5a8c80fac698300375c76e29|Social and Behavioral Sciences|Sociology|Sexualities|5a8c80f7c698300375c76d84|5a8c80fac698300375c76e20|5a8c80fac698300375c76e49|Social and Behavioral Sciences|Sociology|Sex and Gender,,2017,https://api.osf.io/v2/preprints/7hgvx/contributors/,https://api.osf.io/v2/preprints/7hgvx/bibliographic_contributors/,https://api.osf.io/v2/preprints/7hgvx/citation/,7hgvx,preprints,https://api.osf.io/v2/preprints/7hgvx/identifiers/,https://api.osf.io/v2/nodes/tpxgv/,https://api.osf.io/v2/preprints/7hgvx/relationships/node/,tpxgv,nodes,https://api.osf.io/v2/licenses/563c1cf88c5e4a3877f9e96c/,563c1cf88c5e4a3877f9e96c,licenses,https://api.osf.io/v2/providers/preprints/socarxiv/,socarxiv,preprint-providers,https://api.osf.io/v2/preprints/7hgvx/files/,https://api.osf.io/v2/files/599e66b96c613b025436538f/,599e66b96c613b025436538f,files,https://api.osf.io/v2/preprints/7hgvx/review_actions/,https://api.osf.io/v2/preprints/7hgvx/requests/,https://api.osf.io/v2/preprints/7hgvx/,https://osf.io/preprints/socarxiv/7hgvx/,https://doi.org/10.31235/osf.io/7hgvx,NA
