id,type,attributes.date_created,attributes.date_modified,attributes.date_published,attributes.original_publication_date,attributes.doi,attributes.title,attributes.description,attributes.is_published,attributes.is_preprint_orphan,attributes.tags,attributes.preprint_doi_created,attributes.date_withdrawn,attributes.current_user_permissions,attributes.public,attributes.reviews_state,attributes.date_last_transitioned,attributes.has_coi,attributes.conflict_of_interest_statement,attributes.has_data_links,attributes.why_no_data,attributes.data_links,attributes.has_prereg_links,attributes.why_no_prereg,attributes.prereg_links,attributes.prereg_link_info,attributes.subjects,attributes.license_record.copyright_holders,attributes.license_record.year,relationships.contributors.links.related.href,relationships.bibliographic_contributors.links.related.href,relationships.citation.links.related.href,relationships.citation.data.id,relationships.citation.data.type,relationships.identifiers.links.related.href,relationships.node.links.related.href,relationships.node.links.self.href,relationships.node.data.id,relationships.node.data.type,relationships.license.links.related.href,relationships.license.data.id,relationships.license.data.type,relationships.provider.links.related.href,relationships.provider.data.id,relationships.provider.data.type,relationships.files.links.related.href,relationships.primary_file.links.related.href,relationships.primary_file.data.id,relationships.primary_file.data.type,relationships.review_actions.links.related.href,relationships.requests.links.related.href,links.self,links.html,links.preprint_doi,links.doi
wez38,preprints,2017-04-22T16:24:56.788075,2018-07-02T10:55:51.418320,2017-04-22T16:28:03.491719,NA,NA,Good to be Disliked? Exploring the Relationship Between Disapproval of Organizations and Job Satisfaction in the French Context.,"Previous research has found that a positive relationship exists between favorable perception of a firm and employees’ job satisfaction: the more positively an organization is perceived, the happier are its workers. However, the current literature has overlooked the consequences of a negative corporate image, or disapproval of organizations. Building on the concept of organizational identification and the social identity literature, we fill in this gap and counterintuitively argue that employees are more likely to identify and align with their organizations when it faces illegitimate criticism. We test our hypotheses on a large-scale survey collected in France and find that perception of disapproval of an organization has indeed an adverse effect on job satisfaction. However, if employees perceive criticism as illegitimate, job satisfaction is positively impacted. This study suggests the existence of micro-level social identity reactions in case of unjustified disapprobation: employees stick together and hold the line against criticism, strengthening the collective identity and adding positive emotional value to the work experience.",TRUE,FALSE,disapproval|job satisfaction|legitimacy|motivation|organizational theory|sociology,2018-07-02T10:55:51.410362,NA,,TRUE,accepted,2017-04-22T16:28:03.491719,NA,NA,NA,NA,NA,NA,NA,NA,NA,"5a8c80f7c698300375c76d84|5a8c80f7c698300375c76d96|Social and Behavioral Sciences|Other Social and Behavioral Sciences|5a8c80f7c698300375c76d84|5a8c80f7c698300375c76d98|Social and Behavioral Sciences|Psychology|5a8c80f7c698300375c76d84|5a8c80f8c698300375c76dd1|Social and Behavioral Sciences|Leadership Studies|5a8c80f7c698300375c76d84|5a8c80f9c698300375c76e1f|Social and Behavioral Sciences|Organization Development|5a8c80f7c698300375c76d84|5a8c80fac698300375c76e20|5a8c80fac698300375c76e2d|Social and Behavioral Sciences|Sociology|Economic Sociology|5a8c80f7c698300375c76d84|5a8c80fac698300375c76e20|5a8c80fac698300375c76e38|Social and Behavioral Sciences|Sociology|Organizations, Occupations, and Work|5a8c80f7c698300375c76d84|5a8c80fac698300375c76e20|5a8c80fac698300375c76e48|Social and Behavioral Sciences|Sociology|Labor and Labor Movements|5a8c80f7c698300375c76d84|5a8c80fac698300375c76e20|5a8c80fac698300375c76e4b|Social and Behavioral Sciences|Sociology|Social Psychology and Interaction",,2017,https://api.osf.io/v2/preprints/wez38/contributors/,https://api.osf.io/v2/preprints/wez38/bibliographic_contributors/,https://api.osf.io/v2/preprints/wez38/citation/,wez38,preprints,https://api.osf.io/v2/preprints/wez38/identifiers/,https://api.osf.io/v2/nodes/fe3ym/,https://api.osf.io/v2/preprints/wez38/relationships/node/,fe3ym,nodes,https://api.osf.io/v2/licenses/563c1cf88c5e4a3877f9e96c/,563c1cf88c5e4a3877f9e96c,licenses,https://api.osf.io/v2/providers/preprints/socarxiv/,socarxiv,preprint-providers,https://api.osf.io/v2/preprints/wez38/files/,https://api.osf.io/v2/files/58fb83d7594d90024eb6883f/,58fb83d7594d90024eb6883f,files,https://api.osf.io/v2/preprints/wez38/review_actions/,https://api.osf.io/v2/preprints/wez38/requests/,https://api.osf.io/v2/preprints/wez38/,https://osf.io/preprints/socarxiv/wez38/,https://doi.org/10.31235/osf.io/wez38,NA
jk3n4,preprints,2017-04-21T19:52:18.539055,2018-07-02T10:55:51.331174,2017-04-21T19:55:04.823549,NA,NA,Swing Voting in the 2016 Presidential Election in Counties Where Midlife Mortality has been Rising in White Non-Hispanic Americans,"Understanding the effects of widespread disruption of the social fabric on public health outcomes can provide insight into the forces that drive major political realignment. Our objective was to estimate the association between increases in mortality in middle-aged non-Hispanic white adults from 1999-2005 to 2009-2015, health inequalities in life expectancy by income, and the surge in support for the Republican Party in pivotal US counties in the 2016 presidential election. We conducted a longitudinal ecological study in 2764 US counties from 1999 to 2016. Increases in mortality were measured using age-specific (45-54 years of age) all-cause mortality from 1999-2005 to 2009-2015 at the county level. Support for the Republican Party was measured as the party’s vote share in the presidential election in 2016 adjusted for results in 2008 and 2012. We found a significant up-turn in mortality from 1999-2005 to 2009-2015 in counties where the Democratic Party won twice (2008 and 2012) but where the Republican Party won in 2016 (+10.7/100,000), as compared to those in which the Democratic Party won in 2016 (-15.7/100,000). An increase in mortality of 15.2/100,000 was associated with a significant (p&lt;0.001) 1% vote swing from the 2008-2012 average to 2016. We also found that counties with wider health inequalities in life expectancy were more likely to vote Republican in 2016, regardless of the previous voting patterns. Counties with worsening premature mortality in the last 15 years and wider health inequalities shifted votes toward the Republican Party presidential candidate. Further understanding of causes of unanticipated deterioration in health in the general population can inform social policy.
Now published in: https://www.sciencedirect.com/science/article/pii/S0277953617307232",TRUE,FALSE,elections|mortality|politics|social class,2018-07-02T10:55:51.322932,NA,,TRUE,accepted,2017-04-21T19:55:04.823549,NA,NA,NA,NA,NA,NA,NA,NA,NA,"5a8c80f7c698300375c76d84|5a8c80f7c698300375c76d96|Social and Behavioral Sciences|Other Social and Behavioral Sciences|5a8c80f7c698300375c76d84|5a8c80f7c698300375c76d98|Social and Behavioral Sciences|Psychology|5a8c80f7c698300375c76d84|5a8c80f8c698300375c76daf|Social and Behavioral Sciences|Political Science|5a8c80f7c698300375c76d84|5a8c80f8c698300375c76ddb|Social and Behavioral Sciences|Public Affairs, Public Policy and Public Administration|5a8c80f7c698300375c76d84|5a8c80f9c698300375c76e0c|Social and Behavioral Sciences|Social Statistics",,2017,https://api.osf.io/v2/preprints/jk3n4/contributors/,https://api.osf.io/v2/preprints/jk3n4/bibliographic_contributors/,https://api.osf.io/v2/preprints/jk3n4/citation/,jk3n4,preprints,https://api.osf.io/v2/preprints/jk3n4/identifiers/,https://api.osf.io/v2/nodes/qr4ps/,https://api.osf.io/v2/preprints/jk3n4/relationships/node/,qr4ps,nodes,https://api.osf.io/v2/licenses/563c1cf88c5e4a3877f9e96a/,563c1cf88c5e4a3877f9e96a,licenses,https://api.osf.io/v2/providers/preprints/socarxiv/,socarxiv,preprint-providers,https://api.osf.io/v2/preprints/jk3n4/files/,https://api.osf.io/v2/files/58fa62f29ad5a102516d1800/,58fa62f29ad5a102516d1800,files,https://api.osf.io/v2/preprints/jk3n4/review_actions/,https://api.osf.io/v2/preprints/jk3n4/requests/,https://api.osf.io/v2/preprints/jk3n4/,https://osf.io/preprints/socarxiv/jk3n4/,https://doi.org/10.31235/osf.io/jk3n4,NA
v3bk8,preprints,2017-04-20T19:52:22.412770,2018-07-02T10:55:51.123364,2017-04-20T19:55:25.238775,NA,NA,Subaltern's image and the real: an inquiry,"For last few decades post-colonial studies has been one of the ruling framework for cultural theory in Indian subcontinent. In search for the subaltern we mostly can not articulate ourselves as theory. Our inquiries in to the epistemic domain (‘What can we know of the subaltern?’), the metaphysical domain has largely gone unanswered (‘What makes the subaltern possible?’). Here I would like to propose that the solution lies in our proleterization process. In this article I give an outline of just such a theoretical framework, harnessing the theoretical kernel of Marx, Hegel, Lacan and Zizek.",TRUE,FALSE,Post colonial studies|Proleterization|Subaltern|Subjectivation,2018-07-02T10:55:51.115687,NA,,TRUE,accepted,2017-04-20T19:55:25.238775,NA,NA,NA,NA,NA,NA,NA,NA,NA,"5a8c80f2c698300375c76c7d|5a8c80f3c698300375c76c89|Arts and Humanities|Race, Ethnicity and Post-Colonial Studies",,2017,https://api.osf.io/v2/preprints/v3bk8/contributors/,https://api.osf.io/v2/preprints/v3bk8/bibliographic_contributors/,https://api.osf.io/v2/preprints/v3bk8/citation/,v3bk8,preprints,https://api.osf.io/v2/preprints/v3bk8/identifiers/,https://api.osf.io/v2/nodes/f63hp/,https://api.osf.io/v2/preprints/v3bk8/relationships/node/,f63hp,nodes,https://api.osf.io/v2/licenses/563c1cf88c5e4a3877f9e96a/,563c1cf88c5e4a3877f9e96a,licenses,https://api.osf.io/v2/providers/preprints/socarxiv/,socarxiv,preprint-providers,https://api.osf.io/v2/preprints/v3bk8/files/,https://api.osf.io/v2/files/58f91176b83f690258fcaf97/,58f91176b83f690258fcaf97,files,https://api.osf.io/v2/preprints/v3bk8/review_actions/,https://api.osf.io/v2/preprints/v3bk8/requests/,https://api.osf.io/v2/preprints/v3bk8/,https://osf.io/preprints/socarxiv/v3bk8/,https://doi.org/10.31235/osf.io/v3bk8,NA
q2abe,preprints,2017-04-20T16:12:43.005701,2018-07-02T10:55:51.098280,2017-04-20T16:20:33.999502,NA,NA,A dasymetric method to apportion tornado casualty counts spatially,"This paper describes a dasymetric technique to spatially apportion casualty counts from tornado events in the U.S. Storm Prediction Center's database. Apportionment is performed with respect to the proportion of damage path area and to the underlying population density. The method is illustrated with raster grids on tornadoes occurring between 1955 and 2015 within the most tornado-prone region of the United States. Validation of the results using county- and grid-level data reveals strong correlation between dasymetric estimated and location-specific counts. On a broad spatial scale the method provides a better estimate of where casualties have occurred than counting the number of casualty-producing tornadoes. Case studies using the 1974 Xenia, OH and the 1994 Piedmont, AL tornadoes highlight limitations of the method and indicate that results will be improved with more precise tornado path information. Future work that includes socioeconomic variables (demographics, ethnicity, poverty and housing stock/value) might allow populations to be profiled with regards to vulnerability.",TRUE,FALSE,casualties|dasymetric mapping|tornado,2018-07-02T10:55:51.090339,NA,,TRUE,accepted,2017-04-20T16:20:33.999502,NA,NA,NA,NA,NA,NA,NA,NA,NA,5a8c80f7c698300375c76d84|5a8c80f7c698300375c76d86|5a8c80f7c698300375c76d88|Social and Behavioral Sciences|Geography|Geographic Information Sciences|5a8c80f7c698300375c76d84|5a8c80f7c698300375c76d86|5a8c80f7c698300375c76d8a|Social and Behavioral Sciences|Geography|Physical and Environmental Geography,Tyler Fricker,2017,https://api.osf.io/v2/preprints/q2abe/contributors/,https://api.osf.io/v2/preprints/q2abe/bibliographic_contributors/,https://api.osf.io/v2/preprints/q2abe/citation/,q2abe,preprints,https://api.osf.io/v2/preprints/q2abe/identifiers/,https://api.osf.io/v2/nodes/fepy4/,https://api.osf.io/v2/preprints/q2abe/relationships/node/,fepy4,nodes,https://api.osf.io/v2/licenses/563c1cf88c5e4a3877f9e965/,563c1cf88c5e4a3877f9e965,licenses,https://api.osf.io/v2/providers/preprints/socarxiv/,socarxiv,preprint-providers,https://api.osf.io/v2/preprints/q2abe/files/,https://api.osf.io/v2/files/58f8ddfa6c613b02511e04e5/,58f8ddfa6c613b02511e04e5,files,https://api.osf.io/v2/preprints/q2abe/review_actions/,https://api.osf.io/v2/preprints/q2abe/requests/,https://api.osf.io/v2/preprints/q2abe/,https://osf.io/preprints/socarxiv/q2abe/,https://doi.org/10.31235/osf.io/q2abe,NA
nd38q,preprints,2017-04-19T20:09:45.759754,2018-07-02T10:55:50.923258,2017-04-19T20:13:40.816477,NA,NA,Insecure People in Insecure Places: The Influence of Regional Unemployment on Workers’ Reactions to the Threat of Job Loss,"Social comparison theory predicts that unemployment should be less distressing when the experience is widely shared, but does this prediction extend beyond the unemployed to those who are at risk of job loss? Research demonstrates a link between aggregate unemployment and employed individuals’ perceptions of job insecurity; however, less is known about whether the stress associated with these perceptions is shaped by others’ unemployment experiences. We analyze a nationally representative sample of Canadian workers (CAN-WSH study; N=3,900) linked to census data, and test whether regional unemployment influences the mental health consequences of job insecurity. Multilevel analyses provide more support for the social norm of insecurity hypothesis over the amplified threat hypothesis: the health penalties of job insecurity are weaker for individuals in high unemployment regions. This contingency is partially explained by the ability of insecure workers in poor labor market contexts to retain psychological resources important for protecting mental health.",TRUE,FALSE,Mental Health; Job Insecurity; Unemployment,2018-07-02T10:55:50.914597,NA,,TRUE,accepted,2017-04-19T20:13:40.816477,NA,NA,NA,NA,NA,NA,NA,NA,NA,5a8c80f7c698300375c76d84|5a8c80fac698300375c76e20|5a8c80fac698300375c76e27|Social and Behavioral Sciences|Sociology|Ethnomethodology and Conservation Analysis|5a8c80f7c698300375c76d84|5a8c80fac698300375c76e20|5a8c80fac698300375c76e2c|Social and Behavioral Sciences|Sociology|Methodology|5a8c80f7c698300375c76d84|5a8c80fac698300375c76e20|5a8c80fac698300375c76e2e|Social and Behavioral Sciences|Sociology|Mental Health|5a8c80f7c698300375c76d84|5a8c80fac698300375c76e20|5a8c80fac698300375c76e43|Social and Behavioral Sciences|Sociology|Comparative and Historical Sociology|5a8c80f7c698300375c76d84|5a8c80fac698300375c76e20|5a8c80fac698300375c76e4d|Social and Behavioral Sciences|Sociology|Mathematical Sociology|5a8c80f7c698300375c76d84|5a8c80fac698300375c76e20|5a8c80fac698300375c76e4e|Social and Behavioral Sciences|Sociology|Medical Sociology|5a8c80f7c698300375c76d84|5a8c80fac698300375c76e20|5a8c80fac698300375c76e4f|Social and Behavioral Sciences|Sociology|History of Sociology,Paul Glavin and Marisa Young,2017,https://api.osf.io/v2/preprints/nd38q/contributors/,https://api.osf.io/v2/preprints/nd38q/bibliographic_contributors/,https://api.osf.io/v2/preprints/nd38q/citation/,nd38q,preprints,https://api.osf.io/v2/preprints/nd38q/identifiers/,https://api.osf.io/v2/nodes/p8mq9/,https://api.osf.io/v2/preprints/nd38q/relationships/node/,p8mq9,nodes,https://api.osf.io/v2/licenses/563c1cf88c5e4a3877f9e965/,563c1cf88c5e4a3877f9e965,licenses,https://api.osf.io/v2/providers/preprints/socarxiv/,socarxiv,preprint-providers,https://api.osf.io/v2/preprints/nd38q/files/,https://api.osf.io/v2/files/58f7c409b83f690259fc4649/,58f7c409b83f690259fc4649,files,https://api.osf.io/v2/preprints/nd38q/review_actions/,https://api.osf.io/v2/preprints/nd38q/requests/,https://api.osf.io/v2/preprints/nd38q/,https://osf.io/preprints/socarxiv/nd38q/,https://doi.org/10.31235/osf.io/nd38q,NA
8qjue,preprints,2017-04-19T19:57:06.509880,2018-07-02T10:55:50.857206,2017-04-19T20:01:12.620231,NA,NA,Limited Intersectional Approaches to Veteran and Former Prisoner Reintegration:  Examining Gender Identity and Sexual Orientation,"This paper is published in Sociological Imagination. Citation: Dernberger, Brittany. 2017.  “Limited Intersectional Approaches to Veteran and Former Prisoner Reintegration: Examining Gender Identity and Sexual Orientation.” Sociological Imagination 53(1): 100-131. 

Recent legal and policy changes within two prominent institutions, the military and criminal justice system, have profoundly altered the visibility – and subsequent rights – of lesbian, gay, bisexual, and transgender (LGBT) service members and those currently incarcerated. Comparing these two institutions side-by-side illustrates how LGBT inequality mechanisms operate at both an individual and systemic level. Both the military and criminal justice system are total, hypermasculine institutions, both are socially concentrated experiences, both end with a changed relationship with the state, and both veterans and those formerly incarcerated have comparable challenges to reintegration upon returning to their communities. Intersectional analysis provides an apt tool to critically examine how reintegration processes differ for those identifying as LGBT. I examine ways in which existing literature is intersectional and highlight the lack of analyses about systems of power that amplify or moderate former prisoner re-entry and veteran transition for those identifying as LGBT. Finally, I discuss why there may be a lack of attention to intersectionality, and specifically to LGBT individuals, in the literature and address how an intersectional framework would contribute to both public policy and to expanding the existing literature on social inequality and stratification.",TRUE,FALSE,ex-offender re-entry|former prisoner|gender identity|intersectionality|LGBT|military|sexual orientation|stratification|veteran,2018-07-02T10:55:50.849007,NA,,TRUE,accepted,2017-04-19T20:01:12.620231,NA,NA,NA,NA,NA,NA,NA,NA,NA,"5a8c80f7c698300375c76d84|5a8c80fac698300375c76e20|5a8c80fac698300375c76e29|Social and Behavioral Sciences|Sociology|Sexualities|5a8c80f7c698300375c76d84|5a8c80fac698300375c76e20|5a8c80fac698300375c76e2b|Social and Behavioral Sciences|Sociology|Crime, Law, and Deviance|5a8c80f7c698300375c76d84|5a8c80fac698300375c76e20|5a8c80fac698300375c76e49|Social and Behavioral Sciences|Sociology|Sex and Gender",Brittany N. Dernberger,2017,https://api.osf.io/v2/preprints/8qjue/contributors/,https://api.osf.io/v2/preprints/8qjue/bibliographic_contributors/,https://api.osf.io/v2/preprints/8qjue/citation/,8qjue,preprints,https://api.osf.io/v2/preprints/8qjue/identifiers/,https://api.osf.io/v2/nodes/ngcpz/,https://api.osf.io/v2/preprints/8qjue/relationships/node/,ngcpz,nodes,https://api.osf.io/v2/licenses/563c1cf88c5e4a3877f9e96c/,563c1cf88c5e4a3877f9e96c,licenses,https://api.osf.io/v2/providers/preprints/socarxiv/,socarxiv,preprint-providers,https://api.osf.io/v2/preprints/8qjue/files/,https://api.osf.io/v2/files/58f7c111594d9002592bf775/,58f7c111594d9002592bf775,files,https://api.osf.io/v2/preprints/8qjue/review_actions/,https://api.osf.io/v2/preprints/8qjue/requests/,https://api.osf.io/v2/preprints/8qjue/,https://osf.io/preprints/socarxiv/8qjue/,https://doi.org/10.31235/osf.io/8qjue,NA
vw5t4,preprints,2017-04-19T02:06:34.388403,2018-07-02T10:55:50.630298,2017-04-19T02:10:36.066167,NA,NA,The Hunt for Red Flags: Human Resource Perspectives on Internet-based Job Candidate Screening,"This study uses qualitative interviews with 31 human resource professionals to examine how they weigh the usefulness as well as the discriminatory potential of evaluating job candidates based on information obtained from the Internet. Results show that most HR professionals value social media and online search data, though some question its accuracy and usefulness. The majority recognize that because online information emphasizes personal and ascribed traits, it can potentially result in hiring discrimination. They use four strategies to cope with this discriminatory potential. Two strategies downplay the importance of online information by constructing it as the responsibility of individual job candidates and its role in hiring as marginal. Two other tactics involve guarding against discrimination, but in individualized and rather passive and post-hoc ways. Findings contribute to our knowledge of the organizational and labor market dynamics that contribute to inequality in the face of exogenous technological change and field-level uncertainty.",TRUE,FALSE,inequality|Internet|job search|labor markets|organizations|technology,2018-07-02T10:55:50.622456,NA,,TRUE,accepted,2017-04-19T02:10:36.066167,NA,NA,NA,NA,NA,NA,NA,NA,NA,"5a8c80f7c698300375c76d84|5a8c80fac698300375c76e20|5a8c80fac698300375c76e2d|Social and Behavioral Sciences|Sociology|Economic Sociology|5a8c80f7c698300375c76d84|5a8c80fac698300375c76e20|5a8c80fac698300375c76e38|Social and Behavioral Sciences|Sociology|Organizations, Occupations, and Work|5a8c80f7c698300375c76d84|5a8c80fac698300375c76e20|5a8c80fac698300375c76e48|Social and Behavioral Sciences|Sociology|Labor and Labor Movements",Steve McDonald,2017,https://api.osf.io/v2/preprints/vw5t4/contributors/,https://api.osf.io/v2/preprints/vw5t4/bibliographic_contributors/,https://api.osf.io/v2/preprints/vw5t4/citation/,vw5t4,preprints,https://api.osf.io/v2/preprints/vw5t4/identifiers/,https://api.osf.io/v2/nodes/yeu3t/,https://api.osf.io/v2/preprints/vw5t4/relationships/node/,yeu3t,nodes,https://api.osf.io/v2/licenses/563c1cf88c5e4a3877f9e965/,563c1cf88c5e4a3877f9e965,licenses,https://api.osf.io/v2/providers/preprints/socarxiv/,socarxiv,preprint-providers,https://api.osf.io/v2/preprints/vw5t4/files/,https://api.osf.io/v2/files/58f6c629594d9002572b6f84/,58f6c629594d9002572b6f84,files,https://api.osf.io/v2/preprints/vw5t4/review_actions/,https://api.osf.io/v2/preprints/vw5t4/requests/,https://api.osf.io/v2/preprints/vw5t4/,https://osf.io/preprints/socarxiv/vw5t4/,https://doi.org/10.31235/osf.io/vw5t4,NA
