id,type,attributes.date_created,attributes.date_modified,attributes.date_published,attributes.original_publication_date,attributes.doi,attributes.title,attributes.description,attributes.is_published,attributes.is_preprint_orphan,attributes.tags,attributes.preprint_doi_created,attributes.date_withdrawn,attributes.current_user_permissions,attributes.public,attributes.reviews_state,attributes.date_last_transitioned,attributes.has_coi,attributes.conflict_of_interest_statement,attributes.has_data_links,attributes.why_no_data,attributes.data_links,attributes.has_prereg_links,attributes.why_no_prereg,attributes.prereg_links,attributes.prereg_link_info,attributes.subjects,attributes.license_record.copyright_holders,attributes.license_record.year,relationships.contributors.links.related.href,relationships.bibliographic_contributors.links.related.href,relationships.citation.links.related.href,relationships.citation.data.id,relationships.citation.data.type,relationships.identifiers.links.related.href,relationships.node.links.related.href,relationships.node.links.self.href,relationships.node.data.id,relationships.node.data.type,relationships.license.links.related.href,relationships.license.data.id,relationships.license.data.type,relationships.provider.links.related.href,relationships.provider.data.id,relationships.provider.data.type,relationships.files.links.related.href,relationships.primary_file.links.related.href,relationships.primary_file.data.id,relationships.primary_file.data.type,relationships.review_actions.links.related.href,relationships.requests.links.related.href,links.self,links.html,links.doi,links.preprint_doi
mkq7d,preprints,2017-03-23T21:04:18.700000,2018-08-27T22:55:30.854401,2017-03-23T21:07:07.289000,2018-08-27T04:00:00,10.3390/urbansci2030076,"The Effects of Inequality, Density, and Heterogeneous Residential Preferences on Urban Displacement and Metropolitan Structure: An Agent-Based Model","Urban displacement - when a household is forced to relocate due to conditions affecting its home or surroundings - often results from rising housing costs, particularly in wealthy, prosperous cities. However, its dynamics are complex and often difficult to understand. This paper presents an agent-based model of urban settlement, agglomeration, displacement, and sprawl. New settlements form around a spatial amenity that draws initial, poor settlers to subsist on the resource. As the settlement grows, subsequent settlers of varying income, skills, and interests are heterogeneously drawn to either the original amenity or to the emerging human agglomeration. As this agglomeration grows and densifies, land values increase, and the initial poor settlers are displaced from the spatial amenity on which they relied. Through path dependence, high-income residents remain clustered around this original amenity for which they have no direct use or interest. This toy model explores these dynamics, demonstrating a simplified mechanism of how urban displacement and gentrification can be sensitive to income inequality, density, and varied preferences for different types of amenities.",TRUE,FALSE,ABM|agent-based model|agglomeration|complexity|complex systems|displacement|economic development|emergence|gentrification|housing|inequality|land use|modeling|self-organization|simulation|social justice|urban planning|urban sprawl|zoning,2018-07-02T10:51:42.853255,NA,,TRUE,accepted,2017-03-23T21:07:07.289000,NA,NA,NA,NA,,NA,NA,,NA,5a8c80f7c698300375c76d84|5a8c80f7c698300375c76d86|5a8c80f7c698300375c76d89|Social and Behavioral Sciences|Geography|Human Geography|5a8c80f7c698300375c76d84|5a8c80f7c698300375c76d86|5a8c80f7c698300375c76d8d|Social and Behavioral Sciences|Geography|Spatial Science|5a8c80f7c698300375c76d84|5a8c80f7c698300375c76d97|Social and Behavioral Sciences|Urban Studies and Planning|5a8c80f7c698300375c76d84|5a8c80f8c698300375c76dbe|5a8c80f8c698300375c76dc6|Social and Behavioral Sciences|Economics|Regional Economics,,2017,https://api.osf.io/v2/preprints/mkq7d/contributors/,https://api.osf.io/v2/preprints/mkq7d/bibliographic_contributors/,https://api.osf.io/v2/preprints/mkq7d/citation/,mkq7d,preprints,https://api.osf.io/v2/preprints/mkq7d/identifiers/,https://api.osf.io/v2/nodes/wkarz/,https://api.osf.io/v2/preprints/mkq7d/relationships/node/,wkarz,nodes,https://api.osf.io/v2/licenses/563c1cf88c5e4a3877f9e96c/,563c1cf88c5e4a3877f9e96c,licenses,https://api.osf.io/v2/providers/preprints/socarxiv/,socarxiv,preprint-providers,https://api.osf.io/v2/preprints/mkq7d/files/,https://api.osf.io/v2/files/58d43848b83f690209be9ca6/,58d43848b83f690209be9ca6,files,https://api.osf.io/v2/preprints/mkq7d/review_actions/,https://api.osf.io/v2/preprints/mkq7d/requests/,https://api.osf.io/v2/preprints/mkq7d/,https://osf.io/preprints/socarxiv/mkq7d/,https://doi.org/10.3390/urbansci2030076,https://doi.org/10.31235/osf.io/mkq7d
mxngm,preprints,2017-03-23T21:00:04.850000,2018-07-02T10:51:43.536060,2017-03-23T21:01:52.216000,NA,NA,Understanding Cities through Networks and Flows,"Complexity theory has become a popular frame for conceptualizing and analyzing cities. The theory proposes that certain large systems are characterized by the nonlinear, dynamic interactions of their many constituent parts. These systems then behave in novel and unpredictable ways—ways that cannot be divined by examining the components of the system. Complexity theory problematizes traditional reductionist, linear methods of scientifically analyzing and predicting cities. It also opens up a new world of scholarship to researchers keen to formulate new kinds of sciences that take complexity into account. These attempts usually follow Kuhn’s theory of paradigm shifts: new evidence and modes of thinking undermine an established science, and a new science emerges to replace it.",TRUE,FALSE,agent-based modeling|chaos|cities|complexity|complex systems|fractals|modeling|network analysis|networks|nonlinear|simulation|street networks|urban design|urban form|urban planning,2018-07-02T10:51:43.526504,NA,,TRUE,accepted,2017-03-23T21:01:52.216000,NA,NA,NA,NA,,NA,NA,,NA,5a8c80f7c698300375c76d84|5a8c80f7c698300375c76d97|Social and Behavioral Sciences|Urban Studies and Planning,,2017,https://api.osf.io/v2/preprints/mxngm/contributors/,https://api.osf.io/v2/preprints/mxngm/bibliographic_contributors/,https://api.osf.io/v2/preprints/mxngm/citation/,mxngm,preprints,https://api.osf.io/v2/preprints/mxngm/identifiers/,https://api.osf.io/v2/nodes/wf4nh/,https://api.osf.io/v2/preprints/mxngm/relationships/node/,wf4nh,nodes,https://api.osf.io/v2/licenses/563c1cf88c5e4a3877f9e96c/,563c1cf88c5e4a3877f9e96c,licenses,https://api.osf.io/v2/providers/preprints/socarxiv/,socarxiv,preprint-providers,https://api.osf.io/v2/preprints/mxngm/files/,https://api.osf.io/v2/files/58d4374d6c613b0206758ab9/,58d4374d6c613b0206758ab9,files,https://api.osf.io/v2/preprints/mxngm/review_actions/,https://api.osf.io/v2/preprints/mxngm/requests/,https://api.osf.io/v2/preprints/mxngm/,https://osf.io/preprints/socarxiv/mxngm/,NA,https://doi.org/10.31235/osf.io/mxngm
kuqqx,preprints,2017-03-23T18:23:22.937000,2018-07-02T10:51:09.784308,2017-03-23T18:29:14.877000,NA,NA,Prison Gangs,"Although widely seen as unruly and predatory, prison gangs operate as quasi-governments in many American correctional facilities. Inmate groups enforce property rights, regulate illicit markets, and promote cooperation when the state is unable or unwilling to act. Prison gangs are relatively new to the United States, and are best understood as unintended consequences of recent shifts in inmate demographics and the gradual erosion of the convict code. The impact of prison gangs on street-level criminal activities and directions for further research are also discussed.",TRUE,FALSE,criminal organizations|extralegal institutions|prison gangs|private governance|rational choice,2018-07-02T10:51:09.775546,NA,,TRUE,accepted,2017-03-23T18:29:14.877000,NA,NA,NA,NA,,NA,NA,,NA,5a8c80f7c698300375c76d84|5a8c80f8c698300375c76dbe|5a8c80f8c698300375c76dc0|Social and Behavioral Sciences|Economics|Political Economy,,2017,https://api.osf.io/v2/preprints/kuqqx/contributors/,https://api.osf.io/v2/preprints/kuqqx/bibliographic_contributors/,https://api.osf.io/v2/preprints/kuqqx/citation/,kuqqx,preprints,https://api.osf.io/v2/preprints/kuqqx/identifiers/,https://api.osf.io/v2/nodes/xduzu/,https://api.osf.io/v2/preprints/kuqqx/relationships/node/,xduzu,nodes,https://api.osf.io/v2/licenses/563c1cf88c5e4a3877f9e96a/,563c1cf88c5e4a3877f9e96a,licenses,https://api.osf.io/v2/providers/preprints/socarxiv/,socarxiv,preprint-providers,https://api.osf.io/v2/preprints/kuqqx/files/,https://api.osf.io/v2/files/58d41293594d90020b5b3345/,58d41293594d90020b5b3345,files,https://api.osf.io/v2/preprints/kuqqx/review_actions/,https://api.osf.io/v2/preprints/kuqqx/requests/,https://api.osf.io/v2/preprints/kuqqx/,https://osf.io/preprints/socarxiv/kuqqx/,NA,https://doi.org/10.31235/osf.io/kuqqx
v88hh,preprints,2017-03-23T17:52:21.052000,2018-07-02T10:53:44.613119,2017-03-23T17:55:31.112000,NA,NA,"Neighborhood Change, One Pint at a Time: The Impact of Local Characteristics on Craft Breweries","Cities have recognized the local impact of small craft breweries, altering municipal codes to make it easier to establish breweries as anchor points of economic development and revitalization. However, we do not know the extent to which these strategies impact change at the neighborhood scale across the U.S. In this chapter, we examine the relationship between the growth and locations of craft breweries and the incidence of neighborhood change. We rely on a unique data set of geocoded brewery locations that tracks openings and closings from 2004 to the present. Using measures of neighborhood change often found in the gentrification literature, we develop statistical models of census tract demographic and employment data to determine the extent to which brewery locations are associated with social and demographic shifts since 2000. The strongest predictor of whether a craft brewery opened in 2013 or later in a neighborhood was the presence of a prior brewery. We do not find evidence entirely consistent with the common narrative of a link between gentrification and craft brewing, but we do find a link between an influx of lower-to-middle income urban creatives and the introduction of a craft brewery. We advocate for urban planners to recognize the importance of craft breweries in neighborhood revitalization while also protecting residents from potential displacement.",TRUE,FALSE,beer|brewing|displacement|economic development|gentrification|land use|neighborhood|revitalization|urban economics|urban planning|zoning,2018-07-02T10:53:44.604753,NA,,TRUE,accepted,2017-03-23T17:55:31.112000,NA,NA,NA,NA,,NA,NA,,NA,5a8c80f7c698300375c76d84|5a8c80f7c698300375c76d97|Social and Behavioral Sciences|Urban Studies and Planning,,2017,https://api.osf.io/v2/preprints/v88hh/contributors/,https://api.osf.io/v2/preprints/v88hh/bibliographic_contributors/,https://api.osf.io/v2/preprints/v88hh/citation/,v88hh,preprints,https://api.osf.io/v2/preprints/v88hh/identifiers/,https://api.osf.io/v2/nodes/8ddgv/,https://api.osf.io/v2/preprints/v88hh/relationships/node/,8ddgv,nodes,https://api.osf.io/v2/licenses/563c1cf88c5e4a3877f9e96c/,563c1cf88c5e4a3877f9e96c,licenses,https://api.osf.io/v2/providers/preprints/socarxiv/,socarxiv,preprint-providers,https://api.osf.io/v2/preprints/v88hh/files/,https://api.osf.io/v2/files/58d40b4b6c613b02067589fb/,58d40b4b6c613b02067589fb,files,https://api.osf.io/v2/preprints/v88hh/review_actions/,https://api.osf.io/v2/preprints/v88hh/requests/,https://api.osf.io/v2/preprints/v88hh/,https://osf.io/preprints/socarxiv/v88hh/,NA,https://doi.org/10.31235/osf.io/v88hh
fu3e3,preprints,2017-03-23T08:16:00.900000,2019-01-08T13:28:03.099193,2017-03-23T08:20:26.866000,NA,10.1037/pspi0000026,Preprint: Lange and Crusius (2015) - The tango of two deadly sins: The social-functional relation of envy and pride,"Envy stems from a social comparison with a superior standard. Its 2 distinct forms are directed at changing this situation in different ways, either by becoming as successful as the envied person (in benign envy) or by lowering the envied person’s advantage (in malicious envy). In essence, envy is thus a social phenomenon. Nevertheless, most previous research has focused on its underlying intrapersonal processes, overlooking envy’s interpersonal core. In contrast, we show in 6 studies (N = 1,513) that envy and pride are intertwined in a social-functional relationship. Envy and pride often co-occur (Study 1) and pride displays enhance envious feelings (Studies 2 and 3). Specifically, authentic (success attributed to effort) and hubristic pride (success attributed to talent) modulate envious intentions and behavior toward their benign and malicious form (Study 2 to 6). This effect is mediated via liking, perceived prestige, and perceived dominance (Study 4). In accordance with a social-functional approach, the effects emerge only when authentic and hubristic pride are expressed by the superior person and not when the respective information about the superior person’s feelings is simply available in the environment (Study 5). These effects are present when participants recall envy situations (Study 1), when they imagine being in a competitive situation (Studies 3, 4, and 5), or when envy is elicited in situ (Studies 2 and 6). Our findings show the value of studying envy as a social phenomenon and open up numerous avenues for research on envy at the interpersonal and intergroup level.",TRUE,FALSE,authentic pride|benign envy|competition|envy|hubristic pride|malicious envy|motivation|pride|social comparison|social functions of emotions|social judgment,2018-07-02T10:49:08.281282,NA,,TRUE,accepted,2017-03-23T08:20:26.866000,NA,NA,NA,NA,,NA,NA,,NA,5a8c80f7c698300375c76d84|5a8c80f7c698300375c76d98|5a8c80f7c698300375c76da2|Social and Behavioral Sciences|Psychology|Social Psychology,APA,2017,https://api.osf.io/v2/preprints/fu3e3/contributors/,https://api.osf.io/v2/preprints/fu3e3/bibliographic_contributors/,https://api.osf.io/v2/preprints/fu3e3/citation/,fu3e3,preprints,https://api.osf.io/v2/preprints/fu3e3/identifiers/,https://api.osf.io/v2/nodes/vehzp/,https://api.osf.io/v2/preprints/fu3e3/relationships/node/,vehzp,nodes,https://api.osf.io/v2/licenses/563c1cf88c5e4a3877f9e965/,563c1cf88c5e4a3877f9e965,licenses,https://api.osf.io/v2/providers/preprints/socarxiv/,socarxiv,preprint-providers,https://api.osf.io/v2/preprints/fu3e3/files/,https://api.osf.io/v2/files/58d38437594d90020b5b3238/,58d38437594d90020b5b3238,files,https://api.osf.io/v2/preprints/fu3e3/review_actions/,https://api.osf.io/v2/preprints/fu3e3/requests/,https://api.osf.io/v2/preprints/fu3e3/,https://osf.io/preprints/socarxiv/fu3e3/,https://doi.org/10.1037/pspi0000026,https://doi.org/10.31235/osf.io/fu3e3
2j8uv,preprints,2017-03-23T07:33:15.839000,2018-07-02T10:45:08.518308,2017-03-23T07:36:38.061000,NA,NA,Armed groups: problems of theory and classification,"This paper argues in favor of a theory and classification of armed groups that sets
them at the center of political and social sciences. Starting from the problem of order, it
argues that without armed groups one cannot understand how stable societies form,
function and reproduce themselves. It challenges the preeminence of concepts such as class and gender, which are seen as depicting later-formed social structures. It proposes a classification of armed groups based on their permanent or impermanent character, as well as the reasons for using violence, mostly extractive and ideological. The article also discusses armed groups operating within the state.",TRUE,FALSE,armed groups; states; political science; social sciences; violence; social order,2018-07-02T10:45:08.506326,NA,,TRUE,accepted,2017-03-23T07:36:38.061000,NA,NA,NA,NA,,NA,NA,,NA,5a8c80f2c698300375c76c7d|5a8c80f4c698300375c76ccc|Arts and Humanities|History|5a8c80f7c698300375c76d84|5a8c80f8c698300375c76daf|5a8c80f8c698300375c76db0|Social and Behavioral Sciences|Political Science|International Relations|5a8c80f7c698300375c76d84|5a8c80f8c698300375c76daf|5a8c80f8c698300375c76db4|Social and Behavioral Sciences|Political Science|Political Theory|5a8c80f7c698300375c76d84|5a8c80fac698300375c76e20|Social and Behavioral Sciences|Sociology,,2017,https://api.osf.io/v2/preprints/2j8uv/contributors/,https://api.osf.io/v2/preprints/2j8uv/bibliographic_contributors/,https://api.osf.io/v2/preprints/2j8uv/citation/,2j8uv,preprints,https://api.osf.io/v2/preprints/2j8uv/identifiers/,https://api.osf.io/v2/nodes/scpcq/,https://api.osf.io/v2/preprints/2j8uv/relationships/node/,scpcq,nodes,https://api.osf.io/v2/licenses/563c1cf88c5e4a3877f9e96c/,563c1cf88c5e4a3877f9e96c,licenses,https://api.osf.io/v2/providers/preprints/socarxiv/,socarxiv,preprint-providers,https://api.osf.io/v2/preprints/2j8uv/files/,https://api.osf.io/v2/files/58d37a3b594d90020c5b3243/,58d37a3b594d90020c5b3243,files,https://api.osf.io/v2/preprints/2j8uv/review_actions/,https://api.osf.io/v2/preprints/2j8uv/requests/,https://api.osf.io/v2/preprints/2j8uv/,https://osf.io/preprints/socarxiv/2j8uv/,NA,https://doi.org/10.31235/osf.io/2j8uv
nk7my,preprints,2017-03-22T06:09:04.354000,2018-07-02T10:51:45.198956,2017-03-22T06:15:26.149000,NA,NA,"The role of ego in academic profile services: Comparing Google Scholar, ResearchGate, Mendeley, and ResearcherID","Academic profiling services are a pervasive feature of scholarly life. Alberto Martín-Martín, Enrique Orduna-Malea and Emilio Delgado López-Cózar discuss the advantages and disadvantages of major profile platforms and look at the role of ego in how these services are built and used. Scholars validate these services by using them and should be aware that the portraits shown in these platforms depend to a great extent on the characteristics of the "" mirrors "" themselves.",TRUE,FALSE,academic social networks|google scholar|mendeley|researcherid|researchgate,2018-07-02T10:51:45.190473,NA,,TRUE,accepted,2017-03-22T06:15:26.149000,NA,NA,NA,NA,,NA,NA,,NA,5a8c80f7c698300375c76d84|5a8c80f8c698300375c76dd4|5a8c80f8c698300375c76dd9|Social and Behavioral Sciences|Library and Information Science|Scholarly Communication,LSE Impact of Social Sciences,2015,https://api.osf.io/v2/preprints/nk7my/contributors/,https://api.osf.io/v2/preprints/nk7my/bibliographic_contributors/,https://api.osf.io/v2/preprints/nk7my/citation/,nk7my,preprints,https://api.osf.io/v2/preprints/nk7my/identifiers/,https://api.osf.io/v2/nodes/bdv36/,https://api.osf.io/v2/preprints/nk7my/relationships/node/,bdv36,nodes,https://api.osf.io/v2/licenses/563c1cf88c5e4a3877f9e965/,563c1cf88c5e4a3877f9e965,licenses,https://api.osf.io/v2/providers/preprints/socarxiv/,socarxiv,preprint-providers,https://api.osf.io/v2/preprints/nk7my/files/,https://api.osf.io/v2/files/58d214f7594d9002018ac76d/,58d214f7594d9002018ac76d,files,https://api.osf.io/v2/preprints/nk7my/review_actions/,https://api.osf.io/v2/preprints/nk7my/requests/,https://api.osf.io/v2/preprints/nk7my/,https://osf.io/preprints/socarxiv/nk7my/,NA,https://doi.org/10.31235/osf.io/nk7my
5fj2x,preprints,2017-03-21T22:04:53.920000,2018-07-02T10:46:24.514893,2017-03-21T22:11:38.209000,NA,NA,Narcissism Over Ideology: Revealed versus Stated Terrorist Preferences,"What preferences motivate the severity of terrorist attacks? I investigate how Boko Haram
terrorists adjust their fatalities when unexpectedly deprived of public attention, relative to Al
Shabaab terrorists, that were not deprived of public attention. Losing public attention raises the
severity of terrorism: Boko Haram terrorist fatalities surged following the rebasing of Nigeria’s
economy, which catapulted the country into Africa’s largest and the top twenty-five worldwide.
The largest spike in Boko Haram terrorist fatalities occurred in the wake of the Nigerian Ebola
health crisis. Although Boko Haram claims an anti-education sentiment, their fatalities do not
actually differ significantly from Al Shabaab fatalities during the Nigerian national basic education
examination. Overall, terrorists consider well-being changes as threats that have more
validity than the persuasiveness of their own claimed ideologies. Terrorist groups do not significantly
vary the severity of their attacks during Ramadan. Emphasizing revealed preferences may
undermine terrorist credibility and recruitment.",TRUE,FALSE,attention|egotism|narcissism|terrorism|violence,2018-07-02T10:46:24.505654,NA,,TRUE,accepted,2017-03-21T22:11:38.209000,NA,NA,NA,NA,,NA,NA,,NA,5a8c80f7c698300375c76d84|5a8c80f7c698300375c76d8e|5a8c80f7c698300375c76d92|Social and Behavioral Sciences|International and Area Studies|African Studies|5a8c80f7c698300375c76d84|5a8c80f7c698300375c76d98|5a8c80f8c698300375c76dad|Social and Behavioral Sciences|Psychology|Applied Behavior Analysis|5a8c80f7c698300375c76d84|5a8c80f8c698300375c76daf|5a8c80f8c698300375c76db2|Social and Behavioral Sciences|Political Science|Comparative Politics|5a8c80f7c698300375c76d84|5a8c80f8c698300375c76dbe|5a8c80f8c698300375c76dc0|Social and Behavioral Sciences|Economics|Political Economy|5a8c80f7c698300375c76d84|5a8c80f8c698300375c76dbe|5a8c80f8c698300375c76dc5|Social and Behavioral Sciences|Economics|Behavioral Economics,,2017,https://api.osf.io/v2/preprints/5fj2x/contributors/,https://api.osf.io/v2/preprints/5fj2x/bibliographic_contributors/,https://api.osf.io/v2/preprints/5fj2x/citation/,5fj2x,preprints,https://api.osf.io/v2/preprints/5fj2x/identifiers/,https://api.osf.io/v2/nodes/hywwt/,https://api.osf.io/v2/preprints/5fj2x/relationships/node/,hywwt,nodes,https://api.osf.io/v2/licenses/563c1cf88c5e4a3877f9e96a/,563c1cf88c5e4a3877f9e96a,licenses,https://api.osf.io/v2/providers/preprints/socarxiv/,socarxiv,preprint-providers,https://api.osf.io/v2/preprints/5fj2x/files/,https://api.osf.io/v2/files/58d1a3856c613b0200ed90e6/,58d1a3856c613b0200ed90e6,files,https://api.osf.io/v2/preprints/5fj2x/review_actions/,https://api.osf.io/v2/preprints/5fj2x/requests/,https://api.osf.io/v2/preprints/5fj2x/,https://osf.io/preprints/socarxiv/5fj2x/,NA,https://doi.org/10.31235/osf.io/5fj2x
rc9s9,preprints,2017-03-20T21:50:54.813000,2018-07-02T10:52:04.996938,2017-03-20T21:52:29.002000,NA,NA,The unbalanced theoretical toolkit: Problems and partial solutions to studying culture and reproduction but not culture and mobility,Many theories explain how culture is linked to class reproduction but few explain how culture is linked to class mobility. This article argues that this theoretical imbalance is problematic as it ignores key stratification processes. The article then develops three concepts that link culture to downward mobility and three concepts that link culture to upward mobility. These concepts offer initial steps toward understanding how cultural differences between the classes are associated with class mobility as well as class reproduction.,TRUE,FALSE,culture|inequality|mobility|social class,2018-07-02T10:52:04.987336,NA,,TRUE,accepted,2017-03-20T21:52:29.002000,NA,NA,NA,NA,,NA,NA,,NA,"5a8c80f7c698300375c76d84|5a8c80fac698300375c76e20|5a8c80fac698300375c76e34|Social and Behavioral Sciences|Sociology|Communication, Information Technologies, and Media Sociology|5a8c80f7c698300375c76d84|5a8c80fac698300375c76e20|5a8c80fac698300375c76e35|Social and Behavioral Sciences|Sociology|Inequality, Poverty, and Mobility|5a8c80f7c698300375c76d84|5a8c80fac698300375c76e20|5a8c80fac698300375c76e44|Social and Behavioral Sciences|Sociology|Race, Gender, and Class|5a8c80f7c698300375c76d84|5a8c80fac698300375c76e20|5a8c80fac698300375c76e51|Social and Behavioral Sciences|Sociology|Culture",,2017,https://api.osf.io/v2/preprints/rc9s9/contributors/,https://api.osf.io/v2/preprints/rc9s9/bibliographic_contributors/,https://api.osf.io/v2/preprints/rc9s9/citation/,rc9s9,preprints,https://api.osf.io/v2/preprints/rc9s9/identifiers/,https://api.osf.io/v2/nodes/e7j8d/,https://api.osf.io/v2/preprints/rc9s9/relationships/node/,e7j8d,nodes,https://api.osf.io/v2/licenses/563c1cf88c5e4a3877f9e96c/,563c1cf88c5e4a3877f9e96c,licenses,https://api.osf.io/v2/providers/preprints/socarxiv/,socarxiv,preprint-providers,https://api.osf.io/v2/preprints/rc9s9/files/,https://api.osf.io/v2/files/58d04eb56c613b01fded8b38/,58d04eb56c613b01fded8b38,files,https://api.osf.io/v2/preprints/rc9s9/review_actions/,https://api.osf.io/v2/preprints/rc9s9/requests/,https://api.osf.io/v2/preprints/rc9s9/,https://osf.io/preprints/socarxiv/rc9s9/,NA,https://doi.org/10.31235/osf.io/rc9s9
