id,type,attributes.date_created,attributes.date_modified,attributes.date_published,attributes.original_publication_date,attributes.doi,attributes.title,attributes.description,attributes.is_published,attributes.is_preprint_orphan,attributes.license_record,attributes.tags,attributes.preprint_doi_created,attributes.date_withdrawn,attributes.current_user_permissions,attributes.public,attributes.reviews_state,attributes.date_last_transitioned,attributes.has_coi,attributes.conflict_of_interest_statement,attributes.has_data_links,attributes.why_no_data,attributes.data_links,attributes.has_prereg_links,attributes.why_no_prereg,attributes.prereg_links,attributes.prereg_link_info,attributes.subjects,relationships.contributors.links.related.href,relationships.bibliographic_contributors.links.related.href,relationships.citation.links.related.href,relationships.citation.data.id,relationships.citation.data.type,relationships.identifiers.links.related.href,relationships.node.links.related.href,relationships.node.links.self.href,relationships.node.data.id,relationships.node.data.type,relationships.provider.links.related.href,relationships.provider.data.id,relationships.provider.data.type,relationships.files.links.related.href,relationships.primary_file.links.related.href,relationships.primary_file.data.id,relationships.primary_file.data.type,relationships.review_actions.links.related.href,relationships.requests.links.related.href,links.self,links.html,links.preprint_doi
avcq9,preprints,2016-07-18T13:25:36.809000,2018-07-02T10:47:37.191222,2016-07-18T13:25:36.809000,NA,NA," Quantitative assessment of household waste disposed in floodplains of rivers from extra-Carpathian region of Neamț county, Romania","This paper aims to develop a method which estimates the amounts of
household waste disposed (HWD) by rural localities in floodplains of rivers
from the sub Carpathian sector ( Bistrița, Cracău, Ozana) and also from
corridor valleys sector of Moldova and Siret rivers. This approach takes
into the consideration the average distance between the outer limits of
built-up area (village) and floodplain (river) in order to calculate the
specific indicators. This method is applied for 2003 and 2010 with a view
to highlighting the potential impact of illegal dumping on rivers sectors
from the extra-Carpathian region between pre-accession and post-accession
periods. Poor waste management facilities from rural areas lead to this bad
practice which prevailed during 2003-2009. Recent improvements in this
sector, particularly after the closure of rural dumpsites (16 July 2009)
will mitigate this environmental threat which it is also specific to others
rural regions from Romania.",TRUE,FALSE,NA,engrxiv|environment|geography|pollution|Preprint|rural areas|socarxiv|waste management|water pollution,2018-07-02T10:47:37.183766,NA,,TRUE,accepted,2016-07-18T13:25:36.809000,NA,NA,NA,NA,NA,NA,NA,NA,NA,5a8c80f7c698300375c76d84|Social and Behavioral Sciences,https://api.osf.io/v2/preprints/avcq9/contributors/,https://api.osf.io/v2/preprints/avcq9/bibliographic_contributors/,https://api.osf.io/v2/preprints/avcq9/citation/,avcq9,preprints,https://api.osf.io/v2/preprints/avcq9/identifiers/,https://api.osf.io/v2/nodes/88mcu/,https://api.osf.io/v2/preprints/avcq9/relationships/node/,88mcu,nodes,https://api.osf.io/v2/providers/preprints/socarxiv/,socarxiv,preprint-providers,https://api.osf.io/v2/preprints/avcq9/files/,https://api.osf.io/v2/files/578cd8d26c613b01ef15ce7e/,578cd8d26c613b01ef15ce7e,files,https://api.osf.io/v2/preprints/avcq9/review_actions/,https://api.osf.io/v2/preprints/avcq9/requests/,https://api.osf.io/v2/preprints/avcq9/,https://osf.io/preprints/socarxiv/avcq9/,https://doi.org/10.31235/osf.io/avcq9
vbyz9,preprints,2016-07-18T13:24:12.428000,2018-07-02T10:53:44.865132,2016-07-18T13:24:12.428000,NA,NA,"Determining rural areas vulnerable to illegal dumping using GIS techniques. Case study: Neamț county, Romania","The paper aims to mapping the potential vulnerable areas to illegal dumping
of household waste from rural areas in the extra- Carpathian region of
Neamț County. These areas are ordinary in the proximity of built-up areas
and buffers areas of 1km were delimited for every locality. Based on
various map layers in vector formats ( land use, rivers, buil-up areas,
roads etc) an assessment method is performed to highlight the potential
areas vulnerable to illegal dumping inside these buffer areas at local
scale. The results are corelated to field observations and current
situation of waste management systems. The maps outline local disparities
due to various geographical conditions of county. This approach is a
necesary tool in EIA studies particularly for rural waste management
systems at local and regional scale which are less studied in current
literature than urban areas.",TRUE,FALSE,NA,engrxiv|environment|geography|GIS|pollution|Preprint|rural geography|socarxiv|spatial analysis,2018-07-02T10:53:44.858500,NA,,TRUE,accepted,2016-07-18T13:24:12.428000,NA,NA,NA,NA,NA,NA,NA,NA,NA,5a8c80f7c698300375c76d84|Social and Behavioral Sciences,https://api.osf.io/v2/preprints/vbyz9/contributors/,https://api.osf.io/v2/preprints/vbyz9/bibliographic_contributors/,https://api.osf.io/v2/preprints/vbyz9/citation/,vbyz9,preprints,https://api.osf.io/v2/preprints/vbyz9/identifiers/,https://api.osf.io/v2/nodes/zzfpg/,https://api.osf.io/v2/preprints/vbyz9/relationships/node/,zzfpg,nodes,https://api.osf.io/v2/providers/preprints/socarxiv/,socarxiv,preprint-providers,https://api.osf.io/v2/preprints/vbyz9/files/,https://api.osf.io/v2/files/578cd883594d9001f58163f7/,578cd883594d9001f58163f7,files,https://api.osf.io/v2/preprints/vbyz9/review_actions/,https://api.osf.io/v2/preprints/vbyz9/requests/,https://api.osf.io/v2/preprints/vbyz9/,https://osf.io/preprints/socarxiv/vbyz9/,https://doi.org/10.31235/osf.io/vbyz9
9wv82,preprints,2016-07-18T13:22:33.648000,2018-07-02T10:47:34.422993,2016-07-18T13:22:33.648000,NA,NA,"EU acquis compliance on urban waste management. Case study: Piatra Neamt , Romania","This paper examines the current challenges in urban waste management
systems under EU regulations for a newcomer state. Piatra Neamț is among
the first Romanian cities which made the transition from a traditional to a
modern waste management infrastructure through ISPA funds. These changes
are poorly reflected in the rate of recycling and treatment so far
according to the analysis of waste streams. The paper performs a critical
review of waste management services and also assesses the vulnerability to
illegal dumping. Inappropriate sites of waste management facilities
contribute to environmental pollution and urban landscape degradation.
Comparative analysis between pre-accession period vs. current situation
highlights one the one hand the improvements in this sector and on the
other hand the difficulties to comply EU targets.",TRUE,FALSE,NA,engrxiv|environment|environmnetal policy|geography|GIS|pollution|Preprint|recycling|socarxiv|spatial analysis|urban geography|waste managemnt,2018-07-02T10:47:34.415535,NA,,TRUE,accepted,2016-07-18T13:22:33.648000,NA,NA,NA,NA,NA,NA,NA,NA,NA,5a8c80f7c698300375c76d84|Social and Behavioral Sciences,https://api.osf.io/v2/preprints/9wv82/contributors/,https://api.osf.io/v2/preprints/9wv82/bibliographic_contributors/,https://api.osf.io/v2/preprints/9wv82/citation/,9wv82,preprints,https://api.osf.io/v2/preprints/9wv82/identifiers/,https://api.osf.io/v2/nodes/bfjgg/,https://api.osf.io/v2/preprints/9wv82/relationships/node/,bfjgg,nodes,https://api.osf.io/v2/providers/preprints/socarxiv/,socarxiv,preprint-providers,https://api.osf.io/v2/preprints/9wv82/files/,https://api.osf.io/v2/files/578cd8296c613b01ec15ce7d/,578cd8296c613b01ec15ce7d,files,https://api.osf.io/v2/preprints/9wv82/review_actions/,https://api.osf.io/v2/preprints/9wv82/requests/,https://api.osf.io/v2/preprints/9wv82/,https://osf.io/preprints/socarxiv/9wv82/,https://doi.org/10.31235/osf.io/9wv82
bm9g7,preprints,2016-07-18T13:11:58.195000,2018-07-02T10:48:25.607777,2016-07-18T13:11:58.195000,NA,NA,"Spatio-temporal analysis of Romania's rural population access to sanitation services in the context of EU accession,","This paper analysis the disparities between Romanian Counties regarding the
spatio-temporal evolution of rural population acces to sanitation services
for pre-accession period (2003-2006) and the first two years since Romania
is part of the EU-27 (2007-2008) highlighting positive or negative changes
occurred in this period.Romanian counties were mapped and divided into five
typological classes,using multivariate analysis such as hierarchical
cluster analysis method.Each class has different values of rural population
served by waste collection services related to the Romania average
(expressed in standard deviations).Limited access to sanitation services
from rural areas lead to uncontrolled waste disposal.Despite improvement of
public access to sanitation services in rural areas compared to 2003 most
of population still lack access to waste collection services in 2008.In
this context, implementation of the acquis communautaire on municipal waste
management is difficult to achieve in rural territory.",TRUE,FALSE,NA,EU|geography|human geography|population|Preprint|public policy|public services|rural development|sanitation|socarxiv|social geography|utilities|waste management,2018-07-02T10:48:25.596935,NA,,TRUE,accepted,2016-07-18T13:11:58.195000,NA,NA,NA,NA,NA,NA,NA,NA,NA,5a8c80f7c698300375c76d84|Social and Behavioral Sciences,https://api.osf.io/v2/preprints/bm9g7/contributors/,https://api.osf.io/v2/preprints/bm9g7/bibliographic_contributors/,https://api.osf.io/v2/preprints/bm9g7/citation/,bm9g7,preprints,https://api.osf.io/v2/preprints/bm9g7/identifiers/,https://api.osf.io/v2/nodes/rdyhb/,https://api.osf.io/v2/preprints/bm9g7/relationships/node/,rdyhb,nodes,https://api.osf.io/v2/providers/preprints/socarxiv/,socarxiv,preprint-providers,https://api.osf.io/v2/preprints/bm9g7/files/,https://api.osf.io/v2/files/578cd5a0b83f6901fee26837/,578cd5a0b83f6901fee26837,files,https://api.osf.io/v2/preprints/bm9g7/review_actions/,https://api.osf.io/v2/preprints/bm9g7/requests/,https://api.osf.io/v2/preprints/bm9g7/,https://osf.io/preprints/socarxiv/bm9g7/,https://doi.org/10.31235/osf.io/bm9g7
dgwxb,preprints,2016-07-18T13:10:08.929000,2018-07-02T10:48:32.052133,2016-07-18T13:10:08.929000,NA,NA,Geographical distribution of rural dumpsites in North-East Region from Romania,"This paper proposes a spatial analysis of statistical data concerning the
number and areas of rural dumpsites for local administrative units (LAU in
Romanian’s rural territory = communes) from 6 counties of North-East region
using thematic cartography.Database created at the local scale is
correlated with demographic factors (eg population density) taking into
account the various geographical conditions between these 6 counties
(Neamt,Suceava,Botosani,Iasi,Bacau and Vaslui).Rural dumpsites have been
identified by the county environmental authorities in 2008 and 2009, the
The large numberdeadline for closure and rehabilitation beingA large number
of these sites reflect the lack of organized waste management system in
rural territory.Sanitation services are still poorly developed in rural
areas and the waste generated and uncollected are often disposed in open
dumps or river banks (mainly in mountain areas).The geographic location of
human settlements influences the disposal of waste, most of these dumpsites
were located in their proximity.These bad practices are still present being
revealed by field observations.Thus,demographic background (rural
population share of total county population, population density at LAU
level) and local geographical conditions
(mountain,hill/plateau,plains/valley corridor) reflect the territorial
disparities between counties (regional scale) and communes (local scale)
regarding the geographical distribution of rural dumpsites.",TRUE,FALSE,NA,cartography|environment|environmental policy|geography|maps|pollution|Preprint|rural areas|rural geography|socarxiv,2018-07-02T10:48:32.040616,NA,,TRUE,accepted,2016-07-18T13:10:08.929000,NA,NA,NA,NA,NA,NA,NA,NA,NA,5a8c80f7c698300375c76d84|Social and Behavioral Sciences,https://api.osf.io/v2/preprints/dgwxb/contributors/,https://api.osf.io/v2/preprints/dgwxb/bibliographic_contributors/,https://api.osf.io/v2/preprints/dgwxb/citation/,dgwxb,preprints,https://api.osf.io/v2/preprints/dgwxb/identifiers/,https://api.osf.io/v2/nodes/929bq/,https://api.osf.io/v2/preprints/dgwxb/relationships/node/,929bq,nodes,https://api.osf.io/v2/providers/preprints/socarxiv/,socarxiv,preprint-providers,https://api.osf.io/v2/preprints/dgwxb/files/,https://api.osf.io/v2/files/578cd532594d9001f68163ec/,578cd532594d9001f68163ec,files,https://api.osf.io/v2/preprints/dgwxb/review_actions/,https://api.osf.io/v2/preprints/dgwxb/requests/,https://api.osf.io/v2/preprints/dgwxb/,https://osf.io/preprints/socarxiv/dgwxb/,https://doi.org/10.31235/osf.io/dgwxb
u5ntb,preprints,2016-07-18T05:16:57.003000,2018-07-02T10:52:12.072651,2016-07-18T05:16:57.003000,NA,NA,"From Maimonides to Microsoft: The Jewish Law of Copyright Since the Birth of Print, Introduction","In this book, Neil Netanel traces the historical development of Jewish copyright law. In so doing, he compares rabbinic reprinting bans with secular and papal book privileges and relays the stories of dramatic disputes among publishers of books of Jewish learning and liturgy, beginning with the early sixteenth century and continuing until today. He describes each dispute in its historical context and examines the rabbinic rulings that sought to resolve it. Remarkably, the rabbinic reprinting bans and copyright rulings address some of the same issues that animate copyright jurisprudence today: Is copyright a property right or just a right to receive fair compensation? How long should copyrights last? What purposes does copyright serve? While Jewish copyright law has borrowed from its secular counterpart at key junctures, it fashions strikingly different answers to those key questions.",TRUE,FALSE,NA,Preprint|socarxiv,2018-07-02T10:52:12.061241,NA,,TRUE,accepted,2016-07-18T05:16:57.003000,NA,NA,NA,NA,NA,NA,NA,NA,NA,5a8c80f7c698300375c76d84|Social and Behavioral Sciences,https://api.osf.io/v2/preprints/u5ntb/contributors/,https://api.osf.io/v2/preprints/u5ntb/bibliographic_contributors/,https://api.osf.io/v2/preprints/u5ntb/citation/,u5ntb,preprints,https://api.osf.io/v2/preprints/u5ntb/identifiers/,https://api.osf.io/v2/nodes/5evhu/,https://api.osf.io/v2/preprints/u5ntb/relationships/node/,5evhu,nodes,https://api.osf.io/v2/providers/preprints/socarxiv/,socarxiv,preprint-providers,https://api.osf.io/v2/preprints/u5ntb/files/,https://api.osf.io/v2/files/578c664b594d9001f58163c4/,578c664b594d9001f58163c4,files,https://api.osf.io/v2/preprints/u5ntb/review_actions/,https://api.osf.io/v2/preprints/u5ntb/requests/,https://api.osf.io/v2/preprints/u5ntb/,https://osf.io/preprints/socarxiv/u5ntb/,https://doi.org/10.31235/osf.io/u5ntb
jm8fb,preprints,2016-07-17T23:45:55.843000,2018-07-02T10:51:05.966496,2016-07-17T23:45:55.843000,NA,NA,"Living Under Surveillance: Gender, Psychological Distress, and Stop-Question-and-Frisk Policing","A growing body of research is highlighting the collateral consequences of mass incarceration, including stop-and-frisk policing tactics. Living in a neighborhood context characterized by aggressive policing may affect one's mental health, especially for men who are the primary targets of police stops. We examine whether there is an association between psychological distress and neighborhood-level aggressive policing structures (i.e., frisking and use of force by police) and whether that association varies by gender. The 2009-2011 New York City (NYC) Stop, Question, and Frisk Database is aggregated to the neighborhood level (N=34) and merged with individual data from the 2012 NYC Community Health Survey (N= 8,066) via the United Hospital Fund neighborhood of respondents' residence. Weighted multilevel generalized linear models are used to assess main and gendered effects of neighborhood exposures to aggressive police stops on psychological distress measured with Kessler-6 items. The neighborhood stop rate exhibits inconsistent associations with psychological distress; however, neighborhood-level frisk and use of force densities are linked to higher levels of non-specific psychological distress among men, but not women. Specifically, men exhibit higher levels of nervousness, effort, worthlessness, and severe distress in aggressively surveilled neighborhoods. Male residents are affected by the escalation of stop-and-frisk policing in a neighborhood. Living in a context of aggressive policing should be considered an important risk factor that contributes to men's health.

-
Abigail A. Sewell, Ph.D.

Assistant Professor
Department of Sociology
Emory University
1555 Dickey Dr.
Atlanta, GA 30322

Vice Provost's Postdoctoral Fellow
Population Studies Center
University of Pennsylvania
3718 Locust Walk
239 McNeil Building
Philadelphia, PA 191014

Email: abigail.a.sewell@emory.edu
Website: www.abigailasewell.com

________________________________

This e-mail message (including any attachments) is for the sole use of
the intended recipient(s) and may contain confidential and privileged
information. If the reader of this message is not the intended
recipient, you are hereby notified that any dissemination, distribution
or copying of this message (including any attachments) is strictly
prohibited.

If you have received this message in error, please contact
the sender by reply e-mail message and destroy all copies of the
original message (including attachments).",TRUE,FALSE,NA,community|health|neighborhood|policing|Preprint|race|RxPRL|RxPRR|socarxiv,2018-07-02T10:51:05.958149,NA,,TRUE,accepted,2016-07-17T23:45:55.843000,NA,NA,NA,NA,NA,NA,NA,NA,NA,5a8c80f7c698300375c76d84|Social and Behavioral Sciences,https://api.osf.io/v2/preprints/jm8fb/contributors/,https://api.osf.io/v2/preprints/jm8fb/bibliographic_contributors/,https://api.osf.io/v2/preprints/jm8fb/citation/,jm8fb,preprints,https://api.osf.io/v2/preprints/jm8fb/identifiers/,https://api.osf.io/v2/nodes/vg233/,https://api.osf.io/v2/preprints/jm8fb/relationships/node/,vg233,nodes,https://api.osf.io/v2/providers/preprints/socarxiv/,socarxiv,preprint-providers,https://api.osf.io/v2/preprints/jm8fb/files/,https://api.osf.io/v2/files/578c18c06c613b01ee3bf67d/,578c18c06c613b01ee3bf67d,files,https://api.osf.io/v2/preprints/jm8fb/review_actions/,https://api.osf.io/v2/preprints/jm8fb/requests/,https://api.osf.io/v2/preprints/jm8fb/,https://osf.io/preprints/socarxiv/jm8fb/,https://doi.org/10.31235/osf.io/jm8fb
y9x5t,preprints,2016-07-17T23:36:37.755000,2018-07-02T10:55:02.819470,2016-07-17T23:36:37.755000,NA,NA,Collateral Damage: The Health Effects of Invasive Police Encounters in New York City,"In the 1990s New York City widened the surveillance reign of the criminal justice system to include minor offenses. One aspect of this public policy is a procedure known as Terry stops, which involves police temporarily detaining persons who may be acting criminally. While only a small percentage of these stops result in arrest, warrants, or the recovery of illegal materials, a sizeable portion become physically invasive (i.e., involve body searches and use of force). The health effects of invasive policing practices for the community at-large are unknown. Using microlevel health data from 2009-2012 NYC Community Health Survey nested within mesolevel data from the 2009-2012 NYC Stop, Question, and Frisk dataset, this study employs multilevel mixed effects models to evaluate contextual and ethnoracially-variant associations between invasive aspects of Terry stops and multiple dimensions of illness (poor/fair health, diabetes, high blood pressure, asthma episodes, body weight). Terry stops are, in fact, associated with worse health. The most consistent Terry measures associated with illness is the likelihood that stops will result in frisking. More limited deleterious effects can be attributed to the likelihood that stops will result in use of force and to minority-to-white ratios of frisk and use of force. The health effects of Terry stops vary by ethnoracial group in complex ways. For instance, the minority-to-white frisking ratio and the likelihood that stops will involve use of force increase certain dimensions of illness for minorities; meanwhile, the minority-to-white use of force ratio reduces the likelihood of diabetes for Blacks.

-
Abigail A. Sewell, Ph.D.

Assistant Professor
Department of Sociology
Emory University
1555 Dickey Dr.
Atlanta, GA 30322

Vice Provost's Postdoctoral Fellow
Population Studies Center
University of Pennsylvania
3718 Locust Walk
239 McNeil Building
Philadelphia, PA 191014

Email: abigail.a.sewell@emory.edu
Website: www.abigailasewell.com

________________________________

This e-mail message (including any attachments) is for the sole use of
the intended recipient(s) and may contain confidential and privileged
information. If the reader of this message is not the intended
recipient, you are hereby notified that any dissemination, distribution
or copying of this message (including any attachments) is strictly
prohibited.

If you have received this message in error, please contact
the sender by reply e-mail message and destroy all copies of the
original message (including attachments).",TRUE,FALSE,NA,community|health|neighborhoods|policing|Preprint|race|RaceAndPolicing|RxPRL|RxPRR|socarxiv,2018-07-02T10:55:02.812141,NA,,TRUE,accepted,2016-07-17T23:36:37.755000,NA,NA,NA,NA,NA,NA,NA,NA,NA,5a8c80f7c698300375c76d84|Social and Behavioral Sciences,https://api.osf.io/v2/preprints/y9x5t/contributors/,https://api.osf.io/v2/preprints/y9x5t/bibliographic_contributors/,https://api.osf.io/v2/preprints/y9x5t/citation/,y9x5t,preprints,https://api.osf.io/v2/preprints/y9x5t/identifiers/,https://api.osf.io/v2/nodes/m3xb8/,https://api.osf.io/v2/preprints/y9x5t/relationships/node/,m3xb8,nodes,https://api.osf.io/v2/providers/preprints/socarxiv/,socarxiv,preprint-providers,https://api.osf.io/v2/preprints/y9x5t/files/,https://api.osf.io/v2/files/578c1687594d9001f1392a91/,578c1687594d9001f1392a91,files,https://api.osf.io/v2/preprints/y9x5t/review_actions/,https://api.osf.io/v2/preprints/y9x5t/requests/,https://api.osf.io/v2/preprints/y9x5t/,https://osf.io/preprints/socarxiv/y9x5t/,https://doi.org/10.31235/osf.io/y9x5t
x7bfs,preprints,2016-07-17T22:33:35.571000,2018-07-02T10:53:50.400870,2016-07-17T22:33:35.571000,NA,NA,Making Inferences Using Incidentally Collected Data,"This chapter discusses the use of large quantities of incidentally
collected data (ICD) to make inferences about politics. This type of data
is sometimes referred to as “big data” but I avoid this term because of its
conflicting definitions (Monroe, 2012; Ward & Barker, 2013). ICD is data
that was created or collected primarily for a purpose other than analysis.
Within this broad definition, this chapter focuses particularly on data
generated through user interactions with websites. While ICD has been
around for at least half a century, the Internet greatly expanded the
availability and reduced the cost of ICD. Examples of ICD include data on
Internet searches, social media data, and user data from civic platforms.
This chapter briefly explains some sources and uses of ICD and then
discusses some of the potential issues of analysis and interpretation that
arise when using ICD, including the different approaches to inference that
researchers can use.",TRUE,FALSE,NA,Preprint|socarxiv,2018-07-02T10:53:50.393771,NA,,TRUE,accepted,2016-07-17T22:33:35.571000,NA,NA,NA,NA,NA,NA,NA,NA,NA,5a8c80f7c698300375c76d84|Social and Behavioral Sciences,https://api.osf.io/v2/preprints/x7bfs/contributors/,https://api.osf.io/v2/preprints/x7bfs/bibliographic_contributors/,https://api.osf.io/v2/preprints/x7bfs/citation/,x7bfs,preprints,https://api.osf.io/v2/preprints/x7bfs/identifiers/,https://api.osf.io/v2/nodes/f74qb/,https://api.osf.io/v2/preprints/x7bfs/relationships/node/,f74qb,nodes,https://api.osf.io/v2/providers/preprints/socarxiv/,socarxiv,preprint-providers,https://api.osf.io/v2/preprints/x7bfs/files/,https://api.osf.io/v2/files/578c07c4b83f6901f2c062ed/,578c07c4b83f6901f2c062ed,files,https://api.osf.io/v2/preprints/x7bfs/review_actions/,https://api.osf.io/v2/preprints/x7bfs/requests/,https://api.osf.io/v2/preprints/x7bfs/,https://osf.io/preprints/socarxiv/x7bfs/,https://doi.org/10.31235/osf.io/x7bfs
