id,type,attributes.date_created,attributes.date_modified,attributes.date_published,attributes.original_publication_date,attributes.doi,attributes.title,attributes.description,attributes.is_published,attributes.is_preprint_orphan,attributes.tags,attributes.preprint_doi_created,attributes.date_withdrawn,attributes.current_user_permissions,attributes.public,attributes.reviews_state,attributes.date_last_transitioned,attributes.has_coi,attributes.conflict_of_interest_statement,attributes.has_data_links,attributes.why_no_data,attributes.data_links,attributes.has_prereg_links,attributes.why_no_prereg,attributes.prereg_links,attributes.prereg_link_info,attributes.subjects,attributes.license_record.copyright_holders,attributes.license_record.year,relationships.contributors.links.related.href,relationships.bibliographic_contributors.links.related.href,relationships.citation.links.related.href,relationships.citation.data.id,relationships.citation.data.type,relationships.identifiers.links.related.href,relationships.node.links.related.href,relationships.node.links.self.href,relationships.node.data.id,relationships.node.data.type,relationships.license.links.related.href,relationships.license.data.id,relationships.license.data.type,relationships.provider.links.related.href,relationships.provider.data.id,relationships.provider.data.type,relationships.files.links.related.href,relationships.primary_file.links.related.href,relationships.primary_file.data.id,relationships.primary_file.data.type,relationships.review_actions.links.related.href,relationships.requests.links.related.href,links.self,links.html,links.preprint_doi,links.doi
ddnhz,preprints,2017-02-03T02:49:42.037000,2018-07-02T10:48:31.832630,2017-02-03T02:53:13.504000,NA,NA,The Natural and Infrastructural Capital Elements of Potential Post-Electrification Wealth Creation in Kenya,"While it is widely accepted that electricity is a “necessary but not sufficient condition” for development, there is little research that explores the conditions under which electrification might lead to wealth creation post-electrification. Using Kenya as a case study, this paper uses natural capital (NC) and infrastructural capital (IC) to compare the enabling environments of entrepreneur vs. government run off-grid electrification projects, explores the role that NC and IC can play in determining wealth creation post-electrification, and develops a micro-enterprise development (MED) index indicating regions in Kenya that could be well positioned for wealth creation (and thus, persistent demand) post-electrification. A comparison between the MED index and a nightlights GDP per capita proxy finds that their local differences are informative towards the management and use of local resources, suggests that a nightlights proxy could provide a large underestimate, and sheds light towards regions where the gap between achieved and unrealized potential may be large. We hypothesize that the large discrepancy between our MED index and the night lights income proxy is due to an underestimate of economic activity by night lights (most of the economic activity in rural areas happens during the day), the nature of the MED index being a measure of ‘potential’, and several other factors that could affect both variables such as local climate and environmental conditions, population stress on natural resources, quality of infrastructural capital (not only access), local corruption, and ethnic favoritism. We discuss these at length throughout our paper.",TRUE,FALSE,development|energy acces|entrepreneurship|infrastructure|natural capital|renewable energy|sustainability,2018-07-02T10:48:31.821302,NA,,TRUE,accepted,2017-02-03T02:53:13.504000,NA,NA,NA,NA,NA,NA,NA,NA,NA,5a8c80f7c698300375c76d84|5a8c80f7c698300375c76d86|5a8c80f7c698300375c76d8d|Social and Behavioral Sciences|Geography|Spatial Science|5a8c80f7c698300375c76d84|5a8c80f7c698300375c76d8e|Social and Behavioral Sciences|International and Area Studies|5a8c80f7c698300375c76d84|5a8c80f8c698300375c76db6|Social and Behavioral Sciences|Agricultural and Resource Economics|5a8c80f7c698300375c76d84|5a8c80f8c698300375c76dbd|Social and Behavioral Sciences|Environmental Studies|5a8c80f7c698300375c76d84|5a8c80f8c698300375c76dbe|5a8c80f8c698300375c76dc8|Social and Behavioral Sciences|Economics|Growth and Development,,2017,https://api.osf.io/v2/preprints/ddnhz/contributors/,https://api.osf.io/v2/preprints/ddnhz/bibliographic_contributors/,https://api.osf.io/v2/preprints/ddnhz/citation/,ddnhz,preprints,https://api.osf.io/v2/preprints/ddnhz/identifiers/,https://api.osf.io/v2/nodes/m8pbz/,https://api.osf.io/v2/preprints/ddnhz/relationships/node/,m8pbz,nodes,https://api.osf.io/v2/licenses/563c1cf88c5e4a3877f9e96c/,563c1cf88c5e4a3877f9e96c,licenses,https://api.osf.io/v2/providers/preprints/socarxiv/,socarxiv,preprint-providers,https://api.osf.io/v2/preprints/ddnhz/files/,https://api.osf.io/v2/files/5893efbc6c613b01fdcae50b/,5893efbc6c613b01fdcae50b,files,https://api.osf.io/v2/preprints/ddnhz/review_actions/,https://api.osf.io/v2/preprints/ddnhz/requests/,https://api.osf.io/v2/preprints/ddnhz/,https://osf.io/preprints/socarxiv/ddnhz/,https://doi.org/10.31235/osf.io/ddnhz,NA
9aazd,preprints,2017-02-02T02:45:10.012000,2019-02-27T02:04:13.161051,2017-02-02T02:48:12.860000,2019-02-18T08:00:00,10.1016/j.futures.2019.02.015,Politics of Planetary Reproduction and the Children of Other Worlds,"This paper considers possible futures for human space settlements through the life story and experiences of David Vetter—a child born with severe combined immunodeﬁciency who became known in popular media as the “bubble boy.” Lynn Margulis imagined the creation of ecosystems and human settlements on another planet could be an act of Gaia reproducing by budding, through ecopoiesis. Thinking with Margulis about humans as holobionts, our species is both constituted by and embedded within communities of organisms and ecologies. As holobionts we may not be able to live outside of these communities and systems or away from Earth, even if we can temporarily survive without them. Placed within an evolutionary framework, techno-capitalist imaginaries of space settlement limit conceptions of planetary reproduction to heteronormative models of ecopoiesis which promote competition as a key driver of evolution instead of cooperation. Technologically mediated survival along with forced reproduction of holobionts within Earth-like systems and could lead to suffering and isolation like David Vetter’s forced survival in a bubble. I propose alternative liberatory modes of conceptualizing and materializing space migration (including queer and decolonized forms of reproduction) which better respect the Earth, its inhabitants, as well as extraterrestrial planets, landscapes, lives, and possibilities. Cite as: Oman-Reagan, Michael P. “Politics of Planetary Reproduction and the Children of Other Worlds.” Futures. (Forthcoming, 2019)",TRUE,FALSE,Anthropology of Space|Ecology|Environmental Anthropology|Holobiont|Immunology|Medical Anthropology|Reproduction|Social Studies of Science|Space Settlement|STS|Symbiosis,2018-07-02T10:47:32.257346,NA,,TRUE,accepted,2017-02-02T02:48:12.860000,NA,NA,NA,NA,NA,NA,NA,NA,NA,5a8c80f7c698300375c76d84|5a8c80f9c698300375c76df4|Social and Behavioral Sciences|Science and Technology Studies|5a8c80f7c698300375c76d84|5a8c80f9c698300375c76df6|5a8c80f9c698300375c76dfa|Social and Behavioral Sciences|Anthropology|Social and Cultural Anthropology,,2017,https://api.osf.io/v2/preprints/9aazd/contributors/,https://api.osf.io/v2/preprints/9aazd/bibliographic_contributors/,https://api.osf.io/v2/preprints/9aazd/citation/,9aazd,preprints,https://api.osf.io/v2/preprints/9aazd/identifiers/,https://api.osf.io/v2/nodes/cpfhp/,https://api.osf.io/v2/preprints/9aazd/relationships/node/,cpfhp,nodes,https://api.osf.io/v2/licenses/563c1cf88c5e4a3877f9e96a/,563c1cf88c5e4a3877f9e96a,licenses,https://api.osf.io/v2/providers/preprints/socarxiv/,socarxiv,preprint-providers,https://api.osf.io/v2/preprints/9aazd/files/,https://api.osf.io/v2/files/58929d289ad5a101fdd8c54f/,58929d289ad5a101fdd8c54f,files,https://api.osf.io/v2/preprints/9aazd/review_actions/,https://api.osf.io/v2/preprints/9aazd/requests/,https://api.osf.io/v2/preprints/9aazd/,https://osf.io/preprints/socarxiv/9aazd/,https://doi.org/10.31235/osf.io/9aazd,https://doi.org/10.1016/j.futures.2019.02.015
mv7mf,preprints,2017-02-01T17:21:16.909000,2019-12-04T01:40:40.984093,2017-02-01T17:36:51.663000,NA,10.1177/0001699316670715,The Educational Gradient in Self-Rated Health in Europe: Does the Doctor-Patient Relationship Make a Difference?,"Research suggests that doctor–patient relations have evolved from a doctor-centered, paternalistic approach towards a more patient-centered, egalitarian model of interactions between physicians and their patients. Given the long-running debate on the positive relationship between education and health, the question arises how this development in doctor–patient relations affects social inequalities in health. First, we test to what extent egalitarian (e.g. discussing treatment decisions with patients) doctor–patient relations are underlying the education–self-reported health association. Second, we test whether egalitarian and paternalistic (e.g. withholding some information from patients) doctor–patient relations show differential effects on self-reported health across educational groups. Analyses of the European Social Survey (ESS) 2004/2005 for 24 countries demonstrate that a more egalitarian doctor–patient relationship does not substantially reduce educational inequalities in self-reported health. However, some direct positive effects of egalitarian and direct negative effects of paternalistic doctor–patient relations on health ratings can be found. Finally, results show how the health status of the lower educated can improve with a more egalitarian and less paternalistic doctor–patient relationship.",TRUE,FALSE,doctor-patient relations|health care|health inequalities|patient-centered care|Physician–patient relations|self-rated health,2018-07-02T10:51:43.219090,NA,,TRUE,accepted,2017-02-01T17:36:51.663000,NA,NA,NA,NA,NA,NA,NA,NA,NA,"5a8c80f7c698300375c76d84|5a8c80fac698300375c76e20|5a8c80fac698300375c76e2e|Social and Behavioral Sciences|Sociology|Mental Health|5a8c80f7c698300375c76d84|5a8c80fac698300375c76e20|5a8c80fac698300375c76e35|Social and Behavioral Sciences|Sociology|Inequality, Poverty, and Mobility|5a8c80f7c698300375c76d84|5a8c80fac698300375c76e20|5a8c80fac698300375c76e44|Social and Behavioral Sciences|Sociology|Race, Gender, and Class|5a8c80f7c698300375c76d84|5a8c80fac698300375c76e20|5a8c80fac698300375c76e4e|Social and Behavioral Sciences|Sociology|Medical Sociology",,2017,https://api.osf.io/v2/preprints/mv7mf/contributors/,https://api.osf.io/v2/preprints/mv7mf/bibliographic_contributors/,https://api.osf.io/v2/preprints/mv7mf/citation/,mv7mf,preprints,https://api.osf.io/v2/preprints/mv7mf/identifiers/,https://api.osf.io/v2/nodes/b4mp2/,https://api.osf.io/v2/preprints/mv7mf/relationships/node/,b4mp2,nodes,https://api.osf.io/v2/licenses/563c1cf88c5e4a3877f9e96a/,563c1cf88c5e4a3877f9e96a,licenses,https://api.osf.io/v2/providers/preprints/socarxiv/,socarxiv,preprint-providers,https://api.osf.io/v2/preprints/mv7mf/files/,https://api.osf.io/v2/files/58921905594d9001faed1f97/,58921905594d9001faed1f97,files,https://api.osf.io/v2/preprints/mv7mf/review_actions/,https://api.osf.io/v2/preprints/mv7mf/requests/,https://api.osf.io/v2/preprints/mv7mf/,https://osf.io/preprints/socarxiv/mv7mf/,https://doi.org/10.31235/osf.io/mv7mf,https://doi.org/10.1177/0001699316670715
sdsu2,preprints,2017-02-01T12:40:46.547000,2018-07-02T10:52:07.975512,2017-02-01T12:43:36.951000,NA,NA,Urban Science: A Short Primer,"This paper provides a short introductory overview of urban science.  It defines urban science, details its practioners and their aims, sets out its relationship to urban informatics and urban studies, and explains its epistemology and the analysis of urban big data. It then summarizes criticism of urban science with respect to epistemology, instrumental rationality, data issues, and ethics. It is concluded that urban science research will continue to grow for the foreseeable future, providing a valuable means of making sense of cities, but that it is unlikely it will become a new paradigm, producing an integrative approach that replaces the diverse philosophical traditions within urban studies.",TRUE,FALSE,cities|critique|data analytics|epistemology|urban analytics|urban big data|urban informatics|urban science|urban studies,2018-07-02T10:52:07.965941,NA,,TRUE,accepted,2017-02-01T12:43:36.951000,NA,NA,NA,NA,NA,NA,NA,NA,NA,5a8c80f7c698300375c76d84|5a8c80f7c698300375c76d86|5a8c80f7c698300375c76d89|Social and Behavioral Sciences|Geography|Human Geography|5a8c80f7c698300375c76d84|5a8c80f7c698300375c76d86|5a8c80f7c698300375c76d8d|Social and Behavioral Sciences|Geography|Spatial Science,,2017,https://api.osf.io/v2/preprints/sdsu2/contributors/,https://api.osf.io/v2/preprints/sdsu2/bibliographic_contributors/,https://api.osf.io/v2/preprints/sdsu2/citation/,sdsu2,preprints,https://api.osf.io/v2/preprints/sdsu2/identifiers/,https://api.osf.io/v2/nodes/thj7c/,https://api.osf.io/v2/preprints/sdsu2/relationships/node/,thj7c,nodes,https://api.osf.io/v2/licenses/563c1cf88c5e4a3877f9e96c/,563c1cf88c5e4a3877f9e96c,licenses,https://api.osf.io/v2/providers/preprints/socarxiv/,socarxiv,preprint-providers,https://api.osf.io/v2/preprints/sdsu2/files/,https://api.osf.io/v2/files/5891d747b83f6901f00f7e8d/,5891d747b83f6901f00f7e8d,files,https://api.osf.io/v2/preprints/sdsu2/review_actions/,https://api.osf.io/v2/preprints/sdsu2/requests/,https://api.osf.io/v2/preprints/sdsu2/,https://osf.io/preprints/socarxiv/sdsu2/,https://doi.org/10.31235/osf.io/sdsu2,NA
93eyz,preprints,2017-02-01T09:26:34.986000,2018-07-02T10:47:31.695047,2017-02-01T09:28:46.884000,NA,10.1016/j.ssresearch.2015.12.008,"Preferences, Constraints, and the Process of Sex Segregation in College Majors:  A Choice Analysis","The persistence of horizontal sex segregation in higher education continues to puzzle social scientists. To help resolve this puzzle, we analyze a sample of college entrants in Germany with a discrete choice design that allows for social learning from the experiences of others. We make at least two contributions to the state of research. First, we test whether essentialist gender stereotypes affect major selection mostly through internalization or rather as external constraints that high school graduates adapt their behavior to. Empirically, we find that internalized vocational interests better explain gendered major choices than conformance with friends’ and parents’ expectations does. Second, we scrutinize whether segregation results from women’s anticipation of gendered family roles or from their anticipation of sex-based discrimination, but we find no evidence for either of these hypotheses. As in most previous studies, differences in mathematics achievement fail to explain gendered patterns of selection into college majors.",TRUE,FALSE,,2018-07-02T10:47:31.686833,NA,,TRUE,accepted,2017-02-01T09:28:46.884000,NA,NA,NA,NA,NA,NA,NA,NA,NA,"5a8c80f7c698300375c76d84|5a8c80fac698300375c76e20|5a8c80fac698300375c76e26|Social and Behavioral Sciences|Sociology|Sociology of Education|5a8c80f7c698300375c76d84|5a8c80fac698300375c76e20|5a8c80fac698300375c76e29|Social and Behavioral Sciences|Sociology|Sexualities|5a8c80f7c698300375c76d84|5a8c80fac698300375c76e20|5a8c80fac698300375c76e35|Social and Behavioral Sciences|Sociology|Inequality, Poverty, and Mobility|5a8c80f7c698300375c76d84|5a8c80fac698300375c76e20|5a8c80fac698300375c76e44|Social and Behavioral Sciences|Sociology|Race, Gender, and Class|5a8c80f7c698300375c76d84|5a8c80fac698300375c76e20|5a8c80fac698300375c76e49|Social and Behavioral Sciences|Sociology|Sex and Gender",,2017,https://api.osf.io/v2/preprints/93eyz/contributors/,https://api.osf.io/v2/preprints/93eyz/bibliographic_contributors/,https://api.osf.io/v2/preprints/93eyz/citation/,93eyz,preprints,https://api.osf.io/v2/preprints/93eyz/identifiers/,https://api.osf.io/v2/nodes/ra36n/,https://api.osf.io/v2/preprints/93eyz/relationships/node/,ra36n,nodes,https://api.osf.io/v2/licenses/563c1cf88c5e4a3877f9e96c/,563c1cf88c5e4a3877f9e96c,licenses,https://api.osf.io/v2/providers/preprints/socarxiv/,socarxiv,preprint-providers,https://api.osf.io/v2/preprints/93eyz/files/,https://api.osf.io/v2/files/5891a9c1594d9001faed1e84/,5891a9c1594d9001faed1e84,files,https://api.osf.io/v2/preprints/93eyz/review_actions/,https://api.osf.io/v2/preprints/93eyz/requests/,https://api.osf.io/v2/preprints/93eyz/,https://osf.io/preprints/socarxiv/93eyz/,https://doi.org/10.31235/osf.io/93eyz,https://doi.org/10.1016/j.ssresearch.2015.12.008
5u2nn,preprints,2017-02-01T08:58:20.442000,2018-07-02T10:46:25.865146,2017-02-01T09:05:31.457000,NA,10.1093/esr/jcu060,"Why Do Women's Fields of Study Pay Less? A Test of Devaluation, Human Capital, and Gender Role Theory","As men are overrepresented in lucrative fields and women disproportionately graduate from disciplines that yield low wages in the labor market, horizontal sex segregation in higher education contributes significantly to economic gender inequality. But what underlies the association between sex composition and wages in fields of study? We draw on data from the German HIS Graduate Panel Study 1997 (N=4092) and use hierarchical linear models to adjudicate between devaluation theory and explanations based on differential sorting processes: human capital and gender role theory. The resulting evidence for both human capital and devaluation theory is scant. Consistent with gender role theory, differences in the attractiveness of fields to students with a careerist approach to higher education and the labor market in turn explain most of the association between field of studies’ sex composition and wage levels. We therefore conclude that gendered patterns of self-selection which derive from men’s socialization into the breadwinner role rather than valuative discrimination or rational anticipation of career interruptions underlie the association between fields’ sex composition and wage levels.",TRUE,FALSE,,2018-07-02T10:46:25.852067,NA,,TRUE,accepted,2017-02-01T09:05:31.457000,NA,NA,NA,NA,NA,NA,NA,NA,NA,"5a8c80f7c698300375c76d84|5a8c80fac698300375c76e20|5a8c80fac698300375c76e29|Social and Behavioral Sciences|Sociology|Sexualities|5a8c80f7c698300375c76d84|5a8c80fac698300375c76e20|5a8c80fac698300375c76e2d|Social and Behavioral Sciences|Sociology|Economic Sociology|5a8c80f7c698300375c76d84|5a8c80fac698300375c76e20|5a8c80fac698300375c76e35|Social and Behavioral Sciences|Sociology|Inequality, Poverty, and Mobility|5a8c80f7c698300375c76d84|5a8c80fac698300375c76e20|5a8c80fac698300375c76e38|Social and Behavioral Sciences|Sociology|Organizations, Occupations, and Work|5a8c80f7c698300375c76d84|5a8c80fac698300375c76e20|5a8c80fac698300375c76e44|Social and Behavioral Sciences|Sociology|Race, Gender, and Class|5a8c80f7c698300375c76d84|5a8c80fac698300375c76e20|5a8c80fac698300375c76e48|Social and Behavioral Sciences|Sociology|Labor and Labor Movements|5a8c80f7c698300375c76d84|5a8c80fac698300375c76e20|5a8c80fac698300375c76e49|Social and Behavioral Sciences|Sociology|Sex and Gender",,2017,https://api.osf.io/v2/preprints/5u2nn/contributors/,https://api.osf.io/v2/preprints/5u2nn/bibliographic_contributors/,https://api.osf.io/v2/preprints/5u2nn/citation/,5u2nn,preprints,https://api.osf.io/v2/preprints/5u2nn/identifiers/,https://api.osf.io/v2/nodes/t4kc5/,https://api.osf.io/v2/preprints/5u2nn/relationships/node/,t4kc5,nodes,https://api.osf.io/v2/licenses/563c1cf88c5e4a3877f9e96c/,563c1cf88c5e4a3877f9e96c,licenses,https://api.osf.io/v2/providers/preprints/socarxiv/,socarxiv,preprint-providers,https://api.osf.io/v2/preprints/5u2nn/files/,https://api.osf.io/v2/files/5891a3236c613b01fbcadee6/,5891a3236c613b01fbcadee6,files,https://api.osf.io/v2/preprints/5u2nn/review_actions/,https://api.osf.io/v2/preprints/5u2nn/requests/,https://api.osf.io/v2/preprints/5u2nn/,https://osf.io/preprints/socarxiv/5u2nn/,https://doi.org/10.31235/osf.io/5u2nn,https://doi.org/10.1093/esr/jcu060
7n8nw,preprints,2017-02-01T03:31:59.006000,2018-07-02T10:46:32.086017,2017-02-01T03:37:44.844000,NA,10.1145/3025453.3025847,Scratch Commuinty Blocks: Supporting Children as Data Scientists,"In this paper, we present Scratch Community Blocks, a new system that enables children to programmatically access, analyze, and visualize data about their participation in Scratch, an online community for learning computer programming. At its core, our approach involves a shift in who analyzes data: from adult data scientists to young learners themselves. We first introduce the goals and design of the system and then demonstrate it by describing example projects that illustrate its functionality. Next, we show through a series of case studies how the system engages children in not only representing data and answering questions with data but also in self-reflection about their own learning and participation.",TRUE,FALSE,block-based programming|computers and children|computers and education|constructionism|creativity support tools|data science|learning|social computing,2018-07-02T10:46:32.076938,NA,,TRUE,accepted,2017-02-01T03:37:44.844000,NA,NA,NA,NA,NA,NA,NA,NA,NA,5a8c80f6c698300375c76d4e|5a8c80f7c698300375c76d69|Education|Science and Mathematics Education|5a8c80f7c698300375c76d84|5a8c80f9c698300375c76e0d|5a8c80f9c698300375c76e18|Social and Behavioral Sciences|Communication|Social Media,,2017,https://api.osf.io/v2/preprints/7n8nw/contributors/,https://api.osf.io/v2/preprints/7n8nw/bibliographic_contributors/,https://api.osf.io/v2/preprints/7n8nw/citation/,7n8nw,preprints,https://api.osf.io/v2/preprints/7n8nw/identifiers/,https://api.osf.io/v2/nodes/cmgky/,https://api.osf.io/v2/preprints/7n8nw/relationships/node/,cmgky,nodes,https://api.osf.io/v2/licenses/563c1cf88c5e4a3877f9e96a/,563c1cf88c5e4a3877f9e96a,licenses,https://api.osf.io/v2/providers/preprints/socarxiv/,socarxiv,preprint-providers,https://api.osf.io/v2/preprints/7n8nw/files/,https://api.osf.io/v2/files/589156a6b83f6901f20f7d02/,589156a6b83f6901f20f7d02,files,https://api.osf.io/v2/preprints/7n8nw/review_actions/,https://api.osf.io/v2/preprints/7n8nw/requests/,https://api.osf.io/v2/preprints/7n8nw/,https://osf.io/preprints/socarxiv/7n8nw/,https://doi.org/10.31235/osf.io/7n8nw,https://doi.org/10.1145/3025453.3025847
6aqse,preprints,2017-01-31T20:40:14.203000,2019-02-06T17:28:05.766144,2017-01-31T20:42:39.531000,2019-01-28T06:00:00,10.1111/jomf.12554,"Beliefs about Money in Families: Balancing Unity, Autonomy, and Gender Equality","Objective: This study provides the first nationally representative data on U.S. adults' perceptions of income sharing within families.

Background: Modern couples confront tensions between ideals of mutual interests and values of economic autonomy, a departure from fitting themselves into culturally expected family arrangements of the past. This study teases apart the conditions under which people might prioritize one cultural value over another.

Method: The author conducted a nationally representative survey experiment (N = 3,986 individuals). The respondents selected an income allocation arrangement for a fictional couple with varied relationships investments (i.e., marriage, parenthood, length of relationship) and earning disparities.

Results: Although stronger relationship investments were associated with greater support for sharing all income, the most commonly selected income allocation arrangement was a hybrid arrangement of sharing some income and keeping the rest separate. When respondents preferred some amount of financial autonomy, the primary earner was expected to maintain ownership of a greater amount of the total household income. The preferred level of withholding income was slightly larger in magnitude when women were shown as the primary earner when compared with men shown as the primary earner.

Conclusion: The pursuit of economic autonomy, in combination with beliefs about gender, are important dimensions of gender inequality located within families.",TRUE,FALSE,cohabitation|family|gender inequality|intrahousehold finances|marriage|PAA2017,2018-07-02T10:46:27.780578,NA,,TRUE,accepted,2017-01-31T20:42:39.531000,NA,NA,NA,NA,NA,NA,NA,NA,NA,5a8c80f7c698300375c76d84|5a8c80fac698300375c76e20|5a8c80fac698300375c76e29|Social and Behavioral Sciences|Sociology|Sexualities|5a8c80f7c698300375c76d84|5a8c80fac698300375c76e20|5a8c80fac698300375c76e46|Social and Behavioral Sciences|Sociology|Aging and the Life Course|5a8c80f7c698300375c76d84|5a8c80fac698300375c76e20|5a8c80fac698300375c76e47|Social and Behavioral Sciences|Sociology|Children and Youth|5a8c80f7c698300375c76d84|5a8c80fac698300375c76e20|5a8c80fac698300375c76e49|Social and Behavioral Sciences|Sociology|Sex and Gender,,2017,https://api.osf.io/v2/preprints/6aqse/contributors/,https://api.osf.io/v2/preprints/6aqse/bibliographic_contributors/,https://api.osf.io/v2/preprints/6aqse/citation/,6aqse,preprints,https://api.osf.io/v2/preprints/6aqse/identifiers/,https://api.osf.io/v2/nodes/xtz69/,https://api.osf.io/v2/preprints/6aqse/relationships/node/,xtz69,nodes,https://api.osf.io/v2/licenses/563c1cf88c5e4a3877f9e96c/,563c1cf88c5e4a3877f9e96c,licenses,https://api.osf.io/v2/providers/preprints/socarxiv/,socarxiv,preprint-providers,https://api.osf.io/v2/preprints/6aqse/files/,https://api.osf.io/v2/files/5890f6269ad5a102167a1377/,5890f6269ad5a102167a1377,files,https://api.osf.io/v2/preprints/6aqse/review_actions/,https://api.osf.io/v2/preprints/6aqse/requests/,https://api.osf.io/v2/preprints/6aqse/,https://osf.io/preprints/socarxiv/6aqse/,https://doi.org/10.31235/osf.io/6aqse,https://doi.org/10.1111/jomf.12554
