id,type,attributes.date_created,attributes.date_modified,attributes.date_published,attributes.original_publication_date,attributes.doi,attributes.title,attributes.description,attributes.is_published,attributes.is_preprint_orphan,attributes.tags,attributes.preprint_doi_created,attributes.date_withdrawn,attributes.current_user_permissions,attributes.public,attributes.reviews_state,attributes.date_last_transitioned,attributes.has_coi,attributes.conflict_of_interest_statement,attributes.has_data_links,attributes.why_no_data,attributes.data_links,attributes.has_prereg_links,attributes.why_no_prereg,attributes.prereg_links,attributes.prereg_link_info,attributes.subjects,attributes.license_record.copyright_holders,attributes.license_record.year,relationships.contributors.links.related.href,relationships.bibliographic_contributors.links.related.href,relationships.citation.links.related.href,relationships.citation.data.id,relationships.citation.data.type,relationships.identifiers.links.related.href,relationships.node.links.related.href,relationships.node.links.self.href,relationships.node.data.id,relationships.node.data.type,relationships.license.links.related.href,relationships.license.data.id,relationships.license.data.type,relationships.provider.links.related.href,relationships.provider.data.id,relationships.provider.data.type,relationships.files.links.related.href,relationships.primary_file.links.related.href,relationships.primary_file.data.id,relationships.primary_file.data.type,relationships.review_actions.links.related.href,relationships.requests.links.related.href,links.self,links.html,links.preprint_doi,links.doi
rqktw,preprints,2017-01-19T23:52:35.959000,2018-07-02T10:52:05.987827,2017-01-19T23:54:38.959000,NA,NA,#mysanfrancisco: Social Media and the Conceptual Linguistic Landscape,"Recent attempts to advance the field of Linguistic Landscapes (LL) have emphasized the importance of contending with the ‘actors’ of the LL and their role in interpreting or interacting with language in place (Waksman and Shohamy 2016; Barni and Bagna 2015; Malinowski 2009). This paper addresses this interest in what I refer to as the LL’s interpretant (a` la Peirce 1955) or conceptual aspect by analyzing representations of physical space posted on Instagram, a popular photo sharing platform. Using a corpus of Instagram posts geotagged within the Mission District in San Francisco, California, I employ methods such as topic modeling and sentiment analysis to investigate the ways individuals are seen to engage with the semiotic land- scape of the neighborhood and explore how the Mission itself is discursively constructed through these subjective recontextualizations. In doing so I aim to highlight aspects of the relationship between social media and physical place and the ways language is seen to mediate this dynamic. I argue geo- graphically tagged social media is not representative of an LL but productive, viewing the selective and subjective displays found online to be as much a part of the LL context as a potential key to understanding it.",TRUE,FALSE,Gentrification|Linguistic Landscapes|Social Media|Text Mining|Topic Modeling,2018-07-02T10:52:05.975882,NA,,TRUE,accepted,2017-01-19T23:54:38.959000,NA,NA,NA,NA,NA,NA,NA,NA,NA,5a8c80f7c698300375c76d84|5a8c80f9c698300375c76dfd|5a8c80f9c698300375c76e02|Social and Behavioral Sciences|Linguistics|Anthropological Linguistics and Sociolinguistics,,2017,https://api.osf.io/v2/preprints/rqktw/contributors/,https://api.osf.io/v2/preprints/rqktw/bibliographic_contributors/,https://api.osf.io/v2/preprints/rqktw/citation/,rqktw,preprints,https://api.osf.io/v2/preprints/rqktw/identifiers/,https://api.osf.io/v2/nodes/pmknm/,https://api.osf.io/v2/preprints/rqktw/relationships/node/,pmknm,nodes,https://api.osf.io/v2/licenses/563c1cf88c5e4a3877f9e96c/,563c1cf88c5e4a3877f9e96c,licenses,https://api.osf.io/v2/providers/preprints/socarxiv/,socarxiv,preprint-providers,https://api.osf.io/v2/preprints/rqktw/files/,https://api.osf.io/v2/files/588116b7ad3c4800474d824b/,588116b7ad3c4800474d824b,files,https://api.osf.io/v2/preprints/rqktw/review_actions/,https://api.osf.io/v2/preprints/rqktw/requests/,https://api.osf.io/v2/preprints/rqktw/,https://osf.io/preprints/socarxiv/rqktw/,https://doi.org/10.31235/osf.io/rqktw,NA
fj8y8,preprints,2017-01-19T18:04:30.211000,2018-07-02T10:49:07.240585,2017-01-19T18:15:56.250000,NA,NA,Likely Transgender Individuals in U.S. Federal Administrative Records and the 2010 Census,"This paper utilizes changes to individuals’ first names and sex-coding in files from the Social Security Administration (SSA) to identify people likely to be transgender. I first document trends in these transgender-consistent changes and compare them to trends in other types of changes to personal information. I find that transgender-consistent changes are present as early as 1936 and have grown with non-transgender consistent changes. Of the likely transgender individuals alive during 2010, the majority change their names but not their sex-coding. Of those who changed both their names and their sex-coding, most change both pieces of information concurrently, although over a quarter change their name first and their sex-coding 5-6 years later. Linking individuals to their 2010 Census responses shows my approach identifies more transgender members of racial and ethnic minority groups than other studies using, for example, anonymous online surveys. Finally, states with the highest proportion of likely transgender residents have state-wide laws prohibiting discrimination on the basis of gender identity or expression. States with the lowest proportion do not.t",TRUE,FALSE,administrative records|gender|transgender,2018-07-02T10:49:07.231526,NA,,TRUE,accepted,2017-01-19T18:15:56.250000,NA,NA,NA,NA,NA,NA,NA,NA,NA,5a8c80f7c698300375c76d84|5a8c80f9c698300375c76e0c|Social and Behavioral Sciences|Social Statistics|5a8c80f7c698300375c76d84|5a8c80fac698300375c76e20|5a8c80fac698300375c76e29|Social and Behavioral Sciences|Sociology|Sexualities|5a8c80f7c698300375c76d84|5a8c80fac698300375c76e20|5a8c80fac698300375c76e3e|Social and Behavioral Sciences|Sociology|Population|5a8c80f7c698300375c76d84|5a8c80fac698300375c76e20|5a8c80fac698300375c76e45|Social and Behavioral Sciences|Sociology|Animals and Society|5a8c80f7c698300375c76d84|5a8c80fac698300375c76e20|5a8c80fac698300375c76e49|Social and Behavioral Sciences|Sociology|Sex and Gender,,2017,https://api.osf.io/v2/preprints/fj8y8/contributors/,https://api.osf.io/v2/preprints/fj8y8/bibliographic_contributors/,https://api.osf.io/v2/preprints/fj8y8/citation/,fj8y8,preprints,https://api.osf.io/v2/preprints/fj8y8/identifiers/,https://api.osf.io/v2/nodes/hb5x9/,https://api.osf.io/v2/preprints/fj8y8/relationships/node/,hb5x9,nodes,https://api.osf.io/v2/licenses/563c1cf88c5e4a3877f9e96c/,563c1cf88c5e4a3877f9e96c,licenses,https://api.osf.io/v2/providers/preprints/socarxiv/,socarxiv,preprint-providers,https://api.osf.io/v2/preprints/fj8y8/files/,https://api.osf.io/v2/files/5880ff9d9ad5a10050b838c9/,5880ff9d9ad5a10050b838c9,files,https://api.osf.io/v2/preprints/fj8y8/review_actions/,https://api.osf.io/v2/preprints/fj8y8/requests/,https://api.osf.io/v2/preprints/fj8y8/,https://osf.io/preprints/socarxiv/fj8y8/,https://doi.org/10.31235/osf.io/fj8y8,NA
yqgdm,preprints,2017-01-19T15:45:05.941000,2018-07-02T10:55:03.928820,2017-01-19T15:46:58.954000,NA,NA,The Marriage Wealth Premium Revisited,"This study examines the association between marriage and economic wealth of women and men. Going beyond previous research, which focused on household wealth, I examine personal wealth which allows identifying gender disparities in the association between marriage and wealth. Using unique data from the German Socio-Economic Panel Study (2002, 2007, 2012), I apply random-effects and fixed-effects regression models to test my expectations. I find that both, women and men, experience substantial marriage wealth premiums not only in household but also in personal wealth. I do not find consistent evidence for gender disparities in these general marriage premiums. Additional analyses indicate, however, that women’s marriage premiums are substantially lower than men’s premiums in older cohorts and when only considering non-housing wealth. Overall, this study provides new evidence that women and men gain unequally in their wealth attainment through marriage.",TRUE,FALSE,,2018-07-02T10:55:03.919428,NA,,TRUE,accepted,2017-01-19T15:46:58.954000,NA,NA,NA,NA,NA,NA,NA,NA,NA,"5a8c80f7c698300375c76d84|5a8c80fac698300375c76e20|5a8c80fac698300375c76e29|Social and Behavioral Sciences|Sociology|Sexualities|5a8c80f7c698300375c76d84|5a8c80fac698300375c76e20|5a8c80fac698300375c76e35|Social and Behavioral Sciences|Sociology|Inequality, Poverty, and Mobility|5a8c80f7c698300375c76d84|5a8c80fac698300375c76e20|5a8c80fac698300375c76e44|Social and Behavioral Sciences|Sociology|Race, Gender, and Class|5a8c80f7c698300375c76d84|5a8c80fac698300375c76e20|5a8c80fac698300375c76e46|Social and Behavioral Sciences|Sociology|Aging and the Life Course|5a8c80f7c698300375c76d84|5a8c80fac698300375c76e20|5a8c80fac698300375c76e47|Social and Behavioral Sciences|Sociology|Children and Youth|5a8c80f7c698300375c76d84|5a8c80fac698300375c76e20|5a8c80fac698300375c76e49|Social and Behavioral Sciences|Sociology|Sex and Gender",,2017,https://api.osf.io/v2/preprints/yqgdm/contributors/,https://api.osf.io/v2/preprints/yqgdm/bibliographic_contributors/,https://api.osf.io/v2/preprints/yqgdm/citation/,yqgdm,preprints,https://api.osf.io/v2/preprints/yqgdm/identifiers/,https://api.osf.io/v2/nodes/fcba8/,https://api.osf.io/v2/preprints/yqgdm/relationships/node/,fcba8,nodes,https://api.osf.io/v2/licenses/563c1cf88c5e4a3877f9e96c/,563c1cf88c5e4a3877f9e96c,licenses,https://api.osf.io/v2/providers/preprints/socarxiv/,socarxiv,preprint-providers,https://api.osf.io/v2/preprints/yqgdm/files/,https://api.osf.io/v2/files/587f3550ad3c4800454d7d51/,587f3550ad3c4800454d7d51,files,https://api.osf.io/v2/preprints/yqgdm/review_actions/,https://api.osf.io/v2/preprints/yqgdm/requests/,https://api.osf.io/v2/preprints/yqgdm/,https://osf.io/preprints/socarxiv/yqgdm/,https://doi.org/10.31235/osf.io/yqgdm,NA
b244k,preprints,2017-01-18T19:42:33.557000,2018-07-02T10:48:23.022958,2017-01-18T20:28:31.094000,NA,,Dialogue on Alternating Consciousness: From Perception to Infinities and Back to Free Will,"Can we trace back consciousness, reality, awareness, and free will to a single basic structure without giving up any of them? Can the universe exist in both real and individual ways without being composed of both? This dialogue founds consciousness and freedom of choice on the basis of a new reality concept that also includes the infinite as far as we understand it. Just the simplest distinction contains consciousness. It is not static, but a constant alternation of perspectives. From its entirety and movement, however, there arises a freedom of choice being more than reinterpreted necessity and unpredictability. Although decisions ultimately involve the whole universe, they are free in varying degrees also here and now. The unity and openness of the infinite enables the individual to be creative while this creativity directly and indirectly enters into all other individuals without impeding them. A contrary impression originates only in a narrowed awareness. But even the most conscious and free awareness can neither anticipate all decisions nor extinguish individuality. Their creativity is secured.",TRUE,FALSE,awareness|consciousness|creativity|free will|identity|individuality|intersubjectivity|reality,2018-07-02T10:48:23.012529,NA,,TRUE,accepted,2017-01-18T20:28:31.094000,NA,NA,NA,NA,NA,NA,NA,NA,NA,5a8c80f2c698300375c76c7d|5a8c80f5c698300375c76cf4|5a8c80f5c698300375c76cf9|Arts and Humanities|Philosophy|Philosophy of Mind,,2017,https://api.osf.io/v2/preprints/b244k/contributors/,https://api.osf.io/v2/preprints/b244k/bibliographic_contributors/,https://api.osf.io/v2/preprints/b244k/citation/,b244k,preprints,https://api.osf.io/v2/preprints/b244k/identifiers/,https://api.osf.io/v2/nodes/g3pgm/,https://api.osf.io/v2/preprints/b244k/relationships/node/,g3pgm,nodes,https://api.osf.io/v2/licenses/563c1cf88c5e4a3877f9e96a/,563c1cf88c5e4a3877f9e96a,licenses,https://api.osf.io/v2/providers/preprints/socarxiv/,socarxiv,preprint-providers,https://api.osf.io/v2/preprints/b244k/files/,https://api.osf.io/v2/files/587fc520b83f69004cf14c7e/,587fc520b83f69004cf14c7e,files,https://api.osf.io/v2/preprints/b244k/review_actions/,https://api.osf.io/v2/preprints/b244k/requests/,https://api.osf.io/v2/preprints/b244k/,https://osf.io/preprints/socarxiv/b244k/,https://doi.org/10.31235/osf.io/b244k,NA
ejcdm,preprints,2017-01-17T16:16:38.701000,2018-07-02T10:49:04.261833,2017-01-17T16:23:02.346000,NA,NA,Medicare Coverage and Reporting: A Comparison of the Current Population Survey and Administrative Records,"Medicare coverage of the older population in the United States is widely recognized as being nearly universal. Recent statistics from the Current Population Survey Annual Social and Economic Supplement (CPS ASEC) indicate that 93 percent of individuals aged 65 and older were covered by Medicare in 2013. Those without Medicare include those who are not eligible for the public health program, though the CPS ASEC estimate may also be impacted by misreporting. Using linked data from the CPS ASEC and Medicare Enrollment Database (i.e., the Medicare administrative data), we estimate the extent to which individuals misreport their Medicare coverage. We focus on those who report having Medicare but are not enrolled (false positives) and those who do not report having Medicare but are enrolled (false negatives). We use regression analyses to evaluate factors associated with both types of misreporting including socioeconomic, demographic, and household characteristics. We then provide estimates of the implied Medicare-covered, insured, and uninsured older population, taking into account misreporting in the CPS ASEC. We find an undercount in the CPS ASEC estimates of the Medicare covered population of 4.5 percent. This misreporting is not random - characteristics associated with misreporting include citizenship status, year of entry, labor force participation, Medicare coverage of others in the household, disability status, and imputation of Medicare responses. When we adjust the CPS ASEC estimates to account for misreporting, Medicare coverage of the population aged 65 and older increases from 93.4 percent to 95.6 percent while the uninsured rate decreases from 1.4 percent to 1.3 percent.",TRUE,FALSE,Administrative records|health insurance|Medicare|Survey measurement error,2018-07-02T10:49:04.252709,NA,,TRUE,accepted,2017-01-17T16:23:02.346000,NA,NA,NA,NA,NA,NA,NA,NA,NA,5a8c80f7c698300375c76d84|5a8c80f9c698300375c76e0c|Social and Behavioral Sciences|Social Statistics|5a8c80f7c698300375c76d84|5a8c80fac698300375c76e20|5a8c80fac698300375c76e3e|Social and Behavioral Sciences|Sociology|Population|5a8c80f7c698300375c76d84|5a8c80fac698300375c76e20|5a8c80fac698300375c76e45|Social and Behavioral Sciences|Sociology|Animals and Society,,2017,https://api.osf.io/v2/preprints/ejcdm/contributors/,https://api.osf.io/v2/preprints/ejcdm/bibliographic_contributors/,https://api.osf.io/v2/preprints/ejcdm/citation/,ejcdm,preprints,https://api.osf.io/v2/preprints/ejcdm/identifiers/,https://api.osf.io/v2/nodes/uzgwm/,https://api.osf.io/v2/preprints/ejcdm/relationships/node/,uzgwm,nodes,https://api.osf.io/v2/licenses/563c1cf88c5e4a3877f9e96c/,563c1cf88c5e4a3877f9e96c,licenses,https://api.osf.io/v2/providers/preprints/socarxiv/,socarxiv,preprint-providers,https://api.osf.io/v2/preprints/ejcdm/files/,https://api.osf.io/v2/files/587e43569ad5a1021fa75f17/,587e43569ad5a1021fa75f17,files,https://api.osf.io/v2/preprints/ejcdm/review_actions/,https://api.osf.io/v2/preprints/ejcdm/requests/,https://api.osf.io/v2/preprints/ejcdm/,https://osf.io/preprints/socarxiv/ejcdm/,https://doi.org/10.31235/osf.io/ejcdm,NA
5zykt,preprints,2017-01-14T23:04:40.616000,2018-07-02T10:46:26.669982,2017-01-14T23:09:20.348000,NA,NA,Black and Hispanic Representation in Policing: Organizational and Local Labor Market Context,"Recent events, such as highly visible police shootings, have highlighted the underrepresentation of racial minorities in U.S. policing. Past research has found a strong relationship between the local concentrations of a racial minority group and increased representation among police, as well as evidence of the disparate treatment of Blacks and Hispanics by White police officers. Using confidential, establishment-level public employment data on police departments from the Equal Employment Opportunity Commission, linked to Census local labor market data, we examine how department size and local demographic dynamics are associated with Black/Hispanic underrepresentation in policing. We find that police departments in labor markets with larger Black and Hispanic populations, and those with a greater number of officers on their force, are more likely to report underrepresentation of Black and Hispanic officers relative to the labor market. However, the effect of local population composition is reduced for bigger departments, suggesting a positive effect of organization visibility on minority police integration. In addition, the presence of Blacks and Hispanics in top leadership positions is positively associated with proportional representation, suggesting that minorities in leadership positions may have a beneficial impact on Black and Hispanic officer hiring.",TRUE,FALSE,EEOC|employment discrimination|policing|racial inequality,2018-07-02T10:46:26.660008,NA,,TRUE,accepted,2017-01-14T23:09:20.348000,NA,NA,NA,NA,NA,NA,NA,NA,NA,"5a8c80f7c698300375c76d84|5a8c80fac698300375c76e20|5a8c80fac698300375c76e2a|Social and Behavioral Sciences|Sociology|Racial and Ethnic Minorities|5a8c80f7c698300375c76d84|5a8c80fac698300375c76e20|5a8c80fac698300375c76e2b|Social and Behavioral Sciences|Sociology|Crime, Law, and Deviance|5a8c80f7c698300375c76d84|5a8c80fac698300375c76e20|5a8c80fac698300375c76e2d|Social and Behavioral Sciences|Sociology|Economic Sociology|5a8c80f7c698300375c76d84|5a8c80fac698300375c76e20|5a8c80fac698300375c76e35|Social and Behavioral Sciences|Sociology|Inequality, Poverty, and Mobility|5a8c80f7c698300375c76d84|5a8c80fac698300375c76e20|5a8c80fac698300375c76e38|Social and Behavioral Sciences|Sociology|Organizations, Occupations, and Work|5a8c80f7c698300375c76d84|5a8c80fac698300375c76e20|5a8c80fac698300375c76e3d|Social and Behavioral Sciences|Sociology|Latina/o Sociology|5a8c80f7c698300375c76d84|5a8c80fac698300375c76e20|5a8c80fac698300375c76e44|Social and Behavioral Sciences|Sociology|Race, Gender, and Class|5a8c80f7c698300375c76d84|5a8c80fac698300375c76e20|5a8c80fac698300375c76e48|Social and Behavioral Sciences|Sociology|Labor and Labor Movements",,2017,https://api.osf.io/v2/preprints/5zykt/contributors/,https://api.osf.io/v2/preprints/5zykt/bibliographic_contributors/,https://api.osf.io/v2/preprints/5zykt/citation/,5zykt,preprints,https://api.osf.io/v2/preprints/5zykt/identifiers/,https://api.osf.io/v2/nodes/upkcz/,https://api.osf.io/v2/preprints/5zykt/relationships/node/,upkcz,nodes,https://api.osf.io/v2/licenses/563c1cf88c5e4a3877f9e96c/,563c1cf88c5e4a3877f9e96c,licenses,https://api.osf.io/v2/providers/preprints/socarxiv/,socarxiv,preprint-providers,https://api.osf.io/v2/preprints/5zykt/files/,https://api.osf.io/v2/files/587aae809ad5a10202a1a85e/,587aae809ad5a10202a1a85e,files,https://api.osf.io/v2/preprints/5zykt/review_actions/,https://api.osf.io/v2/preprints/5zykt/requests/,https://api.osf.io/v2/preprints/5zykt/,https://osf.io/preprints/socarxiv/5zykt/,https://doi.org/10.31235/osf.io/5zykt,NA
8fhvq,preprints,2017-01-13T23:00:26.796000,2018-07-02T10:47:29.598629,2017-01-13T23:04:01.550000,NA,10.1111/padm.12100,Partisan Governance and Policy Implementation: The Politics of Academy Conversion Amongst English Schools,"This article demonstrates that party-political orientations within governance communities can have strong effects on policy implementation. Empirical evidence is drawn from the Academy conversion scheme for secondary schools in England that was recently pursued by the Conservative and Liberal Democrat coalition government. The opt-in nature of the reform makes it possible to discern the impact that nominally apolitical school governors have on the implementation of the policy. Academy conversion is disproportionately found in more Conservative-voting constituencies due to varying school-level propensities to apply to convert, rather than varying propensities for the Department for Education to authorize conversions. Further, applications to convert are significantly more likely from schools in Conservative parliamentary seats that are under the control of Labour local authorities. Thus, nominally apolitical policy participants appear to act in rather political ways, which has implications for our understanding of the involvement of civil society in the provision of public services.",TRUE,FALSE,,2018-07-02T10:47:29.590015,NA,,TRUE,accepted,2017-01-13T23:04:01.550000,NA,NA,NA,NA,NA,NA,NA,NA,NA,"5a8c80f6c698300375c76d4e|Education|5a8c80f7c698300375c76d84|5a8c80f8c698300375c76daf|5a8c80f8c698300375c76db2|Social and Behavioral Sciences|Political Science|Comparative Politics|5a8c80f7c698300375c76d84|5a8c80f8c698300375c76ddb|5a8c80f9c698300375c76de9|Social and Behavioral Sciences|Public Affairs, Public Policy and Public Administration|Education Policy|5a8c80f7c698300375c76d84|5a8c80f8c698300375c76ddb|5a8c80f9c698300375c76deb|Social and Behavioral Sciences|Public Affairs, Public Policy and Public Administration|Public Policy|5a8c80f7c698300375c76d84|5a8c80f8c698300375c76ddb|5a8c80f9c698300375c76df1|Social and Behavioral Sciences|Public Affairs, Public Policy and Public Administration|Public Administration",,2017,https://api.osf.io/v2/preprints/8fhvq/contributors/,https://api.osf.io/v2/preprints/8fhvq/bibliographic_contributors/,https://api.osf.io/v2/preprints/8fhvq/citation/,8fhvq,preprints,https://api.osf.io/v2/preprints/8fhvq/identifiers/,https://api.osf.io/v2/nodes/tgu4e/,https://api.osf.io/v2/preprints/8fhvq/relationships/node/,tgu4e,nodes,https://api.osf.io/v2/licenses/563c1cf88c5e4a3877f9e96c/,563c1cf88c5e4a3877f9e96c,licenses,https://api.osf.io/v2/providers/preprints/socarxiv/,socarxiv,preprint-providers,https://api.osf.io/v2/preprints/8fhvq/files/,https://api.osf.io/v2/files/58795c02b83f6901fe173877/,58795c02b83f6901fe173877,files,https://api.osf.io/v2/preprints/8fhvq/review_actions/,https://api.osf.io/v2/preprints/8fhvq/requests/,https://api.osf.io/v2/preprints/8fhvq/,https://osf.io/preprints/socarxiv/8fhvq/,https://doi.org/10.31235/osf.io/8fhvq,https://doi.org/10.1111/padm.12100
uuqxg,preprints,2017-01-13T22:33:14.738000,2018-07-02T10:53:43.691409,2017-01-13T22:40:20.469000,NA,10.1017/psrm.2015.11,"Acting Right? Privatization, Encompassing Interests, and the Left","I present a theoretical account of the politics of privatization that predicts left-wing support for the policy is conditional on the proportionality of the electoral system. In contrast to accounts that see privatization as an inherently right-wing policy, I argue that, like trade policy, it has the feature of creating distributed benefits and concen- trated costs. Less proportional electoral systems create incentives for the Left to be responsive to those who face the concentrated costs, and thus for them to oppose privatization more strongly. More proportional systems reduce these incentives and increase the extent to which distributed benefits are internalized by elected representatives. Hypotheses are derived from this theory at both the individual and macro-policy level, and then tested separately. Quantitative evidence on public opinion from the 1990s and privatization revenues from Western European countries over the period 19802005 supports the argument.",TRUE,FALSE,,2018-07-02T10:53:43.682798,NA,,TRUE,accepted,2017-01-13T22:40:20.469000,NA,NA,NA,NA,NA,NA,NA,NA,NA,"5a8c80f7c698300375c76d84|5a8c80f8c698300375c76daf|5a8c80f8c698300375c76db2|Social and Behavioral Sciences|Political Science|Comparative Politics|5a8c80f7c698300375c76d84|5a8c80f8c698300375c76dbe|5a8c80f8c698300375c76dc0|Social and Behavioral Sciences|Economics|Political Economy|5a8c80f7c698300375c76d84|5a8c80f8c698300375c76ddb|5a8c80f9c698300375c76deb|Social and Behavioral Sciences|Public Affairs, Public Policy and Public Administration|Public Policy",,2017,https://api.osf.io/v2/preprints/uuqxg/contributors/,https://api.osf.io/v2/preprints/uuqxg/bibliographic_contributors/,https://api.osf.io/v2/preprints/uuqxg/citation/,uuqxg,preprints,https://api.osf.io/v2/preprints/uuqxg/identifiers/,https://api.osf.io/v2/nodes/uqd27/,https://api.osf.io/v2/preprints/uuqxg/relationships/node/,uqd27,nodes,https://api.osf.io/v2/licenses/563c1cf88c5e4a3877f9e96c/,563c1cf88c5e4a3877f9e96c,licenses,https://api.osf.io/v2/providers/preprints/socarxiv/,socarxiv,preprint-providers,https://api.osf.io/v2/preprints/uuqxg/files/,https://api.osf.io/v2/files/587955a39ad5a101ffa1acd1/,587955a39ad5a101ffa1acd1,files,https://api.osf.io/v2/preprints/uuqxg/review_actions/,https://api.osf.io/v2/preprints/uuqxg/requests/,https://api.osf.io/v2/preprints/uuqxg/,https://osf.io/preprints/socarxiv/uuqxg/,https://doi.org/10.31235/osf.io/uuqxg,https://doi.org/10.1017/psrm.2015.11
