xj8pf,preprints,2017-01-12T18:39:34.547000,2018-12-22T10:38:47.296992,2017-01-12T18:47:53.070000,NA,NA,...,...,TRUE,FALSE,,2018-07-02T10:55:01.176470,NA,,TRUE,accepted,2017-01-12T18:47:53.070000,NA,NA,NA,NA,NA,NA,NA,NA,NA,5a8c80f2c698300375c76c7d|Arts and Humanities,,2017,https://api.osf.io/v2/preprints/xj8pf/contributors/,https://api.osf.io/v2/preprints/xj8pf/bibliographic_contributors/,https://api.osf.io/v2/preprints/xj8pf/citation/,xj8pf,preprints,https://api.osf.io/v2/preprints/xj8pf/identifiers/,NA,https://api.osf.io/v2/preprints/xj8pf/relationships/node/,NA,NA,https://api.osf.io/v2/licenses/563c1cf88c5e4a3877f9e96c/,563c1cf88c5e4a3877f9e96c,licenses,https://api.osf.io/v2/providers/preprints/socarxiv/,socarxiv,preprint-providers,https://api.osf.io/v2/preprints/xj8pf/files/,https://api.osf.io/v2/files/5877cd55b83f6901fa173514/,5877cd55b83f6901fa173514,files,https://api.osf.io/v2/preprints/xj8pf/review_actions/,https://api.osf.io/v2/preprints/xj8pf/requests/,https://api.osf.io/v2/preprints/xj8pf/,https://osf.io/preprints/socarxiv/xj8pf/,https://doi.org/10.31235/osf.io/xj8pf,NA
pfvhu,preprints,2017-01-12T14:56:58.343000,2018-07-02T10:51:47.516874,2017-02-14T21:04:34.624000,NA,NA,2010 American Community Survey Match Study,"Using administrative records data from federal government agencies and commercial sources,
the 2010 ACS Match Study measures administrative records coverage of 2010 ACS addresses,
persons, and persons at addresses at different levels of geography as well as by demographic
characteristics and response mode. The 2010 ACS Match Study represents a continuation of the
research undertaken in the 2010 Census Match Study, the first national‐level evaluation of
administrative records data coverage.
Preliminary results indicate that administrative records provide substantial coverage for
addresses and persons in the 2010 ACS (92.7 and 92.1 percent respectively), and less extensive
though substantial coverage, for person‐address pairs (74.3 percent). In addition, some
variation in address, person and/or person‐address coverage is found across demographic and
response mode groups. This research informs future uses of administrative records in survey
and decennial census operations to address the increasing costs of data collection and declining
response rates.",TRUE,FALSE,,2018-07-02T10:51:47.509668,NA,,TRUE,accepted,2017-02-14T21:04:34.624000,NA,NA,NA,NA,NA,NA,NA,NA,NA,5a8c80f7c698300375c76d84|5a8c80fac698300375c76e20|5a8c80fac698300375c76e3e|Social and Behavioral Sciences|Sociology|Population|5a8c80f7c698300375c76d84|5a8c80fac698300375c76e20|5a8c80fac698300375c76e45|Social and Behavioral Sciences|Sociology|Animals and Society,,NA,https://api.osf.io/v2/preprints/pfvhu/contributors/,https://api.osf.io/v2/preprints/pfvhu/bibliographic_contributors/,https://api.osf.io/v2/preprints/pfvhu/citation/,pfvhu,preprints,https://api.osf.io/v2/preprints/pfvhu/identifiers/,https://api.osf.io/v2/nodes/7gc44/,https://api.osf.io/v2/preprints/pfvhu/relationships/node/,7gc44,nodes,NA,NA,NA,https://api.osf.io/v2/providers/preprints/socarxiv/,socarxiv,preprint-providers,https://api.osf.io/v2/preprints/pfvhu/files/,https://api.osf.io/v2/files/58779932b83f6901fd172e77/,58779932b83f6901fd172e77,files,https://api.osf.io/v2/preprints/pfvhu/review_actions/,https://api.osf.io/v2/preprints/pfvhu/requests/,https://api.osf.io/v2/preprints/pfvhu/,https://osf.io/preprints/socarxiv/pfvhu/,https://doi.org/10.31235/osf.io/pfvhu,NA
