fju3q,preprints,2016-08-24T21:57:33.473000,2018-07-02T10:49:07.270129,2016-08-24T21:57:33.473000,NA,NA,A Structured Approach to Calculating Reasonable Royalties,"A significant part of the problem with patent damage awards comes from the
non-exclusive, fifteen-factor “Georgia-Pacific” test now taken as the gold
standard for calculating reasonable royalty damages. Simply handing the
question of reasonable royalty to the jury, without more, is not a recipe
for precision in damages analysis. But the fifteen-factor test may actually
be worse, because it overloads the jury with factors to consider that may
be irrelevant, overlapping, or even contradictory. And because the jury’s
finding is the result of such a complex, multi-factor test, it is as a
practical matter almost entirely immune from scrutiny by either district or
appellate judges facing a deferential standard of review.

We suggest a structured approach to calculating reasonable royalties. Most
of the factors in the Georgia-Pacific test in fact boil down to three
fundamental questions: (1) what is the marginal contribution of the
patented invention over the prior art, (2) how many other inputs were
necessary to achieve that contribution, and what is their relative value,
and (3) is there some concrete evidence suggesting that the market has
chosen a number different than the product of (1) and (2). By structuring
the inquiry in this way, courts (or Congress) can not only simplify the
question for the jury, but enable district courts and the Federal Circuit
to easily review the factual basis for a jury award.",TRUE,FALSE,NA,Preprint|socarxiv,2018-07-02T10:49:07.263160,NA,,TRUE,accepted,2016-08-24T21:57:33.473000,NA,NA,NA,NA,NA,NA,NA,NA,NA,5a8c80f7c698300375c76d84|Social and Behavioral Sciences,https://api.osf.io/v2/preprints/fju3q/contributors/,https://api.osf.io/v2/preprints/fju3q/bibliographic_contributors/,https://api.osf.io/v2/preprints/fju3q/citation/,fju3q,preprints,https://api.osf.io/v2/preprints/fju3q/identifiers/,https://api.osf.io/v2/nodes/7csbh/,https://api.osf.io/v2/preprints/fju3q/relationships/node/,7csbh,nodes,https://api.osf.io/v2/providers/preprints/socarxiv/,socarxiv,preprint-providers,https://api.osf.io/v2/preprints/fju3q/files/,https://api.osf.io/v2/files/57be184eb83f6901f86563f2/,57be184eb83f6901f86563f2,files,https://api.osf.io/v2/preprints/fju3q/review_actions/,https://api.osf.io/v2/preprints/fju3q/requests/,https://api.osf.io/v2/preprints/fju3q/,https://osf.io/preprints/socarxiv/fju3q/,https://doi.org/10.31235/osf.io/fju3q
