id,type,attributes.date_created,attributes.date_modified,attributes.date_published,attributes.original_publication_date,attributes.doi,attributes.title,attributes.description,attributes.is_published,attributes.is_preprint_orphan,attributes.license_record,attributes.tags,attributes.preprint_doi_created,attributes.date_withdrawn,attributes.current_user_permissions,attributes.public,attributes.reviews_state,attributes.date_last_transitioned,attributes.has_coi,attributes.conflict_of_interest_statement,attributes.has_data_links,attributes.why_no_data,attributes.data_links,attributes.has_prereg_links,attributes.why_no_prereg,attributes.prereg_links,attributes.prereg_link_info,attributes.subjects,relationships.contributors.links.related.href,relationships.bibliographic_contributors.links.related.href,relationships.citation.links.related.href,relationships.citation.data.id,relationships.citation.data.type,relationships.identifiers.links.related.href,relationships.node.links.related.href,relationships.node.links.self.href,relationships.node.data.id,relationships.node.data.type,relationships.provider.links.related.href,relationships.provider.data.id,relationships.provider.data.type,relationships.files.links.related.href,relationships.primary_file.links.related.href,relationships.primary_file.data.id,relationships.primary_file.data.type,relationships.review_actions.links.related.href,relationships.requests.links.related.href,links.self,links.html,links.preprint_doi
pvsu7,preprints,2016-08-24T22:13:55.258000,2018-07-02T10:51:48.782023,2016-08-24T22:13:55.258000,NA,NA,Should Patent Infringement Require Proof of Copying?,"Patent law gives patent owners not just the right to prevent others from
copying their ideas, but the power to control the use of their idea even by
those who independently develop a technology with no knowledge of the
patent or the patentee. In an important paper, Samson Vermont challenges
this received wisdom, arguing that independent invention should be a
defense to patent infringement, just as it would be in copyright or trade
secret cases.

Independent invention has much to recommend it. The most significant
problem facing the patent system today is the rise of so-called ""patent
trolls"" - entities who do not manufacture products or transfer technology,
but wait and assert patents against successful companies who independently
developed and manufactured the technology without knowledge of the patent.
An independent invention defense would eliminate the troll problem in one
fell swoop. Nonetheless, I have concerns. While I agree with Vermont that
we can learn a great deal from the fact of independent invention, I am not
yet persuaded that we can be sure that an independent invention defense
will have no undue effect on incentives. Complicating this difficult
empirical question is the likelihood that the effects of an independent
invention defense would be different in different industries. Further, an
independent invention defense will significantly change any market for
patent rights that might exist or be developing today.

In light of this, I suggest four steps we might take that take advantage of
Vermont's insights without moving all the way to an independent invention
system. First, we should change the definition of willful infringement to
exclude independent inventors. Second, we should adopt some form of a prior
user right. Third, we should give simultaneous invention greater credence
in determining whether inventions are obvious. Finally, we might consider
whether the defendant independently invented as a factor in deciding
whether to grant injunctive relief and the conditions to impose on such
relief.",TRUE,FALSE,NA,Preprint|socarxiv,2018-07-02T10:51:48.774173,NA,,TRUE,accepted,2016-08-24T22:13:55.258000,NA,NA,NA,NA,NA,NA,NA,NA,NA,5a8c80f7c698300375c76d84|Social and Behavioral Sciences,https://api.osf.io/v2/preprints/pvsu7/contributors/,https://api.osf.io/v2/preprints/pvsu7/bibliographic_contributors/,https://api.osf.io/v2/preprints/pvsu7/citation/,pvsu7,preprints,https://api.osf.io/v2/preprints/pvsu7/identifiers/,https://api.osf.io/v2/nodes/xwg7p/,https://api.osf.io/v2/preprints/pvsu7/relationships/node/,xwg7p,nodes,https://api.osf.io/v2/providers/preprints/socarxiv/,socarxiv,preprint-providers,https://api.osf.io/v2/preprints/pvsu7/files/,https://api.osf.io/v2/files/57be1c24594d9001fdd0e005/,57be1c24594d9001fdd0e005,files,https://api.osf.io/v2/preprints/pvsu7/review_actions/,https://api.osf.io/v2/preprints/pvsu7/requests/,https://api.osf.io/v2/preprints/pvsu7/,https://osf.io/preprints/socarxiv/pvsu7/,https://doi.org/10.31235/osf.io/pvsu7
pz3tj,preprints,2016-08-24T22:12:22.079000,2018-07-02T10:51:49.152305,2016-08-24T22:12:22.079000,NA,NA,Foreseeability in Patent Law,"In the Festo decision, the Federal Circuit significantly changed the scope
of the doctrine of equivalents in patent law. The doctrine of prosecution
history estoppel precludes a patent owner from claiming during litigation
to own ground given up during patent prosecution. Under the old rule,
called the ""flexible bar,"" estoppel was based on a multi-factor test and
would apply only if the patentee had no choice but to amend its claims in
the way it did. Festo replaced the flexible bar with an ""absolute bar,""
under which virtually any amendment to a patent precludes resort to the
doctrine of equivalents for that claim element.

The Supreme Court is now considering whether the flexible or absolute bar
is the right rule. We believe there is middle ground in this debate that
has been ignored with both parties. Whether prosecution history estoppel
applies to any given amendment should depend on the reasonably foreseeable
effect of that amendment. Normally, patentees will understand that they are
surrendering coverage by amending their patent claims, and so a rule
precluding them from reclaiming that ground makes sense. But in some cases
the absolute bar will produce unexpected and unintended results. We argue
that the application of estoppel should turn on whether the effect of a
change would be foreseeable to a reasonable patentee at the time of the
amendment. This ""foreseeable"" bar better balances the competing policies of
strong protection for pioneering inventors and notice to improvers who wish
to design around a patent.",TRUE,FALSE,NA,Preprint|socarxiv,2018-07-02T10:51:49.144487,NA,,TRUE,accepted,2016-08-24T22:12:22.079000,NA,NA,NA,NA,NA,NA,NA,NA,NA,5a8c80f7c698300375c76d84|Social and Behavioral Sciences,https://api.osf.io/v2/preprints/pz3tj/contributors/,https://api.osf.io/v2/preprints/pz3tj/bibliographic_contributors/,https://api.osf.io/v2/preprints/pz3tj/citation/,pz3tj,preprints,https://api.osf.io/v2/preprints/pz3tj/identifiers/,https://api.osf.io/v2/nodes/944zt/,https://api.osf.io/v2/preprints/pz3tj/relationships/node/,944zt,nodes,https://api.osf.io/v2/providers/preprints/socarxiv/,socarxiv,preprint-providers,https://api.osf.io/v2/preprints/pz3tj/files/,https://api.osf.io/v2/files/57be1bc7594d9001fed0e067/,57be1bc7594d9001fed0e067,files,https://api.osf.io/v2/preprints/pz3tj/review_actions/,https://api.osf.io/v2/preprints/pz3tj/requests/,https://api.osf.io/v2/preprints/pz3tj/,https://osf.io/preprints/socarxiv/pz3tj/,https://doi.org/10.31235/osf.io/pz3tj
3t97e,preprints,2016-08-24T22:10:07.394000,2018-07-02T10:45:13.772988,2016-08-24T22:10:07.394000,NA,NA,Our Bizarre System for Proving Copyright Infringement,"At the heart of copyright infringement cases is “substantial similarity”
between the plaintiff’s and the defendant’s works. But while every circuit
agrees on the centrality of substantial similarity, that basic agreement
conceals surprising differences in what exactly we mean by substantial
similarity and how it is to be proven in court. And the majority approach,
defined by the Second Circuit in Arnstein v. Porter and the Ninth Circuit
in Sid and Marty Krofft, has the analysis of proof exactly backwards –
permitting analytic dissection of the works and expert testimony where the
question is one that should be handed to the members of the jury, and
falling back on the “ordinary observer” test on the very questions that
require careful dissection by the court. I argue that the Arnstein and
Krofft tests make no sense. A better model draws from software copyright
cases, which give filtration and dissection of unprotectable elements a
more central role.",TRUE,FALSE,NA,Preprint|socarxiv,2018-07-02T10:45:13.764491,NA,,TRUE,accepted,2016-08-24T22:10:07.394000,NA,NA,NA,NA,NA,NA,NA,NA,NA,5a8c80f7c698300375c76d84|Social and Behavioral Sciences,https://api.osf.io/v2/preprints/3t97e/contributors/,https://api.osf.io/v2/preprints/3t97e/bibliographic_contributors/,https://api.osf.io/v2/preprints/3t97e/citation/,3t97e,preprints,https://api.osf.io/v2/preprints/3t97e/identifiers/,https://api.osf.io/v2/nodes/g6wr2/,https://api.osf.io/v2/preprints/3t97e/relationships/node/,g6wr2,nodes,https://api.osf.io/v2/providers/preprints/socarxiv/,socarxiv,preprint-providers,https://api.osf.io/v2/preprints/3t97e/files/,https://api.osf.io/v2/files/57be1b406c613b01edd955e2/,57be1b406c613b01edd955e2,files,https://api.osf.io/v2/preprints/3t97e/review_actions/,https://api.osf.io/v2/preprints/3t97e/requests/,https://api.osf.io/v2/preprints/3t97e/,https://osf.io/preprints/socarxiv/3t97e/,https://doi.org/10.31235/osf.io/3t97e
am6ur,preprints,2016-08-24T22:08:48.900000,2018-07-02T10:47:36.673313,2016-08-24T22:08:48.900000,NA,NA,A Quick and Inexpensive System for Resolving Digital Copyright Disputes,"We have argued elsewhere that peer-to-peer (p2p) file sharing poses
significant new challenges to the enforcement of copyright law. Copyright
owners' initial response to these challenges - to try to shut down the
technologies that facilitate file sharing - is bad for society. We
suggested that it would be preferable to lower enforcement costs for
copyright owners by making dispute resolution by copyright owners against
direct infringers quick and cheap, so that copyright owners would be more
inclined to pursue such direct infringers instead of suing innovators.
While enforcement costs are likely always to be too great to allow pursuit
of every infringer, lower costs would allow for enforcement against more
infringers, increasing any given infringer's chance of being sued. In this
article, we explain how such a dispute resolution system might work, and
propose a draft amendment to the copyright act to implement the system.",TRUE,FALSE,NA,Preprint|socarxiv,2018-07-02T10:47:36.658698,NA,,TRUE,accepted,2016-08-24T22:08:48.900000,NA,NA,NA,NA,NA,NA,NA,NA,NA,5a8c80f7c698300375c76d84|Social and Behavioral Sciences,https://api.osf.io/v2/preprints/am6ur/contributors/,https://api.osf.io/v2/preprints/am6ur/bibliographic_contributors/,https://api.osf.io/v2/preprints/am6ur/citation/,am6ur,preprints,https://api.osf.io/v2/preprints/am6ur/identifiers/,https://api.osf.io/v2/nodes/4zh4q/,https://api.osf.io/v2/preprints/am6ur/relationships/node/,4zh4q,nodes,https://api.osf.io/v2/providers/preprints/socarxiv/,socarxiv,preprint-providers,https://api.osf.io/v2/preprints/am6ur/files/,https://api.osf.io/v2/files/57be1afab83f6901f765683f/,57be1afab83f6901f765683f,files,https://api.osf.io/v2/preprints/am6ur/review_actions/,https://api.osf.io/v2/preprints/am6ur/requests/,https://api.osf.io/v2/preprints/am6ur/,https://osf.io/preprints/socarxiv/am6ur/,https://doi.org/10.31235/osf.io/am6ur
2znvb,preprints,2016-08-24T22:06:13.105000,2018-07-02T10:45:09.998676,2016-08-24T22:06:13.105000,NA,NA,Our Divided Patent System,"In this comprehensive new study, we evaluate all substantive decisions
rendered by any court in every patent case filed in 2008 and 2009 —
decisions made between 2009 and 2013. We assess the outcome of litigation
by technology and industry. We relate the outcomes of those cases to a host
of variables, including variables related to the parties, the patents, and
the courts in which those cases were litigated.

We find dramatic differences in the outcomes of patent litigation by both
technology and industry. For example, owners of patents in the
pharmaceutical industry fare much better in dispositive litigation rulings
than do owners of patents in the computer & electronics industry, and
chemistry patents have much greater success in litigation than their
software or biotech counterparts. Our results provide an important window
into both patent litigation and the industry-specific battles over patent
reform. And they suggest that the traditional narrative of
industry-specific patent disputes, which pits the IT industries against the
life sciences, is incomplete.",TRUE,FALSE,NA,Preprint|socarxiv,2018-07-02T10:45:09.988657,NA,,TRUE,accepted,2016-08-24T22:06:13.105000,NA,NA,NA,NA,NA,NA,NA,NA,NA,5a8c80f7c698300375c76d84|Social and Behavioral Sciences,https://api.osf.io/v2/preprints/2znvb/contributors/,https://api.osf.io/v2/preprints/2znvb/bibliographic_contributors/,https://api.osf.io/v2/preprints/2znvb/citation/,2znvb,preprints,https://api.osf.io/v2/preprints/2znvb/identifiers/,https://api.osf.io/v2/nodes/mrb94/,https://api.osf.io/v2/preprints/2znvb/relationships/node/,mrb94,nodes,https://api.osf.io/v2/providers/preprints/socarxiv/,socarxiv,preprint-providers,https://api.osf.io/v2/preprints/2znvb/files/,https://api.osf.io/v2/files/57be1a576c613b01efd937d3/,57be1a576c613b01efd937d3,files,https://api.osf.io/v2/preprints/2znvb/review_actions/,https://api.osf.io/v2/preprints/2znvb/requests/,https://api.osf.io/v2/preprints/2znvb/,https://osf.io/preprints/socarxiv/2znvb/,https://doi.org/10.31235/osf.io/2znvb
6wnm8,preprints,2016-08-24T22:04:24.853000,2018-07-02T10:46:29.658884,2016-08-24T22:04:24.853000,NA,NA,Intellectual Property Litigation Clearinghouse: Data Overview,"The Intellectual Property Litigation Clearinghouse (IPLC) will be a
comprehensive online information source on IP lawsuits. Modeled on the
renowned Stanford Securities Class Action Clearinghouse, the IPLC will host
general statistical information, as well as text-searchable dockets,
complaints, select motions, judicial opinions, and related data.",TRUE,FALSE,NA,Preprint|socarxiv,2018-07-02T10:46:29.650515,NA,,TRUE,accepted,2016-08-24T22:04:24.853000,NA,NA,NA,NA,NA,NA,NA,NA,NA,5a8c80f7c698300375c76d84|Social and Behavioral Sciences,https://api.osf.io/v2/preprints/6wnm8/contributors/,https://api.osf.io/v2/preprints/6wnm8/bibliographic_contributors/,https://api.osf.io/v2/preprints/6wnm8/citation/,6wnm8,preprints,https://api.osf.io/v2/preprints/6wnm8/identifiers/,https://api.osf.io/v2/nodes/y339r/,https://api.osf.io/v2/preprints/6wnm8/relationships/node/,y339r,nodes,https://api.osf.io/v2/providers/preprints/socarxiv/,socarxiv,preprint-providers,https://api.osf.io/v2/preprints/6wnm8/files/,https://api.osf.io/v2/files/57be19ea6c613b01efd937d0/,57be19ea6c613b01efd937d0,files,https://api.osf.io/v2/preprints/6wnm8/review_actions/,https://api.osf.io/v2/preprints/6wnm8/requests/,https://api.osf.io/v2/preprints/6wnm8/,https://osf.io/preprints/socarxiv/6wnm8/,https://doi.org/10.31235/osf.io/6wnm8
jn2yz,preprints,2016-08-24T22:03:02.349000,2018-07-02T10:51:06.036240,2016-08-24T22:03:02.349000,NA,NA,Quantum Patent Mechanics,"Determining the meaning of patent claims necessarily requires the judge to
break the text of a claim into discrete elements or units of text
corresponding to the elements or units that comprise the claimed invention
- essentially, organizing the language of the claims into chunks or quanta
of text. Define an element narrowly - limit it to a single word, say - and
you will tend to narrow the resulting patent, because to prove infringement
the patentee must show that each word has a corresponding structure in the
accused device. By contrast, defining an element broadly tends to broaden
the patent, because it permits the text to read on a greater range of
accused devices.

For each discrete packet identified, the courts must determine the meaning
of the constituent words. They can assign those words definitions that
range from narrow, specific meanings to broad, general meanings. In
determining the meaning of terms within a particular element, judges
practicing patent claim interpretation are engaged in an exercise that to
some degree resembles the famous levels of abstraction test articulated by
Judge Learned Hand for analysis of infringement under copyright law's
idea/expression doctrine.

There are no hard and fast standards in the law by which to make the right
decision as to either the size of the textual element or the level of
abstraction at which it will be evaluated. Indeed, the indeterminacy is so
acute that courts generally don't acknowledge that they are even engaging
in either inquiry. They define an element almost arbitrarily, and even when
judges disagree as to the proper definition they can offer no principled
basis for doing so. The problem may be worse than a simple failure to
acknowledge subconscious decisions that affect the scope of a patent,
however. This indeterminacy may well be inherent in the process of mapping
words to things, as modern literary theorists suggest. While courts purport
to rely on the ordinary or plain meaning of the words of a patent claim,
there may simply be no such thing.

If we can't define the metes and bounds of the invention in any meaningful
way, we might instead start with the patentee's invention itself,
construing patent claims narrowly and in light of the actual invention when
the claim terms are ambiguous. Courts could then supplement this narrower
claim construction with a doctrine of equivalents analysis, which would
permit them to decide how broadly to apply the principle of the invention.",TRUE,FALSE,NA,Preprint|socarxiv,2018-07-02T10:51:06.028510,NA,,TRUE,accepted,2016-08-24T22:03:02.349000,NA,NA,NA,NA,NA,NA,NA,NA,NA,5a8c80f7c698300375c76d84|Social and Behavioral Sciences,https://api.osf.io/v2/preprints/jn2yz/contributors/,https://api.osf.io/v2/preprints/jn2yz/bibliographic_contributors/,https://api.osf.io/v2/preprints/jn2yz/citation/,jn2yz,preprints,https://api.osf.io/v2/preprints/jn2yz/identifiers/,https://api.osf.io/v2/nodes/hkfbb/,https://api.osf.io/v2/preprints/jn2yz/relationships/node/,hkfbb,nodes,https://api.osf.io/v2/providers/preprints/socarxiv/,socarxiv,preprint-providers,https://api.osf.io/v2/preprints/jn2yz/files/,https://api.osf.io/v2/files/57be199c9ad5a101fb68d998/,57be199c9ad5a101fb68d998,files,https://api.osf.io/v2/preprints/jn2yz/review_actions/,https://api.osf.io/v2/preprints/jn2yz/requests/,https://api.osf.io/v2/preprints/jn2yz/,https://osf.io/preprints/socarxiv/jn2yz/,https://doi.org/10.31235/osf.io/jn2yz
kb3c7,preprints,2016-08-24T22:01:34.555000,2018-07-02T10:51:07.904433,2016-08-24T22:01:34.555000,NA,NA,Freedom of Speech and Injunctions in Intellectual Property Cases,"Preliminary injunctions against libel, obscenity, and other kinds of speech
are generally considered unconstitutional prior restraints. Never mind that
a libel may inflict truly irreparable harm on you: The most you can hope
for is damages, or perhaps a permanent injunction after final adjudication
-- not preliminary relief.

And yet in copyright and other intellectual property cases, preliminary
injunctions are routine. We argue that the prior restraint doctrine has
something to say about that, too. Though copyright law (like libel and
obscenity law), is a constitutionally permissible speech restriction, the
""First Amendment Due Process"" rule against prior restraints applies even to
such permissible restrictions.

We argue that preliminary injunctions in copyright cases are generally
unconstitutional; the one exception is cases where there's no controversy
over substantial similarity of expression or fair use (for instance, where
the question turns only on whether defendant had the requisite license). We
also argue the same about right of publicity cases, trademark cases, and
trade secret cases, except possibly cases (such as many trademark cases)
that involve commercial advertising. We believe this conclusion is dictated
by the Court's prior restraint doctrine, and also makes good First
Amendment policy sense.",TRUE,FALSE,NA,Preprint|socarxiv,2018-07-02T10:51:07.894331,NA,,TRUE,accepted,2016-08-24T22:01:34.555000,NA,NA,NA,NA,NA,NA,NA,NA,NA,5a8c80f7c698300375c76d84|Social and Behavioral Sciences,https://api.osf.io/v2/preprints/kb3c7/contributors/,https://api.osf.io/v2/preprints/kb3c7/bibliographic_contributors/,https://api.osf.io/v2/preprints/kb3c7/citation/,kb3c7,preprints,https://api.osf.io/v2/preprints/kb3c7/identifiers/,https://api.osf.io/v2/nodes/p92jt/,https://api.osf.io/v2/preprints/kb3c7/relationships/node/,p92jt,nodes,https://api.osf.io/v2/providers/preprints/socarxiv/,socarxiv,preprint-providers,https://api.osf.io/v2/preprints/kb3c7/files/,https://api.osf.io/v2/files/57be193f6c613b01eed9396d/,57be193f6c613b01eed9396d,files,https://api.osf.io/v2/preprints/kb3c7/review_actions/,https://api.osf.io/v2/preprints/kb3c7/requests/,https://api.osf.io/v2/preprints/kb3c7/,https://osf.io/preprints/socarxiv/kb3c7/,https://doi.org/10.31235/osf.io/kb3c7
7jg5a,preprints,2016-08-24T21:59:47.305000,2018-07-02T10:46:31.917993,2016-08-24T21:59:47.305000,NA,NA,Reply: Patent Holdup and Royalty Stacking,"We argued in our paper, ""Patent Hold-Up and Royalty Stacking,"" that the
threat to obtain a permanent injunction greatly enhances the patent
holder's negotiating power, leading to royalty rates that exceed a
benchmark level based on the value of the patented technology and the
strength of the patent. John Golden, in his extensive comment on our paper,
claims: ""Lemley and Shapiro err when they claim to have proven that
'patentees whose inventions are only one component of a larger product are
systematically overcompensated.'"" However, the error is Golden's not ours.
When patentees systematically capture value they did not create from others
who did create it, they are being overcompensated by any reasonable
measure, including the standard economic models on which we relied. In Part
II, we briefly respond to his criticism of our empirical study of
court-awarded reasonable royalties. Finally, Golden also claims that our
recommendation to reduce the availability of permanent injunctions to
patent holders who have claims to reasonable royalties but not lost profits
remedy ""threatens to distort markets for innovation."" We strongly disagree.
It is patent holdup, which skews damages in ways more favorable to
reasonable royalties, that distorts markets for innovation. A rule such as
the one we propose, in which damages are calibrated to compensate patentees
for their loss, is sensible public policy.",TRUE,FALSE,NA,Preprint|socarxiv,2018-07-02T10:46:31.909588,NA,,TRUE,accepted,2016-08-24T21:59:47.305000,NA,NA,NA,NA,NA,NA,NA,NA,NA,5a8c80f7c698300375c76d84|Social and Behavioral Sciences,https://api.osf.io/v2/preprints/7jg5a/contributors/,https://api.osf.io/v2/preprints/7jg5a/bibliographic_contributors/,https://api.osf.io/v2/preprints/7jg5a/citation/,7jg5a,preprints,https://api.osf.io/v2/preprints/7jg5a/identifiers/,https://api.osf.io/v2/nodes/s2k4r/,https://api.osf.io/v2/preprints/7jg5a/relationships/node/,s2k4r,nodes,https://api.osf.io/v2/providers/preprints/socarxiv/,socarxiv,preprint-providers,https://api.osf.io/v2/preprints/7jg5a/files/,https://api.osf.io/v2/files/57be18d49ad5a1020968da2f/,57be18d49ad5a1020968da2f,files,https://api.osf.io/v2/preprints/7jg5a/review_actions/,https://api.osf.io/v2/preprints/7jg5a/requests/,https://api.osf.io/v2/preprints/7jg5a/,https://osf.io/preprints/socarxiv/7jg5a/,https://doi.org/10.31235/osf.io/7jg5a
