knvp3,preprints,2016-08-24T19:08:45.618000,2018-07-02T10:51:08.620879,2016-08-24T19:08:45.618000,NA,NA,Rethinking Patent Law's Presumption of Validity,"The United States Patent and Trademark Office is tasked with the job of
reading patent applications and determining which ones qualify for patent
protection. It is a Herculean task, and the Patent Office pursues it
subject to enormous informational and budgetary constraints. Nonetheless,
under current law, courts are bound to defer to the Patent Office's
decisions regarding patent validity. In this Article, we argue for reform.
Deference to previous decision-makers is appropriate in instances where
those previous decisions have a high likelihood of accuracy, and the patent
system should endeavor to create processes that fit this mold. But granting
significant deference to the initial process of patent review is
indefensible and counter-productive. Patents should be vulnerable to
challenge until and unless they are significantly evaluated in an
information-rich environment. At that point, they will have earned and
therefore should be accorded a presumption of validity. Such an approach
would better serve the patent's systems long-run incentive goals, and it
would give patent applicants better incentives to file for genuine
inventions but leave their more obvious and incremental accomplishments
outside the patent system's purview. Here, we therefore suggest the
creation of a two-tier system of patent validity, with patents that are
subject to intensive scrutiny accorded a strong presumption of validity,
while untested patents are left to be evaluated more fully in court.",TRUE,FALSE,NA,Preprint|socarxiv,2018-07-02T10:51:08.613001,NA,,TRUE,accepted,2016-08-24T19:08:45.618000,NA,NA,NA,NA,NA,NA,NA,NA,NA,5a8c80f7c698300375c76d84|Social and Behavioral Sciences,https://api.osf.io/v2/preprints/knvp3/contributors/,https://api.osf.io/v2/preprints/knvp3/bibliographic_contributors/,https://api.osf.io/v2/preprints/knvp3/citation/,knvp3,preprints,https://api.osf.io/v2/preprints/knvp3/identifiers/,https://api.osf.io/v2/nodes/3kt2u/,https://api.osf.io/v2/preprints/knvp3/relationships/node/,3kt2u,nodes,https://api.osf.io/v2/providers/preprints/socarxiv/,socarxiv,preprint-providers,https://api.osf.io/v2/preprints/knvp3/files/,https://api.osf.io/v2/files/57bdf0bf6c613b01ead9380b/,57bdf0bf6c613b01ead9380b,files,https://api.osf.io/v2/preprints/knvp3/review_actions/,https://api.osf.io/v2/preprints/knvp3/requests/,https://api.osf.io/v2/preprints/knvp3/,https://osf.io/preprints/socarxiv/knvp3/,https://doi.org/10.31235/osf.io/knvp3
anz2u,preprints,2016-08-24T19:05:56.763000,2018-07-02T10:47:36.754056,2016-08-24T19:05:56.763000,NA,NA,Copying in Patent Law,"Patent law is virtually alone in intellectual property (IP) in punishing
independent development. To infringe a copyright or trade secret,
defendants must copy the protected IP from the plaintiff, directly or
indirectly. But patent infringement requires only that the defendant's
product falls within the scope of the patent claims. Not only doesn't the
defendant need to intend to infringe, but the defendant may be entirely
unaware of the patent or the patentee and still face liability.

Nonetheless, copying does play a role in some subsidiary patent doctrines.
For example, the question of whether patent damages should be set in order
to deter infringement depends critically on whether infringers are in fact
aware they are infringing, or at least that they are using the plaintiff's
technology. Copying - or at least intent to infringe - is also an element
of claims for indirect infringement. The definition of ""willful
infringement"" also turns on the question of culpability, at least in the
popular understanding of that term. More significantly, the rhetoric of
patent law (and of IP law more generally) often seems to presuppose that
defendants in patent cases are in fact engaged in copying. Similarly, the
outcome of public policy debates over patent reform may well turn on the
perception of patent infringers as either bad actors or as innocent
businesspeople who accidentally ran afoul of a patent.

Unfortunately, no one seems to know whether patent infringement defendants
are in fact unscrupulous copyists or independent developers. In this paper,
we seek to answer that question. Because copying is not an element of any
patent cause of action, courts do not normally make explicit findings as to
whether defendants have copied. Instead, we turn to a variety of proxies to
try to identify the subset of cases in which copying is alleged or proven.
We look both at the allegations made in a random sample of complaints and
at the treatment of copying in recent reported decisions. We find that a
surprisingly small percentage of patent cases involve even allegations of
copying, much less proof of copying. Copying in patent law seems to be the
exception, not the rule.",TRUE,FALSE,NA,Preprint|socarxiv,2018-07-02T10:47:36.746246,NA,,TRUE,accepted,2016-08-24T19:05:56.763000,NA,NA,NA,NA,NA,NA,NA,NA,NA,5a8c80f7c698300375c76d84|Social and Behavioral Sciences,https://api.osf.io/v2/preprints/anz2u/contributors/,https://api.osf.io/v2/preprints/anz2u/bibliographic_contributors/,https://api.osf.io/v2/preprints/anz2u/citation/,anz2u,preprints,https://api.osf.io/v2/preprints/anz2u/identifiers/,https://api.osf.io/v2/nodes/v8djb/,https://api.osf.io/v2/preprints/anz2u/relationships/node/,v8djb,nodes,https://api.osf.io/v2/providers/preprints/socarxiv/,socarxiv,preprint-providers,https://api.osf.io/v2/preprints/anz2u/files/,https://api.osf.io/v2/files/57bdf0169ad5a101fa68da32/,57bdf0169ad5a101fa68da32,files,https://api.osf.io/v2/preprints/anz2u/review_actions/,https://api.osf.io/v2/preprints/anz2u/requests/,https://api.osf.io/v2/preprints/anz2u/,https://osf.io/preprints/socarxiv/anz2u/,https://doi.org/10.31235/osf.io/anz2u
