id,type,attributes.date_created,attributes.date_modified,attributes.date_published,attributes.original_publication_date,attributes.doi,attributes.title,attributes.description,attributes.is_published,attributes.is_preprint_orphan,attributes.license_record,attributes.tags,attributes.preprint_doi_created,attributes.date_withdrawn,attributes.current_user_permissions,attributes.public,attributes.reviews_state,attributes.date_last_transitioned,attributes.has_coi,attributes.conflict_of_interest_statement,attributes.has_data_links,attributes.why_no_data,attributes.data_links,attributes.has_prereg_links,attributes.why_no_prereg,attributes.prereg_links,attributes.prereg_link_info,attributes.subjects,relationships.contributors.links.related.href,relationships.bibliographic_contributors.links.related.href,relationships.citation.links.related.href,relationships.citation.data.id,relationships.citation.data.type,relationships.identifiers.links.related.href,relationships.node.links.related.href,relationships.node.links.self.href,relationships.node.data.id,relationships.node.data.type,relationships.provider.links.related.href,relationships.provider.data.id,relationships.provider.data.type,relationships.files.links.related.href,relationships.primary_file.links.related.href,relationships.primary_file.data.id,relationships.primary_file.data.type,relationships.review_actions.links.related.href,relationships.requests.links.related.href,links.self,links.html,links.preprint_doi
4ea9v,preprints,2016-08-24T21:27:31.615000,2018-07-02T10:45:18.110797,2016-08-24T21:27:31.615000,NA,NA,Irrelevant Confusion,"Trademark law centers its analysis on consumer confusion. With some
significant exceptions, the basic rule of trademark law is that a
defendant’s use of a mark is illegal if it confuses a substantial number of
consumers and not otherwise.

As a general matter, this is the right rule. Trademark law is designed to
facilitate the workings of modern markets by permitting producers to
accurately communicate information about the quality of their products to
buyers, and therefore to encourage them to invest in making quality
products in circumstances in which that quality wouldn’t otherwise be
apparent. If competitors can falsely mimic that information, they will
confuse consumers, who won’t know whether they are in fact getting a high
quality product and therefore won’t be willing to pay as much for that
quality. I won’t pay as much for an iPod if I think there is a chance it is
a cheap knock-off masquerading as an iPod.

The law of false advertising operates as an adjunct to trademark law. While
trademark law prevents competitors from misrepresenting the source of their
products by mimicking another’s brand name, the law of false advertising
prevents false or misleading statements about the quality of one’s own or a
competitor’s products. Like trademark law, false advertising law is
designed to protect the integrity of markets by allowing consumers to rely
on statements made by sellers.

Unfortunately, trademark law has taken the concept of confusion too far.
Between 1930 and 1980, courts expanded the concept of confusion beyond
confusion as to the source of a product to include the possibility that
consumers are confused as to whether the trademark owner sponsors or is
affiliated with the defendant’s goods. This expansion began for plausible
reasons: consumers might be confused to their detriment in a variety of
circumstances in which the plaintiff and the defendant do not actually
compete directly. But sponsorship and affiliation confusion has taken on a
life of its own, resulting in a large number of cases in which companies or
individuals are prevented from doing things that might conceivably confuse
consumers, but do not confuse consumers in any way that harms their
decision-making process or that the law should care about. In Part I, we
offer a number of examples of “confusion” that courts have found actionable
even in circumstances in which that confusion was unlikely to matter to the
operation of the market. Part II explains how we arrived at this
unfortunate pass.

We suggest in Part III that trademark law should focus its attention on
confusion that is actually relevant to purchasing decisions. We would make
the source of the goods the central element of confusion analysis. It is
confusion as to source that is most obviously relevant to the purposes
behind trademark law. That does not mean, however, that confusion as to the
relationship between plaintiff and defendant can never be actionable.
Confusion as to affiliation should be actionable when consumers are likely
to believe that the trademark owner stands behind or guarantees the quality
of the goods the defendant sells. Even if consumers understand that
individual franchisees, rather than the McDonald’s Corporation, actually
make their hamburgers, they are likely to expect that McDonald’s stands
behind whatever quality that brand represents.

Finally, the fact that confusion as to sponsorship or affiliation should
not generally be trademark infringement does not mean that it will never be
actionable. Some statements that create confusion as to sponsorship or
affiliation will be actionable as a form of false advertising. We address
the scope of false advertising in Part IV. Notably, proof of a false
advertising claim requires the plaintiff to demonstrate that the
misrepresentation is material – that it is likely to affect a product
purchasing decision. Indeed, the statute specifies the sorts of
misrepresentations that are forbidden. We continue the discussion in Part
V, which explores some of the implications of shunting some cases into the
false advertising framework, and discusses how to handle some close cases.",TRUE,FALSE,NA,Preprint|socarxiv,2018-07-02T10:45:18.102146,NA,,TRUE,accepted,2016-08-24T21:27:31.615000,NA,NA,NA,NA,NA,NA,NA,NA,NA,5a8c80f7c698300375c76d84|Social and Behavioral Sciences,https://api.osf.io/v2/preprints/4ea9v/contributors/,https://api.osf.io/v2/preprints/4ea9v/bibliographic_contributors/,https://api.osf.io/v2/preprints/4ea9v/citation/,4ea9v,preprints,https://api.osf.io/v2/preprints/4ea9v/identifiers/,https://api.osf.io/v2/nodes/8wg4s/,https://api.osf.io/v2/preprints/4ea9v/relationships/node/,8wg4s,nodes,https://api.osf.io/v2/providers/preprints/socarxiv/,socarxiv,preprint-providers,https://api.osf.io/v2/preprints/4ea9v/files/,https://api.osf.io/v2/files/57be11459ad5a1020968da1e/,57be11459ad5a1020968da1e,files,https://api.osf.io/v2/preprints/4ea9v/review_actions/,https://api.osf.io/v2/preprints/4ea9v/requests/,https://api.osf.io/v2/preprints/4ea9v/,https://osf.io/preprints/socarxiv/4ea9v/,https://doi.org/10.31235/osf.io/4ea9v
4csmu,preprints,2016-08-24T21:27:24.093000,2018-07-02T10:45:17.470175,2016-08-24T21:27:24.093000,NA,NA,The Merchandising Right: Fragile Theory or Fait Accompli?,"Trademark merchandising is big business. One marketing consultant estimated
the global market for licensing and marketing sports-related merchandise at
$17 billion in 2001. With this much money at stake, it's no surprise that
trademark holders demand royalties for use of their marks on shirts, key
chains, jewelry, and related consumer products. After all, the value of
these products comes largely from the allure of the trademarks, and it
seems only fair to reward the party that created that value . . . doesn't
it?

It turns out that the answer is more complicated than this intuitive
account would predict. Trademark law historically has existed primarily to
protect against the consumer deception that occurs when one party attempts
to pass off its products as those of another. From an economic and policy
perspective, it is by no means obvious that trademark holders should have
exclusive rights over the sale of products that use marks for their
ornamental or intrinsic value, rather than as indicators of source or
official sponsorship. Trademark law seeks to promote, rather than hinder,
truthful competition in markets for products sought by consumers; if a
trademark is the product, then giving one party exclusive rights over it
runs in tension with the law's pro-competitive goals, frequently without
any deception-related justification. On the other hand, there may be
circumstances in which consumers expect that trademark holders sponsored or
produced products bearing their mark, in which case use of the mark by
others - even as a part of a product - might result in genuine confusion.

Given these complexities, together with the economic interests at stake,
one might expect that the law and practice of merchandising rights would be
well-settled and reflect a considered balancing of the interests of
trademark holders and their competitors. In reality, however, much of the
multi-billion dollar industry of merchandise licensing has grown around a
handful of cases from the 1970s and 1980s that established merchandising
rights with little regard for the competing legal or policy concerns at
stake. Those cases are far from settled law - indeed, at least as many
decisions decline to give trademark owners the right to control sales of
their trademarks as products. We think it is high time to revisit that case
law and to reconsider the theoretical justifications for a merchandising
right.

That review provides little support for trademark owners' assumptions about
merchandising. Doctrinally, the most broad-reaching merchandising cases -
which presumed infringement based on the public recognition of the mark as
a trademark - were simply wrong in their analysis of trademark infringement
and have been specifically rejected by subsequent decisions.
Philosophically, even a merchandising right that hinges on likelihood of
confusion raises competition-related concerns that should affect courts'
analysis of both the merits and appropriate remedies in merchandising
cases. Perhaps most importantly, recent Supreme Court case law suggests
that, if it had the opportunity to evaluate the merchandising theory
(something it has never done), the Court would deny the existence of such a
right. Further, the Court would be right to do so. When a trademark is
sold, not as a source indicator, but as a desirable feature of a product,
competition suffers - and consumers pay - if other sellers are shut out of
the market for that feature.",TRUE,FALSE,NA,Preprint|socarxiv,2018-07-02T10:45:17.454243,NA,,TRUE,accepted,2016-08-24T21:27:24.093000,NA,NA,NA,NA,NA,NA,NA,NA,NA,5a8c80f7c698300375c76d84|Social and Behavioral Sciences,https://api.osf.io/v2/preprints/4csmu/contributors/,https://api.osf.io/v2/preprints/4csmu/bibliographic_contributors/,https://api.osf.io/v2/preprints/4csmu/citation/,4csmu,preprints,https://api.osf.io/v2/preprints/4csmu/identifiers/,https://api.osf.io/v2/nodes/46n2m/,https://api.osf.io/v2/preprints/4csmu/relationships/node/,46n2m,nodes,https://api.osf.io/v2/providers/preprints/socarxiv/,socarxiv,preprint-providers,https://api.osf.io/v2/preprints/4csmu/files/,https://api.osf.io/v2/files/57be113d9ad5a101f668de00/,57be113d9ad5a101f668de00,files,https://api.osf.io/v2/preprints/4csmu/review_actions/,https://api.osf.io/v2/preprints/4csmu/requests/,https://api.osf.io/v2/preprints/4csmu/,https://osf.io/preprints/socarxiv/4csmu/,https://doi.org/10.31235/osf.io/4csmu
sf5ry,preprints,2016-08-24T21:23:21.442000,2018-07-02T10:52:08.185661,2016-08-24T21:23:21.442000,NA,NA,Could Java Change Everything? The Competitive Propriety of a Proprietary Standard,"The Internet software market is characterized by strong network effects and
omnipresent intellectual property rights. In this paper, we attempt to
explore the relationship between the two, focusing on two examples: the
government's antitrust proceeding against Microsoft for browser tying, and
Sun's suit against Microsoft for altering Java. We conclude that the social
value of the Internet lies in its ability to facilitate interoperation, and
this in turn argues in favor of open access to network standards. Such open
standards may be achieved in the open market. Where they are not, the law
may intervene, but it must be cautious not to overreach and to avoid
disturbing the incentives provided by intellectual property protection.",TRUE,FALSE,NA,Preprint|socarxiv,2018-07-02T10:52:08.177423,NA,,TRUE,accepted,2016-08-24T21:23:21.442000,NA,NA,NA,NA,NA,NA,NA,NA,NA,5a8c80f7c698300375c76d84|Social and Behavioral Sciences,https://api.osf.io/v2/preprints/sf5ry/contributors/,https://api.osf.io/v2/preprints/sf5ry/bibliographic_contributors/,https://api.osf.io/v2/preprints/sf5ry/citation/,sf5ry,preprints,https://api.osf.io/v2/preprints/sf5ry/identifiers/,https://api.osf.io/v2/nodes/3zugu/,https://api.osf.io/v2/preprints/sf5ry/relationships/node/,3zugu,nodes,https://api.osf.io/v2/providers/preprints/socarxiv/,socarxiv,preprint-providers,https://api.osf.io/v2/preprints/sf5ry/files/,https://api.osf.io/v2/files/57be104ab83f6901f86563e7/,57be104ab83f6901f86563e7,files,https://api.osf.io/v2/preprints/sf5ry/review_actions/,https://api.osf.io/v2/preprints/sf5ry/requests/,https://api.osf.io/v2/preprints/sf5ry/,https://osf.io/preprints/socarxiv/sf5ry/,https://doi.org/10.31235/osf.io/sf5ry
n3auz,preprints,2016-08-24T21:21:15.559000,2018-07-02T10:51:43.841571,2016-08-24T21:21:15.559000,NA,NA,The Law and Economics of Internet Norms,"A number of scholars have suggested that the law should defer to social
norms on the Internet, either by abdicating its role entirely to cyberspace
self-governance, or by carving out particular roles for nonlegal
rulemaking. I challenge these assertions. I argue that Internet norms are
elusive and rapidly changing, and that in most cases there is nothing like
the consensus required for norm creation. I contend that Internet norms are
likely to be inefficient, particularly when they are enforced by the
underlying threat of exclusion from the network itself. Finally, I suggest
that neither Net ""vigilantes,"" judges, nor code itself can be relied upon
to identify and enforce Internet norms with an appropriate sensitivity to
efficiency and policy concerns.",TRUE,FALSE,NA,Preprint|socarxiv,2018-07-02T10:51:43.828138,NA,,TRUE,accepted,2016-08-24T21:21:15.559000,NA,NA,NA,NA,NA,NA,NA,NA,NA,5a8c80f7c698300375c76d84|Social and Behavioral Sciences,https://api.osf.io/v2/preprints/n3auz/contributors/,https://api.osf.io/v2/preprints/n3auz/bibliographic_contributors/,https://api.osf.io/v2/preprints/n3auz/citation/,n3auz,preprints,https://api.osf.io/v2/preprints/n3auz/identifiers/,https://api.osf.io/v2/nodes/bbvwx/,https://api.osf.io/v2/preprints/n3auz/relationships/node/,bbvwx,nodes,https://api.osf.io/v2/providers/preprints/socarxiv/,socarxiv,preprint-providers,https://api.osf.io/v2/preprints/n3auz/files/,https://api.osf.io/v2/files/57be0fcd9ad5a101fa68db3d/,57be0fcd9ad5a101fa68db3d,files,https://api.osf.io/v2/preprints/n3auz/review_actions/,https://api.osf.io/v2/preprints/n3auz/requests/,https://api.osf.io/v2/preprints/n3auz/,https://osf.io/preprints/socarxiv/n3auz/,https://doi.org/10.31235/osf.io/n3auz
67ft5,preprints,2016-08-24T21:19:52.887000,2018-07-02T10:46:27.253801,2016-08-24T21:19:52.887000,NA,NA,Is the Patent Office a Rubber Stamp?,"A growing chorus of voices is sounding a common refrain - the U.S. Patent
and Trademark Office (PTO) is issuing far too many bad patents. These
criticisms are complicated by the rather surprising fact that we don't
actually know what percentage of patent applications actually issue as
patents. In this paper, we use a novel dataset of all published patent
applications filed in January 2001 to estimate the grant rate. These data
also allow us to examine the uses of continuation applications, and to
assess dynamics of applicant-examiner interaction over the patent
prosecution process. We find that the PTO rejects a surprisingly high
percentage of patents. While more than two-thirds of all applications
result in at least one patent, a significant number of applications are
rejected and then finally abandoned by the applicant. We also find that the
likelihood of obtaining a patent varies significantly by industry, but in
surprising ways. Finally, despite a variety of reforms that might be
thought to reduce the use and abuse of continuation applications, we find a
high use of continuation applications of various types.",TRUE,FALSE,NA,Preprint|socarxiv,2018-07-02T10:46:27.246069,NA,,TRUE,accepted,2016-08-24T21:19:52.887000,NA,NA,NA,NA,NA,NA,NA,NA,NA,5a8c80f7c698300375c76d84|Social and Behavioral Sciences,https://api.osf.io/v2/preprints/67ft5/contributors/,https://api.osf.io/v2/preprints/67ft5/bibliographic_contributors/,https://api.osf.io/v2/preprints/67ft5/citation/,67ft5,preprints,https://api.osf.io/v2/preprints/67ft5/identifiers/,https://api.osf.io/v2/nodes/zxva7/,https://api.osf.io/v2/preprints/67ft5/relationships/node/,zxva7,nodes,https://api.osf.io/v2/providers/preprints/socarxiv/,socarxiv,preprint-providers,https://api.osf.io/v2/preprints/67ft5/files/,https://api.osf.io/v2/files/57be0f7ab83f6901f165649c/,57be0f7ab83f6901f165649c,files,https://api.osf.io/v2/preprints/67ft5/review_actions/,https://api.osf.io/v2/preprints/67ft5/requests/,https://api.osf.io/v2/preprints/67ft5/,https://osf.io/preprints/socarxiv/67ft5/,https://doi.org/10.31235/osf.io/67ft5
d9ckg,preprints,2016-08-24T21:18:22.571000,2018-07-02T10:48:31.578698,2016-08-24T21:18:22.571000,NA,NA,Industry-Specific Antitrust Policy for Innovation,"The premise that IP promotes dynamic efficiency while antitrust
concentrates on static welfare is wrong, or at least oversimplified. It
proceeds from a fundamentally Schumpeterian assumption that competition
will not lead to innovation, and we need the lure of monopoly to drive
investment in new products. In fact, however there is substantial economic
evidence suggesting that competition itself may act as a greater spur to
innovation than monopoly. Critically, different market structures will
promote innovation in different industries. Sometimes - as in the
pharmaceutical industry - we need the incentive provided by strong patents,
but in other industries - like the Internet - competition is more likely to
spur innovation. Both patent and antitrust law need to take these industry
differences into account. And to do so, antitrust will need to shed its
subservience to IP law.",TRUE,FALSE,NA,Preprint|socarxiv,2018-07-02T10:48:31.567496,NA,,TRUE,accepted,2016-08-24T21:18:22.571000,NA,NA,NA,NA,NA,NA,NA,NA,NA,5a8c80f7c698300375c76d84|Social and Behavioral Sciences,https://api.osf.io/v2/preprints/d9ckg/contributors/,https://api.osf.io/v2/preprints/d9ckg/bibliographic_contributors/,https://api.osf.io/v2/preprints/d9ckg/citation/,d9ckg,preprints,https://api.osf.io/v2/preprints/d9ckg/identifiers/,https://api.osf.io/v2/nodes/mrwxc/,https://api.osf.io/v2/preprints/d9ckg/relationships/node/,mrwxc,nodes,https://api.osf.io/v2/providers/preprints/socarxiv/,socarxiv,preprint-providers,https://api.osf.io/v2/preprints/d9ckg/files/,https://api.osf.io/v2/files/57be0f1f594d900201d0e0a6/,57be0f1f594d900201d0e0a6,files,https://api.osf.io/v2/preprints/d9ckg/review_actions/,https://api.osf.io/v2/preprints/d9ckg/requests/,https://api.osf.io/v2/preprints/d9ckg/,https://osf.io/preprints/socarxiv/d9ckg/,https://doi.org/10.31235/osf.io/d9ckg
bk6am,preprints,2016-08-24T21:16:52.861000,2018-07-02T10:48:25.215980,2016-08-24T21:16:52.861000,NA,NA,Owning Mark(et)s,"Trademark owners regularly rely on claims that the defendant is “free
riding” on their mark by making money using that mark, foreclosing an
opportunity for the trademark owner to capture that revenue. We analyze
those free riding claims and find them wanting. The empirical data shows
that defendants in unrelated markets can benefit from using a well‐known
mark, but that neither mark owners nor consumers suffer any injury from
that use. A legal claim that a defendant is unjustly benefiting by using a
plaintiff’s mark is hollow unless it is accompanied by a theory of why that
benefit should rightly belong to the plaintiff. And unlike real property,
or even other types of intellectual property, trademark law has no such
theory. The result is that free riding claims fall back on empty
circularity. Those free riding arguments are - explicitly or implicitly -
behind the most problematic expansions of trademark law in recent years. We
suggest that trademark law needs a theory of trademark injury that
distinguishes harm to legitimate interests the law should protect from a
mere desire to capture a benefit enjoyed by another.",TRUE,FALSE,NA,Preprint|socarxiv,2018-07-02T10:48:25.202578,NA,,TRUE,accepted,2016-08-24T21:16:52.861000,NA,NA,NA,NA,NA,NA,NA,NA,NA,5a8c80f7c698300375c76d84|Social and Behavioral Sciences,https://api.osf.io/v2/preprints/bk6am/contributors/,https://api.osf.io/v2/preprints/bk6am/bibliographic_contributors/,https://api.osf.io/v2/preprints/bk6am/citation/,bk6am,preprints,https://api.osf.io/v2/preprints/bk6am/identifiers/,https://api.osf.io/v2/nodes/84w3b/,https://api.osf.io/v2/preprints/bk6am/relationships/node/,84w3b,nodes,https://api.osf.io/v2/providers/preprints/socarxiv/,socarxiv,preprint-providers,https://api.osf.io/v2/preprints/bk6am/files/,https://api.osf.io/v2/files/57be0ec6594d900201d0e0a2/,57be0ec6594d900201d0e0a2,files,https://api.osf.io/v2/preprints/bk6am/review_actions/,https://api.osf.io/v2/preprints/bk6am/requests/,https://api.osf.io/v2/preprints/bk6am/,https://osf.io/preprints/socarxiv/bk6am/,https://doi.org/10.31235/osf.io/bk6am
kyw5a,preprints,2016-08-24T19:13:17.829000,2018-07-02T10:51:10.144128,2016-08-24T19:13:17.829000,NA,NA,The Patent Crisis and How Courts Can Solve It,"Patent law is crucial to encourage technological innovation. But as the
patent system currently stands, diverse industries from pharmaceuticals to
software to semiconductors are all governed by the same rules even though
they innovate very differently. The result is a crisis in the patent
system, where patents calibrated to the needs of prescription drugs wreak
havoc on information technologies and vice versa. According to Dan L. Burk
and Mark A. Lemley in this book from the University of Chicago Press,
courts should use the tools the patent system already gives them to treat
patents in different industries differently. Industry tailoring is the only
way to provide an appropriate level of incentive for each industry.",TRUE,FALSE,NA,Preprint|socarxiv,2018-07-02T10:51:10.136267,NA,,TRUE,accepted,2016-08-24T19:13:17.829000,NA,NA,NA,NA,NA,NA,NA,NA,NA,5a8c80f7c698300375c76d84|Social and Behavioral Sciences,https://api.osf.io/v2/preprints/kyw5a/contributors/,https://api.osf.io/v2/preprints/kyw5a/bibliographic_contributors/,https://api.osf.io/v2/preprints/kyw5a/citation/,kyw5a,preprints,https://api.osf.io/v2/preprints/kyw5a/identifiers/,https://api.osf.io/v2/nodes/3eu8t/,https://api.osf.io/v2/preprints/kyw5a/relationships/node/,3eu8t,nodes,https://api.osf.io/v2/providers/preprints/socarxiv/,socarxiv,preprint-providers,https://api.osf.io/v2/preprints/kyw5a/files/,https://api.osf.io/v2/files/57bdf1cfb83f6901f3656327/,57bdf1cfb83f6901f3656327,files,https://api.osf.io/v2/preprints/kyw5a/review_actions/,https://api.osf.io/v2/preprints/kyw5a/requests/,https://api.osf.io/v2/preprints/kyw5a/,https://osf.io/preprints/socarxiv/kyw5a/,https://doi.org/10.31235/osf.io/kyw5a
