id,type,attributes.date_created,attributes.date_modified,attributes.date_published,attributes.original_publication_date,attributes.doi,attributes.title,attributes.description,attributes.is_published,attributes.is_preprint_orphan,attributes.tags,attributes.preprint_doi_created,attributes.date_withdrawn,attributes.current_user_permissions,attributes.public,attributes.reviews_state,attributes.date_last_transitioned,attributes.has_coi,attributes.conflict_of_interest_statement,attributes.has_data_links,attributes.why_no_data,attributes.data_links,attributes.has_prereg_links,attributes.why_no_prereg,attributes.prereg_links,attributes.prereg_link_info,attributes.subjects,attributes.license_record.copyright_holders,attributes.license_record.year,relationships.contributors.links.related.href,relationships.bibliographic_contributors.links.related.href,relationships.citation.links.related.href,relationships.citation.data.id,relationships.citation.data.type,relationships.identifiers.links.related.href,relationships.node.links.self.href,relationships.node.links.related.href,relationships.node.data.id,relationships.node.data.type,relationships.license.links.related.href,relationships.license.data.id,relationships.license.data.type,relationships.provider.links.related.href,relationships.provider.data.id,relationships.provider.data.type,relationships.files.links.related.href,relationships.primary_file.links.related.href,relationships.primary_file.data.id,relationships.primary_file.data.type,relationships.review_actions.links.related.href,relationships.requests.links.related.href,links.self,links.html,links.preprint_doi,links.doi
nzmua,preprints,2020-11-09T04:41:53.985614,2020-11-10T07:13:40.975263,2020-11-10T07:13:27.477418,NA,NA,Dead or alive: The interplay of grandparental investment according to the survival status of other grandparent types,"BACKGROUND
According to the kin selection theory, grandparental investment has its evolutionary roots in the individuals’ aim to maximise their inclusive fitness. Owing to an increasing overlap between successive generations in modern affluent populations, the importance of grandparental investment remains high. Despite the growing literature on this topic, there is limited knowledge regarding how the survival status of different grandparent types influences each other’s investment in grandchildren. 

OBJECTIVE
The present study examined how the survival status of grandparents influenced grandparental investment among other grandparent types using a wide range of grandparental investment variables divided into two latent constructs measuring relationship quality between grandparents and grandchildren and grandparental involvement in grandchildren.

METHODS
We used Bayesian structural equation modeling with multiple-indicator latent variables and the Involved Grandparenting and Child Well-Being Survey, providing nationally representative data of British and Welsh adolescents aged 11–16-years.

RESULTS
Maternal grandmothers’ investment was most strongly influenced by whether other grandparents were dead or alive. Living maternal grandfathers and paternal grandmothers had an almost identical positive influence on the investment of maternal grandmothers in their grandchildren. Weaker evidence suggested that living maternal grandmothers decreased the investment of paternal grandmothers and grandfathers. 

CONCLUSIONS
These findings suggest the opposite influences of the survival status of paternal and maternal grandmothers on their investment. The results are discussed with reference to kin competition and incidental exposure.

CONTRIBUTION
The current study represents the first attempt to test whether the survival status of other grandparents is associated with focal grandparents’ investment within and between lineages.",TRUE,FALSE,Adolescent grandchildren|grandparental investment|structural equation modeling|survival status,2020-11-10T07:13:40.799213,NA,,TRUE,accepted,2020-11-10T07:13:27.477418,FALSE,NA,available,NA,https://www.data-archive.ac.uk/,no,No preregistration.,,,5a8c80f7c698300375c76d84|5a8c80fac698300375c76e20|5a8c80fac698300375c76e47|Social and Behavioral Sciences|Sociology|Children and Youth|5a8c80f7c698300375c76d84|5a8c80fac698300375c76e20|5a8c80fac698300375c76e4c|Social and Behavioral Sciences|Sociology|Family,Samuli Helle|Antti O. Tanskanen|Jenni E. Pettay|Mirkka Danielsbacka,2020,https://api.osf.io/v2/preprints/nzmua/contributors/,https://api.osf.io/v2/preprints/nzmua/bibliographic_contributors/,https://api.osf.io/v2/preprints/nzmua/citation/,nzmua,preprints,https://api.osf.io/v2/preprints/nzmua/identifiers/,https://api.osf.io/v2/preprints/nzmua/relationships/node/,NA,NA,NA,https://api.osf.io/v2/licenses/563c1cf88c5e4a3877f9e965/,563c1cf88c5e4a3877f9e965,licenses,https://api.osf.io/v2/providers/preprints/socarxiv/,socarxiv,preprint-providers,https://api.osf.io/v2/preprints/nzmua/files/,https://api.osf.io/v2/files/5fa8c8989c7a4e00fda07142/,5fa8c8989c7a4e00fda07142,files,https://api.osf.io/v2/preprints/nzmua/review_actions/,https://api.osf.io/v2/preprints/nzmua/requests/,https://api.osf.io/v2/preprints/nzmua/,https://osf.io/preprints/socarxiv/nzmua/,https://doi.org/10.31235/osf.io/nzmua,NA
aqrfn,preprints,2020-11-08T20:18:59.547047,2020-11-09T03:48:41.807404,2020-11-09T03:48:20.578635,2020-11-08T05:00:00,NA,Pauses and reversals of infant mortality decline in India in 2017 and 2018,"This note examines recent trends in infant mortality in India, based on summary reports from the Sample Registration System (SRS). We find evidence of slowdown, pauses, and reversals in infant mortality decline in large parts of India in 2017 and 2018, the last two years for which SRS data are available. In urban areas, the infant mortality rate stagnated at 23 deaths per 1,000 births between 2016 and 2018. Worse, overall infant mortality increased in the poorer states of Chhattisgarh, Jharkhand, Madhya Pradesh, and Uttar Pradesh in this period. This occurred despite sustained improvements in household access to sanitation and clean fuel. One possible interpretation of these findings is that, in addition to their impact on unemployment and poverty, the demonetization experiment in late 2016 and the subsequent economic slowdown had an adverse effect on child health. In any case, these trends reinforce earlier evidence of faltering human development in India in recent years.",TRUE,FALSE,demonetisation|health|human development|India|infant mortality,2020-11-09T03:48:41.786257,NA,,TRUE,accepted,2020-11-09T03:48:20.578635,FALSE,NA,no,NA,,no,,,,"5a8c80f7c698300375c76d84|5a8c80f8c698300375c76ddb|5a8c80f9c698300375c76de2|Social and Behavioral Sciences|Public Affairs, Public Policy and Public Administration|Health Policy",authors,2020,https://api.osf.io/v2/preprints/aqrfn/contributors/,https://api.osf.io/v2/preprints/aqrfn/bibliographic_contributors/,https://api.osf.io/v2/preprints/aqrfn/citation/,aqrfn,preprints,https://api.osf.io/v2/preprints/aqrfn/identifiers/,https://api.osf.io/v2/preprints/aqrfn/relationships/node/,NA,NA,NA,https://api.osf.io/v2/licenses/563c1cf88c5e4a3877f9e965/,563c1cf88c5e4a3877f9e965,licenses,https://api.osf.io/v2/providers/preprints/socarxiv/,socarxiv,preprint-providers,https://api.osf.io/v2/preprints/aqrfn/files/,https://api.osf.io/v2/files/5fa852bb9c7a4e00aaa09723/,5fa852bb9c7a4e00aaa09723,files,https://api.osf.io/v2/preprints/aqrfn/review_actions/,https://api.osf.io/v2/preprints/aqrfn/requests/,https://api.osf.io/v2/preprints/aqrfn/,https://osf.io/preprints/socarxiv/aqrfn/,https://doi.org/10.31235/osf.io/aqrfn,NA
bnp9r,preprints,2020-11-08T17:21:36.987647,2021-01-17T08:10:27.369293,2020-11-09T03:54:00.376266,NA,NA,Working-time flexibility (is not the same) for all: Evidence from a right-to-request reform,"Employed mothers often incur in a trade-off between lower wages and working-time flexibility, and such compensating differentials contribute to persistent gender gaps in labour markets. I ask to what extent working-time flexibility is sought after by those who are not parents of young children, if similar trade-offs may ensue, and with what consequences for disparities among and between women and men. I evaluate the effects of a 2014 reform that extended the “right to request” working-time flexibility from parents of young children to all employees in the UK. Using a difference-in-differences design, I find that women without young children reduce their working hours and move to part-time employment. These adjustments are coupled with a reduction in job-related stress and monthly earnings, but not hourly wage rates. Effects are sizeable, suggesting that right-to-request laws can enhance working-time flexibility within workplaces and mitigate gaps between women with and without children. This holds mainly for the tertiary-educated though, and, as no accompanying changes are observed among men, gender gaps in working hours and earnings are unintendedly amplified. Implications are drawn for both compensating differentials theory and working-time policies, also in light of the current surge in flexible working.",TRUE,FALSE,Compensating differentials|Difference-in-differences|Gender gaps|Right to request|UK|Working-time flexibility,2020-11-09T03:54:21.770086,NA,,TRUE,accepted,2020-11-09T03:54:00.376266,FALSE,NA,no,NA,,no,NA,,,"5a8c80f7c698300375c76d84|5a8c80f8c698300375c76dbe|5a8c80f8c698300375c76dc3|Social and Behavioral Sciences|Economics|Labor Economics|5a8c80f7c698300375c76d84|5a8c80f8c698300375c76ddb|5a8c80f9c698300375c76de0|Social and Behavioral Sciences|Public Affairs, Public Policy and Public Administration|Social Policy|5a8c80f7c698300375c76d84|5a8c80fac698300375c76e20|5a8c80fac698300375c76e2d|Social and Behavioral Sciences|Sociology|Economic Sociology|5a8c80f7c698300375c76d84|5a8c80fac698300375c76e20|5a8c80fac698300375c76e44|Social and Behavioral Sciences|Sociology|Race, Gender, and Class",,2020,https://api.osf.io/v2/preprints/bnp9r/contributors/,https://api.osf.io/v2/preprints/bnp9r/bibliographic_contributors/,https://api.osf.io/v2/preprints/bnp9r/citation/,bnp9r,preprints,https://api.osf.io/v2/preprints/bnp9r/identifiers/,https://api.osf.io/v2/preprints/bnp9r/relationships/node/,https://api.osf.io/v2/nodes/r5xzc/,r5xzc,nodes,https://api.osf.io/v2/licenses/563c1cf88c5e4a3877f9e96a/,563c1cf88c5e4a3877f9e96a,licenses,https://api.osf.io/v2/providers/preprints/socarxiv/,socarxiv,preprint-providers,https://api.osf.io/v2/preprints/bnp9r/files/,https://api.osf.io/v2/files/5fa8293f91419d00bf66bac5/,5fa8293f91419d00bf66bac5,files,https://api.osf.io/v2/preprints/bnp9r/review_actions/,https://api.osf.io/v2/preprints/bnp9r/requests/,https://api.osf.io/v2/preprints/bnp9r/,https://osf.io/preprints/socarxiv/bnp9r/,https://doi.org/10.31235/osf.io/bnp9r,NA
vc7qs,preprints,2020-11-08T16:37:56.356472,2020-11-09T04:18:40.941749,2020-11-09T04:18:20.798223,NA,NA,"Čo sa skrýva v guamile?: náhodné zistenia o pestovaní marihuany na okraji etnografického výskumu vo Uaxactúne, Guatemala.","Aim of this paper is to inform about accidental finds during anthropological research at Uaxactún, Guatemala. Paper explores participants' willingness to talk about illegal activities on site - more precisely about hemp cultivation. Data was obtained through semi-structured interview and participant observation at the site of Uaxactún, Guatemala, during July and August 2019. 18 respondents had taken part in research. Key find is that it seems that participants will to talk about illegal activities only if they feel to be in the same social group as the researcher is, otherwise the participant will provide misleading information. Another strong stimulus affecting obtained information seems to be the economical potential of taking part in the research.",TRUE,FALSE,dezinformácia|drogy|Guatemala|informátor|marihuana|Uaxactún|zavádzanie,2020-11-09T04:18:40.890169,NA,,TRUE,accepted,2020-11-09T04:18:20.798223,TRUE,participants in the research were also employees of the research team,not_applicable,NA,,not_applicable,NA,,,5a8c80f7c698300375c76d84|5a8c80f9c698300375c76df6|5a8c80f9c698300375c76dfa|Social and Behavioral Sciences|Anthropology|Social and Cultural Anthropology,,2020,https://api.osf.io/v2/preprints/vc7qs/contributors/,https://api.osf.io/v2/preprints/vc7qs/bibliographic_contributors/,https://api.osf.io/v2/preprints/vc7qs/citation/,vc7qs,preprints,https://api.osf.io/v2/preprints/vc7qs/identifiers/,https://api.osf.io/v2/preprints/vc7qs/relationships/node/,https://api.osf.io/v2/nodes/c5bse/,c5bse,nodes,https://api.osf.io/v2/licenses/5ad7979bc69830002d8190e3/,5ad7979bc69830002d8190e3,licenses,https://api.osf.io/v2/providers/preprints/socarxiv/,socarxiv,preprint-providers,https://api.osf.io/v2/preprints/vc7qs/files/,https://api.osf.io/v2/files/5fa81ee99c7a4e00aa9ffe17/,5fa81ee99c7a4e00aa9ffe17,files,https://api.osf.io/v2/preprints/vc7qs/review_actions/,https://api.osf.io/v2/preprints/vc7qs/requests/,https://api.osf.io/v2/preprints/vc7qs/,https://osf.io/preprints/socarxiv/vc7qs/,https://doi.org/10.31235/osf.io/vc7qs,NA
vxwqf,preprints,2020-11-08T16:15:18.006272,2020-11-09T04:20:02.018414,2020-11-09T04:19:50.762850,2020-08-29T04:00:00,NA,Algorithmes d'apprentissage et modèles statistiques: Un exemple de régression régularisée et de validation croisée pour prédire le décrochage scolaire,"Le chapitre présente les avantages de l'utilisation de la régularisation dans l'analyse de régression linéaire et logistique. Afin d'illustrer les techniques de régularisation, nous donnons un exemple de régression logistique régularisée avec validation croisée cherchant à prédire le décrochage scolaire chez des élèves du secondaire au Québec. Avec 25 variables prédictives et un échantillon simulé de 1000 cas, les résultats de la régression logistique ordinaire sont comparés avec ceux de la régression avec régularisation ridge, lasso et elastic-net.",TRUE,FALSE,cross-validation|elastic net regression|lasso regression|logistic regression|machine learning|ridge regression,2020-11-09T04:20:01.814480,NA,,TRUE,accepted,2020-11-09T04:19:50.762850,FALSE,NA,available,NA,https://osf.io/ea6r2/,not_applicable,NA,,,5a8c80f7c698300375c76d84|5a8c80f9c698300375c76e0c|Social and Behavioral Sciences|Social Statistics,,2020,https://api.osf.io/v2/preprints/vxwqf/contributors/,https://api.osf.io/v2/preprints/vxwqf/bibliographic_contributors/,https://api.osf.io/v2/preprints/vxwqf/citation/,vxwqf,preprints,https://api.osf.io/v2/preprints/vxwqf/identifiers/,https://api.osf.io/v2/preprints/vxwqf/relationships/node/,https://api.osf.io/v2/nodes/ydxva/,ydxva,nodes,https://api.osf.io/v2/licenses/563c1cf88c5e4a3877f9e96a/,563c1cf88c5e4a3877f9e96a,licenses,https://api.osf.io/v2/providers/preprints/socarxiv/,socarxiv,preprint-providers,https://api.osf.io/v2/preprints/vxwqf/files/,https://api.osf.io/v2/files/5fa81998d1894f00b168eee1/,5fa81998d1894f00b168eee1,files,https://api.osf.io/v2/preprints/vxwqf/review_actions/,https://api.osf.io/v2/preprints/vxwqf/requests/,https://api.osf.io/v2/preprints/vxwqf/,https://osf.io/preprints/socarxiv/vxwqf/,https://doi.org/10.31235/osf.io/vxwqf,NA
dk9bc,preprints,2020-11-08T15:04:16.250642,2020-11-09T03:52:40.791394,2020-11-09T03:52:23.644135,2020-11-07T23:00:00,NA,Are Smileys Valid Answers? Survey Data Quality with Innovative Item Formats,"Introduction: Survey research is often designed based on multiple-choice questions although many other formats, also referred to as innovative item formats (IIF) exist, such as ranking, sorting, questions with pictures or smileys as response options. Research has suggested that IIF in a broad sense can strengthen data quality, but research is needed on a more specific level. Therefore, the purpose of this article is to present research for separate IIFs about the data quality for that type of item. Method: A literature study was conducted to identify articles that test the data quality of IIF. For each IIF research was discussed regarding aspects of data quality, such as reliability, validity and response rate. Results: A total of 166 research articles were identified with data from 218,532 participants revealing aspects of 22 IIFs with 13 subcategories. The type of evidence on data quality is quite varied and for some IIFs the evidence is supportive, for some it is not and for some it is inconclusive. With 6 IIFs the evidence was estimated in favour hereof, for 11 IIFs the evidence was inconclusive, 1 unfavoured and for 3 there was no evidence. With 6 IIFs potential confounders were identified. Discussion: The study suggests further research is needed where evidence is scarce. The present study could initiate more extensive systematic reviews within specific categories of IIF.",TRUE,FALSE,innovative item formats|questionnaire|review|validity,2020-11-09T03:52:40.769214,NA,,TRUE,accepted,2020-11-09T03:52:23.644135,FALSE,NA,not_applicable,NA,,not_applicable,NA,,,5a8c80f7c698300375c76d84|5a8c80f9c698300375c76e0c|Social and Behavioral Sciences|Social Statistics|5a8c80f7c698300375c76d84|5a8c80fac698300375c76e20|5a8c80fac698300375c76e2c|Social and Behavioral Sciences|Sociology|Methodology,,2020,https://api.osf.io/v2/preprints/dk9bc/contributors/,https://api.osf.io/v2/preprints/dk9bc/bibliographic_contributors/,https://api.osf.io/v2/preprints/dk9bc/citation/,dk9bc,preprints,https://api.osf.io/v2/preprints/dk9bc/identifiers/,https://api.osf.io/v2/preprints/dk9bc/relationships/node/,NA,NA,NA,https://api.osf.io/v2/licenses/563c1cf88c5e4a3877f9e96a/,563c1cf88c5e4a3877f9e96a,licenses,https://api.osf.io/v2/providers/preprints/socarxiv/,socarxiv,preprint-providers,https://api.osf.io/v2/preprints/dk9bc/files/,https://api.osf.io/v2/files/5fa808f5d1894f00b068b49a/,5fa808f5d1894f00b068b49a,files,https://api.osf.io/v2/preprints/dk9bc/review_actions/,https://api.osf.io/v2/preprints/dk9bc/requests/,https://api.osf.io/v2/preprints/dk9bc/,https://osf.io/preprints/socarxiv/dk9bc/,https://doi.org/10.31235/osf.io/dk9bc,NA
zdxby,preprints,2020-11-08T14:15:41.779024,2020-11-09T03:55:01.884127,2020-11-09T03:54:38.922604,2019-06-16T04:00:00,10.1177/1012690219855916,"Mother–child Engagement in Sports and Outdoor Activities: Intensive mothering, purposive leisure, and implications for health and relationship closeness","Using Fragile Families &amp; Child Well-Being data (N = 3,252) from the U.S., this study examines mother-child interactions in sports and outdoor activities with their nine-year old children, and their association with mothers’ perceptions of the extent to which they think they are a good parent. The study also considers the implications of these mother-child engagement activities for the health of both generations and for their feelings of relationship closeness. The results reveal that most mothers participate in sports or outdoor activities with their child once per week or more; also, mother-child interactions are positively associated with mothers’ perceptions of being a good parent. In addition, we find that mother-child interactions in sports and outdoor activities are positively associated with mothers’ reports of their health and relationship closeness, but that it is children’s organized sports participation (and not mother-child interactions in sports and outdoor activities) that is positively associated with the children’s reports of their health and mother-child relationship closeness. Overall, there is support for understanding mother-child interactions in sports and outdoor activities as extensions of intensive mothering expectations and purposive leisure goals, and interactions that have positive implications for health and relationship closeness.",TRUE,FALSE,family|intensive mothering|mother–child relationships|parenting|purposive leisure,2020-11-09T03:55:01.846342,NA,,TRUE,accepted,2020-11-09T03:54:38.922604,FALSE,NA,no,Data free to download after registration. See details at: https://fragilefamilies.princeton.edu/documentation,,available,NA,https://fragilefamilies.princeton.edu/documentation,prereg_both,5a8c80f7c698300375c76d84|5a8c80f9c698300375c76df5|Social and Behavioral Sciences|Sports Studies|5a8c80f7c698300375c76d84|5a8c80fac698300375c76e20|5a8c80fac698300375c76e47|Social and Behavioral Sciences|Sociology|Children and Youth|5a8c80f7c698300375c76d84|5a8c80fac698300375c76e20|5a8c80fac698300375c76e4c|Social and Behavioral Sciences|Sociology|Family,,2020,https://api.osf.io/v2/preprints/zdxby/contributors/,https://api.osf.io/v2/preprints/zdxby/bibliographic_contributors/,https://api.osf.io/v2/preprints/zdxby/citation/,zdxby,preprints,https://api.osf.io/v2/preprints/zdxby/identifiers/,https://api.osf.io/v2/preprints/zdxby/relationships/node/,NA,NA,NA,https://api.osf.io/v2/licenses/5ad7979bc69830002d8190e3/,5ad7979bc69830002d8190e3,licenses,https://api.osf.io/v2/providers/preprints/socarxiv/,socarxiv,preprint-providers,https://api.osf.io/v2/preprints/zdxby/files/,https://api.osf.io/v2/files/5fa7fd90d1894f00a5690a16/,5fa7fd90d1894f00a5690a16,files,https://api.osf.io/v2/preprints/zdxby/review_actions/,https://api.osf.io/v2/preprints/zdxby/requests/,https://api.osf.io/v2/preprints/zdxby/,https://osf.io/preprints/socarxiv/zdxby/,https://doi.org/10.31235/osf.io/zdxby,https://doi.org/10.1177/1012690219855916
wj2p6,preprints,2020-11-07T21:53:52.943384,2020-11-09T03:56:01.979592,2020-11-09T03:55:50.247580,2017-10-25T04:00:00,10.1111/fare.12263,Father’s Parenting Stress after the Arrival of a New Child,"Objective: This study analyzed the relationship between father identity characteristics and father’s parenting stress over the first five years after a birth. 
Background: Previous work has considered how father identities shape father involvement, but has not focused on parenting stress. Understanding parenting stress is important as it is linked to fathers’ and children’s well-being. 
Method: We analyzed Fragile Families (FFCW) data (N = 2,547), using OLS and fixed-effects analyses.  The FFCW follows the families of a cohort of new children who were born in large urban areas of the U.S., in the late 1990s.
Results: OLS results indicated that positive attitudes about fatherhood, wanting to provide direct care, and having higher levels of support from the birth mother predicted lower levels of father’s parenting stress one year after a birth; father engagement, changes in birth mother’s support, and inconsistent financial support were also significantly associated with parenting stress. Fixed effects results indicated that changes in father engagement were negatively associated with changes in father’s parenting stress over years 1-5; changes in father’s inconsistent financial support were positively associated with parenting stress. Finally, we found evidence that father identity characteristics moderate predictors of parenting stress. 
Conclusion: Father identities seem to play an important role in shaping fathering experiences and father’s parenting stress. 
Implications: Fathers should be encouraged and supported in developing more salient father identities and fathering commitments by significant others, family practitioners, and public policies.",TRUE,FALSE,fatherhood|father identity|fathering|parenting|parenting stress,2020-11-09T03:56:01.930185,NA,,TRUE,accepted,2020-11-09T03:55:50.247580,FALSE,NA,no,Free to download; registration information available at : https://fragilefamilies.princeton.edu/documentation,,available,NA,https://fragilefamilies.princeton.edu/documentation,prereg_both,5a8c80f7c698300375c76d84|5a8c80fac698300375c76e20|5a8c80fac698300375c76e4c|Social and Behavioral Sciences|Sociology|Family,Wiley,2017,https://api.osf.io/v2/preprints/wj2p6/contributors/,https://api.osf.io/v2/preprints/wj2p6/bibliographic_contributors/,https://api.osf.io/v2/preprints/wj2p6/citation/,wj2p6,preprints,https://api.osf.io/v2/preprints/wj2p6/identifiers/,https://api.osf.io/v2/preprints/wj2p6/relationships/node/,NA,NA,NA,https://api.osf.io/v2/licenses/5ad7979bc69830002d8190e3/,5ad7979bc69830002d8190e3,licenses,https://api.osf.io/v2/providers/preprints/socarxiv/,socarxiv,preprint-providers,https://api.osf.io/v2/preprints/wj2p6/files/,https://api.osf.io/v2/files/5fa717749c7a4e006ba00de6/,5fa717749c7a4e006ba00de6,files,https://api.osf.io/v2/preprints/wj2p6/review_actions/,https://api.osf.io/v2/preprints/wj2p6/requests/,https://api.osf.io/v2/preprints/wj2p6/,https://osf.io/preprints/socarxiv/wj2p6/,https://doi.org/10.31235/osf.io/wj2p6,https://doi.org/10.1111/fare.12263
