id,type,attributes.date_created,attributes.date_modified,attributes.date_published,attributes.original_publication_date,attributes.doi,attributes.title,attributes.description,attributes.is_published,attributes.is_preprint_orphan,attributes.license_record,attributes.tags,attributes.preprint_doi_created,attributes.date_withdrawn,attributes.current_user_permissions,attributes.public,attributes.reviews_state,attributes.date_last_transitioned,attributes.has_coi,attributes.conflict_of_interest_statement,attributes.has_data_links,attributes.why_no_data,attributes.data_links,attributes.has_prereg_links,attributes.why_no_prereg,attributes.prereg_links,attributes.prereg_link_info,attributes.subjects,relationships.contributors.links.related.href,relationships.bibliographic_contributors.links.related.href,relationships.citation.links.related.href,relationships.citation.data.id,relationships.citation.data.type,relationships.identifiers.links.related.href,relationships.node.links.related.href,relationships.node.links.self.href,relationships.node.data.id,relationships.node.data.type,relationships.provider.links.related.href,relationships.provider.data.id,relationships.provider.data.type,relationships.files.links.related.href,relationships.primary_file.links.related.href,relationships.primary_file.data.id,relationships.primary_file.data.type,relationships.review_actions.links.related.href,relationships.requests.links.related.href,links.self,links.html,links.preprint_doi
9w6rz,preprints,2016-07-16T19:02:34.087000,2018-07-02T10:47:34.253304,2016-07-16T19:02:34.087000,NA,NA,Anti-Circumvention Misuse,"The anticircumvention provisions of the Digital Millennium Copyright Act penalize both the circumvention of technical protection measures, and supplying the means for such circumvention. These prohibitions are entirely separate from the exclusive rights under copyright, causing some commentators to dub the anti-circumvention right as ""paracopyright."" Such ""paracopyright"" effectively grants copyright holders sweeping new ability to impose terms of access on content users: consumers who access content without accepting the content owner's terms would violate the owner's ""paracopyright"" even if the material accessed is not itself copyrighted or copyrightable.


At some point, such leveraging of access control seems certain to overstep the bounds militated by sound policy or intended by Congress. In the past, abuse of intellectual property rights has been curtailed under the doctrine of misuse. Misuse claims first arose in the patent context, where the patent might be leveraged into licensing terms that exceeded the proper scope of the patent grant. More recently, overreaching in copyright licensing has been recognized to constitute a form of misuse.  This paper argues that because DMCA ""paracopyright"" is ripe for abuse, limits on overreaching may be imposed by applying the misuse doctrine in this new area. Just as improper leveraging of patent and copyright may be curtailed by application of the misuse doctrine, so improper leveraging of paracopyright should be curtailed by application of misuse. This new application of misuse doctrine may be guided by the standards established in previous applications to patent and copyright law, and may serve a similar function in regulating the excesses invited by the anticircumvention right.",TRUE,FALSE,NA,copyright|digital rights management|DMCA|DRM|paracopyright|Preprint|socarxiv|technical protection measures|TPM,2018-07-02T10:47:34.245545,NA,,TRUE,accepted,2016-07-16T19:02:34.087000,NA,NA,NA,NA,NA,NA,NA,NA,NA,5a8c80f7c698300375c76d84|Social and Behavioral Sciences,https://api.osf.io/v2/preprints/9w6rz/contributors/,https://api.osf.io/v2/preprints/9w6rz/bibliographic_contributors/,https://api.osf.io/v2/preprints/9w6rz/citation/,9w6rz,preprints,https://api.osf.io/v2/preprints/9w6rz/identifiers/,https://api.osf.io/v2/nodes/etde3/,https://api.osf.io/v2/preprints/9w6rz/relationships/node/,etde3,nodes,https://api.osf.io/v2/providers/preprints/socarxiv/,socarxiv,preprint-providers,https://api.osf.io/v2/preprints/9w6rz/files/,https://api.osf.io/v2/files/578a84cc594d9001f5859eed/,578a84cc594d9001f5859eed,files,https://api.osf.io/v2/preprints/9w6rz/review_actions/,https://api.osf.io/v2/preprints/9w6rz/requests/,https://api.osf.io/v2/preprints/9w6rz/,https://osf.io/preprints/socarxiv/9w6rz/,https://doi.org/10.31235/osf.io/9w6rz
re8sk,preprints,2016-07-16T18:53:42.543000,2018-07-02T10:52:05.255682,2016-07-16T18:53:42.543000,NA,NA,"Gendering (Non)Religion: Politics, Education, and Gender Gaps in Secularity in the United States","Gender gaps in religiosity among Western populations, such that women are more religious than men, are well documented. Previous explanations for these differences range from biological predispositions of risk aversion to patriarchal gender socialization, but all largely overlook the intersection of social statuses. Drawing on theories of intersectionality, we contribute to the cultural and empirical analysis of gender gaps in religiosity by documenting an interactive effect between gender, education, and political views for predicting religious nonaffiliation and infrequent attendance at religious services among Americans. For highly educated political liberals, gender gaps effectively disappear, such that men and women are almost equally likely to be secular (or religious). The results have implications for the long-standing disputes about the gendered ""nature"" of religiosity and highlight the importance of multiple intersecting statuses and modalities in shaping aggregate patterns of religiosity and secularity.",TRUE,FALSE,NA,education|gender|intersectionality|politics|Preprint|religion|religiosity|secularity|socarxiv,2018-07-02T10:52:05.246562,NA,,TRUE,accepted,2016-07-16T18:53:42.543000,NA,NA,NA,NA,NA,NA,NA,NA,NA,5a8c80f7c698300375c76d84|Social and Behavioral Sciences,https://api.osf.io/v2/preprints/re8sk/contributors/,https://api.osf.io/v2/preprints/re8sk/bibliographic_contributors/,https://api.osf.io/v2/preprints/re8sk/citation/,re8sk,preprints,https://api.osf.io/v2/preprints/re8sk/identifiers/,https://api.osf.io/v2/nodes/mw7qc/,https://api.osf.io/v2/preprints/re8sk/relationships/node/,mw7qc,nodes,https://api.osf.io/v2/providers/preprints/socarxiv/,socarxiv,preprint-providers,https://api.osf.io/v2/preprints/re8sk/files/,https://api.osf.io/v2/files/578a82b89ad5a101f5f5c3ac/,578a82b89ad5a101f5f5c3ac,files,https://api.osf.io/v2/preprints/re8sk/review_actions/,https://api.osf.io/v2/preprints/re8sk/requests/,https://api.osf.io/v2/preprints/re8sk/,https://osf.io/preprints/socarxiv/re8sk/,https://doi.org/10.31235/osf.io/re8sk
ty2d5,preprints,2016-07-16T18:42:39.496000,2018-07-02T10:52:11.269002,2016-07-16T18:42:39.496000,NA,NA,"""How can you love a work, if you don't know it?"": Critical Code and Design toward Participatory Digital Editions","A literature/digital humanities PhD digital dissertation, exploring the design, coding, and usertesting of the InfiniteUlysses.com participatory digital edition, participatory digital humanities and meaningful crowdsourcing more broadly, and meta-analysis of a unique digital humanities dissertation approach that consisted of design, code, usertesting, blogging, and a whitepaper written during the final month before the PhD defense. The dissertation *is* dr.amandavisconti.com; I've uploaded both the PDF of the whitepaper and a ZIP of the entire dr.amandavisconti.com website (which includes archived blog posts, WARCs of the InfiniteUlysses.com digital edition, and more).",TRUE,FALSE,NA,community design|crowdsourcing|DH|digital dissertation|digital edition|digital humanities|digital ulysses|dissertation|graduate studies|james joyce|meaningful crowdsourcing|open humanities|participatory|participatory humanities|public humanities|scholarly edition|socarxiv|textual scholarship|thesis|ulysses,2018-07-02T10:52:11.251806,NA,,TRUE,accepted,2016-07-16T18:42:39.496000,NA,NA,NA,NA,NA,NA,NA,NA,NA,5a8c80f7c698300375c76d84|Social and Behavioral Sciences,https://api.osf.io/v2/preprints/ty2d5/contributors/,https://api.osf.io/v2/preprints/ty2d5/bibliographic_contributors/,https://api.osf.io/v2/preprints/ty2d5/citation/,ty2d5,preprints,https://api.osf.io/v2/preprints/ty2d5/identifiers/,https://api.osf.io/v2/nodes/ht44g/,https://api.osf.io/v2/preprints/ty2d5/relationships/node/,ht44g,nodes,https://api.osf.io/v2/providers/preprints/socarxiv/,socarxiv,preprint-providers,https://api.osf.io/v2/preprints/ty2d5/files/,https://api.osf.io/v2/files/579f5a31b83f6901fd722703/,579f5a31b83f6901fd722703,files,https://api.osf.io/v2/preprints/ty2d5/review_actions/,https://api.osf.io/v2/preprints/ty2d5/requests/,https://api.osf.io/v2/preprints/ty2d5/,https://osf.io/preprints/socarxiv/ty2d5/,https://doi.org/10.31235/osf.io/ty2d5
j4kp6,preprints,2016-07-16T18:42:26.485000,2018-07-02T10:51:04.186858,2016-07-16T18:42:26.485000,NA,NA,"""Songs of Innocence and of Experience"": Amateur Users and Digital Texts","Information master's thesis exploring non-expert use of digital humanities scholarly websites, and the small design changes such sites might make to serve a broader audience.",TRUE,FALSE,NA,design|digital editions|digital humanities|digital humanities design|information|information science|information studies|master's thesis|open humanities|participatory|participatory edition|participatory humanities|public humanities|scholarly editions|socarxiv|textual scholarship|thesis|usability|usertesting|UX,2018-07-02T10:51:04.177003,NA,,TRUE,accepted,2016-07-16T18:42:26.485000,NA,NA,NA,NA,NA,NA,NA,NA,NA,5a8c80f7c698300375c76d84|Social and Behavioral Sciences,https://api.osf.io/v2/preprints/j4kp6/contributors/,https://api.osf.io/v2/preprints/j4kp6/bibliographic_contributors/,https://api.osf.io/v2/preprints/j4kp6/citation/,j4kp6,preprints,https://api.osf.io/v2/preprints/j4kp6/identifiers/,https://api.osf.io/v2/nodes/3xvwg/,https://api.osf.io/v2/preprints/j4kp6/relationships/node/,3xvwg,nodes,https://api.osf.io/v2/providers/preprints/socarxiv/,socarxiv,preprint-providers,https://api.osf.io/v2/preprints/j4kp6/files/,https://api.osf.io/v2/files/582abdd2594d9001fabd246e/,582abdd2594d9001fabd246e,files,https://api.osf.io/v2/preprints/j4kp6/review_actions/,https://api.osf.io/v2/preprints/j4kp6/requests/,https://api.osf.io/v2/preprints/j4kp6/,https://osf.io/preprints/socarxiv/j4kp6/,https://doi.org/10.31235/osf.io/j4kp6
cbdym,preprints,2016-07-16T18:28:23.355000,2018-07-02T10:48:27.468933,2016-07-16T18:28:23.355000,NA,NA,"""How can you love a work, if you don't know it?"": Critical Code and Design toward Participatory Digital Editions","This whitepaper offers an analytic discussion of the process and product
for Amanda Visconti's dissertation ""How can you love a work, if you don't
know it?"": Critical Code and Design toward Participatory Digital Editions (
dr.AmandaVisconti.com). The introductory section proposes a speculative
experiment to test digital edition design theories: ""What if we build a
digital edition and invite everyone? What if millions of scholars,
first-time readers, book clubs, teachers and their students show up and
annotate a text with their infinite interpretations, questions, and
contextualizations?"". Approaching digital editions as Morris Eaves'
""problem-solving mechanism""s, the project designed, built, and user-tested
a digital edition of James Joyce’s Ulysses with various experimental
interface features: InfiniteUlysses.com. Three areas of research advanced
through the project are presented: designing public and participatory
edition projects, and whether critical participation is necessary to such
projects; designing digital edition functionalities and appearance to serve
a participatory audience, and what we learn about such an endeavor through
Infinite Ulysses' user experience data; and separating the values of
textual scholarship from their embodiments to imagine new types of edition.
A review of theoretical and built precedents from textual scholarship,
scholarly design and code projects, public and participatory humanities
endeavors, and theories around a digital Ulysses grounds the report,
followed by an overview of the features of the Infinite Ulysses
participatory digital edition. Section 2 discusses existing examples of
public participation in digital humanities (DH) projects, Section 3 focuses
on digital editions and the design process, Section 4 reimagines the
digital edition by separating textual scholarship values from the common
embodiments of these values, and the conclusion sums up the interventions
of this project and lists next steps for continuing this research. A
bibliography and appendices (full texts of user surveys, explanation of
project's dissertational format, wireframes and screenshot from throughout
the design process) conclude the report.",TRUE,FALSE,NA,Preprint|socarxiv,2018-07-02T10:48:27.455500,NA,,TRUE,accepted,2016-07-16T18:28:23.355000,NA,NA,NA,NA,NA,NA,NA,NA,NA,5a8c80f7c698300375c76d84|Social and Behavioral Sciences,https://api.osf.io/v2/preprints/cbdym/contributors/,https://api.osf.io/v2/preprints/cbdym/bibliographic_contributors/,https://api.osf.io/v2/preprints/cbdym/citation/,cbdym,preprints,https://api.osf.io/v2/preprints/cbdym/identifiers/,https://api.osf.io/v2/nodes/2z9xr/,https://api.osf.io/v2/preprints/cbdym/relationships/node/,2z9xr,nodes,https://api.osf.io/v2/providers/preprints/socarxiv/,socarxiv,preprint-providers,https://api.osf.io/v2/preprints/cbdym/files/,https://api.osf.io/v2/files/578a7cce6c613b01ee347cb3/,578a7cce6c613b01ee347cb3,files,https://api.osf.io/v2/preprints/cbdym/review_actions/,https://api.osf.io/v2/preprints/cbdym/requests/,https://api.osf.io/v2/preprints/cbdym/,https://osf.io/preprints/socarxiv/cbdym/,https://doi.org/10.31235/osf.io/cbdym
usqt4,preprints,2016-07-16T18:24:53.108000,2018-07-02T10:53:43.500272,2016-07-16T18:24:53.108000,NA,NA,"""Songs of Innocence and of Experience"": Amateur Users and Digital Texts","Digital texts promise to allow learning beyond that possible with
traditional resources. Purpose-built digital texts are crafted for specific
research purposes, with developer-users and devoted academics comprising
their primary, ""scholar"" audience. A secondary, ""amateur"" audience of
learners with less digital text experience also relies on theses
purpose-built resources. Does the promise of new learning from digital
texts extend beyond scholars to amateurs, or does the design of
purpose-built digital texts, by focusing on more experienced users with
direct lines of communication to digital text developers, prevent this
extension of benefits? This study gauged one subgroup of amateur users'
perceptions of the value of digital texts in terms of answering
self-generated research queries. The participants, graduate students from
the University of Michigan's information master's program, worked with a
digital text and completed a survey assessing their experience of digital
text features and perception of their learning success. An analysis of the
survey data produces an introductory understanding of amateur users'
perceptions of their digital text use, their design needs, and their
success or failure at learning through digital texts. The narrative
responses suggest that while the idea of new learning from digital texts is
foreign to the amateur audience, their assessment of digital text features
was not particularly marked by their amateur status. This result suggests
that designing purpose-built digital texts to serve both digital text
scholars as well as some amateur subgroups is a reasonable task.",TRUE,FALSE,NA,Preprint|socarxiv,2018-07-02T10:53:43.493421,NA,,TRUE,accepted,2016-07-16T18:24:53.108000,NA,NA,NA,NA,NA,NA,NA,NA,NA,5a8c80f7c698300375c76d84|Social and Behavioral Sciences,https://api.osf.io/v2/preprints/usqt4/contributors/,https://api.osf.io/v2/preprints/usqt4/bibliographic_contributors/,https://api.osf.io/v2/preprints/usqt4/citation/,usqt4,preprints,https://api.osf.io/v2/preprints/usqt4/identifiers/,https://api.osf.io/v2/nodes/6wa23/,https://api.osf.io/v2/preprints/usqt4/relationships/node/,6wa23,nodes,https://api.osf.io/v2/providers/preprints/socarxiv/,socarxiv,preprint-providers,https://api.osf.io/v2/preprints/usqt4/files/,https://api.osf.io/v2/files/578a7c00594d9001f0859fdd/,578a7c00594d9001f0859fdd,files,https://api.osf.io/v2/preprints/usqt4/review_actions/,https://api.osf.io/v2/preprints/usqt4/requests/,https://api.osf.io/v2/preprints/usqt4/,https://osf.io/preprints/socarxiv/usqt4/,https://doi.org/10.31235/osf.io/usqt4
xgwdb,preprints,2016-07-16T17:35:39.801000,2018-07-02T10:55:01.073392,2016-07-16T17:35:39.801000,NA,NA,"Ethics, Technology and the Challenges of  Documenting History in Real Time",New technologies including mobile phones and use of social media software have made available a plethora of new sources for news and information that both complement and contrast with traditional news sources. This content is relevant to research libraries and archives around the world. Yet most of it does not get deposited into library and archival collections in traditional ways. Libraries and archives need to be innovative and proactive about seeking it out from numerous participants and scraping it off social network sites in real time to insure authenticity and reliability. At UCLA and NYU we have been collecting both digital and physical materials from the front lines of conflict and war-ravaged areas of the world. We've partnered with political activists to develop unique assemblages of ephemera collected on the front lines of social media revolutions. This paper will present two case studies that illustrate the challenges and opportunities for collaboration and community engagement and utilizing new technologies including social media to capture and preserve history in real time.,TRUE,FALSE,NA,archives|citizen journalism|ethics|personal digital archiving|Preprint|preserve historical record|role research libraries|security and safety|socarxiv|social media,2018-07-02T10:55:01.061686,NA,,TRUE,accepted,2016-07-16T17:35:39.801000,NA,NA,NA,NA,NA,NA,NA,NA,NA,5a8c80f7c698300375c76d84|Social and Behavioral Sciences,https://api.osf.io/v2/preprints/xgwdb/contributors/,https://api.osf.io/v2/preprints/xgwdb/bibliographic_contributors/,https://api.osf.io/v2/preprints/xgwdb/citation/,xgwdb,preprints,https://api.osf.io/v2/preprints/xgwdb/identifiers/,https://api.osf.io/v2/nodes/uwu3e/,https://api.osf.io/v2/preprints/xgwdb/relationships/node/,uwu3e,nodes,https://api.osf.io/v2/providers/preprints/socarxiv/,socarxiv,preprint-providers,https://api.osf.io/v2/preprints/xgwdb/files/,https://api.osf.io/v2/files/578a7071b83f6901f2c062ab/,578a7071b83f6901f2c062ab,files,https://api.osf.io/v2/preprints/xgwdb/review_actions/,https://api.osf.io/v2/preprints/xgwdb/requests/,https://api.osf.io/v2/preprints/xgwdb/,https://osf.io/preprints/socarxiv/xgwdb/,https://doi.org/10.31235/osf.io/xgwdb
z57qd,preprints,2016-07-16T14:55:35.295000,2018-07-02T10:55:05.193329,2016-07-16T14:55:35.295000,NA,NA,Why Pirates (Still) Won't Behave: Regulating P2P in the Decade after Napster,"Since the birth of Napster in 1999, corporate copyright owners have attempted to ""govern"" file sharing aggressively at three discrete points of intervention: the content level, the network level, and the user level. Their efforts have met with resistance at each of these points, however, because they have failed to appreciate the insight articulated by Michel Foucault that governing people, in the broad sense, is not only a matter of making them behave; it's also a matter of making them want to behave. This article surveys a decade's worth of anti-piracy regulation and examines the ways in which the entertainment industry's recourse to coercion at every point of intervention has functioned to undermine rather than advance the anti-piracy cause.

Annemarie Bridy
Professor<http://www.uidaho.edu/law/faculty/annemariebridy>|University of Idaho College of Law|PO Box 83720-0051|Boise, ID 83720|Ph. 208.364.4583
Affiliate Scholar<https://cyberlaw.stanford.edu/about/people/annemarie-bridy>|Stanford Center for Internet and Society
Affiliate Fellow<http://isp.yale.edu/people-directory?type=19>|Yale Information Society Project
SSRN<http://papers.ssrn.com/sol3/cf_dev/AbsByAuth.cfm?per_id=630766>|HeinOnline<http://heinonline.org/HOL/AuthorProfile?collection=journals&search_name=Bridy,%20Annemarie&base=js>|LinkedIn<https://www.linkedin.com/in/annemariebridy>|Twitter<https://twitter.com/AnnemarieBridy>",TRUE,FALSE,NA,Preprint|socarxiv,2018-07-02T10:55:05.183343,NA,,TRUE,accepted,2016-07-16T14:55:35.295000,NA,NA,NA,NA,NA,NA,NA,NA,NA,5a8c80f7c698300375c76d84|Social and Behavioral Sciences,https://api.osf.io/v2/preprints/z57qd/contributors/,https://api.osf.io/v2/preprints/z57qd/bibliographic_contributors/,https://api.osf.io/v2/preprints/z57qd/citation/,z57qd,preprints,https://api.osf.io/v2/preprints/z57qd/identifiers/,https://api.osf.io/v2/nodes/9s43e/,https://api.osf.io/v2/preprints/z57qd/relationships/node/,9s43e,nodes,https://api.osf.io/v2/providers/preprints/socarxiv/,socarxiv,preprint-providers,https://api.osf.io/v2/preprints/z57qd/files/,https://api.osf.io/v2/files/578a4ae9594d9001f0859fcb/,578a4ae9594d9001f0859fcb,files,https://api.osf.io/v2/preprints/z57qd/review_actions/,https://api.osf.io/v2/preprints/z57qd/requests/,https://api.osf.io/v2/preprints/z57qd/,https://osf.io/preprints/socarxiv/z57qd/,https://doi.org/10.31235/osf.io/z57qd
9fyvp,preprints,2016-07-16T14:54:35.845000,2018-07-02T10:47:33.152865,2016-07-16T14:54:35.845000,NA,NA,Graduated Response American Style: 'Six Strikes' Measured Against Five Norms,"In 2008, in recognition of the DMCA's inadequacy in the face of P2P file sharing, and with the high-profile case of Arista Records v. Lime Group pending in federal district court in New York, then New York State Attorney General Andrew Cuomo began pressuring broadband providers to agree voluntarily to play a greater role in fighting online infringement. Subsequently, the Obama administration, represented nationally by the Office of the Intellectual Property Enforcement Coordinator (IPEC) and internationally by the Office of the United States Trade Representative (USTR), expressly endorsed the concept of privately negotiated anti-piracy collaborations between corporate rights owners and broadband providers.

In July of 2011, broadband providers finally bowed to the mounting political pressure and to changing economic realities in the business of corporate content ownership and delivery. Five of the largest telecommunications companies in the United States entered into a memorandum of understanding (MOU) with trade groups representing major corporate copyright owners. The MOU creates what the parties characterize as a common framework of 'best practices' to effectively alert subscribers, protect copyrighted content and promote access to legal online content.

This Article is an assessment of the MOU's Copyright Alert System (CAS) with respect to five norms that are central to consumer protection in the enterprise of online copyright enforcement: freedom of expression, privacy, fairness, proportionality, and transparency. Part I provides an introduction to graduated response, which is the genus of online copyright enforcement to which CAS belongs. Part II takes a comparative look at two pre-existing graduated response systems: the government mandated and administered program in France, Hadopi, and a privately administered program in Ireland run by the broadband provider Eircom. Part III provides a detailed overview of CAS, including the structure by which it is governed, the division of labor it prescribes between copyright owners and broadband providers, the progression of warnings and sanctions it implements, and the appeals process it makes available for affected broadband subscribers. Part IV evaluates the strengths and weaknesses of CAS with respect to each of the five norms listed above, using the systems in France and Ireland as reference points.

Annemarie Bridy
Professor<http://www.uidaho.edu/law/faculty/annemariebridy>|University of Idaho College of Law|PO Box 83720-0051|Boise, ID 83720|Ph. 208.364.4583
Affiliate Scholar<https://cyberlaw.stanford.edu/about/people/annemarie-bridy>|Stanford Center for Internet and Society
Affiliate Fellow<http://isp.yale.edu/people-directory?type=19>|Yale Information Society Project
SSRN<http://papers.ssrn.com/sol3/cf_dev/AbsByAuth.cfm?per_id=630766>|HeinOnline<http://heinonline.org/HOL/AuthorProfile?collection=journals&search_name=Bridy,%20Annemarie&base=js>|LinkedIn<https://www.linkedin.com/in/annemariebridy>|Twitter<https://twitter.com/AnnemarieBridy>",TRUE,FALSE,NA,Preprint|socarxiv,2018-07-02T10:47:33.145517,NA,,TRUE,accepted,2016-07-16T14:54:35.845000,NA,NA,NA,NA,NA,NA,NA,NA,NA,5a8c80f7c698300375c76d84|Social and Behavioral Sciences,https://api.osf.io/v2/preprints/9fyvp/contributors/,https://api.osf.io/v2/preprints/9fyvp/bibliographic_contributors/,https://api.osf.io/v2/preprints/9fyvp/citation/,9fyvp,preprints,https://api.osf.io/v2/preprints/9fyvp/identifiers/,https://api.osf.io/v2/nodes/u2fps/,https://api.osf.io/v2/preprints/9fyvp/relationships/node/,u2fps,nodes,https://api.osf.io/v2/providers/preprints/socarxiv/,socarxiv,preprint-providers,https://api.osf.io/v2/preprints/9fyvp/files/,https://api.osf.io/v2/files/578a4aae594d9001f0859fc7/,578a4aae594d9001f0859fc7,files,https://api.osf.io/v2/preprints/9fyvp/review_actions/,https://api.osf.io/v2/preprints/9fyvp/requests/,https://api.osf.io/v2/preprints/9fyvp/,https://osf.io/preprints/socarxiv/9fyvp/,https://doi.org/10.31235/osf.io/9fyvp
